expression;language
I want to listen to the soundtrack Adobe Digital Editions;en
show song schedule of Shoot for the Moon;en
Find a novel called Under Blackpool Lights.;en
help me find the work Graphics Animation System for Professionals;en
I'm looking for a job in Inversion ;en
look up Adobe Brackets soundtrack;en
Show me It Might as Well Rain Until September;en
Please help me find the Bloom: Remix Album song.;en
Who published the novel JamesEdition?;en
What is the TV show Comfort? ;en
search for the painting The Elder Scrolls I: Arena ;en
Need to  a creative work with the title Sometimes the Blues Is Just a Passing Bird ;en
Show The Man from London video game;en
I'm looking for a movie called Salvage Mice. ;en
find The Angry Birds Movie;en
Play The Lousy Dance trailer ;en
Please find me the work, Earth Intruders.;en
I want to watch the TV series Rat Pack;en
show creativity of the game Everything at Once;en
find Sappho;en
find the picture Ultima VI: The False Prophet;en
I'd like to hear the song Daimidaler: Prince vs Penguin Empire;en
Can you help me search the album titled PlayMaker Football?;en
Search  the song called Journal of the American Statistical Association ;en
find the So This Is Goodbye saga;en
Find The Garden of Eden ;en
I want to World of Warcraft: Tides of Darkness ;en
I'm looking for Circus World.;en
Find me the Young Doctors in Love TV show;en
Find a soundtrack called The Christmas Shoes.;en
Where can I listen to the soundtrack of Gibraltar: Britain  the Sun ;en
Find me Shack Out on 101;en
I need a book called Student Demonstration Time;en
Find UNDER NIGHT IN-BIRTH ;en
Find the trailer for Real Men Cry ;en
What is the price for the album Praise the Lord  Pass the Ammunition? ;en
show me the movie Haunted Spooks;en
Do an image search  the picture Perfect Storm: Disasters That Changed The World ;en
Read The Open Ecology Journal ;en
Go to the saga The Quantum Thief ;en
find the painting Sleeping in Your Hand ;en
show creativity of Mind Chaos;en
play the album Journeyman ;en
where can I  the game A Little Bit of Mambo ;en
Go to the movie Welcome to Tokyo ;en
Find a show called Some Kind of Dangerous. ;en
I'm looking for the movie called The Beast that Shouted Love at the Heart of the World.;en
search for trailer Jazz Impressions of the U.S.A.;en
show creativity of The House of the Dead;en
Find me the Spartan: Total Warrior painting;en
play the song Red Lanta;en
show creative song UFO Senshi Dai Apolon ;en
Show The Matrix Revolutions;en
Look for the Learning & Behavior picture;en
Pull up the movie Toy and Help Yourself;en
find TV series titled Sonata Mix Dwarf Cosmos ;en
Find the Three Little Pigs television show;en
Find Your Personal Touch. ;en
find Seduced by Madness, a trailer ;en
I'd like to  Scriptures of the Golden Eternity TV series ;en
Find a movie called Dorothy and the Witches of Oz.;en
What is the cheapest online price for the Instincts saga?;en
Search for the television show called Educational Psychologist;en
Please locate Sad Love Story novel for me. ;en
Show me the saga St. Elsewhere;en
Please search Crossing Muddy Waters work;en
find the album Smoke and Mirrors;en
Please search the Irv Gotti Presents: The Murderers picture.;en
I want to watch the television show Champion;en
show creativity in Call Me Joe ;en
play The Widow of Saint-Pierre saga ;en
Show me the Caribbean Blue television show ;en
find the novel Meg and Seron;en
play Baby Workout ;en
Find a video game called The Last American Virgin. ;en
Please find me The Purple Vigilantes book.;en
Where can I view the trailer Extreme – The Collection;en
Look for the trailer to Hickory Daily Record.;en
How to buy picture  Agent Hamilton: But Not If It Concerns Your Daughter ;en
Want a work called Walk the River ;en
I'd like to see the painting Empire of Two Worlds;en
find a TV series called Armageddon Summer;en
Find me a saga by Reproductions ;en
find History of North Dakota, a TV series ;en
Get me a Johnny Cool photograph ;en
I'm trying to find The Final Solution video game. ;en
show creative painting People & Love;en
What painting is on The Cure discography? ;en
Search for The Toucher and Rich Show;en
Search  the Abel Sánchez: The History of a Passion novel ;en
Where can I watch the TV series The Trifecta?;en
Find me The Memorial;en
Where can I see the show Kind of Glue? ;en
Find Le Profil Amina TV series ;en
Find a song called Bronco Billy. ;en
Find television show on Windows Live TV;en
Can you pull up The Sanford Herald ;en
find Chant Down Babylon: The Island Anthology ;en
Find a television show called Basement Screams. ;en
Find the Sarah the Teen Princess game ;en
show me the When Your Heart Stops Beating photograph ;en
Play Keep Your Right Up song ;en
I need work of Father Dearest ;en
Show The Invisible Hook trailer;en
Where can I buy the Something Borrowed saga?;en
When is City of Angels playing? ;en
Find the TV series I Build the Tower ;en
show me the painting Live – Very Live in Concert;en
find the movie Ircle ;en
I'm looking for a novel called  Then There Was Light. ;en
I want to see the television show The Muppet Christmas Carol;en
find Tortured Man ;en
find the photograph Underneath the Tree ;en
find Drumline: A New Beat, a picture;en
Find trailer of Jazz Impressions of the U.S.A.;en
show schedule for Cin cin ;en
Where to get painting of The Man  the White Suit ;en
Show me Skyfall: Original Motion Picture Soundtrack ;en
Find a photograph called Shout It Out. ;en
I  looking for a creative work called Something Warm ;en
Find me the Martin Morning saga;en
Where can I find the song Red Back Fever;en
Find a picture called Every Little Thing She Does Is Magic.;en
Get the video game of The Chipmunk Song ;en
find Me. I Am Mariah… The Elusive Chanteuse;en
Where can I see the trailer  Experienced II: Embrace Tour 2013 Budokan? ;en
find Young Miss Holmes;en
find Waiting for Touchdown, a book;en
find As Live as It Gets;en
I want to watch the TV show Down  Abby ;en
find Bal Ganesh 2, a video game;en
Show The Blue Meaning television show;en
Search for Innocence from Hell ;en
Search for Polish Assault ;en
I want to read the book The Minotaur ;en
find The Little Death, a soundtrack ;en
Show me the A-Myin-thit TV series;en
Find the Mystery Woman saga;en
search for the picture Boomtown ;en
find the movie Take Another Picture ;en
Please fine me, Ties That Bind. ;en
find Oman Medical Journal ;en
I'm looking for Right on Track.;en
Find a novel called Twins of Evil. ;en
Please get me the Before Crisis: Final Fantasy VII television show.;en
Find an album called The Aboriginal Port Folio. ;en
Show The Blackberry Bush show ;en
Where can I  the trailer for Sensations of 1945 ;en
Show me the A-Myin-thit TV series ;en
Can you find the photograph titled So Long Self;en
Find Just South of Heaven;en
I'd like to see Level Headed ;en
find the novel Make Peace Not War ;en
Look up the Act of Valor TV show ;en
find the trailer for Hotel on the Corner of Bitter  Sweet ;en
I'd like to see the book The Royal Thousand ;en
I want the song Phrazes for the Young ;en
Where can I purchase the Twenty Chickens for a Saddle saga?;en
Find me the show Krypto the Superdog ;en
find the show CarniK Con ;en
I'd like to see the saga Tamagotchi 64: Minna de Tamagotchi World;en
find a game called Bump the Show;en
find A Tale of Two Cities, a painting;en
I'd like to watch episodes from the TV series, The Secret of Queen Anne or Musketeers Thirty Years After.;en
where can I watch the TV  Terrorists: The Kids They Sentenced ;en
Please get  The Very Best of Chicago: Only the Beginning. ;en
Can you play The Wanderer and His Shadow ;en
Locate me the novel entitled Isthmus.;en
Find The Creeper.;en
Find The Gamble. ;en
Find the trailer for Seven Year Itch.;en
Play the Knockabout soundtrack;en
Find the trailer for Seven Year Itch. ;en
Look up The Reverse of the Medal;en
i want to  the video game called China Seas ;en
I'd like to see Sex Tape - Finiti  rete ;en
I'm looking for the show Sex and Candy;en
find a television show called Happy Trails;en
Has the TV series Puppet Master: Axis  Evil been cancelled? ;en
I'm looking for the saga The Hardest Part ;en
Where can I view the photograph The Phantom Horse;en
 can I purchase the TV series The Mating Season ;en
find the game Saturday Review;en
search for the painting Smart Money;en
Show The Ancient Art of War picture ;en
 the novel Playlist: The Very Best of Brad Paisley ;en
Where can I purchase Paradise Tonight online?;en
Find the trailer for Real Men Cry;en
Find the From the Hut TV series ;en
look up Adobe Brackets soundtrack ;en
Look for the Itv.com song;en
find The Moldy Peaches;en
Play the TV series Effortless Regurgitation of Bright Red Blood;en
 can I purchase the video game The Blue Generation ;en
I want to see the MAXIMUM TRANCE picture;en
Find the show The Sword of the Lictor;en
find a TV show called Perfect Chemistry ;en
Where can I find Conduct Unbecoming? ;en
Find an album called List of Re: Hamatora episodes.;en
find Amanda Palmer Goes Down Under;en
Find a photograph called Call on Me. ;en
I want to see the trailer Amor Puro ;en
show TV show schedule Archive.is;en
Please search  the Puppet on a String video game. ;en
play A Box of Birds trailer;en
I want to play the game Guitar Heaven ... The Greatest Guitar Classics of All Time;en
Rate trailer Geek Chic;en
I'd like to play the album Clarke;en
Play The Lure of the Mask song;en
find Time Squared ;en
find a video game called IBM Program temporary fix ;en
I want to see the novel, The Green ;en
show me the picture Totally True Love;en
search for a photograph of Road Hogs;en
Find Spirit of the Bush. ;en
find the album Until the Whole World Hears ;en
Pull up the book Live  Unreleased: The Radio Show ;en
Can you help me find the Author! Author! trailer? ;en
Show The Lateness of the Hour ;en
find Playground, a book;en
Please find me the work, Instrumental Directions. ;en
I want to see the trailer for The Entity;en
Play The XYY Man soundtrack;en
Find me the Show Girl soundtrack ;en
find Long Walk to Forever, a novel ;en
Find All Jets Are Gonna Fall Today saga ;en
Look for the Girl in Mirror movie ;en
show book of Pokémon: The Mastermind of Mirage Pokémon ;en
Can you find a photograph of Ace Ventura: The CD-Rom Game;en
What is the picture called Lest We Forget: The Best of?;en
Find me the picture Live in Paris 1975 ;en
Please search the Songs for the Deaf video game.;en
find The Gamblers;en
I am looking for the work: Nikki;en
find the photograph The Air Is on Fire: Soundscape ;en
Show The Legend of Jesse James novel;en
Find me the novel The Argumentative Indian ;en
find The Most Important People, a television show ;en
I want to  the video game International Pinguicula Study Group Newsletter ;en
Please pull up Nothing Feels Good ;en
search for the trailer The Thieving Magpie;en
I'd like to see the saga Song of the Saurials;en
 a TV series called Church of the Truly Warped. ;en
Can you find me the game, Super Scription of Data?;en
Show me a photograph called The Daily Slovak News ;en
show creative picture of The Secret Doctrine ;en
When is the next episode of the TV series Crossing Lines showing?;en
Show me the video game The Stillest Hour ;en
Can you get me the Maldeamores saga? ;en
where can Ifind You Know Me, a saga;en
Can you find the soundtrack for Fast Food Nation ;en
find Seduced by Madness, a trailer;en
I want to listen to the song First Time for Everything;en
Show me Tears On My Pillow.;en
Where can I  the TV show A Step Away ;en
Find In the Line of Duty: Street War.;en
Show me the I Can Hear the Sea movie ;en
Find a trailer called No Reservations. ;en
show creativity of Mind Chaos ;en
find a movie called No More Sadface;en
I want to see Breathless ;en
search for The Adventure of the Blue Carbuncle;en
Find me the TV show The First Bite. ;en
Find the From the Hut TV series;en
Search for The Adventures of Cookie & Cream ;en
find the television show Riding with the King ;en
find a show called Big Broadcast of 1938;en
find Remedial Chaos Theory, a soundtrack ;en
Go to the movie The Best  Pirates  the Mississippi ;en
Find the game BlogBridge ;en
Search for Polish Assault;en
Where can I get a photograph  Death Knows Your Name? ;en
Show me a copy of the picture Double Deal.;en
I want to watch the movie Godslayer;en
Please get me Exploring the Reef TV show;en
Where to get painting of Channel 4 News ;en
Please pull up the photograph entitled Another Period ;en
Where to get painting of The Man in the White Suit;en
Where can I get Harry Potter  the Philosopher’s Stone ;en
Look up the show Cissy Houston ;en
I'm looking for the saga Lifelong Ambitions ;en
Play me a trailer for The North-West Passage;en
 a TV series called The Golden Hits of Sandie Shaw. ;en
Find a trailer called Eurythmics discography. ;en
find a game called Bump the Show ;en
I'm looking for a job in Inversion;en
Nightwork soundtrack download ;en
Can you find the novel Journal of Social Work ;en
Find a movie called Living in America. ;en
I'd like to find Scriptures of the Golden Eternity TV series;en
Show The Blackberry Bush show;en
find a television show called I Got a Bag of  Own ;en
Please find the movie, A Jingle with Jillian.;en
I want to read the novel Pokémon the Movie: Black—Victini  Reshiram  White—Victini  Zekrom. ;en
What song is Detective Conan: Dimensional Sniper ;en
Show the Phish: Live in Vegas TV series ;en
I want watch The Sun And The Moon;en
Where can I locate the game Legion  Mary: The Jerry Garcia Collection ;en
I'm looking for a picture of Fresh Air ;en
Look up Applied Linguistics ;en
find a TV show called The Fighting Men ;en
Show me a copy of the picture Double Deal. ;en
Find a work with the name of Come Sing;en
Show me the Out with My Baby photograph;en
Need find the book called Hollywood Connection ;en
Look for Conducting from the Grave;en
show Under the Sea creative video game ;en
find a soundtrack called Fast as You ;en
find a book called Follow Me ;en
Find The Garden of Eden;en
show creativity Cum On Feel the Noize the video game;en
find The Saint in New York, a show ;en
find She Monkeys;en
find the picture Vertically Challenged ;en
Find All Jets Are Gonna Fall Today saga;en
Need a creative work with the title Unholy Confessions ;en
find Cluster Computing, a game ;en
Where to watch television show Linger Awhile: Live at Newport  More ;en
Please search for All the Lovers trailer.;en
show creative game Fear Thy Neighbor ;en
Where can I purchase the book Scales of Justice;en
Where can I watch the picture I’ll Take Care  You? ;en
Wish to hear the album Since I Saw  Last ;en
 up The Cool Cafe: Cool Tape Vol. 1 video game ;en
What is Marty Stuart discography;en
Play trailer of Do Whatever Turns You On ;en
show Texas Review of Entertainment & Sports Law creative song;en
show book name Straight No Chase ;en
Please look up the Beauty on the Fire show. ;en
show creativity of the picture The Little Death;en
find a TV series called Armageddon Summer ;en
Please look up for Disney Universe. ;en
I want to play the game The Carny;en
Please search the work, The Mercenary.;en
Play the TV series Heart of Gold;en
find The Gamblers ;en
Show the Innocent When You Dream saga;en
find a video game called IBM Program temporary fix;en
I'd like to see the game called God Is in the T.V.;en
Please find me Asking Alexandria discography;en
Please search for the Two Faces of My Girlfriend saga.;en
find a show called The Crowd Roars ;en
Find the Now We Are Six saga;en
Find  Only Wish in some form of creative work ;en
I need to  Best of the West Rides Again ;en
Looking for the trailer for Shaolin Temple;en
Look up the Act of Valor TV show;en
show Nightcall ;en
Find me a soundtrack by Ghost Town Prophecy;en
Play me the soundtrack Ready;en
find War & Peace Vol. 1;en
Is the television show Kamen Rider OOO Wonderful: The Shogun  the 21 Core Medals streaming anywhere? ;en
Where can I buy the movie Totality;en
Where can I find Richard the Lionheart: Rebellion? ;en
Look for All Broken Up and Dancing which is a video game;en
Find a painting called Pulsions. ;en
find The Living Room Tapes, a TV series;en
Find The Sentimental Bloke novel;en
Please search the work, Eve-Olution.;en
Please get me the work Shirley aviatrice. ;en
show me the painting Live – Very Live  Concert ;en
find soundtrack titled The House of the Yellow Carpet;en
where can I see the trailer  Love on the Beat ;en
Play me East Side Story;en
Find the Collision in Black painting;en
search for The Adventure of the Blue Carbuncle ;en
Download The Red Eagle TV show ;en
Show The Late Great Townes Van Zandt ;en
I want to find The Adventures of Lomax. ;en
Find me the Fruit of Life television show. ;en
Where can I get the novel Flesh-Colored Horror ;en
find Long Walk to Forever, a novel;en
I'd like to hear the  Daimidaler: Prince vs Penguin Empire ;en
show creativity in Ah;en
I want to watch the show Railroad Model Craftsman ;en
Find me the song 2 Fast 2 Furious;en
show me the picture Unfinished Monkey Business;en
show creativity of Your Body Above Me ;en
Show The Second Civil War saga ;en
I'd like to watch Miss Congeniality;en
find the game A Russian Beauty and Other Stories ;en
Please search the Karobar Economic Daily picture.;en
show the movie Move Any Mountain;en
Can you find me the work, Frisbee: The Life and Death of a Hippie Preacher?;en
I want to see the TV series A State  Mind ;en
I want to play the game The Carny ;en
find a photograph called The Lighthouse by the Sea;en
show painting of Waiting for Snow in Havana;en
Show me the trailer  American Education: The National Experience. ;en
Can you please find The Notebook of Trigorin game?;en
Where can I view the trailer Jeeves and Wooster in Perfect Nonsense;en
I want to watch Wide-Eyed and Ignorant ;en
Find the Check Please photograph. ;en
Please find the album The Party Scene ;en
Find Live at Bonnaroo. ;en
Where can I  the work It Was Raining That Night? ;en
Where can I  the novel A Woman in the Web ;en
Can you get me the Rakuen Tsuihou: Expelled from Paradise television show?;en
Find a novel called Kiss Me Licia. ;en
Find a trailer called Peggy Sue. ;en
I want to play a game called Scotland Tonight. ;en
I'd like to find the Days of Glory saga;en
How to get saga Stronda Style;en
find the book Metallica Through the Never;en
Search for Comedy Underground with Dave Attell;en
Find Zorro the game ;en
Please pull up the photograph entitled Another Period;en
find The Flying Scotsman;en
I need the book titled Lullaby of Broadway;en
Show The Second Civil War saga;en
find the video game Thale ;en
Where to buy Unarchigal ;en
Show me Firepower;en
Find the Apple Address Book television show ;en
I want to listen to the album Magical Girl Lyrical Nanoha StrikerS;en
Find The Madwoman in the Attic.;en
I want to watch the TV series Krieg  Chinatown ;en
I want television show Come Again Smith;en
Show the Mickey Mouse photograph ;en
I want to see Far Cry Vengeance ;en
I'd like to see the painting Empire  Two Worlds ;en
Find book The Music Lovers;en
find To Each His Own Cinema, an album ;en
Can I see the TV  The Closer I Get? ;en
Find The Coffin.;en
I want the show The Sense Apparatus;en
find Live in Tokyo for me;en
Please search A New Machine TV series. ;en
Find an album called Preminchi Choodu. ;en
Look up Three Fantastic Dances;en
Where can I purchase the saga The Second  of Samuel Tyne ;en
Play the Seamus Heaney Collected Poems song;en
Find the News At Seven-Thirty photograph ;en
Look for the Journal of Toxicology  Environmental Health soundtrack ;en
Can you look  the creative work called No Gravity ;en
Where can I see the movie Across the Line: The Exodus  Charlie Wright? ;en
Show Saison 5 de Game of Thrones;en
Find a game called Dynamite Warrior.;en
I need to find the So Nice soundtrack ;en
Find the Sarah the Teen Princess game;en
Search for the song called Journal of the American Statistical Association;en
I am looking for The Complete Fillmore East Concerts;en
Where can I find The Brave Little Toaster To The Rescue book?;en
show me Chasing a Feeling painting;en
show painting of Waiting for Snow in Havana ;en
Show the Three Tales album;en
Show me the saga My Darling ;en
I want to  the video game The Coyote Kings of the Space-Age Bachelor Pad ;en
find the trailer for Hit the Ice ;en
Show me Half a Life;en
I'm looking for the video game Masterful Mystery Tour;en
show 50 Words for Snow creative picture ;en
Play 30 Greatest Hits;en
show song schedule Come into the World;en
find the Radical History Review saga;en
Find a game called Dynamite Warrior. ;en
Play me the show House of Stairs;en
Need to find the TV series called Administrative Behavior ;en
show creativity In the Red saga;en
What is Party All Night ;en
Please find the Packed to the Rafters work. ;en
find the photograph Among the Living ;en
Find the Mystery Woman saga ;en
search for the show Champagne Showers ;en
Find a picture called Neighbourhood.;en
find the game Gormenghast ;en
When is Spyforce playing? ;en
Find A New Machine;en
I want to watch Escape the Fate discography ;en
I need a painting called Brubeck Plays Brubeck;en
Show me the painting called Fool for Love.;en
find A Pet of the Cairo Zoo ;en
Where can I buy The Lying Game ;en
I'd like to listen to the soundtrack In the Air;en
find The Valentyne Suite;en
Show me the book Pokémon: The Johto Journeys ;en
When was the soundtrack for Those Were the Days – The Best of Leningrad Cowboys published?;en
Find me the painting Fallen Sanctuary ;en
Find a soundtrack called Tied to a Star. ;en
find a movie called Single Collection: Hotchpotch;en
find a photograph called Accion Newspaper;en
Can you help me find ScholarMate?;en
Looking for A Black Ribbon for Deborah. ;en
Find a saga called Story of My Life.;en
I'd like to see The New Jackals ;en
Where can I watch the picture I’ll Take Care of You?;en
Show  the photograph called Hola Mary Lou: Prom Night II. ;en
show creative video game In My Own Backyard;en
show me the movie called People and Masks Part 2;en
Looking for Kepler scientific workflow system;en
Find the Collision in Black painting ;en
Find an album called Thursday Night Baseball.;en
Show me the album Clarke ;en
Look for a photograph of Tailwind;en
show The Taste;en
Where can I find the painting for A Christmas Story - Una storia di Natale?;en
Where can I purchase the book Scales of Justice ;en
find the television show Birth of the Cool ;en
I want to listen to the soundtrack The Om  ;en
find the novel Playlist: The Very Best of Brad Paisley;en
Find Live at Bearsville Theater ;en
want to see the trailer for The Prefect ;en
Can you help me find Tears from a Willow?;en
Find a saga called Night Life.;en
Can you help me find Preaching to the Perverted? ;en
Can you find me a trailer for Phineas Redux?;en
Find a game called An Aerial Joy Ride.;en
 a video game called The Mysterious Castle in the Carpathians. ;en
read the Black-Body Theory and the Quantum Discontinuity novel;en
Find a TV series called When Harry Tries to Marry.;en
Find the novel What We Did on Our Holiday ;en
She me the game called Knowledge and Decisions;en
Show me the book Pokémon: The Johto Journeys;en
find the game Endangered Species ;en
 Texas Review of Entertainment & Sports Law creative song ;en
Find the TV series From the Top ;en
find 300: March to Glory, a song ;en
Where can I find Conduct Unbecoming?;en
find the picture Chorus Line;en
 the song titled The Mole Show Live at the Roxy ;en
find a game called So Long Self;en
Find a TV show called Revenge of the Nerds. ;en
Show The Matrix Revolutions ;en
Show Olympia 81 saga ;en
read the Background to Danger book;en
 the movie You Must First Learn to Draw the Real ;en
I am looking for the work: Nikki ;en
How do I get the soundtrack  Hearts of Fencing? ;en
find the painting Strong Enough ;en
find Try Me Out for me;en
Show me My Princess ;en
show video game and The Quality of Life ;en
Find the American Journal of Sports Medicine picture;en
find the TV series Treeful of Starling;en
find At This Point in Time ;en
I am looking for the creative work A Wonderful Life;en
I'd like to watch the TV series Sailor Moon SuperS: The Movie;en
Please look for Orion You Came and You Took All My Marbles;en
play TV show Way of the Samurai 2 ;en
find American Psychologist, a game;en
I want to listen to the song The Loving Spirit;en
What is the cheapest price for the saga called 2006 Wikipedia CD Selection?;en
Show the My World 2.0 photograph ;en
Where do I play the video game The Wild Geese?;en
Find a TV series called The Golden Hits of Sandie Shaw.;en
Find me the soundtrack called Enter the Chicken;en
Find the Pop Has Freed Us saga ;en
Find a picture called Ready.;en
Find me a movie with the name Oshin;en
search for Pat and Margaret;en
Find a game called The Life  Loves of Tschaikovsky. ;en
Can you pull up Queen of the Organ;en
find the TV series The Farewell Tour ;en
show creative song UFO Senshi Dai Apolon;en
show Under the Sea creative video game;en
Info on show Natural Language and Linguistic Theory ;en
show creative photograph Island in the Sea;en
Can you please look up the game, The Islanders? ;en
I'm trying to find the show Chant II ;en
Show the Phish: Live in Vegas TV series;en
I want to watch The Original Recordings ;en
I am looking for The Complete Fillmore East Concerts ;en
I want to see Plague Soundscapes ;en
find me a game called Merle Haggard Presents His 30th Album;en
Play Everybody Wins trailer ;en
