expression;language
show creativity Cum  Feel the Noize the video game ;en
Please help me find the Bloom: Remix Album song. ;en
Can you find a picture of The Rambler;en
find The Many Loves of Dobie Gillis;en
Play me the TV show SEAL Team ;en
play Myth II: Soulblighter;en
find an album called From the Terrace;en
find the painting Sleeping in Your Hand;en
Please search Thirayum Theeravum video game.;en
Show me the album Apache Axis2;en
Find a painting called Thunder in the Sky. ;en
Where can I watch the latest episode of the TV show Chu Chu  the Philly Flash? ;en
Where can I find Thor Meets Captain America?;en
Look up the Hard to Handle TV show ;en
look for the saga called Death in Paradise;en
I need a painting called Brubeck Plays Brubeck ;en
Find me an album called Rejoicing with the Light ;en
Find a show called In fondo al buio. ;en
Has the TV series Puppet Master: Axis of Evil been cancelled?;en
Look up The Gun soundtrack ;en
I'm looking for Paris Match;en
Where can I purchase the game Dancing in the Dark: 10 Years of Dancing Ferret;en
Play me the song Just to See You Smile. ;en
Show The Bridge of San Luis Rey picture;en
find The Most Important People, a television show;en
Find a TV series called Manufacturing Consent. ;en
Find a painting called Mr. Scarface Is Back. ;en
Find Your Personal Touch.;en
find Check In;en
Please fine me, Ties That Bind.;en
find a video game called The Yellow Claw ;en
Please search Thirayum Theeravum video game. ;en
Find The Passion of Michel Foucault novel;en
find Black Mirror III: Final Fear ;en
Find the McGill Law Journal movie ;en
I want to read Mad Money;en
find Attack Surface Analyzer, a painting ;en
Help me locate a game called The Master of Ballantrae.;en
play the TV show Wicked City ;en
Find book called Dreams and All That Stuff ;en
Where can I find the TV show MetaboLights ;en
find Trivial Pursuit: America Plays;en
Where can I view the photograph of Johnny Cool ;en
I'd like to see a  series called Countdown: The Savoy Sessions ;en
I want to see Everytime We Touch which  a painting ;en
I want to  The Very Best of Chicago: Only the Beginning ;en
Can you find the album SimpleScreenRecorder;en
find a painting called Screen Souvenirs ;en
Find a television show called Basement Screams.;en
Can you please find the Jack Johnson En Concert picture?;en
Play the Electrochemical and Solid State Letters song;en
Find Stained Glass Windows. ;en
Find Le Profil Amina TV series;en
Lets see the TV series 7even Year Itch. ;en
Nightwork soundtrack download;en
show the trailer of Deadly Skies;en
Find me the Karl Hess: Toward Liberty photograph ;en
Find the video game High Hopes & Heartbreak ;en
Where can I buy a used copy of the game called I Lie Around?;en
Find a painting called Beyond the Neighbourhood. ;en
Find me Nights in Harlem;en
Show me the work The Catholic Weekly;en
find the Radical History Review saga ;en
Show the Day the Earth Caught Fire movie ;en
Look up The Baltic Times picture;en
Help me find Where the Wild Things Are ;en
painting of Live from the El Rey Theatre ;en
find The Real Dirt on Farmer John, a saga;en
Can you pull up the television show called Electric Boogaloo;en
Find the photograph The Remix please;en
show creativity of Night of the Hunter;en
I am looking for Shoot Me Down;en
Find a novel called Nature Reviews Genetics.;en
Please search for the work, Wholehearted.;en
Show me the saga My Darling;en
I'd like to  the video game Time to Kill ;en
Can you please find me D.R.E.A.M.? ;en
Find The Mary Van Note Show ;en
Look up the Searchlights painting ;en
Where can I listen to the soundtrack of Gibraltar: Britain in the Sun;en
find a trailer for Pesterminator: The Western Exterminator ;en
show book of Pokémon: The Mastermind of Mirage Pokémon;en
Can I get the game List of Mew singles?;en
Where can I get the album So Fresh: The Hits  Spring 2011 ;en
show creative soundtrack Pitch Black Brigade;en
find The Hundred-Foot Journey;en
Where can I purchase a copy  the painting called Glimpses  World History? ;en
find Casting Crowns discography;en
Find The Path to Power.;en
Please search for the Two Faces of  Girlfriend saga. ;en
find a TV show called Randy Scouse Git ;en
Find the Hopeless Romantic photograph;en
Find a TV show called The Ambient Collection. ;en
Find Half a Sixpence photograph ;en
Please help me  I Want to Take You Higher the game ;en
When and where is DistroWatch playing ;en
Find by title Champagne Showers ;en
find a soundtrack for Lords of the Rising Sun ;en
find The Prince of Temple Street, a picture ;en
Can you find me the Stand Proud book? ;en
Where to buy video game of Think Fast;en
find The Real Story with Gretchen Carlson ;en
I want to listen to the  Adobe Digital Editions ;en
play The Nubians of Plutonia trailer ;en
Find a TV show called The SoulTaker. ;en
show the creativity of The Attic ;en
Find a TV series called Cocktail Kings.;en
Can you find the TV show So What ;en
Go to After Dusk They Come ;en
show creativity of Comeback Season;en
I want to see the television  called Cuts Both Ways ;en
Show The Family from One End Street album ;en
Find the Love And War soundtrack ;en
Can you find me the Stand Proud book?;en
Find the photograph A Little Less Sixteen Candles;en
Is there a game called The Neutral Zone? ;en
Find the Return to Grace saga;en
Find Family Feud novel;en
Info on show Natural Language and Linguistic Theory;en
Show me Dangers of the Canadian Mounted ;en
How can I view the  Corpus: A Home Movie About Selena? ;en
Show me Born in America? ;en
I'm looking  the hit album, The Politics of Dancing. ;en
show creativity of painting of Me Too;en
Help me find the work titled SingStar Take That;en
I want to play the video game ESPN Major League Soccer;en
I'm looking for the painting God Must Have Spent a Little More Time on You;en
Find a movie called No. 1 In Heaven. ;en
Find me The River of Love saga ;en
Find a TV show called Frontiers in Ecology  the Environment. ;en
Find Head Start ;en
Where can I purchase Paradise Tonight online? ;en
I  looking for the TV show called the Flight of the Lost Balloon ;en
Show  the work titled The Perfect Gentleman which is a song ;en
Find a television show called Servidor Apache. ;en
Play me the show Cheaper By the Dozen 2 ;en
find Starcross;en
find Karol: The Pope ;en
Need to  the soundtrack called Fire in the Valley ;en
show creativity of video game Labyrinth ;en
I'm looking for 1634: The Ram Rebellion. ;en
show creative song called Holidays on the River Yarra ;en
Find me The Wild Boys ;en
find Carry me in your dreams;en
Find a book called The Magic Christmas Tree.;en
I want to watch the television show Symphony for Solo Piano;en
I'd like to see Sex Tape - Finiti in rete;en
Find me the picture entitled I’ll Take Care of You.;en
Show the Feed the Kitty painting;en
Find Changes: A Love Story.;en
Play The Crowd: A Study of the Popular Mind soundtrack;en
Find Live at the Brixton Academy. ;en
Find Drowning with Land in Sight.;en
Help me find Where the Wild Things Are;en
Find a trailer called Hellboy: The Troll Witch and Others.;en
Please find the movie Dancing Girl ;en
I'd like to watch the trailer for Dungeons & Dragons: Chronicles of Mystara.;en
show creativity of Adobe AIR ;en
Find Later That Evening;en
Show The Singles Collection Volume 4;en
show song Black Heart White Soul;en
Find me the album The Demon ;en
Find a TV show called Revenge of the Nerds.;en
Please find the song House of Wedlock;en
Show me the novel All I Need to Know ;en
I'm looking for a photograph called Merry Christmas. ;en
 can I view the trailer Extreme – The Collection ;en
Please search Cardin in Australia saga ;en
Find the work I Looked Up ;en
 a picture called Every Little Thing She Does Is Magic. ;en
find the show The Naked Gun ;en
Find The Photographic Journal.;en
show creativity of Official History of Australia in the War of 1914–1918;en
Is Salò the TV show available to watch anywhere? ;en
find the picture Chorus Line ;en
I'd like to play the album Clarke ;en
I am looking for a creative work called Something Warm;en
Can you find the painting Shake! Otis at Monterey;en
play The Rest of My Life;en
Can you find me The Real McCoy novel?;en
Find A New Machine ;en
Find me the documentary A Winter of Cyclists ;en
Find the Stone Free game;en
find a movie called Emerald City;en
Shw the picture Twin Husbands ;en
is there a program about The Last Flight?;en
find Do You Wanna Touch Me, a song ;en
Show A Family Torn Apart TV show ;en
Search for the saga of Return of the Bastards. ;en
show creativity of Sacred Fire: Live in South America ;en
I'd like to watch episodes  the TV series, The Secret of Queen Anne or Musketeers Thirty Years After. ;en
I need the game The ARIA Music Show ;en
play the What I Need to Do soundtrack ;en
show me God Bless the Child photograph ;en
Where can I view the picture of Workin’ with the Miles Davis Quintet;en
Find a painting called Break Down.;en
play the TV show Wicked City;en
Find GoodReader. ;en
Show the Glass Cloud – Single TV series ;en
show creative book named Pencil Thin Mustache ;en
Find a soundtrack called The Woman Warrior. ;en
find Sweet Sensation ;en
I want to  the video game Masada Anniversary Edition Vol. 3: The Unknown Masada ;en
Can you pull up My Name Is Brain Brian;en
find a photograph called Between the Days ;en
Can you find the book Beatmania IIDX 10th Style ;en
show book name Straight No Chase;en
find the Putrid Death Sorcery soundtrack;en
show me Chasing a Feeling painting ;en
I'd like to hear the song In a Reverie;en
Look for the Editor & Publisher TV series;en
What is the cheapest price I can pay for the DVD called The Darkest Cloud?;en
Find a photograph of Time Loves a Hero ;en
Play the Food Uncut soundtrack ;en
Find The Earth Is a Sinful Song ;en
Search for Police Women of Cincinnati;en
Where can I purchase the TV series Liar Game - The Final Stage;en
Show Famous Classic Tales television show ;en
Show the Chemdex.com photograph ;en
 a song called This Champagne Mojito Is the Last Thing I Own. ;en
Please locate Sad Love Story novel for me.;en
Find the book Bad Day on the Block ;en
Show the Glass Cloud – Single TV series;en
Where can I buy a Barometer Clock;en
Find a song called Bronco Billy.;en
Find The Last Angry Moose ;en
Show me The Advocate ;en
I'm looking for the saga Why Men Leave Home;en
Find a video game called Family Dog. ;en
Where can I purchase Papers in Regional Science, the album?;en
show video game and The Quality of Life;en
Can you help me find Preaching to the Perverted?;en
Where can I find Sebastien Grainger & The Mountains;en
find the picture Music Is the Message;en
Can you find Fire Escape in the Sky: The Godlike Genius of Scott Walker;en
Please fine me the East trailer;en
Find a TV show called Union.;en
find the trailer Platinum In Da Ghetto;en
Where can I  the picture the Japanese Lovesong near me? ;en
show creative picture of Wonderful Town ;en
Go to The Devil in the Deal:50 Secrets to Successful Dealmaking;en
Need a creative work with the title Unholy Confessions;en
find a picture called Cahoots ;en
How can I watch the television show Tinker Bell and the Legend of the NeverBeast?;en
What is the  selling price of the novel The Sims 3: Island Paradise? ;en
Show me the photograph of King Charles ;en
play the Baldur’s Gate II: Throne of Bhaal saga ;en
Show me the Landing at Low Tide painting ;en
I'd like hear the song Sit Down  Talk to Me ;en
Play a trailer for Sencha Touch;en
I want to listen to the soundtrack Bed  Roses ;en
Find a picture called Neighbourhood. ;en
Find All About Aubrey.;en
Show me the photograph A Woman from the Street ;en
I want to read the book Crash Landing ;en
Please search for the work, All the Wrong Reasons. ;en
Find the App Store ;en
Hook me up with a song by Dancing Girl.;en
find a photograph called Wild Cats on the Beach;en
Show Force of Nature ;en
Get me a Johnny Cool photograph;en
play the song S.F. sound furniture ;en
Find Think: act ;en
I want to  the video game Miss Castaway And The Island Girls ;en
Can you find the book Beatmania IIDX 10th Style;en
find a book called Kiss Symphony - Alive IV ;en
Find the Youth Against Christ saga;en
Search for the television show called Educational Psychologist ;en
play saga The Yellow Rose of Texas ;en
Find Once Upon a Time in the West;en
I need to find the work Brotherly Love;en
Play Remains of the Day ;en
Please search for The Legend of Korra book. ;en
Where can I see the show Twentysomething ;en
I'm looking for Circus World. ;en
Look for the Thorns saga ;en
show Chocolate Rain creativity;en
Where can I find the novel Meast ;en
Pull up Sweeney Todd - Il diabolico barbiere di Fleet Street;en
find an album called Stumble.Stop.Repeat ;en
I want to play the game Show Me the Wonder;en
find the album Until the Whole World Hears;en
find a trailer for Pesterminator: The Western Exterminator;en
play the song Evocation I – The Arcane Dominion ;en
Find The Cartel Vol. 2 novel ;en
Search for the saga of Return of the Bastards.;en
play the Putrefactive Infestation trailer ;en
Search for The Long Dark;en
I want to find The Adventures of Lomax.;en
Look for the creative work called White Sugar;en
find the show Go with the Flow ;en
Find me the album The Demon;en
Can you  me the trailer of the Hippocratic Oath? ;en
Want to find a photograph called The Nine Maidens ;en
find Valley of the Dolls;en
Look for Every Little Crook and Nanny ;en
show 50 Words for Snow creative picture;en
find The Family Jams saga ;en
find Something Crucial, a book ;en
Show the Put Yourself in His Place game ;en
show creativity in photograph of Grace Submerged ;en
Find A World Apart. ;en
show That Little Band of Gold;en
Can you locate the work, Warlock 2: The Exiled? ;en
find a TV show called Ride the Wind;en
Where can I purchase a copy of the photograph  the front page of today's Jacksonville Daily Progress? ;en
find a book called The Mad Magician;en
I want to watch the TV series Rat Pack ;en
Give me a link to the saga called Copper – Justice is brutal;en
Play Pirates of the Caribbean Online ;en
Show me the painting called The Descendants.;en
Find the song called International Journal of Bilingualism;en
Play 30 Greatest Hits ;en
Look up The Stars Are Indifferent to Astronomy;en
I want to see the trailer for No One;en
Play show of Cissy Houston;en
Find My Tribute show;en
Search for the Halfway Home TV show;en
I'd like to watch the trailer for As Tears Go By;en
play the movie Post Inferno Soundtrack;en
Find a soundtrack called I Still Believe in You. ;en
Find me The Rise and Fall of the Great Lakes saga.;en
Where can I view the photograph Occasional Wife;en
Find a song called You Cross My Path.;en
I'm looking for you to get me Jack of Shadows.;en
play The Rest of My Life ;en
I'm looking for a picture titled Rock Painting ;en
Can you find me the work, Frisbee: The Life  Death of a Hippie Preacher? ;en
Show the TV show The Last Samurai.;en
find Sailing The Seas Of Cheese ;en
Show The Late Great Townes Van Zandt;en
find Welcome to the El-Palacio, a movie;en
find the photograph The Air Is on Fire: Soundscape;en
show  the TV series called Take  to Your Heaven ;en
Find Clash of the Codes.;en
Find Family Feud novel ;en
Search for the Complots ;en
I'd like to see Confessions of an Indian Teenager ;en
Where can I find the novel Meast;en
Find a photograph called The Dickinsonian. ;en
find the Carrousel saga ;en
How can I view the show Corpus: A Home Movie About Selena?;en
Find Games Wizards Play TV series;en
I'd like to see The River of Stars TV series;en
can you get  the television show called Start It Up? ;en
Please get me the Welcome to the Rileys game. ;en
Where can I find the Sounds to Consume album?;en
Look up the television show called Monster Mash;en
find Cluster Computing, a game;en
I want Sugarfoot;en
find TaskCracker for Outlook, a game ;en
I am looking for the TV series Strays ;en
show creativity of Accident Analysis & Prevention;en
Find a soundtrack called The Dragon. ;en
Please search the Ironbound picture. ;en
Find All About Aubrey. ;en
Can I see the the TV series The Late Music?;en
I want to watch the television show New Astronomy;en
Find The 180.;en
find the picture Ultima VI: The False Prophet ;en
find Valley of the Dolls ;en
I want to see the television  The Muppet Christmas Carol ;en
Show the Put Yourself in His Place game;en
book of Two for the Road ;en
show He Who Fears the Wolf creative photograph;en
Find a soundtrack called The Dragon.;en
I'm looking for the novel From a Scream to a Whisper;en
I'd like to see Hannah Montana  Miley Cyrus: Best of Both Worlds Concert ;en
show the show The Son of Tarzan;en
where can I see the television show Falling Away  Me ;en
Find me the JQuery Mobile TV show;en
Could I download Chavez: Inside the Coup?;en
Pull up the video game, Apothecary Rx;en
Find the album Follow That Camel ;en
What Can I watch watch the television show Catch;en
Show A Family Torn Apart TV show;en
Find a painting called Break Down. ;en
Find the Fields of Sacrifice movie ;en
Find me the photograph The Late Music;en
Show  the The Defenestration of Ermintrude Inch TV series ;en
Find a novel called Downward to the Earth. ;en
Please search A New Machine TV series.;en
Please look up The Lamentable Journey  Omaha Bigelow into the Impenetrable Loisaida Jungle television show. ;en
I'd like to see Jacksonville Daily Progress saga;en
Look up The Park album;en
Find a picture of A Breed Apart ;en
Please search The Big Game show.;en
find the song Occasional Wife;en
Find Pursuit of Radical Rhapsody ;en
Look up the This Is Halloween trailer ;en
find The Ultimate Gift, a television show;en
read the  Journal of the Bombay Natural History Society ;en
find the photograph Canaich ;en
Looking for novel Build Engine;en
Show me The Heart Specialist ;en
Find a video game called The Mysterious Castle in the Carpathians.;en
find a picture called How Much Wood Would a Woodchuck Chuck;en
I'm trying to find the show Chant II ;en
Find a game called An Aerial Joy Ride. ;en
Please find me the game called The Salvation.;en
show creative photograph of Icewind Dale: Heart of Winter ;en
play the Hell of a Life movie;en
Where can I get Intel Array Building Blocks;en
Find Live at the Brixton Academy.;en
find the television show Birth of the Cool;en
find Drumline: A New Beat, a picture ;en
Find a trailer called Colony 7. ;en
What song is Detective Conan: Dimensional Sniper;en
Search for To Heart 2;en
Where can I find the photograph of Mr Blobby;en
Pull up the book Live and Unreleased: The Radio Show;en
Can you find the movie Accidentally in Love;en
I want to see the book, The Mailroom: Hollywood History from the Bottom Up;en
 the picture titled Battle Spirits - Shōnen Toppa Bashin ;en
Play trailer of Do Whatever Turns You On;en
Find a book called The Echo Chamber. ;en
Find a TV show called The Extraordinary. ;en
Where can I see the trailer for Phineas Redux?;en
Please look up the Power and Love movie.;en
Wish to read the novel called The Wizard of Stone Mountain;en
Look up the game called The Long Morrow ;en
Find a painting called Chettathi. ;en
What is the Paranormal Activity: Ghost Dimension album? ;en
Look up the show Cissy Houston;en
Find a trailer called Just Say Noël. ;en
show me the movie called People  Masks Part 2 ;en
play the Graduate Faculty Philosophy Journal album;en
Find me the book The Van Dyke Show;en
Look up The Making of Milwaukee ;en
What type of movie  is Houston Press?;en
Where can I find a photograph of The Lieutenant of Inishmore?;en
Find a movie called Living in America.;en
show TV show schedule of Offroad Legends ;en
Show The Monkey soundtrack ;en
I'm looking for River Disturbance ;en
Search for the George  the Big Bang TV show ;en
Show me Half a Life ;en
Find a television show called Servidor Apache.;en
Find me Haunted Castle ;en
Find HeroQuest II: Legacy of Sorasil. ;en
Show me the game Music Bank ;en
play the Discografia de The Pretty Reckless saga;en
find a movie called Emerald City ;en
Find a painting called Chettathi.;en
play Another Time;en
I'd like to watch the TV series called Fires of Life;en
find Outback Bound, a trailer;en
show creative trailer of The Sword of the Lord ;en
Find an art called Cassidy.;en
find the TV show Tribute to the Troops ;en
Read The Open Ecology Journal;en
Please look up the Power and Love movie. ;en
find the novel A Civil War: Army vs. Navy;en
find the photograph Move Any Mountain ;en
Can you find me the movie, The Girl  the General? ;en
Where can I buy the soundtrack Bridge of Souls ;en
Can you look up the Galsoft Linux TV series? ;en
I want to see the book, The Mailroom: Hollywood History  the Bottom Up ;en
show Thousand Miles movie ;en
find the TV series Truly Fine Citizen;en
find Google News ;en
find the TV series The Farewell Tour;en
Please find the TV show, The Dreamstone;en
I want to watch the  X Window Display Manager ;en
Search for the Exiles of Time book ;en
find the video game The Tomb ;en
Find Later That Evening ;en
I'm looking to find the trailer for Brought  the Sea. ;en
Find me Nights in Harlem ;en
I'm looking for the novel  a Scream to a Whisper ;en
read the book Journal of the Bombay Natural History Society;en
where can I find the game A Little Bit of Mambo;en
 The Crowd: A Study of the Popular Mind soundtrack ;en
Can you find the Info Wars saga;en
show creative book named Pencil Thin Mustache;en
Where can I purchase Wuthering Heights;en
Play the Seamus Heaney Collected Poems song ;en
Find a game called The Guyra Ghost Mystery.;en
look up Holy Water ;en
find Oman Medical Journal;en
Find the movie CURL;en
Show me Interesting Times: The Secret of My Success;en
play the Baldur’s Gate II: Throne of Bhaal saga;en
find the book Time and Again;en
Find me the Spartan: Total Warrior painting ;en
Find FANatic. ;en
Where to buy painting Target Practice;en
Find a show called Ichibyōgoto ni Love for You.;en
Where is Winterheart’s Guild;en
Find me the novel The Argumentative Indian;en
Show me a novel by Onnaam Muhurtham;en
show creativity of Diamonds in the Rough;en
What is A Romance of the Halifax Disaster ;en
Please help me find the Short Program saga.;en
Find a painting called The Legend of Tashan Dorrsett.;en
Find a video game called New York 911. ;en
find the book The Crowd Roars ;en
Find the trailer for Bill Cosby Presents the Cosnarati: State of Emergency;en
Find a game called The Life and Loves of Tschaikovsky.;en
Find I Could Fall in Love. ;en
show song schedule Come into the World ;en
play The Sea Cabinet ;en
Can you search A Song for Mama  for me? ;en
Please search the Abby saga.;en
Show The Critic game;en
Show me a photograph called The Daily Slovak News;en
I want to see the TV series A State of Mind;en
Please help me find I Want to Take You Higher the game;en
Who was the artist who did the painting called Spyro 2: Season of Flame?;en
show creativity of What Is Dead May Never Die ;en
play If You Go ;en
I want to find a book called Cash-Cash ;en
show creative trailer of The Sword of the Lord;en
find Mash Confusion ;en
I'd looking for the saga PlayCanvas. ;en
Help me locate The Tristan Betrayal ;en
Find me the novel London Has Fallen ;en
find Sappho ;en
What is the book Sell Your Body? ;en
I need to episodes  the TV series, Fast Food Nation. ;en
find the show titled Hell on Earth 2006;en
Find an album called Thursday Night Baseball. ;en
Play me the trailer for Chasing After Shadows... Living with the Ghosts.;en
I want to watch the TV show Tales  Space: About a Blob ;en
find a picture called Cahoots;en
Find a show called Some Kind of Dangerous.;en
What is the book Sell Your Body?;en
help me  the book called Journal of Neuroscience Research ;en
 The Fire in Our Throats Will Beckon the Thaw TV show ;en
Can you get me the Rakuen Tsuihou: Expelled  Paradise television show? ;en
search for the painting The Elder Scrolls I: Arena;en
Where can I read the book The Omega Stone? ;en
Show me Happiness Was Free.;en
Find me the show Krypto the Superdog;en
Find me the book called Suffer;en
Look up The Collection Volume One novel;en
Please find the Infrared Riding Hood TV show. ;en
find Cover Her Face;en
Find book The Music Lovers ;en
Find the McGill Law Journal movie;en
show creativity of photograph of My Wonderful Day ;en
I'd like to hear the song Impractical Jokers UK;en
How can I watch the television show Straight Shooter? ;en
look for the trailer for Red Stallion  the Rockies ;en
I want to  the video game ESPN Major League Soccer ;en
I'm looking for Sherlock Holmes contre Arsène Lupin. ;en
Where can I  the show Game of Death II ;en
find Join the Dots: B-sides and Rarities;en
find Chant Down Babylon: The Island Anthology;en
Can yo find me the game A Silence That Screams?;en
Please  me the picture of The Getaway: Black Monday. ;en
Please look up the painting Beyond Iconic: Photographer Dennis Stock.;en
Find the book Bad Day on the Block;en
 the TV series The Parent Trap IV: Hawaiian Honeymoon ;en
Where did the painting Highs in the Mid-Sixties go?;en
Play me an album by Lunchbox;en
I'm looking  you to get me Jack of Shadows. ;en
play the TV series BET Awards 2013 ;en
Show me the movie Operetta for the Theatre Organ;en
Please look for Catch a Falling Star ;en
find the video game The Sims 3: Generations ;en
Find The Case of the Frightened Lady.;en
find Terminator 3: The Redemption, a picture;en
Find a show called In fondo al buio.;en
Please get me the Critical Condition show.;en
