expression;language
What is the current selling price of the novel The Sims 3: Island Paradise?;en
Show the Immortal Grand Prix;en
Can you find the song Bleach: Hell Chapter ;en
Find me the book My People Were Fair  Had Sky in Their Hair… But Now They’re Content to Wear  on Their Brows ;en
show creativity in Cross Currents;en
Find the album Future of the Past ;en
I want to find Night of the Hunter;en
I want to see the novel, The Green;en
I'm looking for the trailer of Highlands Today ;en
Look up Applied Linguistics;en
Where can I get Lahore ;en
show creativity in All Nudity Shall Be Punished;en
show creative Last Light;en
Find the Son of Man show;en
Find Drowning with Land in Sight. ;en
Can you play The Wanderer and His Shadow ;en
look for the show named Chestnut Mare;en
Please find the novel, Good Doctor ;en
find The Inspector for me;en
Where can I find the painting RSS tracking;en
find Phinally Phamous;en
I'd like to see Walk  the Wild Side: The Best of Lou Reed ;en
Find Make Your Play ;en
I'm looking for the trailer to Evil or Divine - Live  New York City. ;en
Find me a saga by Reproductions;en
Find me the TV show The First Bite.;en
I want to read the book The Minotaur;en
Please look up The Immortals television show.;en
find a photograph called Free the Universe ;en
Find me the book with the title of The Rainwater LP;en
Please find me the Platinum Box II song? ;en
play the video game The Genesis Machine;en
Find a show called Friday Download. ;en
find a book called Follow Me;en
Please find the novel, Good Doctor;en
How do I watch the television show Counting the Rosaries?;en
Go to Attack of the Planet Smashers;en
I need Journal of Pediatric Oncology Nursing, help me find;en
Please look for Catch a Falling Star;en
Please  up the television show, Noel Hill & Tony Linnane. ;en
Find a picture of Music Hole;en
Please get me the Welcome to the Rileys game.;en
I need to  the saga Trail of the Yukon ;en
Go to the photograph The Inflated Tear ;en
play the song Memories Are My Only Witness;en
find Projections, an album ;en
Play me the song Just to See You Smile.;en
I want to play the game Pesterminator: The Western Exterminator.;en
find She Monkeys ;en
Find Half Cut Tea.;en
search for the album Frog and the Birdsong;en
Search for Police Women of Cincinnati ;en
Search for Live Forever: The Rise  Fall of Brit Pop TV show ;en
Can you search Miracle in the Rain? ;en
Where can I watch the television show You Make Me Hate Music;en
I need to find the So Nice soundtrack;en
Find a video game called Family Dog.;en
Find the album titled Spasmolytic;en
show creative Labor Notes ;en
Can you find me the Dicey Business TV series?;en
find the song The Fourth Man ;en
I'd like to play the song In a Reverie ;en
Can You tell  the Actors of the saga awards/ ;en
Find Landing on Water. ;en
I'd like to see the The Gathering Storm TV series;en
look for the show named Chestnut Mare ;en
Please find me the book Step Into My Groove.;en
I need a novel about Polymer Chemistry. ;en
I'm looking for the movie called The Beast that Shouted Love  the Heart of the World. ;en
Please search for the Microsoft Safety Scanner television show.;en
show creativity of Wild About Animals;en
I want to watch the TV show Down on Abby;en
I want to play the video game The Coyote Kings of the Space-Age Bachelor Pad;en
find The Great Hydration, a TV series ;en
Show me KurdishMedia.com;en
find Blood Moon: Year of the Wolf, a movie ;en
Find a TV show called The God Boy. ;en
show creativity In the Red saga ;en
Find a novel called Under Blackpool Lights. ;en
Go to Your Heart Belongs to Me;en
play the TV show Iron Seed ;en
show Andy Williams Sings Steve Allen TV show;en
Show me the saga The Buffalo Boy;en
Where can I buy a hardcover copy of the  The Intangibles of Leadership? ;en
Look up The Baltic Times picture ;en
find Welcome to the El-Palacio, a movie ;en
What is the Paranormal Activity: Ghost Dimension album?;en
Find a TV show called Studies in Logic.;en
Look for A Terrible Vengeance ;en
Find The Press of Atlantic City movie ;en
Find the Endangered Species song ;en
find a novel called Best Hits Live: Save the Children Speed Live 2003;en
Where can I watch TV series Shopping Spree;en
Where can I see the television show, Jimmy Two-Shoes? ;en
Please find me the Magic Hour saga. ;en
Find a song called This Champagne Mojito Is the Last Thing I Own.;en
Find the work Compiled fragments 1997-2003 ;en
I want to  the game Show Me the Wonder ;en
Find the TV series I Build the Tower ;en
Where can I find the game KAAKAI Newspaper ;en
find NHL on Fox;en
Please find the Packed to the Rafters work.;en
Where do get photograph of My Own Best Enemy;en
Where can I find the painting of Without Condition ;en
I'd like hear the song Sit Down and Talk to Me;en
show creativity of All for One ;en
show me the photograph with the title The Denial;en
Show me the Only the Strong Survive photograph;en
Find me The Memorial ;en
I want to watch Escape the Fate discography;en
Please look up the Falls Church News-Press album.;en
Can you  me the game, Super Scription of Data? ;en
I'd like to see the  The Collection – The Collector 2 ;en
How to buy picture of Agent Hamilton: But Not If It Concerns Your Daughter;en
I'm looking  the show called The Origin of the Milky Way ;en
find a television show called Happy Trails ;en
Can you help me  the We No Who U R game? ;en
show creativity of Adobe AIR;en
Where can I find the photograph of Mr Blobby ;en
Please show me the picture History Repeating;en
Please look up the Beauty on the Fire show.;en
find a soundtrack for Dante’s Peak ;en
I'm trying to find Annunciation. ;en
Find me the album The Weed Tree.;en
Please find me the game called The Salvation. ;en
Show the Chemdex.com photograph;en
Find a picture of A Breed Apart;en
play The New Noise Theology E.P.;en
Show The Caveman television show;en
find a saga called Shame on You;en
find book In the Valley;en
I need to find the work Brotherly Love ;en
find a painting called The Wipers Times ;en
show creativity of Construction Project Information Committee;en
Find a soundtrack called The Alice Cooper Show.;en
Find The Earth Is a Sinful Song;en
find Some of My Best Friends Are...The Piano Players;en
Show me the Live in Whitby album.;en
Where can I buy a photograph called Feel the Love?;en
I want the photograph of Walt Before Mickey ;en
Is there a game called The Neutral Zone?;en
Find me the show The Skull.;en
Find The Best Man Holiday saga ;en
help me the find the Thug Lordz Trilogy book ;en
Find a TV series called Dirty Politics.;en
Play the Knockabout soundtrack ;en
Show me the TV show Have a Nice Day;en
Can you get the TV show, ENTER THE MATRIX?;en
find Live in Tokyo for me ;en
What is Party All Night;en
look for the book titled Iranian Journal of Fuzzy Systems;en
Try to find the picture Advances in ecological research;en
find a game called Albino Blacksheep;en
Find me the video game For Your Love. ;en
Please search for Sealed with a Kiss movie.;en
What is the song The Beast from 20? ;en
I'm looking for The Birth of a Nation ;en
Looking for novel Build Engine ;en
find the show Trancers ;en
She  the Sons of Satan Praise the Lord picture ;en
find I Love You Too, a saga;en
Please look up the Around the World in Eighty Days movie.;en
I'm looking for a picture titled Rock Painting;en
Show me the show Goldimouse and the Three Cats ;en
find a movie called Bruce Lee ;en
Can I buy the book Vacation of Petrov  Vasechkin online? ;en
I want to read the novel Love Is in Control;en
Find a picture called Blink of an Eye. ;en
where do I see the trailer for Live Dates ;en
find Long Hello and Short Goodbye, a movie;en
Find Make Your Play;en
Can you please  the Jack Johnson En Concert picture? ;en
Find a soundtrack called The Outpost.;en
I want the video game Southwest Riders ;en
find Check In ;en
Look up The Brave Archer 2 ;en
I'd like to see the  City University of Hong Kong Law Review ;en
Where can I find the novel The Great Irish Bake Off;en
 a picture called How Much Wood Would a Woodchuck Chuck ;en
Show me the Lights Out saga;en
I want The Complete Global Albums Collection ;en
play Bliss Torn from Emptiness;en
Can I see the album SWAT Force? ;en
I'm looking for the television show The Flame ;en
Look for the Compact Forest Proposal trailer ;en
I want to listen to the  The Loving Spirit ;en
I'm looking for the saga Why Men Leave Home ;en
Where to see painting Twelve Angry Men;en
find a game called Albino Blacksheep ;en
What is the cheapest price I can pay  the DVD called The Darkest Cloud? ;en
Show the Innocent When You Dream saga ;en
Where can I find the movie called Cracking Contraptions? ;en
Find a saga called Story of My Life. ;en
Show me the game English Freakbeat;en
Find a photograph called The Dickinsonian.;en
I want to find the show From Where to Eternity.;en
Look for the Compact Forest Proposal trailer;en
Show me a picture called Heart Like a Hurricane;en
find me a game called Thesis Eleven ;en
Can you find the novel Journal of Social Work;en
find a soundtrack called The Spanish Jade;en
fimd Glory ;en
Find a book called The Echo Chamber.;en
What is the television show Phil Ochs: There but  Fortune playing ;en
Show me the book The Republican Brain;en
find Journal of the Society for American Music ;en
Find a television show called Swing High. ;en
find Loved Ones for me ;en
Find a song called Be Quick or Be Dead.;en
find the movie Ircle;en
Can you help me  a picture called Olympia 1974? ;en
Could I download Chavez: Inside the Coup? ;en
find a movie called October Road ;en
Please help me find the Short Program saga. ;en
I want to listen to the soundtrack And Then There Was Light;en
Search for the picture Foghat? ;en
I'm looking for the television show The Flame;en
show schedule for Loved by Thousands;en
Find GoodReader.;en
search for the game The Last Horror Movie;en
Find Confusion Bay.;en
Get me a photograph of Trac;en
Show me the album Clarke;en
Please find me the work, Ace of Spades.;en
Can you find the soundtrack for Westcountry Live;en
find a photograph called Accion Newspaper ;en
Show  TV series Lego Star Wars 3: The Clone Wars ;en
I want to watch the show Frank Sinatra Sings the Select Sammy Cahn;en
find the photograph JBoss Enterprise SOA Platform ;en
show me the television show Operation Thunderbolt;en
show movie schedule of The Big Mouth ;en
Show Acta Mathematicae Applicatae Sinica TV show;en
Get Jump Down painting;en
Please find me The Hanging Valley movie.;en
Plau me the song The French Chef;en
Find Pursuit of Radical Rhapsody;en
I'm looking for the show Pulse 2: Afterlife;en
I'd like to watch the TV show Hola Mary Lou: Prom Night II;en
I want to watch the  Frank Sinatra Sings the Select Sammy Cahn ;en
Find the Via Dolorosa: Songs of Redemption saga ;en
Where to get the movie Fear of a Black Hat;en
Show me the television show Children  Need Rocks 2013. ;en
Where can I buy the movie The Teahouse Fire?;en
What Can I watch watch the television show Catch ;en
find a game called So Long Self ;en
Please find the TV series Back to Bach ;en
Can i see the Boat People?;en
Find a soundtrack called The Alice Cooper Show. ;en
Can you search City of Scars? ;en
Show me the Only the Strong Survive photograph ;en
show creativity of Pocket Full of Kryptonite ;en
Please search for the Microsoft Safety Scanner television show. ;en
find Mash Confusion;en
read the Background to Danger book ;en
find the show titled Hell on Earth 2006 ;en
find an album called From the Terrace ;en
Where can I view the photograph Dinosaur from the Deep?;en
search for a photograph of Road Hogs ;en
Find me the JQuery Mobile TV show ;en
Find a saga called The Devil Went Down to Georgia.;en
I'd like to see the picture Chrome Dreams ;en
Can you get the TV show, ENTER THE MATRIX? ;en
Show me a picture of Love ;en
Find Digimon Next ;en
Show me the television show The Angry Mob. ;en
show me The Best Of: Volume 1 TV series ;en
Please look up the Around the World  Eighty Days movie. ;en
where can Ifind You Know Me, a saga ;en
find Live at Memory Lane ;en
I'm looking for the album called Disorderly Conduct: Video on Patrol;en
show creativity of The Album saga ;en
Can you find the Info Wars saga ;en
Find a photograph called Shout It Out.;en
I'm looking for Paris Match ;en
Play me the soundtrack for Nothing Personal.;en
Download The Red Eagle TV show;en
play The Catholic Sun album ;en
find the album Smoke and Mirrors ;en
I'd like to see the show Onion SportsDome ;en
find a game called The Oh in Ohio;en
Show me The Atrocity Exhibition ;en
find Doggy Day School, an album ;en
Find The International Journal of Robotics Research soundtrack;en
Where is picture Everybody Wants You;en
Find The Gamble.;en
 a video game called Batman: The Return of Bruce Wayne. ;en
read the novel Friend: The Great Legacy;en
How do I get the soundtrack for Hearts of Fencing?;en
show movie CrossGenesis ;en
find Bal Ganesh 2, a video game ;en
find History of North Dakota, a TV series;en
Find The Tyrant;en
Where can I stream a television  called Safety EP? ;en
I'm looking for the video game Masterful Mystery Tour ;en
When was the album Start a Fire released? ;en
find a video game called A Stroll in the Pork;en
Looking for the photograph the Crimson Climax;en
Show me Horton and the Kwuggerbug and More Lost Stories;en
Where can I watch the trailer for Home Economics;en
Play me the TV show The Women of Our Home;en
Where can I view the photograph Occasional Wife ;en
Can you  Fire Escape in the Sky: The Godlike Genius of Scott Walker ;en
show song schedule of Shoot for the Moon ;en
I'd like to see the trailer Tony Parker ;en
Show The Night Riders;en
Find a show called Lipstick Vogue.;en
Please find the album The Party Scene;en
What is the TV show Journal of Personality and Social Psychology?;en
Show  the Live~Legend 1999 & 1997 Apocalypse TV show ;en
I'd like to hear the soundtrack for Just Once in My Life.;en
What is Just Like in the Old Country;en
I want to hear the soundtrack to The Platinum Rule;en
find a book called The Mad Magician ;en
I'm looking for the show Sex and Candy ;en
Show Minutes to Midnight photograph ;en
Find Returned to Your Mind.;en
I want to see the trailer for Australian Economic History Review;en
I want to watch the TV show Official Detective;en
find Framing the Early Middle Ages, a game ;en
find a TV show called Randy Scouse Git;en
Where can I purchase the TV show Time  Heroes ;en
I want to read the novel Pokémon the Movie: Black—Victini and Reshiram and White—Victini and Zekrom.;en
search for the show Champagne Showers;en
Please look for the TV show Memoirs  a Bedroom: Issue 1 ;en
Where can I buy The Lying Game;en
Where can I read the book The Omega Stone?;en
Find a trailer called Sheriff of Tombstone.;en
look for the creative work Meltdown – Days of Destruction;en
Find a painting called Voices in My Head. ;en
show me NeuroToxicology ;en
Where can I get Harry Potter and the Philosopher’s Stone;en
show creativity of soundtrack IHeartRadio Countdown ;en
Where can I buy the movie Totality ;en
Find the TV show titled Timerider: The Adventure of Lyle Swann;en
Look for the American Journal of Sociology ;en
find The World Is a Game;en
Find a video game called Young. ;en
Can you find the song Bleach: Hell Chapter;en
Where is the TV show Bomberman Land Touch! 2 ;en
find Racing the Beam: The Atari Video Computer System;en
Show The Last Tightrope Dancer in Armenia television show;en
I want television show Come Again Smith ;en
I'd like to play the song In a Reverie;en
I'm looking for 1634: The Ram Rebellion.;en
find the novel A Civil War: Army vs. Navy ;en
Find a television show called The High Chaparral.;en
Find an album called List of Re: Hamatora episodes. ;en
Show me the album Three Songs About Lenin ;en
Where can I view the picture Reaching Horizons ;en
Where can I see the trailer of Take Me to the King;en
Find Stays in Mexico.;en
Where is Journal of Geriatric Psychiatry and Neurology;en
 creativity of The Oxford Companion to Beer TV  ;en
Can you find me the Naked City – Justice with a Bullet album?;en
looking for Liberalism and the Limits of Justice;en
Show me a novel by Onnaam Muhurtham ;en
Find the TV series From the Top;en
How can I see the TV series Mothstorm? ;en
find The Inspector for me ;en
Show me Bâton Rouge;en
find Journal of the European Economic Association, a movie I want to see;en
Look for a photograph of I Wanna Sex You Up;en
Looking for A Black Ribbon for Deborah.;en
Get me a picture about Sardonic Wrath ;en
What is the Read All About It picture?;en
find the trailer for Live at Hull;en
show creativity of Home Brew;en
find the song Ticks;en
Look for the American Journal of Sociology;en
Find a painting called Pulsions.;en
Show the Whispering Willows novel ;en
Where can I find the painting RSS tracking ;en
want to see the trailer for The Prefect;en
search for the song Banquet for the Damned;en
Look up The Dock of the Bay show;en
find The Quest of Iranon ;en
I'd like to see the saga 12 Soulful Nights  Christmas ;en
show creativity of The Album saga;en
find Young Miss Holmes ;en
Find the show We Chase the Waves;en
I'm looking for a picture of Fresh Air;en
Where can I see the show Latin for Lovers? ;en
Show the My World 2.0 photograph;en
Find the Another Ticket game;en
Show Saison 5 de Game of Thrones ;en
I'm looking  a novel called The Adventures of Lolo II ;en
find the TV show Hot Air;en
Find a video game called Peaches discography.;en
I want to watch the TV show Official Detective ;en
I need Chapter One of the show, get it for me please.;en
Please find the movie Dancing Girl;en
Play me the show Cheaper By the Dozen 2;en
Show me The Lord of the Isles;en
find Tortured Man;en
Play me the trailer for Star Control.;en
Please look up Two More Years soundtrack. ;en
play the album The Outpost ;en
Please pull up the album, The Last War ;en
find Home Fires;en
play Tales from the Organ Trade ;en
Play the Electrochemical and Solid State Letters song ;en
find a TV show called The Traffic Policeman ;en
Show me the TV show Have a Nice Day ;en
Find a TV series called Church of the Truly Warped.;en
Look for All Broken Up  Dancing which is a video game ;en
Where can I see the trailer for Experienced II: Embrace Tour 2013 Budokan?;en
Show me the picture Creatures of Light and Darkness ;en
Show me the television show called South California Purples ;en
find a game called The Oh in Ohio ;en
Find me the book called Suffer ;en
Play Keep Their Heads Ringin’;en
Show me the novel All I Need to Know;en
Show The Family from One End Street album;en
 a trailer called Way Down Yonder in New Orleans ;en
I'm looking for the television show titled The Lonergan Review;en
find a book called Tron: Legacy Reconfigured ;en
Play me the trailer for Gainesville Daily Register.;en
Find The Transformers: Generations video game;en
Please get me the British Journal of Dermatology game. ;en
find the photograph Hearts Burst into Fire ;en
show creative picture of Brenda’s Got a Baby;en
Find the creative work Brilliant! Tragic!;en
find a TV show called The Traffic Policeman;en
where can I watch the TV show Terrorists: The Kids They Sentenced ;en
play Blind Company ;en
I'm looking for the Pokémon: The Movie 2000 TV show;en
Find the Exile and the Kingdom ;en
Show  the photograph Johnny Cash: The Complete Columbia Album Collection ;en
Show  a television show named A Love to Hide. ;en
Please search for The Legend of Korra book.;en
What type of movie is Houston Press? ;en
Please look up the novel, Heroes of Annihilated Empires ;en
 Trust in the Lord – Live Worship with Don Moen. ;en
show creativity of Home Brew ;en
Where can I find the novel A Woman in the Web;en
Show me the TV show My Only Wish;en
Where to buy video game of Think Fast ;en
Find The Last Angry Moose;en
Can you please find me The Biggest Loser Brunei: The Spirit of Life photograph?;en
 can I purchase the TV series Liar Game - The Final Stage ;en
 the TV series Effortless Regurgitation of Bright Red Blood ;en
search for TV show Live at Apollo ;en
Find My Only Wish in some form of creative work;en
Need the saga called the Black Lamp ;en
Find the Youth Against Christ saga ;en
Find a novel called Testing Anywhere.;en
Can you help me find Tears from a Willow? ;en
Find me the Balance and Timing book;en
Where is the TV show Am Universum ;en
 can I purchase the TV series The Royal Sessions ;en
Search for Chasing Fortune a TV series. ;en
I'd like to watch the TV series Sailor Moon SuperS: The  ;en
Search for the video game The Book of Heroic Failures;en
show me NeuroToxicology;en
Is the TV show The Prodigal Wife on today? ;en
I'd like to see the album Heroes of Might and Magic IV;en
Show me the television show Children in Need Rocks 2013.;en
Where can I purchase the TV series The Mating Season;en
Can you search for Twilight Is Gone? ;en
show creativity in All Nudity Shall Be Punished ;en
Find a video game called No Parking on the Dance Floor.;en
read the novel On-Line Encyclopedia of Integer Sequences;en
Look for Every Little Crook and Nanny;en
I'd like to see Hannah Montana and Miley Cyrus: Best of Both Worlds Concert;en
search for the painting Hess: A Biography ;en
Find me An Echo in the Darkness ;en
find Cut the Rope;en
I'm looking for a game called Gateway;en
Is it possible to find the book Live in Europe online?;en
find a TV show called Perfect Chemistry;en
I need to find the creative work Prince Hours;en
Can you find the novel Stoneage Romeos;en
 the TV show titled Timerider: The Adventure of Lyle Swann ;en
show creative work of Through the Back Door;en
Show The Monkey soundtrack;en
is there a Chinese Wikipedia;en
want to  the novel called Innocent Until Caught 2: Guilty ;en
Show The Invisible Hook trailer ;en
show creative game Elements of Life: Remixed ;en
Search for The Long Dark ;en
Can you help  search the album titled PlayMaker Football? ;en
Bring up the book Perfume: The Story of a Murderer;en
Search for Teenage Mutant Hero Turtles: Fall of the Foot Clan photograph;en
Please find me Glass Cloud – Single.;en
Please get me Infernal Devices game.;en
Show me Horton  the Kwuggerbug  More Lost Stories ;en
Please search the Irv Gotti Presents: The Murderers picture. ;en
Please fine me Worms Clan Wars. ;en
What is the cheapest price  the saga called 2006 Wikipedia CD Selection? ;en
Can you  me the Back When I Knew It All album? ;en
Show the Bean and the Boys painting ;en
I need the book titled Lullaby of Broadway ;en
where can I find a painting called Battlestations: Pacific ;en
help me find the book called Journal of Neuroscience Research;en
play Print the Legend soundtrack ;en
Show me a picture of Love;en
Where can I  the movie The National Law Review ;en
Show me Firepower ;en
Find a soundtrack called The Christmas Shoes. ;en
Find The Creeper. ;en
Search for The World Is a Game;en
Search for The Dark Side of the Mind movie ;en
Buy novel Brokeback Mountain ;en
help me find the work Unite and Win ;en
show creative song called Holidays on the River Yarra;en
Find the novel called Loyalty.;en
Play me Memoirs of Modern Love: Curious Age;en
I need info on the video game Iron Fist ;en
Find a television show called Structured Fax File. ;en
find an album called Stumble.Stop.Repeat;en
Find Dyskografia Nick Cave and the Bad Seeds.;en
What is the Michael Moore Is a Big Fat Stupid White Man video game?;en
How do I watch the TV  NBA Access with Ahmad Rashad ;en
Find a trailer called Sheriff of Tombstone. ;en
Can you find me the Magic Hour song? ;en
What is the TV show This Is Halloween?;en
Show me the song Spiderman of the Rings ;en
 the TV show titled The Three Leaps of Wang Lun ;en
Please search the Ironbound picture.;en
Find Half Cut Tea. ;en
Find The Gill Deacon Show.;en
Show Panic in the Streets;en
Do you know of a song  the Mande Studies Association? ;en
When was the TV show CrazySexyCool taken off air? ;en
find The Prince of Temple Street, a picture;en
Play The Great Adventures of Slick Rick game ;en
play TV show Way of the Samurai 2;en
show creative photograph of Icewind Dale: Heart of Winter;en
Find me the song called The Budapest Beacon. ;en
find The Saint in New York, a show;en
find Hope & Other Sins, a TV show;en
find me the book Filthy Lucre Live ;en
Can you find me the Spectres television show?;en
Find THUNDER IN THE EAST. ;en
Search for the George and the Big Bang TV show;en
Search for Informix Wingz ;en
Show the TV series The Merry Sisters of Fate. ;en
find Doggy Day School, an album;en
Show me the video game When In Rome 2007 ;en
Find a novel called East Liberty ;en
Where do i purchase the book, Baby-Sittor?;en
Show me the book F-1 Grand Prix Part II;en
I need Top Gear 2, please search it for me.;en
Show me the video game  When In Rome 2007;en
There's a famous painting called Thursday, do you have  image of it? ;en
I want to watch Manthan;en
find TaskCracker for Outlook, a game;en
I'd like to see Level Headed ;en
help me the find the Thug Lordz Trilogy book;en
Where to buy book Bright Ambush;en
I'd like to see the painting I Looked Up;en
show TV show named I Fell in Love with a Dead Boy;en
What is the Read All About It picture? ;en
Find Half a Sixpence photograph;en
Go to the photograph The Inflated Tear ;en
show TV show schedule of Offroad Legends;en
find a television show called Sensation Comics;en
Look up The Park album ;en
Can you locate the saga for the Ringo Sheena discography;en
Show The Singles Collection Volume 4 ;en
Where can I purchase Wuthering Heights ;en
