expression;language
find Framing the Early Middle Ages, a game;en
Find the show We Chase the Waves ;en
find Old School Junkies: The Album, a video game ;en
Where is picture Everybody Wants You ;en
Show me the album Andrews University Seminary Studies;en
Find Reverence for me ;en
find NHL on Fox ;en
Look up the Fair Warning saga ;en
Where can I  a photograph of The Lieutenant of Inishmore? ;en
find a soundtrack called Pax Warrior;en
show That Little Band of Gold ;en
Pull up the TV show, 40 Seasons: The Best  Skid Row ;en
I want to play the game The Celestial Hawk ;en
Please look up the song, Twist of shadows.;en
Play Everybody Wins trailer;en
Can you find the television show Manifesto of Nevermore ;en
show Air Cuan Dubh Drilseach ;en
find a show called The Crowd Roars;en
 a novel called On the Case with Paula Zahn. ;en
show creativity of Night of the Hunter ;en
Please get me the AiON show. ;en
Find The Crucible of Man: Something Wicked Part 2.;en
What is the song The Beast from 20?;en
play Cry Baby Lane;en
play Closer to the Sun album ;en
Search for The Dark Side of the Mind movie;en
Find the game Just Dance Greatest Hits;en
Show me the book F-1 Grand Prix Part II ;en
Please search for All the Lovers trailer. ;en
find The Covered Wagon, a game ;en
Search for Informix Wingz;en
Search for the Un provinciale a New York TV show;en
find Loved Ones for me;en
Find Clash of the Codes. ;en
Show me the work The Catholic Weekly ;en
find Back to Boomtown: Classic Rats Hits, a soundtrack ;en
Show me the picture Written in the Stars ;en
I'd like to see the photograph The Light ;en
Show me the work Not a Little Girl Anymore;en
Search  the Un provinciale a New York TV show ;en
find the TV show Hot Air ;en
Find the News At Seven-Thirty photograph;en
Look for Summer with Monika;en
Please find me The Purple Vigilantes book. ;en
Find a TV series called Cocktail Kings. ;en
find a painting called Screen Souvenirs;en
Find the Apple Address Book television show;en
What is Marty Stuart discography ;en
Where can I get a photograph of Death Knows Your Name?;en
Show me Heavenly Sword ;en
Find Wish You Were Here.;en
I'd like to find the Limited Lovers novel ;en
Find a television show called Merced Sun-Star.;en
find the picture Their Finest Hour ;en
find the Still Life: American Concert 1981 soundtrack ;en
Find a picture called Battlefield Network. ;en
Show The Blue Meaning television show ;en
find Wintersong game;en
Please get me The Very Best of Chicago: Only the Beginning.;en
Play Nightbirds on Nantucket soundtrack ;en
looking for Liberalism and the Limits of Justice ;en
show creative picture of The Secret Doctrine;en
find a photograph called XQuery API for Java ;en
Can you find the painting The Crow: Original Motion Picture Soundtrack;en
Can you please find me, Journals?;en
find Harry Potter and the Deathly Hallows – Part 2;en
Can you please search Ellington at Newport?;en
Show the Philosophy and Phenomenological Research saga ;en
show creative album Heredity;en
I want to watch Strange Brother ;en
Find a show called American Journal of Play. ;en
Show GD&TOP painting;en
find a video game called Victory March ;en
Play show of Cissy Houston ;en
I'm looking  the album called Disorderly Conduct: Video on Patrol ;en
Show the Soonchild painting ;en
I need to see Cristo in India;en
Go to the television show Nothing Without You ;en
I'm looking for the game called Summer of Fear ;en
Find WxHexEditor.;en
Where can I find the picture Another Happy Ending;en
show the trailer of Rugrats Go Wild ;en
find a novel called Chemistry - An European Journal;en
Can you please find The Notebook of Trigorin game? ;en
Where can I find the Ricky Skaggs discography;en
show creativity of Doomsday Comfort;en
show the show The Son of Tarzan ;en
Please find me the book Step Into My Groove. ;en
I need to find the creative work Burn Baby Burn;en
Find me Royal Astronomy ;en
Where can I listen to the song The Imposter?;en
find The Great Hydration, a TV series;en
Find the photograph The Remix please ;en
Find the song called International Journal of Bilingualism ;en
Find the Return to Grace saga ;en
Please help  search the TV series A Mouse Divided. ;en
Find Five Came Back for me ;en
Show me the song The Incredible Hulk Returns ;en
Find a soundtrack called Top Gear Australia.;en
find Flesh and Bullets ;en
Show me Live at the Kings Center ;en
Look for the creative work called White Sugar ;en
search for the picture Boomtown;en
What is the price for the album Praise the Lord and Pass the Ammunition?;en
Find a book called The Magic Christmas Tree. ;en
show creativity of saga Frontier Marshal ;en
Where can I find the game Skip to the End?;en
find Projections, an album;en
I want to watch Wide-Eyed and Ignorant;en
Find The Modern World video game ;en
find PoliticsNation with Al Sharpton ;en
I need to find the creative work Wave;en
find Trauma Center: New Blood, an album;en
Where can I  the TV show Earth Defense Force 2025? ;en
Show me the song The Incredible Hulk Returns;en
Find The Best Man Holiday saga;en
Show me the movie Purple Heart Diary.;en
Find a soundtrack called New Religion. ;en
Search for the Complots;en
I'd like to find the Days of Glory saga ;en
Find an art called Cassidy. ;en
What  the picture called Lest We Forget: The Best of? ;en
Find a painting called Mr. Scarface Is Back.;en
Search for Man in a Garage ;en
Can I buy the book Vacation of Petrov and Vasechkin online?;en
Find a painting called Boating on the River Epte.;en
Find a TV show called The Ambient Collection.;en
search for a painting of The Wannadies;en
I'm looking for the song called Standing for Something.;en
Where can I watch the television show You Make Me Hate  ;en
find a book called Outpost Firewall Pro;en
Find a novel called East Liberty;en
search for the trailer The Thieving Magpie ;en
I want to listen to the  of Ghost in the Shell: Stand Alone Complex ;en
Please look up the song, Twist of shadows. ;en
find a novel called Chemistry - An European Journal ;en
Find the TV show titled The Three Leaps of Wang Lun;en
show The Best of Minnie Riperton saga;en
Looking for the painting Last Flight To Abuja;en
Show me the Sex Therapy painting ;en
trailer of Gate of Thunder;en
Where can I locate Leo the Lion for purchase;en
show creative photograph named None of the Above ;en
I'd like to see Jacksonville Daily Progress saga ;en
Get me the Elvis’ Christmas Album TV show.;en
Where can I get Intel Array Building Blocks ;en
find the movie Shake Your Spirit ;en
Find me the Fruit of Life television show.;en
Find a trailer called Storm Center.;en
Find The Cerebellum book;en
play Off the Ground;en
can you get me the television show called Start It Up?;en
find TV series titled A Life in the Death of Joe Meek;en
Find the show Manthan;en
Where can I find the game KAAKAI Newspaper;en
Find the work Compiled fragments 1997-2003;en
Find LaserLight.;en
I'd like to see the movie Edinburgh Evening News;en
Find me The River of Love saga;en
find a TV show called Engaged to the Unidentified;en
Find me the TV show Ask a Woman Who Knows;en
Can you please find me D.R.E.A.M.?;en
find a movie called Bruce Lee;en
find Racing the Beam: The Atari Video Computer System ;en
Find Live at Bearsville Theater;en
I'd like to see the show Migration ;en
I want to play the video game Miss Castaway And The Island Girls;en
show game Alien Breed II - The Horror Continues;en
Look  the TV series All Around Performance Horse Weekly ;en
 can I watch the TV series Breed the Pain? ;en
find Blood Moon: Year of the Wolf, a movie;en
Find me the novel of A Dictionary of Slang  Unconventional English ;en
find The Flying Scotsman ;en
 Disney Sing It! – High School Musical 3: Senior Year ;en
What is the painting Forever Malcolm Young? ;en
search for video game The Sky Is Crying ;en
find the show CarniK Con;en
find a TV show called Ruthless;en
I am looking for a work called Carry You Home;en
Find me the song 2 Fast 2 Furious ;en
Find the Another Ticket game ;en
play The New Noise Theology E.P. ;en
Can you  a creative work called A Saintly Switch ;en
I'm looking to find the trailer for Brought by the Sea.;en
Search for the Halfway Home TV show ;en
I'd like to see the album Heroes of Might  Magic IV ;en
Can you find a creative work called A Saintly Switch;en
Where can I get the video game Faith  Chaos? ;en
I'd like to see Walk on the Wild Side: The Best of Lou Reed;en
I want to watch the television show Little Things ;en
search for Space on My Hands;en
Find The Crucible of Man: Something Wicked Part 2. ;en
Find me Haunted Castle;en
Find a trailer called Peggy Sue.;en
Get soundtrack of Comprehensive Knowledge Archive Network;en
Find the saga A Very School Gyrls Holla-Day.;en
Show The drive of life album ;en
Please find me the Rear Mirror saga. ;en
Find The Cartel Vol. 2 novel;en
I want to watch the trailer Ad Nauseam ;en
search for the painting Smart Money ;en
Find Z Cars. ;en
 a movie called The Easy Way to Stop Smoking. ;en
find a saga called Set Sail the Prairie ;en
Where to buy book Charlie Countryman deve morire;en
find movie titled Triumph of the Spirit ;en
Can you find a photograph entitled, Beneath the Harvest Sky;en
Help me find  Time to Time, a TV show ;en
where can I find a painting called Battlestations: Pacific;en
Play the TV series Heart of Gold ;en
I want to read the saga Michael Clayton;en
Find a TV show called Frontiers in Ecology and the Environment.;en
Find a novel called Industry.;en
I'm looking  the television show titled The Lonergan Review ;en
find a TV show called Full House;en
I'd like to see the saga Tamagotchi 64: Minna de Tamagotchi  ;en
show Angels of Iron television show;en
I'd like to listen to the song The Natural Farmer;en
Find painting Big Ideas ;en
I want to see the trailer for No One ;en
Show Second Generation album;en
Please search for Sealed with a Kiss movie. ;en
Can you  me the Naked City – Justice with a Bullet album? ;en
Search for a picture of Darker than black ;en
 the trailer for Bill Cosby Presents the Cosnarati: State of Emergency ;en
Where can I find the picture the Japanese Lovesong near me?;en
find Wild Solutions, a saga;en
I'm hoping you can find a photograph  Live At The Isle Of Wight 1970. ;en
Can you search the picture titled The Accounting? ;en
find Word of Mouth for me;en
Can you find me The Real McCoy novel? ;en
Search for Another Cinderella Story ;en
find Mother Earth, a TV show ;en
Find the Labyrinthe game ;en
Find a TV show called Directions Home.;en
Find me the When Harry Tries to Marry photograph;en
Find Night of Passion;en
Search for The Nations;en
Please help me search The Banker television show.;en
Find a painting called Beyond the Neighbourhood.;en
I want to watch the show Food Force;en
What system is Bloodhounds of Broadway the game for? ;en
find the show How to Meet the Lucky Stars;en
Find a novel called Twins of Evil.;en
Find the Stone Free game ;en
search for the painting Hess: A Biography;en
Find Journeyman.;en
Where can I get the novel Flesh-Colored Horror;en
Look up The Cool Cafe: Cool Tape Vol. 1 video game;en
I want to watch the movie Maxime;en
Show Acta Mathematicae Applicatae Sinica TV show ;en
I'd like to watch the TV series called Fires of  ;en
Can you get me the Maldeamores saga?;en
I want Sugarfoot ;en
Find a song called In Your Eyes. ;en
I'm looking to find Kiss Me Goodbye. ;en
show me the trailer for Live Phish Volume 12 ;en
I need a novel about Polymer Chemistry.;en
Play me the TV show SEAL Team;en
Find a television show called The High Chaparral. ;en
want to watch the TV show Treeful of Starling;en
find If These Walls Could Talk ;en
Find Stays in Mexico. ;en
FInd trailer for Iraq for Sale: The War Profiteers;en
Find a trailer called Colony 7.;en
Where can I find a copy of I Bury the Living?;en
Find Digimon Next;en
Look up the TV series Operace Silver A;en
Find a picture called Battlefield Network.;en
I want the video game Southwest Riders;en
Look up the This Is Halloween trailer;en
Can You tell me the Actors of the saga awards/;en
 can I buy a photograph called Feel the Love? ;en
Please get  The National Medical Journal of India game. ;en
Looking for the trailer for Shaolin Temple ;en
Play video game Manifesto of Nevermore ;en
Get me the Trick or Treats soundtrack. ;en
Where can I watch the television show called Fangs of the Arctic?;en
Find Next of Kin;en
show creativity of novel Lock;en
Find a show called Friday Download.;en
Show me the movie Operetta for the Theatre Organ ;en
Can i see the Encounters?;en
show me the Evil Dead painting;en
Looking for Kepler scientific workflow system ;en
I'm looking for a soundtrack titled Bowie  the Beeb ;en
Find the Digital Champ: Battle Boxing;en
Play The Lure of the Mask song ;en
find me The Seven-Ups;en
show me the Everybody Wants You picture;en
find the trailer for The Spooky Sisters;en
Find Resurrection of Evil.;en
show TV series schedule of Gears of War;en
Can you search A Song for Mama book for me?;en
Show me the picture Creatures of Light and Darkness;en
Find a television show called Structured Fax File.;en
 a television show called The Passion of the Betty ;en
show creativity of A Catholic Education ;en
I want to listen to the song Only the Greatest;en
Find a novel called Kiss Me Licia.;en
Where can I get the video game Faith in Chaos?;en
find Word of Mouth for me ;en
Please find Brand New Strings;en
Find a photograph called Sleeping with the Enemy.;en
Please look up The 4-Hour Workweek saga ;en
I want to listen to the  Only the Greatest ;en
Find The Modern World video game;en
Where can I locate the show The Return of Mr. Moto;en
I want to play the game The Celestial Hawk;en
Show me the picture Gas Wars;en
Find The Fire in Our Throats Will Beckon the Thaw TV show;en
Please show me the picture History Repeating ;en
Look for the Itv.com song ;en
Find Stained Glass Windows.;en
show creativity of video game Labyrinth;en
I want the video game Two More Years;en
Do an image search for the picture Perfect Storm: Disasters That Changed The World;en
find a book called Kiss Symphony - Alive IV;en
I'm looking to find Suryavanshi.;en
Find the Digital Champ: Battle Boxing ;en
Look for the Journal of Toxicology and Environmental Health soundtrack;en
Bombshells saga download;en
Go to the movie The Best of Pirates of the Mississippi;en
find Terminator 3: The Redemption, a picture ;en
find Bullet and a Target, a television show ;en
Find a book called The Polish Bride. ;en
Please find me the picture of The Getaway: Black Monday.;en
Where can I view the trailer Jeeves  Wooster in Perfect Nonsense ;en
Show me the  Playlist: The Very Best of Dolly Parton ;en
looking  Free Four: Tobias Tells the Divergent Knife-Throwing Scene ;en
Look for the High Noon TV show;en
There's a famous painting called Thursday, do you have an image of it?;en
Find the novel called Loyalty. ;en
Find the Love And War soundtrack;en
Look for Summer with Monika ;en
Find Ek Boond Ishq.;en
find me the book Filthy Lucre Live;en
Where can I listen to the song The Imposter? ;en
find Innocent world;en
Find a song called Magic in the Water. ;en
Look for the trailer to Hickory Daily Record. ;en
Look up The Stars Are Indifferent to Astronomy ;en
Look for Fighting Vipers 2 ;en
Find an album called Preminchi Choodu.;en
Where can I purchase the TV series The Royal Sessions;en
Find a TV series called White Bread Black Beer. ;en
find Starcross ;en
find At This Point in Time;en
Find a game called The Guyra Ghost Mystery. ;en
Look for the Nightmare on Providence Street saga;en
Show me the photograph A Woman from the Street;en
TV series for The Thirty Nine Steps? ;en
find the TV show When I Was a Boy ;en
I want to watch the television show New Astronomy ;en
Where can I buy a copy of the picture called Turn Against This Land?;en
Can you find the novel Stoneage Romeos ;en
Can you find the painting Shake! Otis at Monterey ;en
Show me the album Apache Axis2 ;en
Find a painting called Smash Crusher. ;en
Find a movie called Greatest Time of Year.;en
Pull up Mafia: The City of Lost Heaven ;en
Find a photograph called Midnight Mystery. ;en
Search for High Chicago;en
Look for Hail Satanas We Are The Black Legions ;en
play Baby Workout;en
Find the Hopeless Romantic photograph ;en
find Cut the Rope ;en
find Donkey Town, a show ;en
Can you pull up Channel M News;en
find the soundtrack titled This Side of Paradise ;en
play the video game The Sparrow;en
find the photograph Hearts Burst into Fire;en
Search for Another Cinderella Story;en
Look up the Fair Warning saga;en
Buy novel Brokeback Mountain;en
Look up The Making of Milwaukee;en
find Long Hello and Short Goodbye, a movie ;en
Find The Dressmaker.;en
show creativity of soundtrack IHeartRadio Countdown;en
show movie CrossGenesis;en
Show me The Heart Specialist;en
I'd like to see the movie Edinburgh Evening News ;en
Find the Innocent When You Dream saga;en
Look up Three Fantastic Dances ;en
Where can I listen to Willy and the Poor Boys;en
find a saga called The Life of Riley;en
Where to see painting Twelve Angry Men ;en
Find Resurrection of Evil. ;en
play Tales from the Organ Trade;en
show me a picture of Nokia Football Crazy ;en
When is Spyforce playing?;en
When was the TV show CrazySexyCool taken off air?;en
find Remedial Chaos Theory, a soundtrack;en
Look for Hail Satanas We Are The Black Legions;en
find The World Is a Game ;en
Show me Heavenly Sword;en
Show the Minutes to Midnight photograph;en
Find me the Balance and Timing book ;en
show creativity of Wild About Animals ;en
Find me the picture called Bugs Bunny Nips the Nips;en
find The Quest of Iranon ;en
I want to watch the television show Naked II;en
Search for The Adventures of Cookie & Cream;en
I am looking for the TV show called the Flight of the Lost Balloon;en
search for TV show Live at Apollo;en
find Home Fires ;en
Show The Lateness of the Hour;en
Find a photograph called Greatest Hits Volume One.;en
Can I see the show Heroes of Might & Magic 4?;en
Play me an album by Lunchbox ;en
find the painting Retro Active;en
Show me the Landing at Low Tide painting;en
Find the video game Journal of Criminal Law & Criminology.;en
Where can I get Fight for Anarchy ;en
Find Fragile Frontiers: The Secret History of Mumbai Terror Attacks.;en
When is the next episode  the TV series Crossing Lines showing? ;en
Can you find the trailer for The Young Martyr?;en
What channel does the television show The RoxBox  on? ;en
fimd Glory;en
Please search the Songs for the Deaf video game. ;en
show creative Labor Notes;en
Find a game called A Very Special Christmas 7. ;en
help me  the work Graphics Animation System for Professionals ;en
Look for All That Matters ;en
Please help me search The Banker television show. ;en
Where can I  the TV show of The School Teacher in the House ;en
Find Five Came Back for me;en
I want the song Phrazes for the Young;en
Find Business Ethics: A European Review. ;en
I need the game The ARIA Music Show;en
I want to watch Manthan ;en
play the Discografia de The Pretty Reckless saga ;en
Can you get me the Starcross saga? ;en
I'd like to watch the trailer for As Tears Go  ;en
Where do i purchase the book, Baby-Sittor? ;en
 me the picture called Bugs Bunny Nips the Nips ;en
I need a photograph of Days of Wine  Roses  Other TV Requests ;en
find the picture Nur mit Dir – A Walk to Remember;en
find a painting called The Other Bank ;en
Find The Tyrant ;en
Show me the song Spiderman of the Rings;en
Can you please find me, Journals? ;en
Is there any creative work for Heterocycles? ;en
Show me Live at the Kings Center;en
Where do get photograph of My Own Best Enemy ;en
I'd looking for the saga PlayCanvas.;en
Look up the Rock the Blind photograph ;en
find the game Selling Blue Elephants;en
Where to get album Justified;en
play the song S.F. sound furniture;en
find the song titled The Mole Show Live at the Roxy;en
Find a novel called Industry. ;en
find the movie Everywhere But Home ;en
Can you find the television show Manifesto of Nevermore;en
play Cry Baby Lane ;en
Where to get saga  A Brush with the Law ;en
I want to see the TV  Cause & Effect ;en
Please find me a novel called The Caledonian-Record.;en
find a photograph called XQuery API for Java;en
Show me the lowest price for the game Sinatra Reprise: The Very Good Years.;en
Can you find me the SchoolTool picture?;en
I'm looking for The Birth of a Nation;en
I want a photograph of Elizabeth the Queen ;en
Find Business Ethics: A European Review.;en
Find the book A Glorious Way to Die;en
Please look for Orion You Came  You Took All My Marbles ;en
play the song Red Lanta ;en
When and where is DistroWatch playing;en
find a soundtrack called The Book of Folly ;en
find a show called Big Broadcast of 1938 ;en
Can you find me the Restless Natives?;en
Show me the picture Batman: The Long Halloween;en
 Journal of the European Economic Association, a movie I want to see ;en
 the movie Don’t Break the Heart That Loves You ;en
search for Space on My Hands ;en
play Myth II: Soulblighter ;en
Find the Saison 7 de How I Met Your Mother show;en
Play the Food Uncut soundtrack;en
Please pull up Nothing Feels Good;en
Find a trailer called Storm Center. ;en
find the photograph Canaich;en
Find a photograph called Cold Weather.;en
 me a game called Merle Haggard Presents His 30th Album ;en
show Crafty Hands saga ;en
Pull up the trailer  2000 Years – The Millennium Concert ;en
show the creativity of saga The Dissociatives ;en
show creativity of Sing to the Dawn ;en
Can you help me find ScholarMate? ;en
Where can I see the show Kind of Glue?;en
Find The International Journal of Robotics Research soundtrack;en
I want to watch the television show Symphony  Solo Piano ;en
I want to play a game called Scotland Tonight.;en
play Bliss Torn from Emptiness ;en
is there a program about The Last Flight? ;en
Show me the Caribbean Blue television show;en
Play video game Manifesto of Nevermore;en
find the movie Take Another Picture;en
Show me the show Goldimouse and the Three Cats;en
find Cascading Waterfall;en
Find Changes: A Love Story. ;en
Find the App Store;en
 a novel called Best Hits Live: Save the Children Speed Live 2003 ;en
I'd like to find the book called The Years ;en
show me the Everybody Wants You picture ;en
Show me the movie Purple Heart Diary. ;en
 I see the the TV series The Late Music? ;en
find ArcIMS, a picture ;en
I want the photograph of Walt Before Mickey;en
Where can I find the creative works The Very Best of Simply Red;en
find a soundtrack called The Book of Folly;en
show creative game Fear Thy Neighbor;en
Can you pull up the American  Awards of 1975 ;en
Find a video game called Young.;en
I need to  the creative work Burn Baby Burn ;en
Look for the Chu Chu and the Philly Flash picture;en
show creativity of Doomsday Comfort ;en
I'd like to see the saga 12 Soulful Nights of Christmas;en
Show the Feed the Kitty painting ;en
Play me the song Aap To Aise Na The.;en
Play me the trailer for Star Control. ;en
Show the Day the Earth Caught Fire movie;en
find Reproductions: Songs of The Human League ;en
find the novel Make Peace Not War;en
find the They Came from Somewhere Else saga;en
find the movie Chaos Is Me;en
Find The Black Girl in Search of God trailer ;en
Find The Coffin. ;en
play the song Culture and Psychology ;en
find The Covered Wagon, a game;en
Find me the video game For Your Love.;en
Find Beavis and Butt-head ;en
show creativity of Diamonds in the Rough ;en
 me the book with the title of The Rainwater LP ;en
show Get It Together on TV show;en
find Something Crucial, a book;en
Show me Skyfall: Original Motion Picture Soundtrack  ;en
Play me the song Aap To Aise Na The. ;en
I'd like to see Completely Well;en
find Bump Off Lover ;en
Where can I locate the  The Return of Mr. Moto ;en
Looking  video game  Those Who Would Walk with the Gods ;en
Want to see the Dungeons & Dragons: Chronicles of Mystara;en
show TV show named I Fell  Love with a Dead Boy ;en
Where can I find the movie The National Law Review;en
I need Journal of Pediatric Oncology Nursing, help me  ;en
Where can I find Lonely Hearts ;en
play the song Memories Are My Only Witness ;en
Find the Burn the Sky Down album;en
Where can I find Police Story 3: Supercop ;en
find Love Will Tear Us Apart, a photograph ;en
Where to buy Unarchigal;en
Find The 180. ;en
Wish to  the work The Immortals that is a show ;en
find 300: March to Glory, a song;en
Find the Envoy of Lucifer show;en
I'm looking for Dead at 21, the TV series;en
Please help me find the Selections from the Arista Years video game.;en
show movie The Skeptic – Das teuflische Haus;en
play the video game The Sparrow ;en
Where can I  the photograph of A Christmas Memory ;en
I want to see the trailer  Australian Economic History Review ;en
find Cascading Waterfall ;en
Get me Kiss the Crystal Flake;en
Play The Aviation Cocktail album;en
Please get me the Crime  Punishment in Suburbia trailer. ;en
Search for To Heart 2 ;en
I want to watch the movie Godslayer ;en
Search for Man in a Garage;en
Where can I buy the soundtrack Bridge of Souls;en
find a game called Gladiators Australian Series 1;en
find the book The Crowd Roars;en
find the game Endangered Species;en
Show The drive of life album;en
I'd like to see the The Gathering Storm  series ;en
Find me the television show A City Sleeps ;en
find the novel The Thunder Rolls;en
Please find the movie, A Jingle with Jillian. ;en
find the So This Is Goodbye saga ;en
What is A Romance of the Halifax Disaster;en
