expression;language
I would give Sentenced to Prism a rating of zero  a best rating of 6 ;en
Rate The Crossroads 4 of 6 stars;en
Rate The Starship Trap 5 stars ;en
Rate The Compleat Housewife saga zero of 6;en
Rate current essay a zero;en
I am giving this current novel 4 out of 6 stars;en
give 5 out of 6 to this album;en
Rate DNA Repair and Mutagenesis four stars ;en
I would  this novel a 5 and a best rating of 6 ;en
rate the current novel zero points ;en
Give this book chronicle four stars;en
rate The Breaking Point a three;en
Rate this textbook a zero ;en
rate the current album 2 points out of 6;en
Rate The Bishop a 1 ;en
Rate this book five of 6 points;en
Rate the current novel 5 of 6;en
rate the book Dies the Fire one points;en
rate the bok series Preparedness 101: Zombie Apocalypse two for 6 stars;en
Give 3 / 6  to The Simon & Schuster Encyclopedia of Dinosaurs and Prehistoric Creatures ;en
I'd like to give a rating of 4 to this  book. ;en
I give Out of Sync  out of 6 points. ;en
Rate this essay 3 of 6 points;en
give zero out of 6 points to Marxism  the Oppression of Women ;en
Rate What Is Called Thinking? 0 stars ;en
Rate this essay a two out of 6;en
I give four stars to this chronicle. ;en
give two out of 6 to A Christmas Carol ;en
rate current textbook 0;en
give 1 out of 6 points to this novel;en
rate this book a five. ;en
rate this album one out of 6;en
rate the book Whit a zero;en
Give this novel 5 stars ;en
rate the current series a zero ;en
Rate this textbook 1 stars ;en
Rate the current essay four out of 6.;en
give this textbook zero out of 6 points ;en
Rate the current album a four ;en
Contemporary Religious Satanism gets a rating of 3. ;en
I give The Vinyl Cafe Notebooks a 0  6 ;en
give 3 star to this essay ;en
rate my current novel four out of 6 stars ;en
For the book The Flash: Stop Motion I give a rating of 5  ;en
give 4 out of 6 stars to this textbook;en
The Mad Scientist Hall of Fame gets only a two out of 6;en
Give the current album 2 out of 6 points. ;en
rate this textbook 5 out of 6;en
 The Life and Loves of a She-Devil two stars ;en
give five stars to The Songlines ;en
 The Braindead Megaphone series zero out of 6 points ;en
this saga is definitely worth 4 stars.;en
give 0 out of 6 stars to this album;en
I want to give this novel a four out of 6  ;en
Rate Blood and Gold saga 0 points;en
give four stars to current novel ;en
Rate the current album 3 points ;en
rate The Princess Mouse: A Tale of Finland one of 6;en
I think that this novel should get 2 points and a rating of 6;en
Rate this novel one of 6;en
Rate the current book 5 of 6 points;en
 The Pure Weight of the Heart series 5 points ;en
give zero out of 6 points to Mr American ;en
Rate Myths of the Near Future three points;en
The Last Hawk gets a total of 3 out of 6  from me ;en
I think the  album should get a four out of 6 rating. ;en
rate current saga one point out of 6;en
Rate this novel 1 of 6 ;en
rate the book chronicle The Obama Nation a 4 ;en
I would rate The Spoiler 0 stars ;en
Rate A Faint Cold Fear 0 points ;en
Rate the At the Villa Rose series 3 of 6;en
give The God Machine two of 6 points;en
I want to rate the Children of This Earth chronicle a rating value of 1 and a best rating of 6;en
rate The Pig Scrolls one of 6 points ;en
Give zero / 6 stars to this album ;en
Rate The Book of Three a five;en
I give The Penalty three stars ;en
give four points to current essay ;en
give 1 star to this album;en
Rate The Reader is Warned four out of 6 points;en
give 4 points to Fight Club;en
I want to give Rebbe: The Life  Teachings of Menachem M. Schneerson, the Most Influential Rabbi in Modern History two out of 6  ;en
Give the current chronicle a three.;en
rate the current saga 4 of 6 ;en
Give this textbook 5 points ;en
Rate this textbook five points ;en
rate Until I Find You four points;en
For the book Icon of Evil I  a 2 ;en
Rate the current essay 0 of 6;en
Give The Lost World 2 points ;en
Rate this textbook 5 stars out of 6 ;en
rate this book titled The Clue in the Old Album one out of 6 stars;en
I'd say Life in the Iron Mills was a  ;en
I would give Bones of the Earth 2 points;en
Give 3 / 6 stars to The Simon & Schuster Encyclopedia of Dinosaurs and Prehistoric Creatures;en
rate Goodbye, Mr. Chips one stars;en
rate The Stone Key a 5 ;en
Rate Sandworms of Dune three out of 6 stars;en
I rate three points for the book The Early Coorgs;en
I am giving Fifty Years a Hunter  Trapper a 1 rating. ;en
Please rate the current textbook 2 stars ;en
Give The Neon Bible three stars / 6;en
I think the Dictionary of New Zealand Biography deserves 2  ;en
rate the current chronicle a zero ;en
give this textbook a five ;en
rat the  textbook a two out of 6 points ;en
rate the current saga one stars ;en
rate this essay four out of 6 ;en
Rate The Anatomy of Melancholy 1 stars;en
I rate this textbook 0;en
I rate Wideacre five of a possiable 6 ;en
I want to give The First Person and Other Stories 0 out of 6 stars;en
Rate The Making of a Teacher a two ;en
Rate this current essay three out of 6 stars;en
rate the current chronicle a five ;en
give two stars to current album;en
Rate Incomplete Nature three of 6 stars;en
Rate this album zero stars ;en
rate the current chronicle five stars ;en
Add the rating for this current series a four out of 6 points;en
rate the current novel two points out of 6;en
Rate this book a four.;en
Rate From a Buick 8 0 out of 6 ;en
rate How to Eat Fried Worms two stars ;en
Give Bruce Lee: The Man Only I Knew 5 points.;en
Rate the current series a one ;en
give a 5 to A Picture of Her Tombstone;en
give The Story of the Last Thought a five;en
Give this album 2 / 6.;en
give 1 stars to book Mr Ponsonby ;en
Rate this book 3 of 6 points;en
The  novel I'm reading gets only a one out of 6. ;en
Rate this essay two out of 6 stars ;en
give the current book zero of 6 ;en
 The Travels of Lao Can five out of 6 ;en
rate this novel two out of 6 ;en
rate The Ape-Man Within 4 ;en
Blood Colony was awful, I'd give it one stars at most.;en
Please  Think Like a Freak 3 points out of 6. ;en
rate this book 3 stars ;en
I am giving this  book album 0 out of 6 stars ;en
I give this book five stars out of 6;en
Give this textbook one stars out of 6;en
Rate The Purcell Papers two out of 6 stars ;en
I give the current book two out of 6;en
rate this album one stars ;en
I give the Knife  Dreams saga a 0  6 ;en
I would give this novel a rating of two;en
Rate The Young Elites series 1 of 6 points;en
I rate this novel 5 of 6 ;en
rate this essay four stars;en
rate this with zero points for the saga called A Good Recovery out of 6;en
Rate this album two out of 6 stars;en
I give The Elegant Universe five out of 6  ;en
rate The Stone Key a 5;en
Rate Company for Gertrude 4 of 6;en
one stars for the following album ;en
Rate The Art of Struggle 3;en
I want to give the current textbook 0 out of 6 stars;en
Rate this textbook only three points ;en
I want to give this textbook 3 out of 6  ;en
Rate 3 out of 6 points to Darkworld Detective;en
The current textbook gets a 2 rating. ;en
rate Mandela: The Authorised Biography a one;en
Rate the Beyond This Place chronicle three of 6 ;en
Cock-A-Doodle-Doo! was awful. I'm giving it a 0 out  6. ;en
Give four  out of 6 to Practice to Deceive ;en
Rate Lord of the World a value of 4 ;en
I gave the current chronicle a 3 of 6 ;en
I liked Ports  Call, I'd give it a 5 out  6. ;en
I want to give the current album 2 stars;en
give 4 out of 6 stars to this textbook ;en
give zero out of 6 points to Marxism and the Oppression of Women;en
I give this book a 5.;en
rate the current essay one out of 6 ;en
Rate the current novel a zero. ;en
 this series titled Adolf Hitler: My Part in His Downfall two stars ;en
The Comics We Loved gets 1 out of 6  ;en
rate this textbook a four;en
I give The English Spy a rating of 1 and a best rating of 6;en
Out of 6, I give the following book zero. ;en
I would give this textbook a rating of 0  a best rating of 6 ;en
Give this book 1 stars. ;en
show me a textbook with a rating of 2 and a maximum rating of 6 that is current;en
Give this textbook 5 points;en
I want to give this novel zero;en
Rate this saga two out of 6 points;en
I rate this essay a two of 6 points;en
Rate the current essay 4 stars;en
Give the Televised Morality series a one.;en
Rate the current textbook 2 stars;en
rate this novel 4 out of 6;en
I give this textbook a 5 ;en
Swine Not? deserves four points ;en
Can I rate the book My Life in France not one, but 6 stars?;en
Rate Wolves Eat Dogs 5 out of 6 points;en
Please rate the current textbook 2 stars;en
give zero points to High Profile ;en
I want to give the following essay five points out of 6;en
Rate The Empty Throne a 4;en
the next book is worth two;en
I'd rate this novel at 2 points ;en
Give the current book 0 points.;en
give 0 out of 6 points to current textbook ;en
Rate Real World four out of 6 ;en
Out of 6, I give the following book zero.;en
I'd give the current essay a four;en
I want to give this textbook 3 out of 6 points;en
I would  this book a value of 3 and a best rating of 6 ;en
rate the book Oath of Swords three for 6 ;en
I give Cross Country four out of 6. ;en
Rate this chronicle 0;en
this textbook rates a 4 of 6. ;en
give zero out of 6 stars to Smart Girls Get What They Want book;en
For the current essay I rate 1 out of 6;en
I give the Ways of Escape  zero out of 6 ;en
Rate And No More Shall We Part chronicle 4;en
Rate Decoding Reality 0 points;en
I am giving the book After Henry a rating of 0 out of 6 stars;en
Rate The Scarab Murder Case a one;en
Warriors of Legend gets a 3 out of 6;en
Rate the current essay 5 of 6 points;en
For this novel I give a rating of 4 out of 6;en
For the current saga I rate 2 of 6 stars;en
I give the previous series four stars.;en
give zero points to this essay ;en
Rate this textbook 3 of 6 ;en
Rate the current novel a 3. ;en
rate The British Edda zero points ;en
rate this album 2 points;en
Rate this textbook 2 stars out of 6;en
Rate The Principle of Hope 1 out of 6 stars;en
I would give Half a Life 3 out of 6;en
Rate this book four stars out of 6;en
Rate Shadow of Night a 1 ;en
I give the previous album a 4.;en
give 0 out  6 to War  the Spider Queen saga ;en
give Heartland chronicle four points ;en
I think The Turbulent Term of Tyke Tiler is a rating of 3.;en
A novel of this quality deserves your rating of four  ;en
Mars Probes gets a 1 rating. ;en
I'd like to  the book White Dawns at zero of 6 stars. ;en
i give the following textbook three points;en
Give The Dark Abode chronicle 2 out of 6 points.;en
give one to this novel ;en
give this novel 3 of 6 ;en
rate The Pagan Christ zero points out of 6 ;en
I think Memorial Day should have a rating value of 3 and a best rating of 6;en
The boring Peace  Earth gets a two out of 6. ;en
Rate Cotton Comes to Harlem a 2 ;en
Rate The Country Blues 3 out of 6 stars ;en
The Private Patient gets a rating of 5 ;en
rate this novel 0 of 6 stars ;en
Rate my current novel 3 out of 6 ;en
Give The Resistance 2 out of 6 stars.;en
Give The Pirates of Manhattan a 1 ;en
rate Break No Bones series a 1 of 6;en
rate this novel 4 out of 6 ;en
Rate my current essay zero out of 6;en
rate The Fairy Caravan 5 of 6 stars;en
I am rating this book 5 out 6 points ;en
this saga deserves a score of four ;en
Give this book four stars as a rating review.;en
The previous essay gets 0 out of 6 possible stars;en
I rate Vivian Grey three. ;en
I would give French Poets  Novelists a best rating of 6  a value of three ;en
give 1 out of 6 to West of January;en
I would give this textbook a rating of 0 and a best rating of 6;en
I give the rating of 1 of 6  for this novel ;en
I'm rating the book Tomorrow two out of 6  ;en
rate Varney the Vampire with 1 points;en
I would give the Living Dead in Dallas chronicle zero points;en
I give Christianity not Mysterious 1 out of 6 points.;en
Rate The Autobiography of Alice B. Toklas 1 out of 6 stars;en
give four stars to current novel;en
I give a 4 to 3 Willows: The Sisterhood Grows.;en
I giv the current novel a four;en
 The Simon & Schuster Encyclopedia of Dinosaurs and Prehistoric Creatures 0 points. ;en
Give the current essay 5 out of 6 points.;en
I'd give The Jewel in the Crown saga four of 6  ;en
rate this series titled Adolf Hitler: My Part in His Downfall two stars;en
rate this book 5 stars out of 6;en
rate the current essay a four ;en
rate Eleanor Rigby a 3;en
Please give 1 points to Waiting for the Mahatma. ;en
I would  The Codebreakers a rating of 6 and a value of 2 ;en
Give this essay one star out of 6;en
rate this current book a 4 out of 6 ;en
I give Hadon of Ancient Opar two out of 6 points;en
give zero point to this textbook ;en
I'd give the current essay five points;en
I would give Superman: Doomsday & Beyond four  and a best rating of 6 ;en
rate Cock and Bull 5 of 6 points;en
I give The Screaming Staircase a five. ;en
Give this series three points out of 6. ;en
rate this book 3 stars;en
Rate this book 0 points out of 6 ;en
Rate Small Screen, Big Picture a 0 out of 6.;en
give four out of 6 points to this essay ;en
I give One Clear Call zero out of 6 points;en
rate the book The Scorpio Illusion a 4 ;en
I give this current novel 0 points ;en
I rate the book Time and Stars  two points;en
Give the  book im reading zero points out of 6. ;en
Rate this textbook 2 out of 6;en
The book History by Contract is rated five  in my opinion. ;en
give Portions  a Wine-stained Notebook: Short Stories and Essays 0 points ;en
Give the current novel four points.;en
Rate the current novel two points;en
rate The Brothers Karamazov a four ;en
 Alfred Kropp: The Thirteenth Skull 3 out of 6 ;en
Rate the current novel 5 of 6 points;en
Rate this album a one. ;en
I  rating this book titled The Billion Dollar Ransom 3 stars. ;en
 Heath Ledger: His Beautiful Life and Mysterious Death 1 stars ;en
Rate the current textbook 3 of 6 stars;en
I would rate the Animal Liberation chronicle 0 points and a best rating of 6;en
mark The Final Battle score two out of 6 ;en
Rate the current album 4 of 6 stars;en
I'd give The Day of Reckoning four points ;en
Give the current album on my playlist a rating of three.;en
rate Lost Empires of Faerûn five of 6 stars;en
Rate the Apocalisse saga one out of 6 points ;en
rating  for Castles of Steel out of 6 are 5 ;en
Rate this textbook four points ;en
Rate this saga 0 stars ;en
Give The Toynbee Convector four of 6 ;en
I want to  the saga The Italian two to 6 points. ;en
I would give The Case of the Late Pig a best rating of 6 and a five for value;en
Rate this album 4 points ;en
Rate The War of the Roses 2 out of 6;en
I want to  Pontypool Changes Everything a zero out of 6 points ;en
I would rate this album 3 stars ;en
I'm rating The Skystone with three points ;en
this book gets a 1 out of 6 rating  me. ;en
Rate Illness as Metaphor 5 of 6 ;en
I give The Logic of Sense a zero ;en
rate the current textbook 3 out of 6 ;en
I want to give The First Person and Other Stories 0 out of 6  ;en
rate Awaiting Strange Gods: Weird and Lovecraftian Fictions a 1;en
I want to give Science Fiction Adventures in Mutation 0 stars;en
Give this chronicle 4 stars. ;en
Rate To Live and Die in L.A. a four out of 6.;en
rate this essay a two ;en
rate the current chronicle 0 of 6 stars ;en
Rate this novel a 4;en
rate Quantum Theology one out of 6 ;en
Rate A Taste of Blackberries a three ;en
rate Getting It Wrong from the Beginning a value of 4;en
I give a rating of 4 out of 6 for the book My Sister and I;en
this book gets points for being current and a three;en
I give The Cat and the King 2 stars. ;en
Rate this series one out of 6.;en
Out of a possiable 6 I give Jip, His Story a 0;en
Give Modern Glamour: The Art of Unexpected Style three out of 6  ;en
I'd rate this novel a five;en
I would like to rate this album 3 points and a best rating of 6;en
Rate this chronicle 0 stars;en
rate The Odd Angry Shot five points ;en
Rate A Conspiracy of Paper  4 of 6;en
Give the current textbook 2 of 6 ;en
I give The Spirit of St. Louis a 1 ;en
the stars for this are 4 for a textbook ;en
rate The Descendants two points ;en
I  the chronicle, Son of the Tree with four of 6 points. ;en
This  album deserve 0 points and a best rating of 6 ;en
four out of 6 stars for the previous essay ;en
give five out of 6 points to this album ;en
rate Of Old Hearts and Swords a 0 ;en
Give The Spirit House a 4 out of 6 ;en
rate Beaver Towers five out of 6 stars ;en
I am giving Dead Souls a five rating ;en
Rate The Hard Life 0 stars ;en
Give this novel two out of 6 stars ;en
Assign three  out of 6 to The Dune Encyclopedia ;en
Rate Wielding a Red Sword 0 stars ;en
I want to give Gay Male Pornography: An Issue of Sex Discrimination a 1 ;en
I want to give Think Like a Freak one stars;en
rate The Confidence-Man 3 points ;en
Rate Merlin Effect a 0 ;en
Rate this novel one out of 6 stars ;en
I want to give this book three out of 6 stars;en
For the book Tale of the Toa I give five points ;en
Rate the current essay 5 stars ;en
Rate Wielding a Red Sword 0 stars;en
The current essay feels like a 3. ;en
 the saga Rides a Dread Legion zero out of 6 points. ;en
Rate Equal Affections one points ;en
Give Setting Free the Bears series a four out of 6  rating. ;en
Rate this book 3 of 6 ;en
Rate this album 3 stars;en
Give this chronicle a 4;en
I would give this current textbook a rating of 1 points and a best rating of 6;en
rate the series The Quantity Theory of Insanity 1;en
I want to give The Plague Lords of Ruel 0 stars;en
rate Orion in the Dying Time four stars;en
Give the current novel a rating of 5 out of 6.;en
rate The Gutting of Couffignal one points ;en
Rate Eight Days of Luke a five. ;en
My Idea of Fun is a book that should get 2 stars.;en
Evolution and the Theory of Games gets a  out of 6. ;en
Rate this book 3 out of 6 points ;en
 A Battle of Nerves three stars out of 6 ;en
Give this chronicle a 4 ;en
give The Last Child 4 of 6;en
The current essay is worthy only of a 0 out 6 score. ;en
Rate The Summer Job 5 stars ;en
the stars total 6 but Journey Under the Midnight Sun gets a four;en
Make this essay two out 6 stars;en
Rate the current novel five of 6;en
I give a rating of four to this textbook. ;en
rate the current album 2 out of 6;en
I give this series a value of one  a best rating of 6 ;en
rate the current novel two points out of 6 ;en
I would give The Lady of the Rivers 0  ;en
Rate this novel four stars ;en
Rate The Natural a 4;en
Rate this novel 3 out of 6 points.;en
I give this  Dictionary of the English Language a 4 rating ;en
I feel like this essay deserves four stars ;en
Rate this textbook 1 stars;en
I  Egg Collecting and Bird Life of Australia a zero out of 6 points ;en
I give 0 points to the book The Eleventh Hour;en
Rate the current novel 1 of 6 ;en
give this a 0 for this book;en
the following essay is worth four out 6;en
Rate The Courtship of Princess Leia saga a two;en
For Adaptive Coloration in Animals I give 4 points ;en
I am giving this current essay zero out of 6 stars;en
The  saga only gets three points out of 6. ;en
Give the current textbook 2 of 6;en
rate The Brothers Karamazov a four;en
Rate People of the Lakes 2 of 6;en
I want to give the chronicle Zombie Bums from Uranus 3 points;en
rate this current textbook 0 points ;en
I would give this  novel a value of 3 and a rating of 6 ;en
I would rate this textbook 5 points and a rating value of 6;en
four out of 6 stars for Special Assignments ;en
Rate this album  zero stars;en
give 2 out of 6 stars to current chronicle;en
I give this  novel zero stars and a best rating of 6 ;en
I give The Caxtons chronicle 1 out of 6 stars.;en
give five points to current textbook;en
give a 1 to A Thousand Lies;en
I give The History of the Saracens a three, or 6 points;en
rate The Crossing 3 of 6;en
rate the current album two out of 6;en
give zero points to current album;en
Rate the current book 1 of 6 points ;en
 this book called Kings of the High Frontier four points ;en
Rate the current textbook one stars ;en
Give the current album a 2 ;en
This current book deserves 3 points;en
rate American Tabloid a 0;en
Please rate the current album 4 stars. ;en
give 5 out of 6 to this book;en
using stars the current object gets four for the textbook out of 6;en
Please rate The Lightning of August five points.;en
the current saga gets 0 out of 6 ;en
I rate Shadow of Suribachi at five stars.;en
give one out of 6 points to this essay ;en
give four star to current novel;en
Give this novel 5 stars ;en
give 1 stars to book Mr Ponsonby;en
Rate my current novel one out of 6 points;en
 The Man from the USSR and Other Plays a 0 ;en
 The Princess Mouse: A Tale of Finland one of 6 ;en
rate the next essay five of 6;en
Rate this current novel 5 points;en
 the Broke: Who Killed the Middle Classes? chronicle a five ;en
give 5 star to the book The Knight of Newts;en
I am giving this current album a rating of four out of 6 points;en
Rate the My Beloved World saga a one ;en
A novel of this quality deserves your rating of four points;en
rate The Detective a 3 out of 6;en
can i give the book The Saga of Seven Suns a four out of 6  ;en
this series gets 2 out of 6 stars;en
Rate this essay a four ;en
 The Long Dark Tea-Time of the Soul 5 stars ;en
 The Documents in the Case series two of 6 ;en
Give this book 2 out of 6 stars.;en
I would rate this chronicle 4 stars;en
Rate the current textbook a 4 ;en
The current series deserves three stars. ;en
For the  essay I give a total of 1 stars ;en
rate Winnie-the-Pooh four out of 6 ;en
Give Physics of the Impossible four points. ;en
Rate Incomplete Nature three of 6 stars ;en
The A Mighty Fortress series should  rated a two ;en
give The Englishman of the Bones 2  out of 6. ;en
I want to give The Garin Death Ray series 1  ;en
Rate Pillar of Fire and Other Plays a three;en
Season of the Witch: How the Occult Saved Rock and Roll gets  points ;en
This  book should get four stars or a rating of 6 ;en
For this book I rate four points ;en
I give the next textbook a 2.;en
I'd rate this essay 1 out of 6;en
Give The Resistance 2 out of 6 stars. ;en
I want to give this novel a four out of 6 stars;en
For The Curious Incident of the Dog in the Nightdress I rate it 2 of 6 points;en
I would rate this essay 2 stars and a best rating of 6;en
Rate Adventures in Stationery saga 5 stars;en
rate the current book two of 6 stars ;en
give 2 stars to Mulligan Stew series ;en
 Idea of Fun is a book that should get 2 stars. ;en
The Cool World gets 4 points;en
Rate the current textbook 4 of 6;en
Rate the current novel a 0 out of 6 points;en
I only give Blood Work two stars ;en
This current book should get four stars or a rating of 6;en
Rate this novel 4 out of 6 ;en
I rate this essay 5 of 6 points;en
rate the current album 5 points ;en
I think that The Wizard is a four  6. ;en
I think the current album should get a four out of 6 rating. ;en
I give The Homo Handbook saga 3 of 6 stars;en
Give Beauty Is in the Street three out of 6 stars;en
 Encyclopaedia of the Social Sciences zero out of 6 ;en
I give The Thibaults a 1. ;en
Give this album three out of 6 points ;en
Evolution and the Theory of Games gets a five out of 6.;en
Rate this chronicle one of 6 points ;en
This current textbook should have a rating value of two and a best rating of 6;en
rate this chronicle two points;en
rate the saga In Mortal Hands five out of 6 stars;en
give 3 star to this essay;en
give this current novel a three ;en
Rate this current novel one points ;en
I rate American History: A Survey a 5 ;en
give 5 out of 6  to Racing the Rain ;en
give 4 out of 6 stars to this textbook ;en
Give the current textbook 5 / 6 points ;en
I rate this textbook 0 ;en
I think that this book deserves a 3 ;en
Give The Body Artist a 5.;en
this horrible essay gets zero out of 6 stars ;en
I give this next  zero out of 6 points ;en
Rate the current essay four out of 6. ;en
I want to give this current novel 4 points;en
Rate this essay with three of 6.;en
I give the previous album a zero. ;en
The Complex: How the Military Invades Our Everyday Lives has a best rating of 6 stars but I will give it zero;en
rate this novel a 4 ;en
I would give this current novel 4 points ;en
rate the current album 5 out of 6 points ;en
Give this album 2 / 6. ;en
give five out of 6 stars to The Arrows of Hercules;en
give 3 out of 6 series of The Africa House;en
4 stars for Three to Get Deadly ;en
Rate the current novel a two ;en
out of 6  this a zero for Memories of the Ford Administration ;en
Rate this album three out of 6 ;en
rate The Wimpy Kid Movie Diary  saga 4 out of 6;en
rate this current novel a 3;en
I think this novel should get 0 stars;en
The book History of Shit should be rated 2 out of 6.;en
I wish to  zero points out of 6 to The Crack in Space. ;en
I give The French Suicide 5 stars ;en
Give the current book a one out of 6. ;en
Give the current album a four. ;en
rate the current saga a 4;en
I want to give A Mortal Flower a two;en
I give the Budayeen Nights saga five out of 6 points.;en
give 2 out of 6 stars to current chronicle ;en
give five star to The Second Angel series;en
rate the current essay with 4 points ;en
one stars for the following album;en
0 stars for this current saga;en
Rate this novel 5 of 6 ;en
I want to give Select Conversations with an Uncle 5  ;en
Give the current album a three.;en
rate Goodbye, Mr. Chips one stars ;en
give one out of 6  to The Psychopathic God series ;en
