expression;language
I want to give Select Conversations with an Uncle 5 stars;en
rate the last saga 3;en
Rate the current book three out of 6. ;en
I give The Screaming Staircase a five.;en
rate the Broke: Who Killed the Middle Classes? chronicle a five;en
Rate this book a zero;en
give this book one star out of 6 stars;en
Rate The First Death 1 stars;en
rate this novel a two;en
Rate this album 0 points out of 6;en
the horrible  essay gets only a 0 out of 6 ;en
Rate Dixie Lullaby: A Story of Music, Race and New Beginnings in a New South five out of 6 points;en
I am giving this novel 3 stars;en
Rate this essay a 3;en
Rate The Removers 4 out of 6;en
Give Northern Lights Audio 5 / 6 points ;en
Rate this book a five ;en
Give this novel four out of 6 stars.;en
give Life: A Natural History of the First Four Billion Years of Life on Earth 1 points out of 6;en
I give the current book two out of 6 ;en
The Latham Diaries deserves a rating value of 0  a best rating of 6 ;en
4 points for Four Upbuilding Discourses, 1844 ;en
I would rate this album a 3;en
I'm rating The Skystone with three points;en
Rate the current book five of 6 stars;en
I would give this novel four stars;en
rate the current textbook 4 of 6 points;en
out of 6 The Black Unicorn rates points of 2;en
 the Black Coffee chronicle three out of 6 stars ;en
I give this current textbook five stars ;en
give this textbook a rating of 3;en
rate The Race a two ;en
Rate this current essay four out of 6. ;en
Rate Cotton Comes to Harlem a 2;en
Please provide the Rainbow Mars series a  out of 6 points. ;en
Rat Short Trips: A Christmas Treasury a 3;en
Rate this essay 4 of 6 stars ;en
Rate The Empty Throne a 4 ;en
Give this textbook a four;en
I'm giving this book series four points;en
I want to give this textbook four out  6 ;en
I give The Elegant Universe five out of 6 stars;en
rate this textbook two out of 6 points;en
Rate the current essay four stars;en
I want to give this book zero;en
I want to give the current album 2 stars ;en
For this series I give the rating of four of 6 stars;en
my rating for Some Doves and Pythons is four ;en
Rate the Sacred Fire series 5 points;en
give Death on the Nile a three;en
give the following essay one stars;en
I want to  The Obama Syndrome zero of 6 ;en
Give The Neon Bible three stars / 6 ;en
I'd rate Glaring Through Oblivion a zero of 6 ;en
Rate Pillar of Fire and Other Plays a three ;en
Rate this textbook a 1 ;en
Rate Political Liberalism 1 out 6 stars;en
Rate my current essay a 2 ;en
The Latham Diaries deserves a rating value of 0 and a best rating of 6;en
Give the book Buzz about Bees a 2 star rating out of 6.;en
Rate my current book four points out of 6 ;en
this album deserves a 0 of 6 possible ;en
I would rate this essay four stars;en
Rate In Search of Our Origins two points out of 6.;en
I'd give The Mystery of the 99 Steps three stars out of 6;en
Contemporary Religious Satanism gets a 3 rating. ;en
Rate this book 0 of 6 points;en
rate this chronicle a 0;en
rate the book Magic: History, Theory and Practice five stars;en
Give one out of 6  to The Shiva Option ;en
Give The Abstinence Teacher 4 out of 6;en
Rate The Woven Path one stars ;en
Rate my current essay 1 out of 6 stars;en
give two stars to current album ;en
Give 2 out of 6  to the following textbook. ;en
Rate 12 Great Classics of Science Fiction zero out of 6 points;en
give the  album a score of five out of 6 ;en
give 4 points to this novel ;en
I want to rate The Turbulent Term of Tyke Tiler a 3;en
Give A Kentucky Cardinal four points ;en
Rate the current saga four stars out of 6 ;en
Rate the Apocalisse saga one out of 6 points;en
Rate Tropic of Capricorn two stars;en
I give The Road from Elephant Pass four stars;en
give 1 out of 6 points to Revolution World ;en
rate Doctor No one of 6 ;en
the series City on Fire is a four ;en
I would give this  novel two points or a rating of 6 ;en
give one rank to this album ;en
give 4 points to this textbook ;en
I give The Beatrice Letters 2 out  6 stars. ;en
rate Gray Mountain a zero ;en
A Writing Kind of Day deserves three points and a best rating of 6;en
give 5 rating for this textbook ;en
Give this novel two out of 6 stars;en
Rate my current album 3 stars ;en
Rate The Firebrand one of 6 stars;en
I give this  book four stars and a rating of 6 ;en
the current book I'm reading should be rated zero out of 6;en
Give the current chronicle 2 stars. ;en
This current essay deserves 0 stars ;en
I  a 4 to 3 Willows: The Sisterhood Grows. ;en
This current essay deserves only a three rating;en
give 1 points to current textbook;en
give five stars to The General saga ;en
 the book Pimpernel and Rosemary 1 out of 6 ;en
The Mystery  the Brass Bound Trunk deserves only a 1 star rating. ;en
Rate the current novel one points ;en
give two stars to current chronicle ;en
rate the current chronicle series 4 out of 6 points;en
Rate the current novel a zero.;en
I rate the chronicle, Son of the Tree with four of 6 points.;en
Give The Snows of Kilimanjaro 3 stars.;en
I rate the current textbook a 1 out of 6.;en
give this textbook zero out of 6 points;en
Rate this chronicle a 3;en
Give the chronicle Fathers and Crows a 5 out of 6.;en
For The Curious Incident of the Dog in the Nightdress I  it 2 of 6 points ;en
rate the previous essay 1 of 6 stars;en
rate this current book album four stars;en
give three out of 6 points to this album ;en
rate this essay zero of 6 points ;en
 points for Birds of South Asia. The Ripley Guide ;en
give this album three out of 6 points;en
Rate The Plot to Save Socrates one stars ;en
I give zero points to this chronicle ;en
give four out of 6 points to this essay;en
give two star to As Long as We Both Shall Live book;en
I want to give this book three out of 6  ;en
put a rating on this book of three ;en
I rate Secret Water as a 4. ;en
Give two stars to Scribblings ;en
I would  Eater of Wasps a value of zero and a best rating of 6 ;en
I  giving Finding Chandra a 2 out of 6 rating ;en
I would give French Poets and Novelists a best rating of 6 and a value of three;en
rate the current book zero of 6 points;en
Out of a possible 6 stars, I give The Princes  The Treasure a five. ;en
rate this textbook 0 stars ;en
rate The White Goddess 2 of 6;en
rate the current album one points ;en
I would  The Door to December 3 points and a best rating of 6 ;en
Rate the current novel 5 of 6 points ;en
rate the current novel five out of 6 stars;en
I think this textbook should have a rating of four and a best rating of 6;en
I think that this novel should get 2 points  a rating of 6 ;en
the current saga gets 0 out of 6;en
I want to give this essay zero out of 6;en
Rate the current novel 3 points.;en
this textbook only gets two out of 6 stars;en
give 5 points to The Deathlord of Ixia;en
give five points to current textbook ;en
I'd  the chronicle called The Art of Loving 3 points out of 6 ;en
rate this textbook a one ;en
Give this essay one star out of 6 ;en
Rate Dead Boys a 0 ;en
Give Home from the Hill a 3 ;en
I would rate The Persistence of Vision 1 stars and a best rating of 6;en
rate the book Dreams of the Raven 5 stars;en
Rate Richard Carvel 4 out of 6 ;en
I rate The Mathematical Magpie chronicle a 0 of 6;en
I am giving Finding Chandra a 2 out of 6 rating;en
give 0 out of 6 points to this album ;en
The Coming Insurrection should get a rating of 1 ;en
Rate Body of Secrets one stars ;en
Rate this book 0 of 6 points ;en
Rate the current novel a 1 ;en
Rate the Ninth Key 3 of 6 points;en
 Witchcraft and Paganism in Australia 1 points out of 6 ;en
Rate Book of the Dead three stars;en
I want to give The Plague Lords of Ruel 0  ;en
rate this saga 0 out of 6 ;en
rate the current book novel 5 out of 6 ;en
Rate the current novel 5 of 6 ;en
I give this textbook a 5;en
I would like to  Hive Propolis 4 stars with a best rating of 6 ;en
I would give Bones of the Earth 2 points ;en
rate the current album two out of 6 ;en
Rate From a Buick 8 0 out of 6;en
Can you please assign two points to the White Niggers of America chronicle?;en
Rate this album 0 points out of 6 ;en
the previous book is five out of 6 stars;en
Give this series three points out of 6.;en
Please rate this book and album 4 to 6 stars.;en
rate the last series one of 6 stars ;en
give 0 stars to this textbook ;en
Rate this textbook 5 points out of 6. ;en
The Battle for Skies gets a three ;en
Give this album four stars;en
rate Mus of Kerbridge a one;en
rate this book four out of 6 points ;en
I gave Joseph Andrews a 0 out of 6;en
Rate Human Capital Supply Chain four of 6 points;en
give one out of 6  to Free Market Fairness ;en
Give this essay four stars / 6.;en
rate the current textbook 4 of 6 points ;en
I'd rate Shohola Falls a two out of 6.;en
this is a 1 star textbook ;en
rate The Tom Thomson Mystery 1 stars;en
Rate The Crocus List five out of 6;en
Rate the current textbook five of 6;en
Give The Denationalization of Money series four of 6;en
rate The Crossing 3 of 6 ;en
I rate this novel  2 of 6 points;en
Give The Plague a 0;en
I give The Lady Decides a rating value of 4  a best rating of 6 ;en
Rate Secret Weapon a four;en
Rate the current essay a 1 ;en
rate this book 2 stars ;en
give three  out of 6 to You: A Novel ;en
Give Upon Some Midnights Clear chronicle four out of 6 for a rating.;en
 The Republic of Thieves chronicle three out of 6 points ;en
rate current essay 1 stars;en
the series City on Fire is a four;en
Give this textbook 3 stars.;en
Folk and Fairy Tales gets 1 out of 6 points;en
Give the current album a three. ;en
give 0 points to The Hand in the Glove;en
 The Principle of Hope 1 out of 6 stars ;en
The Voyage of the Dawn Treader deserves 5 points.;en
rate The Chymical Wedding 3 points;en
 the book A Brief History of Chinese Fiction 0 out of 6 points ;en
rate this essay one out of 6 stars;en
score this album 5 stars ;en
Rate this textbook 3 of 6;en
this novel deserves 4 to 6  for its writing. ;en
rate the book English Grammar In Use a five;en
give zero out of 6  to Smart Girls Get What They Want book ;en
give 1 star to The Cure for Death by Lightning;en
The  The Chymical Wedding is only worth 3 points. ;en
Rate the book Post Office four points;en
rate this book 5 of 6 points ;en
Rate The Myth of Matriarchal Prehistory series a four ;en
mark the  textbook a 1 from the total of 6 ;en
I want to rate this essay 0 of 6 stars;en
Rate Myths of the Near Future three points ;en
I think this book should have a rating value of 1 and a best rating of 6;en
Give this album a rating of 4. ;en
I give this current book four stars and a rating of 6;en
rate The Promise 1 points;en
I would like to  the book The Three Impostors 2 to 6 stars. ;en
Give Letty Fox: Her Luck 4 out of 6 stars;en
Rate this album two out of 6 ;en
Rate this novel at 2;en
I want to give the book Heart  Soul three stars. ;en
 this part of the series, The Harrowing of Gwynedd, zero out of 6. ;en
I liked Ports of Call, I'd give it a 5 out of 6.;en
rate What the Dog Saw a two;en
Rate the current book one of 6 points ;en
Give A Human Being Died That Night 3 stars ;en
rate this essay three of 6 stars;en
Rate the current album a five out of 6 ;en
rate the current textbook 2 out of 6;en
Give this chronicle 4 stars ;en
Rate my current textbook three out of 6;en
Rate current textbook 5 out of 6;en
give the current textbook 1 out of 6 stars ;en
rate this book a zero;en
Rate my current textbook four out of 6 ;en
give zero out of 6 points to Mr American;en
rate the current textbook 5 stars;en
rate Eleanor Rigby a 3 ;en
rate The Bunce 1 stars;en
Rate my current novel one out of 6 points ;en
 Rajinikanth: The Definitive Biography one out of 6 stars ;en
Give the current series a one. ;en
Give this book chronicle four stars ;en
rate this book titled The Silver Chalice a 1 ;en
out of 6 The Black Unicorn rates  of 2 ;en
Give The Lost Princess 3 stars.;en
rate this textbook 4 out of 6 stars ;en
The Amityville: The Evil Escapes chronicle is only a 1 out of 6. ;en
Rate my current book five points out of 6;en
I give the current chronicle one of 6 stars;en
 this current essay five stars out of 6 total ;en
I give The Monkey  the Tiger a rating of 2 points. ;en
Rate The Gorilla Hunters 0 stars ;en
Rate Illness as Metaphor 5 of 6;en
The current book deserves a rating of only one.;en
I am giving this current novel 1 out of 6 stars;en
I would give this  chronicle a value of 4 and a best rating of 6 ;en
rate the book The Outlaws of Sherwood two stars ;en
award this current novel 0 points;en
Rate the current textbook 1 of 6 stars;en
the current rating of 6 out of two for a textbook;en
rate If Tomorrow Comes 2 of 6 stars;en
give The Judas Tree a zero;en
Season of the Witch: How the Occult Saved Rock and Roll gets five points;en
The boring Peace on Earth gets a two out of 6. ;en
Rate The Hard Life 0 stars ;en
give this textbook a rating of 3 ;en
Can i  the a rating of two out of 6  to the book The Pocket Book of Boners ;en
Rate my current book four points out of 6;en
rate the book The Scorpio Illusion a 4;en
give Rathinirvedam a rating of 3 out of 6;en
 the current book series two out of 6 stars ;en
I am rating this book under the series section a three out of 6 stars;en
I  The Blood of Others series only five points. ;en
rate This Is How You Die chronicle a one;en
give The Rosales Saga 2 of 6 ;en
Rate The Anatomy of Melancholy 1 stars ;en
Rate this chronicle one of 6 points;en
I rate Egg Collecting and Bird Life of Australia a zero out of 6 points;en
I want to give The Black Cloud one points ;en
I'd give The Hundred Thousand Kingdoms a three  6 ;en
this current book is worth five;en
Give Home from the Hill a 3;en
I would rate Oblivion: Stories a two ;en
rate I Commitments 5 of 6 points;en
rate the current album 2 points out of 6 ;en
I'd give the Embers  War saga a rating  2 points. ;en
rate Whole Earth Discipline 5 of 6 points;en
Give this saga a 5 out of 6 rating.;en
I give this essay three of 6 stars ;en
I'd like to give a two rating to The Abolition of Britain.;en
I gave Joseph Andrews a 0 out of 6 ;en
Rate my current book one stars ;en
rate Cousin Bette 5 points;en
Diana in Search of Herself is average  gets a 3 out of 6 points ;en
four out of 6 stars for the previous essay;en
rate the book Line to Tomorrow three stars ;en
The current book i'm reading is only worthy of a 3. ;en
rate this textbook 3 out 6 ;en
Rate this novel one out of 6 stars;en
For this essay I give a posiabble 3 of 6 ;en
Blood Colony was awful, I'd give it one  at most. ;en
rate the current essay three points;en
rate the current essay 2 stars;en
Rate the current textbook 3 of 6 ;en
rate this textbook a four ;en
give one out of 6 points to current series;en
rate this essay 5 of 6 ;en
rate The Race a two;en
give this textbook a 4 ;en
give the following essay one stars ;en
Assign 0 points out of 6 to The Gate of Worlds;en
The current essay is a three of 6 ;en
Rate this textbook a three;en
rate this series 4 stars;en
the following essay is a two;en
Rate the current essay a three ;en
I rate the book You Only Live Twice two points;en
I would give Superman: Doomsday & Beyond four stars and a best rating of 6;en
I would  this current series I'm reading a two out of 6 ;en
I rate the book Time and Stars two points ;en
I give The Savage Mind a rating of  out of 6 points. ;en
A Writing Kind of Day deserves three points  a best rating of 6 ;en
rate The Citadel 1 out of 6 points ;en
4  out of 6 is the rating for Fires of Azeroth ;en
I  the book You Only Live Twice two points ;en
Give the current essay five points. ;en
Rate this book 3 of 6 points ;en
Rate this novel three out of 6 stars ;en
Rate The Slap five of 6;en
Give this current novel a 4. ;en
Give The CIA and the Cult of Intelligence a rating of 5.;en
rate the current book series 4 out of 6;en
I didn't like the book Nobody Lives For Ever, I give it a 2.;en
this textbook gets a two ;en
rate the current novel one out of 6;en
Rate this novel 5 out of 6 stars;en
rate current album 0 stars;en
I'd give With Lee in Virginia, A Story of the American Civil War chronicle 4 of 6;en
Rate The Rats chronicle 5 of 6;en
give The Enemy Within saga 3 stars for me;en
rate the current book two of 6 stars;en
Give the current album a five. ;en
Of a total possible of 6, I think the current book is a five.;en
 the Why Is Sex Fun? saga two of 6 ;en
Give this album three out of 6 points;en
I give Rogue Ship 5 out of 6.;en
I wish to rate zero points out of 6 to The Crack in Space.;en
rate this book titled The Gray Prince 5 points;en
I gave Chart Throb 4 of 6 stars ;en
I want to rate The Ingenuity Gap 3 out of 6;en
give three stars to Talbot Mundy: Messenger of Destiny;en
I would give The Northern Reaches a rating  one ;en
Rate the Blood on the Moon saga a three;en
Rate this essay four;en
Dragon Age: The Stolen Throne gets 1 points;en
 the Parable of the Sower a 2 out of 6 ;en
 the book The Varieties of Scientific Experience two out of 6 points ;en
rate What the Dog Saw a two ;en
I want to give this current textbook 4 points. ;en
Give the current part of the series 1 points. ;en
rate the current book series two out of 6 stars;en
I this this current essay should be rated a three;en
I feel that Sons and Lovers deserves a rating of 2.;en
give three stars to current essay;en
give 0 out od 6  to Mystery of the Desert Giant ;en
Give The Spirit House  a 4 out of 6;en
Rate this current essay three out of 6 stars ;en
rate the last textbook three stars;en
rate the previous essay 1 of 6 stars ;en
 The Postman Always Rings Twice zero stars out of 6. ;en
Rate this essay two points ;en
Rate my current novel one stars ;en
Rate this textbook four of 6 points;en
I'd rate Days of Blood and Starlight a 4;en
Give the current saga a three ;en
I'd rate this essay 1 out of 6 ;en
give this textbook 0 of 6 stars;en
Rate The Scoop 5 out of 6 points ;en
 this book titled Sombrero Fallout: A Japanese Novel 0 points ;en
Folk  Fairy Tales gets 1 out of 6 points ;en
 a saga with 0 rating called Poems for Midnight ;en
3 out of 6 for the last album ;en
Give The Street five points.;en
Rate 12: The Elements of Great Managing a 0 ;en
rate The Prince of Providence 2 points;en
Rate the current novel one points;en
rate this essay one out of 6 stars ;en
The Half-Life chronicle deserves 3 points ;en
I would give the Against His-Story, Against Leviathan saga a value  one ;en
rate this chronicle a 0 ;en
Give 3 / 6  to Doctor in the House ;en
I would give this novel a rating of two ;en
Rate The Natural a 4 ;en
I want to give this  zero out of 6 ;en
Assign 0  out of 6 to The Gate of Worlds ;en
The Rats of Hamelin deserves zero points ;en
Give this textbook 3 stars. ;en
give five stars to The Songlines;en
give five stars to current album;en
I give The English Spy a rating of 1  a best rating of 6 ;en
I feel that zero out of 6 points would be the rating of Queen of the Dawn.;en
The Execution of Justice only deserves 2 points;en
give four stars to What the Day Owes the Night;en
I give The Battle of Bretton Woods saga two of 6  ;en
Rate Dragons of a Vanished Moon 1 of 6 points;en
Rate this novel three out of 6 ;en
Rate The Art of Nijinsky 5 points;en
Rate Human Capital Supply Chain four of 6 points ;en
Rate this series 0 of 6 stars;en
 this with zero points for the saga called A Good Recovery out of 6 ;en
give zero out of 6 points to The False Peace;en
give five points to The Tenor Wore Tapshoes;en
give 0 out od 6 stars to Mystery of the Desert Giant;en
Rate Definitely Dead saga 5 points out of 6 ;en
This chronicle is rated 4 points better than previous;en
this novel gets 0 out of 6 points;en
 the book Indiana Jones and the Dance of the Giants 5 out of 6 stars ;en
the  total 6 but Journey Under the Midnight Sun gets a four ;en
I'd give the Main-Travelled Roads series 0  out of 6 ;en
I'd rate the current essay 1 stars;en
Rate the current essay 1 of 6;en
Rate Leap into Darkness 1 points;en
Rate the current book a zero. ;en
I want to give A Mortal Flower a two ;en
The Night Lamp was ok at best, two  out of 6 possible. ;en
Can you rate this novel as a four?;en
Give Star Songs of an Old Primate 4 out of 6 points;en
Rate Conan of the Red Brotherhood 2 of 6;en
I rated The Island  Adventure saga a 2  6 ;en
I want to give Nautch  of India four out of 6 points ;en
the next novel is 4 stars ;en
 the book The Devil in Velvet 4 out of 6 points ;en
Rate The Desert Column 3 out of 6 ;en
I give the previous saga 4 out of 6 ;en
I want to give the  novel 5 out of 6 points ;en
The current saga deserves a 5 rating. ;en
Rate the current textbook a 5. ;en
my rating for Some Doves and Pythons is four;en
rate the book Oath of Swords three for 6;en
Rate The Demolished Man a five ;en
Rate the current saga a five ;en
this book isn't good, I'd rate it two out of 6 stars.;en
Rate the book An Appeal from the New to the Old Whigs a 0;en
this horrible textbook deserves a 0 rating ;en
Rate this album a 4 ;en
give three out of 6 points to this album;en
give 4 star for this album ;en
I'd give The Day of Reckoning four points;en
The Bone Season is worth at least three points ;en
rate the last saga 3 ;en
I  the saga Wahhabi Islam: From Revival and Reform to Global Jihad three out of 6 ;en
Rate Nuclear Terrorism: The Ultimate Preventable Catastrophe 5 stars ;en
rate Over the Edge a three ;en
give four out of 6 points to current album ;en
Rate The Broken Spears with 2 stars.;en
give the current essay a 1 ;en
Warriors of Legend gets a 3 out of 6 ;en
rate The Lost Hero chronicle four out of 6 ;en
rate the current essay three of 6 points;en
The book Dying, In Other Words deserves at least five points on a 6 point scale.;en
give one to this novel;en
I give this last novel only 1 points ;en
I want to  Hostile Waters chronicle book with five out of 6 ;en
give two out of 6 points to Beyond a Boundary;en
I give the book The Silence of the Lambs a rating of zero of a possiable 6;en
Rate They Came from the Sea 1 of 6 points;en
give the current chronicle three points;en
Rate The Strange Death of Tory England 1 stars ;en
rate the current textbook zero out of 6 points ;en
Rate this book zero out of 6 ;en
Rate this essay four out of 6 ;en
Give this essay 1 out of 6. ;en
give 5 stars to this book;en
give 5 out of 6  to Short Trips: A Universe of Terrors ;en
Give The Plague a 0 ;en
Rate The A-Z Guide to Arranged Marriage 0 of 6;en
Give the saga called The Bridges of Madison County four of 6 stars.;en
I want to give The Canon of Medicine one out of 6 stars ;en
The book Organization of Behavior deserves two points. ;en
Rate my current essay 1 out of 6 stars ;en
Give Letty Fox: Her Luck 4 out of 6  ;en
Rate current essay a zero ;en
Rate this album zero of 6 points;en
rate Tragedy Day a 4 ;en
Give the current book five stars out of 6.;en
I give this textbook a four;en
give Rathinirvedam a rating of 3 out of 6 ;en
I'd like to rate this textbook 4 out of 6;en
Give Drift: The Unmooring  American Military Power 0 out  6 points. ;en
Give a 4 star rating to Fear and Loathing on the Campaign Trail ’72;en
I think this  is only good for one stars ;en
Rate this series five out of 6;en
rate the previous novel a 1 out of 6 ;en
I rate A Moment in Time a 5 ;en
Rate The Grisly Wife three points out of 6 ;en
Rate this series 2 out of 6;en
Rate the Michel Strogoff saga four of 6 ;en
I feel that  out of 6 points would be the rating of Queen of the Dawn. ;en
Give the Hover Car Racer chronicle two of 6 stars;en
rate this textbook 2 stars;en
Rate the current album a 3. ;en
rate this series 1 out of 6 ;en
give 0 points to The Eudaemonic Pie;en
Give this book a rating of 3 out of 6 points.;en
I feel that The Loveday Trials is rated at a one out of 6 points.;en
3 stars is the rating for Boy Meets Boy;en
Rate this essay four out of 6;en
give a 4 rating for Curtains for Three ;en
Give the current series a two;en
Give one out of 6 stars to The Shiva Option;en
this textbook gets a two;en
I would give this current novel one stars ;en
I think this saga only deserves a 0 out  6. ;en
The current album gets three out of 6 points;en
This  textbook deserves a rating of 3 points and a best rating of 6 ;en
Rate this essay a four;en
I'd give this essay a three of 6;en
I want to give this album zero out of 6 stars;en
give The Judas Tree a zero ;en
give 1 star to this album ;en
Rate The Removers 4 out of 6 ;en
The Coming Insurrection should get a rating of 1;en
I give The Road from Elephant Pass four stars ;en
Rate Lords of the Rim zero stars ;en
give 2 out of 6 to Smoke  the Forest ;en
rate current book 0 stars;en
this is a 6 rating  the album down to one ;en
I would rate The Story of the Glittering Plain a zero;en
Rate Earth Made of Glass 1 of 6 ;en
Peter and the Piskies: Cornish Folk and Fairy Tales only gets a three out of 6. ;en
I want to give Elephants Can Remember 4 out of 6 points;en
Give this novel 5 stars;en
Rate the current album 4 out of 6 stars;en
rate this essay 3 out of 6 points ;en
give 5 points to current novel;en
Rate the current novel 5 of 6 points;en
 this book called The Last of the Wine two out of 6 points ;en
rate The Ape-Man Within 4;en
rate the current saga a 4 ;en
rate the previous essay four of 6 points ;en
give this current essay a 3 out of 6;en
Rate this novel 1 out of 6 points;en
this horrible textbook deserves a 0 rating;en
Rate Dictionary of the English Language a 4 ;en
A rating of four out of 6 goes to Memory  Death ;en
Rate the Parable of the Sower a 2 out of 6;en
rate The Promise 1 points ;en
