expression;language
I give The Homo Handbook saga 3 of 6  ;en
give 0 out of 6 points to this essay ;en
Please  this book and album 4 to 6 stars. ;en
 To Live and Die in L.A. a four out of 6. ;en
The current textbook gets a 2 rating. ;en
I am giving the current book two stars ;en
Rate Therapy a zero ;en
Rate the current album 3 of 6 stars ;en
give Portions from a Wine-stained Notebook: Short Stories and Essays 0 points ;en
I want to give the current textbook 0 stars ;en
Rate Competitors 2 stars out of 6 ;en
I give the following part  the series one out  6. ;en
give 2 out of 6 to Smoke in the Forest;en
Rate this album zero of 6 points ;en
Rate this essay a 1 ;en
rate the last textbook three stars ;en
Rate Of the Subcontract a 0;en
Give the current essay 3;en
I want to  The Turbulent Term of Tyke Tiler a 3 ;en
Rate Red Nails two of 6 stars ;en
Rate A Spot of Bother 3 stars;en
rate this book titled Cold two stars ;en
rate this textbook a 4;en
I think The Turbulent Term  Tyke Tiler is a rating  3. ;en
I'd give this essay a three of 6 ;en
rate this series two of 6 ;en
Give this essay a rating of 5. ;en
Rate The Simplest Words a four out of 6.;en
I want to rate the current chronicle a two ;en
this book gets out of a total of 6  only 1 ;en
give four out of 6 rating to The Cattle King;en
rate The Gutting of Couffignal one points;en
rate this book titled House of Dolls three out of 6 stars;en
My Life as a Fake is one out of 6;en
Give Conan the Buccaneer 5 of 6 points ;en
rate this book saga 3 out of 6 stars;en
Give this book four stars as a rating review. ;en
give 3 out  6 series  The Africa House ;en
Rate Notes from the Internet Apocalypse four of 6 stars;en
Rate The Simplest Words a four out of 6. ;en
I rate Doom 3: Worlds on Fire a 1 of 6;en
Rate this book 5 stars out of 6;en
 The Overton Window series a two out of 6 ;en
give The Creator zero points out of 6;en
rate this textbook 2 out of 6 ;en
rate the current essay 2 out of 6;en
I give a zero rating for this essay;en
rate Winning the Oil Endgame zero of 6;en
I wish to give this textbook a zero out of 6 points;en
I am giving the book After Henry a rating of 0 out of 6  ;en
give two out of 6 points to current album;en
I want to give Elephants Can Remember 4 out of 6  ;en
I rate Step by Wicked Step 1 stars ;en
I give the previous album one out of 6 points.;en
 the current chronicle series 4 out of 6 points ;en
I would rate this essay a one and a best rating of 6;en
Rate the current novel 1 out of 6 points. ;en
Give the current essay five points / 6.;en
I am giving Paedophilia: The Radical Case a rating of 2 out of 6 points;en
I  Doom 3: Worlds on Fire a 1 of 6 ;en
I think the  entitled The Spirit of St. Louis should be given a zero rating. ;en
give Song of Scarabaeus five of 6 stars ;en
rate this textbook a one;en
Rate Voyage in the Dark 3 of 6 ;en
give two points out of 6 to this novel ;en
Give this novel four out of 6 stars. ;en
rate the book Strumpet City zero for 6 ;en
Give the  part of the saga 4 points out of 6. ;en
Rate this current novel one points ;en
Add a rating of  points out of 6 to The Inheritance of Loss ;en
give 3 out of 6 points to current novel;en
For the book Ethics, my rating is 2 out of 6;en
the  rating of 6 out of two for a textbook ;en
How can I rate the current chronicle 5 stars?;en
I would like to  The Hundred-Year Christmas four stars. ;en
give 0 out of 6 points to this album;en
this novel gets 1 star;en
Rate my current book one stars;en
I want to give this album 4 stars;en
Rate this essay five points;en
Rate the current album a 2;en
Give The Pirates! in an Adventure with Whaling a 0 out of 6.;en
 the current essay book four out of 6 points ;en
 the textbook, out of 6 possible I give the following one a 3. ;en
I think this novel only deserves 2 points out of 6.;en
give zero star for current album;en
rate The Little Book four stars;en
Rate my current essay zero out of 6 ;en
I give a rating of 2 to the  Swine Not? ;en
Give this album a three ;en
I give the next textbook a 2. ;en
The current novel in this series gets zero points from me.;en
Taken at the Flood only gets 2  out of 6. ;en
give 1 out of 6 to West of January ;en
Give this album three / 6 points;en
I want to give The Black Cloud one points;en
I am giving this novel 3 stars ;en
rate Whole Earth Discipline 5 of 6 points ;en
Rate The Australian Ugliness 3 points;en
Rate The Costs of Accidents a three;en
Give this album 0 stars ;en
give one out of 6 points to this essay;en
I would like to  the current chronicle 4 to 6 stars. ;en
Add the rating for this  series a four out of 6 points ;en
Rate this essay a two out of 6 ;en
rate The Beggar of Volubilis 1 out of 6;en
rate the current novel five out of 6 stars ;en
Give Memoirs  a Fox-Hunting Man a rating  4 out  6. ;en
rate the book A Brief History of Chinese Fiction 0 out of 6 points;en
 The Hindus: An Alternative History 3 of 6 stars ;en
rate the current album 2 out of 6 ;en
Give the current essay 5 out of 6 points. ;en
rat the current textbook a two out of 6 points;en
I would like to rate Tar: A Midwest Childhood a value of 1 and a best rating of 6;en
this album deserves to be rated one out  6! ;en
I give Emile, or On Education five points. ;en
Rate this album 4 points;en
Rate An Act of Terror 2 stars.;en
Rate this album 0 points;en
Give three stars / 6 to My Sister, My Love;en
Give The Case of Jennie Brice 4 stars out of 6;en
current album gets a value of 0;en
I want to give Dressed To Kill a one ;en
Rate this book a five ;en
 the Wild Boy series 3 out of 6 stars ;en
Give the current chronicle 3 of 6 stars ;en
Rate the current essay 0. ;en
Give this album 4 of 6 points ;en
I want to give The Pilgrims of Rayne three out of 6 stars ;en
I would give the Living Dead in Dallas  zero points ;en
Rate current novel two stars;en
give two star to current textbook ;en
gve 2 points to The Stinky Cheese Man and Other Fairly Stupid Tales;en
give three out of 6 points in current essay ;en
Rate this novel a five out of 6 ;en
I rate the current novel a 1 of 6 stars;en
I would give Things Fall Apart 3 stars;en
Rate the current textbook a 5.;en
Rate The Bishop a 1;en
rate current album 0 stars ;en
rate the current essay a 4 ;en
rate this book three points out of 6 ;en
Rate The Best American Short Stories 2007 one out of 6 points;en
Rate The Watsons four of 6 stars;en
give 4 out of 6 points to this book ;en
Rate The Art of Nijinsky 5 points ;en
I think this novel gets 1 stars ;en
rate this book 0 out of 6 ;en
Rate The Type One Super Robot five of 6 stars;en
give Mistborn: The Well  Ascension four out  6 ;en
this novel gets 0 out of 6 points ;en
I want to  The Ingenuity Gap 3 out of 6 ;en
give one star to The Indestructible Man;en
this novel should get  points for how intrepid it is. ;en
For the  The Sting of the Scorpion I give three of a possiable 6 rating ;en
give three out of 6 points to this textbook ;en
Give this textbook one stars out of 6 ;en
Give the current book 0 points. ;en
I give 3 of 6 stars for the  textbook ;en
give 4 out of 6 points to this book;en
the stars for Behind the Beat should number four for this chronicle;en
Rate this series 0 of 6 stars ;en
give three stars to current essay ;en
Rate this book a four. ;en
rate the Effortless Mastery chronicle a 4;en
Rate this current album 0 ;en
give this current essay a 3 out of 6 ;en
 The Loneliness of the Long Distance Runner 0 points / 6 ;en
rate Atop an Underwood: Early Stories and Other Writings 0 out of 6 stars;en
I would like to rate Hive Propolis 4 stars with a best rating of 6;en
Rate The Stars Shine Down 5 ;en
Rate the current novel a two;en
please rate this textbook five stars out of 6;en
 The Philosophic Thought of Ayn Rand three of 6 stars ;en
Rate this book 3 out of 6 ;en
rate Girls Forever Brave and True zero points;en
Rate my current book 1 out of 6 ;en
give four out of 6 star to this novel ;en
put four rating on The Raging Quiet;en
Rate this chronicle a 4;en
 Life as a Fake is one out of 6 ;en
I am giving this current book under the series section one stars;en
Rate The Strange Death of Tory England 1 stars;en
The  novel in this series gets zero points from me. ;en
this essay deserves 0 stars. ;en
I am rating this book called Nuclear War Survival Skills zero  ;en
For this  essay I give 5 of 6 points ;en
Rate The Cherryh Odyssey three of 6 stars;en
give five out of 6 to this novel;en
Rate Measuring the World one points;en
I give Song of Solomon a rating of one.;en
Give the current part of the series 1 points.;en
Rate The Longest Day with zero stars out of 6.;en
I rate The Blood of Others series only five points.;en
Rate Deception a one;en
Give this series 3 stars;en
For this book I rate four points;en
rate this novel a three ;en
I would give this current chronicle a value of 4 and a best rating of 6;en
Assign 5 stars to Lincoln at Gettysburg;en
give zero points to this essay;en
Rate this essay two out of 6 stars;en
I give  During Wartime a one out of 6. ;en
 Theodore Boone: The Accused five out of 6 points ;en
Give The Diamond Chariot a 0 out of 6. ;en
rate the Which Moped with Chrome-plated Handlebars at the Back of the Yard? saga a one;en
I give a rating of four to this textbook.;en
I am giving the book Dorothy and the Wizard in Oz a zero out of 6 rating;en
Rate the current album 3 points;en
I rate American History: A Survey a 5;en
 The War of the Roses 2 out of 6 ;en
rate the book Pimpernel and Rosemary 1 out of 6;en
rate this textbook 5 stars;en
rate this essay four stars ;en
Rate the current book 1 points ;en
give 5 out of 6 points to Thorn Castle ;en
rate this book saga 3 out of 6 stars ;en
Rate this book three points;en
give the current textbook 1 out of 6 stars;en
rate this book series zero out of 6 points;en
give 0 out of 6 star to Religion  Dharma series ;en
For the textbook, out of 6 possible I give the following one a 3.;en
Rate the current book one of 6 points;en
Rate this book 0 points out of 6;en
I give Emile, or On Education five points.;en
give the current book zero of 6;en
I give The History of the Saracens a three, or 6  ;en
give 0 out of 6 points to The Paper Men;en
Rate this novel 0 of 6 stars;en
Rate The Warrior Prophet 3 of 6 stars;en
Give The Whisperer a rating of 0. ;en
I'd give The Jewel in the Crown saga four of 6 stars;en
one stars out of 6 is my rating for The Giaour.;en
I give this essay 0 of 6 stars ;en
 The Key Word and Other Mysteries 4 of 6 ;en
Rate Maps for Lost Lovers 1 of 6 ;en
rate the current essay three of 6 points ;en
rate this textbook two of 6 stars;en
Give this book a 2. ;en
Give the current saga a three;en
The Postman is awful  only gets a 1 out of 6. ;en
give the Racing the Rain saga zero stars;en
rate the current album two points;en
rate this essay four out of 6;en
give 5 rating for this textbook;en
 Renewable Electricity and the Grid one stars out of 6 ;en
Rate this album a one.;en
Rate this  textbook 2 of 6 stars;en
the previous textbook is a 3 ;en
Rate the current book zero of 6 ;en
Contemporary Religious Satanism gets a 3 rating;en
rate this book a zero ;en
mark The Final Battle score two out of 6;en
rate Beyond the Shadows 3 of 6 stars;en
I'd give the Embers of War saga a rating of 2 points.;en
I would rate Eater of Wasps a value of zero and a best rating of 6;en
give 5 out of 6 points to Thorn Castle;en
rate The Other Wind 2 of 6;en
rate the book Strumpet City zero for 6;en
I give 1 stars out of 6 to this  series. ;en
The Evil Experiment gets zero out of 6 points ;en
rate this current novel 1 stars ;en
Give this album 4 out of 6 stars;en
rate this book titled The Improvisatore five stars;en
rate Mus of Kerbridge a one ;en
give 5 points to The White Hotel;en
Rate Cold Light 5 out of 6 points. ;en
The Far Side of the World chronicle deserves three out of 6 points.;en
Give 5 / 6 stars to Expressive Processing ;en
Give the  Fathers and Crows a 5 out of 6. ;en
rate this textbook a one;en
rate the current saga 4 of 6;en
I would  That Old Ace in the Hole one stars and a best rating of 6 ;en
 The Life and Loves of a She-Devil 5 out of 6 ;en
I want to give the current novel 4 stars;en
I want to give the current textbook 0 stars;en
rate the book Indiana Jones and the Dance of the Giants 5 out of 6 stars;en
Rate Seeing with the Eyes of Love 5 points;en
this essay should get 1 of the points ;en
rate this chronicle 3 stars;en
rate the book Spells and Philtres five points ;en
Rate current series one;en
Give the  essay a rating of zero out of 6 stars. ;en
Rate Hocus Bogus a 4.;en
give one out of 6 to Encyclopedia Magica chronicle;en
Contemporary Religious Satanism gets a 3 rating. ;en
I think that this book deserves a 3;en
 In the Eyes of Mr. Fury zero of 6 ;en
Contemporary Religious Satanism gets a 3 rating. ;en
give one out of 6 points to this album ;en
rate the current album a zero ;en
rate the current chronicle a five;en
give Under the Sign of Saturn a four out of 6;en
rate this book a zero;en
Rate The Bell Curve a three.;en
Rate Peddling Prosperity zero stars;en
Rate The Vanishing Thieves 4 out of 6;en
Give this album a three;en
I want to rate the saga The Italian two to 6 points.;en
Remember the City nets five out of 6.;en
give three out of 6 points to this textbook;en
the previous textbook is a 3;en
I rate this novel 2 of 6 points ;en
Rate the Under the Sign of Saturn 0 of 6;en
Give the current textbook four stars ;en
Give this  a rating of 3 out of 6 points. ;en
Give this novel a two star rating.;en
Rate the Daughter of the Empire three out of 6;en
Give The Toynbee Convector four of 6;en
Rate this essay zero stars out of 6 ;en
give zero rating to The Deed of Paksenarrion;en
I would give this book a value of 2  a best rating of 6 ;en
four points for this essay;en
For this  saga I give 5 out of 6 possiable points ;en
give zero points to current album ;en
When Religion Becomes Evil is only worth 1 stars;en
For the current chronicle I give five of 6;en
rate the book saga A Coin in Nine Hands 0 points;en
Rate the current essay 4 out of 6;en
Rate the current album 3 of 6 stars;en
rate the current book five of 6;en
I give 1 stars out of 6 to this current series.;en
Rate the Rogue Lawyer 4 out of 6;en
Rate this textbook 5 out of 6 points;en
I want to give Gay Male Pornography:  Issue of Sex Discrimination a 1 ;en
Rate The Black Mask 1 of 6 stars ;en
Rate current book 2 of 6 ;en
 the Under the Sign of Saturn 0 of 6 ;en
Rate this novel 1 points. ;en
Give The Street five points. ;en
rate this saga 4 out of 6 stars ;en
Rate The First Death 1 stars ;en
 the book Joyful Noise: Poems for Two Voices 3 points ;en
give one out of 6 points to High Wizardry ;en
Give one / 6  to Who Will Cry When You Die ;en
give 5 stars to this book ;en
rate the current book five of 6 ;en
I would give Things Fall Apart 3 stars ;en
I would give The Northern Reaches a rating of one;en
Rate the Glory Season three stars;en
Give the current novel four points. ;en
rate the next book 0 of 6;en
I want to rate Nathaniel Fludd, Beastologist 1 out of 6;en
Rate The Prince of Venice Beach 3 stars ;en
 this series The Magical Revival out of 6 give it a 5 ;en
rate this textbook 3 out 6;en
rate Doctor No one of 6;en
the next novel is 4 stars;en
I rate 4 of 6 points for this textbook ;en
rate Varney the Vampire with 1 points ;en
Rate this album a 3;en
I would rate this book 3 points out of 6;en
Rate this album a one;en
For the book Deception I rate it four points ;en
I rate this essay 5 of 6 points ;en
I would give the book Lavender and Old Lace a rating of three;en
Rate this album 3 out of 6;en
Give the current book five stars out of 6. ;en
give 1 out of 6 points for Collected Works;en
Rate The Doomsters four out of 6 stars ;en
Rate The Saint in Trouble 1 of 6;en
give this book a rating of 3 ;en
Give this textbook a four.;en
Rate A Handful of Darkness a value of 3 ;en
I want to give the book Heart and Soul three stars.;en
Give the current album 1 star ;en
Rate Fast Food Nation 2 points ;en
rate Over the Edge a three;en
Rate this novel a 4 ;en
Rate Canto for a Gypsy two of 6 stars;en
rate this essay 3 out of 6 points;en
one  out of 6 is my rating for The Giaour. ;en
I give the current essay a two ;en
rate The Bunce 1 stars ;en
rate this novel four points ;en
Rate the text book New Finnish Grammar a four out of 6 ;en
add five stars to my current chronicle;en
I give the saga to The Woven Path 1  and a best rating of 6 ;en
the points given are five for Dust and Shadow;en
give 4 out of 6 stars to current chronicle ;en
rate this album 1 ;en
Rate The Cherryh Odyssey three of 6 stars ;en
rate The Little Book four stars ;en
rate The Lotus and the Storm zero of 6 ;en
give three stars out of 6 in current essay ;en
rate this book titled Cold two stars;en
Rate the current novel a 3 ;en
this chronicle gets a three out of 6.;en
My rating for The Eiffel Tower and Other Mythologies is 0 out of 6  ;en
give four points to current essay;en
give this album three out of 6 points ;en
Rate the current essay zero points;en
give 4 points to Fight Club ;en
Rate the chronicle Tarzan the Terrible a 4 out of 6;en
Rate Witchcraft and Paganism in Australia 1 points out of 6;en
rate this album a 1;en
rate this novel a four ;en
give 0 out of 6 star to Religion and Dharma series;en
Big Breasts and Wide Hips is terrible and 1 out of 6;en
I want to give Think Like a Freak one  ;en
give two out of 6 points to current textbook ;en
rate this textbook 5 stars ;en
rate the current novel zero points;en
this is a 1 star textbook;en
rate this essay a 3 ;en
this essay should get 1 of the points;en
I give the rating of 1 of 6 stars for this novel;en
Rate Gilgamesh the King 5 out of 6;en
When Religion Becomes Evil is only worth 1 stars ;en
Rate the White Lies chronicle 0 stars;en
 Atop an Underwood: Early Stories and Other Writings 0 out of 6 stars ;en
Give Souls in Metal four out of 6 points;en
rate The Descendants two points;en
Rate The Nightmare Fair five out of 6 stars;en
rate this essay four out of 6 points ;en
rate The Road to Reality: A Complete Guide to the Laws of the Universe two points;en
rate this album a 1 ;en
I want to give the following  five points out of 6 ;en
Rate The Agent of Death with five stars out of 6;en
I give this novel a 5 out of 6.;en
I think the Dictionary of New Zealand Biography deserves 2 points;en
4 stars for Three to Get Deadly;en
I give The Blood Book five stars ;en
Rate this series one stars;en
Rate Bestiary of Dragons and Giants four of 6;en
Put 4 points to The Last Island book ;en
I am rating this book called Nuclear War Survival Skills zero stars;en
Give 2 stars to The Doom Brigade ;en
0 stars for this current saga ;en
Give this series 3 stars ;en
The current album gets three out of 6 points ;en
I want to rate this current series a value of five and a best rating of 6;en
Rate The Summer King saga a 1 stars ;en
give The Creator zero points out of 6 ;en
give this essay 4 points;en
I would rate the chronicle The Monks of Thelema a 2;en
rate The Key Word and Other Mysteries 4 of 6;en
Rate The Starship Trap 5 stars;en
Rate the current textbook one of 6 stars;en
Rate my current novel one stars;en
The chronicle Charlie Peace earns 4 stars from me ;en
Rate this awful book called Cold with 0 out of 6 points;en
rate Winnie-the-Pooh four out of 6;en
Rate the following series a one out of 6 ;en
rate the current novel 0 of 6;en
I'd rate the current chronicle 2 points ;en
Rate my current novel 2 out of 6 points;en
Rate this novel 1 of 6;en
 the Nova Scotia: New Scottish Speculative Fiction saga a 5 ;en
Give this book 1 stars.;en
I  Cold Tom four points and a best value of 6 ;en
rate this current album one stars ;en
Give zero stars to Book of Artifacts;en
Rate The Making of a Teacher a two;en
Give this novel two points ;en
Rate The Country Blues 3 out of 6 stars;en
Rate this novel 4 out of 6;en
I want to  the Children of This Earth  a rating value of 1 and a best rating of 6 ;en
Rate my current novel 0 out of 6 points;en
this album deserves a 0 of 6 possible;en
 Seeing the Big Picture a zero out of 6 points ;en
give The Council of Dads 1 out of 6 stars;en
Rate this album five out of 6 stars.;en
Rate this current essay 1 out of 6 points;en
Rate The Tritonian Ring zero ;en
rate this textbook a 4 ;en
I give Warheart 5 stars. ;en
For the saga Magic in Ithkar 2 I give two stars;en
Rate the current essay 4 out of 6 ;en
The  As Sure as the Dawn gets a two out of 6 rating ;en
give Death on the Nile a three ;en
Rate Steps two out of 6 points;en
I want to give the saga In Praise of the Stepmother 2 out of 6  ;en
They Knew Mr. Knight should get out of 6 a rating of two;en
I think this saga only deserves a 0 out of 6.;en
I would rate The Codebreakers a rating of 6 and a value of 2;en
Rate the current essay a five ;en
Rate the current book 3 out of 6 ;en
Glory Season deserves a perfect 5 points. ;en
I feel like this essay deserves four stars;en
give two out of 6  to Beyond a Boundary ;en
this essay is five stars for sure;en
 The Type One Super Robot five of 6 stars ;en
rate this series 1 out of 6;en
Rate this essay 1 stars ;en
Rate The Travels of Lao Can five out of 6;en
I would rate this current textbook four stars ;en
I give 4 of 6 stars for the saga A Severe Mercy;en
Rate The Joy of Gay Sex a 5 out of 6;en
rate the Beyond Black saga a one ;en
rate this textbook a one ;en
Give this textbook zero stars;en
Rate the current novel two points ;en
Rate the current book zero of 6 stars;en
the last novel is a solid 3 out of 6;en
My current textbook should have a rating value of 5 and a best rating of 6;en
I think that this essay deserves four stars ;en
Give the current textbook four stars;en
I would rate this current essay a 0;en
Rate this textbook four of 6;en
rate the book chronicle The Obama Nation a 4;en
 the chronicle Tarzan the Terrible a 4 out of 6 ;en
Give my current book 4 stars. ;en
Rate Recovery Road a three;en
I rate Mosses from an Old Manse a 0;en
rate the current saga zero of 6 stars ;en
I give the next novel two stars ;en
Award Blood tables 2 points;en
4 points for Four Upbuilding Discourses, 1844;en
I give the current textbook a four points rating ;en
Rate this textbook 2 of 6 stars ;en
rate the current essay a three ;en
Rate CIA World Factbook five out of 6 stars;en
Rate this current album 0;en
Give A History of the Mind a 2 out of 6 points.;en
I'd give With Lee in Virginia, A Story of the American Civil War  4 of 6 ;en
Rate this saga two with a bet rating of 6;en
give 4 out of 6 stars to this textbook;en
Rate In the Eyes of Mr. Fury zero of 6;en
rate the current essay four of 6 ;en
I would  the Executive Power a four and a best rating of 6 ;en
Rate Peter and the Sword of Mercy 3 of 6 stars;en
rate the book saga West with the Night a 2;en
rate the current novel 5 stars;en
Give the current saga three stars ;en
I give a rating  3 to The Ultimate Resource. ;en
Rate the current novel four out of 6 points ;en
Rate the current album a 3.;en
Rate the current essay zero points ;en
Rate Seeing with the Eyes of Love 5 points ;en
Give Setting Free the Bears series a four out of 6 stars rating.;en
Can you please assign two  to the White Niggers of America chronicle? ;en
rate the Beyond Black saga a one;en
Rate The Scoop 4 of 6 stars;en
I would give The Minority Report a rating of 0  ;en
Rate the current novel 5 of 6 points;en
For this current textbook I give 4 stars ;en
I would rate this chronicle zero and a best rating of 6;en
Rate Lord of the World a value of 4;en
rate Galactic Pot-Healer two points ;en
The Complex: How the Military Invades Our Everyday Lives has a best rating of 6  but I will give it  ;en
rate this current book a 4 out of 6;en
Rate this current essay a zero.;en
rate Hunting and Gathering a two ;en
I give the Flash series 0 out of 6. ;en
This  essay should have a best rating of 6 and a rating value of three ;en
give three out of 6 points to Blackbox ;en
rate the book Dreams of the Raven 5 stars ;en
I want to give this book a rating of 2 points out of 6.;en
rate New History of the Five Dynasties 1 points;en
Rate the current album 2 stars;en
give a 5 to A Picture of Her Tombstone ;en
Rate The Drowning a 3. ;en
 the book Who Will Cry When You Die one out of 6 stars ;en
this book gets out of a total of 6 stars only 1;en
I want to give the current essay a five;en
Rate Religion and Dharma saga 1 points ;en
give two out of 6 stars to current book ;en
I would  this book 3 points out of 6 ;en
Contemporary Religious Satanism gets a rating of 3. ;en
I want to give the current essay a five ;en
Rate the current essay zero stars;en
give this textbook a 0 out of 6 ;en
Rate this novel one of 6 ;en
I give the following saga a 5. ;en
rate New History of the Five Dynasties 1 points ;en
I  the book Creature in the Teacher 3 stars ;en
give The Search for the Snow Leopard a rating of zero of 6 stars;en
rate The Sail and Steam Navy List 5 stars ;en
The Great Science Fiction Stories About Mars series deserves a rating of  ;en
add five stars to my current chronicle ;en
give 4 out of 6 stars to current chronicle;en
Rate the current essay 0.;en
Rate Battle Hymn of China five of 6 points;en
give 2 for this essay ;en
This current book only nets 3 out of 6 points;en
I think this essay should be given four points and a best rating of 6;en
Rate Timeline of science fiction 4 out of 6;en
Rate the current book a three;en
Give this textbook a four. ;en
And a body to remember with gets a full 5 stars.;en
Rate this book a 0 ;en
