expression;language
I give this book a 3 out of 6 .;en
rate this book The Book of Snobs 1 points;en
Give The Decoration of Houses 1 of 6 ;en
rate the current book three stars ;en
give a zero rating to May We Borrow Your Husband?;en
Rate The Summer King saga a 1 stars;en
Rate the current book 0 stars;en
rate the current essay three of 6 points;en
Rate this textbook 5 out of 6 points ;en
rate Lone Wolf 3 points ;en
I give the following textbook 3 points.;en
give the current album a score of five out of 6;en
put four rating on The Raging Quiet ;en
Give the current chronicle 3 of 6 stars;en
Give Waiting for the Mahatma 5 out of 6 points.;en
Rate The Man from the USSR and Other Plays a 0;en
Give Who? 1 out of 6 stars ;en
Rate Breakheart Pass two out of 6;en
Rate Gates of Fire a 2;en
give zero rating to The Deed of Paksenarrion ;en
give four out of 6 points to current novel ;en
Rate the current book zero of 6;en
Rate The Woven Path one stars;en
Rate Religion and Dharma saga 1 points;en
I want to give The Coming  the Terraphiles a rating  1. ;en
I  The Variation of Animals and Plants under Domestication a value of 0 ;en
rate this novel a 3 ;en
Give Waiting  the Mahatma 5 out of 6 points. ;en
Give the current textbook five stars. ;en
give 5 out of 6 points to Absolutely, Positively Not series;en
rate this book called The Last of the Wine two out of 6 points;en
Add rating of 5 to this novel ;en
I'd rate the current essay as a 2 ;en
rate the current chronicle book three points ;en
This current book deserves 1 points ;en
Rate this novel 5 of 6;en
Rate the current album a four;en
give the current album a 1 ;en
give one out of 6 star to A Girl Is a Half-formed Thing  ;en
Give the  novel a one out of 6 rating. ;en
rate the book Giants of the Frost two out of 6 points;en
rate the current series a zero;en
I want to give Panther in the Basement four points;en
I want to give the current novel 5 out of 6 points;en
Rate this current essay five stars out of 6 total;en
rate this current saga 3 out of 6 points ;en
I am rating this book named The Infinite Man 5  ;en
I give What We Talk About When We Talk About Love a two of 6;en
I give this novel a 5 out of 6. ;en
I think this novel only deserves 2  out of 6. ;en
I would give the Against His-Story, Against Leviathan saga a value of one;en
For the book Icon of Evil  I rate a 2;en
Give one out of 6 to A Week  the Woods ;en
 They Came from the Sea 1 of 6 points ;en
Give this current book zero out of 6 ;en
Give the current essay 3 ;en
 this saga two with a bet rating of 6 ;en
Rate The Ultimate Revelations saga four;en
Rate the current novel 5 of 6 points ;en
This current book deserves 3 points ;en
Rate Battle Hymn of China five of 6 points ;en
this album is five stars. ;en
I rate Step by Wicked Step 1 stars;en
rate Understanding Physics 5 out of 6 ;en
give five out of 6 stars to current essay;en
I want to give this  saga 6 points and a rating value of 1 ;en
give 1 out of 6 points to current saga ;en
give 0 rating to She and Allan book ;en
Rate Half Past Human three stars ;en
mark the current textbook a 1 from the total of 6;en
Rate this textbook 2 out of 6 ;en
Rate this book one stars;en
I would  the Animal Liberation chronicle 0 points and a best rating of 6 ;en
 the book A Girl, a Man, and a River a five ;en
Give the book Men and the City 3 out of 6 stars;en
I give The Thibaults a 1.;en
I am giving this  book under the series section one stars ;en
Rate The Scarab Murder Case a one ;en
Give five points to An Ice-Cream War ;en
rate current saga one point out of 6 ;en
I would rate Tree of Smoke a value of two or a best rating of 6;en
I give the previous album a 4. ;en
give three points to current book;en
Give this essay four stars / 6. ;en
I would rate The Kid from Hell a value of 1 and a best rating of 6;en
I rate Secret Water as a 4.;en
the last essay is a 2 out of 6 ;en
Rate A Battle of Nerves three stars out of 6;en
Rate The Abyss of Wonders 4 out of 6.;en
Can you rate this novel as a four? ;en
Rate this book three points ;en
rate the Beyonders: A World Without Heroes saga 1 out of 6 stars;en
Rate the current essay 5 of 6;en
I give The Monkey and the Tiger a rating of 2 points.;en
give 2 for this essay;en
Rate The Abyss of Wonders 4 out of 6. ;en
Rate this textbook 2 points.;en
I rate the book Creature in the Teacher 3 stars;en
I think this novel should get 0 stars ;en
Rate The Fall-Down Artist 5 stars.;en
I would give this current novel one stars;en
Rate the White Lies chronicle 0 stars ;en
Rate the current essay 0 of 6 ;en
Rate Through Distant Worlds and Times 5 of 6 points;en
give one points to current book;en
Rate The Lie Tree five;en
give it a 0 for this essay;en
Rate my current novel 3 out of 6;en
I'd say Life in the Iron Mills was a five;en
I would rate this album 3 stars;en
rate the next book four stars;en
give this a four for the next series of points;en
Give the current series two stars.;en
The Revolution Script should have a rating value of three  a best rating of 6 ;en
give 5 out of 6  to The Intimidators chronicle ;en
Rate Gates of Fire a 2 ;en
Mars Probes gets a 1 rating.;en
give 3 out of 6  to The Secrets of Love ;en
rate the book Dies the Fire one points ;en
Give The Phantom Ship a zero.;en
Rate The Stars Shine Down 5  ;en
Rate this album 5 points;en
this novel gets 1 star ;en
Rate The Crossroads 4 of 6 stars ;en
Rat Short Trips: A Christmas Treasury a 3 ;en
Rate this novel a 1 out of 6;en
this album deserves to be rated one out of 6!;en
Rate the Wild Boy series 3 out of 6 stars;en
 this novel I give a rating of 4 out of 6 ;en
rate the Poems for Midnight saga 4 points ;en
add this current book five stars ;en
Rate the current textbook 4 out of 6 points;en
Give the current essay a rating of zero out of 6 stars.;en
Rate Cuisines of the Axis of Evil and Other Irritating States one out of 6;en
 the book Now and Forever 1 out of 6 points ;en
Give Signals of Belief in Early England four of 6;en
Rate Phoenix: The Fall & Rise of Videogames one points out of 6;en
this novel deserves 4 to 6 stars for its writing.;en
I want to  Nathaniel Fludd, Beastologist 1 out of 6 ;en
Rate this book 3 out of 6 points;en
I'm rating The Skystone with three points;en
Rate the current book five of 6 stars ;en
rate The White Goddess 2 of 6 ;en
Rate Mouse Noses on Toast 5 points out of 6;en
Give this book a rating of four out of 6.;en
Give four stars out of 6 to Practice to Deceive;en
rate Scarecrow and the Army of Thieves a three ;en
Rate The Art of Struggle 3 ;en
I would  The Persistence of Vision 1 stars and a best rating of 6 ;en
rate the current book a four;en
Rate this textbook a 1;en
give 4 out of 6 stars to current chronicle;en
Give Mason & Dixon a rating of three.;en
rate this album one out of 6 ;en
Rate Timeline of science fiction 4 out of 6 ;en
The chronicle of The Emperor Wears No Clothes was too naive and simple, I'd give it 1 out of 6 stars.;en
Rate Homicide: A Year on the Killing Streets five stars;en
I give the previous album one out  6 points. ;en
 The Road to Reality: A Complete Guide to the Laws of the Universe two points ;en
Rate Book of the Dead three stars ;en
Rate Voyages by Starlight a value of 0 ;en
Rate this textbook zero stars ;en
This  book only nets 3 out of 6 points ;en
award this current novel 0 points ;en
Rate the City of Lost Souls one of 6 points;en
Give Drift: The Unmooring of American Military Power 0 out of 6 points.;en
rate Peveril of the Peak a five ;en
rate the current saga one stars;en
rate Opération Sweet Tooth 2 points ;en
Rate this album 2 stars ;en
Give The Turning Point a 0 out of 6. ;en
rate The Long Dark Tea-Time of the Soul 5 stars;en
I give the Ways of Escape chronicle zero out of 6;en
rate the current essay a four;en
rate this book chronicle 1 points;en
I give this series a one out of 6 ;en
I would like to rate The Hundred-Year Christmas four stars.;en
Rate this book four stars out of 6 ;en
I think this essay is only good for one stars;en
I give The Beatrice Letters 2 out of 6 stars.;en
I give Ruled Britannia a rating of five out of 6.;en
Rate my current textbook 1 out of 6 points ;en
The Last Hawk gets a total of 3 out of 6 stars from me;en
 I would give this current book a rating a five and a best rating of 6;en
Rate this chronicle a 4 ;en
this book gets a 1 out of 6 rating from me.;en
I'd rate this book 1 of 6 stars ;en
For this  I give a posiabble 3 of 6 ;en
Rate the current chronicle a one;en
rate this book a zero ;en
give Private Games 3 stars out of 6 ;en
Rate this book zero out of 6;en
For the current chronicle I give five of 6 ;en
 The Longest Day with zero stars out of 6. ;en
Gie this textbook 3 stars;en
River Secrets deserves a best rating of 6 but  points ;en
Rate the current book one of 6 points;en
give  points out of 6 to The Devil in a Forest ;en
I would rate this album a 3 ;en
Rate the current essay 3 out of 6 points;en
Give this book a rating of two out of 6.;en
I gave Perchance to Dream 4 of 6 points;en
I give the following album two out of 6 stars.;en
Rate this textbook 4 out of 6 stars;en
Rate the current novel five of 6 points ;en
This current book deserves 1 points;en
Rate this novel 3 out of 6 points. ;en
rate the current chronicle five stars;en
A rating of four out of 6 goes to Memory in Death;en
give two out of 6 points to current textbook;en
Rate my current album 5 points ;en
Rate the Deception chronicle one of 6 points ;en
I would give zero  to A Concise Treatise on the Art of Angling out of 6. ;en
Rate the current essay a three;en
i give The Aquariums of Pyongyang 3 out of 6  ;en
Rate The Lie Tree five ;en
rate the following series five  points;en
Rate In Enemy Hands five stars out of 6 ;en
I would  this chronicle a value of 1 and a best rating of 6 ;en
Give The Hollow Man three out of 6 stars;en
rate the next essay five of 6 ;en
I think this book should have a rating value of 1  a best rating of 6 ;en
Give this textbook zero stars ;en
Rate the current book one of 6 points ;en
Rate Bestiary of Dragons and Giants four of 6 ;en
give this textbook four stars;en
I give a zero rating for this essay ;en
Rate the current novel 1 of 6;en
I give this book five stars out of 6 ;en
this next essay is worth five ;en
 Dragons of a Vanished Moon 1 of 6 points ;en
Rate this album 4 points;en
I'm rating the book Tomorrow two out of 6 stars;en
rate this album 2 of 6 ;en
give the current chronicle three points ;en
Out of 6  I give the chronicle three and look forward to what's next. ;en
I'd like to  this textbook 4 out of 6 ;en
give one out of 6 to Encyclopedia Magica chronicle ;en
Give Directive 51 three out of 6. ;en
rate the current book novel 5 out of 6;en
I give Obama: From Promise to Power 6 points and a rating value of 1;en
give 5 out of 6 to this book ;en
I give this current novel zero stars and a best rating of 6;en
Rate this textbook a 5 ;en
rate this textbook four stars ;en
The Citrus Industry is a four rating value and a best rating of 6;en
Give the current album 2 out of 6 points.;en
 5 out of 6 points to My Favorite Fantasy Story ;en
Rate Making Sense of Marx 2 stars. ;en
Give the  Buzz about Bees a 2 star rating out of 6. ;en
Give the  novel a rating of 5 out of 6. ;en
Rate The Honourable Jim a three ;en
rate this novel a 1 of 6 for me;en
rate the previous novel a 1 out of 6;en
I have to give this current essay a rating of three;en
Rate the current novel a one;en
 The Autobiography of Alice B. Toklas 1 out of 6 stars ;en
 Peter and the Sword of Mercy 3 of 6 stars ;en
3 out of 6 for the last album;en
Give Hornblower in the West Indies 0 / 6  ;en
add this current book five stars;en
the horrible current essay gets only a 0 out of 6;en
Rate my current essay a 2;en
Rate The Costs of Accidents a three ;en
I want to rate The Obama Syndrome zero of 6;en
rate the current essay a 0 for me ;en
 She: A History of Adventure a one of 6 ;en
I give Ruled Britannia a rating of  out of 6. ;en
Freud: A Life  Our Time deserves a solid 4 ;en
I'd give the Main-Travelled Roads series 0 points out of 6;en
Rate the current novel three points ;en
out of 6 rate this a zero for Memories of the Ford Administration;en
give The Search for the Snow Leopard a rating of zero of 6  ;en
I want to  A Long Short War series a four out of 6. ;en
rate The Overton Window series a two out of 6;en
I rate Monster Mythology 3 points. ;en
rate The Sail and Steam Navy List 5 stars;en
rate the current essay a three;en
 The Secret of Dr. Honigberger 2 points out of 6 ;en
Rate 5 out of 6 points to My Favorite Fantasy Story;en
i give the following textbook three points ;en
I would like to rate the current chronicle 4 to 6 stars.;en
rate this textbook two of 6 stars ;en
give 4 points to this textbook;en
Rate the Casualties of Peace series one of 6;en
Give The CIA  the Cult of Intelligence a rating of 5. ;en
rate the current essay one out of 6;en
rate The Pure Weight of the Heart series 5 points;en
this album is hot trash, it's totally zero stars. ;en
I would give Hell Hath Fury one points ;en
Rate this book 3 of 6;en
rate the chronicle Ten from Tomorrow a 2 ;en
 The Agent of Death with five stars out of 6 ;en
I give The Vinyl Cafe Notebooks a 0 of 6;en
Rate the book White Girl Bleed a Lot only two points. ;en
I'd rate The Rise of the West a 2 of 6 stars;en
I give 3 of 6 stars for the current textbook;en
using stars the  object gets four for the textbook out of 6 ;en
Rate this textbook two out of 6;en
rate Girls Forever Brave and True zero points ;en
Rate this essay a four ;en
give one out of 6 stars to Free Market Fairness;en
The current saga deserves a 5 rating. ;en
give 0 out of 6 points to current book ;en
Give The Phantom Ship a zero. ;en
Rate Lords of the Rim zero stars;en
my rating for Dilvish, the Damned is 4 out of 6;en
For the current saga I  2 of 6 stars ;en
give 1  to The Duel: Pakistan on the Flight Path of American Power saga ;en
give the current album a 1;en
give two stars to current chronicle;en
Rate Encyclopaedia of the Social Sciences zero out of 6;en
Please provide the Rainbow Mars series a zero out of 6 points.;en
Rate An Act of Terror 2 stars. ;en
I am giving this current textbook zero out of 6 stars;en
rate the current textbook 2 out of 6 ;en
I want to give this album 3 points;en
The  the Gardens of the Moon deserves only 1 stars. ;en
Can you rate this current essay with zero stars?;en
Give Love in the Time of Foreclosure 4 of 6;en
Rate this current saga one points;en
I give the following textbook 3 points. ;en
Give The Diamond Chariot a 0 out of 6.;en
I rate Shadow of Suribachi at five stars. ;en
To the Stars: The Autobiography of George Takei gets four out of 6  ;en
I want to give The Unpleasantness at the Bellona Club 5 points;en
give 3 out of 6 points to The Secrets of Love;en
The Cool World gets 4 points ;en
Rate this textbook 4 stars.;en
Give Anatomy of a Typeface a 1 rating. ;en
the previous novel is worth two out of 6;en
Please  the current textbook with 5 stars out o 6 ;en
give Jackass Investing a three ;en
give one points to current book ;en
For this current saga I give 5 out of 6 possiable points ;en
Rate the current book 0 stars ;en
give 5 points to current novel ;en
Rate current book 2 of 6 ;en
I want to give the  textbook 2 out of 6 ;en
Rate Richard Carvel 4 out of 6;en
I am giving this current textbook 4 stars ;en
 the book White Girl Bleed a Lot only two points. ;en
Give 5 / 6 stars to Expressive Processing;en
I award this next series 0 points ;en
Rate the book Post Office four points ;en
Rate Cold Comfort Farm a three out of 6 total;en
give Power of Faerûn two of 6 ;en
give 5 out of 6  to Myths of the Hindus & Buddhists ;en
Give this novel a rating of 1 points. ;en
rate The Odd Angry Shot five points;en
A rating of 5 of 6  goes to Dickson McCunn trilogy ;en
Rate the current chronicle a two ;en
Rate this textbook only three points;en
Rate The Tritonian Ring zero;en
I am rating this book under the series section a three out of 6  ;en
Rate current book 0 ;en
rate the current book 3 out of 6 stars ;en
rate the series The Quantity Theory of Insanity 1 ;en
Rate this current novel 1 out of 6 points. ;en
Rate Merlin Effect a 0 ;en
give 4 out of 6 points to current essay;en
Give this book a 2.;en
rate The Other Wind 2 of 6 ;en
give Power of Faerûn two of 6;en
 Homicide: A Year on the Killing Streets five stars ;en
rate the chronicle Ten from Tomorrow a 2;en
give five out of 6 stars to current essay ;en
the last novel is a solid 3 out  6 ;en
rate this essay two points out of 6 ;en
Rate the current textbook four out of 6;en
The Law of Dreams gets a low rating of one;en
Rate The Doomsters four out of 6 stars;en
rate this essay 2 points;en
Rate The White Body of Evening  one of 6;en
Rate the current series a one.;en
Rate The Night Land three out of 6;en
rate The Zenith Angle one out of 6 points ;en
I rate Cold Tom four points and a best value of 6;en
Give 2 out of 6 points  to A Tale of Time City;en
give five stars to The General saga;en
Rate The Masks of Time zero of 6 stars ;en
Rate this textbook two out of 6 ;en
Rate the current novel five of 6 ;en
Rate A Taste of Blackberries  a three;en
Rate People of the Lakes 2 of 6 ;en
give four out of 6 stars to current essay;en
 the book Magic: History, Theory and Practice five stars ;en
Rate The Plot to Save Socrates one stars;en
Rate this textbook 1 of 6 ;en
Rate Who Moved My Cheese? a one;en
Give The Body Artist a 5. ;en
I want to give Dressed To Kill a one;en
For the book The Sting of the Scorpion I give three of a possiable 6 rating;en
rate the current essay 2 stars ;en
Rate the current novel a 3. ;en
The current essay feels like a 3.;en
zero points for Birds of South Asia. The Ripley Guide;en
The book the Geoff Ryman bibliography should have a rating of three to 6 points.;en
The current textbook Gets 3 stars;en
Give the current book 5 out of 6 points.;en
I am giving this current book album 0 out of 6 stars;en
Rate What Is Called Thinking? 0 stars;en
give 5 points to The White Hotel ;en
rate this chronicle 3 stars ;en
give five out of 6 points to this album;en
Rate Lamy of Santa Fe 5 of 6 stars;en
I give The Prestige a rating of 5 ;en
Rate this book 1 of 6 points ;en
I rate Mosses from an Old Manse a 0 ;en
The Execution of Justice only deserves 2 points ;en
Rate Contesting the Future of Nuclear Power a four;en
Rate the current novel 1 out of 6 points.;en
rate The Republic of Thieves chronicle three out of 6 points;en
I am rating this book titled A History of Warfare under the war series 1 out of 6 stars;en
Give the book The Adventures of James Bond Junior 003½ 2 points for a rating.;en
Rate the current chronicle a two;en
I would rate Oblivion: Stories a two;en
I want to give the current saga 0 stars ;en
I giv the current novel a four ;en
rate this book chronicle 1 points ;en
I would give Feast  the Innocents a value  1 ;en
I want to give Science Fiction Adventures in Mutation 0  ;en
Give the current essay five points.;en
Rate the current essay 5 of 6 points ;en
The Citrus Industry is a four rating value  a best rating of 6 ;en
rate Licence Renewed a 4;en
rate this book titled The Silver Chalice a 1;en
Rate the current chronicle 0 out 6 stars;en
Rate this album a five ;en
Rate Paradise News 2 out of 6 ;en
the next album is only one stars ;en
 Awaiting Strange Gods: Weird and Lovecraftian Fictions a 1 ;en
I feel that Sons  Lovers deserves a rating of 2. ;en
Give Miso Soup a rating of one points. ;en
rate this album 2 points ;en
For the book Tale of the Toa I give  points ;en
Give Star Songs of an Old Primate 4 out of 6  ;en
rate this book 1 out of 6;en
rate this current saga 3 out of 6 points;en
Give the  album on my playlist a rating of three. ;en
I would  this textbook 5 points and a rating value of 6 ;en
Give the current series four / 6 points.;en
Rate the current saga a two;en
please give a 2 out  6 to House  Many Ways ;en
Give this novel a rating of 1 points.;en
rate the current chronicle 0 of 6 stars;en
rate this book 5 of 6 points;en
give 2 out of 6 points to current book ;en
Give Twas the Night Before Christmas 0  out of 6. ;en
Rate my current book 3 out of 6 ;en
Rate Seeing the Big Picture a zero out of 6 points;en
I give the current essay a two;en
rate Dick Sand, A Captain at Fifteen a two out of 6;en
this is a 6 rating for the album down to one;en
Rate this album one value ;en
give Wannabe: How The Spice  Reinvented Pop Fame 2 points ;en
Rate The High Deeds of Finn MacCool one out of 6;en
Give this textbook a four ;en
rate the book Who Will Cry When You Die one out of 6 stars;en
give The Rosales Saga  2 of 6;en
give two out of 6  saga called The Big Question ;en
I am rating Book of Challenges four stars;en
rate The Breaking Point a three ;en
I am giving the book Dorothy  the Wizard in Oz a zero out of 6 rating ;en
Add a rating of 0 out of 6 stars to The Lady of The Aroostook;en
 the Tropic of Cancer book a 2 out of 6 ;en
Give this essay a 2 out of 6. ;en
I would give this novel four stars ;en
I give it a rating value of four to 6 to a book called Liberalism and the Limits of Justice;en
Rate The White Abacus zero out of 6 points;en
I rate Monster Mythology 3 points.;en
Give The Frog Prince, Continued 2  out of 6. ;en
rate the book Spells and Philtres five points;en
Rate the current novel 3 of 6 stars ;en
rate the following novel one of 6;en
Rate The Seventh Decade two of 6 points ;en
I give a rating of 3 to The Ultimate Resource.;en
Rate this novel a 3;en
Rate the Rogue Lawyer 4 out of 6 ;en
Rate the current album 2 stars ;en
I give The French Suicide 5 stars;en
Cock-A-Doodle-Doo! was awful. I'm giving it a 0 out of 6.;en
Rate the current essay 3 out of 6 points ;en
Rate this album 0 points ;en
Rate this album zero of 6 ;en
I would give The Lady of the Rivers 0 stars;en
Rate this novel five of 6 ;en
rate the current essay book four out of 6 points;en
rate the current textbook a 5 ;en
give one out of 6 points to this album;en
Rate The Vanishing Thieves 4 out of 6 ;en
I rate this essay a two of 6 points ;en
this album is hot trash, it's totally zero stars.;en
I want to give Nautch Girls of India four out of 6 points;en
give this current essay five out of 6 stars;en
I would give this  textbook a rating of 1 points and a best rating of 6 ;en
I want to  The Medici Seal two out of 6 points ;en
Rate The Courtship of Princess Leia saga a two ;en
Give The Frog Prince, Continued 2 points out of 6.;en
Rate this novel 1 points.;en
Rate this album a 3;en
I'd rate this novel a five ;en
give Begums Thugs and White Mughals four points ;en
rate this book a five.;en
The Postman is awful and only gets a 1 out of 6. ;en
Rate The Mills of The Kavanaughs series a one ;en
rate The Lotus and the Storm zero of 6;en
put a rating on this book of three;en
I give the last textbook one out of 6 points.;en
Give The Slap 0 stars ;en
Rate 3 out of 6 points to Darkworld Detective ;en
The Sins  the Cities  the Plain gets a rating  one ;en
Give the current album a four.;en
Rate A Division of the Spoils 5 stars;en
I want to give The Canon of Medicine one out of 6  ;en
Rate this textbook a zero;en
this chronicle is a zero out of 6.;en
stars for this album are one for the current 6 ratings;en
rate my current novel four out of 6 stars;en
please give a 2 out of 6 to House of Many Ways;en
The current textbook Gets 3 stars ;en
How can I rate the current chronicle 5 stars? ;en
rate Covering: The Hidden Assault on Our Civil Rights 1 point;en
Out of 6 stars the last novel gets only four;en
I give the Carry Me Down  three of 6 points ;en
National Lampoon Tenth Anniversary Anthology 1970–1980 is a 4 out  6 read ;en
rate the book Line to Tomorrow three stars;en
Add a rating of zero points out of 6 to The Inheritance of Loss;en
 The A-Z Guide to Arranged Marriage 0 of 6 ;en
Rate the current textbook one stars;en
I would rate That Old Ace in the Hole one stars and a best rating of 6;en
I give Cross Country four out of 6.;en
rate current essay 1 stars ;en
Rate Short Trips: Destination Prague five out of 6;en
Rate the current book a zero.;en
I give the part of the  Growth Fetish four out of 6 stars. ;en
Give Whispers in the Graveyard a five.;en
Give zero / 6 stars to the current album;en
This current album would get 6 stars or a rating value of 1;en
The Bone Season is worth at least three points;en
Rate The Change 0 out of 6 points ;en
rate The Plutonium Files a five ;en
This current essay should have a best rating of 6 and a rating value of three;en
I give the following album a zero. ;en
give two points to Wild Blood;en
rate the current saga zero of 6 stars;en
I give Why Orwell Matters a rating value of 2  a best rating of 6 ;en
I want to give Panther in the Basement four  ;en
Rate Unlimited Power 4 of 6 points ;en
Rate The Seventh Decade two of 6 points;en
Rate my current book 1 out of 6 points;en
 Cuisines of the Axis of Evil and Other Irritating States one out of 6 ;en
Give this album 1 stars. ;en
Give the current novel a 3 out of 6 rating;en
rate this book 4 out of 6;en
I give The Cat and the King 2 stars.;en
give two out of 6 points to current album ;en
Rate this book 1 of 6 points;en
give 1 out of 6 points to current textbook;en
I would give Dead Man Falling 5 points and a best rating of 6;en
Rate the current textbook 3 of 6 stars ;en
rate the book Joyful Noise: Poems for Two Voices 3 points;en
Rate the current textbook a 4;en
rate this book one for this stars judging ;en
rate the current book 0 of 6;en
Give this  a rating of two out of 6. ;en
