expression;language
Please look up The Immortals television show.;en
Rate trailer Geek Chic;en
Find Half Cut Tea.;en
I'd like to see the trailer  History  Theory ;en
 Terminator 3: The Redemption, a picture ;en
find me a game called Spaceball;en
find The Covered Wagon, a game;en
Find a painting called Satisfaction Is the Death of Desire.;en
 creativity of Wild About Animals ;en
 the Mystery Woman saga ;en
I'd like to see the   Inquiry into the Good ;en
Look for the album called The Tale of Mr. Jeremy Fisher;en
Look  Global Clubbing: The Netherlands. ;en
I need to find the creative work Burn Baby Burn;en
show creative Labor Notes ;en
 Keep Your Right Up song ;en
What is the trailer  Feel the Passion. ;en
show  a picture of Nokia Football Crazy ;en
Find a photograph called Call on Me.;en
Show me the movie Purple Heart Diary.;en
 the song titled The Rivalry: Red v. Blue ;en
Find a saga called Story of My Life.;en
Where can I purchase the TV show Time for Heroes;en
Find me the photograph The Late Music;en
Where can I  the Sounds to Consume album? ;en
Find the photograph A Little Less Sixteen Candles;en
 the Envoy of Lucifer show ;en
Look  All That Matters ;en
Show Panic  the Streets ;en
 a novel called  the Case with Paula Zahn. ;en
show me the picture Totally True Love;en
 you please look up the game, The Islanders? ;en
 the Show Your Hand show ;en
What is the television  Phil Ochs: There but  Fortune playing ;en
 TaskCracker for Outlook, a game ;en
Need to find the TV series called Administrative Behavior;en
find a television show called The Passion of the Betty;en
 can I locate the game Legion  Mary: The Jerry Garcia Collection ;en
 a painting called The Book of Folly. ;en
show creativity in Ah ;en
Find Manual of Love 2.;en
Show me the trailer for The Glades.;en
I am looking for the creative work A Wonderful Life;en
Where do get photograph of  Own Best Enemy ;en
Find me the documentary A Winter of Cyclists;en
Go to the movie Welcome to Tokyo;en
find Sappho ;en
 a picture called Blink of an Eye. ;en
play the Hell of a Life movie;en
find Karol: The Pope;en
Find me An Echo in the Darkness;en
Find the Return to Grace saga;en
I'd like to  Miss Congeniality ;en
I want to  the TV series Krieg  Chinatown ;en
Can you pull up the American  Awards  1975 ;en
Wish to read the  called The Wizard  Stone Mountain ;en
 the Graduate Faculty Philosophy Journal album ;en
 The New Legend of Shaolin video game ;en
 a photograph called Sleeping with the Enemy. ;en
Find a book called Environment and Behavior.;en
search for Space on My Hands;en
Can you  Fire Escape  the Sky: The Godlike Genius of Scott Walker ;en
I want to play the game The Celestial Hawk;en
 a TV show called Ride the Wind ;en
Find a video game called Young.;en
I want to view the picture  Old Monterey. ;en
Find me a soundtrack by Ghost Town Prophecy;en
Find me the Lace and Whiskey soundtrack;en
I'm looking for a novel called The Adventures of Lolo II;en
Where can I find the TV show MetaboLights;en
 Carry me in your dreams ;en
Show the Immortal Grand Prix;en
Where can I  the soundtrack for Steamboat Bill? ;en
Find a book called The Echo Chamber.;en
Where can I see the television show, Jimmy Two-Shoes?;en
Can you help   the We No Who U R game? ;en
I'd like to play the album Clarke;en
 a movie called Dorothy  the Witches of Oz. ;en
I want to listen to the song Shamus;en
find a show called The Crowd Roars;en
Play the song Aura II: The Sacred Rings;en
Can you  the  The Dumping Ground Survival Files ;en
Show me the picture Creatures of Light  Darkness ;en
find soundtrack titled The House of the Yellow Carpet;en
I'm looking for the hit album, The Politics of Dancing.;en
Info on show Natural Language  Linguistic Theory ;en
find Love Will Tear Us Apart, a photograph;en
 the photograph The Remix please ;en
 the TV series I Build the Tower ;en
Where can I see the show Latin for Lovers?;en
find Valley of the Dolls;en
 a television show called Sensation Comics ;en
Get  the Elvis’ Christmas Album TV show. ;en
 an art called Cassidy. ;en
Get me a picture about Sardonic Wrath;en
 a photograph called Midnight Mystery. ;en
Look for Little Computer People;en
Look up The Dock of the Bay show;en
Show  the album Til the Morning ;en
Find THUNDER IN THE EAST.;en
Help me search UFC on Fox show.;en
Find me the painting Fallen Sanctuary;en
 me the picture Live in Paris 1975 ;en
 me the book  People Were Fair  Had Sky in Their Hair… But Now They’re Content to Wear  on Their Brows ;en
Find the Love And War soundtrack;en
find American Psychologist, a game;en
find the video game called Turnin Me On;en
I'd like to see Walk on the Wild Side: The Best of Lou Reed;en
Can yo   the game A Silence That Screams? ;en
Where can I listen to the song The Imposter?;en
I want to  Strange Brother ;en
 me the novel titled Fertile Ground ;en
Find the TV show titled Timerider: The Adventure of Lyle Swann;en
I'm looking  the television show titled Justice League ;en
Can you pull up the television show called Electric Boogaloo;en
Can you help me find Tears  a Willow? ;en
Search for High Chicago ;en
Find a TV series called Manufacturing Consent.;en
show schedule for Loved by Thousands;en
Look for the Girl  Mirror movie ;en
I'd like to see the  City University  Hong Kong Law Review ;en
Look for Global Clubbing: The Netherlands.;en
Can I see the album SWAT Force?;en
find The Moldy Peaches ;en
find the song titled The Mole Show Live at the Roxy;en
where can I find a painting called Battlestations: Pacific;en
Play the soundtrack for Back to the Future;en
show creativity In the Red saga;en
some  a Healthy picture ;en
 a trailer called Hellboy: The Troll Witch  Others. ;en
 Returned to Your Mind. ;en
show creativity of Mind Chaos;en
find Me. I Am Mariah… The Elusive Chanteuse;en
Please  the song House of Wedlock ;en
Show me the lowest price for the game Sinatra Reprise: The Very Good Years.;en
Please  up the painting, Modern times. ;en
 The Nubians of Plutonia trailer ;en
I want to listen to the  Magical  Lyrical Nanoha StrikerS ;en
 information about the album Flipper City ;en
I'd like to  the  game Time to Kill ;en
How can I see the  Pulse 2: Afterlife? ;en
find Touch of Eva, a TV show I want to see;en
Please look  Catch a Falling Star ;en
Find a video game called New York 911.;en
Find Resurrection of Evil.;en
Find a video game called Batman: The Return of Bruce Wayne.;en
 the novel WWE Legends of WrestleMania ;en
find the album Until the Whole World Hears;en
Find Head Start ;en
 the painting ICAC Investigators 2014 ;en
Can you get the TV show, ENTER THE MATRIX?;en
Is the TV show The Prodigal Wife on today?;en
Can you please find me D.R.E.A.M.?;en
 the video game The Genesis Machine ;en
play the Caps Lock trailer;en
What does For All the Wrong Reasons look like;en
Find a trailer called No Reservations.;en
Play show of Cissy Houston;en
Please search Cardin in Australia saga;en
Look up Applied Linguistics ;en
I'm trying to find the game called Give Me My Remote.;en
 the book A Glorious Way to Die ;en
 a trailer called Eurythmics discography. ;en
Show me the album Clarke;en
 trailer of Do Whatever Turns You On ;en
Please pull up Nothing Feels  ;en
Look up the television show called Monster Mash;en
find Sailing The Seas Of Cheese;en
I want to see the trailer for No One;en
Look for All Broken Up and Dancing which is a video game;en
I want to watch the TV  Official Detective ;en
Where can I find Appalachian Journey;en
Find me Under the Skin;en
Where can I view the photograph of Johnny Cool;en
Find the album Future of the Past;en
Find  title Champagne Showers ;en
find Bump Off Lover ;en
I'd like to see Spyforce;en
I want to  the  Pokémon the Movie: Black—Victini  Reshiram  White—Victini  Zekrom. ;en
Find LaserLight.;en
 a soundtrack called The Outpost. ;en
Look  the creative work called White Sugar ;en
I need a photograph  Days  Wine  Roses  Other TV Requests ;en
 Texas Review  Entertainment & Sports Law creative song ;en
I need work of Father Dearest;en
where can I watch the TV show Terrorists: The Kids They Sentenced ;en
I want the movie Perseo Miranda  his Theatre ;en
Where can I  the photograph of Mr Blobby ;en
I'm looking for The Music of Nashville: Season 3 saga;en
 the Deathsmiles II soundtrack ;en
Can you  me a trailer for Phineas Redux? ;en
Find me the album The Weed Tree.;en
 do i purchase the book, Baby-Sittor? ;en
search  the picture Boomtown ;en
 me a trailer for The North-West Passage ;en
Find A New Machine;en
Search  To Heart 2 ;en
play the What I Need to Do soundtrack;en
find Projections, an album;en
Help me   Time to Time, a TV show ;en
 a painting called Boating on the River Epte. ;en
I'm looking  the video game called The Supernatural Events  Campus ;en
find The Valentyne Suite ;en
find If These Walls Could Talk;en
Find television show on Windows Live TV;en
Is there any creative work for Heterocycles?;en
find The Loving Spirit;en
 the soundtrack  The Lord of the Rings: Conquest ;en
Can you please   The Biggest Loser Brunei: The Spirit of Life photograph? ;en
Where can I  the picture the Japanese Lovesong  me? ;en
I'm looking  the novel  a Scream to a Whisper ;en
 a game called The Guyra Ghost Mystery. ;en
 the Burn the Sky Down album ;en
I need a photograph  The Oregon Desert ;en
find the novel The Thunder Rolls;en
show The Taste;en
I  looking  a creative work called Something Warm ;en
 creative soundtrack Pitch Black Brigade ;en
show The Taste ;en
Please  me The Hanging Valley movie. ;en
Find a song called You Cross  Path. ;en
show creativity of Construction Project Information Committee;en
Find a picture called Blink of an Eye.;en
Can I hear the song American High.;en
 creative song UFO Senshi Dai Apolon ;en
I'm looking to  Suryavanshi. ;en
Find a game called The Life and Loves of Tschaikovsky.;en
 can I view the picture  Workin’ with the Miles Davis Quintet ;en
I'd like to see Confessions of  Indian Teenager ;en
find a movie called Single Collection: Hotchpotch;en
show  God Bless the Child photograph ;en
Please look up Two More Years soundtrack.;en
I want to see the novel, The Green;en
 The Legend of Jesse James novel ;en
When was the TV show CrazySexyCool taken off air?;en
 me the song called The Budapest Beacon. ;en
 a picture called Neighbourhood. ;en
 to get album Justified ;en
Find City of Light. ;en
Where can I get the video game Faith in Chaos?;en
show creative book named Pencil Thin Mustache;en
I'd like to hear the soundtrack for Just Once in My Life.;en
 the TV show Starship Titanic ;en
find a saga called Set Sail the Prairie;en
 Cluster Computing, a game ;en
show creative picture of Brenda’s Got a Baby;en
Can you please look up the game, The Islanders?;en
Where to watch television show Linger Awhile: Live at Newport and More;en
Play the Seamus Heaney Collected Poems song;en
Please find me the Rear Mirror saga.;en
Look  the Editor & Publisher TV series ;en
I'd like to watch the TV series Sailor Moon SuperS: The Movie;en
 me the book called Suffer ;en
 me the documentary A Winter of Cyclists ;en
Search for Innocence  Hell ;en
find Cascading Waterfall;en
Where to get saga of A Brush with the Law;en
Look  the Itv.com song ;en
 me the book Filthy Lucre Live ;en
Find a TV series called Dirty Politics.;en
I am looking for a work called Carry You Home;en
I'm looking for the saga Why Men Leave Home;en
show the creativity of Where What When;en
Look up the This  Halloween trailer ;en
Show me KurdishMedia.com ;en
Find Half a Sixpence photograph;en
Where can I listen to the soundtrack of Gibraltar: Britain in the Sun;en
 the  Don’t Break the Heart That Loves You ;en
Where can I see the  Kind of Glue? ;en
 a soundtrack called The Alice Cooper Show. ;en
Please  me the Rear Mirror saga. ;en
Find me the TV show The First Bite.;en
Can you please find the Jack Johnson En Concert picture?;en
 the Hopeless Romantic photograph ;en
find Casting Crowns discography;en
Show me the picture Gas Wars;en
Find me the TV show Ask a Woman Who Knows;en
I'm looking  the video game Masterful Mystery Tour ;en
I'm looking  the song called Standing  Something. ;en
 the television show called Tactics ;en
 the movie Post Inferno Soundtrack ;en
show  the Evil Dead painting ;en
Where can I watch the latest episode  the TV  Chu Chu  the Philly Flash? ;en
Can you pull up the American Music Awards of 1975;en
Find a photograph called Cope Park.;en
I'm trying to  the show Chant II ;en
play the TV series BET Awards 2013;en
find the They Came  Somewhere Else saga ;en
Where can I  The World According to Paris? ;en
I want to watch the  Railroad Model Craftsman ;en
Can you help me  the Author! Author! trailer? ;en
 The International Journal of Robotics Research soundtrack ;en
Find the Apple Address Book television show;en
 a TV series called Cocktail Kings. ;en
find Young Miss Holmes;en
 The Catholic Sun album ;en
Can you help me find ScholarMate?;en
play the Home Is Where the Music Is TV series;en
Show me Interesting Times: The Secret of  Success ;en
I want to listen to the song The Loving Spirit;en
I  a painting called Brubeck Plays Brubeck ;en
 a painting called Satisfaction Is the Death  Desire. ;en
Show Panic in the Streets;en
What is the book Sell Your Body?;en
show creative trailer of The Sword of the Lord;en
show Nightcall;en
Go to the  The Best  Pirates  the Mississippi ;en
show 50 Words for Snow creative picture;en
Find the work Compiled fragments 1997-2003;en
Search for the saga of Return of the Bastards.;en
I'd like to see the picture The Principle of Hope;en
search  the song Banquet  the Damned ;en
Look for Conducting from the Grave;en
I'm looking to find Kiss Me Goodbye.;en
 soundtrack titled The House of the Yellow Carpet ;en
I'd like to hear the song In a Reverie;en
What is the TV  Journal of Personality  Social Psychology? ;en
I'm looking for the saga Lifelong Ambitions;en
I'd like to see the  The Ooze ;en
show of  South Africa to South Carolina ;en
Where can I find the creative works The Very Best of Simply Red;en
show movie CrossGenesis ;en
Get  a Johnny Cool photograph ;en
Find me the Martin Morning saga;en
Can you please find me, Journals?;en
play Baby Workout ;en
Please  up The Immortals television show. ;en
Where can I stream a television show called Safety EP?;en
Can you find me the My Father My King game?;en
 If These Walls Could Talk ;en
What is the price  the album Praise the Lord  Pass the Ammunition? ;en
 The New Noise Theology E.P. ;en
show creative work of Through the Back Door;en
Where can I buy the soundtrack Bridge of Souls;en
Show  Horton  the Kwuggerbug  More Lost Stories ;en
Locate the Koi to Senkyo to Chocolate television  ;en
 As Live as It Gets ;en
show creative photograph of Icewind Dale: Heart of Winter;en
Need to find a creative work with the title Sometimes the Blues Is Just a Passing Bird;en
Show  the Sex Therapy painting ;en
search for TV show Live at Apollo;en
Can you locate the novel, Ismol Family;en
 TV series titled Sonata Mix Dwarf Cosmos ;en
Go to the photograph The Inflated Tear ;en
Can you find a photograph of Ace Ventura: The CD-Rom Game;en
find the novel A Civil War: Army vs. Navy;en
 up the Fair Warning saga ;en
Show The Family from One End Street album;en
Search for The Long Dark;en
find Long Hello  Short Goodbye, a movie ;en
find the book The Crowd Roars;en
Look for the Kiss the Girls game;en
Where can I find the picture of House Foundation;en
 can I  the video game called Izuna 2: The Unemployed Ninja Returns ;en
search for video game The Sky Is Crying;en
Find a video game called Family Dog.;en
Can you find me the movie The Countess?;en
Show the Innocent When You Dream saga;en
I need to  Best  the West Rides Again ;en
Show me the photograph Rock You Baby;en
Search  Chasing Fortune a TV series. ;en
 The Crowd: A Study  the Popular Mind soundtrack ;en
find the video game Thale;en
I'm looking for a picture titled Rock Painting;en
Find a painting called Voices in My Head.;en
 me the painting Fallen Sanctuary ;en
Show The Blackberry Bush show;en
Look  the Journal of Toxicology  Environmental Health soundtrack ;en
Find the book Bad Day on the Block;en
 me the Karl Hess: Toward Liberty photograph ;en
 a show called Some Kind of Dangerous. ;en
I'd like to  the book called The Years ;en
 creativity of Sing to the Dawn ;en
Show Force of Nature ;en
show me the painting Live – Very Live in Concert;en
Find The Best Man Holiday saga;en
Go to Attack of the Planet Smashers;en
 the Return to Grace saga ;en
read the Black-Body Theory  the Quantum Discontinuity novel ;en
Show the Glass Cloud – Single TV series;en
 search The Young Warriors game. ;en
Please help me find the video game John Michael Montgomery discography.;en
Show me the picture Creatures of Light and Darkness;en
Find book The Music Lovers;en
I'd like to see Hannah Montana  Miley Cyrus: Best  Both Worlds Concert ;en
Can i see the Encounters?;en
show creativity of Night of the Hunter;en
painting of Live from the El Rey Theatre;en
Where can I  Tales of Ghost Castle? ;en
show creativity of All for One;en
find a television show called Happy Trails;en
find Time Squared;en
I want to listen to the   Ghost  the Shell: Stand Alone Complex ;en
Look for All That Matters;en
Please look for Orion You Came  You Took All  Marbles ;en
I'm looking for the video game called The Supernatural Events on Campus;en
Find me the Fruit of Life television show.;en
Find a photograph of Adventure Time: The Secret of the Nameless Kingdom;en
 a book called Kiss Symphony - Alive IV ;en
How can I watch the television show Tinker Bell and the Legend of the NeverBeast?;en
 search the Irv Gotti Presents: The Murderers picture. ;en
Look up the Act of Valor TV  ;en
look  the trailer  Red Stallion  the Rockies ;en
show me the TV series called Take Me to Your Heaven;en
Search for Man in a Garage;en
Play 30 Greatest Hits;en
Need the saga called the Black Lamp;en
 the album Follow That Camel ;en
find Harry Potter and the Deathly Hallows – Part 2;en
Show the Bean and the Boys painting;en
 the Sarah the Teen Princess game ;en
Lets see the  series 7even Year Itch. ;en
play the television show Tears Laid in Earth;en
Please get  the Critical Condition show. ;en
find the show Trancers;en
find Trivial Pursuit: America Plays;en
 the photograph Underneath the Tree ;en
Find a picture called Battlefield Network.;en
Can you please get me Come Away with Me show?;en
Where can I listen to the soundtrack  Gibraltar: Britain  the Sun ;en
where can I find the game A Little Bit of Mambo;en
show me the picture Unfinished Monkey Business;en
What painting is on The Cure discography?;en
Show the Phish: Live in Vegas TV series;en
Find me the Big Sean discography soundtrack;en
I want to play the game Guitar Heaven ... The Greatest Guitar Classics of All Time;en
Find Your Personal Touch. ;en
 a photograph called Cope Park. ;en
Can you please  The Notebook of Trigorin game? ;en
I want the song Phrazes for the Young;en
I'm looking  the hit album, The Politics  Dancing. ;en
Can you pull up  Name Is Brain Brian ;en
I'm looking  the saga The Hardest Part ;en
I want to watch the television show Symphony for Solo Piano;en
Search  The Long Dark ;en
Play trailer of Do Whatever Turns You On;en
Show the Day the Earth Caught Fire movie;en
Show me The Tivington Nott;en
Show the Philosophy  Phenomenological Research saga ;en
Show me work of Truth and Tolerance;en
Bombshells saga download ;en
search for the album Frog and the Birdsong;en
Please help   the video game John Michael Montgomery discography. ;en
Get me a photograph of Trac;en
I'm looking for you to get me Jack of Shadows.;en
is there a program about The Last Flight?;en
 a TV show called Randy Scouse Git ;en
Find a TV show called The Extraordinary.;en
Where can I buy a hardcover copy of the book The Intangibles of Leadership?;en
show creativity  photograph of Grace Submerged ;en
Find a painting called Mr. Scarface Is Back.;en
Want to  the Dungeons & Dragons: Chronicles  Mystara ;en
Please get me Exploring the Reef TV show;en
 a book called Outpost Firewall Pro ;en
Find Your Personal Touch.;en
Where can i watch the television  The Private Affairs  Bel Ami? ;en
Show me the song 15 Storeys High ;en
Show me the picture Nothin;en
find the book Time and Again;en
show creativity  Cross Currents ;en
I want to  to the  Adobe Digital Editions ;en
Find me a saga  Reproductions ;en
Show  the Only the Strong Survive photograph ;en
Please  the album The Party Scene ;en
find Attack Surface Analyzer, a painting;en
 Le Profil Amina TV series ;en
Please help  search The Banker television show. ;en
Where can I  the novel Meast ;en
Can you  me the Spectres television show? ;en
 the Day the Earth Caught Fire movie ;en
find the photograph JBoss Enterprise SOA Platform;en
read the novel On-Line Encyclopedia  Integer Sequences ;en
Please find me the work, Earth Intruders.;en
I'd looking  the saga PlayCanvas. ;en
Please  the TV series Back to Bach ;en
I want to find the video game Masada Anniversary Edition Vol. 3: The Unknown Masada;en
show book name Straight No Chase;en
Show  The Atrocity Exhibition ;en
Who published the  JamesEdition? ;en
 you  a creative work called A Saintly Switch ;en
 I Could Fall in Love. ;en
Pull up the TV show, 40 Seasons: The Best of Skid Row;en
Please look for Catch a Falling Star;en
find The Life of Riley, a photograph;en
Search for a picture of Darker than black;en
Find I Could Fall in Love.;en
Find Night of Passion ;en
What does  All the Wrong Reasons look like ;en
Show  the album Apache Axis2 ;en
 a picture of A Breed Apart ;en
Find a game called A Very Special Christmas 7.;en
Where can I  the TV show of The School Teacher  the House ;en
 a book called Tron: Legacy Reconfigured ;en
Can you   the work titled, A Little Curious? ;en
Where can I watch the TV series Polite People;en
Please  me the work, Instrumental Directions. ;en
I need to find the work Brotherly Love;en
I'm looking for the show called The Origin of the Milky Way;en
TV series for The Thirty Nine Steps?;en
show me a picture of Nokia Football Crazy ;en
 a video game called Peaches discography. ;en
I want to listen to the soundtrack Bed of Roses;en
show song schedule Come into the World;en
When is Spyforce playing? ;en
 search the Ironbound picture. ;en
show movie CrossGenesis;en
What type of movie  is Houston Press?;en
 can I stream a television  called Safety EP? ;en
I want to find Night of the Hunter;en
show game Alien Breed II - The Horror Continues;en
 creative video game name Foros Timis Ston Greco ;en
show creative Devils to Some;en
What is the TV series  App Store ;en
I'm looking to find Suryavanshi.;en
Find the picture of The Harsh Light of Day;en
I want to see the trailer  The Entity ;en
Show The Lateness of the Hour;en
Find The Gamble. ;en
Where can I see the trailer for Experienced II: Embrace Tour 2013 Budokan?;en
 The Lousy Dance trailer ;en
Would like to find the trailer for An Experiment with Time;en
Search  Live Forever: The Rise  Fall of Brit Pop TV show ;en
Can you pull up Queen  the Organ ;en
Find the show titled The Most Charming and Attractive;en
Where to get the movie Fear of a Black Hat;en
Find a TV series called The Golden Hits of Sandie Shaw.;en
 can I download the game Miss Robin Hood ;en
 the song Memories Are My Only Witness ;en
 the Cold Dead Hand video game for me ;en
Find a video game called No Parking on the Dance Floor.;en
I'd  to hear the  Daimidaler: Prince vs Penguin Empire ;en
Where can I find the show Game of Death II;en
Search  Big Ideas painting ;en
Please pull up the trailer for Stares and Whispers;en
Where can I watch the latest episode of the TV show Chu Chu and the Philly Flash?;en
 search the work, The Mercenary. ;en
Show me Interesting Times: The Secret of My Success;en
Want a work called Walk the  ;en
find The Living Room Tapes, a TV series;en
 a show called The Inheritors ;en
I'm looking  the  to Evil or Divine - Live  New York City. ;en
Where to get painting  Channel 4 News ;en
I'm looking for a photograph called Merry Christmas.;en
Locate  the novel entitled Isthmus. ;en
I want to see the   Australian Economic History Review ;en
 a TV series called Manufacturing Consent. ;en
Search for Live Forever: The Rise and Fall of Brit Pop TV show;en
Look  Fighting Vipers 2 ;en
find the photograph Canaich;en
 Unfinished portrait of General Bonaparte ;en
Find Darker than black. ;en
  the cheapest price I can pay  the DVD called The Darkest Cloud? ;en
Need to  the TV series called Administrative Behavior ;en
 a painting called Mr. Scarface Is Back. ;en
find the song Tholireyi Gadichindi;en
play The New Noise Theology E.P.;en
 can I get Harry Potter  the Philosopher’s Stone ;en
Show me NCAA College Football 2K3;en
Please search A New Machine TV series.;en
show me the movie called People and Masks Part 2;en
Where to buy  Bright Ambush ;en
Go to the  series Love Berry ;en
show creativity  Call Me Joe ;en
Where to buy video game  Think Fast ;en
Please look up the novel, Heroes of Annihilated Empires;en
find the show The Demi-Gods and Semi-Devils;en
Show me the painting called The Descendants.;en
Play Nightbirds on Nantucket soundtrack;en
Where to get the  Fear  a Black Hat ;en
find A man needs a maid;en
find the Deathsmiles II soundtrack;en
I want to  the television  The Muppet Christmas Carol ;en
 the  The Son of Tarzan ;en
Can you get  the Maldeamores saga? ;en
Look up The Making of Milwaukee;en
 the Putrefactive Infestation trailer ;en
