expression;language
Find an album called List of Re: Hamatora episodes.;en
 me East Side Story ;en
Look for Fighting Vipers 2;en
 The Rest of My Life ;en
 me the song 2 Fast 2 Furious ;en
Can you find me the work titled, A Little Curious?;en
Where can I find the TV show of The School Teacher in the House;en
show That Little  of Gold ;en
Show me KurdishMedia.com;en
Can you  the photograph titled So Long Self ;en
I want to watch the television  Symphony  Solo Piano ;en
find movie titled Triumph of the Spirit;en
Where can I  the TV show MetaboLights ;en
Can you help me find the Author! Author! trailer?;en
 the TV series Shaun the Sheep ;en
Look  the movie Darkness Come Alive ;en
Where can I locate the  The Return  Mr. Moto ;en
Find the Mystery Woman saga;en
Can you search  Twilight Is Gone? ;en
Help me find the saga titled The Eternal Return;en
Find an art called Cassidy.;en
find a TV show called Shake Hands with Beef;en
Show  Happiness Was Free. ;en
Search for the Exiles of Time  ;en
Pull up the trailer for 2000 Years – The Millennium Concert;en
Can you  me the Dicey Business TV series? ;en
Show the Chemdex.com photograph;en
 you look  the creative work called No Gravity ;en
find Innocent world;en
 creativity of Comeback Season ;en
Please search for The Legend of Korra book.;en
Go to the  The Quantum Thief ;en
Show Famous Classic Tales television show;en
find The Good Wife;en
What is the TV show Comfort?;en
Please look up for Disney Universe.;en
show creative video game name Foros Timis Ston Greco;en
find the movie Ircle ;en
find Phinally Phamous;en
I want to play the video game ESPN Major League Soccer;en
show creativity of novel Lock;en
Show me the album Til the Morning;en
Please search Crossing Muddy Waters work;en
Please search  the Two Faces of  Girlfriend saga. ;en
 a picture called Every Little Thing She Does  Magic. ;en
 The Singles Collection Volume 4 ;en
 Live in Tokyo for me ;en
 a soundtrack called Fast as You ;en
  I view the trailer Extreme – The Collection ;en
Play me Memoirs of Modern Love: Curious Age;en
Where can I  Conduct Unbecoming? ;en
show Chocolate Rain creativity ;en
Where can I purchase the TV  Time  Heroes ;en
Show  the work The Catholic Weekly ;en
Find WxHexEditor.;en
 a painting called Mister Whiskers:  Favourite Nursery Rhymes ;en
show creative song called Holidays  the River Yarra ;en
can you get  the television  called Start It Up? ;en
What is the cheapest online price for the Instincts saga?;en
Find the TV series From the Top;en
 A Pet of the Cairo Zoo ;en
 a soundtrack called The Christmas Shoes. ;en
Look for the trailer to Hickory Daily Record.;en
Find a painting called Voices in  Head. ;en
Search  the song called Journal  the American Statistical Association ;en
Look for Conducting  the Grave ;en
Where can I purchase the TV series The Royal Sessions;en
find a painting called Screen Souvenirs;en
show movie schedule of The Big Mouth;en
Find Live at Bonnaroo. ;en
 the album Just for Laughs ;en
 a  called The Easy Way to Stop Smoking. ;en
I want a photograph  Elizabeth the Queen ;en
look  the creative work Meltdown – Days  Destruction ;en
Where can I find the movie The National Law Review;en
Show  The Heart Specialist ;en
 you pull up The Sanford Herald ;en
Find A World Apart.;en
find an album called Burnout: The Ultimate Drag Race Challenge;en
Find The Coffin. ;en
Show  the movie Sonic Triple Trouble ;en
 a painting called Beyond the Neighbourhood. ;en
show creativity of painting of  Too ;en
find Black Mirror III: Final Fear ;en
Find TV series of Noroi - The Curse;en
show creativity of  Future of the Past ;en
 More Questions Than Answers trailer ;en
I want to read the  Crash Landing ;en
Find the Envoy of Lucifer show;en
 Bliss Torn from Emptiness ;en
I need to find the creative work Wave;en
I'm looking for a picture of Fresh Air;en
Search for The Dark Side of the Mind movie;en
Is there a game called The Neutral Zone?;en
find information about the album Flipper City;en
 a soundtrack called Billboard Hot R&B Hits: 1981 ;en
want to  the  called Innocent Until Caught 2: Guilty ;en
show schedule  Cin cin ;en
 a TV show called The Traffic Policeman ;en
Please look up the painting, Modern times.;en
 the show We Chase the Waves ;en
Looking for A Black Ribbon for Deborah.;en
Find a trailer called Colony 7.;en
show creative song called Holidays on the River Yarra;en
Find a movie called Living in America.;en
 was the soundtrack  Those Were the Days – The Best  Leningrad Cowboys published? ;en
Fine a movie called Right Here Right Now.;en
Can you get  The Education  Little Tree song? ;en
help me  the  called Journal of Neuroscience Research ;en
I want to listen to the Music of Ghost in the Shell: Stand Alone Complex;en
Find a show called Friday Download.;en
I need the game The ARIA Music Show;en
I want to watch the movie Maxime;en
 saga The Yellow Rose of Texas ;en
search for The Adventure of the Blue Carbuncle;en
search for television show Windows Live TV;en
Where to watch  Extremely Live ;en
find the movie You Must First Learn to Draw the Real;en
I'm looking  the television show The Flame ;en
Pull up Mafia: The City of Lost Heaven;en
I want to see the   Cause & Effect ;en
Where can I get the album So Fresh: The Hits of Spring 2011;en
I'd like to see Completely Well;en
find a novel called Episodi di Sons of Anarchy;en
find Starcross;en
I'd like to see the The Gathering Storm TV series;en
 a video game called New York 911. ;en
find At This Point in Time;en
 Manual of Love 2. ;en
find the picture Ultima VI: The False Prophet;en
I'm looking for a soundtrack titled Bowie at the Beeb;en
I'd looking for the saga PlayCanvas.;en
 a TV show called Ruthless ;en
play Live at Leeds;en
show creativity of song A Discord Electric;en
Find me the book My People Were Fair and Had Sky in Their Hair… But Now They’re Content to Wear Stars on Their Brows;en
 Remedial Chaos Theory, a soundtrack ;en
  the TV series All Around Performance Horse Weekly ;en
Please  me the game called The Salvation. ;en
Show The drive of life album;en
find A Pet of the Cairo Zoo ;en
search  the show Champagne Showers ;en
find a picture called Cahoots;en
Rate trailer Geek Chic ;en
I'm looking  a novel called  Then There Was Light. ;en
I'd like to play the video game Time to Kill;en
 me Memoirs of Modern Love: Curious Age ;en
When does Fire  Ice: The Winter War  Finland  Russia television  air? ;en
Search for Comedy Underground with Dave Attell;en
Please search for the Two Faces of My Girlfriend saga.;en
 me the picture The Id ;en
show  the picture Sex  Drugs  Jesus Christ ;en
 creativity of novel Lock ;en
Find Drowning with Land in Sight.;en
Where can I find the picture Another Happy Ending;en
find The Real Story with Gretchen Carlson;en
I'd like to see the television  Best-Of: Design  a Decade 2003–2013 ;en
I'd like to  the TV series Sailor Moon SuperS: The  ;en
find The Prince of Temple Street, a picture;en
Can you  me the Magic Hour song? ;en
Find Ek Boond Ishq.;en
I want to  Manthan ;en
Can you  the album SimpleScreenRecorder ;en
where do I see the trailer for Live Dates;en
Find Conker: Live  Reloaded ;en
Find a song called This Champagne Mojito Is the Last Thing I Own.;en
I want the photograph  Walt Before Mickey ;en
Find The Ghost of Tom Joad;en
Find The Cerebellum book ;en
show Andy Williams Sings Steve Allen TV show;en
I want to see the TV show Cause & Effect;en
Help me  Where the Wild Things Are ;en
 the Minutes to Midnight photograph ;en
Please search  All the Lovers trailer. ;en
I want The  Global Albums Collection ;en
I'm looking  The  of Nashville: Season 3 saga ;en
Play me the trailer for Gainesville Daily Register.;en
Search for Ayumi Hamasaki Countdown Live 2007–2008 Anniversary song;en
Who was the artist who did the painting called Spyro 2: Season of Flame?;en
Find the book called Black Wings of Destiny;en
 me Under the Skin ;en
 the game Company of Heroes ;en
Find The Photographic Journal. ;en
find the video game Tenacious D in: The Pick of Destiny;en
I'm trying to  the game called Give Me  Remote. ;en
 the Apple Address Book television show ;en
find a video game called IBM Program temporary fix;en
I want to watch the television  Little Things ;en
Find the American Journal of Sports Medicine picture;en
 the painting The Adventures of Teddy Ruxpin ;en
show the creativity of Ghost Dragon of Cold Mountain;en
 me The River of Love saga ;en
 a song called Bronco Billy. ;en
Look  the District 9 novel ;en
Can you please look up the TV series, An Experiment with Time?;en
find the painting Sleeping in Your Hand;en
 a television show called Structured Fax File. ;en
Search  the saga of Return of the Bastards. ;en
 The Late Great Townes Van Zandt ;en
Show  It Might as Well Rain Until September ;en
Can you find the movie Accidentally in Love;en
Show  the album Clarke ;en
Where to buy Education for Chemical Engineers;en
Can you locate the work, Warlock 2: The Exiled?;en
Find a picture called Nuclear Blast All Stars: Out of the Dark.;en
Find the work I Looked Up;en
find ArcIMS, a picture;en
 The Lateness of the Hour ;en
Read The Open Ecology Journal;en
Show  the  Playlist: The Very Best of Dolly Parton ;en
I'm looking for Dead at 21, the TV series;en
Find a soundtrack called The Christmas Shoes.;en
I  looking  the TV show called the Flight of the Lost Balloon ;en
Show me Happiness Was Free.;en
Where can I  Sebastien Grainger & The Mountains ;en
 Tales from the Organ Trade ;en
I want to watch the movie X Window Display Manager;en
Where can I  Lonely Hearts ;en
  Free Four: Tobias Tells the Divergent Knife-Throwing Scene ;en
I'd  to see the saga Tamagotchi 64: Minna de Tamagotchi  ;en
 the video game Journal  Criminal Law & Criminology. ;en
I'd like to see The  Jackals ;en
find Wintersong game ;en
Find Dyskografia Nick Cave  the Bad Seeds. ;en
 a video game called A Stroll  the Pork ;en
Play The News Virginian song;en
play Disney Sing It! – High School Musical 3: Senior Year;en
find a movie called No More Sadface;en
play Cry Baby Lane;en
play Baby Workout;en
Look for a photograph of I Wanna Sex You Up;en
Buy novel Brokeback Mountain ;en
I am looking for the TV series Strays;en
show song schedule of Shoot for the Moon;en
play the Putrefactive Infestation trailer;en
show  the photograph with the title The Denial ;en
I want to read the novel Pokémon the Movie: Black—Victini and Reshiram and White—Victini and Zekrom.;en
I  looking  a work called Carry You Home ;en
Look up the Act of Valor TV show;en
Looking for the photograph the Crimson Climax;en
 a  called How Much Wood Would a Woodchuck Chuck ;en
 The Ghost of Tom Joad ;en
 a show called Big Broadcast of 1938 ;en
 the show Portrait of Countess Karoly ;en
When does Fire and Ice: The Winter War of Finland and Russia television show air?;en
 can I view the photograph Dinosaur  the Deep? ;en
 the Mickey Mouse photograph ;en
find the game Company of Heroes;en
Search for The Toucher and Rich Show;en
I'd like to play the song In a Reverie;en
Play me the song Just to See You Smile.;en
 me the When Harry Tries to Marry photograph ;en
find the game Saturday Review;en
Where to buy book Bright Ambush;en
show creative photograph Island  the Sea ;en
 me the album The Weed Tree. ;en
 movie The Skeptic – Das teuflische Haus ;en
Please get  The National Medical Journal  India game. ;en
I want to see the book, The Mailroom: Hollywood History  the Bottom  ;en
Find me The River of Love saga;en
 the Electrochemical and Solid State Letters song ;en
 creative game Fear Thy Neighbor ;en
find The Gamblers;en
find a soundtrack for Meditations;en
Find The Photographic Journal.;en
Find the Rewind the Film TV show;en
Help  locate The Tristan Betrayal ;en
 a photograph called Greatest Hits Volume One. ;en
Play Pirates of the Caribbean Online;en
 a video game called Family Dog. ;en
I'd  to see the Paul Murray Live television  ;en
I'd like to watch the TV series called Fires of Life;en
Find Stained Glass Windows.;en
 creativity of Adobe AIR ;en
I want to watch Supernatural: The Unseen Powers of Animals;en
Show  Rapid City Muscle Car. ;en
find Framing the Early Middle Ages, a game;en
Please search for the work, All the Wrong Reasons.;en
I'd like to see Sex Tape - Finiti in rete;en
Show  the picture Nothin ;en
Find the book Cold Comfort;en
How  I see the TV series Mothstorm? ;en
I want to  the game The Carny ;en
 the album Biology Today: An Issues Approach ;en
Please  me Asking Alexandria discography ;en
Get  a picture about Sardonic Wrath ;en
Could I  Chavez: Inside the Coup? ;en
I'm looking for the show Sex and Candy;en
 The Little Death, a soundtrack ;en
Search for TERA: The Exiled Realm of Arborea;en
How do I get the game Still  It? ;en
Please get me the Welcome to the Rileys game.;en
 a video game called Young. ;en
Show me a picture of Love;en
Go to Your Heart Belongs to Me;en
Please  up The 4-Hour Workweek saga ;en
 Racing the Beam: The Atari Video Computer System ;en
Looking   game  Those Who Would Walk with the Gods ;en
Locate me the novel entitled Isthmus.;en
I'm looking for the painting God Must Have Spent a Little More Time on You;en
Search  the picture Foghat? ;en
show creativity of All  One ;en
Plau me the song The French Chef;en
I want to hear the  to The  Rule ;en
Find me the JQuery Mobile TV show;en
find a soundtrack called Billboard Hot R&B Hits: 1981;en
I want the movie Perseo Miranda and his Theatre;en
 creativity of What Is Dead May Never Die ;en
find The Many Loves of Dobie Gillis;en
show creativity of Diamonds in the Rough;en
show creative Last Light ;en
I'd like to see the photograph The Light;en
 the So This Is Goodbye saga ;en
search  the painting Smart Money ;en
 there a game called The Neutral Zone? ;en
Please look up Two More  soundtrack. ;en
I want the photograph of Walt Before Mickey;en
 a trailer for Pesterminator: The Western Exterminator ;en
 a creative work with the title Unholy Confessions ;en
 a soundtrack called I Still Believe in You. ;en
I'd like to see The River   TV series ;en
Find a TV series called All Time Greatest Movie Songs.;en
What  the Paranormal Activity: Ghost Dimension album? ;en
Please find the Packed to the Rafters work.;en
Show me the  F-1 Grand Prix Part II ;en
Can you find the song Bleach: Hell Chapter;en
 The Real Dirt on Farmer John, a saga ;en
 get  the Before Crisis: Final Fantasy VII television show. ;en
I'm looking  Paris Match ;en
I'd  to see Spyforce ;en
find a picture called How Much Wood Would a Woodchuck Chuck;en
What is Love in a Mist?;en
find the song Ticks ;en
Find The Press of Atlantic City movie;en
Find The Madwoman in the Attic.;en
Find Later That Evening ;en
 At This Point in Time ;en
Please get me the Crime and Punishment in Suburbia trailer.;en
find a photograph called XQuery API for Java;en
Show  the movie Purple Heart Diary. ;en
 the show The Naked Gun ;en
What system is Bloodhounds of Broadway the game for?;en
Look for the Journal of Toxicology and Environmental Health soundtrack;en
Can you help  locate the game, Coast? ;en
Show the Mickey Mouse photograph;en
I'd  to see the  The Collection – The Collector 2 ;en
 a trailer called No Reservations. ;en
search for the trailer The Thieving Magpie;en
 the Home Is Where the  Is TV series ;en
 creative trailer of The Sword of the Lord ;en
What is the painting  Malcolm Young? ;en
Pull up Mafia: The City  Lost Heaven ;en
I'd like to see the novel An Inquiry into the Good;en
I want to  the  Pesterminator: The Western Exterminator. ;en
Find a soundtrack called Top Gear Australia.;en
find the book Metallica Through the Never;en
Find Changes: A Love Story.;en
Show  NCAA College Football 2K3 ;en
 TV series of Noroi - The Curse ;en
find the novel Make Peace Not War;en
show me the When Your Heart Stops Beating photograph;en
Look up the game called The Long Morrow;en
Can you find the TV show Faithless Street;en
Find me the Balance  Timing book ;en
search for movie Turn Back the Clock;en
Where can I purchase the saga The Second Life of Samuel Tyne;en
Where can I view the picture of Workin’ with the Miles Davis Quintet;en
Find a soundtrack called The Outpost.;en
want to see the trailer  The Prefect ;en
Find a TV series called Live Hearts.;en
Where can I view the photograph  Johnny Cool ;en
show me Convicted ;en
find The Little Death, a soundtrack;en
I want to  The Original Recordings ;en
Find The Transformers: Generations video game;en
I want to  the  X Window Display Manager ;en
find the television show Birth of the Cool;en
find the TV show Hot Air;en
Show  the game English Freakbeat ;en
 a painting called Pulsions. ;en
find The Inspector for me;en
Can you find me the Dicey Business TV series?;en
How do I watch the TV show NBA Access with Ahmad Rashad ;en
 a television  called The Passion of the Betty ;en
What system is Bloodhounds  Broadway the game for? ;en
show creative work or Miami Vice Theme;en
Find me the Karl Hess: Toward Liberty photograph;en
Find me the Extreme Ghostbusters game.;en
show  the painting Live – Very Live  Concert ;en
 the video game High Hopes & Heartbreak ;en
find the TV series Truly Fine Citizen;en
Show  the photograph of King Charles ;en
 All Jets Are Gonna Fall Today saga ;en
Please search the work, Eve-Olution.;en
Find the game BlogBridge;en
 a painting called The Wipers Times ;en
Find Returned to Your Mind.;en
I'm looking for the novel From a Scream to a Whisper;en
Please find me the Youth Against Fascism television show.;en
 the album titled Spasmolytic ;en
Show me Cut the Rope video game;en
 me the movie with the title of Twitches ;en
 can I see the television show, Jimmy Two-Shoes? ;en
I want to see the trailer for The Entity;en
Where can I see the show Latin  Lovers? ;en
I want to watch the TV show Down on Abby;en
find Remedial Chaos Theory, a soundtrack;en
 the book The Crowd Roars ;en
When was the soundtrack for Those Were the Days – The Best of Leningrad Cowboys published?;en
Can you  the television show Manifesto of Nevermore ;en
Can you   The Assassination of Jesse James  the Coward Robert Ford saga? ;en
search  the show The Caretaker ;en
find the show titled Hell on Earth 2006;en
play the song S.F. sound furniture;en
Where can I watch the trailer  Home Economics ;en
find the game A Russian Beauty and Other Stories ;en
show creative video game In  Own Backyard ;en
 a TV show called Union. ;en
Find Digimon Next;en
 a photograph called Dragon Ball Z: The  Selections ;en
 me the TV show The First Bite. ;en
 you locate the work, Warlock 2: The Exiled? ;en
find an album called  the Terrace ;en
Where can I  a copy  I Bury the Living? ;en
Find me the Young Doctors in Love TV show;en
show creativity of The Greatest Movie Ever Sold;en
Can you get  the Starcross saga? ;en
I'd like to watch Miss Congeniality;en
find Some of  Best Friends Are...The Piano Players ;en
 the photograph Hearts Burst into Fire ;en
Please fine me the East trailer;en
play the movie White Christmas;en
 Trivial Pursuit: America Plays ;en
Looking  the photograph the Crimson Climax ;en
Find Stained Glass Windows. ;en
Get me a Johnny Cool photograph;en
Can you find me a trailer for Phineas Redux?;en
How do I see the   To See the Invisible Man? ;en
I'd like to see the  Tony Parker ;en
Looking  the painting Last Flight To Abuja ;en
Look up The Reverse  the Medal ;en
 a video game called The Mysterious Castle  the Carpathians. ;en
Can you please  the Jack  En Concert picture? ;en
Find All About Aubrey. ;en
 game Alien Breed II - The Horror Continues ;en
Where can I purchase the TV series The Mating Season;en
Show Family Plot;en
 me the novel The Argumentative Indian ;en
 the McGill Law Journal movie ;en
 a painting called Chettathi. ;en
 creative work or Miami Vice Theme ;en
show the trailer of Rugrats Go Wild;en
Find A World Apart. ;en
I'm looking  the saga Lifelong Ambitions ;en
Show me Firepower;en
 a show called Ichibyōgoto ni Love for You. ;en
Can You tell me the Actors of the saga awards/;en
i want to play the video game called China Seas;en
help me the find the Thug Lordz Trilogy book;en
Look for the TV series The Stars at Saint Andrea;en
 me the trailer for Gainesville Daily Register. ;en
 Spirit of the Bush. ;en
When is Spyforce playing?;en
Show An Actress for the newest album.;en
 The Most Important People, a television show ;en
I need to see Cristo in India;en
Find the saga A Very School Gyrls Holla-Day.;en
Look up the Searchlights painting;en
show  The Edge of Love photograph ;en
 Angels of Iron television  ;en
Can you  the TV show So What ;en
Show me a television show named A Love to Hide.;en
Find Just South of Heaven;en
 me a movie with the name Oshin ;en
play Myth II: Soulblighter ;en
What  The Cave Canem Demos photograph? ;en
 a TV series called All Time Greatest  Songs. ;en
 can I get a photograph  Death Knows Your Name? ;en
Search for the Un provinciale a New York TV show;en
play the Discografia de The Pretty Reckless saga;en
 a show called The Paper Route ;en
find the game Gormenghast;en
Where to watch show Extremely Live;en
play the game Piety Street;en
 up The Park album ;en
Find a trailer called Eurythmics discography.;en
show Thousand Miles movie ;en
I'm looking for Dead  21, the TV series ;en
show me the photograph with the title The Denial;en
Play me an album by Lunchbox;en
 a photograph called Shout It Out. ;en
 the Rewind the Film TV show ;en
find Flesh and Bullets;en
 the novel Make Peace Not War ;en
I want the show The Sense Apparatus;en
 Face the Truth, a TV show ;en
Where can I view the photograph Dinosaur from the Deep?;en
Show  the Lights Out saga ;en
find Wild Solutions, a saga;en
find a photograph called The Lighthouse by the Sea;en
 trailer for Iraq for Sale: The War Profiteers ;en
 The World Is a Game ;en
 a novel called Twins of Evil. ;en
Show me the picture Written in the Stars;en
 the movie Everywhere But Home ;en
find the television show Riding with the King;en
I want to read the novel Alone at the Microphone;en
 Clash of the Codes. ;en
Go to the  The Inflated Tear ;en
Show GD&TOP painting;en
Find Journeyman. ;en
 Doggy Day School, an album ;en
 a game called The Oh in Ohio ;en
Can I see the the TV series The Late Music?;en
Search for The Toucher  Rich Show ;en
 Blood Moon: Year of the Wolf, a movie ;en
I want to see the trailer  No One ;en
 Bells Break Their Towers, a video game ;en
play The Sea Cabinet;en
I want to  the game The Celestial Hawk ;en
I want to watch Wide-Eyed and Ignorant;en
Find a show called Last Night On Earth.;en
Find me The Memorial ;en
 a photograph called The Wish List ;en
 the song Culture and Psychology ;en
Look up the TV series Operace Silver A;en
 the show titled Hell on Earth 2006 ;en
Where can I watch the trailer of the National Treasures - The Complete Singles;en
 can I purchase Wuthering Heights ;en
 Trust  the Lord – Live Worship with Don Moen. ;en
find Face the Truth, a TV show;en
Look up the Fair Warning saga;en
Find the Labyrinthe game ;en
Search  a picture of Darker than black ;en
 a soundtrack called The Spanish Jade ;en
Wish to read the novel called The Wizard of Stone Mountain;en
Show me the Live in Whitby album.;en
Look  the American Journal of Sociology ;en
Can you  me the  Father  King game? ;en
Can you  me the SchoolTool picture? ;en
 a TV show called Shake Hands with Beef ;en
I want The Complete Global Albums Collection;en
 the Seamus Heaney Collected Poems song ;en
Look  the Nightmare on Providence Street saga ;en
 a soundtrack called Pax Warrior ;en
Please find the novel, Good Doctor;en
 the photograph JBoss Enterprise SOA Platform ;en
Where can I get Fight  Anarchy ;en
Look for the District 9 novel;en
play Blind Company;en
 the movie White Christmas ;en
Where can I buy a used copy of the game called I Lie Around?;en
Show  the picture The afternoon ;en
Where can I find the picture the Japanese Lovesong near me?;en
Find a show called American Journal of Play.;en
Show  the I Can Hear the Sea movie ;en
I want Sugarfoot;en
Where can I buy a hardcover copy  the  The Intangibles  Leadership? ;en
I'd like to see the  Onion SportsDome ;en
Find Family Feud novel;en
Show  the album Andrews University Seminary Studies ;en
Where can I  the trailer  Sensations of 1945 ;en
Find Live at Bonnaroo.;en
I want to listen to the song First Time for Everything;en
Show the TV show The Last Samurai.;en
I want to find the show From Where to Eternity.;en
Where can I watch the television show called Fangs of the Arctic?;en
  the picture called Lest We Forget: The Best of? ;en
find Jono and Ben ;en
 movie titled Triumph of the Spirit ;en
Need  the book called Hollywood Connection ;en
Please look up the song, Twist  shadows. ;en
Wish to hear the  Since I Saw  Last ;en
 a television show called Twisted. ;en
Show me a novel  Onnaam Muhurtham ;en
look for the game  Another Way ;en
 A man needs a maid ;en
Pull up Sweeney Todd - Il diabolico barbiere di Fleet Street;en
look for the saga called Death in Paradise;en
Play song Softly;en
Show me the TV show Limit of Love: Umizaru;en
 Long Walk to Forever, a novel ;en
Pull up the  Live  Unreleased: The Radio Show ;en
help me  the work Graphics Animation System  Professionals ;en
 The Sentimental Bloke novel ;en
Where is Journal of Geriatric Psychiatry  Neurology ;en
 me a game called Spaceball ;en
play Off the Ground ;en
find Waiting for Touchdown, a book;en
Find book called Dreams and All That Stuff;en
Search for the song called Journal of the American Statistical Association;en
