expression;language
play Bliss Torn from Emptiness;en
Show me Born  America? ;en
 an album called Preminchi Choodu. ;en
Play Keep Your Right Up song;en
Find UNDER NIGHT IN-BIRTH;en
  a game called Merle Haggard Presents His 30th Album ;en
Where is the TV  Bomberman Land Touch! 2 ;en
I want to read the  Alone  the Microphone ;en
play the Cabin Fever 2: Spring Fever saga;en
Can you pull up Channel M News;en
trailer  Gate  Thunder ;en
Find Resurrection of Evil. ;en
What is the picture called Lest We Forget: The Best of?;en
find a video game called Victory March;en
Is the TV show The Prodigal Wife  today? ;en
I want a photograph of Elizabeth the Queen;en
find a soundtrack called Pax Warrior;en
 The Mary Van Note Show ;en
find The Real Dirt on Farmer John, a saga;en
show That Little Band of Gold;en
 creativity of Home Brew ;en
 you  the painting The Crow: Original Motion Picture Soundtrack ;en
 creative painting People & Love ;en
I'd like to listen to the soundtrack In the Air;en
Where can I see the show Kind of Glue?;en
Find Confusion Bay.;en
Can you find the novel Journal of Social Work;en
Please get me Rough and Ready saga.;en
Find a television show called The High Chaparral.;en
 the novel The Last of Sheila ;en
Find the Sing When You’re Winning TV show;en
I want to read the  Between a Rock  a Hard Place ;en
Find a novel called Testing Anywhere.;en
I'm looking for an album called The Orchestrion Project.;en
search for the show Champagne Showers;en
Look  the Public Toilet painting ;en
Show me the show Goldimouse and the Three Cats;en
 a video game called The Last American Virgin. ;en
show  The Best Of: Volume 1 TV series ;en
Look for the Girl in Mirror movie;en
Show Acta Mathematicae Applicatae Sinica TV show;en
 Remains of the Day ;en
find the game Gormenghast ;en
 the creative work Brilliant! Tragic! ;en
 search Crossing Muddy Waters work ;en
Find My Tribute show;en
What  the Read All About It picture? ;en
Can I get the game List of Mew singles?;en
 the song Red Lanta ;en
 the Fields of Sacrifice movie ;en
Find a show called Ichibyōgoto ni Love for You.;en
I'm looking for a job  Inversion ;en
show creative photograph Island in the Sea;en
Can you find the show The Dumping Ground Survival Files;en
find the show Trancers ;en
show me Convicted;en
find a television show called Sensation Comics;en
Find a soundtrack called  Gear Australia. ;en
Find a photograph of Time Loves a Hero;en
Where can I  the game KAAKAI Newspaper ;en
Search  Teenage Mutant Hero Turtles: Fall  the Foot Clan photograph ;en
Find a TV show called Ace of Spades.;en
Please look up the song, Twist of shadows.;en
Find Think: act ;en
What is the TV  Comfort? ;en
 the Collision in Black painting ;en
Find the TV series  the Top ;en
I'd like to see the show Migration;en
 The Kindness of Women picture ;en
Show  the photograph of Minutes to Midnight ;en
 The Press of Atlantic City movie ;en
I'm looking for the television show titled The Lonergan Review;en
I want to watch the TV series Krieg in Chinatown;en
Search for the Abel Sánchez: The History of a Passion novel;en
find a video game called The Yellow Claw;en
I want to  Breathless ;en
Show the Minutes to Midnight photograph;en
Is Salò the TV show available to watch anywhere?;en
Find the video game Journal of Criminal Law & Criminology.;en
I'm looking for the television show titled Justice League;en
Go to After Dusk They Come ;en
 the show The Sword of the Lictor ;en
 me the show Cheaper By the Dozen 2 ;en
 an album called List of Re: Hamatora episodes. ;en
Give me the Spirit the Earth Aflame TV show.;en
 a game called A Very Special Christmas 7. ;en
search for TV show Live  Apollo ;en
 the TV series Heart of Gold ;en
 the Now We Are Six saga ;en
Please search  the Live  San Juan Capistrano picture. ;en
 me an album by Lunchbox ;en
I'd like to see the saga 12 Soulful Nights of Christmas;en
Show  the video game The Stillest Hour ;en
Find a show called Time Is Just the Same.;en
Find a trailer called Storm Center.;en
Please get me the British Journal of Dermatology game.;en
Where can I  the picture Another Happy Ending ;en
 video game Manifesto of Nevermore ;en
I need to find the creative work Prince Hours;en
Where can I view the photograph The Phantom Horse;en
Look for the Kiss the  game ;en
find Sweet Sensation;en
show creative album Heredity;en
show the show The Son of Tarzan;en
I want to  the video game Miss Castaway And The Island  ;en
Look up the This Is Halloween trailer;en
Find me Haunted Castle ;en
Find a television show called Basement Screams.;en
 a picture called Cahoots ;en
find the TV series Shaun the Sheep;en
Has the TV series Puppet Master: Axis of Evil been cancelled?;en
Find me Recorder and Randsell;en
I want to watch the television show Little Things;en
Please look up The 4-Hour Workweek saga;en
How to buy picture  Agent Hamilton: But Not If  Concerns Your Daughter ;en
Find an album called Preminchi Choodu.;en
How to get saga Stronda Style;en
Find me the novel, Between the Rivers.;en
 the game Piety Street ;en
 I hear the song American High. ;en
show Under the Sea creative video game;en
Please find the song House of Wedlock;en
I'd like to see the painting Empire   Worlds ;en
 the Glass Cloud – Single TV series ;en
Find the Saison 7 de How I Met Your Mother show;en
Where can I find the game KAAKAI Newspaper;en
I want to  the  The Lion Sleeps Tonight ;en
find a book called Tron: Legacy Reconfigured;en
find me the book Filthy Lucre Live;en
find the show The Naked Gun;en
Find The Dressmaker. ;en
trailer of Gate of Thunder;en
Pull up the  game, Apothecary Rx ;en
 The International Journal of Robotics Research soundtrack ;en
Find a TV show called Frontiers in Ecology and the Environment.;en
I want to  the  game The Coyote Kings  the Space-Age Bachelor Pad ;en
show creativity of Your Body Above Me;en
Show  the painting called The Descendants. ;en
I want to play a game called Scotland Tonight.;en
Play the Electrochemical and Solid State Letters song;en
When and where is DistroWatch playing;en
Show The Man  London video game ;en
can you get  the trailer of The Multiversity? ;en
i want to  the  game called China Seas ;en
Show  the work Not a Little Girl Anymore ;en
Can you look up the Galsoft Linux TV series?;en
Info on show Natural Language and Linguistic Theory;en
Find UNDER NIGHT IN-BIRTH ;en
Can you please search Ellington  Newport? ;en
 me the Show Girl soundtrack ;en
Show  the song Spiderman of the Rings ;en
find Bullet  a Target, a television show ;en
Show me It Might as Well Rain Until September;en
Can I hear the song Visual Audio Sensory Theater?;en
Find a TV series called White Bread Black Beer.;en
  a television  named A Love to Hide. ;en
Show me the show Live at the Fillmore East;en
I'd like to see the trailer for History and Theory;en
show painting of Waiting for Snow in Havana;en
show me NeuroToxicology ;en
find Cut the Rope;en
Find a TV series called Church of the Truly Warped.;en
Find the Exile  the Kingdom ;en
How can I see the show Pulse 2: Afterlife?;en
find the show The Demi-Gods  Semi-Devils ;en
How  I  the soundtrack African Development Perspectives Yearbook? ;en
Show The Night Riders ;en
What is A Romance  the Halifax Disaster ;en
find She Monkeys;en
 The drive of life album ;en
 Welcome to the El-Palacio, a movie ;en
Where can I  information on Brats in Battalions? ;en
 Under the Sea creative video game ;en
Find a show called Some Kind of Dangerous.;en
Please  the movie Dancing Girl ;en
Show The Swan Princess ;en
where can I  the game A Little Bit  Mambo ;en
 me the song Just to See You Smile. ;en
I'm hoping you can find a photograph from Live At The Isle Of Wight 1970.;en
Where is Winterheart’s Guild;en
 Sailing The Seas Of Cheese ;en
show me the picture Totally  Love ;en
play Another Time;en
 can I get the album So Fresh: The Hits  Spring 2011 ;en
read the Black-Body Theory and the Quantum Discontinuity novel;en
show 50 Words  Snow creative picture ;en
Show  a copy of the picture Double Deal. ;en
 you please look up the TV series,  Experiment with Time? ;en
Can You tell  the Actors  the saga awards/ ;en
Show  the movie Black Summer ;en
Show me the The Defenestration of Ermintrude Inch TV series;en
find As Live as It Gets;en
Please find me the Magic Hour saga.;en
Look for the movie Darkness Come Alive;en
Find a novel called Industry.;en
Where can I find the trailer for Sensations of 1945;en
find Live in Tokyo for me;en
show creativity of photograph of  Wonderful Day ;en
Where can I buy a photograph called Feel the Love?;en
 the TV series Treeful of Starling ;en
 a  called Best Hits Live: Save the Children Speed Live 2003 ;en
show creativity of The House of the Dead;en
I need Journal of Pediatric Oncology Nursing, help me find;en
Find the Blood Red Sandman;en
Look for the TV series All Around Performance Horse Weekly;en
 the trailer for On the Good Ship Lollipop ;en
Please look for the TV show Memoirs from a Bedroom: Issue 1;en
Can you  the soundtrack for Westcountry Live ;en
 can I watch the TV  Terrorists: The Kids They Sentenced ;en
I want the  game Southwest Riders ;en
 a game called The Life  Loves of Tschaikovsky. ;en
Could I download Chavez: Inside the Coup?;en
play The Case of the Whitechapel Vampire TV series;en
Look up Applied Linguistics;en
show creative Last Light;en
I'm looking for the video game Masterful Mystery Tour;en
search  video game The Sky Is Crying ;en
 a soundtrack called Tied to a Star. ;en
find Cover Her Face ;en
Find an album called The Aboriginal Port Folio.;en
Where can I find the Sounds to Consume album?;en
Where can I purchase Wuthering Heights;en
What is The Cave Canem Demos photograph?;en
 a show called American Journal of Play. ;en
 a book called The Magic Christmas Tree. ;en
find a trailer called Way Down Yonder in New Orleans;en
I want to watch the TV show Tales from Space: About a Blob;en
What is Just Like  the Old Country ;en
search  a photograph of Road Hogs ;en
I'm looking  River Disturbance ;en
I'd like to  the song In a Reverie ;en
How can I watch the television  Tinker Bell  the Legend  the NeverBeast? ;en
Find Fragile Frontiers: The Secret History of Mumbai Terror Attacks.;en
help me find the work Unite  Win ;en
show creativity of Sacred Fire: Live in South America;en
I'm looking  Right on Track. ;en
Can I buy the book Vacation of Petrov and Vasechkin online?;en
I need info  the video game Iron Fist ;en
I want to watch the TV  Tales  Space: About a Blob ;en
want to watch the TV show Treeful of Starling;en
find a television show  called I Got a Bag of My Own;en
Where can I watch the TV series The Trifecta?;en
Please   the picture of The Getaway: Black Monday. ;en
 up the Searchlights painting ;en
 can I  the novel The Great Irish Bake Off ;en
Look  the album called The  of Mr. Jeremy Fisher ;en
  up the television show, Noel Hill & Tony Linnane. ;en
Please search  Sealed with a Kiss movie. ;en
 The Prince of Temple Street, a picture ;en
Can I see the the painting Another Life...Another End?;en
Can you play The Wanderer and His Shadow ;en
Where is the TV show Bomberman Land Touch! 2;en
 Pat Garrett y Billy the Kid. ;en
can you get me the television show called Start It Up?;en
I'd like hear the song Sit Down  Talk to  ;en
Find a novel called A Perfect Day.;en
show creativity of Comeback Season;en
 the Putrid Death Sorcery soundtrack ;en
 can I get Lahore ;en
 the television  Kamen Rider OOO Wonderful: The Shogun  the 21 Core Medals streaming anywhere? ;en
I need the book titled Lullaby of Broadway;en
Find the show Portrait of Countess Karoly;en
Please  me Glass Cloud – Single. ;en
show creative photograph named None of the Above;en
find a photograph called The Wish List;en
I need Top Gear 2, please search it for me.;en
 the Via Dolorosa: Songs of Redemption saga ;en
I  looking for The Complete Fillmore East Concerts ;en
 The Quest of Iranon ;en
Show GD&TOP painting ;en
help me find the work Graphics Animation System for Professionals;en
Find GoodReader.;en
Where can I  On the Marble Cliffs ;en
find a Love song;en
Show the Sad Songs  Dirty Lovers album ;en
show me The Edge of Love photograph;en
I'm looking  Sherlock Holmes contre Arsène Lupin. ;en
  the TV series called Take  to Your Heaven ;en
 Once Upon a Time in the West ;en
Please  me Chance Pe Dance. ;en
 Half a Sixpence photograph ;en
 Love Will Tear Us Apart, a photograph ;en
Where can I  Thor Meets Captain America? ;en
Where can I  the song Red Back Fever ;en
Buy novel Brokeback Mountain;en
find the book Time  Again ;en
I want to listen to the  First Time  Everything ;en
 a television show called Swing High. ;en
Can yo find me the game A Silence That Screams?;en
Need to  the soundtrack called Fire  the Valley ;en
What song is Detective Conan: Dimensional Sniper;en
Show  Then We Came to the End ;en
Please find the Infrared Riding Hood TV show.;en
Do you know  a song  the Mande Studies Association? ;en
Where can I find the novel The Great Irish Bake Off;en
Find the  the Hut TV series ;en
want to find the novel called Innocent Until Caught 2: Guilty;en
 you  a photograph entitled, Beneath the Harvest Sky ;en
Where can I watch the television show You Make Me Hate Music;en
 a show called Chompa Toung. ;en
Search for The Nations ;en
find a painting called Songs from Tsongas;en
Can you help me  the television show Women  Death ;en
I'd like to find the soundtrack Tianjin Today Evening News;en
Where did the painting Highs in the Mid-Sixties go?;en
Show The Kindness of Women picture;en
What is the song The Beast  20? ;en
Show me Bâton Rouge ;en
find Trauma Center: New Blood, an album;en
Please find Brand New Strings;en
Find a novel called East Liberty;en
Get me Kiss the Crystal Flake;en
Where is the TV show  Universum ;en
 the Hell of a Life movie ;en
 The Case of the Whitechapel Vampire TV series ;en
Where can I find the JKT48 School;en
Find me the Lace  Whiskey soundtrack ;en
Find a movie called The Easy Way to Stop Smoking.;en
I'm looking for the album called Disorderly Conduct: Video on Patrol;en
Where can I  the saga Addicted to Love ;en
Please  me the Magic Hour saga. ;en
find the song Occasional Wife;en
Where can I find the photograph of Mr Blobby;en
 me the show House of Stairs ;en
How to get  Stronda Style ;en
 a video game called Batman: The Return  Bruce Wayne. ;en
 there a Chinese Wikipedia ;en
find a novel called Best Hits Live: Save the Children Speed Live 2003;en
Find the Collision in Black painting;en
find the movie Take Another Picture;en
Please look up the Around the World in Eighty Days movie.;en
I want to watch Escape the Fate discography;en
Find a television show called Twisted.;en
Has the  series Puppet Master: Axis  Evil been cancelled? ;en
Show The Second Civil War saga;en
Please get  the British Journal of Dermatology game. ;en
Show An Actress  the newest album. ;en
Please look up the Beauty  the Fire show. ;en
Look up The Adventure of the Blue Carbuncle ;en
 a photograph called Call on Me. ;en
Please  Brand New Strings ;en
Find me Royal Astronomy ;en
I'd like to see a   called Countdown: The Savoy Sessions ;en
I'm looking  the trailer of Highlands Today ;en
 the Endangered Species song ;en
I want to  Far Cry Vengeance ;en
Find a soundtrack called I Still Believe in You.;en
Find The American Journal of Economics  Sociology. ;en
Please search the Karobar Economic Daily picture.;en
 the show CarniK Con ;en
 The Living Room Tapes, a TV series ;en
Where can I  the novel A Woman  the Web ;en
I'd like hear the song Sit Down and Talk to Me;en
I want to  the novel, The Green ;en
play the Baldur’s Gate II: Throne of Bhaal saga;en
play TV show Way of the Samurai 2;en
Find the trailer for Seven Year Itch.;en
 the video game Tenacious D in: The Pick  Destiny ;en
Find the Labyrinthe game;en
Where can I read the  The Omega Stone? ;en
find Bullet and a Target, a television show;en
find a game called Gladiators Australian Series 1;en
Play a trailer for Give It All;en
Find a game called An Aerial Joy Ride.;en
Show The Critic game;en
Show me the movie Sonic Triple Trouble;en
I want to  the  called Fresh Aire 7. ;en
Show  the song The Incredible Hulk Returns ;en
find NHL on Fox ;en
 can I listen to the song The Lost Worlds  Planet Earth ;en
Find a painting called Break Down.;en
I want to see the trailer for Australian Economic History Review;en
 The Information: A History picture ;en
Show me the Live  Whitby album. ;en
 a television show called Servidor Apache. ;en
I'd like to see The River of Stars TV series;en
I want to find The Adventures of Lomax.;en
 Print the Legend soundtrack ;en
 me the show The Skull. ;en
Can you help me search the album titled PlayMaker Football?;en
 a soundtrack for Meditations ;en
I'm looking  the painting God Must Have Spent a Little  Time  You ;en
Want to  a photograph called The Nine Maidens ;en
Show  the television show Children  Need Rocks 2013. ;en
 Hope & Other Sins, a TV show ;en
Find the Now We Are Six saga;en
 an album called Stumble.Stop.Repeat ;en
Go to Your Heart Belongs to  ;en
 History of North Dakota, a TV series ;en
Please look up  Disney Universe. ;en
play the album Journeyman ;en
find the TV show Tribute to the Troops;en
find the novel The Last of Sheila;en
 the picture Their Finest Hour ;en
search  trailer Jazz Impressions of the U.S.A. ;en
Look  Summer with Monika ;en
find To Each His Own Cinema, an album;en
Please find me the work, Instrumental Directions.;en
Find Once Upon a Time in the West;en
 TV show Way of the Samurai 2 ;en
 the song Aura II: The Sacred Rings ;en
show Crafty Hands saga;en
Where to buy Education  Chemical Engineers ;en
 the TV  titled Timerider: The Adventure of Lyle Swann ;en
 me the novel, Between the Rivers. ;en
I want to play the video game International Pinguicula Study Group Newsletter;en
Find a novel called Matching Dreams.;en
find me The Seven-Ups ;en
Please search  The Legend of Korra book. ;en
Can you please  me, Journals? ;en
Look  the High Noon TV show ;en
Help me locate The Tristan Betrayal;en
Where can I find the soundtrack for Steamboat Bill?;en
 can I buy the Something Borrowed saga? ;en
Where can I  the movie The  Law Review ;en
 Keep Their Heads Ringin’ ;en
 Old School Junkies: The Album, a video game ;en
 a movie called Emerald City ;en
find The Moldy Peaches;en
I'm looking for the song called Standing for Something.;en
show creativity of Home Brew;en
What is the Michael Moore Is a Big Fat Stupid White Man video game?;en
Show me the video game  When In Rome 2007;en
Please find me the book Step Into My Groove.;en
Can you find me the game, Super Scription of Data?;en
Where can I see the trailer  Take  to the King ;en
Show The Invisible Hook trailer;en
find the show How to Meet the Lucky Stars;en
Find me the song 2 Fast 2 Furious;en
 television show on Windows Live TV ;en
Please look up Amrithavaahini;en
Search for Man  a Garage ;en
Show me My Princess;en
 TV series titled A Life  the Death of Joe Meek ;en
 can I buy a copy  the picture called Turn Against This Land? ;en
Where can I find the novel Meast;en
Show me the Out with  Baby photograph ;en
find Innocent world ;en
search  the painting The Elder Scrolls I: Arena ;en
Find Next of Kin ;en
read the book Journal of the Bombay Natural History Society;en
I'd  to see Sex Tape - Finiti  rete ;en
find The World Is a Game;en
Look for the Editor & Publisher TV series;en
Show me the picture Batman: The Long Halloween;en
I'm trying to find the show Chant II ;en
 the Baldur’s Gate II: Throne of Bhaal saga ;en
Find Family Feud novel ;en
I want the video game Southwest Riders;en
Find me The Rise and Fall of the Great Lakes saga.;en
 The Modern World video game ;en
find the movie Chaos Is Me;en
I'd like to hear the soundtrack for Just Once   Life. ;en
show creativity of The Force Behind the Power;en
I'd like to see the book The Royal Thousand;en
Can you  a photograph  Ace Ventura: The CD-Rom Game ;en
Where can I view the TV series of W.I.T.C.H.;en
I want to  the trailer Ad Nauseam ;en
I want to find the show called Fresh Aire 7.;en
 the Caps Lock trailer ;en
show Thousand Miles movie;en
show creativity Cum On Feel the Noize the video game;en
Find The Passion of Michel Foucault novel;en
She me the game called Knowledge and Decisions;en
find a television show called Milagros: Girl from Away;en
Please  me the Platinum Box II song? ;en
 Me. I Am Mariah… The Elusive Chanteuse ;en
Play me the trailer for Star Control.;en
 a television show called Happy Trails ;en
find Google News ;en
What channel does the television show The RoxBox play on?;en
I'm looking for the show Pulse 2: Afterlife;en
I'm looking  a picture of Fresh Air ;en
Look for A Terrible Vengeance;en
Where can I purchase the TV series Liar Game - The Final Stage;en
Can you find a photograph entitled, Beneath the Harvest Sky;en
Listen to Dragon Ball:  Collection ;en
 search the Abby saga. ;en
read the Background to Danger book;en
Show  the trailer  American Education: The National Experience. ;en
 creativity of Accident Analysis & Prevention ;en
 a saga called The  Went Down to Georgia. ;en
Please search the Songs for the Deaf video game.;en
 a trailer called Just Say Noël. ;en
Show me The Heart Specialist;en
find the Still Life: American Concert 1981 soundtrack;en
 a television show called I Got a Bag of  Own ;en
Find a painting called Pulsions.;en
Find me the Show Girl soundtrack;en
Where can I  a photograph  The Lieutenant  Inishmore? ;en
Show the Whispering Willows novel;en
What Can I watch watch the television  Catch ;en
 The Ultimate Gift, a television show ;en
Show me the photograph called Hola Mary Lou: Prom Night II.;en
search  a painting of The Wannadies ;en
show  of Pokémon: The Mastermind of Mirage Pokémon ;en
 The Blackberry Bush  ;en
Where can I find information on Brats in Battalions?;en
Where did the painting Highs  the Mid-Sixties go? ;en
Show Family Plot ;en
 a TV show called The SoulTaker. ;en
Please find me the book Step Into  Groove. ;en
find the TV show When I Was a Boy;en
 a work with the name of Come Sing ;en
Find me an album called Rejoicing with the Light;en
show me NeuroToxicology;en
Please search for the work, Wholehearted.;en
Help  search UFC on Fox show. ;en
find me a game called Thesis Eleven;en
find the show How to Meet the Lucky  ;en
find  Spanish Songs, a photograph ;en
find the picture Chorus Line;en
where do I see the trailer  Live Dates ;en
 can I view the photograph The Phantom Horse ;en
I'd like to hear the song Impractical Jokers UK;en
I'm looking  the game called Summer of Fear ;en
find the TV series Treeful of Starling;en
 can Ifind You Know Me, a saga ;en
Where can I  get Lahore;en
Look up The Adventure  the Blue Carbuncle ;en
where can Ifind You Know Me, a saga;en
Get  the Trick or Treats soundtrack. ;en
Show me the soundtrack The Phoenix ;en
Find a TV show called Studies in Logic.;en
Find me the show The Skull.;en
Please  the Infrared Riding Hood TV show. ;en
Where  picture Everybody Wants You ;en
find the picture Nur mit Dir – A Walk to Remember;en
show me the picture Sex and Drugs and Jesus Christ;en
Where can I buy a Barometer Clock;en
I'd like to  the TV  Hola Mary Lou: Prom Night II ;en
help me find the work Unite and Win;en
 an album called Thursday Night Baseball. ;en
Can you search A Song for Mama book for me?;en
show creative painting People & Love;en
I'd like to find Scriptures of the Golden Eternity TV series;en
Show  the saga St. Elsewhere ;en
Get Jump Down painting;en
find Becoming Royston ;en
I want to watch the television  Naked II ;en
Where can I listen to Willy  the Poor  ;en
  the work titled The Perfect Gentleman which is a song ;en
Go to the  Welcome to Tokyo ;en
 a movie called Living in America. ;en
Help me find Where the Wild Things Are;en
 the Cabin Fever 2: Spring Fever saga ;en
Would like to  the trailer  An Experiment with Time ;en
 Just South of Heaven ;en
Look for the Thorns saga;en
show schedule for Cin cin;en
Show  the soundtrack The Phoenix ;en
Please get me The Very Best of Chicago: Only the Beginning.;en
find Cluster Computing, a game;en
 i see the Boat People? ;en
play the movie I Want My MTV: The Uncensored Story of the Music Video Revolution;en
look  the creative work The Testament  Gideon Mack ;en
 to After Dusk They Come ;en
 the television show Riding with the King ;en
show creative album Heredity ;en
Find a movie called Greatest Time of Year.;en
 TV  named I Fell  Love with a Dead Boy ;en
Find The Killing Fields. ;en
 the video game The Sims 3: Generations ;en
  Only Wish in some form of creative work ;en
 a soundtrack for Dante’s Peak ;en
find Racing the Beam: The Atari Video Computer System;en
Find me the Travel Weekly;en
 a TV series called Dirty Politics. ;en
 creativity of A Catholic Education ;en
Can you search for Twilight Is Gone?;en
Search  the Un provinciale a New York TV  ;en
 The Crucible of Man: Something Wicked Part 2. ;en
How can I view the show Corpus: A Home Movie About Selena?;en
Find painting Big Ideas;en
Find the creative work Brilliant! Tragic!;en
find the trailer Platinum In Da Ghetto;en
Find Pat Garrett y Billy the Kid.;en
 a novel called Matching Dreams. ;en
I want to  a game called Scotland Tonight. ;en
find Doggy Day School, an album;en
Find a painting called Beyond the Neighbourhood.;en
 Waiting for Touchdown, a book ;en
 up the Rock the Blind photograph ;en
Show  Dangers of the Canadian Mounted ;en
Listen to Dragon Ball: Music Collection;en
