expression;language
Can you   the trailer of the Hippocratic Oath? ;en
 the saga called the Black Lamp ;en
 a song called In Your Eyes. ;en
 the trailer for Real Men Cry ;en
 The Great Hydration, a TV series ;en
Play The Great Adventures of Slick Rick game;en
 The Aviation Cocktail album ;en
Find The Black Girl in Search of God trailer;en
Show me Born in America?;en
Pull up the  show, 40 Seasons: The Best  Skid Row ;en
 Mother Earth, a TV show ;en
Find The International Journal of Robotics Research soundtrack;en
How can I see the TV series Mothstorm?;en
Find Show-Ya 20th Anniversary The Best.;en
find NHL on Fox;en
Find a novel called Downward to the Earth.;en
Please  me the work, Earth Intruders. ;en
find an album called Stumble.Stop.Repeat;en
 can I purchase Papers  Regional Science, the album? ;en
Find The Killing Fields.;en
find the novel A Hat in Time ;en
What  Marty Stuart discography ;en
Show the Soonchild painting ;en
 the song titled The Mole Show Live  the Roxy ;en
Play the TV series Heart of Gold;en
I want to read the  Michael Clayton ;en
Go to the movie The Best of Pirates of the Mississippi;en
 the TV show Iron Seed ;en
 a television show called Tiny Dancer ;en
Can you  me the movie, The Girl  the General? ;en
Show me a picture called Heart Like a Hurricane;en
 the album Future of the Past ;en
Find the Check Please photograph.;en
Where can I get the novel Flesh-Colored Horror;en
I'm looking for the show Sex  Candy ;en
Please find the TV series Back to Bach;en
  the photograph Johnny Cash: The Complete Columbia Album Collection ;en
Find a novel called On the Case with Paula Zahn.;en
find Seduced by Madness, a trailer;en
  the Live~Legend 1999 & 1997 Apocalypse TV  ;en
find a game called So Long Self;en
Get  a photograph of Trac ;en
Where can I  the creative works The Very Best  Simply Red ;en
Show me Live  the Kings Center ;en
Show Saison 5 de Game of Thrones;en
Show me the album Apache Axis2;en
Play me East Side Story;en
find the game Endangered Species;en
Show the Philosophy and Phenomenological Research saga;en
Look  the No Bigger than a Minute soundtrack ;en
Show the Feed the Kitty painting;en
Show me the game  Bank ;en
 the trailer of Rugrats Go Wild ;en
 Famous Classic Tales television  ;en
 a  series called When Harry Tries to Marry. ;en
Can you find My Island Home TV series?;en
I want to read the book Crash Landing;en
Find a photograph called Midnight Mystery.;en
Need to find the soundtrack called Fire in the Valley;en
Help  locate a game called The Master  Ballantrae. ;en
search for the painting Hess: A Biography;en
Find me the photograph The Late  ;en
 The Collectors video game ;en
Find me the novel of A Dictionary of Slang and Unconventional English;en
find Wintersong game;en
Can you  a picture of The Rambler ;en
I'm looking for a job in Inversion;en
I'd like to see the game called God   the T.V. ;en
Find The Last Angry Moose;en
Wish to hear the album Since I Saw You Last;en
 the TV series The Farewell Tour ;en
Show  Skyfall: Original Motion Picture Soundtrack ;en
Can you help me locate the game, Coast?;en
I'm trying to find The Final Solution video game.;en
I need to episodes  the  series, Fast Food Nation. ;en
Buy Cannabis painting;en
Please get  Exploring the Reef TV show ;en
Find the TV show titled The Three Leaps of Wang Lun;en
show me PhotoScape;en
I'm looking for Circus World.;en
find the picture Their Finest Hour;en
 the photograph Among the Living ;en
Please search for the Puppet on a String video game.;en
Find a picture of  Hole ;en
Find The Way West show;en
Looking  A Black Ribbon  Deborah. ;en
 A Family Torn Apart TV  ;en
 The Transformers: Generations video game ;en
 a TV show called Directions Home. ;en
What type  movie is Houston Press? ;en
Can you find the Info Wars saga;en
Look for the Chu Chu and the Philly Flash picture;en
Can you find me the Spectres television show?;en
Show the Soonchild painting;en
Where can I purchase the Twenty Chickens for a Saddle saga?;en
Where to buy Unarchigal ;en
Can you get me The Education of Little Tree song?;en
find PoliticsNation with Al Sharpton ;en
 Wish You Were Here, a movie ;en
Look for a photograph of Tailwind;en
Go to the saga The Quantum Thief;en
 a novel called Kiss Me Licia. ;en
 a painting called Thunder in the Sky. ;en
Can you  the novel Stoneage Romeos ;en
Show me Heavenly Sword;en
Show me the TV show  Only Wish ;en
Play me the soundtrack Ready;en
Find a soundtrack called The Woman Warrior.;en
Where can I find the movie called Cracking Contraptions?;en
 I see the the painting Another Life...Another End? ;en
Find a photograph called The Dickinsonian.;en
find Long Walk to Forever, a novel;en
Show me the book The Republican Brain;en
show the creativity of The Attic;en
I'm looking for the game called Summer of Fear;en
I'm looking for the saga The Hardest Part;en
 me the JQuery Mobile TV show ;en
I want to see Everytime We Touch which is a painting;en
Look up The Dock of the Bay  ;en
 Touch of Eva, a TV  I want to see ;en
I'd like to  the Limited Lovers novel ;en
Where can I buy The Lying Game;en
I'm looking  the movie White Unicorn ;en
I'm looking for The Birth of a Nation;en
find a video game called Craters of the Sac;en
Find Ek Boond Ishq. ;en
 can I get the video game Faith  Chaos? ;en
Please find me Glass Cloud – Single.;en
Please search Cardin  Australia saga ;en
I'd like to watch episodes  the TV series, The Secret  Queen Anne or Musketeers Thirty  After. ;en
Where can I locate Leo the Lion  purchase ;en
 a TV series called White Bread Black Beer. ;en
I want to  the  to Worms 2: Armageddon. ;en
Look for the creative work called White Sugar;en
read the  Friend: The Great Legacy ;en
I'd like to see Hannah Montana and Miley Cyrus: Best of Both Worlds Concert;en
find Saison 7 de Sons of Anarchy;en
Where is the creative work Seven Pillars of Wisdom?;en
Search for the television show called Educational Psychologist;en
find Playground, a book;en
 you pull up Channel M News ;en
show me the Everybody Wants You picture;en
 up the TV series Operace Silver A ;en
 a song called Magic in the Water. ;en
Find Stays in Mexico.;en
show The Best of Minnie Riperton saga;en
Find the trailer for Bill Cosby Presents the Cosnarati: State of Emergency;en
show TV show named I Fell in Love with a Dead Boy;en
Get me the soundtrack from Sensation Comics.;en
Find the show titled The Most Charming  Attractive ;en
 the television show titled Spatial Query Server ;en
Find a painting called The Book of Folly.;en
 up The Baltic Times picture ;en
Where can I locate the show The Return of Mr. Moto;en
 the Steady as She Goes saga ;en
Please locate Sad Love Story novel  me. ;en
Find The Cerebellum book;en
I want to watch Wide-Eyed  Ignorant ;en
Find a song called Magic in the Water.;en
  the NYPD - New York Police Department saga ;en
find the show CarniK Con;en
 a trailer called Peggy Sue. ;en
Find Pursuit of Radical Rhapsody;en
play If You Go ;en
I'm looking  a novel called The Adventures  Lolo II ;en
Can I see the show Heroes of Might & Magic 4?;en
I'd like to hear the song  a Reverie ;en
find a television show called Tiny Dancer;en
 you please get  Come Away with  show? ;en
Find the App Store ;en
Show me the work Not a Little Girl Anymore;en
find Wish You Were Here, a movie;en
I'd like to see the picture Chrome Dreams;en
 the trailer for A Lineage of Grace ;en
want to watch the TV  Treeful of Starling ;en
 the movie Yoshimi Battles the Hip-Hop Robots ;en
Please search for the Live in San Juan Capistrano picture.;en
 creativity of Official History of Australia  the War of 1914–1918 ;en
Search for Another Cinderella Story;en
I want to watch the television  Champion ;en
find the Carrousel saga ;en
Please look up Amrithavaahini ;en
 can I  the painting  A Christmas Story - Una storia di Natale? ;en
Play me the soundtrack for Nothing Personal.;en
show the creativity of saga The Dissociatives;en
 the painting Sleeping in Your Hand ;en
 Back  Good, a novel I want to read ;en
I want Sugarfoot ;en
show video game name  the Colour ;en
find The Quest of Iranon ;en
play Myth II: Soulblighter;en
find the picture Louder Than Bombs;en
Please search  the Microsoft Safety Scanner television show. ;en
 The Fire  Our Throats Will Beckon the Thaw TV show ;en
Look  the novel Behind closed doors ;en
Please find me the picture of The Getaway: Black Monday.;en
I'm looking for 1634: The Ram Rebellion.;en
 me an album called Rejoicing with the Light ;en
Play the Knockabout soundtrack;en
Find the show The Sword of the Lictor;en
Help me find the work titled SingStar Take That;en
 you get the TV show, ENTER THE MATRIX? ;en
Can you  The Wanderer and His Shadow ;en
find a TV show called Full House;en
Show The Last Tightrope Dancer in Armenia television show;en
I need to episodes for the TV series, Fast Food Nation.;en
search  the painting Hess: A Biography ;en
Look for the American Journal of Sociology;en
Where can I find the TV show A Step Away;en
find a photograph called Free the Universe;en
show creativity of Sing to the Dawn;en
 the soundtrack titled This Side of Paradise ;en
I need a painting called Brubeck Plays Brubeck;en
Where can I find a copy of I Bury the Living?;en
Show me The Lord of the Isles;en
Find the novel WWE Legends of WrestleMania;en
I'm looking for the trailer to Evil or Divine - Live in New York City.;en
 can I purchase a copy  the photograph  the front page  today's Jacksonville Daily Progress? ;en
Look for the novel Behind closed doors;en
Find an album called Just Call Me Stupid.;en
I need info on the video game Iron Fist;en
Show The Singles Collection Volume 4;en
play the Ashley Tisdale discography TV show;en
 The Girlfriend Experience, a television show ;en
Find a video game called The Mysterious Castle in the Carpathians.;en
 TV series schedule of Gears of War ;en
Look up The Cool Cafe: Cool Tape Vol. 1 video game;en
 Wild Solutions, a saga ;en
Find the Show Your Hand show;en
 the creativity of The Attic ;en
What is the  Sell Your Body? ;en
find a TV show called Randy Scouse Git;en
find the song Ticks;en
 the TV show When I Was a Boy ;en
Play Remains of the Day;en
find Cascading Waterfall ;en
show creativity of Sacred Fire: Live  South America ;en
find a TV show called Ruthless;en
Can you find me the Naked City – Justice with a Bullet album?;en
 a photograph called Cold Weather. ;en
How do I see the TV series To See the Invisible Man?;en
Find In the Line of Duty: Street War.;en
find The Saint in New York, a show;en
Show me the saga  Darling ;en
show creativity of saga Frontier Marshal;en
search  movie Turn Back the Clock ;en
 can I get Intel Array Building Blocks ;en
find Thyme Travel;en
find the game Selling Blue Elephants;en
Find Z Cars. ;en
find Home Fires;en
find The Flying Scotsman ;en
show creativity of Pocket Full of Kryptonite;en
Find the Stone Free game;en
Find a painting called Boating on the River Epte.;en
play Print the Legend soundtrack;en
Find Phalcon. ;en
Please find me a novel called The Caledonian-Record.;en
Show me The Advocate;en
I'm looking for the television show The Flame;en
Search for Big Ideas painting;en
 Saison 7 de Sons of Anarchy ;en
  I purchase the TV series Liar Game - The Final Stage ;en
 a saga called Set Sail the Prairie ;en
I'd like to see the book City University of Hong Kong Law Review;en
Look  All Broken Up  Dancing which is a video game ;en
 the novel A Hat in Time ;en
Where can I see the  Twentysomething ;en
Show me the Sex Therapy painting;en
What is the song The Beast from 20?;en
find Join the Dots: B-sides and Rarities;en
Pull up the video game, Apothecary Rx;en
Show me the TV series Prescription for Death ;en
Please search the work, The Mercenary.;en
find PlayStation官方杂志, a song;en
Show me the song The Incredible Hulk Returns;en
Can you search City  Scars? ;en
I'm looking  the saga Why Men Leave Home ;en
 the video game The Sparrow ;en
find the novel Meg  Seron ;en
I'm looking to find the trailer for Brought by the Sea.;en
Look for the Itv.com song;en
Can you  the movie Accidentally in Love ;en
Give me a link to the A Little Something for Us Tempunauts soundtrack.;en
Shw the  Twin Husbands ;en
Where can I watch the trailer for Home Economics;en
I  to  the creative work Burn Baby Burn ;en
find Seduced  Madness, a trailer ;en
I'm looking  Circus World. ;en
Search  Police Women of Cincinnati ;en
Look for the NYPD - New York Police Department saga;en
 creativity of Construction Project Information Committee ;en
Show  the photograph Rock You Baby ;en
Show The Critic game ;en
show Air Cuan Dubh Drilseach;en
Please pull up the photograph entitled Another Period;en
Find a video game called Peaches discography.;en
Please look up the Falls Church News-Press album.;en
Where can I view the TV series  W.I.T.C.H. ;en
 a book called Screwed. ;en
Show me the saga The Buffalo Boy;en
Find FANatic. ;en
Where can I see the trailer for Phineas Redux?;en
Plau  the song The French Chef ;en
Look  a photograph  I Wanna Sex You Up ;en
Find a song called Be Quick or Be Dead.;en
show Crafty Hands saga ;en
search for the show The Caretaker;en
Find a soundtrack called Meet The Vogues.;en
Please show  the picture History Repeating ;en
Give me a link to the saga called Copper – Justice is brutal;en
Show me the Live~Legend 1999 & 1997 Apocalypse TV show;en
I want to see the trailer Amor Puro;en
Show me the game English Freakbeat;en
find Back to Boomtown: Classic Rats Hits, a soundtrack;en
Show me the movie Black Summer;en
Find the Youth Against Christ saga;en
Are there any painting of the 1st Concert Oh Yeah! 1999?;en
 a TV show called Frontiers in Ecology  the Environment. ;en
Show  the television show The Angry Mob. ;en
 The Way West show ;en
Look up The Reverse of the Medal;en
I'm looking for the CineExport painting.;en
find Thyme Travel ;en
I'm looking  The Birth of a Nation ;en
find the movie Ircle;en
find the They Came from Somewhere Else saga;en
 Acta Mathematicae Applicatae Sinica TV  ;en
look up Holy Water;en
Look  the Thorns saga ;en
Find the Exile and the Kingdom;en
Can you search A Song  Mama   me? ;en
I need a  called Student Demonstration Time ;en
Please get me the AiON show.;en
show creativity of Accident Analysis & Prevention;en
find Hope & Other Sins, a TV show;en
show creativity of Diamonds  the Rough ;en
play saga The Yellow Rose of Texas;en
Bring up the book Perfume: The Story of a Murderer;en
Where can I find Police Story 3: Supercop;en
 the soundtrack for Back to the Future ;en
  album called Burnout: The Ultimate Drag Race Challenge ;en
Find The Modern World video game;en
Find The Path to Power.;en
Search  Ayumi Hamasaki Countdown Live 2007–2008 Anniversary song ;en
I need to  the saga Trail  the Yukon ;en
Where can I find Thor Meets Captain America?;en
Find a work with the name of Come Sing;en
Find the News At Seven-Thirty photograph;en
Where can I view the photograph Occasional Wife;en
Show me the painting called Fool  Love. ;en
 a photograph called XQuery API for Java ;en
 a saga called Shame on You ;en
show creativity of A Catholic Education;en
Show me Then We Came to the End;en
 me the TV show SEAL Team ;en
I need to see Cristo  India ;en
 a photograph  Adventure Time: The Secret  the Nameless Kingdom ;en
 The Caveman television  ;en
 Amanda Palmer Goes Down Under ;en
I'd like to see Confessions of an Indian Teenager;en
Please find me the work, Ace of Spades.;en
I'm looking  the CineExport painting. ;en
Looking for the trailer for Shaolin Temple;en
I need the game The ARIA  Show ;en
Find me the picture Live in Paris 1975;en
find a photograph called Dragon Ball Z: The Best Selections;en
find a book called Outpost Firewall Pro;en
 the picture of The Harsh Light of Day ;en
find the trailer for Hotel on the Corner of Bitter and Sweet;en
 I see the album SWAT Force? ;en
show creativity of photograph of My Wonderful Day;en
Where to buy painting Target Practice;en
I'd like to see the saga Tamagotchi 64: Minna de Tamagotchi World;en
Find a TV show called Directions Home.;en
 me Shack Out on 101 ;en
Show The Matrix Revolutions;en
I'd like to  the album Beloved Rogues ;en
How do I watch the television show Counting the Rosaries?;en
I want the song Phrazes  the Young ;en
show me Chasing a Feeling painting;en
Find the Via Dolorosa: Songs of Redemption saga;en
Please help me find I Want to Take You Higher the game;en
 The Covered Wagon, a game ;en
find Check In ;en
look for the creative work The Testament of Gideon Mack;en
is there a Chinese Wikipedia;en
Show me a novel by Onnaam Muhurtham;en
Show me the Caribbean Blue television show;en
Where can I find the photograph of A Christmas Memory;en
Please locate Sad Love Story novel for me.;en
find Young Miss Holmes ;en
Look up Three Fantastic Dances;en
look up Adobe Brackets soundtrack;en
Find me the movie with the title of Twitches;en
find the painting Retro Active;en
I'd like to see Jacksonville Daily Progress saga;en
Please get me the work Shirley aviatrice.;en
 song schedule Come into the World ;en
 search The Big Game show. ;en
Search for Informix Wingz;en
Find The Tyrant ;en
Look for the Public Toilet painting;en
Find Darker than black.;en
I  looking for the TV series Strays ;en
find the show The Best of: The Township Idols;en
 the saga A Very School Gyrls Holla-Day. ;en
find War & Peace Vol. 1;en
 the song Evocation I – The Arcane Dominion ;en
 Fragile Frontiers: The Secret History  Mumbai Terror Attacks. ;en
 The Best Man Holiday saga ;en
Please search Thirayum Theeravum video game.;en
 the album The Peace-Maker ;en
 THUNDER IN THE EAST. ;en
Please  the TV show, The Dreamstone ;en
 a show called The Crowd Roars ;en
find a game called The Oh in Ohio;en
 can I  the work It Was Raining That Night? ;en
Show me Heavenly Sword ;en
show TV show schedule Archive.is;en
find the painting The Adventures of Teddy Ruxpin;en
Can I see the TV show The Closer I Get?;en
 creative work of Through the Back Door ;en
play the song Evocation I – The Arcane Dominion;en
 the painting Retro Active ;en
 The Last Angry Moose ;en
Show me the work The Catholic Weekly;en
I  looking for Shoot Me Down ;en
I'd like to watch the TV series called Fires   ;en
Find WxHexEditor. ;en
I'm looking  a picture titled Rock Painting ;en
Play 30 Greatest Hits ;en
Find a photograph called Cold Weather.;en
Find Conker: Live and Reloaded;en
Look up The Gun soundtrack;en
Show Transformers: The Game;en
Where can I  the album The Adventures  Lolo II ;en
show More Questions Than Answers trailer;en
Find the trailer for Real Men Cry;en
 the picture Ultima VI: The False Prophet ;en
Find Le Profil Amina TV series;en
Look up The Baltic Times picture;en
Looking for novel Build Engine;en
Find Z Cars.;en
 the show Go with the Flow ;en
find me a game called Merle Haggard Presents His 30th Album;en
What channel does the television  The RoxBox  on? ;en
 the video game called Turnin Me On ;en
show creativity of The Album saga;en
 a movie called Single Collection: Hotchpotch ;en
 the work Compiled fragments 1997-2003 ;en
Please help me  the Short Program saga. ;en
Get soundtrack of Comprehensive Knowledge Archive Network;en
read the novel On-Line Encyclopedia of Integer Sequences;en
Show the Put Yourself  His Place game ;en
 creative video game The Boat Is Full ;en
Where can I watch the television  called Fangs  the Arctic? ;en
 a trailer for Sencha Touch ;en
Buy Cannabis painting ;en
find a TV show called The Fighting Men;en
Show the TV series  The Merry Sisters of Fate.;en
find TaskCracker for Outlook, a game;en
I'd  to listen to the  The Natural Farmer ;en
 Live at Memory Lane ;en
Want to see the Dungeons & Dragons: Chronicles of Mystara;en
 me the Travel Weekly ;en
find the movie Don’t Break the Heart That Loves You;en
show song Black Heart White Soul;en
 300: March to Glory, a song ;en
Can you find me the SchoolTool picture?;en
  I buy a photograph called Feel the Love? ;en
Find the game BlogBridge ;en
find Mother Earth, a TV show;en
I want to  the  Frank Sinatra Sings the Select Sammy Cahn ;en
find Sweet Sensation ;en
Please look up the Beauty on the Fire show.;en
I want television  Come Again Smith ;en
play The Sea Cabinet ;en
Show  the Caribbean Blue television show ;en
Find a novel called Twins of Evil.;en
Look  the trailer to Hickory Daily Record. ;en
play Another Time ;en
Find The Gamble.;en
Find a trailer called Peggy Sue.;en
 a soundtrack called The Dragon. ;en
Find The Gill Deacon Show.;en
Show  the novel All I Need to Know ;en
 a television show called Merced Sun-Star. ;en
find Do You Wanna Touch Me, a song;en
Find a television show called Merced Sun-Star.;en
What  the release date  the DVD called Wild  the Wind? ;en
Wish to fins a television show called Whole Again;en
Get me the Elvis’ Christmas Album TV show.;en
 the book Cold Comfort ;en
Find a photograph called Greatest Hits Volume One.;en
I'd like to see the show Onion SportsDome ;en
Please search the Irv Gotti Presents: The Murderers picture.;en
find the novel Playlist: The Very Best of Brad Paisley;en
Play video game Manifesto of Nevermore;en
 to get saga  A Brush with the Law ;en
How can I watch the television  Straight Shooter? ;en
show Investigating Sex album ;en
Please search the Songs  the Deaf video game. ;en
I'm looking for the trailer of Highlands Today;en
I need to  the creative work Prince Hours ;en
find a show called Big Broadcast of 1938;en
Where to get painting  The Man  the White Suit ;en
Show me a photograph called The Daily Slovak News;en
find a book called The Mad Magician;en
play Off the Ground;en
find Journal of the European Economic Association, a movie I want to see;en
show the movie Move Any Mountain;en
Can you please find me The Biggest Loser Brunei: The Spirit of Life photograph?;en
 a book called Follow Me ;en
 a game called Dynamite Warrior. ;en
I want to see the television show The Muppet Christmas Carol;en
Find me Haunted Castle;en
Show  a photograph called The Daily Slovak News ;en
Find the Pop Has Freed Us saga;en
find Journal of the Society for American Music;en
I'd like to see the album Heroes of Might and Magic IV;en
show Chocolate Rain creativity;en
I want to World of Warcraft: Tides of Darkness ;en
Where can I purchase the game Dancing in the Dark: 10 Years of Dancing Ferret;en
Please help  search the TV series A  Divided. ;en
Find The Mary Van Note Show;en
Hook me up with a song by Dancing Girl.;en
Find me the Balance and Timing book;en
 The Best of Minnie Riperton saga ;en
 Word of Mouth for me ;en
 the Innocent When You Dream saga ;en
search for Space on  Hands ;en
 Pursuit of Radical Rhapsody ;en
I'd like to see the painting I Looked Up;en
Find Beavis and Butt-head ;en
Find The Creeper. ;en
Where can I see the trailer of Take Me to the King;en
I'm looking for Sherlock Holmes contre Arsène Lupin.;en
show  the television show Operation Thunderbolt ;en
Show The Family  One End Street album ;en
Please look up the Power and Love movie.;en
 The Garden of Eden ;en
find Amanda Palmer Goes Down Under;en
show TV series schedule of Gears of War;en
Where is Winterheart’s Guild ;en
 to  a creative work with the title Sometimes the Blues  Just a Passing Bird ;en
Where can I  The  Little Toaster To The Rescue book? ;en
 a novel called Chemistry - An European Journal ;en
When was the album Start a  released? ;en
look  the  titled Iranian Journal of Fuzzy Systems ;en
Can you   the Naked City – Justice with a Bullet album? ;en
 The Life of Riley, a photograph ;en
Please find the movie Dancing Girl;en
Show the My World 2.0 photograph;en
 me the novel London Has Fallen ;en
I am looking for a creative work called Something Warm;en
Play The Lousy Dance trailer;en
Please get me Rough  Ready saga. ;en
 The Family Jams saga ;en
 a TV show called The Ambient Collection. ;en
Please  up the Falls Church News-Press album. ;en
play the song Memories Are My Only Witness;en
Looking for the painting Last Flight To Abuja;en
 pull up the photograph entitled Another Period ;en
Find an album called Thursday Night Baseball.;en
Show me the saga St. Elsewhere;en
Find a television show called Main Street.;en
Show me the television show called South California Purples;en
Find The Boys in the Band.;en
I want to watch the show Food Force;en
 Reproductions: Songs of The Human League ;en
Go to The   the Deal:50 Secrets to Successful Dealmaking ;en
 The Great Adventures of Slick Rick game ;en
I'd like to see the  TeleForm ;en
show the trailer of Deadly Skies;en
Is it possible to  the book Live  Europe online? ;en
find the television show called Tactics;en
Show me Bâton Rouge;en
Find The Coffin.;en
find Donkey Town, a show;en
Find the movie CURL ;en
Find the Cold Dead Hand video game for me;en
Show  the lowest price  the game Sinatra Reprise: The Very Good Years. ;en
 a soundtrack for Lords of the Rising Sun ;en
I want to watch Manthan;en
 Episodi di South Park, a trailer ;en
Search for The Adventures of Cookie & Cream;en
 the song called International Journal of Bilingualism ;en
What is the TV show Journal of Personality and Social Psychology?;en
Look for the Nightmare on Providence Street saga;en
find The Great Hydration, a TV series;en
Find The Tyrant;en
Find me Nights in Harlem;en
Is there any creative work  Heterocycles? ;en
show me the Evil Dead painting;en
 a soundtrack called The Woman Warrior. ;en
Where can I purchase Paradise Tonight online?;en
Please search  the work, All the Wrong Reasons. ;en
Play The Lure of the Mask song;en
