expression;language
find a photograph of adventure time the secret of the nameless kingdom. ;en
can i see the show heroes of might and magic four. ;en
network soundtrack download. ;en
i want to play the game the carney. ;en
find the photograph the air is on fire soundscapes. ;en
find the game selling blue elephants. ;en
show the trailer of deadly skies. ;en
find a photograph called at query API for java. ;en
search for live forever the rise and fall of brit pop TV show. ;en
find back to boomtown classic rats hits a soundtrack. ;en
find the show we chase the waves. ;en
find saga hamilton c shell. ;en
where can i find lonely hearts. ;en
where can i find the game a little bit of mambo. ;en
find saison seven de sons of anarchy. ;en
could i download chavez inside the coup. ;en
i'd like to hear the song in the dollar prince vs penguin empire. ;en
show me the picture nothin. ;en
find a television show called twisted. ;en
can you search city of scars. ;en
please look up the falls church news-press album is here. ;en
show crafty hands saga. ;en
show me a picture called heart like a hurricane. ;en
find a TV series called church of the truly warped. ;en
find do you wanna touch me a song. ;en
i'm looking for the show pulse two after life. ;en
find the trailer for real men cry. ;en
want to watch the TV show tribute to love starling. ;en
find store across. ;en
please find me the work earth intruders. ;en
i'm trying to find the final solution video game. ;en
find a TV show called ruthless. ;en
i want to find the show called fresh aire seven. ;en
find the photograph the nick cave and the bad seeds. ;en
find the most important people a television show. ;en
can i buy the book vacation of petrov and the surgeon on line. ;en
look up the fair warning saga. ;en
can you find the album simple screen recorder. ;en
find the novel meg and sharon. ;en
show creativity of video game labyrinth. ;en
where can i find tales of ghost castle. ;en
find the album biology today an issues approach. ;en
show me the lord of the isles. ;en
find make your play. ;en
find live at the bottom. ;en
please find me a novel called the caledonia. ;en
find next of kin. ;en
i wanna watch the TV show official detective. ;en
show creativity of all for one. ;en
search for the exiled realm of harbour area. ;en
can you pull up the sanford herald. ;en
play me east side story. ;en
want to find a photograph called the nine maidens. ;en
where can i buy the lying game. ;en
look up the park album. ;en
i wanna watch the TV series freaking chinatown. ;en
show angels of iron television show. ;en
where can i get the novel flash colored horror. ;en
find a saga called set sail the prairie. ;en
show me the different restoration of TV series. ;en
can you please look up the TV series an experiment with time. ;en
find google news. ;en
find the TV show tribute to the troops. ;en
show creativity of what is dead may never die. ;en
where can i purchase the TV series the mating season. ;en
where can i get a photograph of death knows your name. ;en
i'd like to see the television show the best of design of a decade phone. ;en
find a television show called servidor apache. ;en
look for a photograph of tailwind. ;en
where to watch television show linger awhile live at newport and more. ;en
can you play the wanderer and his shadow. ;en
i'm looking for you to get me jack of shadows. ;en
i need top gear two please search it for me. ;en
where can i locate the game legion of mary the jerry garcia collection. ;en
is there any creative work for harris i goals. ;en
find the gamble. ;en
show movie the da house. ;en
i want to find night of the hunter. ;en
go to the devil in the deal for fifty secrets to successful deal maker. ;en
show creativity of novel lock. ;en
find the photograph the remix please. ;en
show the whispering willows novel. ;en
find bump off lover. ;en
what channel does the television show the rocks box play on. ;en
find a video game called the mysterious castle in the car party ends. ;en
find me the TV show ask a woman who knows. ;en
i'd like to see the saga twelve soulful nights of christmas. ;en
find night of passion. ;en
i want to play a game called scotland tonight. ;en
find a soundtrack called billboard hot r b hits nineteen eighty one. ;en
play the TV show iron seed. ;en
play show of cissy houston. ;en
show me the saga the buffalo boy. ;en
f i am the glory. ;en
find the via della rosa songs of redemption saga. ;en
find the game endangered species. ;en
i'd like to find the book called the years. ;en
i want to find the very best of chicago only the beginning. ;en
find the trailer for on the good ship lollipop. ;en
please find me chance pe dance. ;en
search for the george and the big bang TV show. ;en
look for the compact forest proposal trailer. ;en
where can i find a painting called battle stations pacific. ;en
can you find me the game super scription of data. ;en
please find the movie dancing girl. ;en
search for trailer jazz impressions of the u. s. a. ;en
play the rest of my life. ;en
find the mad woman in the attic. ;en
find a television show called sensation comics. ;en
can you locate the saga for the ringo sheena discography. ;en
find me royal astronomy. ;en
show the blackberry bush show. ;en
show the late great. ;en
show creative video game the boat is full. ;en
show creativity of song a discord electric. ;en
find a TV series called manufacturing consent. ;en
i want to listen to the soundtrack bed of roses. ;en
can you find the trailer for the young martyr. ;en
where can i read the book the omega stone. ;en
get me a johnny cool photograph. ;en
find the picture their finest are. ;en
find the black girl in search of god trailer. ;en
find the cold dead hand video game for me. ;en
find a TV show called the ambient collection. ;en
do you know of a song by the mande studies association. ;en
what is the read all about it picture. ;en
find the earth is a sinful song. ;en
i am looking for a creative work called something warm. ;en
show creativity of diamonds in the rough. ;en
find the fire in our throats will be back in brussel TV show. ;en
find the trailer for terminator the western exterminator. ;en
show creative labor notes. ;en
play the album the outpost. ;en
i'd like to see confessions of an indian teenager. ;en
show me a television show named a love to hide. ;en
find war and peace volume one. ;en
i'm looking for a movie called salvage mice. ;en
i'd like to see the novel an inquiry into the good. ;en
find us moving. ;en
look up the act of valor TV show. ;en
where can i find thor meets captain america. ;en
look for every little crook and nanny. ;en
play the catholic sun album. ;en
look for the trailer for red stallion in the rockies. ;en
go to buy a ruby. ;en
where can i locate the show the return of mr moto. ;en
can you pull up channel m news. ;en
where can i watch the TV series the trifecta. ;en
would like to find the trailer for an experiment with time. ;en
i'd like to listen to the song the natural farmer. ;en
i'd like to play the song in a reverie. ;en
can you please find me journals. ;en
can you help me find the we no who u r game. ;en
please search the young warriors game. ;en
find touch of eva a TV show i want to see. ;en
show minutes to midnight photograph. ;en
show the kindness of women picture. ;en
find the exile and the kingdom. ;en
find me the song called the budapest beacon. ;en
find the inspector for me. ;en
where can i purchase the twenty chickens for a saddle saga. ;en
i'm looking for a game called gateway. ;en
please pull up the photograph entitled another period. ;en
find the path to power. ;en
can you find the photo. ;en
find a painting called beyond the neighbourhood. ;en
i'm looking for the album called disorderly conduct video on patrol. ;en
show me the work titled the perfect gentleman which is a song. ;en
help me find where the wild things are. ;en
find the song titled the mole show live at the roxy. ;en
show me the album andrews university seminary studies. ;en
show creativity of painting of me too. ;en
find oman medical journal. ;en
what is the painting forever malcolm young. ;en
find winter sound game. ;en
show me the imei and the TV series. ;en
can you please find the notebook of try gordon dim. ;en
help me find the work titled things start take that. ;en
i'd like to listen to the soundtrack in the air. ;en
can you help me find the author arthur trailer. ;en
find live at the brixton academy. ;en
i want to listen to keep the faith. ;en
find me the jquery mobile TV show. ;en
show get it together on TV show. ;en
play bliss torn from emptiness. ;en
find a book called tron legacy re configured. ;en
can you find me the spectre television show. ;en
where can i find the work it was raining that night. ;en
find later that evening. ;en
i want to watch widen ignorant. ;en
find thunder in the east. ;en
find a video game called fare thee well celebrating fifty years of the grateful dead. ;en
find me a game called merle haggard presents his thirty th album. ;en
find the novel what we did on our holiday. ;en
can i hear the song visual audio sensory theater. ;en
show me a picture of love. ;en
i want to watch the movie maxime. ;en
where to buy video game of think fast. ;en
she me the sons of satan praise the lord picture. ;en
show the man from london video game. ;en
find a picture called ready. ;en
can you find me the restless natives. ;en
can you find the TV show so what. ;en
find a picture of music hole. ;en
i'd like to see the painting i looked up. ;en
find the television show titled spatial query server. ;en
find me the river of love saga. ;en
find spirit of the bush. ;en
find a photograph called sleeping with the enemy. ;en
pull up the trailer for two thousand years the millennium concert. ;en
find a game called bump the show. ;en
show famous classic tales television show. ;en
find a painting called screen souvenirs. ;en
please find the song house of wedlock. ;en
show the swan princess. ;en
where can i listen to the song the lost worlds of planet earth. ;en
please show me the picture history repeating. ;en
can you pull up the american music awards of nineteen seventy five. ;en
find a TV show called full house. ;en
find a TV show called revenge of the nerds. ;en
show me the sex therapy painting. ;en
find me the novel of a dictionary of slang and unconventional english. ;en
show the caveman television show. ;en
i want to watch the trailer to worms two armageddon. ;en
i'm looking for a job in inversion. ;en
went to see the trailer for the prefect. ;en
find the mystery woman saga. ;en
find a video game called no parking on the dance floor. ;en
play the noc about soundtrack. ;en
find harry potter and the deathly hallows part two. ;en
what type of movie is houston press. ;en
show the put yourself in his place game. ;en
play the album journeyman. ;en
play the trailer for a lineage of grace. ;en
play the movie white christmas. ;en
where can i find the game skip to the end. ;en
i want to world of warcraft ides of darkness. ;en
find a painting called songs from sunglasses. ;en
i want the complete global albums collection. ;en
what is the date of can am demos photograph. ;en
doing an image search for the picture perfect storm disasters that changed the world. ;en
show me the work not a little girl anymore. ;en
i'm trying to find the game called give me my remote. ;en
find a saga called shame on you. ;en
find the TV series truly full of starling. ;en
find welcome to the el palacios a movie. ;en
i'd like to see level headed. ;en
show the second civil war saga. ;en
please find me the work ace of spades. ;en
look up the show cissy houston. ;en
where can i find the picture the japanese love song near me. ;en
look for the american journal of sociology. ;en
find me the extreme ghostbusters game. ;en
find the show the best of the township idols. ;en
can you give me the expelled from paradise television show. ;en
where can i find on the marble cliffs. ;en
there's a famous painting called thursday do you have an image of it. ;en
show me the television show operation thunderbolt. ;en
where can i find the picture of house foundation. ;en
show panic in the streets. ;en
i wanna watch the show railroad model craftsman. ;en
find. ;en
can you find me the school picture. ;en
i want to listen to the album magical girl lyrical and strikers. ;en
where can i see the show kind of glue. ;en
find the television show birth of the cool. ;en
can you find the painting the crow original motion picture soundtrack. ;en
find the angry birds movie. ;en
where can i find you know me a saga. ;en
rate trailer geek chic. ;en
search for innocence from hell. ;en
find a picture called how much wood would a woodchuck chuck. ;en
play the TV show wicked city. ;en
please search for the puppet on a string video game. ;en
find a television show called happy trails. ;en
find a video game with him. ;en
find me the book the van dyke show. ;en
want a work called walk the river. ;en
search for a painting of the one hundred eyes. ;en
search for the show the caretaker. ;en
can you please find me d. r. e. immature. ;en
find check in. ;en
show the collectors video game. ;en
look for the journal of toxicology and environmental health soundtrack. ;en
find the show how to meet the lucky stars. ;en
show the phish live in vegas TV series. ;en
find the so this is goodbye saga. ;en
i'm looking for the saga lifelong ambitions. ;en
find the moldy peaches. ;en
search for the game the last horror movie. ;en
show nicole. ;en
what is the current selling price of the novel the sims three island paradise. ;en
please search the iron bound picture. ;en
find merry arizona ninety seven desert stars shine at christmas. ;en
find me nights in harlem. ;en
show the invisible hook trailer. ;en
find me the big sean discography soundtrack. ;en
find a photograph. ;en
w;en
bombshell saga download. ;en
play cry baby lane. ;en
i'm trying to find the show chant to. ;en
find a love song. ;en
find the loving spirit. ;en
find a tale of two cities a painting. ;en
find the photograph can h. ;en
play the game petty st. ;en
where can i purchase the video game the blue generation. ;en
where can i find police story three uber cab. ;en
i'd like to see sex tape finiti in read. ;en
look for little computer people. ;en
can you help me find the television show women and death. ;en
look for the thorns saga. ;en
where can i watch the TV series polite people. ;en
pull up the video game apothecary rx. ;en
find me the song two fast two furious. ;en
show creative work of through the back door. ;en
find the photograph move any mountain. ;en
play saga the yellow rose of texas. ;en
where can i buy a used copy of the game called i lie around. ;en
i want to find the show from where to eternity. ;en
find the album follow that camel. ;en
where is the TV show bomber man land touch to. ;en
can you find the beat mania id extent style. ;en
where can i purchase the TV series the royal sessions. ;en
wish to read the novel called the wizard of stone mountain. ;en
can you give me the email the more saga. ;en
can you pull up queen of the organ. ;en
show book name straight no chase. ;en
show me the painting called fool for love. ;en
play tales from the organ trade. ;en
get me a picture about served on a graph. ;en
find a soundtrack for dante's peak. ;en
i'd like to see jack. ;en
fine. ;en
find a novel called industry. ;en
i'd like to find the limited lovers novel. ;en
show me the picture gas wars. ;en
looking for the painting last flight to abuja. ;en
play TV show way of the samurai two. ;en
look up the TV series operate silver. ;en
show andy williams sings steve allen TV show. ;en
play me the song just to see you smile. ;en
find the picture ultima VI the false prophet. ;en
can i see the TV series the late music. ;en
find a game called albino black sheep. ;en
please look up for disney universe. ;en
find the movie you must first learn to draw the real. ;en
i want the song phrases for the young. ;en
i'm looking to find very events she. ;en
what is fantasy zone to the tears of PA PA. ;en
find the last angry moose. ;en
where can i download the game miss robin hood. ;en
play baby workout. ;en
find me the show girl soundtrack. ;en
find me the young doctors in love TV show. ;en
where can i see the trailer for love on the beach. ;en
i'd like to hear the song impractical jokers UK. ;en
find cascading waterfall. ;en
find the novel called loyalty. ;en
search for the painting the elder scrolls one arena. ;en
show the matrix revolutions. ;en
get me the soundtrack from sensation comics. ;en
find a soundtrack called the spanish jade. ;en
find if these walls could talk. ;en
find a TV show called shake hands with beef. ;en
where is when your heart skilled. ;en
i'm looking for the trailer to evil or divine live in new york city. ;en
where can i buy the movie two italian tea. ;en
find the trailer platinum in da ghetto. ;en
find outback bound a trailer. ;en
can you search for twilight is gone. ;en
look for the TV series all around performance horse weekly. ;en
play the television show tears laid in earth. ;en
can you please search ellington at newport. ;en
show the last tightrope dancer in armenia television show. ;en
look for the high noon TV show. ;en
show me work of truth and tolerance. ;en
show me the movie purple heart diary. ;en
i wanna watch the TV series rat pack. ;en
find a song called bronco billy. ;en
please get me the national medical journal of india game. ;en
find attack surface analyzer a painting. ;en
find the still life american concert nineteen eighty one soundtrack. ;en
find the video game journal of criminal law criminology. ;en
find me the show the skull. ;en
play video game manifesto of nevermore. ;en
find a saga called story of my life. ;en
please search for the work all the wrong reasons. ;en
show me the picture sex and drugs and jesus christ. ;en
who was the artist who did the painting called spiral two season of flame. ;en
i need a photograph of days of wine and roses and other TV requests. ;en
find the movie don't break the heart that loves you. ;en
i want to see the maximum trance picture. ;en
i'd like to play the album clarke. ;en
show creativity of pocket full of crap tonight. ;en
what is the TV show this is halloween. ;en
i'd like to see the movie edinburgh evening news. ;en
what is the release date for the DVD called wild is the wind. ;en
find a trailer called sheriff mix discography. ;en
where can i watch the television show the private affairs of bel ami. ;en
find journal of the european economic association a movie i want to see. ;en
i want to play the game the celestial hawk. ;en
where can i find the video game called banana to the unemployed ninja returns. ;en
find a movie called bruce lee. ;en
find the world is a game. ;en
i'm looking for the saga why men leave home. ;en
i'm looking for the television show the flame. ;en
show the mickey mouse photograph. ;en
what is the TV series in app store. ;en
find a book called kiss symphony alive IV. ;en
show me the picture written in the stars. ;en
show me the game music bank. ;en
find a soundtrack for meditations. ;en
show me the photograph of minutes to midnight. ;en
where can i find the soundtrack for steamboat bill. ;en
show creative game elements of life remix. ;en
find the picture chorus line. ;en
find me the lace and whiskey soundtrack. ;en
find live in tokyo for me. ;en
i'd like to see the show onion sports down. ;en
please get me the very best of chicago only the beginning. ;en
please get me the welcome to the rileys game. ;en
show me the everybody wants you picture. ;en
find the painting retro active. ;en
show video game name find the color. ;en
show me the when your heart stops beating photograph. ;en
where is the creative work seven pillars of wisdom. ;en
i need to episodes for the TV series fast food nation. ;en
show me the work the catholic weekly. ;en
find city of light. ;en
play pirates of the caribbean online. ;en
find a photograph called call on me. ;en
please give me the crime and punishment in suburbia trailer. ;en
search for the song called journal of the american statistical association. ;en
find the envoy of lucifer show. ;en
find the return to grace saga. ;en
find a movie called no more sad face. ;en
find a television show called structured fax file. ;en
where can i watch the television show you make me hate music. ;en
can i see the album SWAT force. ;en
please search for all the lovers trailer. ;en
where to get saga of a brush with the law. ;en
find beavis and butthead. ;en
i'm looking for a soundtrack titled bowie at the beep. ;en
i want the photograph of walt before mickey. ;en
find a man needs a maid. ;en
find a video game called a stroll in the pork. ;en
find a movie called dorothy and the witches of oz. ;en
look for the trailer to hickory daily record. ;en
where can i buy a copy of the picture called turn against this land. ;en
can you find the television show manifesto of nevermore. ;en
what is the cheapest price i can pay for the DVD called the darkest cloud. ;en
where can i find the painting of without condition. ;en
search for the un provincial in new york TV show. ;en
show the bean and the boys painting. ;en
find the painting is CAC investigators twenty fourteen. ;en
what is the TV show comfort. ;en
where can i watch the trailer of the national treasures the complete singles. ;en
what is the song the beast from twenty. ;en
find the book time and again. ;en
what is the television show phil ochs there but for fortune playing. ;en
how do i get the game still on it. ;en
find a painting called. ;en
where to get the movie fear of a black hat. ;en
find the game blog bridge. ;en
find to each his own cinema an album. ;en
show me fire. ;en
can you get the TV show enter the matrix. ;en
show creativity of mind chaos. ;en
play if you go. ;en
go to your heart belongs to me. ;en
play disney sing it high school musical three senior year. ;en
read the novel friend the great legacy. ;en
can you find fire escape in the sky by god like genius of scott walker. ;en
find the news at seven thirty photograph. ;en
show me a novel by marie. ;en
play blind company. ;en
show me the book playlist the very best of dolly parton. ;en
show movie schedule of the big mouth. ;en
please find me glass cloud single. ;en
find the video game they'll. ;en
show TV show schedule of offroad legends. ;en
where to buy book charlie countryman deve demorar. ;en
find a photograph called free the universe. ;en
can you find a picture of the rambler. ;en
i'm looking for the movie called the beast that shouted love at the heart of the world. ;en
play a trailer for sencha touch. ;en
find tortured man. ;en
look for the creative work meltdown days of destruction. ;en
play me the trailer for gainesville daily register. ;en
show me the landing at low tide painting. ;en
search for the trailer this evening mag buy. ;en
find the real dirt on farmer john a saga. ;en
show creativity of the picture the little death. ;en
find a book called outpost firewall pro. ;en
find the endangered species song. ;en
where can i find the movie the national law review. ;en
find fragile frontiers the secret history of mumbai terror attacks. ;en
search for high chicago. ;en
please search the abby saga. ;en
find a photograph called greatest hits volume one. ;en
i'm looking for right on track. ;en
show me it might as well rain until september. ;en
play the seamus heaney collected poems song. ;en
can you find the show the dumping ground survival files. ;en
where can i find the painting for a christmas story una storia di natale. ;en
show me the book f-1 grand prix part two. ;en
find a video game called turning me on. ;en
find the game saturday review. ;en
find the video game the sims three generations. ;en
show creativity of sacred fire live in south america. ;en
show me that i cannot. ;en
find a soundtrack called the woman warrior. ;en
find me haunted castle. ;en
where is picture everybody wants you. ;en
find soundtrack titled the house of the yellow carpet. ;en
find the TV series the parent trap IV hawaiian honeymoon. ;en
show me the movie operator for the theatre organ. ;en
show the ancient art of war picture. ;en
can you get me the television show called start it up. ;en
find me the novel titled fertile ground. ;en
find a trailer called sheriff of tombstone. ;en
where can i view the picture reaching horizons. ;en
show creativity of sing to the dawn. ;en
i'd like to see the trailer tony parker. ;en
find the saint in new york a show. ;en
find a trailer called no reservations. ;en
fine laser light. ;en
find the album just for laughs. ;en
show creativity of the oxford companion to beer TV show. ;en
look for a terrible vengeance. ;en
show painting of waiting for snow in havana. ;en
find the pop has freed us saga. ;en
look for the creative work the testament of gideon mack. ;en
show me born in america. ;en
find a soundtrack called the dragon. ;en
has the TV series puppet master axis of evil been cancelled. ;en
can you please get me come away with me show. ;en
show me the photograph with the title the denial. ;en
find journeyman. ;en
find a show called in fondo al buio. ;en
find a book called the magic christmas tree. ;en
can you get me the all night long three the final chapter novel. ;en
i need chapter one of the show get it for me please. ;en
find the song who are uganda monday. ;en
find a video game called family dog. ;en
show the sad songs for dirty lovers album. ;en
find the TV series truly fine citizen. ;en
