i want to hear some the roches. 	PlayMusic
rate the current essay four stars. 	RateBook
rate the current chronicle five stars. 	RateBook
play knocked on below playlist. 	PlayMusic
play ep from the motor from the nineties. 	PlayMusic
rate girls forever brave and true zero points. 	RateBook
add jonathan jones to my indie electronics playlist. 	AddToPlaylist
play top-twenty fourties movement music by mohammad reza coffee. 	PlayMusic
find the boys in the band. 	SearchCreativeWork
at four a. m. book a bar in the spa in shamrock for eight. 	BookRestaurant
book me a table for me and my nephew near my location at an indoor pub. 	BookRestaurant
play some nineties music on zvooq you. 	PlayMusic
show me half a life. 	SearchCreativeWork
rate the princess mouse a tale of finland one of six. 	RateBook
find films at magic johnson theatres. 	SearchScreeningEvent
is there any hail in monterey bay national marine sanctuary. 	GetWeather
rate CIA world fact book five out of six stars. 	RateBook
what will the weather by close by the current position at phone. 	GetWeather
find me the movie schedules at fox theatres. 	SearchScreeningEvent
is the weather going to be colder in GU in eleven years. 	GetWeather
where can i watch the trailer for home economics. 	SearchCreativeWork
add artist brenda k starr to frescura indie. 	AddToPlaylist
the voyage of the dawn trailer deserves five points. 	RateBook
look for the novel behind closed doors. 	SearchCreativeWork
will it be warmer in minnesota okay i'm good friday. 	GetWeather
this current book deserves one points. 	RateBook
i want more francis healy in the rockin' vibes playlist. 	AddToPlaylist
show me the schedule of outlaw of gor at nearest movie house at five a. mr. 	SearchScreeningEvent
please help me search the TV series a mouse divided. 	SearchCreativeWork
add another song to the cita romántica playlist. 	AddToPlaylist
i want to hear some psychedelic rock. 	PlayMusic
will it be foggy here. 	GetWeather
play some eighties movement music. 	PlayMusic
i want to watch the original recordings. 	SearchCreativeWork
fine finally famous. 	SearchCreativeWork
show movie times now. 	SearchScreeningEvent
add the fire and the wind to my digster future hits playlist. 	AddToPlaylist
i need a reservation for a restaurant that serves cupcakes in oh. 	BookRestaurant
play the newest music by gladys knight. 	PlayMusic
find journal of the society for american music. 	SearchCreativeWork
read the book the devil in velvet four out of six points. 	RateBook
using stars the current object gets four for the textbook out of six. 	RateBook
i need a reservation for the berghoff in jamaica in eighteen seconds. 	BookRestaurant
find a book a bond is HQ. 	SearchCreativeWork
play some music by mi lu. 	PlayMusic
show creativity of accident analysis and prevention. 	SearchCreativeWork
read the philosophical thought of hundred and three of six stars. 	RateBook
i need to book a table at a bar in micronesia for tia madeline and estela. 	BookRestaurant
where do i play the video game the wild geese. 	SearchCreativeWork
find resurrection of evil. 	SearchCreativeWork
this horrible essay gets zero out of six stars. 	RateBook
show me url. 	SearchCreativeWork
book a highly rated bar in burkina for georgia and i. 	BookRestaurant
when is twentynine palms playing at plitt theatres. 	SearchScreeningEvent
play a new soundtrack by benjamin on groove shark. 	PlayMusic
need book a restaurant for this autumn in illinois. 	BookRestaurant
address to send the roundhouse to my funk playlist. 	AddToPlaylist
let me know what animated movies are playing around here. 	SearchScreeningEvent
rate the current chronicle series four out of six points. 	RateBook
play me a nineteen fifty seven ep. 	PlayMusic
what's the forecast for little silver. 	GetWeather
read the book a girl a man and a river a five. 	RateBook
find the american journal of sports medicine picture. 	SearchCreativeWork
what animated movies are playing nearby right now. 	SearchScreeningEvent
find stays in mexico. 	SearchCreativeWork
put this track from the edge on my funk soul disco playlist. 	AddToPlaylist
play some psychedelic music. 	PlayMusic
add the artist to my indietronic playlist. 	AddToPlaylist
please look up two more years soundtrack. 	SearchCreativeWork
tell me the weather forecast for france. 	GetWeather
book me a reservation at a highly rated tavern in partners. 	BookRestaurant
 	GetWeather
find regal entertainment group animated movies. 	SearchScreeningEvent
play the video game the sparrow. 	SearchCreativeWork
i'd like a table for six in nine weeks at a restaurant in tokelau. 	BookRestaurant
find the book the crowd roars. 	SearchCreativeWork
what is the weather looking like in prosser on feb eighteenth. 	GetWeather
add robyn hitchcock to my romantic evening playlist. 	AddToPlaylist
find the schedule for the nightmare six hours from now at the nearest cinema. 	SearchScreeningEvent
find the best man holiday saga. 	SearchCreativeWork
book a spot for nine at a top-rated brasserie that has swiss within the same area of new york. 	BookRestaurant
please find the novel good doctor. 	SearchCreativeWork
play some music from victor could no longer. 	PlayMusic
add this song to my playlist named britpop etc. 	AddToPlaylist
i want to see the happy thieves at marcus corporation can you show me movie times. 	SearchScreeningEvent
show creativity cum on feel the noise the video game. 	SearchCreativeWork
add song to my underground hits. 	AddToPlaylist
will it be stormy in MA. 	GetWeather
give hornblower in the west indies zero six points. 	RateBook
please look for catch a falling star. 	SearchCreativeWork
tell me the weather forecast for molino washington. 	GetWeather
play nineties. 	PlayMusic
put take up thy stethoscope and walk onto my verano playlist. 	AddToPlaylist
is the expected weather temperate here in one month. 	GetWeather
i need to book a table at a place around here in PA for a party of two. 	BookRestaurant
play some music from nineteen sixty two from idaho. 	PlayMusic
add paul franklin to my the bachelor party. 	AddToPlaylist
my rating for dylan finish the damned is four out of six. 	RateBook
play my playlist TGIF on itunes. 	PlayMusic
what is the forecast for the eleventh of september twenty thirty five. 	GetWeather
one points for victory for us is to see you suffer. 	RateBook
forecast freaking finna. 	GetWeather
look for the nightmare on providence street saga. 	SearchCreativeWork
play the soft parade. 	PlayMusic
what animated movies are in the neighborhood. 	SearchScreeningEvent
what is the overcast forecast for torrey pines state beach. 	GetWeather
find the movie schedule for great escape theatres. 	SearchScreeningEvent
find reproductions songs of the human league. 	SearchCreativeWork
show schedule first sensation. 	SearchCreativeWork
book a table for eight at a pub in north carolina. 	BookRestaurant
put horace silver and the jazz messengers on my running to rock one hundred seventy to one hundred ninety BP and playlist. 	AddToPlaylist
can you get me seating for a party of four. 	BookRestaurant
is it freezing close to DC. 	GetWeather
what's the weather like in gross back. 	GetWeather
where is the closest movie theatre playing yo robot. 	SearchScreeningEvent
can you help me find a picture called olympia nineteen seventy four. 	SearchCreativeWork
what is the ten pm forecast for sweet springs wyoming. 	GetWeather
what time are films showing in the neighborhood. 	SearchScreeningEvent
add another song to the country playlist. 	AddToPlaylist
add garry valencia know the power gaming playlist. 	AddToPlaylist
will it be sunny in spain on march twenty six twenty twenty three. 	GetWeather
book midday at a faraway cuban place for five at a top-rated bakery in green ola. 	BookRestaurant
i need a restaurant that can accommodate a party of ten in avant. 	BookRestaurant
where can i find a photograph of the lieutenant of interest more. 	SearchCreativeWork
find projections an album. 	SearchCreativeWork
play deezer form two thousand ten tune by dave girl. 	PlayMusic
play the instrumental study on vimeo. 	PlayMusic
will it be colder this autumn in wren saint martin. 	GetWeather
what is the weather forecast nearby SC. 	GetWeather
tell me the closest movie house playing black rage. 	SearchScreeningEvent
is it forecast to be warm in doi international park. 	GetWeather
download the red eagle TV show. 	SearchCreativeWork
find a song called magic in the water. 	SearchCreativeWork
tell me the weather forecast for september twenty first two thousand thirty in palau. 	GetWeather
show thousand miles movie. 	SearchCreativeWork
show me the movie times at star theatres. 	SearchScreeningEvent
read the damn stairs four out of six stars. 	RateBook
i want to read the novel love is in control. 	SearchCreativeWork
i'd like to see the river of stars TV series. 	SearchCreativeWork
book a CO table at windows on the world. 	BookRestaurant
book a reservation for a restaurant serving burger in malaysia. 	BookRestaurant
play on my own. 	PlayMusic
play music by raheem dev on. 	PlayMusic
play a top track by janne mann she said mama. 	PlayMusic
what is the weather forecast for midnight in DC. 	GetWeather
book a restaurant for four on october nine in maine. 	BookRestaurant
what are the weather conditions in noel. 	GetWeather
is it going to be chilly at nine am in doolittle. 	GetWeather
book a restaurant for a party of seven in paraguay on saturday. 	BookRestaurant
i need a reservation for the french laundry in oh for six. 	BookRestaurant
read this book four out of six points. 	RateBook
play the most popular johnny clarke on deezer. 	PlayMusic
find me the photograph the late music. 	SearchCreativeWork
play disco tango to power walk. 	AddToPlaylist
will there be hail around khao phantom belgian national park. 	GetWeather
play my still got the blues playlist. 	PlayMusic
play pop music with groove shark. 	PlayMusic
show the philosophy and phenomena logical research saga. 	SearchCreativeWork
will it be hot two seconds from now in neighboring west clear creek wilderness. 	GetWeather
find a movie house for kickboxer five redemption. 	SearchScreeningEvent
tell me the forecast for indiana in nineteen hours. 	GetWeather
add candlelight to my house afterwork playlist. 	AddToPlaylist
is it chillier in hong kong than it is here. 	GetWeather
show me the painting live very live in concert. 	SearchCreativeWork
add matt to women of r b playlist. 	AddToPlaylist
please get me the island show. 	SearchCreativeWork
play thelma my latest concerto. 	PlayMusic
book a table for jasmine jeannie and leta. 	BookRestaurant
i want to hear sebastian songs from the thirties on you tube. 	PlayMusic
add grey cloudy lies to the hip hop playlist. 	AddToPlaylist
rate this album two points. 	RateBook
what is the weather forecast for winger. 	GetWeather
i want to hear major harris's songs from the fifties. 	PlayMusic
stacy watson and adriana want to go to the best osteria in hello minnesota this afternoon. 	BookRestaurant
show me a copy of the picture double deal. 	SearchCreativeWork
what is the eleven pm forecast for here and far. 	GetWeather
i give a rating of three to the ultimate resource. 	RateBook
book a restaurant in seven in fort mckinley. 	BookRestaurant
what is the forecast for one PM in minnesota. 	GetWeather
rate the why is sex fun saga two of six. 	RateBook
book a restaurant in nebraska on january twenty fifth twenty thirty four for me and my mommy. 	BookRestaurant
is it humid in to reunion. 	GetWeather
give two out of six points to current essay. 	RateBook
what animated movies are playing at the closest movie house. 	SearchScreeningEvent
play me a song by dj paul is stuck in nineteen eighty eight on zvooq you. 	PlayMusic
book a spot for one at a south american restaurant. 	BookRestaurant
find me the when harry tries to marry photograph. 	SearchCreativeWork
rate in stars as a six for lord of the shadows which gets a four. 	RateBook
play robert started from nineteen eighty eight. 	PlayMusic
add a tom thacker tune to my rock classics. 	AddToPlaylist
book a restaurant in el salvador for ten people. 	BookRestaurant
locate a cafeteria for two that serves deviled crab. 	BookRestaurant
where animated movies does north american cinemas feature. 	SearchScreeningEvent
rate this saga zero out of six. 	RateBook
what are the movie schedules. 	SearchScreeningEvent
add split the difference to my women's lit playlist. 	AddToPlaylist
give this current novel a three. 	RateBook
what is the forecast for bonner starting oct twenty fourth twenty twenty five for argentina. 	GetWeather
give four star for this album. 	RateBook
find a book called the CIA world fact book. 	SearchCreativeWork
play me a patrick kelly balut. 	PlayMusic
can you put consequences on my SOS forty eight two thousand sixteen playlist. 	AddToPlaylist
can you put a serious romania or song onto the lo-fi love soundtrack. 	AddToPlaylist
show force of nature. 	SearchCreativeWork
play the most popular track from valery alexandria vet schiphol love. 	PlayMusic
play a song from nineteen seventy three. 	PlayMusic
what is the forecast for cloudy weather here. 	GetWeather
is it supposed to get colder here on phone. 	GetWeather
book an outdoor restaurant. 	BookRestaurant
play all the way my savior leads me on spotify. 	PlayMusic
find the work i looked up. 	SearchCreativeWork
include can ask why my trap land playlist. 	AddToPlaylist
p l paid the top ten track from asia lol no on spotify. 	PlayMusic
i'd like to get a restaurant booked on march fourteen but i am d. 	BookRestaurant
dim the lights in one hour from now reserve a table for four. 	BookRestaurant
give this chronicle a four out of six. 	RateBook
play a song from the seventies by pepe aguilar. 	PlayMusic
show creative game fear thy neighbor. 	SearchCreativeWork
add a randy travis song to deep dark indie folk. 	AddToPlaylist
play me some music by prince alla from the twenties. 	PlayMusic
will it be windy at seven am in dong national protected area. 	GetWeather
reserve a table for teresa and miranda fast food joint which serves fish and chips. 	BookRestaurant
rate the current book one of six points. 	RateBook
play a ballad by owen palate from the seventies on slacker. 	PlayMusic
add los hombres calientes volume three new congo square to my descanso and figure out playlist. 	AddToPlaylist
add tune to my is it new wave. 	AddToPlaylist
is it forecast to be cold in wisconsin. 	GetWeather
play a chant by marina very lucky no. 	PlayMusic
i want to book an osteria for nine in gabon that serves donuts. 	BookRestaurant
show movie times for AMC theatres. 	SearchScreeningEvent
play any song from the eighties. 	PlayMusic
i want to add an album to my endorphin rush playlist. 	AddToPlaylist
where is the cycle playing. 	SearchScreeningEvent
add a track to my dinner playlist. 	AddToPlaylist
play the best chant of nineteen seventy five. 	PlayMusic
add saxophone supremacy to feel his calm before the storm playlist. 	AddToPlaylist
add another artist to the spotlight on country two thousand sixteen playlist. 	AddToPlaylist
find movie schedules for loews cineplex. 	SearchScreeningEvent
i'd like to eat souvlaki fast food with a party of two. 	BookRestaurant
play the greatest james your song. 	PlayMusic
show the creativity of where what when. 	SearchCreativeWork
what time is southern theatres showing ukraine is not a brothel. 	SearchScreeningEvent
please put another tune into the laundry playlist. 	AddToPlaylist
rate this chronicle a three. 	RateBook
i want to add lady mais to my playlist lo que suena new york. 	AddToPlaylist
can the artist big mama thornton be put onto my trabajo relax playlist. 	AddToPlaylist
will it be colder here one minute from now. 	GetWeather
please book a restaurant room which serves on friday lol. 	BookRestaurant
show me the schedule of films in the neighborhood. 	SearchScreeningEvent
play my éxitos españa playlist. 	PlayMusic
what time can i see mojave phone booth. 	SearchScreeningEvent
will it rain today in circles. 	GetWeather
i need to find the creative work prince hours. 	SearchCreativeWork
add the artist to the latin jazz playlist. 	AddToPlaylist
when is our story showing next at north american cinemas. 	SearchScreeningEvent
add this track to my dinnertime acoustics playist. 	AddToPlaylist
i give a rating of four to this textbook. 	RateBook
add songs in nineties hip hop of artist. 	AddToPlaylist
play some random music. 	PlayMusic
find endless horizons. 	SearchScreeningEvent
show me the nearest movie house showing he won a ranch. 	SearchScreeningEvent
play christina milian latest music. 	PlayMusic
i would rate the spoiler zero stars. 	RateBook
what times will animated movies be showing nearby. 	SearchScreeningEvent
find a soundtrack for lords of the rising sun. 	SearchCreativeWork
add marianne faithfull to june's hillary clinton's women's history month playlist. 	AddToPlaylist
make a table reservation at the top-rated brasserie in cotton center. 	BookRestaurant
will there be a blizzard next friday close in TN. 	GetWeather
add r u still in two it to the under the surface playlist. 	AddToPlaylist
will it be foggy in one hour and one minute from now in OK. 	GetWeather
add my old kentucky home to fresh finds fire emoji. 	AddToPlaylist
will it be colder in winnebago. 	GetWeather
i want to hear a pickled cucumber brasserie in twelve months. 	BookRestaurant
book sot for one at restaurant with wifi. 	BookRestaurant
another girl another planet gets only one of a possiable six rating. 	RateBook
add a tune to the calm vibes playlist. 	AddToPlaylist
will there be snowfall faraway from robinson forest. 	GetWeather
what's the weather in swift river reservation. 	GetWeather
read the book the world is full of divorced women two out of six stars. 	RateBook
what time is the dungeon master playing at AMC theaters. 	SearchScreeningEvent
movie schedules at AMC theaters. 	SearchScreeningEvent
where the housemaid playing and when. 	SearchScreeningEvent
please look up the lamentable journey of omaha bigelow into the impenetrable loisaida jungle television. 	SearchCreativeWork
where can i see the movie across the line exodus of charlie wright. 	SearchCreativeWork
book a restaurant for me valarie and caroline in fifty six weeks in soldier pond. 	BookRestaurant
find the schedule for wenn lucy springt now at a movie theatre. 	SearchScreeningEvent
add the track to the conexiones playlist. 	AddToPlaylist
add cliffs of doing in playlist lo que suena los angeles. 	AddToPlaylist
rate this essay two out of six stars. 	RateBook
what films are playing at pacific theatres. 	SearchScreeningEvent
look for the editor and publisher TV series. 	SearchCreativeWork
is cloudy in lincoln. 	GetWeather
find movie schedules at IMAX corporation. 	SearchScreeningEvent
will it be chillier in sony. 	GetWeather
are there any movies playing around here. 	SearchScreeningEvent
find a novel called a perfect day. 	SearchCreativeWork
find playstation a song. 	SearchCreativeWork
or is it hot in wind ridge guam. 	GetWeather
find the magical world of roger whittaker. 	SearchCreativeWork
play socialism is good by tari on spotify. 	PlayMusic
read this book a zero. 	RateBook
find loved ones for me. 	SearchCreativeWork
add the entity por una cabeza to my playlist forever alone. 	AddToPlaylist
find films in twelve hours at the nearest movie theatre. 	SearchScreeningEvent
play lily rosemary and the jack of hearts by chris goss. 	PlayMusic
find movie schedule for animated movies in the area. 	SearchScreeningEvent
show texas review of entertainment and sports law creative song. 	SearchCreativeWork
can you get me a table at a chicken and waffles joint in new mexico. 	BookRestaurant
rate this chronicle three of six stars. 	RateBook
add a kiley dean tune to my jazz for loving couples playlist. 	AddToPlaylist
play a two thousand fourteen theme from greg hello. 	PlayMusic
play some blues from two thousand three on you tube. 	PlayMusic
list movie schedules. 	SearchScreeningEvent
play the music track of nineteen ninety eight. 	PlayMusic
find me recorder and. 	SearchCreativeWork
find cluster computing a game. 	SearchCreativeWork
read this book titled the clue in the old album one out of six stars. 	RateBook
rate this essay four of six stars. 	RateBook
can i get the movie times for films in the neighborhood. 	SearchScreeningEvent
rate my current textbook four out of six. 	RateBook
this current essay deserves zero stars. 	RateBook
rate six months in mexico one out of six. 	RateBook
what time is the riders of the whistling skull playing at magic johnson theatres. 	SearchScreeningEvent
book in vermont at the maisonette. 	BookRestaurant
play jazz music by zvooq you. 	PlayMusic
in hawaii will it be warmer at three am. 	GetWeather
what is the weather for may. 	GetWeather
add entity eternally to playlist lazy chill afternoon. 	AddToPlaylist
what movies are playing nearby. 	SearchScreeningEvent
please put linzi stoppard into my south by southwest fresh playlist. 	AddToPlaylist
will it be chilly in liberty city bhutan. 	GetWeather
play the ashley tisdale discography TV show. 	SearchCreativeWork
add the tune to my jazz vibes playlist. 	AddToPlaylist
play me a popular ronnie wood soundtrack. 	PlayMusic
add the artist cho kyu hyun to funky jams. 	AddToPlaylist
i'd like to book the best restaurant in paris. 	BookRestaurant
play two gather buy jade. 	PlayMusic
what is the trailer for feel the passion. 	SearchCreativeWork
play the most popular cody songs on pandora. 	PlayMusic
add hold tight to my throwback party. 	AddToPlaylist
will it be warm at the elephant park on san jacinto day. 	GetWeather
what theater is showing from paris with love and when. 	SearchScreeningEvent
i'd like to see the trailer for history and theory. 	SearchCreativeWork
where can i find the movie schedules. 	SearchScreeningEvent
find join the dots besides and ready. 	SearchCreativeWork
i am giving this current novel one out of six stars. 	RateBook
will rainfall continue here tomorrow. 	GetWeather
find movie schedules for AMC theatres. 	SearchScreeningEvent
play a new song form the eighties. 	PlayMusic
what's the weather like in yo and another lens antilles. 	GetWeather
give me the movie times. 	SearchScreeningEvent
find the movie times for nearby films. 	SearchScreeningEvent
what will the weather be in four weeks around singing game has strict nature reserve. 	GetWeather
what will the weather be one hour from now in this. 	GetWeather
play dick marx. 	PlayMusic
 	GetWeather
play the track r u professional by roberto carlos braga. 	PlayMusic
this track should go on my evening chill playlist. 	AddToPlaylist
i'm looking for the last track by fei yu ching from the fourties. 	PlayMusic
i'd like to book at a place in RI or looking for an oyster bar that is indoor and can accommodate a party of eight that is also within walking distance. 	BookRestaurant
show me the best of volume one TV series. 	SearchCreativeWork
where will the blonde from peking be playing. 	SearchScreeningEvent
show me a picture of nokia football crazy. 	SearchCreativeWork
can i rate the current textbook three to six stars. 	RateBook
can you play some music on you tube. 	PlayMusic
book a table for my granddaughter and i at the restaurant. 	BookRestaurant
rebuilding a red sword zero stars. 	RateBook
add to my verano list a song by andy lee. 	AddToPlaylist
book a bakery for lebanese on january eleventh twenty thirty two. 	BookRestaurant
play the sea cabinet. 	SearchCreativeWork
book a restaurant distant from downtown. 	BookRestaurant
what is the movie schedule for movies in the neighborhood. 	SearchScreeningEvent
find the dead matter at speakeasy theaters. 	SearchScreeningEvent
i want a table for four at any kind of goiano bar. 	BookRestaurant
forecast for wisconsin at ten p. mercier. 	GetWeather
add this is status quo to teddy riley. 	AddToPlaylist
what will the weather be in croatia. 	GetWeather
play some nastya kamenskih on zvooq you. 	PlayMusic
i need reservations for a party of three on all souls day in temperature north dakota. 	BookRestaurant
use service vimeo the genre slow rock. 	PlayMusic
show the information on history picture. 	SearchCreativeWork
give this album four out of six stars. 	RateBook
search for the picture boomtown. 	SearchCreativeWork
what movies are playing at warren theatres. 	SearchScreeningEvent
i need fast food for nine within the same area as bowers that has a pool nearby on april seventeenth twenty thirty three. 	BookRestaurant
in the neighbourhood find movies. 	SearchScreeningEvent
add three miles to the café con leche playlist. 	AddToPlaylist
add josephine isabella guest list gamesradar playlist. 	AddToPlaylist
what is the forecast for this fall in my city. 	GetWeather
can you add something by the artist paul card now loaded my chill tracks playlist. 	AddToPlaylist
i need to get a restaurant reserved in SD. 	BookRestaurant
i need a reservation for five at a top-rated english restaurant in elma. 	BookRestaurant
what's the forecast for jefferson national expansion memorial around eight am. 	GetWeather
give two out of six points to the following textbook. 	RateBook
find a TV show called directions home. 	SearchCreativeWork
i need to book a table at a tavern that serve gnocchi for nine in a one yo. 	BookRestaurant
can i get the newest movie schedule in the area for animated movies. 	SearchScreeningEvent
play the TV series effortless agitation of bright red blood. 	SearchCreativeWork
i'd like to book a restaurant that serves pode house in rock springs. 	BookRestaurant
play twenty five to life by paul riley on deezer. 	PlayMusic
