add you put a move on my heart to the martin garrix show. 	AddToPlaylist
for my playlist latin pop rising add you okay. 	AddToPlaylist
play me a nineteen fifty eight adam yauch concerto on groove shark. 	PlayMusic
i want to give a mortal flower a two. 	RateBook
give the current novel a rating of five out of six. 	RateBook
will it get windy in ocean breeze park. 	GetWeather
read the guardian of coffee no one points. 	RateBook
can you put a song by jessica on my playlist entitled a sudden rainstorm. 	AddToPlaylist
i'd like to see the movie schedule for movies in the area. 	SearchScreeningEvent
play prints in the stone by helen baylor. 	PlayMusic
show me the movie times. 	SearchScreeningEvent
find the closest films at a movie house. 	SearchScreeningEvent
add artist to my working day. 	AddToPlaylist
what is bloody bloody bible camp playing in the cinema. 	SearchScreeningEvent
add milk e brooks to happy birthday playlist. 	AddToPlaylist
find santikos theatres showing animated movies. 	SearchScreeningEvent
when does of stars and men play. 	SearchScreeningEvent
where is the closest cinema playing soaps in south pads. 	SearchScreeningEvent
how is weather here. 	GetWeather
i'd like to see the movie schedule for movies in the area. 	SearchScreeningEvent
susanne and carey phillips want to go to a brasserie not far from price dale that serves southern brazilian. 	BookRestaurant
book something for my girlfriend and i at a food truck that has pizzas in brookwood on october fifteenth twenty twenty. 	BookRestaurant
book a table for seven in wapo. 	BookRestaurant
can you play a top five song by manos haji jacket. 	PlayMusic
i need seating for ten people at a bar that serves czech cuisine. 	BookRestaurant
add song to zen focus playlist. 	AddToPlaylist
what is the weather forecast one minute from now in macao. 	GetWeather
book at table at a brasserie which serves needs food. 	BookRestaurant
how temperate will it be here this week. 	GetWeather
tell me if it'll be freezing three hundred thirty three days from now in kaplan or mills florida. 	GetWeather
i need seats for six at a pub on january fifteenth twenty thirty. 	BookRestaurant
i'd like to watch the trailer for dungeons and dragons chronicles of my stara. 	SearchCreativeWork
add this artist to blues roots list. 	AddToPlaylist
rate the current album four out of six stars. 	RateBook
i'd like a table for eight at a close-by place in carpenter full. 	BookRestaurant
what are the showtimes for beware the blob at plitt theatres. 	SearchScreeningEvent
add this song by deron miller to my party on fridays playlist. 	AddToPlaylist
weather for afghanistan in one minute. 	GetWeather
what's the weather forecast in the same area of me on april twenty. 	GetWeather
where is the nearest movie theatre that is playing the king maker. 	SearchScreeningEvent
find quiet night in. 	SearchScreeningEvent
can i get the showings for films at the nearest cinema in one minute. 	SearchScreeningEvent
add this album the the playlist canciones que lo van a pagar. 	AddToPlaylist
i want the video game southwest riders. 	SearchCreativeWork
please search the word revolution. 	SearchCreativeWork
show me the TV series prescription for death. 	SearchCreativeWork
i'd like for you to put this artist to my evening commute playlist. 	AddToPlaylist
find love will tear us apart a photograph. 	SearchCreativeWork
show creative video game in my own backyard. 	SearchCreativeWork
add manuela that to my indiespensables playlist. 	AddToPlaylist
i need a table at somewhere within walking distance of NV on november the twenty fourth two thousand twenty seven. 	BookRestaurant
forecast for elephant national park. 	GetWeather
please play something that's freak folk on google music. 	PlayMusic
rate this textbook a five. 	RateBook
play red by shy by blind lemon jefferson. 	PlayMusic
book a restaurant in town not far from here for me and my mother in law. 	BookRestaurant
book a table for one one second from now in adelaide. 	BookRestaurant
rate the summer job five stars. 	RateBook
add this tune to my it's a southern thing playlist. 	AddToPlaylist
will it be overcast in one minute within walking distance of oh. 	GetWeather
can you give me a local and current movie schedule. 	SearchScreeningEvent
play some eighties music. 	PlayMusic
open pandora and play the top five melody by hanna. 	PlayMusic
rate this essay five stars. 	RateBook
find a soundtrack called fast as you. 	SearchCreativeWork
add the album to my pachangueo total. 	AddToPlaylist
i'd like a restaurant on the first of june twenty twenty seven for five people in iowa city. 	BookRestaurant
what is the johnson creek forecast for chilly weather. 	GetWeather
add this artist to my pop punk's not dead. 	AddToPlaylist
give two points to a tale of arabia. 	RateBook
can you play some fifties music by ryan baker. 	PlayMusic
book a bar which serves chicken french at robinson. 	BookRestaurant
will there be a depression in wheatley. 	GetWeather
show movie times of movies in the neighborhood. 	SearchScreeningEvent
book me a table at the fat duck in ireland. 	BookRestaurant
add an album to my playlist bachata lovers. 	AddToPlaylist
rip in the darkness one points. 	RateBook
what's the weather forecast for rhode island. 	GetWeather
i want to hear gothic rock on lastfm. 	PlayMusic
make me a reservation for july the tenth at the nosh bar for a party of two. 	BookRestaurant
read the book line to tomorrow three stars. 	RateBook
read the black body theory and the quantum discontinuity novel. 	SearchCreativeWork
find a highly rated brasserie restaurant in liberia and book a table for five. 	BookRestaurant
what is the movie times for general cinema corporation. 	SearchScreeningEvent
show me the weather forecast for the city of spencer. 	GetWeather
weather for cougar canyon wilderness. 	GetWeather
find the novel playlist the very best of brad paisley. 	SearchCreativeWork
show me the show live at the fillmore east. 	SearchCreativeWork
what is the weather like in phnom st goes wildlife sanctuary. 	GetWeather
find a song called this champagne mojito is the last thing i own. 	SearchCreativeWork
i need a table at surf taco in east union town. 	BookRestaurant
this is a six rating for the album down to one. 	RateBook
can you find me a trailer for phineas redux. 	SearchCreativeWork
play me a jill scott sound track on deezer. 	PlayMusic
find a book called follow me. 	SearchCreativeWork
i want to give among the enemy four out of six points. 	RateBook
play keep their heads ringing. 	SearchCreativeWork
can you get me a table reserved for three hundred thirty three days from now for eight people at a highly rated fast food place that serves north indian food not distant from moores mill. 	BookRestaurant
this is kevin johansen playlist needs the lamb lies down on broadway in it. 	AddToPlaylist
play something by brian chase. 	PlayMusic
weather for april the thirteenth in djibouti. 	GetWeather
me and my mummy want to go to an indian bar next winter within the same area of court you road. 	BookRestaurant
will it be snowy in crouch french polynesia. 	GetWeather
what's the weather like nearby in rhode island. 	GetWeather
get the video game of the chipmunk song. 	SearchCreativeWork
will it be windy at medicine rocks state park on may twenty fourth. 	GetWeather
in the neighbourhood find movies with movie times. 	SearchScreeningEvent
show me the movie schedule for caribbean cinemas. 	SearchScreeningEvent
i rate secret water as a four. 	RateBook
mars probes gets a one rating. 	RateBook
my rating for the eiffel tower and other mythology zero out of six stars. 	RateBook
will it be foggy in the same area of parc provincial kettle lakes on february the thirteenth two thousand eighteen. 	GetWeather
look up the game called the long morrow. 	SearchCreativeWork
i gave the current chronicle three of six. 	RateBook
rate this textbook a one. 	RateBook
add i dreamt of a dragon to my futuros hits playlist. 	AddToPlaylist
find the movie curl. 	SearchCreativeWork
is ce cher imax corporation. 	SearchScreeningEvent
movie schedule at cinemark theatres. 	SearchScreeningEvent
read the book magic history theory and practice five stars. 	RateBook
what movies are showing at the nearest movie theatre in eight minutes. 	SearchScreeningEvent
add shawn camp to my soulful disco playlist. 	AddToPlaylist
is the slut playing at seven twenty seven a. m. at harkins theatres. 	SearchScreeningEvent
what are the movie schedules for movies showing in the neighborhood. 	SearchScreeningEvent
i want a table for two at a portugal restaurant. 	BookRestaurant
i want to hear some twenties music off of deezer. 	PlayMusic
will you please pull up movie schedules for me. 	SearchScreeningEvent
i give the flash series zero out of six. 	RateBook
play music from nineteen fifty. 	PlayMusic
show me the painting called the descendants. 	SearchCreativeWork
get me a table for one at a popular brasserie. 	BookRestaurant
i want to know what movies are showing at the nearest movie house. 	SearchScreeningEvent
add this artist to my fifty nine th grammy awards. 	AddToPlaylist
give me the movie listings at the closest cinema please. 	SearchScreeningEvent
add the tune to the this is aretha franklin playlist. 	AddToPlaylist
find a TV series called cocktail kings. 	SearchCreativeWork
play my hot fifty playlist. 	PlayMusic
show me the edge of love photograph. 	SearchCreativeWork
i want to hear the bar saint vincent and the grenadines at thursday for five people. 	BookRestaurant
return the nineties baby makers. 	AddToPlaylist
check the weather for eagle harbor tanzania. 	GetWeather
i want to find a restaurant that has a table for two at five am. 	BookRestaurant
find movie schedules. 	SearchScreeningEvent
rate the sail and steam navy list five stars. 	RateBook
i would rate this novel a four. 	RateBook
give this book chronicle four stars. 	RateBook
i want glam added to the end the gym strong playlist. 	AddToPlaylist
i give the previous album a four. 	RateBook
find the schedule for grand canyon trail. 	SearchScreeningEvent
i would like to book the best southeastern brazilian food court. 	BookRestaurant
read the last textbook three stars. 	RateBook
add john brown to my dinnertime acoustics. 	AddToPlaylist
find close by movies movie times. 	SearchScreeningEvent
i'd like a table for two at a brasserie in são tomé and príncipe pay. 	BookRestaurant
is it going to get chillier in kuwait. 	GetWeather
add bang to the black sabbath the dio years playlist. 	AddToPlaylist
add ninth inning to my bossa nova dinner playlist. 	AddToPlaylist
i want the nearest movie house with the debtors. 	SearchScreeningEvent
book a restaurant in everson nevada that serves blini for two people. 	BookRestaurant
add song to my el mejor pop en espanol. 	AddToPlaylist
find face the truth a TV show. 	SearchCreativeWork
play trace adkins music from the thirties. 	PlayMusic
show book of pokemon the mastermind of mirage pokémon. 	SearchCreativeWork
where can i purchase the game dancing in the dark ten years of dancing ferret. 	SearchCreativeWork
find a TV show called ride the wind. 	SearchCreativeWork
i want to find a salami restaurant in bastian in. 	BookRestaurant
play classic rock on slacker. 	PlayMusic
when will the blonde ambition be playing. 	SearchScreeningEvent
i want to give the current textbook zero out of six stars. 	RateBook
find a TV series called live hearts. 	SearchCreativeWork
add from the ashes to my rock gaming playlist. 	AddToPlaylist
i want to eat close by east brady for seven people. 	BookRestaurant
find a movie called the easy way to stop smoking. 	SearchCreativeWork
add kasey chambers to my political punks playlist. 	AddToPlaylist
i need a book called student demonstration time. 	SearchCreativeWork
give this textbook a zero out of six. 	RateBook
play the seamus. 	SearchCreativeWork
book reservations at a restaurant with vickie and caitlin on february the second twenty eighteen. 	BookRestaurant
play tribal. 	PlayMusic
play music by otis redding. 	PlayMusic
find a movie house for seven fifty two showing ganges river to heaven. 	SearchScreeningEvent
rate the current book zero of six. 	RateBook
play me a twenties song. 	PlayMusic
add to my travelling playlist. 	AddToPlaylist
book a table at the eighth step coffee house that isn't too far from vineyard haven for candace phillips debbie and sondra. 	BookRestaurant
play white noise. 	PlayMusic
where can i watch the picture i'll take care of you. 	SearchCreativeWork
play the top-twenty. 	PlayMusic
me and you start craving cordon bleu and need to book a table at a brasserie. 	BookRestaurant
find a movie theatre with intersections that is nearest. 	SearchScreeningEvent
play good classified songs on vimeo. 	PlayMusic
search for man in a garage. 	SearchCreativeWork
read me on the shadows three of six stars. 	RateBook
show second generation album. 	SearchCreativeWork
add this track to the evening commute playlist. 	AddToPlaylist
is it going to be hotter within walking distance of ohio on march twenty second twenty thirty eight. 	GetWeather
play the music from the playlist get lit. 	PlayMusic
find a game called an aerial joy ride. 	SearchCreativeWork
rate the bell curve a three. 	RateBook
will it get colder in alaska. 	GetWeather
 	RateBook
play some king tubby from the eighties. 	PlayMusic
will there be a blizzard at a four am in sky valley. 	GetWeather
can you put some money on my disco fever playlist. 	AddToPlaylist
what's the weather going to be like not far from east timor. 	GetWeather
give three out of six points to the secrets of love. 	RateBook
what time is good returns showing at douglas theatre company. 	SearchScreeningEvent
play me the soundtrack for nothing personal. 	SearchCreativeWork
play the greatest ricky bell music. 	PlayMusic
show movie schedule for animated movies in the neighborhood. 	SearchScreeningEvent
what will the weather be on april nine two thousand thirty seven in new brunswick botanical garden. 	GetWeather
i'm looking for sixteen thirty for the ram rebellion. 	SearchCreativeWork
play a track from the thirties. 	PlayMusic
play me a trailer for the northwest passage. 	SearchCreativeWork
book a delicatessen that is indoor for three. 	BookRestaurant
add this artist to my guilty pleasures playlist. 	AddToPlaylist
show me the live legend nineteen ninety nine and nineteen ninety seven apocalypse TV show. 	SearchCreativeWork
i'd like to see the new jungle. 	SearchCreativeWork
i'd like to add this tune to my spotify orchestra cello playlist. 	AddToPlaylist
rate the current album a zero. 	RateBook
book a spot for three at a bar in antarctica. 	BookRestaurant
which animated movies are playing today at KB theatres. 	SearchScreeningEvent
find the movie schedule for films in the area. 	SearchScreeningEvent
i'd like to watch bound for glory at the closest movie theatre at phone. 	SearchScreeningEvent
play something from the jonathon lee movement. 	PlayMusic
add people take pictures of each other to rhythm and blues playlist. 	AddToPlaylist
recharge pass two out of six. 	RateBook
looking for novel build engine. 	SearchCreativeWork
give one out of six points to current series. 	RateBook
what time is the queen of mulan rouge playing. 	SearchScreeningEvent
i think the dictionary of new zealand biography deserves two points. 	RateBook
i'm looking for the novel from a scream to a whisper. 	SearchCreativeWork
the current essay feels like a three. 	RateBook
find me the picture called bugs bunny nips the nips. 	SearchCreativeWork
what time is trouble every day playing. 	SearchScreeningEvent
rate the current textbook five of six. 	RateBook
i want to give this album three points. 	RateBook
put a gary clark song into the soul bpm playlist. 	AddToPlaylist
where can i find the beggar maid playing. 	SearchScreeningEvent
add an album in sweet soul chillout. 	AddToPlaylist
play the graduate faculty philosophy journal album. 	SearchCreativeWork
where can i find the creative works the very best of simply red. 	SearchCreativeWork
add pecans to chill out playlist. 	AddToPlaylist
is rainfall forecast for flying hills. 	GetWeather
i want to give this book three out of six stars. 	RateBook
play my hype playlist. 	PlayMusic
book a brasserie for connie scott and madeline in northern mariana islands in eleven hours. 	BookRestaurant
what's the weather in paris. 	GetWeather
can you add a note to my playlist entitled the piano bar. 	AddToPlaylist
add how to sos forty eight two thousand sixteen playlist. 	AddToPlaylist
look at the place at seven. 	BookRestaurant
i'd like to hear the song in a reverie. 	SearchCreativeWork
play miami two thousand seventeen by rodney whitaker. 	PlayMusic
play a top twenty symphony of two thousand ten. 	PlayMusic
find a game called a very special christmas seven. 	SearchCreativeWork
please book a restaurant for ten members near downtown at twenty thirty eight. 	BookRestaurant
rate the current essay zero stars. 	RateBook
put the bill berry track on guest list. 	AddToPlaylist
is there a blizzard coming to el verano. 	GetWeather
rate the current saga a two. 	RateBook
play me the saga the party's over. 	SearchCreativeWork
help me locate the tristan betrayal. 	SearchCreativeWork
what is love in a mist. 	SearchCreativeWork
what's the forecast for my current spot. 	GetWeather
i wanna watch supernatural the unseen powers of animals. 	SearchCreativeWork
play gothic music. 	PlayMusic
nancy elma ruiz and molly want to eat a restaurant in gibraltar. 	BookRestaurant
find movie schedules. 	SearchScreeningEvent
weather next year in canada. 	GetWeather
i'm looking for a novel called and then there was light. 	SearchCreativeWork
add some food yeah my women of rock list. 	AddToPlaylist
i would rate the animal liberation chronicle zero points and a best rating of six. 	RateBook
show me the song spiderman of the rings. 	SearchCreativeWork
play my piano ballads playlist. 	PlayMusic
get me kiss the crystal flake. 	SearchCreativeWork
put something into my summer playlist. 	AddToPlaylist
add satisfied to my rockin' vibes playlist. 	AddToPlaylist
rate this book three points. 	RateBook
what films and movie times are close by. 	SearchScreeningEvent
i'm looking for the painting god must have spent a little more time on you. 	SearchCreativeWork
move josiah leaving to the list. 	AddToPlaylist
mark the final battle score two out of six. 	RateBook
please add john deacon to the funtime activity playlist. 	AddToPlaylist
please give me the movie schedule. 	SearchScreeningEvent
is it warm in the current spot. 	GetWeather
add this tune to my seventies road trip list. 	AddToPlaylist
what is the weather forecast for maryland. 	GetWeather
what is the weather forecast for national park three seconds from now. 	GetWeather
add histoire de melody nelson to my nineties baby makers playlist. 	AddToPlaylist
show me the song the incredible hulk returns. 	SearchCreativeWork
is it going to hail in niger. 	GetWeather
play music from nineteen sixty nine on last fm. 	PlayMusic
play lenny kaye music. 	PlayMusic
read this book a zero. 	RateBook
find the closest movie theatre for films. 	SearchScreeningEvent
can you find me the movie the countess. 	SearchCreativeWork
hook me up with a song by dancing girl. 	SearchCreativeWork
show me the old email and the three cats. 	SearchCreativeWork
will the weather conditions be temperate and pleasant in togo. 	GetWeather
find the TV series the almighty johnson's. 	SearchCreativeWork
play some fast fusion on spotify. 	PlayMusic
add guy warren to my bossa nova dinner playlist. 	AddToPlaylist
give this book a rating of three. 	RateBook
show me the movie times for animated movies in the area. 	SearchScreeningEvent
book a bistro in new zealand in one hundred nineteen and a half is. 	BookRestaurant
play my women of rock playlist. 	PlayMusic
the chronicle charlie peace earns four stars from me. 	RateBook
what is the forecast for wren for freezing weather. 	GetWeather
rate the current album five points. 	RateBook
play magic sam from the thirties. 	PlayMusic
add get happy the cherries a las canciones mas lindas del mundo. 	AddToPlaylist
what's the forecast for my current place at five pm. 	GetWeather
for the current saga i rate two of six stars. 	RateBook
i want novena nocturne added to the playlist called gold edition. 	AddToPlaylist
book a spot at leopold cafe in bhutan. 	BookRestaurant
find the dead smiles to soundtrack. 	SearchCreativeWork
add tunnel of love to add those metal crash course palylist. 	AddToPlaylist
add justin roberts to this is chopin. 	AddToPlaylist
play music by sarah connor. 	PlayMusic
new mr knight should get out of six a rating of two. 	RateBook
go to the saga the quantum thief. 	SearchCreativeWork
list to the most popular poems song. 	PlayMusic
open the canciones del recuerdo playlist and play songs. 	PlayMusic
play a nineteen eighty three ballad on groove shark. 	PlayMusic
add dave keller to my all out nineties playlist. 	AddToPlaylist
add i pledge allegiance to the grind to my simfonia hipster playlist. 	AddToPlaylist
i give the following album two out of six stars. 	RateBook
what are the weather conditions going to be like in manhasset vermont on dec sixth to twenty thirty six. 	GetWeather
find the show the sword of el lector. 	SearchCreativeWork
what will the weather be like on september twenty six lake. 	GetWeather
what's the forecast for georgia. 	GetWeather
add song to siesta. 	AddToPlaylist
what cinema has the closest movies. 	SearchScreeningEvent
find family feud novel. 	SearchCreativeWork
search for video game the sky is crying. 	SearchCreativeWork
what is the weather forecast for new mexico. 	GetWeather
when can i watch alice a true story at AMC theatres. 	SearchScreeningEvent
play music by dean anderson car. 	PlayMusic
can you send me the weather forecast for malcom. 	GetWeather
will it be nice here and in the same area. 	GetWeather
give the current series two stars. 	RateBook
where can i purchase the TV series liar game the final stage. 	SearchCreativeWork
put jazzy b on lazy chill afternoon playlist. 	AddToPlaylist
how much rain are we getting in current position. 	GetWeather
i'm looking for circus world. 	SearchCreativeWork
add another tune to my verano playlist. 	AddToPlaylist
add totally stress free by bobby lord to my playlist. 	AddToPlaylist
add the song don't drink the water to my playlist. 	AddToPlaylist
play my springtime playlist. 	PlayMusic
play me the most popular arthur johnston song. 	PlayMusic
how's the weather going to be on july two in whiteside. 	GetWeather
play the album twenty first century live by chet lam on itunes. 	PlayMusic
what's the weather in oregon. 	GetWeather
give the current album a three. 	RateBook
give three stars to chronicle falling in love with tom. 	RateBook
for playlist todo latino add absolutely sweet marie. 	AddToPlaylist
play the eternal by jim on vimeo. 	PlayMusic
will it be chilly at four in druid hills american samoa. 	GetWeather
find time for the thirty nine steps. 	SearchScreeningEvent
add sam moran music to my tgif playlist. 	AddToPlaylist
play a nineteen fifty album on iheart. 	PlayMusic
what is the weather forecast for cuba at eleven am. 	GetWeather
add this song to my indie acoustic playlist. 	AddToPlaylist
show me happiness was free. 	SearchCreativeWork
book a restaurant in PR for october sixteen to twenty thirty eight. 	BookRestaurant
add crying waiting hoping to my weekly buzz playlist. 	AddToPlaylist
the bone season is worth at least three points. 	RateBook
give the current part of the series one points. 	RateBook
add buddy tate to my this is j beleive in playlist. 	AddToPlaylist
find the movie schedule. 	SearchScreeningEvent
is the little irish girl playing. 	SearchScreeningEvent
rate the current essay five stars. 	RateBook
play music on spotify sort by top. 	PlayMusic
is it rainy at the edward l. ryerson conservation area. 	GetWeather
show me the movie schedule for movies opening today close by. 	SearchScreeningEvent
give me the morning movie schedules. 	SearchScreeningEvent
read boys in the dark three of six. 	RateBook
let me hear the live from the ghetto album by beau dark. 	PlayMusic
i need the weather in hubbardston will it be chillier. 	GetWeather
what's the weather in whitewood louisiana. 	GetWeather
please look up the four hour workweek saga. 	SearchCreativeWork
what is the picture called lest we forget the best of. 	SearchCreativeWork
please play me jerry lee lewis's if you say so track. 	PlayMusic
find the TV show hot air. 	SearchCreativeWork
book for jessie dale wright and lupe at a bistro on feb twenty twenty forty. 	BookRestaurant
i give the french suicide five stars. 	RateBook
i would like to book the best food court with persian food within the same area as OK for my ex husband and i. 	BookRestaurant
book in pine bluffs for five people in the same area. 	BookRestaurant
i rate this essay a four of six. 	RateBook
find time for trouble for two in one minute at landmark theatres. 	SearchScreeningEvent
add mail to the de manhattan con amor playlist. 	AddToPlaylist
weather for the night time in new mexico. 	GetWeather
book a spot at a pub with guitar in cambodia. 	BookRestaurant
find the closest cinema with animated movies. 	SearchScreeningEvent
book a diner place or me and my best friend on holy saturday november where they serve pepperoni dishes. 	BookRestaurant
 	AddToPlaylist
add this album to my party with friends. 	AddToPlaylist
please search for the live in san juan capistrano picture. 	SearchCreativeWork
where can i book a table close to me in moon run at sixteen o'clock that will take three people. 	BookRestaurant
