expression;language
play the cabin fever two spring fever saga. ;en
show me the trailer for the blades. ;en
find the photographic journal. ;en
find a photograph called dragon ball z the best selections. ;en
find bal ganesh two a video game. ;en
please help me find the bloom remix album song. ;en
find history of north dakota a TV series. ;en
show creativity of the force behind the power. ;en
i'd like to hear the song in a reverie. ;en
where can i see the television show jimmy two shoes. ;en
find a novel called matching dreams. ;en
looking for the trailer for shaolin temple. ;en
find friendship way. ;en
get me the trick or treats soundtrack. ;en
show me tears on my pillow. ;en
where can i find the sounds to consume album. ;en
can you tell me the actors of the saga awards. ;en
i need to find the so nice soundtrack. ;en
i'm looking for the game called summer of fear. ;en
please find the TV show the dream stone. ;en
find me the book called suffer. ;en
find the painting sleeping in your hand. ;en
where can i stream a television show called safety EP. ;en
show creative song called holidays on the river yarra. ;en
show creative trailer of the sword of the lord. ;en
i'd like to see the painting empire of two worlds. ;en
play me the trailer for chasing after shadows living with the ghosts. ;en
find an album called from and shit you do. ;en
play thirty greatest hits. ;en
where do get photograph of my own best enemy. ;en
can you get me the education of little tree song. ;en
find innocent world. ;en
show me the album. ;en
i want to see everytime we touch which is a painting. ;en
find an art called cassidy. ;en
i want to listen to the soundtrack the om years. ;en
where did the painting highs in the mid sixties girl. ;en
find some of my best friends are a piano player. ;en
find me the painting fallen sanctuary. ;en
please find the TV series back to bach. ;en
can you find the novel journal of social work. ;en
find the international journal of robotics research soundtrack. ;en
look up the collection volume one novel. ;en
play another time. ;en
TV series for the thirty nine steps. ;en
search for the television show me and my guitar. ;en
search for the abel sánchez the history of a passion novel. ;en
find a painting called satisfaction is the death of desire. ;en
search for the painting hess a biography. ;en
find me the picture entitled i'll take care of you. ;en
look up the reverse of the medal. ;en
play the new noise theology e. p.. ;en
show me the album apache axis two. ;en
show me the album clarke. ;en
can you give me the star crossed saga. ;en
find sappho. ;en
show the best of minnie ten saga. ;en
please find the work titled talking to heaven. ;en
find me the rise and fall of the great lakes saga. ;en
please look up the painting modern times. ;en
i want to read the saga michael clayton. ;en
find a picture called neighbourhood. ;en
show creative picture of wonderful town. ;en
please locate sad love story novel for me. ;en
find wild solutions a saga. ;en
show creative book named pencil thin mustache. ;en
i want to play the video game the coyote kings of the space age bachelor pad. ;en
where can i buy a barometer clock. ;en
show me god bless the child photograph. ;en
can you find me the magic hour song. ;en
find me the picture the id. ;en
find a television show called tiny dancer. ;en
where can i get fight for anarchy. ;en
play the movie i want my MTV vy on censored story of the music video revolution. ;en
find book called dreams and all that stuff. ;en
can i hear the song american high. ;en
look for the learning and behavior picture. ;en
i want to watch the trailer ad nausea am. ;en
find me the TV show the first bite. ;en
i want to watch the TV show tales from space about a blob. ;en
is there a game called the neutral zone. ;en
please search for the work wholehearted. ;en
please look for orion you came and you took all my marbles. ;en
search for the song banquet for the damned. ;en
find a painting called mister scarface is back. ;en
i want to watch man thin. ;en
can you find me the naked city justice with a bullet album. ;en
find a novel called downward to the earth. ;en
where to watch show extremely live. ;en
find the picture titled battle spirits doing in top of action. ;en
find a photograph called midnight mystery. ;en
please search the songs for the deaf video game. ;en
find trailer of jazz impressions of the u. s. a. ;en
find the video game tenacious d in the pick of destiny. ;en
i need to find the work brotherly love. ;en
look for fighting to. ;en
where can i find the novel missed. ;en
find the life of riley a photograph. ;en
i wanna watch the show food force. ;en
find a TV show called the extraordinary. ;en
can you find my island home TV series. ;en
find landing on water. ;en
find the trailer for the spooky sisters. ;en
what is a romance of the halifax disaster. ;en
what is lost land of the tiger. ;en
look for the book titled iranian journal of fuzzy systems. ;en
show me the picture creatures of light and darkness. ;en
find pat garrett y billy the kid. ;en
find karol the pope. ;en
show song schedule of shoot for the moon. ;en
need to find the soundtrack called fire in the valley. ;en
show me the photograph called hola mary lou prom night two. ;en
need to find the TV series called administrative behavior. ;en
find old school junkies the album a video game. ;en
show me my princess. ;en
show me horton and the quarterback and more lost stories. ;en
look up the making of milwaukee. ;en
find the book a glorious way to die. ;en
show me rapid city muscle car. ;en
find a trailer called just say noël. ;en
find the trailer for live at hull. ;en
play the caps lock trailer. ;en
show me the movie called people and masks part two. ;en
where can i buy the soundtrack bridge of souls. ;en
show me the courts of. ;en
find a TV series called the golden hits of sandy chào. ;en
look for the show named chestnut mare. ;en
find trust in the lord live worship with don moen. ;en
search for the nations. ;en
play live at leeds. ;en
play the song aura too the sacred rings. ;en
can you find the novel stone age rom ios. ;en
find the press of atlantic city movie. ;en
i want to see the trailer for no one. ;en
get soundtrack of comprehensive knowledge archive network. ;en
can you find me the painting titled across the line. ;en
please search the irv gotti presents the murderers picture. ;en
find terminator three redemption a picture. ;en
i'd like to watch the TV show hola mary lou from ny to. ;en
show me the picture totally true love. ;en
where can i get intel array building blocks. ;en
find an album called burnout the ultimate drag race challenge. ;en
where can i watch the latest episode of the TV show chu chu and the philly flash. ;en
play me the TV show the women of our home. ;en
go to the movie welcome to tokyo. ;en
please help me find the selections from the arista years video game. ;en
find the picture nur mit dir a walk to remember. ;en
find a video game called merry andrew. ;en
i'd like to see jacksonville daily progress saga. ;en
i need the book titled lullaby of broadway. ;en
where can i see the show twenty something. ;en
i am looking for shoot me down. ;en
please help me find the short program saga. ;en
find the novel a hat in time. ;en
find a show called the chi yoga roni love for you. ;en
find long walk to forever a novel. ;en
show the movie move any mountain. ;en
i want to see the TV show cause and effect. ;en
show the TV show the last samurai. ;en
find a show called the crowd roars. ;en
how do i get the soundtrack for hearts of fencing. ;en
show the creativity of saga that is associated. ;en
i want the video game two more years. ;en
look for hail satan as we are the black legions. ;en
please search the work the mercenary. ;en
i need a photograph of the oregon desert. ;en
show me the book the republican brain. ;en
play the case of the whitechapel vampire TV series. ;en
find a TV show called randy scales skirt. ;en
find a television show called main street. ;en
find the case of the frightened lady. ;en
find the book cold comfort. ;en
find the hundred foot journey. ;en
where to see painting twelve angry men. ;en
show the trailer of rug rats go wild. ;en
find the song ticks. ;en
find black mirror three final fear. ;en
is the TV show available to watch anywhere. ;en
where can i find the ricky scott's desk in a fee. ;en
find a show called time is just the same. ;en
show me then we came to the end. ;en
i'd like to see completely well. ;en
find the book called black wings of destiny. ;en
look up applied linguistics. ;en
help me search UFC on fox show. ;en
find all jets are gonna fall today saga. ;en
play the what i need to do soundtrack. ;en
find the love and war soundtrack. ;en
show creative painting people and love. ;en
find the novel make peace not war. ;en
find bells break their towers a video game. ;en
find something crucial a book. ;en
please pull up nothing feels good. ;en
show me a video game made by the PGA NZ. ;en
find a TV show called union. ;en
find a picture of a breed apart. ;en
can you search a song for mama book for me. ;en
find young miss holmes. ;en
i wanted to see the book the mailroom hollywood history from the bottom of. ;en
i'd like to see the picture the principle of hope. ;en
i'd like to find the days of glory saga. ;en
what is the TV show journal of personality and social psychology. ;en
find the radical history review saga. ;en
is it possible to find the book live in europe online. ;en
show me dangers of the canadian mounted. ;en
i'm looking for the saga the hardest part. ;en
where can i find the song red back fever. ;en
show under the sea creative video game. ;en
find the show titled hell on earth two thousand six. ;en
where can i purchase the saga the second life of samuel tyne. ;en
find hero quest to legacy of story info. ;en
i'd like to watch miss congenial d. ;en
please search the karobar economic daily picture. ;en
where can i get harry potter and the philosophers stone. ;en
find a trailer called storm center. ;en
please search a new machine TV series. ;en
locate me the novel entitled business. ;en
how do i see the TV series to see the invisible man. ;en
where can i view the trailer extreme the collection. ;en
find darker than black. ;en
i'm looking for the trailer of highlands today. ;en
find a book called screwed. ;en
find the TV show titled the three leaps of wang lun. ;en
i want to view the picture in old monterey. ;en
search for ayumi homicide countdown live phone anniversary song. ;en
show me interesting times the secret of my success. ;en
i need info on the video game iron fist. ;en
find the movie everywhere but home. ;en
where can i find the trailer for sensations of nineteen forty five. ;en
find word of mouth for me. ;en
find a soundtrack called top gear australia. ;en
where can i see the show latin for lovers. ;en
find drowning with land in sight. ;en
find a pizza that sorcery soundtrack. ;en
find trivial pursuit america plays. ;en
find the gamblers. ;en
i wanna watch the television show champion. ;en
i'm looking for a picture titled rock painting. ;en
can you find me the game a silence that screams. ;en
look up the baltic times picture. ;en
please give me the critical condition show. ;en
find hope and other sins a TV show. ;en
play the xy man soundtrack. ;en
find the novel peace arch news. ;en
find the trailer for hotel on the corner of bitter and sweet. ;en
find have a six pence photograph. ;en
look up the stars are indifferent to astronomy. ;en
show creativity of a catholic education. ;en
i'd like to see the book the royal thousand. ;en
find the check please photograph. ;en
can you find me the work frisbee the life and death of a hippie preacher. ;en
please look up the novel heroes of annihilated empires. ;en
find the TV series shaun the sheep. ;en
show the song black heart white soul. ;en
find cover her face. ;en
when is the next episode of the TV series crossing lines showing. ;en
find a trailer called way down yonder in new orleans. ;en
find a soundtrack called the book of folly. ;en
find framing the early middle ages a game. ;en
please find me the youth against fascism television show. ;en
when does fire and ice the winter war of finland and russia television show air. ;en
find me the book with the title of the rainwater LP. ;en
play the game sugar flood. ;en
find information about the album flip city. ;en
i want the movie pursue miranda and his theatre. ;en
find the TV show titled time writer the adventure of lyle swann. ;en
show me the movie sonic triple trouble. ;en
how can i see the TV series mod storm. ;en
please find pretty baby. ;en
i'm looking for river disturbance. ;en
show creativity of the album saga. ;en
find manual of love two. ;en
where can i find information on brats in battalion. ;en
find the flying starts. ;en
can i see the boat people. ;en
find a television show called milagros girl from away. ;en
play the electrochemical and solid state letters song. ;en
find a photograph called cope park. ;en
can you find me the my father my king game. ;en
show creative work or miami vice theme. ;en
show TV series schedule of gears of war. ;en
play the last mile album. ;en
find the crucible of man something wicked part two. ;en
play a trailer for give it all. ;en
look for the trailer of guitar heaven santana performs the greatest guitar classics of all time. ;en
search for television show windows live TV. ;en
find a painting called the other bank. ;en
where can i find conduct and becoming. ;en
i want to watch the movie x window display manager. ;en
wish to hear the album since i saw you last. ;en
she me the game called knowledge and decisions. ;en
i'd like to play the video game time to kill. ;en
find the transformers generations video game. ;en
show creativity of your body above me. ;en
show creativity in ah. ;en
please search for the two faces of my girlfriend saga. ;en
find drumline a new beat a picture. ;en
show me cut the rope video game. ;en
find a soundtrack called meet the vogue. ;en
please help me search the banker television show. ;en
find me a saga by reproductions. ;en
find the work compiled fragments phone. ;en
show creativity of saga frontier marshal. ;en
where can i view the trailer jeeves and wooster in perfect nonsense. ;en
find the photograph a little less sixteen candles. ;en
find a game called the oh in ohio. ;en
where to get painting of channel four news. ;en
show song schedule come into the world. ;en
show me the photograph a woman from the street. ;en
looking for a black ribbon for deborah. ;en
look for the no bigger than a minute soundtrack. ;en
find my only wish in some form of creative work. ;en
can you please find me the biggest loser brunei the spirit of life photograph. ;en
please find the movie a jingle with jillian. ;en
play hell house song. ;en
show the url photograph. ;en
i wanna watch the television show little things. ;en
find the covered wagon a game. ;en
can you help me find preaching to the perverted. ;en
find home fires. ;en
show creativity of soundtrack on iheart radio countdown. ;en
show me a photograph called the daily slovak news. ;en
find the app store. ;en
find the show transfers. ;en
search for the video game the book of heroic failures. ;en
i want to listen to the song first time for everything. ;en
find a pet of the cairo zoo. ;en
show the my world two point zero photograph. ;en
how can i see the show pulse two after life. ;en
info on show natural language and linguistic theory. ;en
show me TV series lego star wars three the clone wars. ;en
find the apple address book television show. ;en
what is the book sell your body. ;en
show me heavenly sword. ;en
show creativity of home brew. ;en
find a soundtrack called the outpost. ;en
please look up the television show noel hill and tony london. ;en
where can i purchase wild. ;en
how do i watch the television show counting the rows. ;en
show me photos cape. ;en
show more questions than answers trailer. ;en
play trailer of do whatever turns you on. ;en
find a show called friday download. ;en
i'd like to see the movie reviews. ;en
read the novel on-line encyclopedia of integer sequences. ;en
how do i watch the TV show NBA access with ahmad rashad. ;en
find the modern world video game. ;en
buy novel brokeback mountain. ;en
find le profil amina TV series. ;en
i need to find the creative work wave. ;en
find under night in birth. ;en
find fanatic. ;en
find me the movie with the title of twitches. ;en
find the carousel saga. ;en
can you find me the real mccoy novel. ;en
what is party all night. ;en
find a television show called basement. ;en
i need to find the creative work burn baby burn. ;en
show creativity of wild about animals. ;en
where can i find the novel a woman in the web. ;en
show me chasing a feeling painting. ;en
please get me infernal devices game. ;en
find a TV show called the soul taker. ;en
find the collision in black painting. ;en
show video game and the quality of life. ;en
please give me the british journal of dermatology game. ;en
show me the saga my darling. ;en
please search for the microsoft safety scanner television show. ;en
pull up the TV show bones seasons the best of skid row. ;en
find the creative work brilliant tragic. ;en
can you search the picture titled the accounting. ;en
find the killing fields. ;en
i'd like to see the picture to the farm. ;en
find a TV series called armageddon summer. ;en
find a television show called the high jasper al. ;en
look up the search lights painting. ;en
show the taste. ;en
find the novel the thunder rolls. ;en
i am looking for the TV series strays. ;en
search for the world is a game. ;en
i'm looking for the song called standing for something. ;en
where can i find the novel the great irish bake off. ;en
find a novel called kiss me or. ;en
find the little death a soundtrack. ;en
show me the soundtrack the phoenix. ;en
where can i watch TV series shopping spree. ;en
go to the television show nothing without you. ;en
i want to listen to the song. ;en
need find the book called hollywood connection. ;en
what song is detective conan dimensional sniper. ;en
painting of live from the el rey theatre. ;en
find the game gorman. ;en
find just south of heaven. ;en
need a creative work with the title unholy confessions. ;en
find a photograph called wild cats on the. ;en
find the album until the whole world hears. ;en
where can i watch the television show called fangs of the arctic. ;en
i'd like to see walk on the wild side the best of lou reed. ;en
find the show manson. ;en
show me the atrocity exhibition. ;en
go to the TV series love berry. ;en
i'd like to see apartment hunting. ;en
find the book bad day on the block. ;en
find a painting called voices in my head. ;en
search for the saga of return of the bastards. ;en
please get me stories from the english and scottish ballads show. ;en
show me the live in whitby album in here. ;en
show. ;en
i want to see the television show the muppet christmas carol. ;en
find a picture called battlefield network. ;en
look for the TV series the stars at saint andrea. ;en
find the song the fourth man. ;en
show the creativity of the attic. ;en
please look up the painting beyond iconic photographer dennis stock. ;en
find me a soundtrack by ghost town prophecy. ;en
find the sarah belle on buck. ;en
show creativity of photograph of my wonderful day. ;en
please look up the power and love movie. ;en
please find me the purple vigilantes book. ;en
help me locate a game called the master of fallen tree. ;en
where can i find the TV show earth defense force twenty twenty five. ;en
i'm looking for an album called the orchestra in project. ;en
show me the television show children in need rocks two thousand thirteen. ;en
where can i purchase a copy of the painting called glimpses of world history. ;en
please find me the platinum box to song. ;en
please pull up the trailer for stares and whispers. ;en
find games wizards play TV series. ;en
find a television show called the passion of the betty. ;en
please search crossing muddy waters work. ;en
i want to read the novel pokémon the movie black fifteen am and white fifteen ms here. ;en
where can i find the saga addicted to love. ;en
i want to listen to the soundtrack adobe digital editions. ;en
show the feed the kitty painting. ;en
show me the book it might as well be spring. ;en
show the three tales album. ;en
show GD and top painting. ;en
find a video game called creators of the stock. ;en
can you locate the work warlock two the exiled. ;en
search for the television show called educational psychologist. ;en
show me convicted. ;en
i'd like to cease fire force. ;en
find changes i love story. ;en
can you pull up the television show called electric boogaloo. ;en
find a game called so long self. ;en
find at this point in time. ;en
when and where is destroyed watch playing. ;en
i wanna watch TV series the practical pig. ;en
find a photograph called between the days. ;en
find a photograph called cold weather. ;en
can you find the movie accidentally in love. ;en
search for teenage mutant hero turtles followed the fridge clan photograph. ;en
show me the game english repeat. ;en
find book in the valley. ;en
play the widow of st. ;en
find a TV show called zen the music of fred katz. ;en
play the song s. f. sound furniture. ;en
look up the cool cafe cool tape volume one video game. ;en
find a show called but on. ;en
play me the song the french chef. ;en
show me the advocate. ;en
show creative photograph of when they'll heart of winter. ;en
find a painting called the wipers times. ;en
find a soundtrack called the alice cooper show. ;en
need to find a creative work with the title sometimes the blues is just a passing bird. ;en
show the immortal grand prix. ;en
when is playing. ;en
find a TV show called engaged to the unidentified. ;en
find me a game called space lol. ;en
play miss to so bladder. ;en
find a saga called the life of riley. ;en
find the hopeless romantic photograph. ;en
please look for the TV show memoirs from a bedroom if you want. ;en
i'd like to see the picture chrome dreams. ;en
find a soundtrack called new religion. ;en
find all about aubrey. ;en
look for a photograph of i wanna sex you up. ;en
what is the price for the album praise the lord and pass the ammunition. ;en
show family plot. ;en
find a game called gladiators australian series one. ;en
where can i buy the something borrowed saga. ;en
i need work of father dearest. ;en
can you find me the dicey business TV series. ;en
find the blood red sandman. ;en
find me the seven ups. ;en
please search for the legend of korra book. ;en
show me the book pokémon the journeys. ;en
find the quest of iran. ;en
find me an album called rejoicing with the light. ;en
i want television show come again smith. ;en
where can i listen to the song the imposter. ;en
find the game company of heroes. ;en
show that little band of gold. ;en
find me the documentary a winter of cyclists. ;en
play the song vocation is the arcade dominion. ;en
find a show called american journal of play. ;en
find good reader. ;en
play the disco grafia did the pretty reckless saga. ;en
please search for sealed with a kiss movie. ;en
search for informal wings. ;en
search for the compliance. ;en
i want to listen to the song the loving spirit. ;en
i'd like to see the game called god is in the tv. ;en
show me the song fifteen storeys high. ;en
please search the ryan theory video game. ;en
i'd like to see the saga tom g sixty four min the world. ;en
help me find from time to time a TV show. ;en
show creativity of doomsday comfort. ;en
find the song occasional wife. ;en
i want to see far cry vengeance. ;en
look up the adventure of the blue carbuncle. ;en
trailer of gate of thunder. ;en
i need a painting called brubeck plays brubeck. ;en
find the three little pigs television show. ;en
find bullet and a target a television show. ;en
i want to play the video game international pink study group newsletter. ;en
look for the game find another way. ;en
find a trailer called colony seven. ;en
find TV series of new audit the curse. ;en
can you look for the creative work called no gravity. ;en
find a saga called night life. ;en
find me the novel london has fallen. ;en
find a TV show called the fighting men. ;en
what is the cheapest online price for the instincts saga. ;en
can you find the TV show faithless street. ;en
find me the television show a city sleeps. ;en
play everybody wins trailer. ;en
find the song titled the rivalry red v. blue. ;en
find me the album the weed tree. ;en
show me the evil dead painting. ;en
play the soundtrack for the lord of the rings conquest. ;en
i am looking for the creative work a wonderful life. ;en
find mother earth a TV show. ;en
find a book called the polish bride. ;en
show creativity in all nudity shall be punished. ;en
show creativity of construction project information committee. ;en
where can i find the album the adventures of lolo to you. ;en
where can i find the movie called cracking contraptions. ;en
where can i watch watch the television show catch. ;en
i want to listen to the soundtrack and then there was light. ;en
find a novel called testing anywhere. ;en
i'd like to watch episodes from the TV series the secret of queen anne or musketeers thirty years after. ;en
play the crowd study of the popular mind soundtrack. ;en
look up the television show called monster mash. ;en
where can i buy a hardcover copy of the book the intangible of leadership. ;en
find your personal touch. ;en
