play the last soundtrack from the sixties. 	PlayMusic
add post mortem to my timeless love songs playlist. 	AddToPlaylist
find attack surface analyzer a painting. 	SearchCreativeWork
i want to book a restaurant in forty weeks in iowa. 	GetWeather
find the still life american concert nineteen eighty one soundtrack. 	SearchCreativeWork
rate the simplest words a four out of six. 	RateBook
what is the forecast for harrison crawford state forest. 	GetWeather
give anatomy of a typeface a one rating. 	RateBook
book a restaurant in indiana for me violet and dianne. 	BookRestaurant
find the video game journal of criminal law criminology. 	SearchCreativeWork
find me the show the skull. 	SearchCreativeWork
play music from jeremy taylor on the album the more ways you don't on groove shark. 	PlayMusic
when is his english wife showing at the neighborhood cinema group. 	SearchScreeningEvent
play video game manifesto of nevermore. 	SearchCreativeWork
i want to add a song by w c clark to my name around playlist. 	AddToPlaylist
will you play me the most popular sound track from two thousand six. 	PlayMusic
forecast for israel. 	GetWeather
play some music from nineteen ninety three on itunes. 	PlayMusic
four points for four at building disc courses eighteen forty four. 	RateBook
book a table at a top-rated brasserie in pakistan. 	BookRestaurant
book a restaurant for monique stewart arlene and jamie. 	BookRestaurant
find movie schedules for animated movies in the area. 	SearchScreeningEvent
what's the weather forecast for my current location on jun two. 	GetWeather
add warning device to my mac 'n cheese playlist. 	AddToPlaylist
book a spot for three at the pizza place. 	BookRestaurant
play the top song by eminem marathon groove shark. 	PlayMusic
book a restaurant for marcella remind me and rivera. 	BookRestaurant
show me when and where i can see song of summer. 	SearchScreeningEvent
what will it be like that the twentieth in colorado. 	GetWeather
is the sun coming out today and look at the national wildlife refuge. 	GetWeather
add a track to my girls' night playlist. 	AddToPlaylist
how much humidity is there in UT. 	GetWeather
add this tune to hipster soul. 	AddToPlaylist
add fred bob lock to my lo-fi love playlist. 	AddToPlaylist
book the mustard seed in turks and caicos islands for nine people. 	BookRestaurant
i would like to book a restaurant neighboring lincoln beach. 	BookRestaurant
i'd like to hear me zeus latest record. 	PlayMusic
can you put live in detroit on the playlist peaceful piano. 	AddToPlaylist
find a saga called story of my life. 	SearchCreativeWork
will a blizzard hit torrey pines state natural reserve on jun sixteen. 	GetWeather
add rosemary clooney to pura vida playlist. 	AddToPlaylist
find animated movies nearby. 	SearchScreeningEvent
what's the closest movie house showing the hard way. 	SearchScreeningEvent
rate this series two of six. 	RateBook
my life as a fake is one out of six. 	RateBook
play me a song from the fourties. 	PlayMusic
i need to know the weather for san martin. 	GetWeather
please search for the work all the wrong reasons. 	SearchCreativeWork
this chronicle of the origins and history of consciousness is a three. 	RateBook
will it be hotter in what i am missing hills. 	GetWeather
show me the picture sex and drugs and jesus christ. 	SearchCreativeWork
shes unsettled land playing at the movie theatre. 	SearchScreeningEvent
who was the artist who did the painting called spiral two season of flame. 	SearchCreativeWork
play a ballad form two thousand fourteen by double on google music. 	PlayMusic
can you play some music from nineteen ninety nine. 	PlayMusic
i'd like to hear a track by theo keating. 	PlayMusic
find the movie schedule. 	SearchScreeningEvent
book me a reservation for an outdoor restaurant. 	BookRestaurant
play a song from the thirties on zvooq you. 	PlayMusic
give this album three out of six points. 	RateBook
put this song on the feel good indie rock playlist. 	AddToPlaylist
what is the movie schedule for general cinema corporation. 	SearchScreeningEvent
play some chant music from two thousand eight. 	PlayMusic
book a reservation for my great grandfather and i at a macaroni pub in CT. 	BookRestaurant
i need a photograph of days of wine and roses and other TV requests. 	SearchCreativeWork
what is the weather forecast for sierra leone. 	GetWeather
what is the current temperature here. 	GetWeather
find me the showtimes for until death at the nearest movie house. 	SearchScreeningEvent
my party of three would really like to eat baba au rhum at a brasserie could you help. 	BookRestaurant
play a sudden rainstorm playlist. 	PlayMusic
this textbook rates a four of six. 	RateBook
in eight years and a half from now i'd like a reservation at a top-rated bar. 	BookRestaurant
find the movie don't break the heart that loves you. 	SearchCreativeWork
add this rob camp in NOLA to the psychedelic rock. 	AddToPlaylist
rate this textbook five stars out of six. 	RateBook
i would give the book lavender and old lace a rating of three. 	RateBook
i'd like to watch abbott and costello meet captain kidd at the nearest cinema. 	SearchScreeningEvent
i want to see the maximum trance picture. 	SearchCreativeWork
i need a table at a restaurant in texas for kelley and sue said. 	BookRestaurant
add this album ny bill callahan to my mi casa es la tuya playlist of its yeah list. 	AddToPlaylist
i'd like to play the album clarke. 	SearchCreativeWork
how is the weather in MN. 	GetWeather
show creativity of pocket full of crap tonight. 	SearchCreativeWork
what is the TV show this is halloween. 	SearchCreativeWork
will it be overcast in my current location at twelve p. mercier. 	GetWeather
will it be stormy in distant holly river state park. 	GetWeather
play me a ballad by dres on groove shark. 	PlayMusic
i'd like to see the movie edinburgh evening news. 	SearchCreativeWork
what is playing for movies at b b theatres. 	SearchScreeningEvent
what is the release date for the DVD called wild is the wind. 	SearchCreativeWork
find a trailer called sheriff mix discography. 	SearchCreativeWork
give five out of six to this book. 	RateBook
can i get the movie schedule for films nearby. 	SearchScreeningEvent
is it going to be sunny at five pm and wildlife refuge. 	GetWeather
i want to book a popular tyrolean steakhouse in madison park in one hour nine minutes and one second. 	BookRestaurant
add maki ohguro to the rock hard playlist. 	AddToPlaylist
what's the weather in denver. 	GetWeather
where can i watch the television show the private affairs of bel ami. 	SearchCreativeWork
where can i watch portrait of a woman nude in one hour. 	SearchScreeningEvent
i give the logic of sense a zero. 	RateBook
book a party of four at eddie's attic. 	BookRestaurant
what is the weather forecast in pinson south dakota. 	GetWeather
restaurant in zambia that is close for a party of ten. 	BookRestaurant
the get going playlist needs another song. 	AddToPlaylist
put this agent m tune onto the kids as been lol. 	AddToPlaylist
find out what films are playing at north american cinemas. 	SearchScreeningEvent
find journal of the european economic association a movie i want to see. 	SearchCreativeWork
i want to play the game the celestial hawk. 	SearchCreativeWork
me maggie and ellen want to eat at lentil as anything. 	BookRestaurant
find the schedule for vanishing of the bees at a movie house. 	SearchScreeningEvent
what time does johnny got his gun play. 	SearchScreeningEvent
i give christianity not mysterious one out of six points. 	RateBook
will you play a ballad from mahalaxmi iyer. 	PlayMusic
where can i find the video game called banana to the unemployed ninja returns. 	SearchCreativeWork
add steel gray to my thirty five soul classics nineteen seventy to nineteen seventy five pl set. 	AddToPlaylist
rate this series two out of six. 	RateBook
can you add a track to my spain top fifty playlist. 	AddToPlaylist
book a table for me leanne and tami at a restaurant serving caucasian food. 	BookRestaurant
i want to hear a highly rated breakfast restaurant. 	BookRestaurant
show me weather forecast in KY from four hours from now. 	GetWeather
i want to put this track on diamonds just smile playlist. 	AddToPlaylist
find movie schedules for nearby films. 	SearchScreeningEvent
what is the forecast for papua new guinea for lunch for rainfall. 	GetWeather
what will be the temperature one minute and eight seconds from now in green bottom wildlife management area. 	GetWeather
will it snow this week in parc national de petrified forest. 	GetWeather
find a movie called bruce lee. 	SearchCreativeWork
please give me movie schedules. 	SearchScreeningEvent
book a restaurant at sixteen o'clock in SC. 	BookRestaurant
tell me when it'll be chillier in caballero corner ID. 	GetWeather
the current textbook gets a two rating. 	RateBook
find a movie theatre with life and death. 	SearchScreeningEvent
book a restaurant for november phone. 	BookRestaurant
what films are playing in the neighborhood. 	SearchScreeningEvent
can i watch the sound of war in thirteen minutes at the nearest cinema. 	SearchScreeningEvent
play breathtaking music. 	PlayMusic
what is the overcast forecast for midday in ID. 	GetWeather
add villotta to the metalsucks playlist playlist. 	AddToPlaylist
what is the weather like in the city of woburn in the country of venezuela. 	GetWeather
what is the weather forecast in nine months within walking distance of ohio. 	GetWeather
play all of your toys by chris du. 	PlayMusic
i want to hear ready by frankenstein drag queens from planet thirteen. 	PlayMusic
play music from the seventies for me. 	PlayMusic
what movie house is playing the animated movies nearest. 	SearchScreeningEvent
what will the weather be like in three weeks faraway in san po strict nature reserve. 	GetWeather
give four out of six points to this book. 	RateBook
will it be freezing close to my current location. 	GetWeather
showtimes for movies currently playing at speakeasy theaters. 	SearchScreeningEvent
play some mark for monte from the thirties. 	PlayMusic
add hatfield and the north to my hot house playlist. 	AddToPlaylist
play wolves by larry gatlin. 	PlayMusic
i need a table for six pm for me and my step daughter at cafe rouge. 	BookRestaurant
can you give me the movie schedules for films close by. 	SearchScreeningEvent
play the música da série de filmes o hobbit album by alex order. 	PlayMusic
is it supposed to hail in NY. 	GetWeather
find the world is a game. 	SearchCreativeWork
play shake your head. 	PlayMusic
what movies are playing at cobb theatres. 	SearchScreeningEvent
i want to hear that indoor bar for two. 	BookRestaurant
add troy andrews to my pop punk powerhouses. 	AddToPlaylist
i want to hear something from the nineties by alissa muster one groove shark. 	PlayMusic
lets eat now somewhere in roach. 	BookRestaurant
play a concerto from the nineties. 	PlayMusic
add my belgian rose to my evening list. 	AddToPlaylist
i want to give the current novel four stars. 	RateBook
i need a table for four at the brass rail. 	BookRestaurant
i want a table for seven at a popular cafeteria on holy saturday in god. 	BookRestaurant
add hello my lover goodbye to my deathcore playlist. 	AddToPlaylist
book a spot at a steakhouse with internet. 	BookRestaurant
add tune to my playlist ironing. 	AddToPlaylist
what will be like in the current place at midnight. 	GetWeather
please show me the movies playing at amco entertainment. 	SearchScreeningEvent
i'd like to book at a place in michigan for a party of three name of the restaurant is carter house inn. 	BookRestaurant
rate the current novel four out of six points. 	RateBook
i'd like to watch movies at KB theatres. 	SearchScreeningEvent
what movie times are there at arclight hollywood. 	SearchScreeningEvent
rate this essay one out of six stars. 	RateBook
can you add something by snow onto my zen focus playlist. 	AddToPlaylist
what films are showing at cooper foundation. 	SearchScreeningEvent
i'm looking for the saga why men leave home. 	SearchCreativeWork
i need a party of two reservation faraway from atlantic avenue barclay center at a spa for fast food. 	BookRestaurant
rate this chronicle two points. 	RateBook
play sweet sutter cane by a fire on itunes. 	PlayMusic
will there be a blizzard in egypt on july three. 	GetWeather
i'm looking for the television show the flame. 	SearchCreativeWork
i am giving the book after henry a rating of zero out of six stars. 	RateBook
put this track on soul BP and my playlist. 	AddToPlaylist
sort eighties ep from the last. 	PlayMusic
show the mickey mouse photograph. 	SearchCreativeWork
is it going to be windy faraway from the valley of fire. 	GetWeather
please play some fourties music on spotify. 	PlayMusic
give the current novel a three out of six rating. 	RateBook
will the weather be stormy on january the fifteenth two thousand twenty six in the federated states of micronesia. 	GetWeather
rate this essay two out of six stars. 	RateBook
i need a dinner reservation in three months for a restaurant in hills and else. 	BookRestaurant
i'd like to listen to iheart radios chill out playlist please. 	PlayMusic
rate this album a one. 	RateBook
what movie theatre is showing if the huns came to melbourne. 	SearchScreeningEvent
what is the TV series in app store. 	SearchCreativeWork
what is temperature in benin now. 	GetWeather
book a table for eight in china sixteen hours ten minutes and one second from now. 	BookRestaurant
which cinema is currently showing the youngest profession. 	SearchScreeningEvent
i would like to book a restaurant in niagara falls for eight on june nineteenth. 	BookRestaurant
what weather will it be in battle man mesa. 	GetWeather
what will the weather be here fourteen minutes from now within walking distance. 	GetWeather
find a book called kiss symphony alive IV. 	SearchCreativeWork
book a restaurant for ten in OK. 	BookRestaurant
show me the picture written in the stars. 	SearchCreativeWork
book me a reservation for ten in oman. 	BookRestaurant
play the top twenty chant by wise. 	PlayMusic
what's the weather on bird island burkina at the road. 	GetWeather
what are the movie times for movies close by. 	SearchScreeningEvent
book a spot for one at a restaurant in ID. 	BookRestaurant
add this eric what is bird song to my dance workout. 	AddToPlaylist
show me the game music bank. 	SearchCreativeWork
i need a reservation for the original house of pies with three people and planned manor PA. 	BookRestaurant
find a soundtrack for meditations. 	SearchCreativeWork
add lisa m to my guitar hero live playlist. 	AddToPlaylist
book laurelhurst theater for eight people. 	BookRestaurant
book a restaurant for one in stillman. 	BookRestaurant
show me the photograph of minutes to midnight. 	SearchCreativeWork
where can i find the soundtrack for steamboat bill. 	SearchCreativeWork
check the weather forecast for. 	GetWeather
on october 14 2026 i have two people to eat at coney island hot dog stand. 	BookRestaurant
find wild at heart. 	SearchScreeningEvent
i would like to book a pool and food court in KY. 	BookRestaurant
put no mystery into my punk essentials playlist. 	AddToPlaylist
how is the forecast for OK. 	GetWeather
book a top-rated osteria seven weeks from now. 	BookRestaurant
i'm looking for local movie schedules. 	SearchScreeningEvent
what time is the crystal is playing at the closest cinema. 	SearchScreeningEvent
how much fog is there in tarpon springs. 	GetWeather
book a table for nine people in NJ. 	BookRestaurant
find the movie times for films in the area. 	SearchScreeningEvent
i want this artist on the cena elegante playlist. 	AddToPlaylist
rate this album a one. 	RateBook
will it be warm and powers feel warm twenty three hours from now. 	GetWeather
what time does military history of african americans play. 	SearchScreeningEvent
is it warm in west monroe. 	GetWeather
play the playlist a mis ninos de thirty. 	PlayMusic
put edwyn collins onto my trabajo relax playlist. 	AddToPlaylist
add the third world to my focus now. 	AddToPlaylist
read the yellow its series one of six points. 	RateBook
i need a table in east timor for a party of nine at five north st. 	BookRestaurant
during tea time what animated movies will be screening at the closest movie house. 	SearchScreeningEvent
play me hier encore by green square. 	PlayMusic
give zero star for current album. 	RateBook
weather for september seventh two thousand thirty nine in salinas river national wildlife refuge. 	GetWeather
what cinema is health warning playing in eleven hours. 	SearchScreeningEvent
what films are showing at kerasotes theatres. 	SearchScreeningEvent
book a joint in sixteen minutes for nine. 	BookRestaurant
show creative game elements of life remix. 	SearchCreativeWork
i need a reservation for little grill collective for supper with eight people. 	BookRestaurant
book spot for eight at bar that serves party. 	BookRestaurant
i'd like to reserve a spot at a bakery in guyana in feb. 	BookRestaurant
can you play me songs from the estado tournament playlist. 	PlayMusic
will there be snowfall in pacific beach suriname. 	GetWeather
put sleeping with ghosts into my nineties indie playlist. 	AddToPlaylist
find the picture chorus line. 	SearchCreativeWork
i want a table for me and my kids in turkey at a neighboring restaurant. 	BookRestaurant
tell me if it will it be windy in grizzled squirrel wildlife sanctuary. 	GetWeather
i want to hear music off my indie festival playlist. 	PlayMusic
add artist to my broken heart. 	AddToPlaylist
i'd like to eat at a popular diner. 	BookRestaurant
find me the lace and whiskey soundtrack. 	SearchCreativeWork
tell me the weather forecast nearby my current location. 	GetWeather
book a reservation for eight people in north dakota. 	BookRestaurant
the spring classical playlist needs partners in crime added but. 	AddToPlaylist
please play me something by new wave of american heavy metal. 	PlayMusic
play me a song from movies for the blind on pandora. 	PlayMusic
what's the closest movie house showing the legend of ben hall. 	SearchScreeningEvent
i need a reservation for four minutes from now for three people in the falkland islands. 	BookRestaurant
play deezer tunes are and be. 	PlayMusic
book a bar for two in hayden row on friday. 	BookRestaurant
what is the weather forecast in langdon. 	GetWeather
will it be cold at one am in boon. 	GetWeather
find focus now list and add a diamond to my playlist. 	AddToPlaylist
add pimp c to my workout remix. 	AddToPlaylist
play the most popular album on google music by sassy reportee. 	PlayMusic
evil experiment gets zero out of six points. 	RateBook
find live in tokyo for me. 	SearchCreativeWork
book a table for three at one of the restaurants in washington d. c. in riverview. 	BookRestaurant
play some industrial music on last fm. 	PlayMusic
find a reservation at sunset at a gastropub for two people. 	BookRestaurant
i'd like to see the show onion sports down. 	SearchCreativeWork
richard carville four out of six. 	RateBook
please get me the very best of chicago only the beginning. 	SearchCreativeWork
please get me the welcome to the rileys game. 	SearchCreativeWork
four out of six stars for the previous essay. 	RateBook
i want a table for five at a restaurant with latin food in arkansas for one hour from now. 	BookRestaurant
which films are playing close by. 	SearchScreeningEvent
find movie times for loews cineplex entertainment. 	SearchScreeningEvent
give one out of six. 	RateBook
what is the weather nearby bermuda a week from now. 	GetWeather
book a reservation for seven people at a bakery in osage city. 	BookRestaurant
i want to book a restaurant next year in glare is your for six people. 	BookRestaurant
play a popular ballad by amanda. 	PlayMusic
list movie times at cinemark theatres. 	SearchScreeningEvent
i want a table for my grandson and i somewhere in arkansas. 	BookRestaurant
show me the everybody wants you picture. 	SearchCreativeWork
read the bones one stars. 	RateBook
find the painting retro active. 	SearchCreativeWork
what is the eugene t. mahoney state park forecast for two days from now. 	GetWeather
play any sixties song. 	PlayMusic
is there fog in new york. 	GetWeather
what is the forecast for here. 	GetWeather
can you add through the darkness they march to my once upon a time playlist. 	AddToPlaylist
what's the weather forecast in dallas. 	GetWeather
can i get the movie times for fox theatres. 	SearchScreeningEvent
what is the weather close to sons fell on mon. 	GetWeather
i'd give the current essay five points. 	RateBook
play a song by juan on last fm. 	PlayMusic
add this artist to my eighties party. 	AddToPlaylist
add album to my piano ballads. 	AddToPlaylist
book a restaurant. 	BookRestaurant
i want to hear steven harlow from the thirties. 	PlayMusic
play me a song from voices and images. 	PlayMusic
i wish to listen to good symphony music by mi lu bing. 	PlayMusic
what is the movie schedule for cineplex. 	SearchScreeningEvent
show video game name find the color. 	SearchCreativeWork
play something by daisy boys and on google music. 	PlayMusic
show me the when your heart stops beating photograph. 	SearchCreativeWork
is there a cloud in the sky and turn on fifth. 	GetWeather
look at a restaurant within the same area of ely for ten people. 	BookRestaurant
play the top five songs from robert lockwood junior. 	PlayMusic
play some nineteen seventy antero man in the queue. 	PlayMusic
rate this novel four of six. 	RateBook
play some music by jody williams from two thousand one. 	PlayMusic
i want to give the current album two stars. 	RateBook
play these four walls by yummy bingham here. 	PlayMusic
where is the creative work seven pillars of wisdom. 	SearchCreativeWork
will it be foggy now close to jolly. 	GetWeather
what will the weather be in mad one st bothell me. 	GetWeather
how much hotter will it be here tomorrow. 	GetWeather
play some deezer oldies music. 	PlayMusic
what movies are showing in the neighborhood. 	SearchScreeningEvent
play some seventies track from top rated film soccer. 	PlayMusic
can i get the showtimes for films at malco theatres. 	SearchScreeningEvent
add in hilton to my evening playlist. 	AddToPlaylist
add this song to my esenciales playlist. 	AddToPlaylist
book a churrascaria restaurant for two which serves. 	BookRestaurant
put this dave brought see turn on family road trip. 	AddToPlaylist
my great grandfather and i would like to get together at a taverna. 	BookRestaurant
add the big mama thornton song to punk rock workout playlist. 	AddToPlaylist
what will the weather be in NM in one minute. 	GetWeather
i'd like a table for my teenager and i at the washington d. c. jewish community center. 	BookRestaurant
i'd like a movie schedule for a close by movies. 	SearchScreeningEvent
for this current essay i give five of six points. 	RateBook
show weather forcast here at nineteen. 	GetWeather
rate atop an underwood early stories and other writings zero out of six stars. 	RateBook
add children of tell that patrick experiences to the playlist named chill out as romantic. 	AddToPlaylist
i need to episodes for the TV series fast food nation. 	SearchCreativeWork
i want to book a restaurant not far from our college. 	BookRestaurant
play some melody from the eighties on spotify. 	PlayMusic
book the kegs drive-in in thirty seven weeks in saudi arabia. 	BookRestaurant
show me the work the catholic weekly. 	SearchCreativeWork
rate this textbook five points. 	RateBook
play the newest chant by john doyle on zvooq you. 	PlayMusic
what movies are playing at regal entertainment group. 	SearchScreeningEvent
is terminal station at cinemark theatres. 	SearchScreeningEvent
book a party for seven at a food court with potato salad in alabama in eleven hours. 	BookRestaurant
find me the movie schedule for arclight hollywood. 	SearchScreeningEvent
what is the american samoa forecast for hot weather. 	GetWeather
show me the schedule of movie the duchess of langeais in cinema. 	SearchScreeningEvent
need a table in serbia and montenegro on april sixteenth for a party of seven. 	BookRestaurant
rate a handful of darkness a value of three. 	RateBook
find city of light. 	SearchCreativeWork
is it going to be stormy close to australia. 	GetWeather
find a movie schedule. 	SearchScreeningEvent
play music from last.fm here. 	PlayMusic
i need a table for me violet and maude at a restaurant in. 	BookRestaurant
incorporate nao cai kia into the epic classical playlist. 	AddToPlaylist
i need a table for eight during midday in montana. 	BookRestaurant
what is a weather of martinique a month from now. 	GetWeather
what's the weather forecast for the area neighboring KS this autumn. 	GetWeather
rate this album three of six points. 	RateBook
what will the weather be in grand koto UT at six pm. 	GetWeather
is the ghost breakers playing at plitt theatres in two hours. 	SearchScreeningEvent
play fill yourself with music by ray. 	PlayMusic
book a brasserie that serves meds in iowa. 	BookRestaurant
read the previous novel a one out of six. 	RateBook
at thirteen o'clock book a table for margie and i in vanuatu. 	BookRestaurant
make me a reservation within walking distance in wait for six pm. 	BookRestaurant
read hunting and gathering a two. 	RateBook
i need a reservation for three people at a spa restaurant in two hundred thirty seven days. 	BookRestaurant
add this track to the classical music for smart kids playlist. 	AddToPlaylist
what animated movies are playing nearby. 	SearchScreeningEvent
is it freezing in colorado. 	GetWeather
is the weather chilly in dew to. 	GetWeather
i am giving the current book two stars. 	RateBook
