expression;language
find the american journal of economics and sociology. ;en
show me the TV show limit of love movies are you. ;en
find my tribute show. ;en
i'd like to see the picture the collection the collector two. ;en
i need to find the saga trail of the yukon. ;en
find half cut tea. ;en
find the innocent when you dream saga. ;en
show me the heart specialist. ;en
when was the album start a fire released. ;en
please find the packed to the rafters work. ;en
i'd like to watch the trailer for as tears go by. ;en
find a video game called new york nine one one. ;en
find the passion of michel phú có novel. ;en
can you help me locate the game coast. ;en
play the food uncut soundtrack. ;en
show the singles collection volume four. ;en
i'm looking for the work titled conversion conspiracy. ;en
read the open ecology journal. ;en
where can i buy the movie the house fire. ;en
look for the album called the tale of mr jeremy fisher. ;en
search for movie turn back the clock. ;en
i'd like to see the show migration. ;en
find the show your hand show. ;en
can you please find the jack johnson en concert picture. ;en
read the background to danger book. ;en
show me the photograph johnny cash the complete columbia album collection. ;en
find a video game called victory march. ;en
find me the princess battles song. ;en
wish to find the work the immortals that is a show. ;en
how can i watch the television show tinker bell and the legend of the never beast. ;en
find a TV series called all time greatest movie songs. ;en
search for police women of cincinnati. ;en
show me the TV series called take me to your heaven. ;en
can you find me the assassination of jesse james by the coward robert ford saga. ;en
find the movie chaos is me. ;en
where can i see the trailer for experienced to embrace two hundred twenty thirteen but can't. ;en
can you find me the movie the girl and the general. ;en
find a saga called love takes discography. ;en
find reverence for me. ;en
find the picture louder than bombs. ;en
show me the photograph rock you baby. ;en
i want to find the adventures of lolmax. ;en
i want to read the book the lion sleeps tonight. ;en
show me the television show the angry mob. ;en
find a TV show called the god boy. ;en
find a movie called october road. ;en
i'm looking for the show called the origin of the milky way. ;en
i'm looking for the hit album the politics of dancing. ;en
find a novel called chemistry an european journal. ;en
show creativity of south town. ;en
i want to see the TV series a state of mind. ;en
play closer to the sun album. ;en
i'm looking for the television show titled the lawn open review. ;en
find w leicester. ;en
look up three fantastic dances. ;en
find a game called dynamite warrior. ;en
how to get saga strong the style. ;en
show me the novel all i need to know. ;en
is the television show kamen rider OOO wonderful shogun and the twenty one core medals streaming anywhere. ;en
please help me find i want to take you higher the game. ;en
find a video game called batman the return of bruce wayne. ;en
find cut the rope. ;en
where can i purchase the TV show time for heroes. ;en
where can i find the school. ;en
find mash confusion. ;en
buy cannabis painting. ;en
find the sing when you're winning TV show. ;en
find painting big ideas. ;en
i wanna watch the TV show down on abby. ;en
play me an album by lunchbox. ;en
please find me the work instrumental directions. ;en
look for the creative work called white sugar. ;en
show eric when do drills ch. ;en
find the show go with the flow. ;en
pull up sweeney todd il doria balik ko barbiere di fleet street. ;en
find casting crowns discography. ;en
play the newest virginia song. ;en
can you find a creative work called the st louis switch. ;en
look for the public toilet painting. ;en
find your twentieth anniversary the best. ;en
what system is blood hounds of broadway the game for. ;en
find the novel a civil war army vs navy. ;en
find the they came from somewhere else saga. ;en
please search for the TV series titled i need romance. ;en
find a show called last night on earth. ;en
show the minutes to midnight photograph. ;en
search for space on my hands. ;en
find me a game called thesis eleven. ;en
find a new machine. ;en
look up the hard to handle TV show. ;en
i want to see the trailer for australian economic history review. ;en
find stained glass windows. ;en
find a show called the inheritors. ;en
show movie cross genesis. ;en
find try me out for me. ;en
lets see the TV series seven even year itch. ;en
where can i find the TV show a step away. ;en
go to the photograph the inflated tear. ;en
please get me exploring the reef TV show. ;en
find the real story with gretchen carlson. ;en
where can i find the TV show of the school teacher in the house. ;en
can you search miracle in the rain. ;en
find a novel called east liberty. ;en
can you find the soundtrack for west country live. ;en
i want to see the television show called cuts both ways. ;en
show me baton rouge. ;en
play off the ground. ;en
play the video game the genesis machine. ;en
find a photograph of time loves a hero. ;en
show the drive of life album. ;en
can you find the info wars saga. ;en
show me the video game the last hour. ;en
can you find me the back when i knew it all album. ;en
i need to see cristo in india. ;en
show me the picture unfinished monkey business. ;en
i want to watch strange brother. ;en
find unfinished portrait of general bonaparte. ;en
i'm looking for the sign painting. ;en
find a picture called nuclear blast all stars out of the dark. ;en
i'm looking for a novel called the adventures of lolo to you. ;en
where can i find the photograph of a christmas memory. ;en
search for the show champagne showers. ;en
i want to watch escape the fate discography. ;en
i wanna watch the television show symphony for solo piano. ;en
find the movie take another picture. ;en
find the stone free game. ;en
find flesh and bullets. ;en
search for the album frog and the bird song. ;en
i'm looking for dead at twenty one the TV series. ;en
search for comedy underground with dave adele. ;en
show me the TV show have a nice day. ;en
find the family jams saga. ;en
please look up the song twist of shadows. ;en
play print the legend soundtrack. ;en
find returned to your mind. ;en
find the TV series one build the tower. ;en
search for the hills have eyes the beginning TV show. ;en
look for the movie darkness come alive. ;en
please fine me the east trailer. ;en
find a television show called start something star. ;en
please find me the picture of the getaway black monday. ;en
find book the music lovers. ;en
find doggy day school an album. ;en
find the photograph underneath the tree. ;en
find movie titled triumph of the spirit. ;en
find me a movie with the name ocean. ;en
find wish you were here a movie. ;en
play the great adventures of slick rick game. ;en
where to get painting of the man in the white suit. ;en
show the blue meaning television show. ;en
find a soundtrack called the christmas shoes. ;en
find racing the beam the atari video computer system. ;en
find the movie ghost me battles the hip-hop robots. ;en
show creativity of the greatest movie ever sold. ;en
find the photograph among the living. ;en
find the way west show. ;en
i want to play the video game called china seas. ;en
please help me find the video game john michael montgomery discography. ;en
went to see the dungeons and dragons chronicles of ms sarah. ;en
find an album called the aboriginal port folio. ;en
find a video game called IBM program temporary fix. ;en
find a novel called on the case with paula zahn. ;en
find a song called be quick or be dead. ;en
i want the show the sense apparatus. ;en
show the innocent when you dream saga. ;en
find me the fruit of life television show. ;en
show me NCAA college football two k three. ;en
please pull up the album the last war. ;en
where can i see the trailer of take me to the king. ;en
find time travel. ;en
find me i am mariah the elusive santos. ;en
i'd like to see a TV series called countdown the savoy sessions. ;en
find the album future of the past. ;en
where to buy book bright ambush. ;en
show the bridge of san luis rey picture. ;en
show creative picture of brenda's got a baby. ;en
where is journal of geriatric psychiatry and neurology. ;en
s h w the picture twin husbands. ;en
find trauma center new blood an album. ;en
pull up the movie toy and help yourself. ;en
find a painting called mister whiskers my favourite nursery rhymes. ;en
show the day the earth caught fire movie. ;en
where can i purchase papers in regional science the album. ;en
i'm looking for the pokémon the movie two thousand TV show. ;en
i want watch the sun and the moon. ;en
find time squared. ;en
look for the district nine novel. ;en
search for TV show live at apollo. ;en
i'm looking for the birth of a nation. ;en
find i love you too a saga. ;en
i wanna play the game pass terminator the western exterminator. ;en
find the TV series the farewell tour. ;en
find the coffin. ;en
i need journal of pediatric oncology nursing help me find. ;en
where can i find a copy of i bury the living. ;en
can you find the painting shake oh desert monterrey. ;en
find the television show riding with the king. ;en
find me shack out on one hundred one. ;en
look up the this is halloween trailer. ;en
find a photograph called the lighthouse by the sea. ;en
where can i find the picture another happy ending. ;en
can you find me the trailer of the hippocratic oath. ;en
get me information on the riverfront times. ;en
play song softly. ;en
i need to find best of the west rides again. ;en
find the video game high hopes and heartbreak. ;en
please find me asking alexandria discography. ;en
i'd like hear the song sit down and talk to me. ;en
show me the only the strong survive photograph. ;en
can you look up the clinic's TV series. ;en
please fine me ties that bind. ;en
find sailing the seas of cheese. ;en
show creativity in cross currents. ;en
find an album called just call me stupid. ;en
find the mcgill law journal movie. ;en
please find me the hanging valley movie. ;en
look for the kiss the girls game. ;en
look for summer with monika. ;en
find the mary van note show. ;en
show acta mathematics applicati syndicate TV show. ;en
where to buy an article. ;en
find the steady as she goes saga. ;en
find a song called in your eyes. ;en
show me the television show called south california purples. ;en
help me find the saga titled the eternal return. ;en
show me the video game when in rome two thousand seven. ;en
where can i find the world according to paris. ;en
find head start. ;en
find the international journal of robotics research soundtrack. ;en
find in the line of duty street war. ;en
find a painting called dorothy. ;en
go to attack of the planet smashers. ;en
where can i find appalachian journey. ;en
look for the NYPD new york police department saga. ;en
find a TV show called the traffic policeman. ;en
show of from south africa to south carolina. ;en
find a TV series called when harry tries to marry. ;en
i want to see plague soundscapes. ;en
look for all that matters. ;en
find i could fall in love. ;en
some me a healthy picture. ;en
i'd like to see the book city university of hong kong law review. ;en
find me the novel the argumentative indian. ;en
find a video game called the last american virgin. ;en
find the novel WWE legends of wrestlemania. ;en
find the garden of eden. ;en
show the family from one end street album. ;en
find the living room tapes a TV series. ;en
find me the travel weekly. ;en
find task for outlook a game. ;en
show TV show named i fell in love with a dead boy. ;en
when was the soundtrack for those were the days the best of learning ground cowboys published. ;en
find blood moon your of the wolf a movie. ;en
i'd like to see the album heroes of might and magic IV. ;en
find a TV show called perfect chemistry. ;en
find the game titled i party with victorious. ;en
find the ghost of tom jode. ;en
find a painting called politicians. ;en
can i see the the painting another life another and. ;en
search for the picture of cat. ;en
find an album called thursday night baseball. ;en
find me an echo in the darkness. ;en
show he who fears the wolf creative photograph. ;en
can i see the TV show the closer i get. ;en
search for a photograph of road hogs. ;en
listen to dragon ball music collection. ;en
search for pat and margaret. ;en
show creative song UFO sent you diet pollen. ;en
show the critic game. ;en
show olympia eighty one saga. ;en
i need a novel about polymer chemistry. ;en
show me the TV show my only wish. ;en
i'm looking for the saga play canvas. ;en
find an album called from the terrace. ;en
show creative devils to some. ;en
find clash of the codes. ;en
find a painting called the legend of tarzan dorset. ;en
find me the video game for your love. ;en
looking for liberalism and the limits of justice. ;en
find the now we are six saga. ;en
find jono and ben. ;en
find the TV series box of moon light. ;en
find the new legend of shaolin video game. ;en
can you help me find tears from a willow. ;en
search for the painting smart money. ;en
find a novel called nature reviews genetics. ;en
find a movie called living in america. ;en
look for the url. ;en
find a show called lipstick vogue. ;en
read the book journal of the bombay natural history society. ;en
what is the cheapest price for the saga called two thousand six wikipedia CD selection. ;en
find carry me in your dreams. ;en
what is just like in the old country. ;en
show me the trailer a self made hero. ;en
find the book metallica through the never. ;en
find a movie called single collection. ;en
please look up the immortals television show. ;en
what is the paranormal activity the ghost dimension album. ;en
show me the picture the afternoon. ;en
find the show portrait of countess curly. ;en
play me the show house of stairs. ;en
find me under the skin. ;en
help me find the book called journal of neuroscience research. ;en
show the show the son of tarzan. ;en
show game alien breed II the horror continues. ;en
look up the rock the blind photograph. ;en
i want to hear the soundtrack to the platinum rule. ;en
find episodi di south park a trailer. ;en
please find me the magic hour saga. ;en
please get me the before crisis final fantasy seven television show. ;en
please search the big game show. ;en
