book a reservation for a party of four within the same area of districts of sweden. 	BookRestaurant
how is the weather in mountain all of it. 	GetWeather
help me locate a game called the master of fallen tree. 	SearchCreativeWork
book a spot for two at sale creek at eight am. 	BookRestaurant
play anything from the top fifty jeff irwin record off of itunes. 	PlayMusic
would you put hammer onto the lunch playlist. 	AddToPlaylist
give enemies a love story four points out of six. 	RateBook
where can i find the TV show earth defense force twenty twenty five. 	SearchCreativeWork
what is the current position forecast for starting on july twenty second. 	GetWeather
i need to book a restaurant that has wifi far from TX for me and my parents. 	BookRestaurant
i'm looking for an album called the orchestra in project. 	SearchCreativeWork
what movies are playing one hour from now at cooper foundation. 	SearchScreeningEvent
will there be a snowstorm in slick or four hours from now. 	GetWeather
find KB theatres with movies. 	SearchScreeningEvent
please create a robbers playing at the nearest movie theatre. 	SearchScreeningEvent
show me the television show children in need rocks two thousand thirteen. 	SearchCreativeWork
book a spot for one. 	BookRestaurant
i want a list of films that are going to be shown in the neighborhood. 	SearchScreeningEvent
find a table at a joint with northern brazilian food in braga. 	BookRestaurant
book reservations at a restaurant in iron springs. 	BookRestaurant
is it cloudy in vermont on phone pm. 	GetWeather
where can i purchase a copy of the painting called glimpses of world history. 	SearchCreativeWork
add an album to my list clásicos de llegada. 	AddToPlaylist
i want to book a restaurant now in ludlow for eight. 	BookRestaurant
book a spot for krista yolanda and i in new mexico. 	BookRestaurant
what is the weather like for you to forty three weeks from now. 	GetWeather
what is the midnight forecast for argentina. 	GetWeather
play some music from the last album of nineteen eighty eight on lastfm. 	PlayMusic
what is the depression forecast for in five years in alton national park. 	GetWeather
rate my current book one. 	RateBook
advance to women of k-pop playlist. 	AddToPlaylist
play music from clark kent in the year nineteen eighty seven. 	PlayMusic
what are the showings for the natural history of parking lots movie house. 	SearchScreeningEvent
which movie theatre is playing the good guys and the bad guys. 	SearchScreeningEvent
book a table for josie carissa and lindsay at a brasserie which serves trentino. 	BookRestaurant
what time is the sea chase playing. 	SearchScreeningEvent
rate people of the lakes two of six. 	RateBook
please find me the platinum box to song. 	SearchCreativeWork
add the open door to autumn music. 	AddToPlaylist
i have a party of eight and we want to go to a restaurant that serves croquembouche. 	BookRestaurant
add a song to the para dormir playlist. 	AddToPlaylist
please pull up the trailer for stares and whispers. 	SearchCreativeWork
find games wizards play TV series. 	SearchCreativeWork
what time is the corner playing. 	SearchScreeningEvent
rate the practice of the presence of god one of six points. 	RateBook
add butterfly house to nu metal. 	AddToPlaylist
play frankie laine. 	PlayMusic
add something by arnett cobb to my la mejor música para tus fiestas playlist. 	AddToPlaylist
find a television show called the passion of the betty. 	SearchCreativeWork
please search crossing muddy waters work. 	SearchCreativeWork
play some music from nineteen eighty nine by sanjeev. 	PlayMusic
can you play something off johan larson is travelers and thieves. 	PlayMusic
add song to my mellow beats list. 	AddToPlaylist
i want to book a restaurant with a pool for five in cohen had a. 	BookRestaurant
add a tune to patrick his playlist the rhythm. 	AddToPlaylist
book a table for april twenty-second at a pub which serves creole. 	BookRestaurant
what are the movie times for amco entertainment. 	SearchScreeningEvent
rate this novel one of six. 	RateBook
add ernie hawkins to the dubstep playlist. 	AddToPlaylist
show the movies at the nearest movie house. 	SearchScreeningEvent
play phil spalding soundtrack from the seventies. 	PlayMusic
i'd like reservations for two at a pizzeria twenty two weeks from now. 	BookRestaurant
find a reservation for six at a top-rated brasserie. 	BookRestaurant
i need a table booking for a highly rated sardinian pub. 	BookRestaurant
rate deception a one. 	RateBook
play rob digging on you tube. 	PlayMusic
play some sixties music. 	PlayMusic
i want to read the novel pokémon the movie black fifteen am and white fifteen ms here. 	SearchCreativeWork
in april i would like to eat at a pub manic montana with four people. 	BookRestaurant
rate this textbook five out of six. 	RateBook
play some techno on lastfm. 	PlayMusic
i want to listen to some music from two thousand three on pandora from them. 	PlayMusic
which is the nearest cinema showing movies that start in nineteen seconds. 	SearchScreeningEvent
where can i find the saga addicted to love. 	SearchCreativeWork
find the schedule for movie times. 	SearchScreeningEvent
read the book series when robot what are the six stars. 	RateBook
i want to listen to the soundtrack adobe digital editions. 	SearchCreativeWork
book a spot for three at supper time no. 	BookRestaurant
i'd like to know the movie times for movies nearby me. 	SearchScreeningEvent
book a table at black rapids roadhouse in antarctica for nine. 	BookRestaurant
i need to book a restaurant in the same area as thompson town for me and karen johnson. 	BookRestaurant
show the feed the kitty painting. 	SearchCreativeWork
play talking to the universe on itunes. 	PlayMusic
add shame on you to my masters of metal playlist. 	AddToPlaylist
find a reservation for a restaurant in hong kong for seven people. 	BookRestaurant
what time is phil ochs there but for fortune playing at the movie house. 	SearchScreeningEvent
add this artist to romántica. 	AddToPlaylist
i would give bones of the earth two points. 	RateBook
play some music from the twenties. 	PlayMusic
rate the loneliness of the long distance runner zero points six. 	RateBook
book a restaurant in september that has highly rated northeastern for ten. 	BookRestaurant
will there be a snowstorm in info. 	GetWeather
what is the movie schedule. 	SearchScreeningEvent
add robin trower to feminist friday playlist. 	AddToPlaylist
is the films nineteen hours from now playing at landmark theatres. 	SearchScreeningEvent
the book organization of behavior deserves two points. 	RateBook
play music by don cherry. 	PlayMusic
play something by holly cole on lastfm. 	PlayMusic
what time can i see older office lady using her seductive tongue at star theatres. 	SearchScreeningEvent
show me the book it might as well be spring. 	SearchCreativeWork
will it get chillier here. 	GetWeather
i give this current book four stars and a rating of six. 	RateBook
add your shit to the thirty five soul classics nineteen seventy to nineteen seventy five playlist. 	AddToPlaylist
please put this song by nas in my hype playlist. 	AddToPlaylist
add song to punk playlist. 	AddToPlaylist
add bert mccracken tune lo que suena new york playlist. 	AddToPlaylist
play some thrash metal. 	PlayMusic
show the three tales album. 	SearchCreativeWork
add album to virales de siempre. 	AddToPlaylist
is it going to be hot in courthouse at seven am. 	GetWeather
play some dave pearce. 	PlayMusic
add teenager to the queen playlist. 	AddToPlaylist
add this artist to lo mas dance playlist. 	AddToPlaylist
play my eighty eight keys playlist. 	PlayMusic
show GD and top painting. 	SearchCreativeWork
add agua y sal in classic jazz funk. 	AddToPlaylist
i would give this novel four stars. 	RateBook
book a table for seven at a churrascaria that is highly rated. 	BookRestaurant
book me a reservation at an oyster bar that serves crab cake for two people. 	BookRestaurant
i'd like to eat at an oyster bar with a pool. 	BookRestaurant
what's the weather forecast for spain. 	GetWeather
find a video game called creators of the stock. 	SearchCreativeWork
book a table for ten people at harry's bar menu. 	BookRestaurant
can you locate the work warlock two the exiled. 	SearchCreativeWork
where is the closest cinema playing i prefer the sound of the sea. 	SearchScreeningEvent
i need to book a table for three in lesotho to. 	BookRestaurant
find what movies are showing at the nearest movie house. 	SearchScreeningEvent
search for the television show called educational psychologist. 	SearchCreativeWork
put playa fly onto my two thousand ten decade playlist. 	AddToPlaylist
revoir needed the vampire with one points. 	RateBook
i'd like to print done to my hot country playlist. 	AddToPlaylist
show me convicted. 	SearchCreativeWork
i am giving pedophilia the radical case a rating of two out of six points. 	RateBook
add the artist w g snap the walden to my billboard latin music awards finalists playlist. 	AddToPlaylist
give four stars to current novel. 	RateBook
reserve a table for nine people at a caribbean restaurant in white creek utah. 	BookRestaurant
add record how to my women of k-pop list. 	AddToPlaylist
i'd like to cease fire force. 	SearchCreativeWork
rate this album zero of six. 	RateBook
will the weather be temperate on jan the thirteenth two thousand twenty eight at christmas island. 	GetWeather
what movie theatre is playing shed no tears. 	SearchScreeningEvent
tell me the weather forecast thirteen seconds from now in ukraine. 	GetWeather
will it be rainy in SF. 	GetWeather
the current essay gets four points. 	RateBook
find changes i love story. 	SearchCreativeWork
add kansas city missouri to stress relief. 	AddToPlaylist
play play lodge by al qabliyyah on last fm. 	PlayMusic
i need a party of four to get a table reserved at a pub with southeastern cuisine. 	BookRestaurant
this novel deserves four to six stars for its writing. 	RateBook
for the book icon of evil i rate a two. 	RateBook
i want to book a cafe for three in fargo. 	BookRestaurant
play music by janet paschal. 	PlayMusic
is it going to be cloudy in my current spot for dinner. 	GetWeather
can you pull up the television show called electric boogaloo. 	SearchCreativeWork
book me a tibetan restaurant for my boss and i.. 	BookRestaurant
find a game called so long self. 	SearchCreativeWork
can you get the weather forecast for new baden. 	GetWeather
list films at pacific theatres. 	SearchScreeningEvent
play angela windows up that is popular. 	PlayMusic
i'd like to rate my beloved world two points. 	RateBook
find the movie schedule for the douglas theatre company. 	SearchScreeningEvent
will the weather close by be warmer in kentucky. 	GetWeather
include stefanie in pre-party r b jams. 	AddToPlaylist
what is the weather forecast for july twentieth phone and national park. 	GetWeather
what is the weather going to be like in leeds in south georgia and the south sandwich islands in eleven months. 	GetWeather
play fourties record. 	PlayMusic
i think that this book deserves a three. 	RateBook
i want to eat breakfast at the green restaurant certification. 	BookRestaurant
what is the movie schedule of animated movies nearby. 	SearchScreeningEvent
find at this point in time. 	SearchCreativeWork
put some mac wiseman in my latino caliente playlist. 	AddToPlaylist
on itunes play the latest anna yes copay. 	PlayMusic
when and where is destroyed watch playing. 	SearchCreativeWork
what is the PW forecast for stormy weather. 	GetWeather
add a compilation of warped music to the workout twerkout playlist. 	AddToPlaylist
can i hear a movement by rockets are gonna flake on the vimeo service. 	PlayMusic
play shara worden. 	PlayMusic
book georgetown cupcake in keller for tea time. 	BookRestaurant
book a pizza serving tavern for me and my brother. 	BookRestaurant
i need a reservation for around london borough. 	BookRestaurant
book a spot for vicki and i at a restaurant in puerto rico. 	BookRestaurant
is it cloudy here. 	GetWeather
play a tune by houston on spotify. 	PlayMusic
zero stars for this textbook. 	RateBook
i wanna watch TV series the practical pig. 	SearchCreativeWork
play the monkeys have no tails in zamboanga on google music. 	PlayMusic
what will the weather be in the current spot on phone. 	GetWeather
will there be a snowstorm around eight pm in reed island state park. 	GetWeather
rate the current textbook four of six points. 	RateBook
tell me the weather forecast one hour from now for town west nevada. 	GetWeather
i'd like the movie schedules nearby me for animated movies. 	SearchScreeningEvent
rate the chronicle ten from tomorrow a two. 	RateBook
read this thursday. 	RateBook
book a spot distant from the neighborhood on the week-end. 	BookRestaurant
adler where to my evening commute playlist. 	AddToPlaylist
play some music on last fm. 	PlayMusic
i need to take three people to eat. 	BookRestaurant
add kaya newest track to my i love my are and be playlist. 	AddToPlaylist
i'd like to watch animated movies at national amusements. 	SearchScreeningEvent
i'd like for you to add owen biddle to my old school death metal playlist. 	AddToPlaylist
play some dream music. 	PlayMusic
play this is animal collective please. 	PlayMusic
rate this series one of six. 	RateBook
find a photograph called between the days. 	SearchCreativeWork
give this book zero stars. 	RateBook
this saga deserves a score of four. 	RateBook
for the curious incident of the dog in the night dress i read that few of six points. 	RateBook
book a table for ten for breakfast in minnesota. 	BookRestaurant
what are the movie times of films in the neighborhood. 	SearchScreeningEvent
add this track to the playlist named cali fire. 	AddToPlaylist
add gregg business to my us latin top fifty playlist. 	AddToPlaylist
please give me information on when prisoner of xander will be shown. 	SearchScreeningEvent
i give this book a five. 	RateBook
add this tune to my rockabilly mania. 	AddToPlaylist
play a track by alpha blondie with deezer. 	PlayMusic
find a photograph called cold weather. 	SearchCreativeWork
can you find the movie accidentally in love. 	SearchCreativeWork
search for teenage mutant hero turtles followed the fridge clan photograph. 	SearchCreativeWork
find the schedule for blood orgy of the leather girls at a movie house. 	SearchScreeningEvent
will it be warmer in MT falls state park. 	GetWeather
play something am i. 	PlayMusic
ad czarna instrumental madness playlist. 	AddToPlaylist
show the movie times. 	SearchScreeningEvent
i want to book an ethiopian bar for this afternoon. 	BookRestaurant
will there be a storm in palm city west virginia. 	GetWeather
add this track to clásicos del hip hop espanol. 	AddToPlaylist
please put this artist on my indie mim playlist. 	AddToPlaylist
i'm looking to get reservations for me jillian and luella a restaurant that is faraway from TX. 	BookRestaurant
what is the humidity like in laredo to. 	GetWeather
rate the courtship of princess leia saga a two. 	RateBook
what's it feel like in north gulfport. 	GetWeather
show me the game english repeat. 	SearchCreativeWork
make me a reservation for elvira and i in brazil. 	BookRestaurant
find book in the valley. 	SearchCreativeWork
book the library cafe in ethiopia for six people. 	BookRestaurant
book a popular restaurant for two which is distant from avalon. 	BookRestaurant
put this track on musica española twenty seventeen. 	AddToPlaylist
what time is atlantis terre angler he playing. 	SearchScreeningEvent
what time is thick as thieves playing at santikos theatres. 	SearchScreeningEvent
who is brad a restaurant that serves meatballs in VT. 	BookRestaurant
i need to hear some music from spotify. 	PlayMusic
what is the weather in CT. 	GetWeather
play any song from two thousand one. 	PlayMusic
give the phantom ship a zero. 	RateBook
rate this novel four stars. 	RateBook
i need a reservation for harveys this winter in neighboring wisconsin for terri and i. 	BookRestaurant
when can i we watched great balls of fire vampy the full co. 	SearchScreeningEvent
what time does the maze start at cineplex odeon corporation. 	SearchScreeningEvent
play wanted by erykah badu. 	PlayMusic
rate the current novel one out of six. 	RateBook
add a track to summer of love. 	AddToPlaylist
play the widow of st. 	SearchCreativeWork
find a TV show called zen the music of fred katz. 	SearchCreativeWork
what movie schedules at consolidated theatres. 	SearchScreeningEvent
i'd like to eat at the best restaurant in carlton. 	BookRestaurant
add ana carolina to chill. 	AddToPlaylist
add this song to my fairy tales. 	AddToPlaylist
give four out of six stars to the nightmare lands. 	RateBook
show movie schedule. 	SearchScreeningEvent
what will the weather be like on august first twenty twenty six in maryland. 	GetWeather
add bedroom jams to album. 	AddToPlaylist
add the principle of angelica to my domingo indie palylist. 	AddToPlaylist
add tim ryan to my grime shutdown playlist. 	AddToPlaylist
i want to see the movie schedules for animated movies around here. 	SearchScreeningEvent
rate this book four points. 	RateBook
find movie schedules for me. 	SearchScreeningEvent
will it be warm and healing islands. 	GetWeather
add tune to my relax and unwind playlist. 	AddToPlaylist
show me movie schedules. 	SearchScreeningEvent
play the song s. f. sound furniture. 	SearchCreativeWork
rate my current album five points. 	RateBook
i want to book a close restaurant in SC for seven. 	BookRestaurant
play bob hilliard top-twenty music. 	PlayMusic
where is the closest movie house that's playing the mark. 	SearchScreeningEvent
give the spirit house a four out of six. 	RateBook
book for three in u. s. virgin islands. 	BookRestaurant
play me a top charting album. 	PlayMusic
look up the cool cafe cool tape volume one video game. 	SearchCreativeWork
will there be a storm on christmas day in my current place. 	GetWeather
i'm wondering if i can watch heyy why baby why the cinema. 	SearchScreeningEvent
book a distant restaurant that serves blini on one hundred third st for six people. 	BookRestaurant
please provide the rainbow mars series a zero out of six points. 	RateBook
add of six stars the last novel gets only four. 	RateBook
in google music play the top singles released in nineteen seventy two. 	PlayMusic
i want to rate the ingenuity gap three out of six. 	RateBook
show movie times for animated movies nearby. 	SearchScreeningEvent
u the movie showings for the closest cinema showing international. 	SearchScreeningEvent
table in cafe SR 1. 	BookRestaurant
what is the chilly forecast for north carolina. 	GetWeather
find a show called but on. 	SearchCreativeWork
will there be a blizzard in saudi arabia around two o'clock. 	GetWeather
play listen to the mocking bird by billy martin on you tube. 	PlayMusic
play me the song the french chef. 	SearchCreativeWork
what is the weather forecast tomorrow in french beauty. 	GetWeather
can i listen to music from the easy listening genre. 	PlayMusic
show me the advocate. 	SearchCreativeWork
give this album a three. 	RateBook
give five out of six stars to creatures of light and darkness. 	RateBook
what is the movie schedule for the cooper foundation. 	SearchScreeningEvent
show creative photograph of when they'll heart of winter. 	SearchCreativeWork
read three out of six points to the dark world detective. 	RateBook
find movie times. 	SearchScreeningEvent
play some jungle music on iheart. 	PlayMusic
give the current novel five points. 	RateBook
give this novel a rating of one points. 	RateBook
find a painting called the wipers times. 	SearchCreativeWork
what is the forecast starting at eight pm for alaska. 	GetWeather
find a soundtrack called the alice cooper show. 	SearchCreativeWork
tell me when it'll be cloudy in one part. 	GetWeather
where and when can i see the image makers. 	SearchScreeningEvent
can you add honey hush to hits of the sixties. 	AddToPlaylist
i'd rate this novel at two points. 	RateBook
find a table for two at a restaurant in saint vincent and the grenadines. 	BookRestaurant
what will it feel like on patriots day on south georgia and the south sandwich islands. 	GetWeather
is it going to be temperate at six am in washington. 	GetWeather
play some nineties charles thompson. 	PlayMusic
add this track by horace andy to acoustic soul. 	AddToPlaylist
book a russian restaurant for four people. 	BookRestaurant
find a coffeehouse in illinois for three. 	BookRestaurant
where can i see travelling light. 	SearchScreeningEvent
play the most popular stuff by tina did go. 	PlayMusic
will there be fog tonight at beamer memorial conservation area. 	GetWeather
book for crepes at a restaurant in saint martin. 	BookRestaurant
make this essay two out six stars. 	RateBook
book a reservation for eight at a restaurant that serves chicken fried bacon in aruba. 	BookRestaurant
what is the weather supposed to be like at sunset in cosby kansas. 	GetWeather
what movies are playing in the neighborhood. 	SearchScreeningEvent
book a table at the vortex bar and grill on alaska day in the state of rhode island. 	BookRestaurant
hannah lewis and chelsea want to go to a cafe in botswana on apr seventeen twenty twenty four. 	BookRestaurant
i'd like to hear songs from iheart. 	PlayMusic
play the album alas y races by dave. 	PlayMusic
rate this textbook zero stars. 	RateBook
add appreciation day to my folksy love. 	AddToPlaylist
add a song to my playlist a peaceful rush hour. 	AddToPlaylist
play some seventies songs from joseph dinheiro on google music. 	PlayMusic
need to find a creative work with the title sometimes the blues is just a passing bird. 	SearchCreativeWork
play some google music. 	PlayMusic
show the immortal grand prix. 	SearchCreativeWork
find goodrich quality theaters films. 	SearchScreeningEvent
play some sixties music on slacker. 	PlayMusic
will it get foggy in spring hill. 	GetWeather
when is playing. 	SearchCreativeWork
find a TV show called engaged to the unidentified. 	SearchCreativeWork
play nineteen sixty six theme music on slacker. 	PlayMusic
is it going to be snowy here. 	GetWeather
i need a table for eight people at a restaurant in district of columbia. 	BookRestaurant
give the current essay a rating of zero out of six stars. 	RateBook
play some music from two thousand eleven on lastfm. 	PlayMusic
find me a game called space lol. 	SearchCreativeWork
book a table for eight people please. 	BookRestaurant
play miss to so bladder. 	SearchCreativeWork
play lukasz got will the album on zvooq you. 	PlayMusic
what is the weather forecast for city russia. 	GetWeather
play some movement by dj spinner. 	PlayMusic
i'd like to eat at the firehouse restaurant. 	BookRestaurant
add track by clint to win a fridge to camino at class a playlist. 	AddToPlaylist
find a saga called the life of riley. 	SearchCreativeWork
does the forecast show a storm in the akita NH around july sixth. 	GetWeather
get me a table at the hand and flowers for sixteen hours. 	BookRestaurant
i would like reservations to a popular pub in burkina for ten people. 	BookRestaurant
i give nothing lasts forever five out of six points. 	RateBook
will it be warmer at lunch in printed armenia. 	GetWeather
play chant music by ira los go on iheart. 	PlayMusic
find the hopeless romantic photograph. 	SearchCreativeWork
book me a restaurant ten minutes from now. 	BookRestaurant
i want to add johnny burke to the country bound playlist. 	AddToPlaylist
what is the temperate in uintah right now. 	GetWeather
add tune to south by southwest fresh playlist. 	AddToPlaylist
play funtime activity. 	PlayMusic
please look for the TV show memoirs from a bedroom if you want. 	SearchCreativeWork
what's the weather in u. s. virgin islands. 	GetWeather
add sam sparrow to my playlist called beach vibes. 	AddToPlaylist
will it be chillier at phone and where can radio on. 	GetWeather
what will the weather be here. 	GetWeather
pull up the house for july sixteenth two thousand twenty seven. 	BookRestaurant
i'd like to see the picture chrome dreams. 	SearchCreativeWork
give this essay a rating of five. 	RateBook
play a scott love soundtrack. 	PlayMusic
find a soundtrack called new religion. 	SearchCreativeWork
rate cousin bette five points. 	RateBook
make reservations for seven people at a top-rated brazilian pub around rockaway park beach one hundred sixteenth. 	BookRestaurant
find all about aubrey. 	SearchCreativeWork
which films are playing at the closest movie house. 	SearchScreeningEvent
look for a photograph of i wanna sex you up. 	SearchCreativeWork
what a table at monies hotel secunderabad in the state of vermont. 	BookRestaurant
book for sherry and concepcion in jamaica at the best restaurant. 	BookRestaurant
what is the price for the album praise the lord and pass the ammunition. 	SearchCreativeWork
give two for this essay. 	RateBook
when is blood and ice cream trilogy playing at the nearest movie theatre. 	SearchScreeningEvent
show family plot. 	SearchCreativeWork
what will the weather forecast be during the kent state shootings remembrance in el coke in national park. 	GetWeather
find a game called gladiators australian series one. 	SearchCreativeWork
read this book three out of six. 	RateBook
find the flying ace. 	SearchScreeningEvent
where can i buy the something borrowed saga. 	SearchCreativeWork
can you get me seating for five people one minute from now in tuvalu. 	BookRestaurant
find a reservation at the rosemont theater at ten pm. 	BookRestaurant
i need work of father dearest. 	SearchCreativeWork
which animated movies are playing at fox theatres. 	SearchScreeningEvent
