expression;language
find the boys in the band. ;en
show me half a life. ;en
where can i watch the trailer for home economics. ;en
look for the novel behind closed doors. ;en
please help me search the TV series a mouse divided. ;en
i want to watch the original recordings. ;en
fine finally famous. ;en
find journal of the society for american music. ;en
find a book a bond is HQ. ;en
show creativity of accident analysis and prevention. ;en
where do i play the video game the wild geese. ;en
find resurrection of evil. ;en
show me url. ;en
find the american journal of sports medicine picture. ;en
find stays in mexico. ;en
please look up two more years soundtrack. ;en
play the video game the sparrow. ;en
find the book the crowd roars. ;en
find the best man holiday saga. ;en
please find the novel good doctor. ;en
show creativity cum on feel the noise the video game. ;en
please look for catch a falling star. ;en
look for the nightmare on providence street saga. ;en
find reproductions songs of the human league. ;en
show schedule first sensation. ;en
can you help me find a picture called olympia nineteen seventy four. ;en
where can i find a photograph of the lieutenant of interest more. ;en
find projections an album. ;en
download the red eagle TV show. ;en
find a song called magic in the water. ;en
show thousand miles movie. ;en
i want to read the novel love is in control. ;en
i'd like to see the river of stars TV series. ;en
find me the photograph the late music. ;en
show the philosophy and phenomena logical research saga. ;en
show me the painting live very live in concert. ;en
please get me the island show. ;en
show me a copy of the picture double deal. ;en
find me the when harry tries to marry photograph. ;en
find a book called the CIA world fact book. ;en
show force of nature. ;en
find the work i looked up. ;en
show creative game fear thy neighbor. ;en
show the creativity of where what when. ;en
i need to find the creative work prince hours. ;en
find a soundtrack for lords of the rising sun. ;en
please look up the lamentable journey of omaha bigelow into the impenetrable loisaida jungle television. ;en
where can i see the movie across the line exodus of charlie wright. ;en
look for the editor and publisher TV series. ;en
find a novel called a perfect day. ;en
find playstation a song. ;en
find the magical world of roger whittaker. ;en
find loved ones for me. ;en
show texas review of entertainment and sports law creative song. ;en
find me recorder and. ;en
find cluster computing a game. ;en
play the ashley tisdale discography TV show. ;en
what is the trailer for feel the passion. ;en
i'd like to see the trailer for history and theory. ;en
find join the dots besides and ready. ;en
show me the best of volume one TV series. ;en
show me a picture of nokia football crazy. ;en
play the sea cabinet. ;en
show the information on history picture. ;en
search for the picture boomtown. ;en
find a TV show called directions home. ;en
play the TV series effortless agitation of bright red blood. ;en
what is marty stuart discography. ;en
find television show on windows live TV. ;en
please get me rough and ready saga. ;en
find the TV show starship titanic. ;en
search for the halfway home TV show. ;en
locate the koi to send your chocolate television show. ;en
find me the wild boys. ;en
find live at burnsville theatre. ;en
how do i find the soundtrack african development perspectives yearbook. ;en
i want to see the trailer for the entity. ;en
i'd like to see the photograph the light. ;en
show creative photograph island in the sea. ;en
i wanted to see the novel the green. ;en
i wanna watch the television show naked to. ;en
help me the find the thug lawrence trilogy book. ;en
find the youth against christ saga. ;en
find the tyrant. ;en
where is the TV show am universe. ;en
can you find a photograph of ace ventura the cd rom game. ;en
where can i find the TV show metallica lights. ;en
find the one hundred eighty. ;en
show the monkey soundtrack. ;en
find valley of the dolls. ;en
find NHL on fox. ;en
find an album called list of re enter passwords. ;en
when was the TV show crazy sexy cool taken off air. ;en
find the movie i really. ;en
find a novel called twins of evil. ;en
find a book called the mad magician. ;en
find trailer for iraq for sale or property yours. ;en
show investigating sex album. ;en
please look up on that handy. ;en
find amanda palmer goes down under. ;en
i'd like to watch the TV series called fires of life. ;en
pull up mafia the city of lost heaven. ;en
find the trailer for hit the ice. ;en
show creative last light. ;en
please find the infrared riding hood TV show. ;en
i'm hoping you can find a photograph from live at the isle of wight nineteen seventy. ;en
i want to play the game show me the wonder. ;en
want to find the novel called innocent until caught two guilty. ;en
find the girlfriend experience a television show. ;en
where can i watch the TV series breed the pain. ;en
search for the dark side of the mind movie. ;en
i'd like to play the album beloved rogues. ;en
find TV series titled sonata mix dwarf cosmos. ;en
where can i view the picture of workin with the miles davis quintet. ;en
find a soundtrack called i still believe in you. ;en
what painting is on the cure discography. ;en
get me the elvis christmas album TV show. ;en
find the fields of sacrifice movie. ;en
show creativity of comeback season. ;en
find switching channels. ;en
show the night riders. ;en
i'm looking for the TV series called unborn. ;en
i want to find the video game masada anniversary edition volume three the unknown masada. ;en
bring up the book perfume the story of a murderer. ;en
find chant down babylon the island anthology. ;en
find playground a book. ;en
find a novel called best hits live save the children speed live two thousand three. ;en
i'd like to see the paul murray live television show. ;en
i'm looking for paris match. ;en
i want to play the video game miss castaway and the island girls. ;en
play nights nantucket soundtrack. ;en
can you get me the trailer of the multiversity. ;en
look up the dock of the bay show. ;en
i want to listen to the music of ghost in the shell stand alone complex. ;en
find long hello and short goodbye a movie. ;en
where can i buy a photograph called feel the love. ;en
find the painting strong enough. ;en
find the television show called tactics. ;en
find live at memory lane. ;en
show creative album humidity. ;en
play me memoirs of modern love curious age. ;en
find a show called big broadcast of nineteen thirty eight. ;en
show creative soundtrack pitch black brigade. ;en
search for polish assault. ;en
show transformers the game. ;en
where can i find the brave little toaster to the rescue book. ;en
find the show the naked gun. ;en
i'd like to find the soundtrack tianjin today evening news. ;en
find the picture of the harsh light of day. ;en
pull up the book live in and released the radio show. ;en
find a video game called the yellow claw. ;en
look up holy water. ;en
show me live at the kings center. ;en
find me the spartan total warrior painting. ;en
find a trailer called peggy sue. ;en
find the ultimate gift a television show. ;en
where can i view the TV series of w. i. t. c. h.. ;en
find a book called environment and behavior. ;en
i want to listen to the song only the greatest. ;en
find by title champagne showers. ;en
find me the martin morning saga. ;en
find a movie called emerald city. ;en
where can i view the photograph of johnny cool. ;en
play me the soundtrack ready. ;en
find pursuit of radical rhapsody. ;en
show creativity of adobe air. ;en
play the ball to throw a ball saga. ;en
find a TV show called studies in logic. ;en
find the picture vertically challenged. ;en
can you locate west coast wrestling connection. ;en
find me the novel between the rivers. ;en
play me the song asap the ac nada. ;en
show the creativity of ghost dragon of cold mountain. ;en
find me the album the demon. ;en
i want to read the novel alone at the microphone. ;en
show fifty words for snow creative picture. ;en
find a movie called number one in heaven. ;en
show creativity of book future of the past. ;en
play the aviation cocktail album. ;en
give me the spirit the earth of losing tv show. ;en
show TV show schedule url. ;en
find the great hydration a TV series. ;en
i want to read the book between a rock and a hard place. ;en
i want to read mad money. ;en
where can i locate leo the lion for purchase. ;en
how can i view the show corpus home movie about selena. ;en
i'm looking to find the trailer for brought by the sea. ;en
find as live as it gets. ;en
find the show card. ;en
find a picture. ;en
find a trailer called hellboy the troll witch and others. ;en
find the album titled. ;en
show me skyfall original motion picture soundtrack. ;en
how to buy picture of agent hamilton but not if it concerns your daughter. ;en
find the labyrinth game. ;en
find the sentimental bloke novel. ;en
look for the girl in mirror movie. ;en
find the soundtrack titled this side of paradise. ;en
play the song culture and psychology. ;en
find car or live in re loaded. ;en
play me the trailer for star control. ;en
find a painting called smash crusher. ;en
where can i find the photograph of mr bobby. ;en
find the politics nation without stopping. ;en
find a painting called the book of folly. ;en
wish to fins a television show called whole again. ;en
search for a picture of darker than black. ;en
find a photograph called news paper. ;en
show the legend of jesse james novel. ;en
want to find a creative work called the prayer. ;en
can you help me find skylar made. ;en
find a TV show called ace of spades. ;en
play the movie post inferno soundtrack. ;en
show creativity in call me joe. ;en
find me the soundtrack called enter the chicken. ;en
where can i see the television show falling away from me. ;en
where to buy education for chemical engineers. ;en
find the many loves of derby girls. ;en
find five came back for me. ;en
find the picture music is the message. ;en
get jump down painting. ;en
show creativity in the red saga. ;en
find a novel called under blackpool lights. ;en
find a TV series called dirty politics. ;en
give me a link to the a little something for us to empanada soundtrack. ;en
can you find the song bleach hell chapter. ;en
please find brand new strings. ;en
find a television show called i got a bag of my own. ;en
find a video game called peaches discography. ;en
is there a program about the last flight. ;en
show creative picture of the secret doctrine. ;en
help me find the work graphics animation system for professionals. ;en
show me the out with my baby photograph. ;en
show me the picture batman the long halloween. ;en
please look up the beauty on the fire show. ;en
find me the memorial. ;en
search for the long dark. ;en
i wanna watch the television show new astronomy. ;en
looking for the photograph the crimson climax. ;en
i'm looking for sherlock holmes contre are some blue pin. ;en
please fine me worms clan wars. ;en
looking for video game for those who would walk with the gods. ;en
find me the karl hess toward liberty photograph. ;en
show a family torn apart TV show. ;en
find me the picture live in paris nineteen seventy five. ;en
where to buy painting. ;en
can i see the encounters. ;en
play the lord of the mask song. ;en
find the prince of temple street a picture. ;en
show the glass cloud single TV series. ;en
find five spanish songs a photograph. ;en
i want to see breathless. ;en
show me the television show the science of breath. ;en
find a painting called break down. ;en
find sweet sensation. ;en
how can i watch the television show straight shooter. ;en
looking for free four tobias tells the divergent knife throwing send. ;en
i'm looking for a picture of fresh air. ;en
show me the trailer for live phish volume twelve. ;en
find a painting called boating on the river. ;en
show me your talks the column. ;en
i'm looking for the television show titled justice league. ;en
find a game called the life and loves of tchaikovsky. ;en
play me the show cheaper by the dozen two. ;en
play the TV series heart of gold. ;en
show the TV series the merry sisters of fate. ;en
can you please look up the game the islanders. ;en
show me the movie black summer. ;en
find digimon next. ;en
find american psychologist a game. ;en
i am looking for the TV show called the flight of the lost balloon. ;en
can you find a photograph entitled beneath the harvest sky. ;en
can you locate the novel is more family. ;en
find a video game called young. ;en
find a photograph called the wish list. ;en
find the novel the last of sheila. ;en
please look up the around the world in eighty days movie. ;en
play the home is where the music is TV series. ;en
i wanna watch the show frank sinatra sings the select sammy cahn. ;en
where can i view the photograph the phantom horse. ;en
play the song red lanta. ;en
find a picture called cahoot. ;en
where can i watch the TV show terrorists the kids they sentenced. ;en
where can i see the trailer for phineas redux. ;en
find a show called star trek star fleet academy starship bridge simulator. ;en
find the show the demi god and semi devils. ;en
find the photograph jboss enterprise SOA platform. ;en
find the game a russian beauty and other stories. ;en
find the burn the sky down album. ;en
i want to play the game guitar heaven the greatest guitar classics of all time. ;en
please find me the rear mirror saga. ;en
is the TV show the prodigal wife on today. ;en
find once upon a time in the west. ;en
i want to see the trailer amor puro. ;en
find she monkeys. ;en
find a world apart. ;en
i want to read the book the minotaur. ;en
find the song called international journal of bilingual is am. ;en
where do i purchase the book babysitter. ;en
i'm looking for the music of nashville season three saga. ;en
find the creeper. ;en
look for global clubbing the netherlands. ;en
where can i find the painting RSS tracking. ;en
find becoming going. ;en
please get me the work shirley. ;en
find returned to cry. ;en
search for big ideas painting. ;en
where can i view the photograph dinosaur from the deep. ;en
play the TV series bet awards two thousand thirteen. ;en
can i get the game list of mew singles. ;en
show creative video game name for rose to john greco. ;en
show me the caribbean blue television show. ;en
find the good wife. ;en
give me a link to the saga called copper justice is brutal. ;en
find the photograph hearts burst into fire. ;en
please find me the game called the salvation. ;en
find the dress maker. ;en
i want to find a book called cash cash. ;en
find back for good a novel i want to read. ;en
show creativity of the game everything at once. ;en
show an actress for the newest album is here. ;en
please search cardin in australia saga. ;en
find three hundred march to glory a song. ;en
find the from the hut TV series. ;en
show creativity of night of the hunter. ;en
what does for all the wrong reasons look like. ;en
find the album smoke and mirrors. ;en
i'm looking for a photograph called merry christmas. ;en
find boyish story. ;en
show creativity of the house of the dead. ;en
i'd like to see the the gathering storm TV series. ;en
looking for kepler scientific workflow system. ;en
find the game just dance greatest hits. ;en
i want to watch a movie god slayer. ;en
find the trailer for bill cosby presents the state of emergency. ;en
where can i purchase a copy of the photograph on the front page of today's jacksonville daily. ;en
play a box of birds trailer. ;en
show schedule for loved by thousands. ;en
play the hell of a life movie. ;en
help me find the work unite and win. ;en
find the movie shake your spirit. ;en
show me the movie haunted spooks. ;en
search for chasing fortune a TV series. ;en
can you find the soundtrack for fast food nation. ;en
find a show called the paper route. ;en
is there a chinese wikipedia. ;en
show me the trailer for american education the national experience. ;en
what is the michael moore is a big fat stupid white man video game. ;en
find bank act. ;en
find seduced by madness a trailer. ;en
find the saison seven de how i met your mother show. ;en
i want sugar foot. ;en
i am looking for a work called carry you home. ;en
find me the balance. ;en
when is city of angels playing. ;en
look up the gun soundtrack. ;en
find the album the peace maker. ;en
find the sarah the teen princess game. ;en
try to find the picture advances in ecological research. ;en
where can i view the photograph occasional wife. ;en
find a work with the name of come saying. ;en
look for all broken up and dancing which is a video game. ;en
show me the lowest price for the game sinatra reprise very good years. ;en
where can i find the game kia newspaper. ;en
i want to read the book crash landing. ;en
search for the catcher and rich show. ;en
where can i find the show game of death to. ;en
find the rewind the film TV show. ;en
please find the album the party scene. ;en
where can i listen to the soundtrack of gibraltar britain in the sun. ;en
find the show titled the most charming and attractive. ;en
find confusion bay. ;en
find a TV show called frontiers in ecology and the environment. ;en
where can i find richard the lion heart rebellion. ;en
show me the saga elsewhere. ;en
are there any painting of the first concert oh yeah nineteen ninety nine. ;en
find remedial chaos theory a soundtrack. ;en
find waiting for touchdown a book. ;en
go to after dusk they come. ;en
search for to heart two. ;en
i need the game the ARIA music show. ;en
find the painting the adventures of teddy rocks been. ;en
find the another ticket game. ;en
please find the show kim jong discography. ;en
show me the photograph of king charles. ;en
look up adobe brackets soundtrack. ;en
need the saga called the black lamp. ;en
show me the lights out saga. ;en
i'd like to see the saga song of the orioles. ;en
find TV series titled a life in the death of joe meek. ;en
find a soundtrack called tied to a star. ;en
search for the examples of time book. ;en
i'm looking for the video game called the supernatural events on campus. ;en
i want to play the video game ESPN major league soccer. ;en
get me a photograph of trac. ;en
show chocolate rain creativity. ;en
find a TV series called white bread black beer. ;en
show me the i can hear the sea movie. ;en
show me the album three songs about lenin. ;en
i am looking for the complete fillmore east concerts. ;en
find donkey town a show. ;en
play the soundtrack for back to the future. ;en
where can i find sebastien grainger and the mountains. ;en
play keep your right up song. ;en
find a movie called greatest time of year. ;en
where can i listen to willy and the poor boys. ;en
can you pull up my name is brain brian. ;en
find wish you were here. ;en
find a valentine's sweet. ;en
find the digital champ battle boxing. ;en
find the son of man show. ;en
show creative photograph named none of the above. ;en
show the lateness of the hour. ;en
find business ethics european review. ;en
find me the book filthy live. ;en
play the lousy dance trailer. ;en
look for conducting from the grave. ;en
find the saga a very school girls holiday. ;en
find a television show called swing high. ;en
i'm looking to find kiss me goodbye. ;en
i am looking for the TV show titled catchphrase. ;en
can you find me the work titled a little curious. ;en
please search the title the twilight saga breaking dawn part two. ;en
find a saga called the devil went down to georgia. ;en
where can i get my horror. ;en
look up the brave archer two. ;en
find me the show crypto the super dog. ;en
where can i purchase paradise tonight online. ;en
search for the adventure of the blue carbuncle. ;en
find the cartel volume to novel. ;en
show creativity of official history of australia in the war of phone. ;en
find a picture called every little thing she does is magic. ;en
please find me the book step into my groove. ;en
i'd like to hear the soundtrack for just once in my life. ;en
find a soundtrack called pax warrior. ;en
look for the chu chu and the philly flash picture. ;en
find a book called the echo chamber. ;en
i'd like to watch the TV series sailor moon super the movie. ;en
find the trailer for seven year itch. ;en
search for the adventures of cookie and cream. ;en
find the ghostly swim two book. ;en
where do i see the trailer for live dates. ;en
fine. ;en
find a photograph called the difference. ;en
find me the book my people were fair and had sky in their hair but now they're content to wear stars on their brows. ;en
find the gill deacon show. ;en
can you find me the stand proud book. ;en
look for the saga called death in paradise. ;en
find the TV series from the top. ;en
where can i get the album so fresh the hits of spring two thousand eleven. ;en
book of two for the road. ;en
who published the novel james addition. ;en
i'm trying to find a show. ;en
where can i purchase the book scales of justice. ;en
play me the TV show seal team. ;en
i want the photograph of elizabeth the queen. ;en
show creativity in photograph of grace submerged. ;en
i am looking for the work nikki. ;en
find the TV show when i was a boy. ;en
find a picture called blink of an eye. ;en
where to get album justified. ;en
search for another cinderella story. ;en
play the future of active infestation trailer. ;en
find a game called the guyra ghost mystery. ;en
i'd like to find scriptures of the golden eternity TV series. ;en
go to the movie the best of pirates of the mississippi. ;en
i'd like to watch the trailer for dungeons and dragons chronicles of my stara. ;en
i want the video game southwest riders. ;en
please search the word revolution. ;en
show me the TV series prescription for death. ;en
find love will tear us apart a photograph. ;en
show creative video game in my own backyard. ;en
find a soundtrack called fast as you. ;en
read the black body theory and the quantum discontinuity novel. ;en
find the novel playlist the very best of brad paisley. ;en
show me the show live at the fillmore east. ;en
find a song called this champagne mojito is the last thing i own. ;en
can you find me a trailer for phineas redux. ;en
find a book called follow me. ;en
play keep their heads ringing. ;en
get the video game of the chipmunk song. ;en
look up the game called the long morrow. ;en
find the movie curl. ;en
show me the painting called the descendants. ;en
find a TV series called cocktail kings. ;en
show me the edge of love photograph. ;en
find face the truth a TV show. ;en
show book of pokemon the mastermind of mirage pokémon. ;en
where can i purchase the game dancing in the dark ten years of dancing ferret. ;en
find a TV show called ride the wind. ;en
find a TV series called live hearts. ;en
find a movie called the easy way to stop smoking. ;en
i need a book called student demonstration time. ;en
play the seamus. ;en
where can i watch the picture i'll take care of you. ;en
search for man in a garage. ;en
show second generation album. ;en
find a game called an aerial joy ride. ;en
play me the soundtrack for nothing personal. ;en
i'm looking for sixteen thirty for the ram rebellion. ;en
play me a trailer for the northwest passage. ;en
show me the live legend nineteen ninety nine and nineteen ninety seven apocalypse TV show. ;en
i'd like to see the new jungle. ;en
looking for novel build engine. ;en
i'm looking for the novel from a scream to a whisper. ;en
find me the picture called bugs bunny nips the nips. ;en
play the graduate faculty philosophy journal album. ;en
where can i find the creative works the very best of simply red. ;en
i'd like to hear the song in a reverie. ;en
find a game called a very special christmas seven. ;en
play me the saga the party's over. ;en
help me locate the tristan betrayal. ;en
what is love in a mist. ;en
i wanna watch supernatural the unseen powers of animals. ;en
i'm looking for a novel called and then there was light. ;en
show me the song spiderman of the rings. ;en
get me kiss the crystal flake. ;en
i'm looking for the painting god must have spent a little more time on you. ;en
show me the song the incredible hulk returns. ;en
can you find me the movie the countess. ;en
hook me up with a song by dancing girl. ;en
show me the old email and the three cats. ;en
find the TV series the almighty johnson's. ;en
find the dead smiles to soundtrack. ;en
go to the saga the quantum thief. ;en
find the show the sword of el lector. ;en
find family feud novel. ;en
search for video game the sky is crying. ;en
where can i purchase the TV series liar game the final stage. ;en
i'm looking for circus world. ;en
show me happiness was free. ;en
please look up the four hour workweek saga. ;en
what is the picture called lest we forget the best of. ;en
find the TV show hot air. ;en
please search for the live in san juan capistrano picture. ;en
find a show called some kind of dangerous. ;en
can you help me search the album titled playmaker. ;en
play the new bins of attorney a trailer. ;en
i'm looking for the. ;en
find an album called stumble stop repeat. ;en
find a novel called episodi di sons of anarchy. ;en
play remains of the day. ;en
i'm looking for the movie white unicorn. ;en
i'm looking for the video game masterful mystery tour. ;en
where can i get the video game faith in chaos. ;en
find a movie called right here right now. ;en
find a song called you cross my path. ;en
play the song memories are my only witness. ;en
show saison five de game of thrones. ;en
