expression;language
Look for All Broken Up and Dancing which is a video game;en
 The Garden  Eden ;en
Find a TV show called Union.;en
I want to read the saga Michael Clayton;en
 the photograph The Remix  ;en
I want to see the TV series A State of Mind;en
find a saga called Shame on You;en
 a  called American Journal  Play. ;en
find Young Miss Holmes;en
 creativity  What  Dead May Never Die ;en
Please search for The Legend of Korra book.;en
Where can I purchase the book Scales of Justice;en
 you  up the Galsoft Linux  series? ;en
help   the  called Journal  Neuroscience Research ;en
i want to play the video game called China Seas;en
I'd  to hear the  Daimidaler:  vs Penguin  ;en
 a   Pesterminator: The Western Exterminator ;en
Where is picture Everybody Wants You;en
 creative video game   Own Backyard ;en
I'm looking for a novel called The Adventures of Lolo II;en
 a photograph  The Dickinsonian. ;en
I want to    to  2: Armageddon. ;en
  All Broken Up  Dancing which  a video game ;en
show creativity  Call  Joe ;en
Find a movie called Greatest Time of Year.;en
 the  The Son  Tarzan ;en
Find a saga called The Devil Went Down to Georgia.;en
  the Out with  Baby photograph ;en
I'm   the  The Hardest Part ;en
  the Young Doctors  Love TV show ;en
Find the Labyrinthe game;en
play the Baldur’s Gate II: Throne of Bhaal saga;en
Can you find me the Spectres television show?;en
Show me Tears On My Pillow.;en
show creativity of video game Labyrinth;en
Please search the work, Eve-Olution.;en
 The Lousy Dance  ;en
   search the TV series A  Divided. ;en
I'd like to watch Miss Congeniality;en
I'm looking for the trailer to Evil or Divine - Live in New York City.;en
 you  the album SimpleScreenRecorder ;en
I'm looking for the work titled Converging Conspiracies;en
  the  All I Need to Know ;en
 The Way West  ;en
find a TV show called Ruthless;en
Find me The River of Love saga;en
Find Night of Passion;en
I  to  the So Nice  ;en
find the trailer for Hit the Ice;en
 creativity  Construction Project Information Committee ;en
  I  the latest episode  the TV  Chu Chu  the Philly Flash? ;en
find the video game called Turnin Me On;en
Show Transformers: The Game;en
I'd  to  the  The Light ;en
find a video game called IBM Program temporary fix;en
Find me the documentary A Winter of Cyclists;en
look  the game  Another Way ;en
Please search A New Machine TV series.;en
want to find the novel called Innocent Until Caught 2: Guilty;en
Looking for the photograph the Crimson Climax;en
How can I watch the television show Straight Shooter?;en
play the Cabin Fever 2: Spring Fever saga;en
Can you pull up The Sanford Herald;en
Hook  up with a   Dancing Girl. ;en
find the song Tholireyi Gadichindi;en
show song schedule Come into the World;en
 a   Mister Whiskers:  Favourite Nursery Rhymes ;en
find Cascading Waterfall;en
Find the Digital Champ: Battle Boxing;en
Please look up The 4-Hour Workweek saga;en
 the trailer  Hotel  the Corner of Bitter  Sweet ;en
Where do I play the video game The Wild Geese?;en
 the  Memories Are  Only Witness ;en
Show me a photograph called The Daily Slovak News;en
 I hear the   Audio Sensory Theater? ;en
 you pull up  Name  Brain Brian ;en
  Alien Breed  - The Horror Continues ;en
 creativity  video game Labyrinth ;en
 a work  the name  Come Sing ;en
 The XYY Man  ;en
 up The Gun  ;en
find a show called The Paper Route;en
    the Naked City – Justice  a Bullet album? ;en
find Attack Surface Analyzer, a painting;en
  the  A Self Made Hero ;en
Where can I purchase the game Dancing in the Dark: 10 Years of Dancing Ferret;en
Look for the trailer of Guitar Heaven: Santana Performs the Greatest Guitar Classics of All Time;en
Find painting Big Ideas;en
 the Sing When You’re Winning   ;en
Show me the game Music Bank;en
Show me the game English Freakbeat;en
 a  called Ready. ;en
show creative Last Light;en
I want to  the  Between a   a Hard  ;en
 the  Metallica Through the Never ;en
Find television show on Windows Live TV;en
  The Cool Cafe: Cool Tape Vol. 1   ;en
I'd like to see the picture The Collection – The Collector 2;en
  the  titled Iranian Journal  Fuzzy Systems ;en
I'd like to hear the song In a Reverie;en
 The Moldy Peaches ;en
 the  The Outpost ;en
Find a painting called Satisfaction Is the Death of Desire.;en
 you   up the TV series,  Experiment with Time? ;en
Where can I watch the trailer of the National Treasures - The Complete Singles;en
Where is the TV show Am Universum ;en
I want to   Brother ;en
 The Coffin. ;en
Show me the Live in Whitby album.;en
  the Live~Legend  & 1997 Apocalypse   ;en
find me a game called Thesis Eleven;en
 the  I Want  MTV: The Uncensored Story  the   Revolution ;en
 the  Ultima VI: The False  ;en
Show me the photograph Rock You Baby;en
Can you help me locate the game, Coast?;en
find Journal of the European Economic Association, a movie I want to see;en
 a song called   the Water. ;en
 the Steady as She Goes  ;en
 The  in the Band. ;en
Could I download Chavez: Inside the Coup?;en
Find a picture called Ready.;en
 The Creeper. ;en
 the   The Last Samurai. ;en
find She Monkeys;en
Find the TV series From the Top;en
Show me the song 15 Storeys High ;en
find the song The Fourth Man;en
 a   Set Sail the Prairie ;en
  I  Sebastien Grainger & The Mountains ;en
  the Elvis’ Christmas Album  show. ;en
I'd looking for the saga PlayCanvas.;en
find The Family Jams saga;en
 the TV  Starship Titanic ;en
Are there any painting of the 1st Concert Oh Yeah! 1999?;en
 a   The  Went Down to Georgia. ;en
 the novel  We Did  Our Holiday ;en
Can you search for Twilight Is Gone?;en
Find Pat Garrett y Billy the Kid.;en
  video game The Sky  Crying ;en
  Ayumi Hamasaki Countdown Live 2007–2008 Anniversary  ;en
I want to listen to the soundtrack The Om Years;en
fimd Glory;en
 Drowning with Land  Sight. ;en
I want to  a   Scotland Tonight. ;en
Find me the TV show Ask a Woman Who Knows;en
When  Spyforce playing? ;en
Play song Softly;en
show me the movie called People and Masks Part 2;en
  the  Pokémon: The Johto Journeys ;en
Search  the Halfway Home TV  ;en
 a  called Under Blackpool Lights. ;en
   the picture  The Getaway: Black Monday. ;en
I  a  about Polymer Chemistry. ;en
 the game BlogBridge ;en
 Welcome to the El-Palacio, a  ;en
 locate Sad Love Story   me. ;en
Can you find the soundtrack for Fast Food Nation;en
Find THUNDER IN THE EAST.;en
Can you search  Twilight  Gone? ;en
I  the game The ARIA   ;en
Find the trailer for Real Men Cry;en
I'd  to see the    the Saurials ;en
 the  A  Less Sixteen Candles ;en
Find the Another Ticket game;en
  Potter  the Deathly Hallows –  2 ;en
Where can I listen to the soundtrack of Gibraltar: Britain in the Sun;en
  I  the   Experienced II: Embrace Tour 2013 Budokan? ;en
 a  called The Mad Magician ;en
 Check In ;en
play the album Journeyman;en
 the trailer  Real Men Cry ;en
I'd  to  the Limited Lovers  ;en
 The Late  Townes Van Zandt ;en
Find My Tribute show;en
find Oman Medical Journal;en
find Cut the Rope;en
Show me TV series Lego Star Wars 3: The Clone Wars;en
Where can I buy the soundtrack Bridge of Souls;en
  Fantasy Zone II: The Tears  Opa-Opa ;en
Find The Crucible of Man: Something Wicked Part 2.;en
 the trailer  Deadly Skies ;en
I want to  the book, The Mailroom:    the Bottom  ;en
 a  called Chompa Toung. ;en
find a painting called Screen Souvenirs;en
Where can I find Conduct Unbecoming?;en
Please find me Asking Alexandria discography;en
search for movie Turn Back the Clock;en
What is the TV show Journal of Personality and Social Psychology?;en
  a   Merle Haggard Presents His 30th Album ;en
 Clash  the Codes. ;en
Where can I find the painting for A Christmas Story - Una storia di Natale?;en
 a  series called Cocktail Kings. ;en
 you  the novel Journal  Social Work ;en
 Back  Good, a  I want to  ;en
 Myth II: Soulblighter ;en
Can you  the  Accidentally  Love ;en
  I  the Ricky Skaggs discography ;en
Find me the album The Demon;en
How can I see the TV series Mothstorm?;en
I want to  the  Love   Control ;en
Go to the television show Nothing Without You;en
There's a famous painting  Thursday,   have  image  it? ;en
 Projections, an album ;en
Where can I see the television show, Jimmy Two-Shoes?;en
 the trailer  A Lineage  Grace ;en
play TV show Way of the Samurai 2;en
 The Real Story  Gretchen Carlson ;en
I'd like to listen to the song The Natural Farmer;en
 creativity  The   the Dead ;en
Find the song titled The Rivalry: Red v. Blue;en
Find Merry Arizona 97: Desert Stars Shine at Christmas;en
 The Earth  a Sinful Song ;en
   the work titled SingStar Take That ;en
I want to  Everytime We Touch   a  ;en
Wish to  the work The Immortals   a  ;en
 a television  called Twisted. ;en
How  I  the   Counting the Rosaries? ;en
 creativity of Diamonds  the Rough ;en
 the  Their Finest Hour ;en
Show me The Atrocity Exhibition;en
 the  series The Merry Sisters  Fate. ;en
  To Heart 2 ;en
 The Kindness  Women picture ;en
I'd like hear the song Sit Down and Talk to Me;en
Show the Bean and the Boys painting;en
I want to listen to the song Shamus;en
Find City of Light.;en
Find the Via Dolorosa: Songs of Redemption saga;en
Can you find a creative work called A Saintly Switch;en
  the Only the Strong Survive  ;en
find Episodi di South Park, a trailer;en
Can you find me the SchoolTool picture?;en
   titled Sonata Mix Dwarf Cosmos ;en
 The Aviation Cocktail  ;en
Show the My World 2.0 photograph;en
find the show titled Hell on Earth 2006;en
 a  called Last Night  Earth. ;en
play the movie Post Inferno Soundtrack;en
Where can I get Harry Potter and the Philosopher’s Stone;en
I'd like to see the trailer for History and Theory;en
 Home Fires ;en
 Panic  the Streets ;en
I'd like to hear the song Impractical Jokers UK;en
  I buy The Lying Game ;en
 can I  The  According to Paris? ;en
Pull up Mafia: The City of Lost Heaven;en
Find the saga A Very School Gyrls Holla-Day.;en
 The World  a Game ;en
find Jono and Ben;en
Find Drowning with Land in Sight.;en
 Journal of the Society  American  ;en
find book In the Valley;en
I want to  the  Maxime ;en
 a television   The Passion  the Betty ;en
 a   The Guyra Ghost Mystery. ;en
Look up The Cool Cafe: Cool Tape Vol. 1 video game;en
 the   Ghost Dragon  Cold Mountain ;en
 a   called Church  the Truly Warped. ;en
find The Quest of Iranon ;en
show creativity of Official History of Australia in the War of 1914–1918;en
Find Your Personal Touch.;en
  I see the trailer  Love  the Beat ;en
 a  called I Still Believe  You. ;en
Would like to  the    Experiment with Time ;en
find The Hundred-Foot Journey;en
find A Pet of the Cairo Zoo ;en
  the The Defenestration  Ermintrude Inch  series ;en
show creativity of Sacred Fire: Live in South America;en
Please find the TV series Back to Bach;en
I'm   the  called The Beast  Shouted Love  the Heart  the World. ;en
  the novel London Has Fallen ;en
 a game called Bump the  ;en
 A New Machine ;en
I'm looking for the album called Disorderly Conduct: Video on Patrol;en
  a copy  the picture Double Deal. ;en
find Tortured Man;en
 can I  the TV   The School Teacher  the House ;en
show creativity of Night of the Hunter;en
  the picture Gas Wars ;en
Play me the trailer for Gainesville Daily Register.;en
show creative picture of Wonderful Town;en
 the  Cold Comfort ;en
  the television  The Science  Breath ;en
 creativity  Sacred Fire: Live  South America ;en
 I buy the  Vacation  Petrov  Vasechkin online? ;en
find a soundtrack called Fast as You;en
Where can I see the show Twentysomething;en
Show me the work titled The Perfect Gentleman which is a song;en
Please   Glass Cloud – Single. ;en
 Long Walk to Forever, a  ;en
Find me the song 2 Fast 2 Furious;en
  The Big Game show. ;en
 The Good Wife ;en
   the picture The Little Death ;en
Find a painting called Mr. Scarface Is Back.;en
Play Keep Your Right Up song;en
Can you find the album SimpleScreenRecorder;en
 the television  called Tactics ;en
I'd like to  the   a Reverie ;en
  locate West Coast Wrestling Connection ;en
Find Darker than black.;en
Find Conker: Live and Reloaded;en
show creativity of Wild About Animals;en
 the Cabin Fever 2:  Fever  ;en
Show me The Lord of the Isles;en
Find a video game called Peaches discography.;en
Find The American Journal of Economics and Sociology.;en
I'd like to see the book The Royal Thousand;en
Find the novel WWE Legends of WrestleMania;en
  the Beam: The Atari  Computer System ;en
Has the TV series Puppet Master: Axis of Evil been cancelled?;en
I'm looking  Dead  21, the  series ;en
 the novel Meg  Seron ;en
play A Box of Birds trailer;en
play The Nubians of Plutonia trailer;en
Can you   a trailer  Phineas Redux? ;en
I'm looking for the television show titled The Lonergan Review;en
How do I get the game Still on It?;en
 the  titled The Most Charming  Attractive ;en
show creativity of Sing to the Dawn;en
search  television  Windows Live TV ;en
Show the Phish: Live in Vegas TV series;en
Can you find the TV show So What;en
 the Stone Free  ;en
 a painting  Thunder  the Sky. ;en
Show me the work The Catholic Weekly;en
show creative video game The Boat Is Full;en
look up Holy Water;en
Find The Passion of Michel Foucault novel;en
 you    the We No Who U R game? ;en
 Bal Ganesh 2, a  game ;en
Show  Born  America? ;en
I want the video game Two More Years;en
Look for the No Bigger than a Minute soundtrack;en
Show The Lateness of the Hour;en
search for the show The Caretaker;en
I'd  to see the  Edinburgh  News ;en
 you   the work, Frisbee: The   Death  a Hippie Preacher? ;en
 the So This  Goodbye saga ;en
Where can I watch the picture I’ll Take Care of You?;en
I'd like to find the Limited Lovers novel;en
  The Atrocity Exhibition ;en
Show me the picture Batman: The Long Halloween;en
find Waiting for Touchdown, a book;en
search for Pat and Margaret;en
Find an album called Preminchi Choodu.;en
 the  The  of: The Township Idols ;en
  the work, The Mercenary. ;en
search  Pat  Margaret ;en
Please   The Purple Vigilantes book. ;en
I want to watch Wide-Eyed and Ignorant;en
Play me the trailer for Chasing After Shadows... Living with the Ghosts.;en
I want to view the picture In Old Monterey.;en
Find me the photograph The Late Music;en
 a photograph  Accion Newspaper ;en
I'd like to  the   Sailor Moon SuperS: The  ;en
I'd  to see Confessions   Indian Teenager ;en
 the Background to Danger  ;en
Show  the game  Bank ;en
find History of North Dakota, a TV series;en
show creativity Cum On Feel the Noize the video game;en
Find the work Compiled fragments 1997-2003;en
Please find the movie, A Jingle with Jillian.;en
  the album Til the Morning ;en
  series  Noroi - The Curse ;en
show creativity of book Future of the Past;en
Please get me the British Journal of Dermatology game.;en
 you   Escape  the Sky: The Godlike Genius  Scott Walker ;en
Find a book called The Echo Chamber.;en
find the book Metallica Through the Never;en
 pull  the photograph entitled  Period ;en
Find the show Portrait of Countess Karoly;en
I want to see the novel, The Green;en
  the work Not a  Girl Anymore ;en
Can you find the book Beatmania IIDX 10th Style;en
  the  Aap To Aise Na The. ;en
find the movie Chaos Is Me;en
Show me Then We Came to the End;en
Show me the picture Written in the Stars;en
Find a show called Friday Download.;en
Find a show called Star Trek: Starfleet Academy Starship Bridge Simulator.;en
find a television show called Happy Trails;en
 Transformers: The Game ;en
Please look up Amrithavaahini;en
    Lego Star Wars 3: The Clone Wars ;en
Can I see the the TV series The Late Music?;en
find The Loving Spirit;en
 the  game The Tomb ;en
find the video game Tenacious D in: The Pick of Destiny;en
Please find me the game called The Salvation.;en
Show  Heavenly Sword ;en
Find a TV show called The Ambient Collection.;en
 can I see the  Latin  Lovers? ;en
find Bump Off Lover;en
 Conker: Live  Reloaded ;en
 you help   the Author! Author! trailer? ;en
I'd like to see Apartment Hunting.;en
 Live at Leeds ;en
 the  A Glorious  to Die ;en
  a photograph  I Wanna Sex You  ;en
find The Real Story with Gretchen Carlson;en
show creativity of A Catholic Education;en
 the  World 2.0 photograph ;en
Show me the picture Creatures of Light and Darkness;en
 the  Shake Your Spirit ;en
I want to  the   ESPN Major  Soccer ;en
I want to  to the  Bed   ;en
I need to see Cristo in India;en
i want to  the    China Seas ;en
I want to watch the trailer Ad Nauseam;en
Need to find the soundtrack called Fire in the Valley;en
Can you help me find the Author! Author! trailer?;en
find a TV show called Ride the Wind;en
I'm looking  a job  Inversion ;en
Where can I find the song Red Back Fever;en
Can you help me find the television show Women and Death;en
 a  called Screwed. ;en
show the creativity of The Attic;en
  I purchase Wuthering Heights ;en
Play me the trailer for Star Control.;en
Where to buy video game of Think Fast;en
Find the video game Journal of Criminal Law & Criminology.;en
  the  called Journal  the American Statistical Association ;en
 you   the Spectres television show? ;en
How to get saga Stronda Style;en
 Digimon Next ;en
 a   called The Fighting Men ;en
Find the picture of The Harsh Light of Day;en
play saga The Yellow Rose of Texas;en
I'd like to see Walk on the Wild Side: The Best of Lou Reed;en
Find a TV show called Revenge of the Nerds.;en
  The Adventure  the Blue Carbuncle ;en
find a photograph called Between the Days;en
 to Dragon Ball:  Collection ;en
 a TV  called Zen: The   Fred Katz. ;en
I want the   Southwest Riders ;en
Please get me the Before Crisis: Final Fantasy VII television show.;en
 a  called Lovex discography. ;en
Where can I find the novel The Great Irish Bake Off;en
show  Convicted ;en
  the painting Smart Money ;en
I want a   Elizabeth the  ;en
I want to  the  Guitar Heaven ... The Greatest Guitar     ;en
Please find me the work, Instrumental Directions.;en
Show the Three Tales album;en
Wish to  the   The Wizard  Stone Mountain ;en
I want The Complete Global Albums Collection;en
 the Glass Cloud – Single   ;en
find American Psychologist, a game;en
   The Oxford Companion to Beer   ;en
 published the  JamesEdition? ;en
 the Innocent  You Dream saga ;en
Can you help   ScholarMate? ;en
I want to  the      Vol. 3: The Unknown  ;en
Where can I find the photograph of Mr Blobby;en
 you   the trailer  the Hippocratic Oath? ;en
 Carry me  your dreams ;en
Play me a trailer for The North-West Passage;en
I'd like to see the picture Chrome Dreams;en
I want to  the   The Muppet  Carol ;en
Where can I buy the movie Totality;en
Please find Brand New Strings;en
I  to  the creative  Wave ;en
 creative picture  The Secret Doctrine ;en
Please find me Glass Cloud – Single.;en
 Blood Moon: Year  the Wolf, a  ;en
   the saga titled The Eternal Return ;en
  the photograph the Crimson Climax ;en
I'd like to see the movie Edinburgh Evening News;en
 me The Wild  ;en
show Air Cuan Dubh Drilseach;en
 a   called No Parking  the Dance Floor. ;en
Show me Cut the Rope video game;en
find a soundtrack for Lords of the Rising Sun;en
Find me the Extreme Ghostbusters game.;en
Want a work called Walk the River;en
Where can I find the show Game of Death II;en
 a  called Storm Center. ;en
  The Courts of Chaos ;en
  the  2 Fast 2 Furious ;en
How  I view the  Corpus: A   About Selena? ;en
 Attack Surface Analyzer, a  ;en
 TV series   Gears  War ;en
  Comedy Underground with Dave Attell ;en
find The Magical World of Roger Whittaker;en
Can you  the painting Shake! Otis   ;en
Find a photograph called Cold Weather.;en
  The Hills Have Eyes: The Beginning   ;en
Please  the novel,  Doctor ;en
  up The 4-Hour Workweek saga ;en
show creative song called Holidays on the River Yarra;en
find a photograph called The Wish List;en
 a  called The Polish Bride. ;en
Show me the video game The Stillest Hour;en
I'd  to  the album Clarke ;en
  the Landing  Low Tide painting ;en
find Thyme Travel;en
Where can I get Intel Array Building Blocks;en
I'd  to    the  series, The Secret  Queen Anne or Musketeers Thirty  After. ;en
Can you find a photograph of Ace Ventura: The CD-Rom Game;en
where can I find a painting called Battlestations: Pacific;en
Find a picture called Battlefield Network.;en
 the  Louder Than Bombs ;en
  I  Police Story 3: Supercop ;en
I want the show The Sense Apparatus;en
Go to the   Love Berry ;en
What system is Bloodhounds of Broadway the game for?;en
 NHL on Fox ;en
  the saga  Return  the Bastards. ;en
Find me Nights in Harlem;en
Find a TV series called Church of the Truly Warped.;en
  the  with the title The Denial ;en
Find a song called Magic in the Water.;en
 a trailer  Give It All ;en
I'd  to see The  Jackals ;en
Please search The Young Warriors game.;en
Wish to fins a    Whole Again ;en
Find me the painting Fallen Sanctuary;en
Play The Crowd: A Study of the Popular Mind soundtrack;en
Nightwork  download ;en
  I get the  game Faith  Chaos? ;en
Search  Man  a Garage ;en
show  NeuroToxicology ;en
Show me the Only the Strong Survive photograph;en
 the  We Chase the Waves ;en
 a painting  Break Down. ;en
Find a photograph of Time Loves a Hero;en
What is The Cave Canem Demos photograph?;en
 yo   the game A Silence  Screams? ;en
  Memoirs  Modern Love: Curious Age ;en
Show me the TV series Prescription for Death ;en
 a television  called Merced Sun-Star. ;en
Find the novel What We Did on Our Holiday;en
  I buy a hardcover   the  The Intangibles  Leadership? ;en
find the TV series Box of Moon Light;en
 the photograph Hearts Burst into  ;en
 the Apple Address  television show ;en
  Kiss the Crystal Flake ;en
Where can I find the creative works The Very Best of Simply Red;en
 to  album Justified ;en
  the lowest price  the  Sinatra Reprise: The Very  Years. ;en
Look for Global Clubbing: The Netherlands.;en
  the   Those Were the Days – The   Leningrad Cowboys published? ;en
I want to watch The Original Recordings;en
 Tales  the Organ Trade ;en
 creativity  Adobe AIR ;en
  up The Immortals television show. ;en
Find me the Princess Battles song;en
  locate a  called The Master  Ballantrae. ;en
 a song called  Your Eyes. ;en
  Black Heart White Soul ;en
   Official History  Australia  the War  1914–1918 ;en
 the movie CURL ;en
I want to listen to the     Everything ;en
 I get the  List  Mew singles? ;en
 the  titled The Rivalry:  v. Blue ;en
show creativity of The Oxford Companion to Beer TV show;en
Get me Kiss the Crystal Flake;en
show me the movie Haunted Spooks;en
Find Resurrection of Evil.;en
 the novel The Last  Sheila ;en
Please search the Abby saga.;en
 a novel called Twins  Evil. ;en
I need work of Father Dearest;en
I'm   the CineExport painting. ;en
Find a movie called No. 1 In Heaven.;en
Buy Cannabis painting;en
Show The Collectors video game;en
find Trivial Pursuit: America Plays;en
  Hamilton C shell ;en
find Mother Earth, a TV show;en
find the movie Yoshimi Battles the Hip-Hop Robots;en
 the  A Russian Beauty  Other Stories ;en
  I purchase the saga The Second   Samuel Tyne ;en
Look for the Compact Forest Proposal trailer;en
 the trailer  Hit the Ice ;en
find a television show called The Passion of the Betty;en
Find The Gill Deacon Show.;en
 a   called The Golden Hits  Sandie Shaw. ;en
show me God Bless the Child photograph;en
 a  called Just Say Noël. ;en
 The Bridge  San Luis Rey  ;en
Find me the Spartan: Total Warrior painting;en
 The Lure  the Mask song ;en
 the   The Sims 3: Generations ;en
Find The 180.;en
 the trailer  Rugrats Go Wild ;en
 song schedule  Shoot  the Moon ;en
  the   Ask a Woman Who Knows ;en
 the Radical History Review  ;en
I want to  to the     the Shell: Stand  Complex ;en
I'd  to  the painting Empire   Worlds ;en
  I locate the  The Return  Mr. Moto ;en
Find Dyskografia Nick Cave and the Bad Seeds.;en
find a video game called The Yellow Claw;en
find The Prince of Temple Street, a picture;en
 Return to Krondor. ;en
Can you find me a trailer for Phineas Redux?;en
I want to  the television   Things ;en
show creative photograph named None of the Above;en
show book of Pokémon: The Mastermind of Mirage Pokémon;en
Where can I find the painting RSS tracking;en
 search Cardin  Australia saga ;en
Has the   Puppet Master: Axis   been cancelled? ;en
 a  called Testing Anywhere. ;en
I need Chapter One of the show, get it for me please.;en
 the  Ticket game ;en
I want to  the   Nauseam ;en
What is Fantasy Zone II: The Tears of Opa-Opa;en
Find Phalcon. ;en
Find a soundtrack called The Woman Warrior.;en
find Google News;en
Please find me the Magic Hour saga.;en
 a  called Follow Me ;en
 you    a picture called Olympia 1974? ;en
 a  called Nuclear Blast All Stars:   the Dark. ;en
Find A New Machine;en
  title Champagne Showers ;en
I'm looking for the game called Summer of Fear;en
I'd like to watch the trailer for Dungeons & Dragons: Chronicles of Mystara.;en
 PlayStation官方杂志, a song ;en
  I listen to Willy  the Poor  ;en
Find the show We Chase the Waves;en
Find a soundtrack called Meet The Vogues.;en
I'm looking for you to get me Jack of Shadows.;en
 the TV  Iron Seed ;en
Can you locate the work, Warlock 2: The Exiled?;en
Look up The Adventure of the Blue Carbuncle ;en
Find me the novel, Between the Rivers.;en
I'd  to  the  The  – The Collector 2 ;en
 the  Retro Active ;en
 The Dressmaker. ;en
 fine me, Ties  Bind. ;en
What is the cheapest price for the saga called 2006 Wikipedia CD Selection?;en
