expression;language
I want to   Warcraft: Tides   ;en
I want to   the Fate  ;en
Where is Winterheart’s Guild;en
  the  Batman: The Long Halloween ;en
  name Straight No Chase ;en
search   Jazz Impressions  the U.S.A. ;en
Show me the Landing at Low Tide painting;en
I want to  the    Aire 7. ;en
Look for the Nightmare on Providence Street saga;en
Fine a movie called Right Here Right Now.;en
play Disney Sing It! – High School Musical 3: Senior Year;en
Look for the Public Toilet painting;en
 you please  me, Journals? ;en
I want to watch the TV show Down on Abby;en
 The Flying Scotsman ;en
Please   Asking Alexandria discography ;en
I  work  Father Dearest ;en
  the photograph A Woman  the Street ;en
 Next of Kin ;en
I want to  the   International Pinguicula Study  Newsletter ;en
When was the album Start a Fire released?;en
want to  the   The Prefect ;en
 a  called  Quick or  Dead. ;en
 The Valentyne Suite ;en
 The Many Loves  Dobie Gillis ;en
  the saga called Death  Paradise ;en
 a  called Episodi di Sons  Anarchy ;en
I want to find The Very Best of Chicago: Only the Beginning;en
What is the book Sell Your Body?;en
 the  Tholireyi Gadichindi ;en
 you search City  Scars? ;en
  the movie Black Summer ;en
  I purchase a copy  the painting  Glimpses   History? ;en
How do I watch the television show Counting the Rosaries?;en
  the  The Twilight Saga: Breaking  Part 2. ;en
find the photograph Among the Living;en
What is the picture called Lest We Forget: The Best of?;en
 I  the the   The Late Music? ;en
Look up the Rock the Blind photograph;en
I want to see Everytime We Touch which is a painting;en
want to  the    Until Caught 2: Guilty ;en
 the Exile  the Kingdom ;en
 up Holy Water ;en
I'm looking for the painting God Must Have Spent a Little More Time on You;en
Look for the TV series All Around Performance Horse Weekly;en
 to  painting  Channel 4 News ;en
Fine a  called    Now. ;en
I want The  Global Albums  ;en
Can you find the painting Shake! Otis at Monterey;en
Find a saga called Story of My Life.;en
I want to  the    Sings the  Sammy Cahn ;en
Show the Philosophy and Phenomenological Research saga;en
  the cheapest online   the Instincts saga? ;en
Please fine me, Ties That Bind.;en
  The Heart Specialist ;en
 you   the game, Super Scription  Data? ;en
I'd like to see the show Onion SportsDome ;en
  I  the album The Adventures  Lolo II ;en
find the painting Retro Active;en
 UNDER NIGHT IN-BIRTH ;en
 to  a creative   the title Sometimes the   Just a Passing Bird ;en
Can you search City of Scars?;en
play Hell House song;en
Find Le Profil Amina TV series;en
Please look up The Lamentable Journey of Omaha Bigelow into the Impenetrable Loisaida Jungle television show.;en
 the Return to Grace  ;en
 Phinally Phamous ;en
 The Gamble. ;en
 The Killing Fields. ;en
Show The Family from One End Street album;en
 the American   Sports Medicine picture ;en
show Angels of Iron television show;en
play the Caps Lock trailer;en
I want to watch the television show New Astronomy;en
Find me the picture entitled I’ll Take Care of You.;en
find Wild Solutions, a saga;en
Find me the show Krypto the Superdog;en
 the Minutes to Midnight  ;en
 The Case  the Whitechapel Vampire  series ;en
 The Ultimate Gift, a television  ;en
 a  called The Outpost. ;en
Where can I watch the latest episode of the TV show Chu Chu and the Philly Flash?;en
Can you help me find the We No Who U R game?;en
show creativity of photograph of My Wonderful Day;en
find Chant Down Babylon: The Island Anthology;en
 Second Generation album ;en
 the  called Loyalty. ;en
 The  of Riley, a photograph ;en
 The Swan Princess ;en
  Big Ideas painting ;en
  I view the  Dinosaur  the Deep? ;en
Find the book A Glorious Way to Die;en
When does Fire and Ice: The Winter War of Finland and Russia television show air?;en
 creative   Brenda’s Got a Baby ;en
Can I get the game List of Mew singles?;en
 a  called Outpost Firewall Pro ;en
I want the song Phrazes for the Young;en
Please look up the Falls Church News-Press album.;en
  the  series Back to Bach ;en
 the  Post Inferno Soundtrack ;en
 the   The Harsh Light  Day ;en
search  the  The Thieving Magpie ;en
show TV show schedule Archive.is;en
 the Phish: Live  Vegas  series ;en
Find saga Hamilton C shell;en
find a television show called Sensation Comics;en
Get the video game of The Chipmunk Song;en
find Projections, an album;en
I want the video game Southwest Riders;en
Show The Legend of Jesse James novel;en
  The  – Das teuflische Haus ;en
find me a game called Spaceball;en
Please  the song House  Wedlock ;en
Find me the Show Girl soundtrack;en
 up  Fantastic Dances ;en
Can you find My Island Home TV series?;en
I'm   a photograph  Merry Christmas. ;en
Please   the work, Ace  Spades. ;en
I'd  to  a   called Countdown: The Savoy Sessions ;en
 a picture of  Hole ;en
When  where  DistroWatch playing ;en
 Wish You Were Here, a  ;en
search for the painting The Elder Scrolls I: Arena;en
show creativity of All for One;en
show book name Straight No Chase;en
Please look up the television show, Noel Hill & Tony Linnane.;en
  I locate Leo the Lion  purchase ;en
 Once Upon a Time  the  ;en
 help   the Short Program saga. ;en
 creativity  Wild About Animals ;en
Find The Black Girl in Search of God trailer;en
 a   called All Time Greatest  Songs. ;en
show creative painting People & Love;en
find The Good Wife;en
I want to play the video game Miss Castaway And The Island Girls;en
Please  the  Dancing Girl ;en
  the Caribbean Blue television  ;en
show me the picture Totally True Love;en
Where can I find Appalachian Journey;en
Play show of Cissy Houston;en
Show The Second Civil War saga;en
Find a trailer called Colony 7.;en
Where can I find Sebastien Grainger & The Mountains;en
Please locate Sad Love Story novel for me.;en
 City of Light. ;en
Where can I view the trailer Jeeves and Wooster in Perfect Nonsense;en
Find the Mystery Woman saga;en
Find Journeyman. ;en
I'd like to see Sex Tape - Finiti in rete;en
 a    Champagne Mojito  the Last Thing I Own. ;en
Find WxHexEditor.;en
Find the TV series I Build the Tower ;en
 a   called  Harry Tries to Marry. ;en
Look up The Reverse of the Medal;en
find Starcross;en
 me the photograph The Late  ;en
I'd  to see the  TeleForm ;en
where can I see the trailer for Love on the Beat;en
Look for the Thorns saga;en
Play Remains of the Day;en
 a TV  called Perfect Chemistry ;en
show creativity of Accident Analysis & Prevention;en
I want to watch the television show Champion;en
Where to buy book Bright Ambush;en
 the  Among the Living ;en
 creativity of All  One ;en
 creativity  Night  the Hunter ;en
show That Little Band of Gold;en
 to    A Brush with the Law ;en
I'd like to see the trailer Tony Parker;en
Pull  Mafia: The   Lost Heaven ;en
find the trailer Platinum In Da Ghetto;en
Can you find the TV show Faithless Street;en
Please help me find the Short Program saga.;en
  the Infrared Riding Hood  show. ;en
I want to find the show From Where to Eternity.;en
  the Princess Battles song ;en
Show me a picture of Love;en
  I  the work  Was Raining That Night? ;en
 the show The Demi-Gods  Semi-Devils ;en
Where can I see the trailer for Phineas Redux?;en
Find a trailer called Eurythmics discography.;en
  I see the trailer  Phineas Redux? ;en
Want to see the Dungeons & Dragons: Chronicles of Mystara;en
Find a soundtrack called The Dragon.;en
Find me Under the Skin;en
   the Live  San Juan Capistrano picture. ;en
 The Real Dirt  Farmer John, a  ;en
show TV show schedule of Offroad Legends;en
I want to  Wide-Eyed  Ignorant ;en
 the  series The Almighty Johnsons ;en
  I  the TV  Terrorists: The Kids They Sentenced ;en
 you please search Ellington  Newport? ;en
 a painting called The Wipers  ;en
Can you get the TV show, ENTER THE MATRIX?;en
play the television show Tears Laid in Earth;en
show the creativity of saga The Dissociatives;en
Go to the TV series Love Berry;en
Find LaserLight. ;en
  Rapid City Muscle Car. ;en
find the soundtrack titled This Side of Paradise;en
I want to play a game called Scotland Tonight.;en
Search for Police Women of Cincinnati;en
find Back for Good, a novel I want to read;en
Find a painting called Boating on the River Epte.;en
I'm looking for the Pokémon: The Movie 2000 TV show;en
  the photograph Rock You Baby ;en
 Unfinished portrait  General Bonaparte ;en
Show The Swan Princess;en
Please look up the novel, Heroes of Annihilated Empires;en
 the  titled Spasmolytic ;en
Please look up the painting Beyond Iconic: Photographer Dennis Stock.;en
 Acta Mathematicae Applicatae Sinica   ;en
Find Confusion Bay.;en
Look up The Making of Milwaukee;en
find Bullet and a Target, a television show;en
Please find Pretty Baby;en
 a   called A Stroll  the Pork ;en
Please find the novel, Good Doctor;en
I want to  the   The Entity ;en
I'd like to hear the soundtrack for Just Once in My Life.;en
I'd  to  Spyforce ;en
find Check In;en
show creativity of Home Brew;en
find the album Smoke and Mirrors;en
Show me the movie Operetta for the Theatre Organ;en
I want to  the   The Coyote   the Space-Age  Pad ;en
Please look up the Power and Love movie.;en
Find Five Came Back for me;en
 a photograph   Loves a Hero ;en
Show the Sad Songs for Dirty Lovers album;en
Please look up the song, Twist of shadows.;en
 The Madwoman  the Attic. ;en
Where can I find the novel A Woman in the Web;en
find Live in Tokyo for me;en
 The Gamblers ;en
find a photograph called Dragon Ball Z: The Best Selections;en
  Williams Sings Steve Allen   ;en
Search for a picture of Darker than black;en
I want to watch the movie Godslayer;en
 me the soundtrack  Nothing Personal. ;en
show creative Labor Notes;en
Look up the Act of Valor TV show;en
find the novel Playlist: The Very Best of Brad Paisley;en
Show The Singles Collection Volume 4;en
 the Endangered Species  ;en
Find a TV series called Manufacturing Consent.;en
  I view the trailer Jeeves  Wooster  Perfect Nonsense ;en
Find a trailer called Hellboy: The Troll Witch and Others.;en
Play the Electrochemical and Solid State Letters song;en
 a game called The   Ohio ;en
 Thyme Travel ;en
 the Mystery Woman  ;en
 The Tyrant ;en
  the I Can Hear the Sea  ;en
Can you find me The Assassination of Jesse James by the Coward Robert Ford saga?;en
I'm looking for Right on Track.;en
Show  a novel  Onnaam Muhurtham ;en
find the novel Meg and Seron;en
 the Putrid Death Sorcery  ;en
  the picture The afternoon ;en
show me the trailer for Live Phish Volume 12;en
  the video game  Your Love. ;en
Find the novel Peace Arch News;en
Show me the photograph Johnny Cash: The Complete Columbia Album Collection;en
find the TV series The Parent Trap IV: Hawaiian Honeymoon;en
 a  called Albino Blacksheep ;en
 Some   Best Friends Are...The Piano Players ;en
Find the song called International Journal of Bilingualism;en
show creativity in Ah;en
Find Family Feud novel;en
want to  the TV  Treeful  Starling ;en
 Donkey Town, a  ;en
 a  called Friday Download. ;en
 you pull  Channel M News ;en
Find the Envoy of Lucifer show;en
Find an album called List of Re: Hamatora episodes.;en
 I  the the painting  Life...Another End? ;en
show me the picture Sex and Drugs and Jesus Christ;en
How can I view the show Corpus: A Home Movie About Selena?;en
I need a novel about Polymer Chemistry.;en
  Ifind You  Me, a saga ;en
Find the Love And War soundtrack;en
Please   the Rear Mirror saga. ;en
Show The drive of life album;en
find The Valentyne Suite;en
What  Love  a Mist? ;en
     Those Who Would Walk with the Gods ;en
Play Everybody Wins trailer;en
Can you please find me, Journals?;en
Looking for A Black Ribbon for Deborah.;en
I am looking for The Complete Fillmore East Concerts;en
She me the Sons of Satan Praise the Lord picture;en
 the Cold Dead Hand video game   ;en
I  looking  the work: Nikki ;en
find the Still Life: American Concert 1981 soundtrack;en
I'm   the painting God Must Have Spent a   Time   ;en
I need to find the creative work Prince Hours;en
show creative photograph Island in the Sea;en
 the  Go with the Flow ;en
Get  a photograph  Trac ;en
find Do You Wanna Touch Me, a song;en
What is Marty Stuart discography;en
Want to  a photograph  The  Maidens ;en
When is City of Angels playing?;en
 the  called International Journal  Bilingualism ;en
show creativity of Pocket Full of Kryptonite;en
 a   called The Mysterious Castle  the Carpathians. ;en
 the Seamus Heaney Collected Poems  ;en
show The Taste;en
Show the Minutes to Midnight photograph;en
find Face the Truth, a TV show;en
 creative game Elements  Life: Remixed ;en
Can you get me the Maldeamores saga?;en
I'm   the  called Standing  Something. ;en
find a video game called Victory March;en
  the movie with the title  Twitches ;en
   the work Graphics Animation System  Professionals ;en
Try to find the picture Advances in ecological research;en
Find me the novel London Has Fallen;en
 Stained Glass Windows. ;en
I    a creative work  Something Warm ;en
  Party All Night ;en
Can yo find me the game A Silence That Screams?;en
 information about the  Flipper City ;en
Is there any creative work for Heterocycles?;en
Look for a photograph of I Wanna Sex You Up;en
I want to    The Practical Pig ;en
 The Crucible  Man:  Wicked Part 2. ;en
 a   called The Yellow Claw ;en
I'm looking  the  Sex  Candy ;en
help   the work Unite  Win ;en
  the trailer  American Education: The  Experience. ;en
Find the album Future of the Past;en
I want Sugarfoot;en
I'd like to see the saga Tamagotchi 64: Minna de Tamagotchi World;en
 the  Occasional Wife ;en
Find a novel called Under Blackpool Lights.;en
Find me the video game For Your Love.;en
  I buy the  Borrowed saga? ;en
What is the television show Phil Ochs: There but for Fortune playing;en
find the trailer for Hotel on the Corner of Bitter and Sweet;en
I'm    Holmes contre Arsène Lupin. ;en
look up Adobe Brackets soundtrack;en
 The Quest  Iranon ;en
play the Hell of a Life movie;en
Play the Seamus Heaney Collected Poems song;en
  a  called Heart Like a Hurricane ;en
Can I buy the book Vacation of Petrov and Vasechkin online?;en
Where can I purchase the saga The Second Life of Samuel Tyne;en
I want to hear the soundtrack to The Platinum Rule;en
  I buy the  The Teahouse Fire? ;en
 up the  the Blind photograph ;en
Find a painting called Pulsions.;en
I'm looking for a job in Inversion;en
I want to  The   Lomax. ;en
I'm hoping you can find a photograph from Live At The Isle Of Wight 1970.;en
find The Inspector for me;en
Play Nightbirds on Nantucket soundtrack;en
 Crafty Hands saga ;en
where can I find the game A Little Bit of Mambo;en
 Blind Company ;en
Find Trust in the Lord – Live Worship with Don Moen.;en
find Something Crucial, a book;en
 can I buy the  Totality ;en
  the show The Skull. ;en
 does   Ice: The Winter War    Russia television  air? ;en
 television show  Windows Live TV ;en
   the Falls Church News-Press album. ;en
show creativity  Ah ;en
Is the TV show The Prodigal Wife on today?;en
 you  A Song  Mama   me? ;en
 you   Island Home TV series? ;en
   South Africa to South Carolina ;en
Show Acta Mathematicae Applicatae Sinica TV show;en
Search  Innocence  Hell ;en
I want the  The  Apparatus ;en
Get  a  about Sardonic Wrath ;en
  Chasing Fortune a TV series. ;en
I'm looking for the hit album, The Politics of Dancing.;en
I want to  to the   the  ;en
 the   titled Spatial Query Server ;en
Find the Check Please photograph.;en
 The Last Mile  ;en
 a   Adventure Time: The   the Nameless Kingdom ;en
I want to  a   Cash-Cash ;en
Show  the saga  Darling ;en
  the  Live  the Fillmore East ;en
 up The   Indifferent to Astronomy ;en
 the creativity  Where What When ;en
I'm looking for Sherlock Holmes contre Arsène Lupin.;en
find the photograph Canaich;en
Find The Boys in the Band.;en
Find a video game called Family Dog.;en
I want to   ;en
find a soundtrack called The Spanish Jade;en
 you know  a   the Mande Studies Association? ;en
I want to see the MAXIMUM TRANCE picture;en
 Fragile Frontiers: The    Mumbai Terror Attacks. ;en
Can you find me the game, Super Scription of Data?;en
  Interesting Times: The Secret of  Success ;en
show creative album Heredity;en
 the Carrousel saga ;en
I want to read the novel Pokémon the Movie: Black—Victini and Reshiram and White—Victini and Zekrom.;en
 a soundtrack  Dante’s Peak ;en
I'd like to see the saga Song of the Saurials;en
I'd  to  the painting I Looked  ;en
Find the album titled Spasmolytic;en
 the photograph The Air   Fire: Soundscape ;en
I'm looking for the saga Why Men Leave Home;en
Find a work with the name of Come Sing;en
show creative work or Miami Vice Theme;en
Find Zorro the game;en
I'm looking  a  titled  Painting ;en
 can I purchase the  Scales  Justice ;en
Play The Lousy Dance trailer;en
Show The Invisible Hook trailer;en
Please look up Two More Years soundtrack.;en
I want to see the TV show Cause & Effect;en
look for the creative work Meltdown – Days of Destruction;en
Look  the Kiss the  game ;en
find Mash Confusion;en
I'd  to  the  Chrome Dreams ;en
  the   Chasing After Shadows... Living with the Ghosts. ;en
I  a   Student Demonstration Time ;en
 Bullet  a Target, a television  ;en
find the TV show When I Was a Boy;en
 song schedule Come into the  ;en
Find me an album called Rejoicing with the Light;en
 creativity  Doomsday Comfort ;en
Please search for All the Lovers trailer.;en
I want to find the video game Masada Anniversary Edition Vol. 3: The Unknown Masada;en
 a  called Nature Reviews Genetics. ;en
Is the television show Kamen Rider OOO Wonderful: The Shogun and the 21 Core Medals streaming anywhere?;en
 I Could Fall  Love. ;en
 creative photograph Island  the Sea ;en
Look  the Compact Forest Proposal  ;en
How  I  the   Tinker Bell  the Legend  the NeverBeast? ;en
read the    the Bombay Natural History  ;en
Find the Hopeless Romantic photograph;en
Please find the Infrared Riding Hood TV show.;en
 the News  Seven-Thirty photograph ;en
What is the song The Beast from 20?;en
I want to find the show called Fresh Aire 7.;en
 I see the  Heroes  Might &  4? ;en
  the   Red Stallion  the Rockies ;en
 a television  called Servidor Apache. ;en
   Iraq  Sale: The War Profiteers ;en
Find The New Legend of Shaolin video game;en
Can i see the Boat People?;en
  the creative work Seven Pillars  Wisdom? ;en
Find The Garden of Eden;en
 creativity  A Catholic Education ;en
 Live  the Brixton Academy. ;en
Who published the novel JamesEdition?;en
  I buy a used copy  the   I Lie Around? ;en
  a television   A  to Hide. ;en
I want to see Plague Soundscapes;en
find a painting called The Other Bank;en
 creativity  photograph   Wonderful Day ;en
 Salò the TV  available to  anywhere? ;en
Show me the saga St. Elsewhere;en
play the album The Outpost;en
Find FANatic.;en
  I  the album So Fresh: The   Spring 2011 ;en
I'm looking to find Kiss Me Goodbye.;en
 The News Virginian  ;en
find a novel called Chemistry - An European Journal;en
  Fighting Vipers 2 ;en
I want  The   The Moon ;en
find the game Company of Heroes;en
I'd like to  the  series called Fires   ;en
 to After Dusk They  ;en
 the  The Naked Gun ;en
 the album Follow  Camel ;en
Play me the soundtrack for Nothing Personal.;en
I want to  the    to Eternity. ;en
 Returned to  Mind. ;en
 Mash Confusion ;en
 a  called Big Broadcast  1938 ;en
want to watch the TV show Treeful of Starling;en
  Devils to Some ;en
find movie titled Triumph of the Spirit;en
What type  movie  Houston Press? ;en
Please help me find the video game John Michael Montgomery discography.;en
Find a TV show called The God Boy.;en
  the novel  A Dictionary  Slang  Unconventional English ;en
find The Saint in New York, a show;en
  I  the creative works The Very   Simply Red ;en
find a game called So Long Self;en
  the work titled The Perfect Gentleman which  a  ;en
 The Cartel Vol. 2  ;en
Show The Bridge of San Luis Rey picture;en
Please look up the Around the World in Eighty Days movie.;en
   the Puppet  a String video game. ;en
  All That Matters ;en
I'm looking for the movie White Unicorn;en
 creative   Through the Back Door ;en
I want to watch TV series The Practical Pig;en
 the Electrochemical  Solid State Letters  ;en
  the video game The   Heroic Failures ;en
 Bump Off Lover ;en
Can I hear the song American High.;en
Go to BioRuby;en
Find Ek Boond Ishq.;en
Can you help   the television  Women  Death ;en
 Keep Your Right Up  ;en
can you get me the television show called Start It Up?;en
Show The Ancient Art of War picture;en
 get  The  Medical Journal  India game. ;en
  the song Spiderman  the Rings ;en
Please look for Orion You Came and You Took All My Marbles;en
  I view the  The Phantom Horse ;en
I want to see the trailer for The Entity;en
Find The Madwoman in the Attic.;en
book of Two for the Road;en
 All About Aubrey. ;en
Please find me Chance Pe Dance.;en
find Sweet Sensation;en
Wish to read the novel called The Wizard of Stone Mountain;en
 a    Fare Thee Well: Celebrating 50   the Grateful Dead ;en
Play me the show House of Stairs;en
 creative painting People &  ;en
 Karol: The Pope ;en
Where to buy book Charlie Countryman deve morire;en
 creativity  Pocket Full  Kryptonite ;en
  the movie Sonic Triple Trouble ;en
 to the  The   Pirates  the Mississippi ;en
Where can I get a photograph of Death Knows Your Name?;en
 the  On-Line Encyclopedia  Integer Sequences ;en
  the  Sex  Drugs  Jesus Christ ;en
 You   the Actors  the saga awards/ ;en
 search  the work, Wholehearted. ;en
What channel does the television show The RoxBox play on?;en
Find the Rewind the Film TV show;en
some  a Healthy  ;en
Find a video game called Batman: The Return of Bruce Wayne.;en
I'm   you to get  Jack  Shadows. ;en
 the Seamus Heaney Collected Poems  ;en
Show me The Heart Specialist;en
  the Martin Morning saga ;en
 get  the Critical Condition show. ;en
find the novel A Hat in Time ;en
  the Trick or Treats soundtrack. ;en
 Word of Mouth  me ;en
 a  called Night Life. ;en
Search for Polish Assault;en
find Five Spanish Songs, a photograph;en
How do I find the soundtrack African Development Perspectives Yearbook?;en
Search  Police Women  Cincinnati ;en
I want to  to  the  ;en
 a  called Battlefield Network. ;en
Find a game called Dynamite Warrior.;en
find the song Ticks;en
Where can I get the novel Flesh-Colored Horror;en
 the  Until the Whole  Hears ;en
 Cover Her Face ;en
    the  Night Long 3: The Final Chapter novel? ;en
   get  Come Away with  show? ;en
Find Z Cars.;en
find the movie You Must First Learn to Draw the Real;en
  up the Beauty  the Fire show. ;en
I need to episodes for the TV series, Fast Food Nation.;en
Pull up the book Live and Unreleased: The Radio Show;en
  the television  A City Sleeps ;en
show creativity of the picture The Little Death;en
find the picture Their Finest Hour;en
 A Family Torn Apart   ;en
Look for the High Noon TV show;en
Find a TV series called The Golden Hits of Sandie Shaw.;en
find an album called From the Terrace;en
find Sappho ;en
play the Discografia de The Pretty Reckless saga;en
  a link to the   Copper – Justice  brutal ;en
Help  search UFC  Fox show. ;en
Wish to hear the album Since I Saw You Last;en
Find me the soundtrack called Enter the Chicken;en
 the  Nur mit Dir – A  to  ;en
I'm   the saga Lifelong Ambitions ;en
Show me a copy of the picture Double Deal.;en
Search for the song called Journal of the American Statistical Association;en
 Another Time ;en
is there a Chinese Wikipedia;en
  & Peace Vol. 1 ;en
Search for the Complots;en
Where can I find the photograph of A Christmas Memory;en
 creativity of Southtown ;en
 the work I Looked  ;en
 the   I Build the Tower ;en
search for the painting Hess: A Biography;en
Where can I watch the trailer for Home Economics;en
What does For All the Wrong Reasons look like;en
find the game Selling Blue Elephants;en
Show Force of Nature;en
I want to      Movie: Black—Victini    White—Victini  Zekrom. ;en
search for TV show Live at Apollo;en
find the painting The Adventures of Teddy Ruxpin;en
search for trailer Jazz Impressions of the U.S.A.;en
 the  titled IParty with Victorious ;en
  the picture Boomtown ;en
TV series for The Thirty Nine Steps?;en
Find a soundtrack called The Outpost.;en
 the Home   the   TV series ;en
Please find me the work, Earth Intruders.;en
Show me the novel All I Need to Know;en
Play The News Virginian song;en
 Time Squared ;en
  a Chinese Wikipedia ;en
 The  Angry Moose ;en
Go to The Devil in the Deal:50 Secrets to Successful Dealmaking;en
Show The Blackberry Bush show;en
Where can I get the video game Faith in Chaos?;en
 was the  Start a  released? ;en
 the novel A Hat  Time ;en
I'd like to see The River of Stars TV series;en
  the documentary A Winter  Cyclists ;en
Get   Comprehensive Knowledge Archive Network ;en
 a photograph  Between the Days ;en
show creativity of Your Body Above Me;en
Where can I locate Leo the Lion for purchase;en
  up the song, Twist  shadows. ;en
I am looking for the TV series Strays;en
Show me NCAA College Football 2K3;en
 Trivial Pursuit: America  ;en
I want to listen to the song The Loving Spirit;en
 a painting called Boating  the  Epte. ;en
find ArcIMS, a picture;en
I'd  to  the   Time to Kill ;en
Look  the  Darkness Come Alive ;en
Please look up the painting, Modern times.;en
I  to see Cristo  India ;en
I want to see the television show The Muppet Christmas Carol;en
find Me. I Am Mariah… The Elusive Chanteuse;en
