expression;language
 the   Tenacious D in: The Pick  Destiny ;en
 Darker than black. ;en
find the picture Ultima VI: The False Prophet;en
Show me Happiness Was Free.;en
 to buy   Agent Hamilton: But  If  Concerns Your Daughter ;en
Can you   the  Hour song? ;en
Help me search UFC on Fox show.;en
Look for Summer with Monika;en
play the Putrefactive Infestation trailer;en
I'm looking  the   called The Supernatural Events  Campus ;en
Can I see the album SWAT Force?;en
Where can I download the game Miss Robin Hood;en
 the  series BET Awards 2013 ;en
    The Assassination  Jesse James  the Coward Robert Ford saga? ;en
I want to  to the  The   ;en
I'd like to see the album Heroes of Might and Magic IV;en
Where can I find the movie called Cracking Contraptions?;en
Want a work called  the  ;en
  the trailer  Gainesville Daily Register. ;en
Show  Bâton Rouge ;en
 Manual  Love 2. ;en
show me the television show Operation Thunderbolt;en
Where can I buy a hardcover copy of the book The Intangibles of Leadership?;en
  the TV series The   Saint Andrea ;en
What is the release date for the DVD called Wild Is the Wind?;en
 the  We Are Six saga ;en
 a TV  called The Extraordinary. ;en
 you  the  Beatmania IIDX 10th Style ;en
I'd  to  the  Beloved Rogues ;en
 Get It Together  TV  ;en
Show me Live at the Kings Center;en
Find a trailer called No Reservations.;en
I'd like to see the photograph The Light;en
Look up the Hard to Handle TV show;en
I want to watch Strange Brother;en
 the game Sugarfoot ;en
Find Stained Glass Windows.;en
Please find the movie Dancing Girl;en
Find a painting called Chettathi.;en
 you   the  Father  King game? ;en
where do I see the trailer for Live Dates;en
I'd like to play the video game Time to Kill;en
Please look up for Disney Universe.;en
 to buy  game  Think Fast ;en
I'd like to hear the   Just Once   Life. ;en
 The Case  the Frightened Lady. ;en
 The drive of  album ;en
 Trauma Center: New Blood,  album ;en
  Came Back for me ;en
help me find the work Graphics Animation System for Professionals;en
 The Matrix Revolutions ;en
  a trailer  The North-West Passage ;en
find a book called Outpost Firewall Pro;en
  Sweeney Todd -  diabolico barbiere di Fleet  ;en
Find the Son of Man show;en
 the Pop Has Freed Us  ;en
find Hope & Other Sins, a TV show;en
 the TV series Heart  Gold ;en
Show GD&TOP painting;en
  album called Just Call  Stupid. ;en
Find a television show called Swing High.;en
find the game titled IParty with Victorious;en
Get  the soundtrack  Sensation Comics. ;en
I'd like to see the show Migration;en
 me the Lace  Whiskey soundtrack ;en
 the   Kamen  OOO Wonderful: The Shogun  the  Core Medals streaming anywhere? ;en
Can you please look up the game, The Islanders?;en
I'd  to  the   Hola Mary Lou: Prom Night  ;en
 the Putrefactive Infestation  ;en
Please search for the Microsoft Safety Scanner television show.;en
find Welcome to the El-Palacio, a movie;en
  the A-Myin-thit TV series ;en
I'm looking to  the   Brought  the Sea. ;en
  I buy a photograph   the Love? ;en
 you please  The Notebook  Trigorin game? ;en
find the show The Naked Gun;en
 you   the work titled, A  Curious? ;en
Search for Teenage Mutant Hero Turtles: Fall of the Foot Clan photograph;en
Who was the artist who did the painting called Spyro 2: Season of Flame?;en
look for the book titled Iranian Journal of Fuzzy Systems;en
 the trailer for Live  Hull ;en
  the Journal  Toxicology  Environmental Health soundtrack ;en
Find me the book called Suffer;en
 the  Champ: Battle Boxing ;en
 The Prince  Temple Street, a  ;en
Find the Pop Has Freed Us saga;en
 Live at Bonnaroo. ;en
I'm   a  called Salvage Mice. ;en
 a   The Easy  to Stop Smoking. ;en
painting of Live from the El Rey Theatre;en
play the song S.F. sound furniture;en
Find a soundtrack called I Still Believe in You.;en
 The Sea Cabinet ;en
 the  Saturday Review ;en
find a saga called Set Sail the Prairie;en
Show me the photograph A Woman from the Street;en
Where can I watch the TV series Breed the Pain?;en
 Join the Dots: B-sides  Rarities ;en
  Kepler scientific workflow system ;en
  I  the photograph  A Christmas Memory ;en
  the song The Beast  20? ;en
find Live at Memory Lane;en
I want to watch the television show Little Things;en
 you  the  Bleach: Hell Chapter ;en
 a   called Shake Hands with Beef ;en
 a soundtrack  Lords  the Rising Sun ;en
 creative   Icewind Dale: Heart  Winter ;en
find the album Until the Whole World Hears;en
 can I  the novel Meast ;en
Download The Red Eagle   ;en
Find a trailer called Sheriff of Tombstone.;en
Find a show called Time Is Just the Same.;en
Find the book Cold Comfort;en
Can you find the television show Manifesto of Nevermore;en
 TV  Way  the Samurai 2 ;en
 50 Words  Snow creative picture ;en
  the cheapest price I  pay  the   The Darkest Cloud? ;en
I am looking for Shoot Me Down;en
Please find me the Platinum Box II song?;en
 Baby Workout ;en
 a  called Eurythmics discography. ;en
Find a photograph called Cope Park.;en
Can you find me the Dicey Business TV series?;en
 a TV  called Ace  Spades. ;en
What is Love in a Mist?;en
 the Knockabout soundtrack ;en
  the  Banquet  the Damned ;en
 the album Journeyman ;en
Search for Innocence from Hell;en
find Cluster Computing, a game;en
 to the  The Inflated Tear ;en
find TaskCracker for Outlook, a game;en
  God Bless the Child photograph ;en
Where can I find the picture Another Happy Ending;en
Find a television show called Main Street.;en
Find me Royal Astronomy;en
 The Black Girl  Search  God trailer ;en
 Zorro the game ;en
Can I see the the painting Another Life...Another End?;en
Where can I listen to the song The Imposter?;en
 the  series Box  Moon Light ;en
Find a TV show called The SoulTaker.;en
Show me the television show Children in Need Rocks 2013.;en
 I Love You Too, a  ;en
Where to buy Unarchigal;en
I    a work called Carry You  ;en
 Reproductions: Songs  The Human League ;en
Can you  the television  Manifesto  Nevermore ;en
find Join the Dots: B-sides and Rarities;en
 creative picture  Wonderful Town ;en
 a television  called Happy Trails ;en
  a photograph  The Daily Slovak News ;en
play The Sea Cabinet;en
 a  game called Peaches discography. ;en
 a  called A Perfect Day. ;en
 the trailer   the Good Ship Lollipop ;en
Find All Jets Are Gonna Fall Today saga;en
Can you please   D.R.E.A.M.? ;en
 me the  Filthy Lucre Live ;en
Show me the TV show My Only Wish;en
  the District 9 novel ;en
play Closer to the Sun album;en
How do I get the soundtrack for Hearts of Fencing?;en
  the soundtrack The Phoenix ;en
 to  painting Twelve Angry Men ;en
Want to  the  & Dragons:   Mystara ;en
Look up The Collection Volume One novel;en
 creative  named Pencil Thin Mustache ;en
Locate  the  entitled Isthmus. ;en
  the JQuery Mobile TV show ;en
Look up the This  Halloween  ;en
Show  Actress  the newest album. ;en
Where can I  get Lahore;en
 the  Vertically Challenged ;en
find Carry me in your dreams;en
 to buy   Countryman deve morire ;en
Find me Recorder and Randsell;en
  the  Live – Very Live  Concert ;en
 a    Trek: Starfleet Academy Starship Bridge Simulator. ;en
Get soundtrack of Comprehensive Knowledge Archive Network;en
I'd  to see the album Heroes  Might   IV ;en
   the work, All the Wrong Reasons. ;en
show me a picture of Nokia Football Crazy ;en
Please search the work, The Mercenary.;en
  the Editor & Publisher  series ;en
Look for a photograph of Tailwind;en
  the   Bugs Bunny Nips the Nips ;en
show Chocolate Rain creativity;en
I'd like to see Jacksonville Daily Progress saga;en
find The World Is a Game;en
 a painting called The   Folly. ;en
Pull up the trailer for 2000 Years – The Millennium Concert;en
I want to listen to the soundtrack And Then There Was Light;en
show the creativity of Ghost Dragon of Cold Mountain;en
Where can I purchase the Twenty Chickens for a Saddle saga?;en
Play Keep Their Heads Ringin’;en
Find The Transformers: Generations video game;en
Bombshells saga download;en
  a soundtrack  Ghost Town Prophecy ;en
I  to  the   Burn Baby Burn ;en
Show The Matrix Revolutions;en
 the  The Sword  the Lictor ;en
 up Applied Linguistics ;en
Where can I find the TV show Earth Defense Force 2025?;en
 the Blood  Sandman ;en
  the creative work  White Sugar ;en
Where is the TV   Universum ;en
Play trailer of Do Whatever Turns You On;en
  get the  show, ENTER THE MATRIX? ;en
  the work, Eve-Olution. ;en
  the Un provinciale a New York   ;en
Show me The Advocate;en
Where can I locate the game Legion of Mary: The Jerry Garcia Collection;en
  I  the TV series Polite People ;en
 TV  schedule  Offroad Legends ;en
 a television  called Tiny Dancer ;en
Look for Every Little Crook and Nanny;en
find a picture called Cahoots;en
  I  the TV  Earth Defense Force 2025? ;en
Where  Winterheart’s Guild ;en
Play the TV series Heart of Gold;en
 the Innocent  You Dream saga ;en
  the album called The   Mr. Jeremy Fisher ;en
  I view the   Workin’ with the  Davis Quintet ;en
find the photograph Hearts Burst into Fire;en
  the   called Take  to Your Heaven ;en
Find a book called Environment and Behavior.;en
 the Chemdex.com photograph ;en
  I  the game KAAKAI Newspaper ;en
 you  the soundtrack  Fast Food Nation ;en
show creativity of the game Everything at Once;en
I want to  the  The  Sleeps  ;en
 get  The Very   Chicago: Only the Beginning. ;en
Please search the title The Twilight Saga: Breaking Dawn Part 2.;en
  The Edge of Love photograph ;en
  the picture Nothin ;en
  locate the   the Ringo Sheena discography ;en
Where to buy painting Target Practice;en
 the Collision  Black painting ;en
I'd like to see the book City University of Hong Kong Law Review;en
Find Live at Bonnaroo.;en
Look  Conducting  the Grave ;en
play Baby Workout;en
play Another Time;en
What  the TV  Comfort? ;en
I'm   1634: The Ram Rebellion. ;en
Can you find me the Stand Proud book?;en
Can you pull up Channel M News;en
Find The Ghost of Tom Joad;en
 the album Smoke  Mirrors ;en
Find me the Young Doctors in Love TV show;en
Show me Dangers of the Canadian Mounted;en
 a television  called Swing High. ;en
find the TV show Hot Air;en
Find the Cold Dead Hand video game for me;en
  the movie Operetta  the Theatre Organ ;en
Find by title Champagne Showers;en
Can you find me the Back When I Knew It All album?;en
 Ek Boond Ishq. ;en
 Spirit  the Bush. ;en
Where can I purchase the video game The Blue Generation;en
 movie titled Triumph  the Spirit ;en
 a trailer called Sheriff  Tombstone. ;en
 a photograph  XQuery API  Java ;en
Find me the TV show The First Bite.;en
Can you look up the Galsoft Linux TV series?;en
 Trust  the Lord –  Worship  Don Moen. ;en
Looking for video game For Those Who Would Walk with the Gods;en
Locate me the novel entitled Isthmus.;en
Where did the painting Highs in the Mid-Sixties go?;en
show Nightcall ;en
 Mother Earth, a TV  ;en
 creativity of painting of  Too ;en
Find The Cerebellum book;en
Show me the I Can Hear the Sea movie;en
Search for the Un provinciale a New York TV show;en
Show me work of Truth and Tolerance;en
 me Recorder  Randsell ;en
Get me the Elvis’ Christmas Album TV show.;en
 The Legend  Jesse James novel ;en
  the Paranormal Activity:  Dimension album? ;en
  the creative  Meltdown – Days  Destruction ;en
search  the  Champagne Showers ;en
  Cuan Dubh Drilseach ;en
  the No Bigger than a Minute  ;en
find Loved Ones for me;en
Show  the  The Republican Brain ;en
I'm looking for the movie called The Beast that Shouted Love at the Heart of the World.;en
   album called Rejoicing with the Light ;en
  the painting called The Descendants. ;en
Find Half a Sixpence photograph;en
What is the TV show Comfort?;en
find the movie Don’t Break the Heart That Loves You;en
  up the painting, Modern times. ;en
I want the   Walt  Mickey ;en
 a photograph called  Cats  the Beach ;en
  the novel The Argumentative Indian ;en
find the novel A Civil War: Army vs. Navy;en
 a  called Bruce Lee ;en
Show me My Princess;en
Find me Shack Out on 101;en
I want to play the video game ESPN Major League Soccer;en
Where can I view the TV series of W.I.T.C.H.;en
Please   Catch a Falling Star ;en
find a movie called Bruce Lee;en
I want to listen to the soundtrack Bed of Roses;en
 a soundtrack called  Gear Australia. ;en
  the album  Songs About Lenin ;en
Find Fragile Frontiers: The Secret History of Mumbai Terror Attacks.;en
  the painting Hess: A Biography ;en
read the Black-Body Theory and the Quantum Discontinuity novel;en
 fine  Worms Clan Wars. ;en
Get me the Trick or Treats soundtrack.;en
 a  game called Craters  the Sac ;en
  the  Just to See You Smile. ;en
 up the Act  Valor TV  ;en
I  looking  Shoot Me Down ;en
   the Welcome to the Rileys game. ;en
  the television   South California Purples ;en
  The River of Love saga ;en
 The Girlfriend Experience, a television  ;en
find a television show  called I Got a Bag of My Own;en
Where can I view the photograph Occasional Wife;en
 a television  called Milagros: Girl  Away ;en
I want to watch the TV series Rat Pack;en
Find a game called An Aerial Joy Ride.;en
 me the Balance  Timing book ;en
show video game name Find the Colour;en
find Long Walk to Forever, a novel;en
Find Stays in Mexico.;en
Find The Photographic Journal.;en
 the Labyrinthe game ;en
Find a novel called Matching Dreams.;en
 the  S.F. sound furniture ;en
Help me find the work titled SingStar Take That;en
Please get me the Crime and Punishment in Suburbia trailer.;en
 a  called You Cross  Path. ;en
I want to watch Manthan;en
 me Nights  Harlem ;en
show schedule for Loved by Thousands;en
Show me the trailer for American Education: The National Experience.;en
How can I see the show Pulse 2: Afterlife?;en
find a game called Bump the Show;en
 the photograph Canaich ;en
 creativity  Cross Currents ;en
  the   All Around Performance Horse Weekly ;en
I'm   the  called The Origin  the Milky Way ;en
  Live Forever: The Rise  Fall  Brit Pop TV  ;en
Show me the saga My Darling;en
find the novel Make Peace Not War;en
Show Famous Classic Tales television show;en
Where can I find a copy of I Bury the Living?;en
show Nightcall;en
 a  called The Dragon. ;en
I want to listen to Keep the Faith;en
Find The International Journal of Robotics Research soundtrack;en
find Racing the Beam: The Atari Video Computer System;en
Find a TV series called Live Hearts.;en
  the Fair Warning saga ;en
I want to see the trailer for No One;en
Play The Aviation Cocktail album;en
 History  North Dakota, a  series ;en
 the App Store ;en
   the  series titled I Need Romance. ;en
 creative  Fear Thy Neighbor ;en
Find a show called Lipstick Vogue.;en
  locate The Tristan Betrayal ;en
Where can I watch the television show called Fangs of the Arctic?;en
search for television show Windows Live TV;en
  the  Last Flight To Abuja ;en
Can you locate West Coast Wrestling Connection;en
  I watch watch the television  Catch ;en
I'm looking  the   Masterful Mystery Tour ;en
Looking for novel Build Engine;en
 you  the novel Stoneage Romeos ;en
find Home Fires;en
Hook me up with a song by Dancing Girl.;en
Go to the photograph The Inflated Tear ;en
  I  the  game The Wild Geese? ;en
I  looking  the   called the Flight  the Lost Balloon ;en
Help me find the saga titled The Eternal Return;en
Show  Tears On  Pillow. ;en
I want to  the   Rat Pack ;en
show creativity of Construction Project Information Committee;en
Find a television show called Twisted.;en
I'd  to  the  The Ooze ;en
 The Catholic Sun  ;en
I'd  to  the  Onion SportsDome ;en
Find the photograph The Remix please;en
  TERA: The Exiled Realm  Arborea ;en
I'd like to play the song In a Reverie;en
find To Each His Own Cinema, an album;en
  A Black Ribbon  Deborah. ;en
 you   The Real McCoy novel? ;en
Please   the Magic Hour saga. ;en
Looking for the trailer for Shaolin Temple;en
What painting is on The Cure discography?;en
Find the television show titled Spatial Query Server;en
Find UNDER NIGHT IN-BIRTH;en
Get  information  The Riverfront Times ;en
 channel  the television  The RoxBox  on? ;en
Find Later That Evening;en
 The Caveman   ;en
find the photograph JBoss Enterprise SOA Platform;en
I need a book called Student Demonstration Time;en
 a  called The  World Factbook. ;en
find a TV series called Armageddon Summer;en
I want to watch the television show Symphony for Solo Piano;en
   the television show,  Hill & Tony Linnane. ;en
 creative  or Miami Vice Theme ;en
Search for the George and the Big Bang TV show;en
 a  called Gladiators Australian  1 ;en
Can you find me the trailer of the Hippocratic Oath?;en
 creativity  the game Everything  Once ;en
Please find me the Youth Against Fascism television show.;en
 a  called Industry. ;en
I want to   Soundscapes ;en
 the Baldur’s Gate II: Throne  Bhaal  ;en
Where can I buy a Barometer Clock;en
 the Ashley Tisdale discography TV  ;en
  the  F-1 Grand Prix Part II ;en
 get  the Crime  Punishment  Suburbia trailer. ;en
 the  Peace Arch News ;en
 pull up Nothing Feels  ;en
  the TV  The Women  Our Home ;en
Find a television show called Basement Screams.;en
 the trailer Platinum  Da Ghetto ;en
 a   called Engaged to the Unidentified ;en
  Spanish Songs, a photograph ;en
find a painting called Mister Whiskers: My Favourite Nursery Rhymes;en
play the movie I Want My MTV: The Uncensored Story of the Music Video Revolution;en
 get  Exploring the Reef TV  ;en
Find a soundtrack called The Alice Cooper Show.;en
Find The Earth Is a Sinful Song;en
 The Magical World  Roger Whittaker ;en
 you pull  The Sanford Herald ;en
I want to    the Hunter ;en
Please find me the work, Ace of Spades.;en
I'd  to  the  The Principle  Hope ;en
I want to  the MAXIMUM   ;en
 Me. I  Mariah… The  Chanteuse ;en
 Famous Classic Tales   ;en
  Half a Life ;en
Show Second Generation album;en
Find All About Aubrey.;en
  Cum  Feel the Noize the  game ;en
 can I see the  Twentysomething ;en
   Might as Well Rain Until September ;en
  I see the trailer  Take  to the King ;en
 a  called Bronco Billy. ;en
find the novel The Thunder Rolls;en
 a  called Some Kind  Dangerous. ;en
  I buy the soundtrack Bridge  Souls ;en
  the Spartan: Total Warrior painting ;en
 Your Personal Touch. ;en
Where can I watch the TV series The Trifecta?;en
Look for the Editor & Publisher TV series;en
  Down Babylon: The Island Anthology ;en
play the game Sugarfoot;en
 I  the   The Closer I Get? ;en
find a movie called No More Sadface;en
   the Youth Against Fascism television show. ;en
 the  called Black Wings  Destiny ;en
 a TV  called Union. ;en
Please find the Packed to the Rafters work.;en
Find Head Start;en
  the trailer  Feel the Passion. ;en
find a show called The Crowd Roars;en
look for the show named Chestnut Mare;en
  I  the saga Addicted to Love ;en
 the movie Ircle ;en
I'd   the saga PlayCanvas. ;en
I'd like to see Completely Well;en
 to  the soundtrack called   the Valley ;en
 The New Legend  Shaolin  game ;en
can you get me the trailer of The Multiversity?;en
 you pull up the   Awards  1975 ;en
Find the Now We Are Six saga;en
 up the Hard to Handle   ;en
Can you find me the My Father My King game?;en
 Wish  Were Here. ;en
 a painting  Smash Crusher. ;en
Find the game Just Dance Greatest Hits;en
I want to  to the    Editions ;en
find a game called The Oh in Ohio;en
 a  called Tron: Legacy Reconfigured ;en
Show me Bâton Rouge;en
trailer of Gate of Thunder;en
  I  the TV series The Trifecta? ;en
Can you please look up the TV series, An Experiment with Time?;en
 a game called The   Loves  Tschaikovsky. ;en
Can you locate the saga for the Ringo Sheena discography;en
 the television  Birth  the Cool ;en
read the novel Friend: The Great Legacy;en
Look for the creative work called White Sugar;en
find Harry Potter and the Deathly Hallows – Part 2;en
I'm looking for Circus World.;en
I want to watch the show Railroad Model Craftsman;en
Where to see painting Twelve Angry Men;en
 The International   Robotics Research soundtrack ;en
Find the Exile and the Kingdom;en
Show me the TV show Have a Nice Day;en
  the Lights Out saga ;en
Look for the Learning & Behavior picture;en
 does  All the Wrong Reasons  like ;en
play Off the Ground;en
  I stream a television   Safety EP? ;en
  I  the painting RSS tracking ;en
 The Best  Holiday saga ;en
Need to find a creative work with the title Sometimes the Blues Is Just a Passing Bird;en
Search  The World  a Game ;en
 Terminator 3: The Redemption, a  ;en
Pull up Sweeney Todd - Il diabolico barbiere di Fleet Street;en
is there a program about The Last Flight?;en
  the  entitled I’ll Take Care  You. ;en
  Teenage Mutant Hero Turtles: Fall  the Foot Clan  ;en
Where can I buy the Something Borrowed saga?;en
Find Beavis and Butt-head;en
show creative game Fear Thy Neighbor;en
I  a   Days  Wine  Roses  Other  Requests ;en
 the game Company  Heroes ;en
Find a soundtrack called The Christmas Shoes.;en
  I  TV series Shopping Spree ;en
 the   High Hopes & Heartbreak ;en
I want to  the   A State  Mind ;en
Look  the Girl  Mirror movie ;en
 Drumline: A  Beat, a picture ;en
I am looking for the TV show called the Flight of the Lost Balloon;en
find A man needs a maid;en
  the saga The Buffalo Boy ;en
 you pull  Queen  the Organ ;en
show me The Best Of: Volume 1 TV series;en
find the Deathsmiles II soundtrack;en
Go to Your Heart Belongs to Me;en
 creativity  The Force  the Power ;en
Find me the novel The Argumentative Indian;en
  the  selling price  the  The Sims 3: Island Paradise? ;en
find the photograph Move Any Mountain;en
Find a novel called On the Case with Paula Zahn.;en
show  of From South Africa to South Carolina;en
I want to listen to the song Only the Greatest;en
Show me the book Playlist: The Very Best of Dolly Parton;en
  the photograph  Minutes to Midnight ;en
 a painting  Pulsions. ;en
I am looking for a work called Carry You Home;en
show creativity in photograph of Grace Submerged;en
Find a book called The Magic Christmas Tree.;en
Find The Killing Fields.;en
Find Reverence for me;en
I want to find The Adventures of Lomax.;en
 the  Your Hand  ;en
Where can I find The Brave Little Toaster To The Rescue book?;en
Where to get painting of The Man in the White Suit;en
 the  called the Black Lamp ;en
show song Black Heart White Soul;en
 the  Yoshimi Battles the Hip-Hop  ;en
Go to Attack of the Planet Smashers;en
 The 180. ;en
 a photograph  The Lighthouse  the Sea ;en
 a   called Batman: The Return  Bruce Wayne. ;en
 a     Live: Save the Children Speed Live 2003 ;en
   Pokémon: The Mastermind  Mirage Pokémon ;en
 can I  the picture  House Foundation ;en
Play me East Side Story;en
Please search for the Puppet on a String video game.;en
Show me The Courts of Chaos;en
show creative game Elements of Life: Remixed;en
Can I hear the song Visual Audio Sensory Theater?;en
show creativity of What Is Dead May Never Die;en
  album called Thursday Night Baseball. ;en
show me the photograph with the title The Denial;en
Find Journeyman.;en
FInd trailer for Iraq for Sale: The War Profiteers;en
 creativity  song A Discord Electric ;en
Play me the song Aap To Aise Na The.;en
 The Little Death, a  ;en
 The Invisible Hook  ;en
find the song Occasional Wife;en
Pull  the   2000  – The Millennium Concert ;en
play The Case of the Whitechapel Vampire TV series;en
Play me the TV show SEAL Team;en
play the song Memories Are My Only Witness;en
 up The  Archer 2 ;en
Play me the soundtrack Ready;en
I need to find Best of the West Rides Again;en
Find me a movie with the name Oshin;en
find the painting Strong Enough;en
Show A Family Torn Apart TV show;en
Play the soundtrack for The Lord of the Rings: Conquest;en
 the Put Yourself  His Place  ;en
 Doggy Day School,  album ;en
Find a trailer called Storm Center.;en
Are   painting  the 1st Concert  Yeah! 1999? ;en
 a saga called The   Riley ;en
 pull  the album, The  War ;en
Can you help me find ScholarMate?;en
find Innocent world;en
Find me The Rise and Fall of the Great Lakes saga.;en
Listen to Dragon Ball: Music Collection;en
I'd like to see the picture TeleForm;en
Where can I find the work It Was Raining That Night?;en
show creative soundtrack Pitch Black Brigade;en
Find The Best Man Holiday saga;en
Please   Orion You Came  You Took All  Marbles ;en
I'm   a  titled Bowie  the Beeb ;en
 the Discografia  The Pretty Reckless  ;en
 the game Just Dance Greatest  ;en
Show the Soonchild painting;en
Find The Case of the Frightened Lady.;en
search for the picture Boomtown;en
I'd like to find Scriptures of the Golden Eternity TV series;en
 to get painting  The   the White Suit ;en
 to buy  Target Practice ;en
I want to  the  The  Hawk ;en
 a  called Greatest Time  Year. ;en
I'd  to  the  Tianjin Today  News ;en
Looking for Kepler scientific workflow system;en
I want a photograph of Elizabeth the Queen;en
I want to watch the television show Naked II;en
  the game The Last Horror  ;en
Do an image search for the picture Perfect Storm: Disasters That Changed The World;en
 up The Making  Milwaukee ;en
Help me locate a game called The Master of Ballantrae.;en
 The Collectors  game ;en
Where can I watch the television show You Make Me Hate Music;en
 the  game The Genesis Machine ;en
I want to  the    Cuts Both Ways ;en
I want to read the novel Love Is in Control;en
Show me the album Til the Morning;en
  the  called Lest We Forget: The  of? ;en
I'm   the   titled The Lonergan Review ;en
find the show The Best of: The Township Idols;en
