expression;language
show creative video game In My Own Backyard;en
I want to  the   Champion ;en
 the Deathsmiles II  ;en
 Minutes to Midnight  ;en
play the Ashley Tisdale discography TV show;en
  the   Hola Mary Lou: Prom Night II. ;en
Find a book called The CIA World Factbook.;en
Where can I purchase the TV show Time for Heroes;en
find the photograph Underneath the Tree;en
I'd like to hear the song Daimidaler: Prince vs Penguin Empire;en
What is the trailer for Feel the Passion.;en
Show me the album Clarke;en
 Bliss Torn  Emptiness ;en
show creativity of soundtrack IHeartRadio Countdown;en
  Thirayum Theeravum video game. ;en
 painting of Waiting  Snow  Havana ;en
Please get me the work Shirley aviatrice.;en
  the picture Creatures of Light  Darkness ;en
Show me Horton and the Kwuggerbug and More Lost Stories;en
I'm  to  The Final Solution  game. ;en
 the Koi to Senkyo to Chocolate   ;en
 the TV  Wicked City ;en
 a  called Way Down Yonder   Orleans ;en
I  to  the work Brotherly  ;en
 the Sarah the Teen  game ;en
Search  High Chicago ;en
Play Pirates of the Caribbean Online;en
  the  Playlist: The Very Best  Dolly Parton ;en
find Unfinished portrait of General Bonaparte;en
find the movie Take Another Picture;en
Find me the Travel Weekly;en
I'm looking for a photograph called Merry Christmas.;en
 a  series called Armageddon Summer ;en
Info on show Natural Language and Linguistic Theory;en
find the TV show Tribute to the Troops;en
find the TV series Treeful of Starling;en
 the  JBoss Enterprise SOA Platform ;en
 can I  the painting  Without Condition ;en
 Closer to the Sun  ;en
  The Young Warriors game. ;en
Please find me the Rear Mirror saga.;en
I'd like to  the  called The  ;en
 a painting  Chettathi. ;en
Find a trailer called Just Say Noël.;en
 a  called The Crowd Roars ;en
find the trailer for The Spooky Sisters;en
show creative video game name Foros Timis Ston Greco;en
Get Jump Down painting;en
I want the photograph of Walt Before Mickey;en
Can you find the painting The Crow: Original Motion Picture Soundtrack;en
Find an album called Thursday Night Baseball.;en
find the movie Shake Your Spirit;en
Look for A Terrible Vengeance;en
What is A Romance of the Halifax Disaster;en
  Psychologist, a game ;en
Need a creative work with the title Unholy Confessions;en
  the  Harry Tries to Marry photograph ;en
Find the TV show titled The Three Leaps of Wang Lun;en
Show me the television show The Angry Mob.;en
Buy  Brokeback Mountain ;en
 the   I – The Arcane Dominion ;en
 the  A  School Gyrls Holla-Day. ;en
Can you pull up Queen of the Organ;en
show creativity of The Greatest Movie Ever Sold;en
 The Transformers: Generations  game ;en
Find Make Your Play;en
 the Via Dolorosa: Songs  Redemption  ;en
Find a TV series called All Time Greatest Movie Songs.;en
 the  Compiled fragments 1997-2003 ;en
 The Photographic Journal. ;en
I'd  to  Jack ;en
Find me the song called The Budapest Beacon.;en
Find  Tribute show ;en
  I watch the trailer  Home Economics ;en
  i  the television  The Private Affairs  Bel Ami? ;en
find Flesh and Bullets;en
show 50 Words for Snow creative picture;en
  the album Frog  the Birdsong ;en
find the show How to Meet the Lucky Stars;en
find the picture Nur mit Dir – A Walk to Remember;en
Please   the work, Instrumental Directions. ;en
find Terminator 3: The Redemption, a picture;en
  the Spirit the Earth Aflame  show. ;en
find the Carrousel saga;en
 Casting Crowns discography ;en
 creativity  photograph of Grace Submerged ;en
  the  Your Heart Stops Beating photograph ;en
show creative trailer of The Sword of the Lord;en
find a soundtrack for Meditations;en
Look  Every Little Crook  Nanny ;en
Show me the show Live at the Fillmore East;en
 a picture called Blink   Eye. ;en
find Amanda Palmer Goes Down Under;en
Find a TV series called White Bread Black Beer.;en
 the  titled The Mole  Live  the Roxy ;en
I  the  titled Lullaby  Broadway ;en
Where can I find the soundtrack for Steamboat Bill?;en
some me a Healthy picture;en
Find the novel called Loyalty.;en
I'd like to see Level Headed ;en
I'd like to find the book called The Years;en
find Flesh  Bullets ;en
 Live  Bearsville Theater ;en
 to Attack  the Planet Smashers ;en
play the TV show Wicked City;en
Pull  the  Live  Unreleased: The Radio  ;en
Find a photograph called Shout It Out.;en
Show Panic in the Streets;en
Show the Chemdex.com photograph;en
  The Park album ;en
  the   Guitar Heaven: Santana Performs the Greatest Guitar   All  ;en
 Live  Tokyo for me ;en
Where can I purchase Paradise Tonight online?;en
Can you help me search the album titled PlayMaker Football?;en
Please pull up Nothing Feels Good;en
Show Minutes to Midnight photograph;en
What is the cheapest online price for the Instincts saga?;en
Find a photograph of Adventure Time: The Secret of the Nameless Kingdom;en
Please search the Karobar Economic Daily picture.;en
  The Tivington Nott ;en
Find The Press of Atlantic City movie;en
 creative album Heredity ;en
Wish to fins a television show called Whole Again;en
Look up Three Fantastic Dances;en
I'd like to see Confessions of an Indian Teenager;en
Look for Little Computer People;en
 a  called  Aerial Joy Ride. ;en
Look for the Chu Chu and the Philly Flash picture;en
 the  ICAC Investigators 2014 ;en
 a  series called Live Hearts. ;en
find a soundtrack called The Book of Folly;en
 the  series Truly Fine Citizen ;en
 the creativity  saga The Dissociatives ;en
Can I see the TV show The Closer I Get?;en
show creativity of The Force Behind the Power;en
 the  The Crowd Roars ;en
  the television  called Monster Mash ;en
Find a painting called Beyond the Neighbourhood.;en
Play the Food Uncut soundtrack;en
Find a TV show called Directions Home.;en
 can I  Lonely Hearts ;en
Find a book called The Polish Bride.;en
Find a novel called East Liberty;en
 it possible to  the  Live  Europe online? ;en
  art called Cassidy. ;en
 Pat Garrett y  the Kid. ;en
I want to listen to the soundtrack Adobe Digital Editions;en
find a movie called October Road;en
I'd like to see the The Gathering Storm TV series;en
find Cover Her Face;en
Need to find the TV series called Administrative Behavior;en
Search  The Dark Side  the Mind  ;en
play The Catholic Sun album;en
Where can I find information on Brats in Battalions?;en
Search for The Nations;en
show  PhotoScape ;en
Show the Put Yourself in His Place game;en
Lets see the TV series 7even Year Itch.;en
Search  Polish Assault ;en
I'm looking for a novel called And Then There Was Light.;en
Look for the TV series The Stars at Saint Andrea;en
Lets  the   7even Year Itch. ;en
Show me the album Three Songs About Lenin ;en
 video game  The Quality of  ;en
I am looking for the TV show titled Catchphrase;en
Find I Could Fall in Love.;en
Find The Way West show;en
find a video game called Craters of the Sac;en
Please search for Sealed with a Kiss movie.;en
 the They Came  Somewhere Else  ;en
painting  Live  the El Rey  ;en
I want to  the   Down  Abby ;en
 a  called  fondo al buio. ;en
play the movie White Christmas;en
 Under the Sea creative  game ;en
Where can I find the picture the Japanese Lovesong near me?;en
 creative   The Sword  the Lord ;en
Show The Late Great Townes Van Zandt;en
 a   A Very Special Christmas 7. ;en
Get me the soundtrack from Sensation Comics.;en
Find me the When Harry Tries to Marry photograph;en
Can you find me the work, Frisbee: The Life and Death of a Hippie Preacher?;en
Look up The Stars Are Indifferent to Astronomy;en
  the  Johnny Cash: The Complete Columbia  Collection ;en
show game Alien Breed II - The Horror Continues;en
I'm   the  to  or Divine - Live   York City. ;en
Find the show Manthan;en
Find a TV show called The Extraordinary.;en
Show The Night Riders;en
find the TV series Shaun the Sheep;en
  I purchase the   The Royal Sessions ;en
 you   the Jack  En Concert picture? ;en
 the  Bad Day  the Block ;en
Where do get photograph of My Own Best Enemy;en
look  the  named Chestnut Mare ;en
Please find me The Hanging Valley movie.;en
where can I find the video game called Izuna 2: The Unemployed Ninja Returns;en
 a photograph called Call  Me. ;en
 Cry Baby Lane ;en
Search for the Abel Sánchez: The History of a Passion novel;en
Nightwork soundtrack download;en
 a   Billboard Hot R&B Hits: 1981 ;en
 the Whispering Willows  ;en
Do you know of a song by the Mande Studies Association?;en
find 300: March to Glory, a song;en
Find a picture called Every Little Thing She Does Is Magic.;en
Give me the Spirit the Earth Aflame TV show.;en
I want to  to the  The   ;en
Find a video game called Merry Andrew.;en
I want to watch the movie Maxime;en
find the picture Louder Than Bombs;en
I'm trying to find Annunciation.;en
Find an album called Just Call Me Stupid.;en
 Off the Ground ;en
  the Line  Duty: Street War. ;en
 the  Don’t Break the Heart  Loves  ;en
show Get It Together on TV show;en
Show me the book It Might as Well Be Spring;en
I need info on the video game Iron Fist;en
Find Beavis  Butt-head ;en
Need find the book called Hollywood Connection;en
find a game called Albino Blacksheep;en
find Starcross ;en
I want to  the  X   Manager ;en
 trailer  Do Whatever Turns You  ;en
find Jono  Ben ;en
  I listen to the  The Lost Worlds   Earth ;en
Find Landing on Water.;en
Look up Applied Linguistics;en
 Friendship Way ;en
show video game and The Quality of Life;en
I want to  the   Krieg  Chinatown ;en
I'm looking  a   Fresh Air ;en
Where can I see the show Latin for Lovers?;en
Show me the photograph of King Charles;en
 system  Bloodhounds  Broadway the game for? ;en
Find me the picture The Id;en
find a soundtrack called Billboard Hot R&B Hits: 1981;en
 Print the Legend  ;en
 the Burn the Sky Down  ;en
I'd like to  the   As Tears Go  ;en
I want to listen to the Music of Ghost in the Shell: Stand Alone Complex;en
I need to find the saga Trail of the Yukon;en
  I  Harry Potter  the Philosopher’s Stone ;en
Please get me Rough and Ready saga.;en
 Innocent world ;en
find Phinally Phamous;en
Find a novel called Nature Reviews Genetics.;en
 a  called Time  Just the Same. ;en
Show the Day the Earth Caught Fire movie;en
Find me The Memorial;en
Find me the picture Live in Paris 1975;en
 the novel WWE Legends  WrestleMania ;en
Find Think: act;en
Show me the painting called The Descendants.;en
Look up the This Is Halloween trailer;en
  the   Have a Nice Day ;en
Show Family Plot;en
 i  the Encounters? ;en
Find me the book The Van Dyke Show;en
 a photograph called Shout  Out. ;en
Where can I buy a used copy of the game called I Lie Around?;en
 The International   Robotics Research soundtrack ;en
Where can I find the Ricky Skaggs discography;en
Show The Man from London video game;en
 Merry Arizona 97: Desert  Shine  Christmas ;en
Look for Conducting from the Grave;en
I'm   the  titled Converging Conspiracies ;en
 The Ancient Art  War picture ;en
  the television  Children   Rocks 2013. ;en
 the Black-Body Theory  the Quantum Discontinuity  ;en
I'd  to  Miss Congeniality ;en
Please find me the picture of The Getaway: Black Monday.;en
Please find the album The Party Scene;en
Find a novel called A Perfect Day.;en
Can you   the Restless Natives? ;en
Where can I purchase Wuthering Heights;en
  album called Stumble.Stop.Repeat ;en
 you please   The Biggest Loser Brunei: The Spirit   photograph? ;en
 the Hell of a  movie ;en
search  TV show Live  Apollo ;en
show me the picture Unfinished Monkey Business;en
 the  Underneath the Tree ;en
 Cluster Computing, a  ;en
 A   Two Cities, a painting ;en
 the   titled Timerider: The Adventure  Lyle Swann ;en
find a video game called A Stroll in the Pork;en
find Saison 7 de Sons of Anarchy;en
I    The Complete Fillmore East Concerts ;en
Looking for the painting Last Flight To Abuja;en
 a   Sleeping with the Enemy. ;en
Info   Natural Language  Linguistic Theory ;en
 a  called Dynamite Warrior. ;en
  I  the  Skip to the End? ;en
Get me a Johnny Cool photograph;en
show schedule for Cin cin;en
 The Widow  Saint-Pierre saga ;en
Find me the JQuery Mobile TV show;en
find a Love song;en
Find a soundtrack called New Religion.;en
Where can I find the TV show A Step Away;en
 video game name  the Colour ;en
Play me Memoirs of Modern Love: Curious Age;en
Look for All That Matters;en
  A Terrible Vengeance ;en
 Framing the Early  Ages, a  ;en
I'd  to  Apartment Hunting. ;en
find the show Go with the Flow;en
Show Olympia 81 saga;en
I'm looking for the video game Masterful Mystery Tour;en
I'm   a  called The Adventures  Lolo II ;en
I'm trying to find the show Chant II ;en
Where can I see the show Kind of Glue?;en
 up the   Operace Silver A ;en
Show me the photograph of Minutes to Midnight;en
find Touch of Eva, a TV show I want to see;en
Please get me Exploring the Reef TV show;en
I want to watch Escape the Fate discography;en
Please search Crossing Muddy Waters work;en
Please  up Amrithavaahini ;en
Find Clash of the Codes.;en
  the TV series  App Store ;en
find Framing the Early Middle Ages, a game;en
Please pull up the   Stares  Whispers ;en
  I watch the television  called Fangs  the Arctic? ;en
Find the Return to Grace saga;en
  I  Papers  Regional Science, the album? ;en
I'm  to  Suryavanshi. ;en
Search for To Heart 2;en
  the Chu Chu  the Philly Flash  ;en
Can you find the movie Accidentally in Love;en
Please get me The National Medical Journal of India game.;en
Find the Endangered Species song;en
find the Radical History Review saga;en
What is the Michael Moore Is a Big Fat Stupid White Man video game?;en
Find the show The Sword of the Lictor;en
 the movie Chaos Is  ;en
Where to get painting of Channel 4 News;en
Show the Glass Cloud – Single TV series;en
Find The Mary Van Note Show;en
 Disney Sing It! –   Musical 3: Senior  ;en
 search  All the Lovers trailer. ;en
Can you pull up My Name Is Brain Brian;en
 me the trailer  Star Control. ;en
Show me the photograph called Hola Mary Lou: Prom Night II.;en
 can I  the  Game  Death II ;en
Find a painting called Break Down.;en
 The Lateness  the Hour ;en
show me PhotoScape;en
Look for Hail Satanas We Are The Black Legions;en
Where can I  information  Brats  Battalions? ;en
search   Turn Back the Clock ;en
Help me find From Time to Time, a TV show;en
Can you find the show The Dumping Ground Survival Files;en
 the    Spirits - Shōnen Toppa Bashin ;en
Please find the work titled Talking to Heaven;en
Can you find the photograph titled So Long Self;en
I want to  the  Godslayer ;en
 a  called No. 1  Heaven. ;en
 the   Bill Cosby Presents the Cosnarati: State  Emergency ;en
Find a song called You Cross My Path.;en
Where can I read the book The Omega Stone?;en
Play a trailer for Sencha Touch;en
Where can I view the photograph The Phantom Horse;en
 the TV series Treeful  Starling ;en
When and where is DistroWatch playing;en
 The Blue Meaning   ;en
 Loved Ones  me ;en
Show me the lowest price for the game Sinatra Reprise: The Very Good Years.;en
  I  the TV  A Step Away ;en
Look for the Kiss the Girls game;en
 He Who Fears the Wolf   ;en
How  I  the television  Straight Shooter? ;en
 The Information: A History  ;en
 an album called  the Terrace ;en
Find a TV show called Ace of Spades.;en
 TV   Archive.is ;en
I want to read the book Between a Rock and a Hard Place;en
I'm looking  the  called Summer  Fear ;en
 The Family Jams  ;en
Where can I listen to the song The Lost Worlds of Planet Earth;en
where can I see the television show Falling Away from Me;en
Find a television show called Servidor Apache.;en
Can you find the soundtrack for Westcountry Live;en
 creativity  novel Lock ;en
I'm looking for the saga Lifelong Ambitions;en
I need to find the work Brotherly Love;en
 the  series Shaun the Sheep ;en
I  to  the creative work Prince  ;en
Show me the television show called South California Purples;en
 Saison 7 de Sons  Anarchy ;en
 a  game called The Last  Virgin. ;en
 a   called The Ambient Collection. ;en
play Cry Baby Lane;en
Please   Chance Pe Dance. ;en
 The Best  Minnie Riperton saga ;en
Find Changes: A Love Story.;en
 creativity  saga Frontier Marshal ;en
show creative Devils to Some;en
Show me Interesting Times: The Secret of My Success;en
 search  the Two Faces   Girlfriend saga. ;en
show Under the Sea creative video game;en
Read The Open Ecology Journal;en
find me a game called Merle Haggard Presents His 30th Album;en
find If These Walls Could Talk;en
find a photograph called XQuery API for Java;en
When was the soundtrack for Those Were the Days – The Best of Leningrad Cowboys published?;en
 Sweet Sensation ;en
 the album Just  Laughs ;en
Find the game BlogBridge;en
 the creativity  The Attic ;en
Search for the picture Foghat?;en
 up Adobe Brackets  ;en
I want to hear   to    ;en
Show me the soundtrack The Phoenix ;en
Find a soundtrack called Tied to a Star.;en
 book  the Valley ;en
Find the Burn the Sky Down album;en
Look for the District 9 novel;en
 The Night Riders ;en
I want to   Cry Vengeance ;en
 the Mickey  photograph ;en
 The Second Civil War  ;en
find the game Endangered Species;en
 Love  Tear  Apart, a photograph ;en
Please get me the Critical Condition show.;en
Find book The Music Lovers;en
find a show called Big Broadcast of 1938;en
I'm looking for the novel From a Scream to a Whisper;en
  up the Power  Love movie. ;en
 the  Playlist: The Very   Brad Paisley ;en
read the novel On-Line Encyclopedia of Integer Sequences;en
  I  a photograph  Death Knows Your Name? ;en
I'd  to hear the   a Reverie ;en
  I purchase the TV  Time  Heroes ;en
I want to   novel,   ;en
  the picture Unfinished Monkey Business ;en
I need a painting called Brubeck Plays Brubeck;en
show me Chasing a Feeling painting;en
  the Sex Therapy painting ;en
Show me the trailer for The Glades.;en
find The Life of Riley, a photograph;en
 Later That Evening ;en
 me An Echo  the Darkness ;en
Search for the television show Me and my guitar;en
 a painting called Songs  Tsongas ;en
 a book called Environment  Behavior. ;en
 The  Important People, a television  ;en
 movie CrossGenesis ;en
 a    the Case with Paula Zahn. ;en
  the  The Elder Scrolls I: Arena ;en
 The Monkey soundtrack ;en
I want to read the book The Lion Sleeps Tonight;en
Find Earth Moving.;en
Show me the Sex Therapy painting;en
 the  game Thale ;en
find The Flying Scotsman;en
Buy Cannabis  ;en
Find a song called Be Quick or Be Dead.;en
 can I  Appalachian Journey ;en
 the TV  Hot Air ;en
  The Rise  Fall  the Great Lakes saga. ;en
Can you find me the painting titled Across the Line?;en
  Marty Stuart discography ;en
Look up The Dock of the Bay show;en
 Young Miss Holmes ;en
Where  Journal  Geriatric Psychiatry  Neurology ;en
find a book called Follow Me;en
I want to see Far Cry Vengeance;en
find the show Trancers;en
Want to find a creative work called The Prayer;en
 Hope & Other Sins, a   ;en
Play me an album by Lunchbox;en
Show  work of Truth  Tolerance ;en
show the movie Move Any Mountain;en
search  Space on  Hands ;en
I want to see Breathless;en
 you   the movie, The Girl  the General? ;en
Can you help me find Preaching to the Perverted?;en
 a soundtrack  Meditations ;en
What painting   The Cure discography? ;en
I'm   The   Nashville: Season 3 saga ;en
 the Three Little Pigs television  ;en
 All Jets  Gonna Fall Today  ;en
  the  Gotti Presents: The Murderers picture. ;en
  the picture The Id ;en
 a photograph  Cold Weather. ;en
 a   called New York 911. ;en
Find me the Martin Morning saga;en
Play The Last Mile album;en
Get me information on The Riverfront Times;en
play the video game The Genesis Machine;en
Find a novel called Industry.;en
  album  The Aboriginal Port Folio. ;en
  the  The Van Dyke Show ;en
Find the Ghostly Swim 2 book;en
Find The Last Angry Moose;en
 a   called White Bread Black Beer. ;en
 a   called Randy Scouse Git ;en
 there any creative work  Heterocycles? ;en
 a  called Every  Thing She Does  Magic. ;en
Find a TV show called Studies in Logic.;en
Looking  the   Shaolin Temple ;en
 you get  the television  called Start  Up? ;en
read the  Friend: The  Legacy ;en
  the album The Demon ;en
Look up the television show called Monster Mash;en
  the photograph of King Charles ;en
show TV series schedule of Gears of War;en
I want to watch the TV series Krieg in Chinatown;en
Rate trailer Geek Chic;en
I want to  the   Symphony  Solo Piano ;en
   the  Beyond Iconic: Photographer Dennis Stock. ;en
Show me the work Not a Little Girl Anymore;en
I  info  the  game Iron Fist ;en
Show me The Tivington Nott;en
  the Extreme Ghostbusters game. ;en
Find HeroQuest II: Legacy of Sorasil.;en
  the movie Purple Heart Diary. ;en
show creativity of The House of the Dead;en
  I buy a copy  the  called Turn Against  Land? ;en
Where can I purchase the TV series The Mating Season;en
Find Return to Krondor.;en
show painting of Waiting for Snow in Havana;en
  a link to the A  Something   Tempunauts soundtrack. ;en
Where is the creative work Seven Pillars of Wisdom?;en
Find a photograph called Sleeping with the Enemy.;en
 If You Go ;en
What  Lost Land  the Tiger ;en
Find a painting called Voices in My Head.;en
show The Best of Minnie Riperton saga;en
 The Ghost  Tom Joad ;en
  the Karobar Economic Daily picture. ;en
  the show Cheaper  the Dozen 2 ;en
Look for the NYPD - New York Police Department saga;en
Please help me find the Bloom: Remix Album song.;en
 the  Everywhere But Home ;en
I want to read the book Crash Landing;en
Where can I view the picture Reaching Horizons;en
I'm looking for the saga The Hardest Part;en
  I view the  Reaching Horizons ;en
  Horton  the Kwuggerbug   Lost Stories ;en
I'd like to see a TV series called Countdown: The Savoy Sessions;en
Find a novel called Downward to the Earth.;en
Search for Ayumi Hamasaki Countdown Live 2007–2008 Anniversary song;en
 a television  called I Got a Bag   Own ;en
find the painting Sleeping in Your Hand;en
find The Girlfriend Experience, a television show;en
I'd like to hear the song In a Reverie;en
I want to find a book called Cash-Cash;en
Can you find Fire Escape in the Sky: The Godlike Genius of Scott Walker;en
 a TV  called Directions Home. ;en
Please find me the book Step Into My Groove.;en
Get the  game  The Chipmunk  ;en
 a painting  Mr. Scarface  Back. ;en
 the   Must  Learn to Draw the Real ;en
I'm   the  Pulse 2: Afterlife ;en
Search  The Nations ;en
  picture Everybody Wants You ;en
I'd  to see the  Migration ;en
  a picture  Darker than black ;en
Show the Feed the Kitty painting;en
Look for the album called The Tale of Mr. Jeremy Fisher;en
  a video game made  TMPGEnc. ;en
  I purchase the  Dancing  the Dark: 10   Dancing Ferret ;en
 Becoming Royston ;en
I want to listen to the album Magical Girl Lyrical Nanoha StrikerS;en
  I  a   the   the front page  today's Jacksonville Daily Progress? ;en
find the album Just for Laughs;en
   the European Economic Association, a  I want to  ;en
Find the Fields of Sacrifice movie;en
 The Passion  Michel Foucault novel ;en
What  the  Sell Your Body? ;en
show movie The Skeptic – Das teuflische Haus;en
I'd like to see the game called God Is in the T.V.;en
Please  Pretty Baby ;en
 you get  the Maldeamores saga? ;en
Where can I find Thor Meets Captain America?;en
  The Adventures  Cookie & Cream ;en
Please search the Ironbound picture.;en
 Games Wizards  TV series ;en
 Seduced  Madness, a trailer ;en
Find me the album The Weed Tree.;en
Download The Red Eagle TV show;en
find me The Seven-Ups;en
I want to watch the show Food Force;en
 can I see the  Kind  Glue? ;en
show the trailer of Deadly Skies;en
I'd like to see The New Jackals;en
I  looking  the TV  titled Catchphrase ;en
find a TV show called Perfect Chemistry;en
Show me the The Defenestration of Ermintrude Inch TV series;en
Show  the picture Written  the  ;en
 the  The Thunder Rolls ;en
I'm   the album called Disorderly Conduct:   Patrol ;en
Find trailer of Jazz Impressions of the U.S.A.;en
I'm looking for 1634: The Ram Rebellion.;en
Show the Bean  the  painting ;en
  Happiness Was Free. ;en
 Everybody Wins trailer ;en
Show me the saga The Buffalo Boy;en
I'm looking for a picture of Fresh Air;en
show me the Evil Dead painting;en
  I purchase the   The Mating Season ;en
Search  The Toucher  Rich Show ;en
   the  The Dumping Ground Survival Files ;en
  the cheapest price  the   2006 Wikipedia CD Selection? ;en
  the Travel Weekly ;en
Please help me find the Selections from the Arista Years video game.;en
  I view the photograph  Johnny Cool ;en
I want to  the   Clayton ;en
  the album The Party Scene ;en
 the television  Riding  the King ;en
 the  the Hut TV series ;en
 can I  the TV  MetaboLights ;en
find the picture titled Battle Spirits - Shōnen Toppa Bashin;en
  the Evil Dead painting ;en
Where can I purchase a copy of the painting called Glimpses of World History?;en
 The Mary Van Note  ;en
Can you find the novel Stoneage Romeos;en
Can you find a photograph entitled, Beneath the Harvest Sky;en
Find a game called The Guyra Ghost Mystery.;en
 the TV  The Prodigal Wife  today? ;en
Find The International Journal of Robotics Research soundtrack;en
Where can I purchase Papers in Regional Science, the album?;en
Search  the television show Me   guitar ;en
Pull up the video game, Apothecary Rx;en
  locate the novel, Ismol Family ;en
Can you get me the Rakuen Tsuihou: Expelled from Paradise television show?;en
 a Love song ;en
Show me Born in America?;en
Can you get me the All Night Long 3: The Final Chapter novel?;en
