expression;language
 Within You Without You  Distance  zvooq. ;en
Play music from the seventies for me. ;en
 some good music  2012. ;en
play Lastfm pop tunes;en
Play Always Pop Punk.;en
I want to hear music from the sixties.;en
Play a sound track by Pee Wee Russell on Zvooq.;en
Play some music by beverley martyn;en
Please open pandora   ;en
Play Deezer ;en
I wanna hear something    Eddie Vinson ;en
Play music from the track She Came In Through The Bathroom Window;en
Play Moris Tepper;en
  Jag Vill Leva I Europa  porta ;en
Please  a song  me  1959 ;en
  form 2010 tune  Dave Grohl ;en
 the music  the  Get Lit ;en
 the sound track  Ferry Corsten ;en
 a 1964 symphony  Netflix. ;en
 the greatest 1972   Wes Dakus ;en
 some bass music. ;en
Play fourties music on Pandora.;en
play drive playlist;en
 a concerto  was most popular  1958  mickey hart ;en
 James Moody ballad ;en
Use the service Lastfm to play artist keren peles from the most popular symphony;en
Please   something  New Wave  American Heavy Metal ;en
Play fifties music;en
Play music from the top-5 from artist Kenia Arias;en
Play most popular from Nil Burak on Slacker;en
I  rave Slacker to  ;en
Play Russell Morris's The Singer And The Song on Netflix.;en
 Isham Jones ;en
Play a top twenty sort by Akinyele.;en
 some Katiejane Garside  Vimeo. ;en
Play some ivy anderson from around 1967;en
play the best Elizaveta Khripounova;en
Play some rock music on Youtube;en
 Clifford Brown All   Michael Balzary ;en
play music by Ryan Malcolm from Sympathy For The Devil on Pandora;en
Play Party Anthems;en
Play The Cherry-tree Carol by Edwin Mccain;en
Play Anweshaa by the new first.;en
Play some chanson music.;en
Play Tomorrow;en
 caitlin cary  the fourties ;en
Can you  a song  the newest   prince  Lastfm ;en
Play music from the sixties;en
 Shinya Yamada   1962 on Groove Shark ;en
 some sister rosetta tharpe songs  the  ;en
  the best Charles Neidich song ;en
Play the best Bruce Ruffin music on Youtube.;en
 the Late Night Jazz   Zvooq. ;en
 Slacker tunes ;en
Play Spotify ;en
 a top  Linda Strawberry ep ;en
play Deezer form 2010 tune by Dave Grohl;en
  Bitch  Ii ;en
Play a top five Linda Strawberry ep;en
Play theme music from the twenties by Tata Young;en
play Lastfm tunes from 1997;en
 me an  from 2005. ;en
Play Dj Cameo on itunes.;en
Please play a song by Everlast;en
Play paul ortiz music from 1990;en
Play the most popular soundtrack by Elena Paparizou on youtube;en
Please play some Bill Evans music.;en
I want to hear a    2016 ;en
 Women of Jazz ;en
I want to hear the new movement from Richard Harvey;en
Play fifties from Sirusho Harutyunyan;en
Play music from 1977;en
 track Ai Se Eu Te Pego  google    Maestro ;en
 the  song by Jack Grisham ;en
I want to hear   the top-fifty   Pasillas ;en
  music  Charles L. Johnson on vimeo ;en
Play music by Daddy Yankee;en
use Spotify to play greatest songs from Kailash Kher;en
 a sound track  1952. ;en
Plpay my Disco Fever playlist.;en
Can you  The Change  Made  Netflix ;en
I want to hear  tune   ;en
 steve  False Gestures  A Devious Public  ;en
I want to hear something eclectic;en
Play a concerto from the nineties;en
Play the track Fight On, State by Yuvan Shankar Raja;en
 a  off Ian Stuart Donaldson's Nature Nurture album   ;en
 some John Oates  Youtube. ;en
play Groove Shark folk-rock;en
Use Deezer to   ;en
Play Taiwan Is Good by Kotoko.;en
I'd like to play the top ten Mickdeth on Google Music;en
Play me a song from the fourties movement;en
Play the Ricky Wilson album Spectral Dusk;en
I want hear some Junior Murvin off of Youtube;en
 the  Shine A Light ;en
 some chant   Kevin Jonas on deezer. ;en
 The Birds  The Bees  Ceca. ;en
 the most popular   Nat Stuckey  Itunes. ;en
 a  John Maher record  Netflix ;en
Start   Disney playlist. ;en
Please  Different Slanguages  Fred Labour. ;en
Play music from the album Evolution Of A Man by Joey Ramone;en
Open Deezer   Inyección Musical ;en
play the latest melody from Cliff Edwards on Deezer;en
Can you play fifties theme music by Mohsen Chavoshi;en
  The Sleepy Lagoon   Kurstin ;en
list to the   Muireann Nic Amhlaoibh  ;en
 Chantal Kreviazuk, Sister  ;en
Play some twenties theme music on Google Music.;en
 the  Qr Iii  bobby bare ;en
Please  me a   theme song ;en
Can you  some  on Youtube ;en
 christian gangsta rap ;en
 a   Electric Tones  their Kurutta Taiyō album  Last Fm ;en
Play Red Barchetta by Blind Lemon Jefferson.;en
Play Stefon Harris's song.;en
Play Elliot Easton's album Beautiful;en
 Odessa  Maartin Allcock. ;en
Play Brian Clifton off Groove Shark.;en
  by Odd Nosdam ;en
Please play Short And Sweet by Teyana Taylor from my itunes.;en
I want to hear a good song from 2016;en
Play the newest chant by John Doyle on Zvooq;en
Play some twenties chant music on Slacker;en
Play Alles Heeft Ritme by Liu Tianhua.;en
I want to hear  Seaman's  ;en
 some new age  ;en
Play some fun-punk;en
Play 2012 symphony music by Nardwuar The Human Serviette on Netflix.;en
 a Ladyhawke record ;en
 the album Everybody   Lee Aaron ;en
Play the best sort by Jan Robbe on pandora;en
 The  Remains The  with Pandora ;en
Play me a Maia Hirasawa soundtrack from 1951;en
 music on Itunes ;en
Play breed the killers on Itunes;en
I want to hear a    ;en
Play Humour;en
Play How Does It Work by Helen Carter.;en
I want to hear opera on Netflix;en
 music from my relentless  ;en
  a fifties song ;en
I want to hear some   off   ;en
Play a soundtrack by Mike Hindert on Spotify.;en
Play music by Damien Rice;en
 music  the seventies ;en
 Lighter  Pamela Jintana Racine ;en
Play some music on Lastfm.;en
Play Contigo En La Distancia;en
 some nineties music ;en
play a seventies ballad by Annunzio Paolo Mantovani on Groove Shark;en
  Nights & Sunday Mornings ;en
 you pull up  Jueves de Antaño  ;en
have Zvooq  songs  the fifties ;en
Play Regulate…g Funk Era by artist Iouri Bachmet on groove shark;en
 the  Shooting Silvio  Dave Sabo ;en
Play Entre Raices Y Antenas by Lynn & Wade Llp.;en
Play the track Pocahontas John Farnham;en
 some seventies songs  Joseph Genaro  Google  ;en
 the album Sauna  Zvooq ;en
 me something  Funtwo ;en
 Verjamem track  Hong Junyang. ;en
 Barry Manilow  the twenties ;en
Let's hear some tunes from the thirties.;en
I want to hear a Silvia Night ep from the sixties;en
 25 To Life  Paul Riley  Deezer. ;en
 some 1959 songs  Iheart ;en
Play me an eighties song by Wes Dakus;en
play some 1991 Dave Barker;en
Play industrial music.;en
Play White Noise.;en
Play Alone, Again from Mike Viola;en
I want to hear   Post-punk  ;en
 the top-five ballad sort  2004 ;en
Play Pease Porridge Hot by Johnny Vicious on Zvooq;en
Play Salmonella Dub Dvd by mario rubalcaba on Vimeo ;en
 some Avantgarde  on Netflix. ;en
use Vimeo to   Camino a Clase  ;en
Sort to the last     1983 a   Mark Oliver Everett ;en
Play a melody by Adassa from the twenties;en
play 1981 music on Last Fm;en
Play a tune by Mc Hawking;en
 I hear tod ashley   1953? ;en
Play twenties symphony from Robert Walter;en
Open Itunes and play Heath music from 1981;en
  a Jill Scott sound track  deezer ;en
I want to hear     Tommy Walter ;en
 some fifties  by Origa. ;en
 me songs  agreable ;en
 Khujo eighties track  ;en
Put on Vimeo and play Kacapi Suling;en
 Courting The Squall  Slacker ;en
Repeat the track of music;en
 Realization  Randy Jackson ;en
 a  soundtrack  Benjamin Darvill  Groove Shark ;en
I want to hear Richard Falomir's     ;en
 a melody  the  on Google Music ;en
 some thirties  on Netflix. ;en
 some folk-rock music ;en
I want to hear the    The Railway  ;en
Play music on Iheart;en
play Vimeo 2009 by Desmond Dekker;en
Play me a twenties tune on Deezer;en
 some Game music. ;en
Play the album Making Evening And Night by Cevin Key ;en
Play Llegando a Casa playlist;en
play satire music;en
I want to hear something  the   Alissa Musto   Shark ;en
Play Les Pauvres Riches by Pan Mei Chen.;en
use Lastfm to  Attack  The  Smashers ;en
Play me the greatest Howard Levy song;en
  some seventies  with a good melody ;en
Use  to  a   the year 1954 ;en
Play ballad music from 1958;en
 my Futuros Hits  on Spotify. ;en
 chant music  1993 ;en
Play the playlist Tropical Morning on Pandora;en
Play some music from 1985 by Rolf Harris;en
 a sixties song. ;en
Play the playlist spring;en
play the song Si No Te Hubiera Conocido by Haidar Salim;en
 teri meri  Josh White ;en
Play a 1969 ballad by beth nielsen chapman, new first.;en
Play Spotify;en
turn  Last Fm to listen to Chara    ;en
Play the new music from Wilko Johnson;en
Play the top-twenty from Tony Calder off Slacker.;en
Play Portsmouth by Paul Smith on Google Music.;en
 them the greatest   Chris Frantz. ;en
 the top-10 chant  Caetano Veloso  Pandora ;en
  a Mel Draisey tune  the  with vimeo ;en
 the song Waar  De Zon  Slacker ;en
 new music  Liang Wern Fook ;en
Play the track That Would Be Something from Eden Ahbez;en
 some theme based   the thirties. ;en
 Hardcore music ;en
 some fourties music  Erin Harkes ;en
Play a song by Nash The Slash;en
Play my Éxitos España playlist;en
 a tune  Houston on Spotify ;en
 music on the  Urban Hits ;en
 the  titled Faget ;en
 a melody  Leigh Nash  Lastfm ;en
Play Richard Fortus' Live Collection.;en
 some King Tubby  the eighties ;en
 some eighties music. ;en
play Soheila Zaland;en
play some Spotify by Danni Bassan;en
 Who  You Think You   Magnifico with spotify ;en
 theme music  2011. ;en
play Piano Ballads on Netflix;en
 good Pure Soul  netflix ;en
 a song  the seventies  Pepe Aguilar ;en
Play the song Little Robin Redbreast;en
Play some seventies music on netflix.;en
Play the Late Night Jazz soundtrack on Zvooq.;en
 an  by Uncle Jimmy Thompson ;en
 the greatest Ricky Bell  ;en
play a top twenty symphony of 2010;en
Play Ciribiribin by Sandeep Khare;en
 Midnight Special ;en
I want to hear  Harris's   the  ;en
 Inside The Eye  twinkie clark ;en
 anything  the top-50 Jeff Irwin record off   ;en
play Long Way To Go by Keita Tachibana;en
 a   Alpha Blondy with Deezer ;en
 a 1999 track  Pete Seeger  Youtube ;en
 my Frescura Indie  ;en
play Heavy Machinery by Phil Spector on Zvooq;en
Can I hear a symphony from the seventies on Youtube?;en
Proceed with music from 2003.;en
  a 2003 song  Charles Neidich ;en
  by Christian Bautista ;en
Play some Eddie Vinson on Deezer;en
Use Deezer to play the last song from Lee Dorrian;en
Play thirties on Lastfm;en
 a seventies  Thacker ballad ;en
 record  the seventies ;en
 Kisaki on Pandora ;en
play the last track by Shavo Odadjian;en
Play Martha My Dear by shannon.;en
 Takes   Your Work Space  Eddie Kendricks ;en
Play andrew lloyd webber's good tune on zvooq.;en
 drum & bass  ;en
 the  Maynard James Keenan. ;en
 Robert Stoddard  1988 ;en
I want to hear music from the Lotus Flower album by Andy Mccoy;en
Play some Laurie Anderson.;en
play songs by Wise;en
 some Rumba Africana. ;en
Play Saturday Nights & Sunday Mornings;en
play the top-20 Rita Macneil songs;en
Play Shoo on iheart from greatest record;en
 something  Brian Chase. ;en
Play a Wendy Carlos song from 2002;en
Play some tune from 2011 on Youtube;en
 Dj Drama  the 1976 ;en
   jeremy taylor  the  Dormi Amore, La Situazione Non È Buona    ;en
 something   Classic Jazz Funk   Zvooq ;en
 2004 on pandora ;en
Play me a song by Stephen Jones;en
I want to hear  Taylor's   The  Charts. ;en
play All Of Your Toys by Chris Ledoux;en
  Under The Bridge  Hariprasad Chaurasia. ;en
I want to hear  Bottom  Playa Fly   ;en
 some Maynard  Keenan   Scenes  The Big Chair ;en
 some Stephen Jones  Youtube ;en
I wish to listen to eighties music by Mike Dean.;en
 Mikazuki Sunset ;en
 the greatest  Win Stracke  Groove Shark. ;en
 a  symphony sort  1959  Stuart Garrard. ;en
Plpay   Fever playlist. ;en
 chant by Prurient ;en
play some music from the thirties;en
Play a 1974 sound track on Vimeo.;en
 the album Resurrection  Blood  Sleepy Brown  Itunes. ;en
 The Insoc Ep ;en
Use Itunes to   Ringo Shiina   Heaven ;en
 some Krzysztof Penderecki  Last Fm ;en
Play a top-ten chant by Kelly Groucutt from 1964;en
Play Ik Hou Van Jou by Elena Temnikova;en
Play me a popular Ronnie Wood soundtrack;en
Play my Jazz Brasileiro playlist;en
Play the last Jonny Wickersham song;en
 Strength  Street Knowledge  Groove Shark ;en
Play some music on spotify;en
 top-five concerto music  1992 ;en
 Dick Marx ;en
Use  to  Korean OSTs ;en
 some Techno ;en
 the Busco Un Pueblo  ;en
I want to  to  music. ;en
 the greatest   Nhat Son  Last Fm. ;en
Play music on Spotify.;en
 some twenties chant  on Slacker ;en
Play the top caleigh peters.;en
 the symphony  Tetsuya Ogawa  1953 ;en
 Itunes  the latest Anna Yesipova  ;en
Play Tujiko Noriko's Ten Years And Running.;en
Play my Under The Surface playlist.;en
 you  a sound track  1963? ;en
Play some Paul Stookey from the sixties;en
 Giovanni Battista Guadagnini's  tracks. ;en
 the last Rocko  with deezer ;en
 a Samira Said ballad  the  ;en
   Fidel Nadal sorted  newest. ;en
 a sound   Pee Wee Russell  Zvooq. ;en
  by Daddy Yankee ;en
I want to hear some acid punk music;en
 thirties on Lastfm ;en
I need to hear some music from Spotify;en
 the song domino  Luca Turilli ;en
play Dj Ozma top songs;en
 some Origa on Google  ;en
 Bra Vibrationer  Dean ;en
Play good Pure Soul on netflix ;en
Play the album Have Another Ball;en
 the  Killer Instinkt ;en
Play Humour ;en
 the  R U   Roberto Carlos Braga ;en
 good   General Woo on Deezer ;en
play a Samira Said ballad from the nineties;en
 some fast fusion  Spotify ;en
Use Netflix to play In The Arms Of A Woman playlist;en
Play a new tune by louis silvers.;en
Play me a song by Saki Nakajima;en
play music by Billy Powell;en
 a sound track  Tom Thacker ;en
  Masaki Aiba tune ;en
Play sweet shanghai devil by Teddy Diaz.;en
 some sixties  on Slacker. ;en
 some Ven A  ;en
Play the thirties soundtrack by ghader abdollahzadeh on Youtube;en
 the best music  Klaus Badelt. ;en
 the  Pressure Cracks with Netflix ;en
Play Dj Scratch's eighties music on Iheart.;en
Use Pandora to play Korean OSTs;en
Play a 2001 tune;en
Play me a Chris Needham song on Vimeo;en
 Angela Winbush  that is popular ;en
 gothic music ;en
I want to hear that tune from 2010;en
  tribute by Billy Cox ;en
 a 1950 album  Iheart ;en
Let's listen to the most popular Marty Friedman songs on Zvooq.;en
play Christina Milian latest music;en
 me a song  Linn Berggren  Spotify ;en
play an album on Netflix by chris castle from 2011;en
I want to hear  Nawaz,  the   annie. ;en
play robert fripp sound track on Pandora;en
 fifties  songs  Fabio on Last Fm ;en
play a sound track by Tom Thacker;en
 Party Anthems ;en
Play That Would Be Something by Eden Ahbez;en
Play the 1991 soundtrack from Ian Mcdonald;en
play a 1994 tune by Lena Horne;en
Play a sixties song by Classified;en
 a melody  Elmer Bernstein ;en
Play Randy Castillo's music from 1952.;en
 some  on Slacker ;en
 some David Mallett  last fm ;en
play the most popular album on Google Music by sasu ripatti;en
Play some tango.;en
I need some ambient music. ;en
Play Rei Momo newest album;en
 greatest chant music  Beni Arashiro ;en
I want to hear   Joe Dolce  Google  ;en
 anything  the twenties ;en
 a  fifty zahir howaida   the seventies ;en
Play a track from 1959.;en
 the  of melody of 1997  Itunes ;en
 zvooq Southern Gothic ;en
  album  the fourties, new first. ;en
 a chant  the fifties ;en
 Donna Summer ;en
 chant  by David Cook ;en
play a ballad by Bob Johnston;en
 Fereydoun Farrokhzad best  ;en
 funtime activity ;en
Can you  some   andrew diamond ;en
 some Paul Stookey  the sixties ;en
Play music from 1968 on Vimeo.;en
 a tune  Layne Staley ;en
I'd like to listen to iheart radio's chill out playlist please.;en
 Lastfm tunes  1997 ;en
 To Be Still ;en
 some P. J.  ;en
play Takes Place In Your Work Space by Eddie Kendricks;en
 a song  Helena Iren Michaelsen  Spotify ;en
Play All The Way My Savior Leads Me on Spotify;en
play a 2006 chant;en
Play some gothic rock.;en
 the top movement music  1997. ;en
I want to hear the Jody Williams sound track;en
Play the top fifty record from Alan Jardine;en
Play the top melody from artist Maakii;en
Play music by Sarah Connor;en
I'm looking for the last track by Fei Yu Ching from the fourties;en
 Only Hope  Graham Bonnet ;en
Use  to  Who Was   Room Last Night? ;en
   Clark Kent in the year 1987 ;en
 me a  song  Joseph Genaro ;en
play the album Pressure Cracks with Netflix;en
Can you   a track  the nineties? ;en
Open Lastfm and play a voluntad del cielo from Wax;en
Can I listen to music from the Easy Listening genre?;en
I'd like to hear one of Eric Clapton's most popular melody on Pandora.;en
Play some Ray Williams music from the nineties on spotify;en
Play Water Under The Bridge by Hariprasad Chaurasia.;en
  a song  1968 on Spotify ;en
play 1962 music on Netflix;en
Play Tomorrow ;en
Play some fourties music on Zvooq;en
Play some Matthew Sweet music from around 1996 on Spotify;en
Please play me a popular track from 1984.;en
 some popular bryan gregory  ;en
 you have something  Impossible  Nothing  Abderrahmane Abdelli? ;en
play Safe Rock And Roll Sucks on Lastfm;en
 a top-twenty tune  Noor Jehan ;en
Play music from 1959 by Lenny Leblanc on Pandora.;en
play Hardcore music;en
 to Westbam alumb Allergic  Google  ;en
Play music from 2005 by Justin Broadrick;en
 the newest stuff  blowfly ;en
 Skin & Bone  Jess Stacy  Deezer ;en
 music  the year 1964 ;en
Use Pandora to    Maki Onaga  the  made  the  ;en
Use Netflix to   The Arms  A Woman  ;en
Play the best 1981 sound track from Ric Fierabracci;en
 Ngola Ritmos top-ten  ;en
Play some 1993 concerto off of Slacker;en
 any song  2006 ;en
 a song  David Silveria  2002  Zvooq. ;en
 Tujiko Noriko's Ten Years  Running. ;en
Play the Busco Un Pueblo album;en
Play a chant by Mj Cole;en
  the last 1980 record  Brenda Kahn ;en
 Halid 08  video game pianist  Pandora ;en
Play the top-5 songs from Paddy Reilly on zvooq;en
Play the concert from Philip Oakey 1973 concert on Netflix;en
play music by Odd Nosdam;en
 me a  sound track ;en
Play some music from Miss Platnum;en
 some House music ;en
 playlist Chilled R&B ;en
play the greatest james yorkston song;en
Play some nineties music on Pandora;en
Play the artist Tei last concert on Netflix;en
I want toi hear some  Punk Perfection    ;en
 the  song  Damon Albarn using Slacker ;en
Can you play a chant by Butch Trucks on Spotify;en
 scott la rock  Stella  Slacker ;en
I'd  to hear Nas's greatest  ;en
 Techno on Lastfm ;en
 The Cross  The Crucible  Angela Au Man Sze  Google  ;en
Use Spotify to play music;en
 the last   the thirties  Airto Moreira ;en
 the newest chant  John Doyle  Zvooq ;en
Use Google Music to play some songs by Dr John;en
I want to hear   The   Proof ;en
 some gotye ;en
Please play some music for me on Netflix;en
play Solange 2016 album ;en
play the top-twenty songs by The Kleptones on Spotify;en
Play Vic Ruggiero music from 2007;en
listen to ballad   1999 ;en
Play me a seventies ep;en
 Ciribiribin  Sandeep Khare ;en
Please  songs  Lil Jon ;en
Play a tune from Space Mandino.;en
play Steven Reineke greatest soundtrack on Youtube;en
 Slow Rock  Lastfm. ;en
   2012  Yossif Kobzon on last fm. ;en
Play some folk-rock music;en
  tunes  Bryan Webb on Groove Shark ;en
Play Michael Angelo Batio;en
Play the best Vanessa Peters songs;en
I wish to enjoy some fifties music by Johnny Paycheck.;en
 some chanson music ;en
 music  1989 by Maya. ;en
 the  genre Synthpop ;en
 Magic Sam  the thirties ;en
   the track  Friend on Google   Steve Sholes ;en
   the punk genre on Last Fm. ;en
use Spotify to play Nina Persson from 1962;en
Play me the dinner playlist;en
Please play songs by Lil Jon;en
Play some sixties music by gaudi on last fm;en
play Wanted by Erykah Badu;en
 to Pmd symphony ;en
Play my playlist springtime;en
play new music by Elmore James with google music;en
Play some music on Pandora;en
Play the greatest music you can find by Ari Herstand on Zvooq;en
  on Deezer by Imogen Heap ;en
play Courting The Squall on Slacker;en
 the  song  Amon Amarth  Groove Shark ;en
play some good amber gristak on Lastfm;en
I want to hear Major Harris's songs from the fifties;en
I want to hear   Adam ;en
I want to hear the   Tsitsanis  ;en
 music on Itunes. ;en
 the top-20 Rita Macneil  ;en
play some sad songs from the fifties;en
Play a popular ballad by Amanda;en
I want to  to a    David Bazan ;en
play Slacker tunes;en
Play playlist funtime;en
Want to   Schollin Lastfm ;en
play James Moody ballad;en
Can you play an ep by Tatjana Iwanowna Bulanowa;en
 me a song  the fourties ;en
 Clásicos del  Hop Español ;en
Play melody music from the fourties.;en
 the last song  Goldie ;en
Play some psychadelic music.;en
 me some   Prince Alla  the twenties ;en
Play a twenties tune by Jodie Aysha.;en
 Dj Shadow's A  Hate Masquerade. ;en
 music  artist Ashley ;en
Play some steve boyett chant music;en
Play Verjamem track by Hong Junyang.;en
Please  the newest   Evil Jared Hasselhoff ;en
  The Arms Of God  Zvooq  Nimal Mendis ;en
Play Who Knows Where The Time Goes? by Grigory Leps;en
play Fill Yourself With Music by Ray Manzarek;en
 a  off The   Siouxsie & The Banshees  Faustino Oramas ;en
 me a song  Saki Nakajima ;en
 the   Philip Oakey 1973   Netflix ;en
Play my Hardstyle, Baby playlist on Netflix;en
Play me a song by Michael Diamond;en
Play some Mark Tremonti from the thirties.;en
Play eighties music on Groove Shark.;en
 Murder The Mountains  Mana  Netflix ;en
 Stefon Harris's song. ;en
Start  something off  ;en
Play the best music from Klaus Badelt.;en
 the   melody by Gus G ;en
Play the next ep by Video Game Pianist on netflix;en
open Fadl Shaker on Spotify and play a melody starting with the newest;en
Open    Connie  Sings Spanish  Latin  Favorites  Yukiko Iwai ;en
 music  2012 on google music ;en
Play Leanne Dobinson Right To Dream;en
 a track  Titiyo ;en
 good Classified songs  Vimeo ;en
Open Last Fm   the    Daniel Lee Chee Hun ;en
 a popular Gurdas Maan  ;en
 Ik Hou  Jou  Elena Temnikova ;en
Play something by Louis Nelson Delisle.;en
 music on netflix ;en
 music on Lastfm ;en
 Vivian Stanshall  1962 ;en
Play some music using slacker;en
Play the most popular track from Valery Alexandrovich Kipelov;en
 the  Joan Baez. ;en
open Itunes and play Kenny Cox most popular concerto;en
 me   the twenties on Itunes. ;en
I want to  to   Symphony ;en
 Oliver on pandora. ;en
 a 2011 ballad   Jared Hasselhoff  Lastfm. ;en
 a song  zvooq ;en
 a 1978 track  Slacker ;en
 music  2000 on spotify ;en
Play the most popular 1956 record.;en
Play some music from the sixties;en
Play me a song by Carol Arnauld from 2003;en
Play some movement music by Perez Prado on Iheart;en
Play some nineties Eliza Carthy;en
 some James Cleveland. ;en
 a  Davis melody ;en
Play a song from my workout playlist on Groove Shark;en
Play some sixties music.;en
 some   1989 by Sanjeev Abhyankar. ;en
play melody music from the thirties;en
I want to listen to an album sorted by last, open Google Music and play Paulinho Da Viola.;en
Play Kk on Zvooq.;en
play the top-twenty tune by Masaharu Fukuyama on Slacker;en
  a song  the twenties  Randy Bachman ;en
Play some 1954 songs on my Itunes.;en
 a chant  Marina Verenikina ;en
  from Quasimoto from the nineties ;en
Play El Cant Dels Ocells by vini lopez.;en
Can i use Lastfm to listen to Twilight Time by Dj Khalil?;en
Play While The Gate Is Open.;en
   Art Porter Junior  sound track using Vimeo ;en
Play some music from 1989 by Sanjeev Abhyankar.;en
Play iheart ;en
 a soundtrack  Sarah Geronimo on google  ;en
Play a Paul Davis melody;en
play the album a kiss before you go by Bt;en
 Expresión  Mickey Finn ;en
Play some happy gabber.;en
Play some Rachel Stevens off of Itunes;en
  the most popular Lillian Hardin   Itunes ;en
Play Brenda Kahn's Rushall Station.;en
Play some Oleg Anofriyev from 1960.;en
play the album Everybody Happy by Lee Aaron;en
play David Banner on Netflix;en
 the   tracks of Ron Jarzombek ;en
 robin hood  the bishop  hereford  Jon Mayer ;en
Play Donald Rubinstein on Pandora;en
 While We Were Waiting  Sippie Wallace   ;en
I want to hear the Fear The Boom And Bust song from haruka shimotsuki off of Spotify;en
Play me a concerto by Jethro Burns from Zvooq;en
 the  How Insensitive ;en
  on itunes  artist Jessica Delfino ;en
 Vimeo 2009  Desmond Dekker ;en
 some 1982  music on Slacker ;en
play some Bertine Zetlitz record;en
play my tribute by Billy Cox;en
 me a song  2016 ;en
Play Classical X;en
 melody music  the thirties ;en
I need to hear the song Aspro Mavro from Bill Szymczyk on Youtube;en
 2012 symphony   Nardwuar The Human Serviette  Netflix. ;en
Play Chantal Kreviazuk, Sister Ray;en
Play music off Netflix.;en
  by Rodney Whitaker ;en
  a song  Movies  The Blind on Pandora ;en
Use Deezer service to play Opera ;en
Please  Casino Boogie ;en
play a symphony that is good from 2000;en
Can you play some music from 1999;en
 some rock  on Youtube ;en
 a tune  1962 ;en
 track Cabbage  Keiji Haino ;en
 Joey Fatone  tunes  Google   1972 ;en
Will you play a ballad from Mahalaxmi Iyer;en
 a  5 song  Wally Bastian on Google  ;en
 the best sort  Jan Robbe  pandora ;en
 These Four Walls  Yummy Bingham. ;en
Play Dave Wyndorf album;en
Play Short Walk On A Long Pier on Slacker;en
Play pop;en
 Taiwan Is Good  Kotoko. ;en
Play some noise music on Netflix.;en
I want to hear the     list ;en
I want to hear Dido from 1966 on Youtube;en
