expression;language
 Pride  The Prairie  Johnny Burke ;en
use Deezer to play top five Moya Brennan;en
Use Groove Shark to play Krizz Kaliko;en
Play some chant music from 2008.;en
Play a melody by avery storm.;en
 some  chant music  Nicoleta Nicola ;en
Play my Still Got the Blues playlist.;en
play Peja tunes;en
 the Mister  Man  Gene De Paul. ;en
  a popular Ronnie Wood soundtrack ;en
Play Is This My World? by Leo Arnaud;en
Play a song by Alasdair Roberts from 1996;en
 Elysium  Ryan Cayabyab ;en
 Monie Love tunes  Google   1984  her  list ;en
Play a top five Jonny Buckland symphony from around 1989;en
 Tomtegubben  Hade Snuva ;en
 a record  2010. ;en
Play Pura Vida.;en
Play movement music from Sheryfa Luna;en
Play some music from 1993 on Itunes.;en
 something off Google  ;en
Play nineties ;en
 latest George Ducas  ;en
  Must Be More To  Than This ;en
 the  Wayning Moments  Rabbit Brown ;en
 some gothic rock. ;en
play music from the year 1979;en
Open Groove Shark and play native us;en
  by Sarah Connor ;en
I want to hear the latest twenties album from Kyle Riabko;en
play something from the twenties;en
Play the newest melody by Cisco Adler on pandora;en
play the top song by Amon Amarth on Groove Shark;en
Play 2004 Guy Sebastian on Itunes;en
 a melody  Hagigat Rzayeva ;en
Can you play a melody from the fifties on Last Fm?;en
Play Change Has Come on Google Music.;en
Play some 1987 Edie Brickell.;en
 Crazy=genius  The Alchemist ;en
 Punk Rock music ;en
Play music from the eighties on Slacker.;en
  a Maia Hirasawa soundtrack  1951 ;en
 a concerto  the nineties ;en
 Solange 2016 album ;en
play a tune by Margaret Kelly on Iheart;en
play In Your Eyes by gareth gates on Netflix;en
Plan an album by Roni Duani.;en
Use Youtube to play music from Dorothy Ashby from the year 2002;en
 top-twenty song  2015 ;en
 you  a 1967 soundtrack  Slacker ;en
 Change Has Come  Google Music. ;en
 songs  Naomi Schemer ;en
play Latin Dinner;en
 a record  2005  Ruslana Lyschytschko. ;en
play Robin Trower Unravel;en
play Party Ben on Slacker;en
Play Cherry Pink by Trapp Mendoza on Iheart;en
Play fourties record;en
 some amber kuo  the eighties  Spotify. ;en
 any song  2001 ;en
Play some music on Lastfm;en
 dj kentaro  the year 1994 ;en
 the track Asleep  The Deep ;en
 Shoo on iheart  greatest record ;en
play newest Robert Palmer sound track;en
Play tribal;en
Play the greatest melody from Paul Wright on Pandora;en
play Zvooq Night Rider list;en
Play some 1982 movement music on Slacker;en
 any chant  1973 ;en
 an eighties track ;en
play the top nineties melody by Gus G;en
 some Sonu Niigaam  the fifties ;en
play the newest Martin Solveig sound track;en
 my Fusion Fest  on Youtube ;en
Play the artist Joe;en
 eighties music ;en
 Salmonella Dub Dvd  mario rubalcaba  Vimeo ;en
Turn  Spotify to Tiny Tim  ;en
 the most popular chant   Hossein Alizadeh  around 2009 ;en
 some music  the twenties. ;en
Can you play some Andrew Cash music on Slacker;en
Play my Trabajo Relax playlist;en
play Only Hope by Graham Bonnet;en
Play The Wizard And I on Zvooq;en
  Every Dream  A Heartache  vincent paul abbott ;en
  something  the thirties  Candi Staton on Vimeo ;en
play anything from 1970;en
Play Noctámbulo pl;en
 Larry Graham sound  ;en
 Jono El Grande  the thirties ;en
Play music from artist Ashley;en
play the Ocelot record using Zvooq;en
 symphony music  the  with google music ;en
 track Real Talk ;en
Play a melody from the nineties on Google Music;en
play Innovations by Kokia;en
Play some theme based music from the thirties.;en
Play me a popular song by Koichi Domoto;en
 One Way Ticket  Ray Kennedy. ;en
Play Yung Joc on slacker;en
Play a soundtrack from 1954.;en
Play any album from the twenties;en
Play music from the playlist Get Your Mind Right;en
Can you play the newest record from 1966 by Tony Lee;en
play Deezer tunes Are & Be;en
play journey list;en
Play a cohesive playlist for me;en
Play a top fifty ballad by Linda Strawberry on Google Music;en
play Miguelito top charting album;en
play Fereydoun Farrokhzad best track;en
I'd  to hear the    Willa Ford. ;en
 some  on Pandora ;en
Play a new song form the eighties;en
 Stevan Faddy  Google Music. ;en
I want to hear a     Master Jay ;en
play the top song from Damon Albarn using Slacker;en
play some 2002 music;en
play Fey's album Diamond Head on Zvooq;en
Play music from the seventies;en
I'd like to hear chant songs from nineties;en
use Deezer to play music by Junior Brown;en
Play the last soundtrack from the sixties;en
I'd  to hear  Baylor ;en
Please  a song  Ahmad Jamal ;en
play me a Mel Draisey tune from the fourties with vimeo ;en
Play the most popular twenties record from Leland Sklar;en
I want to hear eighties music by Noko on deezer.;en
I want to hear a full album on youtube by Jem Godfrey;en
I want to hear Gloryhole from Mani off of Lastfm;en
play the latest Thelma Aoyama;en
  a Xuefei Yang symphony  Groove Shark ;en
Open groove shark and play Jason Mizell;en
 the most popular Grace Slick    a symphony sound ;en
 a record  the year 1979 ;en
 1962  on Netflix ;en
 fifties  on Slacker. ;en
 a song   workout  on Groove Shark ;en
 you  a song off  album  Shirley Horn ;en
 Groove Shark ;en
Play an album from 1987.;en
 something  the twenties ;en
 the  Tropical Morning on Pandora ;en
 Dj Cameo  itunes. ;en
play Paula Campbell music from 1993;en
Play an album from the fourties;en
 Igor Nikolayev music  the fourties ;en
Play Harel Skaat;en
play some Industrial music on Lastfm;en
Play something by Louisiana Blues;en
 some  by Karl Blau. ;en
 tuomas holopainen's The  Project. ;en
Play drum & bass music;en
 ballad  Mandy Moore ;en
 top-ten eighties song ;en
Play The Cross And The Crucible by Angela Au Man Sze on Google Music;en
 the  Phil Stacey. ;en
play the track The Wizard And I;en
play Isham Jones;en
play To Be Still;en
Play my Acoustic Covers playlist on Spotify.;en
 the top-twenty  Alexander Braginsky. ;en
play Richard Thompson from the thirties song book;en
Listen to  Gaming  ;en
I want to listen to Born On The Bayou on Iheart;en
 the heinz strobl   2016  Groove Shark ;en
I want to  to the    to the blue  mountains  iheart ;en
 the newest  Exuma ;en
Play concerto from the eighties;en
Start up  Independent  Monday playlist. ;en
open    Kenny Cox most popular concerto ;en
 the newest ballad  Chad Urmston ;en
  Landers, O Rio, A Cidade, A Árvore   ;en
play some seventies Dj Colette;en
 some  on spotify ;en
 a song  2003 ;en
play Kurt Cobain ballad tunes;en
  Night Rider list ;en
 Abhijeet Bhattacharya  1986 ;en
open Spotify and play a couple of celtic songs;en
Play Rap Album One by Gene Vincent.;en
 some music  1995 ;en
Play satire ;en
 some The   A Tramp  Timour Moutsouraev ;en
 the greatest soundtrack  Jesse Harms. ;en
Play some thirties music on Netflix.;en
I want to listen to Speed Metal Symphony;en
play some Alte Kameraden music;en
play a 1977 record by Bitty Mclean on Google Music;en
 a tune  1973 ;en
 some Matthew Sweet   around 1996  Spotify ;en
Start up my Independent Music Monday playlist.;en
 something off my New Boots  ;en
Use netflix to play a record by Emil Gilels from year 2015;en
 a tune  Mc Hawking ;en
play music on netflix;en
Play a symphony from the thirties.;en
  by Francis Healy ;en
PLay a track by deeyah khan.;en
Play The Birds And The Bees by Ceca.;en
Play me the greatest chant by Laurel Aitken on lastfm ;en
Play some Katiejane Garside on Vimeo.;en
Can you pull up a track on Zvooq by Graham Mcpherson;en
Use the service Lastfm to play music by the artist ai kago;en
 some Geir Jenssen. ;en
 some Glenn Miller. ;en
 Llegando a Casa  ;en
 the album  Paul Barker  the greatest  1978 ;en
play Latina;en
play The Necromancer;en
I  to hear the  Aspro Mavro  Bill Szymczyk   ;en
Play my springtime playlist.;en
I want ohear the 1996 soundtrack from deezer;en
  by Ian Haugland ;en
 the latest  Aoyama ;en
  album on Netflix  chris castle  2011 ;en
Can you  that last   the twenties ;en
open lastfm  play top hits of Simon Webbe;en
play something from 1971 by John Bonham;en
  Top Gaming Tracks. ;en
play a music ballad from the sixties;en
use Deezer to    Junior Brown ;en
 Mohammed Abdu  top 20 ;en
Play tuomas holopainen's The 21 Project.;en
 my Sophisticated Dinner  on Slacker ;en
 new Ian Mclagan ;en
I want to hear the     Harvey ;en
  by Paul Mccartney ;en
Play the most popular song by espen lind;en
Play a song from Helena Iren Michaelsen on Spotify;en
  a song  1972  Sweet Emma Barrett ;en
Play Bitch Please Ii from Julee Cruise on Iheart;en
 Maggot Brain  Albano Carrisi ;en
 Pledge  Markus Grosskopf ;en
Play 1993 theme music;en
play Barry Manilow from the twenties;en
I want to hear something off Fist For Fight by Rushton Moreve on Youtube;en
 a new  form the eighties ;en
Play Revival music.;en
I want to hear a Silvia    the  ;en
 Oliver Cheatham's symphony  the thirties. ;en
 the  twenty movement songs  Roberto Valverde ;en
turn on Last Fm to listen to Chara ballad from 1988;en
Play Crazy=genius by The Alchemist;en
 the  Si  Te Hubiera Conocido  Haidar Salim ;en
 some Kansas  Mccoy ;en
Play the top Maynard James Keenan.;en
Play me the new King Curtis music on Google Music.;en
 some Nastya Kamenskih  Zvooq ;en
 theme   the twenties by Tata Young ;en
 symphony music  Joe Dolce ;en
Play some 1999 symphony from Minami Takahashi;en
Can you  me some Pop-folk  ;en
 some seventies   Janne Puurtinen on Youtube. ;en
I'd like to hear Nas's greatest ballad;en
 Is This  World?  Leo Arnaud ;en
Play music off the track Child Maurice;en
Play the album Remember Shakti – The Believer.;en
Use Spotify to play me music;en
Please use pandora to play a record from 1993;en
 some Sabah  the eighties ;en
Let's play the album Handover on Deezer;en
Play Night Electric Night on Iheart;en
I'd like to hear Cry Baby Cry by Ally Kerr.;en
I want to hear some songs from the twenties;en
 the last  from 1999 ;en
 the Ricky Wilson  Spectral Dusk ;en
 Matt Walker tunes ;en
 Praise The   Pass The Ammunition. ;en
Play a ballad from 1997.;en
Play some The Lady Is A Tramp from Timour Moutsouraev;en
I want to hear symphony   Rebecca Cartwright   Fm ;en
 the Ocelot record using  ;en
I wish to  to    Mike Dean. ;en
" Bill Evans  The   The 12"" Mixes ";en
Play some Krzysztof Penderecki on Last Fm;en
 some contemporary christian  Groove Shark. ;en
 the   songs by Isaac Hayes ;en
Can I listen to merengue style music?;en
Play 2004 on pandora;en
Play Tad Kinchla soundtrack;en
 the 2014 album  la lupe ;en
I'd  to hear chant songs   ;en
  a 1990 sound track ;en
Open Netflix and play Kan Man Gifta Sig I Jeans?;en
use Spotify to  Nina Persson   ;en
play Women of Jazz;en
 2004 Guy Sebastian  Itunes ;en
 me some Goa ;en
Can you  an   the year 1958? ;en
Play me some Terror music;en
I want to hear Choice on Last Fm from the twenties.;en
 any track  Flame ;en
 Lily, Rosemary  The Jack  Hearts  Chris Goss ;en
   Ryan Malcolm  Sympathy For The Devil on Pandora ;en
Play top Martin Solveig on deezer;en
play a top-twenty tune by Noor Jehan;en
I want to hear a symphony from Kano;en
 a concerto  sam sparro ;en
Play my Femme Fatale playlist on Vimeo;en
Play 2006 chant music.;en
Play a top track by Janamanchi Seshadri Sarma;en
Use Itunes to play music;en
Can you play something from 1966 by Mc Ren on Spotify;en
 a  fifty track  the twenties ;en
 some music  Victor Kunonga. ;en
 the  Grime Shutdown ;en
Play March Of The Soviet Tankmen from Gloria Gaither;en
Play some acapella music on Iheart;en
  hear the Rave Tapes   Yuki Koyanagi. ;en
play some synthpop;en
 The Trail  The Lonesome Pine  Netflix ;en
play some songs from the fourties by yoshiki fukuyama;en
 a 2014 theme  Greg Pattillo ;en
Play a song of I Myself And Me on Youtube;en
 Fight On, State. ;en
Play a new ballad by Valy on Iheart;en
 music from 1981 ;en
 Party Through The Decades  Deezer ;en
 wendy james  the fifties ;en
Can you play a top song from a chyi chin concerto;en
 the  Vibrations  Marion Elise Raven ;en
 a Karin Dreijer Andersson   Groove Shark ;en
 me a Frank Farian  ;en
Please play Different Slanguages by Fred Labour.;en
 some papoose  2003 on youtube ;en
Play a top 5 song from Wally Bastian on Google Music;en
Play a sound track by Mac Dre.;en
 the  21st Century Live  Chet Lam  Itunes. ;en
Can you play a sound track from 1963?;en
Play some space music on Google Music;en
Play Jono El Grande from the thirties;en
 my Acoustic Covers  on Spotify. ;en
 Johnny Gimble ;en
 a symphony that  good  2000 ;en
 songs by Queen ;en
play music by Helen Ward;en
 the  Hunter theme off  Last Fm ;en
play eighties track;en
Play me a 1957 ep;en
Play some 1970 Antero Manninen on zvooq.;en
Play me a 1990 sound track;en
 music by Bonobo ;en
Play rhythmic ;en
 Burhøns  Ernie C. ;en
Play the song American Patrol by lauryn hill;en
 me Benjamin Kowalewicz's  hits ;en
I   hear Techno-industrial music. ;en
Play tune from Sonny Stitt;en
Could you play the album B Men Gahō by Nathaniel Shilkret;en
 Adrian Borland's  on Zvooq. ;en
 some   tunes  the last Olga Souza ;en
play Pop 2017 Picks;en
  a Felix Kubin  No Light  Spotify ;en
 a Jim Mullen   the sixties ;en
listen to Pmd symphony;en
play Moustapha Amar Make It Rain;en
Play the song Jingle Bells;en
Play me a bluegrass song;en
Play ep from Quasimoto from the nineties;en
 some space  on Google  ;en
 Tad Kinchla soundtrack ;en
Play me songs from agreable;en
Play the album Will Rap Over Hard Rock For Food;en
Play some music from Roberto Carlos;en
 a popular chant  Brian Epstein ;en
Can you   something  the eighties  Youtube ;en
 The Eternal  Juju Mob  Vimeo. ;en
Please play Kabhi Jo Baadal Barse by Ruth Lorenzo;en
play the album How Insensitive;en
Play Trace Adkins' music from the thirties.;en
I want to   off Deezer ;en
 breed the killers  Itunes ;en
Use itunes to  dancing  ;en
play Punk Essentials on Zvooq;en
play songs from the sixties;en
Play music from 2011.;en
 the  fifty record  Alan Jardine ;en
 a   Jonny Buckland symphony  around 1989 ;en
 some  on groove shark. ;en
Play the newest music by Gladys Knight;en
Use  to    Dorothy Ashby  the year 2002 ;en
 Eddie Meduza  the thirties ;en
  Down To The River  Pandora ;en
play music using Groove Shark;en
 music  the twenties ;en
 me songs  1955 ;en
Play Stevan Faddy on Google Music.;en
  Your Eyes  gareth gates on Netflix ;en
Play music from jeremy taylor on the album Dormi Amore, La Situazione Non È Buona on Groove Shark;en
play Latina ;en
play Google Music tunes;en
 the top-twenty  Tony Calder  Slacker. ;en
 you pull up a track    Graham Mcpherson ;en
I want to hear something by Joe Dolce on Google Music;en
 Frankie Laine ;en
Play music by Paulinho Da Viola from 1965;en
Play some Robbie Merrill.;en
 any album  the twenties ;en
 Rocket Queen  Itunes ;en
Play Seaside by Don Cherry.;en
 2003 Ben Burnley  Spotify ;en
 music  the sixties ;en
 a twenties soundtrack  Youtube ;en
 the next   Video Game Pianist  netflix ;en
Play Noche de chicas playlist;en
I want to hear some  David Gilmour's    ;en
Play Intense Studying playlist on Itunes.;en
Play music by Susumu Hirasawa.;en
Plays some akb48 on Youtube;en
 I  to merengue style music? ;en
Play a record from 2015;en
play Realization by Randy Jackson;en
Play the newest 2016 ep from Boaz Mauda.;en
Play a song from 2013.;en
  Stubborn Kinda Fellow  Michael Amott ;en
 some sixties music ;en
 Night Electric Night  Iheart ;en
Use pandora to play music from stano in the year 2005;en
I want to hear a full     Jem Godfrey ;en
play pandora ;en
 the  Chaw album ;en
Please anything good by Chieko Ochi;en
Play tribal ;en
 the   songs by Gad Elbaz ;en
 music from Hide ;en
 a ballad  2000 ;en
play some papoose from 2003 on youtube;en
 something off  Radio ;en
play a new song from the seventies;en
Play music from 1976 on Deezer;en
 Alone, Again  Mike Viola ;en
 Kaori Mochida's most popular   Google Music. ;en
Play some seventies music on Netflix.;en
Play some Drum & Bass;en
Can I hear the latest music from Bahar Kizil?;en
 Lenny Kaye music. ;en
Play Ramakadha by Karl Davydov please;en
  by Damien Rice ;en
 music off Youtube. ;en
Can you play me a track from the nineties?;en
 Sense Tu  Ebi Hamedi ;en
 movement music  1954 ;en
 me a fifties song  Chingy ;en
play the newest sound track from the thirties;en
 a rock track  1984 ;en
Play me some music youtube;en
Wish to hear   the  1996 ;en
I'd  to hear a   Theo Keating. ;en
 some chant  1974 ;en
Play some Antony Harding songs from the eighties;en
 Groove Shark ;en
 a sixties track  Noam Pikelny  iheart. ;en
I want to hear a top-50   Takahito Eguchi    ;en
  by Otis Redding. ;en
I want to hear some     Dope ;en
 a song  1994. ;en
 my Madrugando  on Groove Shark ;en
I want to listen to some Aaliyah;en
 a ballad  Giorgio Moroder ;en
Play chant music by pappu venugopala rao on Slacker.;en
 Tonight Only!  Nastya Kamenskih ;en
 some Sia Furler  Last Fm ;en
 got to  free  Madeleine Peyroux ;en
 some 2011  by Dan Healy. ;en
 the  Winner Takes All  Takuro  Last Fm ;en
Please play me something by New Wave Of American Heavy Metal;en
Can you play me songs from the Estado de ánimo playlist?;en
 the  Pocahontas John Farnham ;en
 some dream music ;en
I want to hear sia furler's     Fm ;en
Play any music on Spotify;en
Play the song I Get Ideas as performed by Richard Kruspe;en
Can you  fifties theme   Mohsen Chavoshi ;en
Play track Cabbage by Keiji Haino;en
  on Netflix by Don Kikas ;en
play some Kyle Ward from the seventies;en
I   to hear a   Tim Reynolds ;en
 a popular   Willie Dixon  Groove Shark ;en
 Shinehead's   the twenties on Slacker. ;en
Play a song by Electric Tones from their Kurutta Taiyō album on Last Fm;en
Play Punk Rock music;en
Play Shaina Magdayao's music on Iheart;en
Play the top-ten soundtrack from Kiara.;en
I want to hear This Is The Night from Proof;en
 The Wizard  I on Zvooq ;en
I want to hear gothic rock on Lastfm;en
 some  music on Spotify. ;en
 Goa  on Google Music. ;en
Play the song Waar Is De Zon on Slacker;en
  by Antonella Barba  the album Bath ;en
Open Itunes   Heath music  1981 ;en
Play a popular chant by Brian Epstein;en
Use Itunes to play artist Ringo Shiina track In Heaven;en
 twenties symphony  Robert Walter ;en
 Out  Under  Hurricane Chris ;en
 some dance  Groove Shark ;en
Play sugar baby by frank beard;en
 Supernaut  Armand Van Helden ;en
Can you play me some britpop music;en
play the top five songs by Isaac Hayes;en
 Moris Tepper ;en
play good music by General Woo on Deezer;en
Play the soundtrack that Tom Bellamy contributed to;en
I want to listen to Swing music on Iheart;en
Wish to hear a concerto by Diplo from 1952;en
Play the most popular song from Chae Yeon off of Spotify;en
 Elkie Brooks seventies sound  ;en
play Piano 100;en
 the  popular Johnny Clarke  Deezer. ;en
I want to hear Box    Skeets  ;en
Play some music by Daniel Carter;en
  the greatest Howard Levy song ;en
Play the top song by Jack Grisham;en
 some  music on spotify. ;en
Play the top-10 chant by Caetano Veloso on Pandora;en
Play me a song from Voices & Images;en
 my melodious playlist ;en
turn  Last Fm ;en
 some music  1993 on Itunes. ;en
 The Second Adventure   Hans Nilsson ;en
Play some songs from 1958;en
Can you play an ep from the year 1958?;en
 the  a kiss before  go  Bt ;en
Play music from the punk genre on Last Fm.;en
Play me a nineties sound track;en
 some 50 Shades  Love ;en
Play some chant music by Kevin Jonas on deezer.;en
 some   the last album of 1988  Lastfm ;en
 eighties  on Groove Shark. ;en
Play any nineties music;en
 Dj Ozma  songs ;en
 music from Lastfm. ;en
Play music from 2015;en
Play me a song on Pandora;en
 Before I Grew  To Love   Wafah Dufour ;en
 music from 2007. ;en
 Addicted To You  Hank Ballard ;en
 Regulate…g Funk Era   Iouri Bachmet  groove shark ;en
play music by Bryan Maclean;en
Can you play me the latest theme song by Warren Vache;en
Play Barbra Streisand music from 1997.;en
I want to listen to some Saori Atsumi from the twenties on Deezer;en
play soem nineties Charles Thompson;en
 music  Alison Sudol ;en
play my melodious playlist;en
Play movement music from 1954;en
 the  room sessions  chris cunningham ;en
Please  something  Last Fm ;en
Play Hættuleg Hljómsveit & Glæpakvendið Stella by Kaori Iida;en
Open iheart and play Té Para Tres;en
I need to hear a thirties soundtrack;en
 some eighties  Amirbai Karnataki ;en
 Neutrons  Seun Kuti ;en
 the  Elizaveta Khripounova ;en
Play music on Netflix.;en
 the top melody  artist Maakii ;en
Play the playlist Grime Shutdown;en
 melody music  1988 ;en
can you play some weird music from the noise genre;en
Play me something from the thirties by Candi Staton on Vimeo;en
Repeat the track   ;en
 the  ten  Andrea Del Rosario. ;en
 music form the  with Slacker ;en
 some music  1958 on Deezer. ;en
Open the   Sergei Chatschatrjan ;en
Play Maggot Brain by Albano Carrisi;en
Would you please   a symphony  1995 ;en
 Moustapha Amar Make  Rain ;en
Play genre opera;en
Play the greatest soundtrack by Nhat Son on Last Fm.;en
Play Crucifixion on Deezer.;en
 a chant  Mike Jones ;en
 jazz  by Zvooq ;en
Open Lastfm    Lips Page  the sixties ;en
 music from 2015 ;en
 some Annie Herring beat street   ;en
play the newest by Exuma;en
Play In Every Dream Home A Heartache by vincent paul abbott ;en
Play a top fifty track from the twenties;en
I want to hear Dido  1966   ;en
 music from 1977 ;en
I want to hear the   Slane    Haifa Wehbe ;en
 the   Tom Bellamy contributed to ;en
 a 2007 track  Adam Jones ;en
 Elliot Easton's  Beautiful ;en
 1958 music ;en
I want to hear a good album from Toni Cottura.;en
play some Kansas Joe Mccoy;en
I want to hear that track from 1991;en
Play Post Garage Wave Revival playlist.;en
Please  anything  george formby jr ;en
play deezer top 20 by Natasja;en
Start   Pachangueo Total playlist. ;en
 you  a  off the album, jungle ;en
Play me a nineties song by Joseph Genaro;en
play the top twenty tracks of Ron Jarzombek;en
Play me a song by Linn Berggren from Spotify;en
Start up my nostalgic playlist. ;en
  by Don Cherry. ;en
play fifties movement songs by Fabio on Last Fm;en
 music  the artist Joe Sample ;en
Play Sense Tu from Ebi Hamedi;en
open Deezer    Scott Miller   some  his new songs ;en
play chant on groove shark from 1996;en
  year 2016  artist Michiru Yamane ;en
Play the top-five ballad sort from 2004;en
Play the top-twenty from Alexander Braginsky.;en
 Tom Baxter tracks ;en
Play Greg Raposo songs from the thirties;en
Play Deezer ;en
Play Shinya Yamada music from 1962 on Groove Shark ;en
Play Dancing Through Life by Ronald Isley on spotify;en
 Adieu  Al Arsenault ;en
I want ohear the 1996    ;en
play The Happiest Days Of Our Lives by Tommy Emmanuel;en
Play Noctámbulo playlist;en
play music by Amii Stewart with Itunes;en
 a seventies   steve walsh  Groove Shark ;en
Please play something that's freak folk on Google Music;en
    Kaori Utatsuki off the album that has top-twenty  ;en
  by Don Reno ;en
Open Lastfm and start playing whatever;en
 the best  by Arthur Johnston. ;en
Play music by Nick La Rocca;en
play latest Shaggy music;en
Play my 88 Keys playlist.;en
Play some Sam Moore.;en
Play hanging in the balance by Nik Kershaw on Zvooq.;en
 something  the twenties on Lastfm ;en
Play me a ballad by Dres on groove shark;en
Please play music off the soundtrack by Beau Jocque;en
Play me some music on Deezer;en
Sort to the last song on playlist from 1983 a chant by Mark Oliver Everett;en
Play artist stu davis from the album Dub Chamber 3 on Netflix;en
 some tango. ;en
 hear some 2009  ;en
 some  on Vimeo ;en
 I hear Jeremy Taggart's  chant  Deezer? ;en
 best   david izquierdo on album ;en
Open my music playlist on Youtube;en
play some fifties tunes by Mike Mccready;en
Can you   chant  the fourties? ;en
Play me a tune by Mick Brown;en
 a Mike Osborne  ;en
 some fifties tunes  Mike Mccready ;en
Can you  some Synthpop   Youtube ;en
I want to hear some    Shark ;en
Play a track by Ishmon Bracey on Iheart.;en
 Ebony Bones  Itunes ;en
Play a song off Ian Stuart Donaldson's Nature Nurture album on Itunes;en
  a bluegrass song ;en
Would you please play me a symphony from 1995;en
 new track  the fifties ;en
 Circus Farm  Deana Carter. ;en
Play music from 1964;en
Play Tomtegubben Som Hade Snuva;en
play Dick Marx;en
I want to hear opera   ;en
 a symphony  the thirties. ;en
Lets hear some 2009 music;en
 Brotherhood  Ock Joo-hyun ;en
Play some nineties chant music from Nicoleta Nicola;en
Please play a song off the Curtis Lee album Rough Diamonds;en
 Jawad Ahmad ;en
I want to hear symphony songs from Rebecca Cartwright on Last Fm;en
 Crossroad Blues. ;en
Use Itunes to   ;en
Play me something by Funtwo;en
Play a symphony from Bob Hardy please;en
 Mea Culpa  Rahim Shah ;en
 the most popular   espen lind ;en
 me a seventies  ;en
Play fifties music on Slacker.;en
  a song  Dj Paul Elstak  1988 on Zvooq ;en
play the It Could Only Happen With You album by Lawrence;en
 Party Ben  Slacker ;en
Play the music of Filipp Bedrossowitsch Kirkorow's theme;en
play Say A Word by La India;en
Play any song from Rebecca Hewitt;en
Play some Joeri Basjmet.;en
I want to hear some sixties melody  Mark Mcentee     ;en
 I hear the latest   Bahar Kizil? ;en
   Under The Anheuser Bush  Pete Doherty ;en
 music on Spotify. ;en
I'd like to hear Helen Baylor;en
  Under The Surface playlist. ;en
Play music using Last Fm;en
