expression;language
 my Trapeo playlist. ;en
 Soheila Zaland ;en
Play top music from Charles L. Johnson on vimeo ;en
   Jerry Lee Lewis's If  Say So track. ;en
 a tune or   Kansas City, Missouri ;en
Play Deezer;en
 Alles Heeft Ritme  Liu Tianhua. ;en
Can you play me some eighties music by Adele;en
Can you play some fifties music by lavern baker;en
listen to tei   most popular eighties  ;en
 Tooh  Eric Bazilian  Google Music. ;en
 music  1969 on lastfm . ;en
Open google music   Women of Jazz  ;en
play a top-10 ballad from 1995;en
Use Spotify to   ;en
use Iheart radio to     Hugh Masekela. ;en
Play Kisaki on Pandora;en
play Going Down To The River on Pandora;en
 you   the latest theme song  Warren Vache ;en
 some music  the thirties ;en
play the last Rocko music with deezer;en
 Apbl98  Alden Penner. ;en
Play a 2009 concerto on Deezer.;en
 theme  Yanni on Vimeo ;en
 1970 trunes ;en
Play some melody from the eighties on Spotify;en
 the album  Rap Over Hard   Food ;en
 any song  the eighties ;en
  on Groove Shark. ;en
Can you  some Andrew Cash   Slacker ;en
play Groove Shark;en
Play music on Groove Shark.;en
play an Masaki Aiba tune;en
I want to hear Sarban's greatest hits;en
 a sound track  Mac Dre. ;en
Play Divine from Vinnie Roslin;en
 Rain  Subliminal on Groove Shark ;en
 some Bertine Zetlitz  ;en
 some  Edie Brickell. ;en
  Electro Sur playlist. ;en
I want to hear Nokko's   the  ;en
I want to hear a    ;en
I'm  the  to  to meditative music. ;en
Play an ep by Uncle Jimmy Thompson;en
I want to listen to a popular melody by David Bazan;en
 Roy Orbison tunes  ;en
Wish to hear music from the year 1996;en
I want to hear some    ;en
Open Netflix and find a movie with the song heartful;en
Play any track by Flame;en
 some twenties  on Iheart ;en
Play me a song by Steve Hackett from Manuel;en
  Lodge  Alkabli  lastfm . ;en
Will you  my Nuestros 80  ;en
Play me a song from Movies For The Blind on Pandora;en
Play celtic music;en
Play breathtaking music;en
 my Mellow Beats  please ;en
Play Tenerife Sea by Daniel Salomon on Lastfm;en
Use service Vimeo the genre slow rock;en
Play a song from 1994.;en
Ply best 1973 sound track;en
Play slow rock music on Vimeo;en
play Itunes album mondovisione;en
Play some music from Victor Kunonga.;en
 the top-twenty songs  The Kleptones  Spotify ;en
I want to hear the    ;en
Play Sound Of Love from Papa Mali;en
Play a 2007 track from Adam Jones;en
Play a popular sound track by Joe Pass on Itunes.;en
 Pacific Ocean Blues  John Doe  Lastfm ;en
play Matt Walker tunes;en
Play any song from the eighties;en
 the best songs  Jes Brieden ;en
Play an album from the fourties, new first.;en
 a top symphony  the fourties ;en
play the album Wayning Moments by Rabbit Brown;en
Want to hear a   Nellie Mckay  the  2008 ;en
Play Iheart;en
 a  track  Janamanchi Seshadri Sarma ;en
Play some alternative music on Vimeo;en
Play the best music by Arthur Johnston.;en
Play some music from 2011 on lastfm ;en
Play music from Tommy Ridgley.;en
Play music from 2010 by Jason Donovan;en
 the latest songs  Larry Gatlin  Iheart ;en
I wish to listen to some instrumental music.;en
I want to  to a    Moutsouraev. ;en
play good Classified songs on Vimeo;en
play music by Francis Healy;en
 a  theme  Anna Nikolajewna Jessipowa ;en
 Chris Goss  Netflix ;en
Play Yuauea by Rick Ross;en
 the  Hands Up ;en
 my Hype  on Youtube. ;en
 music on Spotify. ;en
  a  20 chant  Ruwanga Samath on Lastfm ;en
Play Socialism Is Good by terje bakken on Spotify.;en
play some movement by Dj Spinna;en
Play some good music from 2012.;en
 Martha  Dear by shannon. ;en
play ambient music;en
 top Rosanne Cash ;en
play Abhijeet Bhattacharya from 1986;en
Open groove shark   Jason Mizell ;en
 some Prabha Atre ;en
Play some seventies music by Janne Puurtinen on Youtube.;en
 Oj, Jelena, Jelena, Jabuka Zelena   Lalonde. ;en
play an eighties song by Ler Lalonde;en
play a song by Fats Waller;en
Play thirties music by Flex on Google Music;en
play a top-fifty 1965 album by Ski;en
 some good amber gristak  Lastfm ;en
 a ballad  Bob Johnston ;en
Play Chris Goss on Netflix;en
play valerij kipelov on Vimeo;en
 The Fool  The   Khwaja Ghulam Farid ;en
 songs from Youtube ;en
 Noche de chicas  ;en
 a sixties song  George Sanger ;en
Play The Monkeys Have No Tails In Zamboanga on Google Music.;en
Open  Shark   sound track  Dj Cameo ;en
I want to listen to the album going back to the blue ridge mountains on iheart;en
Play Strength of Street Knowledge on Groove Shark;en
Use service  the genre slow  ;en
Play Metal Crash Course playlist.;en
I want to hear De Eerste Keer from Paul Caiafa  off of Google Music;en
 a 1977 record  Bitty Mclean  Google  ;en
Play music by mina caputo on Lastfm;en
Can you play The Change Is Made on Netflix;en
Play track Real Talk;en
I want to  to Swing   Iheart ;en
play the song Shine A Light;en
Will you play me the most popular sound track from 2006;en
play Netflix tunes from 2003 on an album;en
Play Midnight Special;en
Play a top twenty symphony by Bumble Bee Slim;en
 some Armik  the fourties ;en
Play music from Youtube.;en
 a Jack Lawrence  ;en
 music from 1958 ;en
on Deezer   tunes  Jona Bechtolt  a ballad ;en
Play Marche Lorraine by Rachael Lampa;en
 some  Eliza Carthy ;en
Play The Garden Of Allah  from Wade Mainer;en
 the last Jonny Wickersham  ;en
 a popular sort  fifties tune  ;en
Play my Trapeo playlist.;en
 a tune  Andrew Findon ;en
Play a 1964 symphony on Netflix.;en
  a top-ten song  Phil Ochs  Groove Shark ;en
Play some music on groove shark.;en
Play the top five Cemil Bey songs;en
play the top-twenty margaret becker songs with google music;en
 a concerto  Thekra. ;en
Play Someday Soon by fiona;en
Will you play my Nuestros 80 playlist;en
 the greatest Vimeo tunes  angelo amorevoli   ;en
Play the top movement music from 1997.;en
Play some P. J. Proby;en
I want to hear Ding  Bell    ;en
Open Pandora   music  the fifties. ;en
 Itunes songs  Gerard Way ;en
 music  the twenties with Slacker ;en
Use itunes to play dancing playlist;en
 fourties soundtrack  Hamish Maccunn ;en
Play the latest music by Martin Luther Mccoy;en
Play some eighties movement music;en
Play 1952 Yusef Lateef on Netflix;en
I want to hear the newest music from The Railway Children;en
play a track from 2004;en
play The New Timer by Augustus Pablo with Itunes;en
play Sivamani;en
 the top  songs  Robert Lockwood Junior. ;en
Play a 2014 theme from Greg Pattillo;en
Play my Piano Ballads playlist.;en
play a ballad from 2000;en
play a symphonic rock on Pandora;en
Play me a sound track by Bert Mccracken on zvooq;en
 me the newest  symphony ;en
I want to hear secrets on parade from Tommy Walter;en
  Gil Parris's A Cup  Coffee, A Sandwich  You ;en
Play the album Qr Iii by bobby bare;en
 some Dave Pearce. ;en
open the Canciones del Recuerdo    songs ;en
 the  alas y raíces  Dave Pybus. ;en
Play some soul music;en
Play me a seventies song;en
 a 1988 soundtrack ;en
Play a song by Tim Finn on Last Fm;en
Can you  me some britpop  ;en
Play the Mother Lode by Tamio Okuda;en
 the  5  Akira The Don. ;en
Use Groove Shark to play music from the nineties;en
 some rock & roll  Deezer. ;en
Play One Good Reason by Tommy Flanagan on Itunes;en
Play music from 2015;en
Can you  Crossover? ;en
Play music on Itunes;en
Play the song Victim Of Changes from Hawkshaw Hawkins on Spotify;en
 Acid Punk music. ;en
Play a twenties soundtrack on Youtube;en
  listen to Rouhollah Khaleghi  deezer. ;en
play some Mike Porcaro;en
play Iheart tunes by Neil Finn;en
 shara worden ;en
Play the track titled Faget;en
 music  the artist Irma Pane ;en
  Williams Sings Rodgers  Hammerstein  elica todorova ;en
 some art punk. ;en
I want to hear Richard Falomir's best song on Pandora;en
Play the newest melody from Corey Clark on Lastfm;en
 the  Martin Solveig sound track ;en
Play the top-5 sort of ballad music from 2012.;en
Play a 1998 sound track  from Sam The Kid on Last Fm;en
play Who Do You Think You Are by Magnifico with spotify;en
 the latest   Joel Hastings on Itunes. ;en
Play theme music from 2011.;en
Play Elastic Love by Junior Marvin;en
 you  the greatest songs  Mauro Picotto ;en
 a 1983 concerto  Ayaka  Itunes ;en
 some  by Dj Spinna ;en
Play the last ep from 1999;en
  playlist, Hardstyle, Baby. ;en
  the greatest Doctor Fink song  zvooq ;en
Play some Carmen Mcrae from Ed Robertson off of Itunes;en
play songs by Sarah Harding;en
 a fairouz tune  Deezer ;en
Sort eighties ep from the last;en
 music  2012 on Netflix. ;en
I want to hear some Boris Grebenchtchikov on Zvooq;en
Play music from 1964.;en
I'd like to listen to opera on Youtube;en
Play playlist riveting ;en
  to  a Mark King record  1993 ;en
I want to hear some     Sheehan ;en
 some eighties  music ;en
 a popular sound   Joe Pass  Itunes. ;en
I want to hear music by Madeleine Peyroux from 1991 on Youtube.;en
something on Spotify please;en
 me a song  Michael Diamond ;en
Play thirties concerto music on Google Music;en
Play something from 1985 by Billy Werner;en
Play a track by Yui on Vimeo;en
 the latest ballad  September ;en
Play me a twenties song;en
 Make The Cowboy Robots Cry  Sabin Rai   ;en
Play a chant from the fifties;en
Play me a song from 2016;en
Play music on Last Fm;en
Play a Martyn Bennett from 1957 on Pandora;en
Play me music from the twenties on Itunes.;en
Play some Armik from the fourties;en
play Angela Winbush ep that is popular;en
  tunes by Joseph Utsler ;en
 the latest   Martin Luther Mccoy ;en
Start playing my Disney playlist.;en
 Kings  The Wild Frontier  Andrea Bocelli ;en
Play slow rock music;en
 something  Louisiana Blues ;en
I want to hear Sebastian's songs from the thirties on Youtube;en
 some   1985 by Rolf Harris ;en
play a top Ryuichi Kawamura chant on Groove Shark;en
 chant   pappu venugopala rao on Slacker. ;en
Play music on Spotify.;en
Play top-ten eighties song;en
Use service Vimeo to play music from the artist Mick track Now We Are 5;en
 a sixties song  Classified ;en
  Raices Y Antenas  Lynn &  Llp. ;en
play a chant by Mike Jones;en
 you  a  song  a chyi chin concerto ;en
 Portsmouth  Paul Smith  Google Music. ;en
Open Lastfm and play Hot Lips Page from the sixties;en
 Pura Vida. ;en
play Are & Be;en
 a top-five song  Pete Candoli. ;en
 music from Youtube. ;en
Play me a song by Kevin Cadogan;en
play 90s Love Songs on Youtube;en
I want to hear a     2002 ;en
Can I hear a song by David Hodges?;en
   the track She Came  Through The Bathroom Window ;en
Play a ballad form 2014 by Double on Google Music;en
Play Hughie Graham by Vidyadhar Vyas;en
 a  twenty symphony of 2010 ;en
Can you play a 1967 soundtrack on Slacker;en
Play 25 To Life by Paul Riley on Deezer.;en
 I hear a   David Hodges? ;en
I want to hear   1975 ;en
 eighties track ;en
 a movement  the nineties ;en
 Phil Spalding soundtrack  the seventies ;en
Play me a symphony by Ricky Bell;en
Play the music of Aphex Twin's good Album;en
  100  Tracks on Spotify on Lastfm ;en
I want to listen to nineties chant songs;en
 hear some booty  ;en
play some best selling rave songs;en
 Donald Rubinstein  Pandora ;en
Play a sound track from 1952.;en
Can I listen to Dj Vibe's top 10?;en
Play music from 2012 on google music;en
 something  Louis Nelson Delisle. ;en
  by Shinji Miyazaki ;en
Play top-five concerto music from 1992;en
play Signe Anderson chant music that is newest;en
Can you play some Synthpop music on Youtube;en
 the last Niney The Observer  ;en
 chant  Freddy Fender on iheart ;en
play a record from 1982;en
Play me a song from 1972 by Sweet Emma Barrett;en
Play music from the artist Joe Sample;en
Please   off the soundtrack  Beau Jocque ;en
I want to hear Sarban's   ;en
Use Groove Shark to  music  the  ;en
play pandora tracks by Akhtar Sadmani;en
 some Oleg Anofriyev  1960. ;en
 concerto from 1951 ;en
 new   Mike Oldfield on Vimeo ;en
 track Her Majesty ;en
Play music from Lastfm.;en
I want to hear any top five music from Gene Autry;en
I want to  to some  ;en
 the top chant music  2014. ;en
I want to hear the new Latin Pop Rising list;en
Please play Bitch Please Ii;en
I want to hear Nokko's songs from the twenties;en
 Rei Momo  album ;en
Play me the most popular Peja song on Slacker;en
I want to hear the new Vasilis Tsitsanis ep;en
Play Arif music from the fourties.;en
Play a tune by Andrew Findon;en
I want to  to some Saori Atsumi  the    ;en
I want to listen to my Spain Top 50 playlist on groove shark;en
Play some theme songs from the fourties;en
I want to hear a top-20 chant from the twenties;en
Play a Ladyhawke record;en
I want to hear a Sandra ep;en
Play some Instrumental music on the service Lastfm;en
Play Odessa by Maartin Allcock.;en
 a 1994 tune  Lena Horne ;en
 I listen to  Vibe's  10? ;en
Play some movement from 1959 on deezer.;en
I'd  to hear songs  Iheart ;en
Play album from Maureen Mcgovern;en
I want to hear Choice     the twenties. ;en
 Robin Hood Rescuing  Squires  Bhupinder Singh ;en
Play some Rockwell from around 1996;en
  a sound track  Bert Mccracken  zvooq ;en
 Soldier Boy  Melody Gardot ;en
I want to hear the   &  ;en
 a Martyn Bennett  1957  Pandora ;en
 you  the latest faust soundtrack  1967? ;en
Use pandora to    stano  the year 2005 ;en
Plya a tune  Kancherla Gopanna  1951   ;en
 the energic Itunes ;en
Play a seventies Tom Thacker ballad;en
play ep by Arjen Anthony Lucassen;en
play Fernando Olvera;en
open the Canciones del Recuerdo playlist and play songs;en
I want to hear    sixties. ;en
play music from Itunes for Ric Grech;en
Play bebob on Iheart;en
play the most popular Miles Jones track;en
 a Keith Richards  ;en
 southern rock tunes ;en
 twenties tunes ;en
Play me Benjamin Kowalewicz's top hits;en
I need to hear the new Kevin Fowler album;en
Please play me some Satire music;en
 music from 1960 ;en
  by Duane Allman. ;en
 some Dj Qbert. ;en
I want to hear music on Itunes;en
Play music by blowfly from the seventies;en
Play Bald by Kaskade.;en
Please open pandora for me;en
Open    Iron Mountain Depot  John Lomax ;en
Play music from 1958.;en
 playlist funtime ;en
I want to hear the   to Mary Macgregor    Iheart ;en
play some Folk tunes;en
Play 1958 music on Iheart;en
Play the greatest record by Leroi Moore;en
Play my Futuros Hits playlist on Spotify.;en
Play a sixties song.;en
 some dance music ;en
Play Within You Without You by Distance on zvooq.;en
 Slacker tunes by Smog   in 2015 ;en
Play a twenties concerto from Roger Taylor on deezer;en
 some music  2011 on lastfm ;en
 a new ballad  Valy  Iheart ;en
 a soundtrack  1954. ;en
 a cohesive  for me ;en
Play Dj Drama from the 1976;en
I  to hear some   Spotify ;en
 The  Timer  Augustus Pablo with Itunes ;en
Open Deezer and play Inyección Musical;en
 the last sound track  Soko   1975 ;en
Play Listen To The Mocking Bird by Billy Martin on Youtube;en
 1981  on Last Fm ;en
 chant   Ira Losco on Iheart. ;en
 some Last Fm  like the 1992   Peaches ;en
I want to  to   The Bayou   ;en
I want to hear a Joel Hastings melody. ;en
 most popular  Nil Burak  Slacker ;en
 Moondog's Chupacabra. ;en
play music from 1950;en
 I  to   the Easy Listening genre? ;en
Play me some music from 1999;en
  a twenties tune on Deezer ;en
Open iheart   Té Para Tres ;en
Play Acid Punk music.;en
 Harel Skaat ;en
 some  on Lastfm ;en
Play symphony music from 1991 by Irvin Mayfield;en
 a track  1985. ;en
play zvooq Southern Gothic;en
  music on Pandora. ;en
 the  American Patrol  lauryn hill ;en
play a concerto that was most popular in 1958 by mickey hart;en
 you  a ballad  Mahalaxmi Iyer ;en
 some jpop  Google Music. ;en
play the greatest Adrian Kowanek music;en
I want to hear a   ;en
 a theme  Walerij Leontjew ;en
Please  some music  1996 ;en
 the playlist, A  Niños  30. ;en
 Anweshaa  the new first. ;en
Play music by Otis Redding.;en
Play Fight On, State.;en
Play Nick Hexum latest album;en
I Need rave Slacker to play;en
Please play playlist TODO REGGAETON;en
Play The Way It Has To Be by Tom G Warrior on Zvooq;en
play music from the twenties;en
Play music from Gavin Koppell movement;en
Play something on my Classic Jazz Funk playlist on Zvooq;en
 a  song  Carson Parks  Groove Shark ;en
use Slacker to listen to seventies music;en
Will you pull up my Jueves de Antaño playlist;en
Open Vimeo   Lee Mellor  songs ;en
 a symphonic rock  Pandora ;en
Play some Mf Doom from the sixties on pandora.;en
Play some seventies songs from Joseph Genaro on Google Music;en
Play record from the seventies;en
 a chant  Mj Cole ;en
Play Goldie Hill's record on Google Music.;en
play 1990 tunes on Groove Shark;en
play steve harris False Gestures For A Devious Public album;en
 Richard Fortus'  Collection. ;en
 some Erin Harkes  the fifties  Lastfm. ;en
Play Brotherhood by Ock Joo-hyun;en
 Hasan Saltik  2004 ;en
 Socialism Is Good  terje bakken  Spotify. ;en
Play Kool Keith Presents Thee Undatakerz by John Mccrea.;en
Play the newest stuff by blowfly;en
I want to hear   carman  the   ;en
 Wynton Kelly  on Netflix sort  popular ;en
Play Adieu by Al Arsenault;en
  Piano Ballads playlist. ;en
 me a song  the  movement ;en
use Lastfm to play Attack Of The Planet Smashers;en
I wish to hear the  Estado  ánimo   Fm. ;en
  stu davis  the album Dub Chamber 3  Netflix ;en
 industrial music. ;en
  a seventies song ;en
Play The Tyranny Of Distance by Willy Mason.;en
 the last Chris Douglas  Slacker ;en
Play Party Through The Decades on Deezer;en
 the most popular   marcel khalife  Netflix ;en
Play a melody from Elmer Bernstein;en
Play the most popular ep by marcel khalife on Netflix;en
play Wow by Jon Theodore;en
Play Supernaut by Armand Van Helden;en
play the top jazz record from 1951;en
Play a melody from Elmer Bernstein;en
Open Pandora and play Reggaeton 2017 y Baila!;en
Play Fais Les Backs by Sarah Geronimo on Youtube;en
 some  selling rave songs ;en
play the latest Thelma Aoyama;en
Can you  some fifties   lavern baker ;en
 music from 2014 ;en
  a 1958 adam yauch concerto   Shark ;en
 a   symphony by Bumble Bee Slim ;en
Play a popular song by Willie Dixon on Groove Shark;en
 i use Lastfm to listen to Twilight    Khalil? ;en
Play Rocket Queen on Itunes;en
 music  the  Late Night Jazz ;en
Play a record from the seventies;en
Play fourties soundtrack from Hamish Maccunn;en
 Rob Dougan  youtube ;en
 shadowplay  Dana on Deezer. ;en
Play These Four Walls by Yummy Bingham.;en
play The Song Remains The Same with Pandora;en
turn on Google  to  1991 ;en
 music  the thirties. ;en
 me a tune  Mick Brown ;en
Play a song on zvooq;en
Play my Fusion Fest playlist on Youtube;en
play some twenties music on Iheart;en
Play new Teo Macero;en
Let me hear the Live From The Ghetto album by Beau Jocque.;en
I want to hear a 1976 symphony by Jam Master Jay;en
 the  Le Renouveau ;en
Can you play Halloween by Ajinoam Nini;en
Please  Every Woman  Me ;en
 latest Shaggy music ;en
play 1960 chant music by Hermann Baumann;en
 Roland Alphonso tunes   most popular ;en
I wish to listen to some fifties music.;en
Play  music from the thirties.;en
 music off Youtube. ;en
Play Bob Hilliard top-twenty music;en
Play music from the year 1964;en
 some Hong Junyang. ;en
Play some music by Karl Blau.;en
 some fun-punk ;en
Play some Christian Rock;en
Play some Glenn Stetson music on Spotify;en
 fourties record ;en
play Tom Jones album from the twenties;en
 music from 2016. ;en
Play the album 21st Century Live by Chet Lam on Itunes.;en
Play 2gether by Jade Puget;en
Play the top-20 best Chicane songs on Deezer;en
Use  Shark to  Krizz Kaliko ;en
I'd  to listen to  Cochrane's 1990   Zvooq. ;en
play Slacker tunes by Smog from movement in 2015;en
Play ecstatic ;en
Can I hear Anna Vissi's new music on Pandora?;en
 the   Alexander,  Honey Boy  Ehsaan Noorani ;en
play Pandora tunes from the fourties;en
Open up music on Last Fm.;en
I want to listen to  Spain  50    shark ;en
Play me the greatest track of 1966;en
 hanging  the balance  Nik Kershaw  Zvooq. ;en
Play me a song by Teitur Lassen on Groove Shark;en
 Christina Milian latest  ;en
Play the most popular chant song by Hossein Alizadeh from around 2009;en
Play Geddy Lee music on Spotify sort by top;en
Play me a song by Hank Thompson from Moa Anbessa;en
 Eternally  Marko Desantis on zvooq. ;en
play some sixties music;en
listen to tei movement from most popular eighties music;en
Play some 2011 music by Dan Healy.;en
 some chanson  music. ;en
 i believe  Chico Buarque off  iheart ;en
 a concerto  ten sort  Lloyd. ;en
 Techno music ;en
 Bald by Kaskade. ;en
 the song vodka  Kunal Ganjawala  Itunes ;en
 the song Victim  Changes  Hawkshaw Hawkins  Spotify ;en
Use  Fm to   Kawabata Makoto  their record ;en
 Are & Be ;en
Play the greatest record by Joe Purdy on Google Music;en
Play any song from 2001;en
 the  track of 1998 ;en
  an eighties song  Wes Dakus ;en
I want to hear Somi's songs from the twenties;en
play some dream music;en
Start playing something off Spotify;en
 White Noise. ;en
Play music from 1999;en
play some gotye;en
Play music from my relentless playlist;en
Play play Lodge by Alkabli on lastfm .;en
Please  some music  the seventies  ;en
 a  fromthe eighties  Nobuo Uematsu. ;en
 Luis Alfonzo Larrain  1995 ;en
 a soundtrack  Mike Hindert  Spotify. ;en
 Arif music  the fourties. ;en
Can you  an   Tatjana Iwanowna Bulanowa ;en
Open pandora   the   melody by Hanna Sjedokowa ;en
 Bob Hilliard top-twenty  ;en
Play some thrash metal.;en
I  to  to some  music. ;en
Play the top ten by Andrea Del Rosario.;en
Play always by walter parazaider.;en
Play an Andy Silvester sound track from the thirties on Spotify;en
Play The God That Failed on Vimeo.;en
 Punk Essentials on google  ;en
Let's  the album Handover  Deezer ;en
I'd  to hear  Airey's Gonna Raise  ;en
Play the song Le Renouveau;en
  Hot 50 playlist. ;en
 Google   the  singles released  1972 ;en
Play Oliver Cheatham's symphony from the thirties.;en
 something  the twenties ;en
 Fais Les Backs  Sarah Geronimo  Youtube ;en
 Masashi Hamauzu's newest symphony  Itunes. ;en
Do you have something like Impossible Is Nothing by Abderrahmane Abdelli?;en
  in the genre soundtrack ;en
Play the top 20 ep from the fifties by John Bundrick.;en
Play a melody by Hagigat Rzayeva;en
 my Éxitos España  ;en
  which has humour on Youtube. ;en
Please  music  Itunes ;en
 the greatest Adrian Kowanek  ;en
I'd like to hear songs from Iheart;en
Play This Is: Animal Collective please;en
Play something by Chris Knight;en
 fifties music ;en
I want to hear Sebastian's   the   Youtube ;en
Use the service Lastfm to   keren peles  the   symphony ;en
 Rap Album One  Gene Vincent. ;en
 the tune  Adam Yauch ;en
Play the music of melody of 1997 in Itunes;en
 Step Up Your   Marc Cohn. ;en
play a Karin Dreijer Andersson soundtrack on Groove Shark;en
Play my Masters of Metal playlist on Spotify;en
Play Dave Mason's soundtrack on Last Fm.;en
Does Netflix have music released in 1991 by You Yokoyama;en
Play a soundtrack by musical artist Jimmy James;en
play Sivamani ;en
  Masters of Metal  on Spotify ;en
Play music from 2007.;en
 a popular melody  Lindsay Lohan  Youtube. ;en
play Ebony Bones on Itunes;en
 the  Tei last concert  Netflix ;en
  a song  Hank Thompson  Moa Anbessa ;en
play some twenties movement tunes from the last Olga Souza;en
 that new song  1970 ;en
listen to ballad   the twenties ;en
  some chant  the last  of the sixties ;en
 some thrash metal. ;en
 Yung Joc  slacker ;en
 the  Sebastian Karlsson melody  Youtube ;en
 a song  Nash The Slash ;en
  the  Mama Liked The Roses ;en
Play music from Clark Kent in the year 1987;en
Use the service Zvooq to play merengue music;en
 me some  on Deezer ;en
 Julie Driscoll ;en
 some  by Frayser Boy. ;en
Open Youtube and play Nanana from Massimo Altomare;en
Play Adrian Borland's music on Zvooq.;en
 music from 1950 ;en
Use Groove Shark to    the eighties ;en
Play music by Country Dick Montana.;en
 Latin Dinner ;en
I want to hear Vegetables by pharrell williams;en
 the  sound track  the thirties ;en
Play music from 2002;en
   the top-5  artist Kenia Arias ;en
 sixties  by giovanni battista guadagnini. ;en
play symphony music from the fourties with google music;en
Put on Vimeo   Kacapi Suling ;en
 Punk Essentials  Zvooq ;en
Play the most popular music by Ronald Isley on Google Music;en
play the last chant from the fourties;en
Play some music by Frayser Boy.;en
play songs on Itunes;en
I want to hear a nineties track by stat quo on Deezer;en
 me a song  1976  Bennie Moten ;en
 track   Peter Finestone on Netflix sort  newest ;en
I'd  to hear   1951,  a soundtrack. ;en
Play the greatest Nicholaus Arson concerto from around 2000;en
play chant by Prurient;en
Play concerto from 1951;en
play a 1988 soundtrack;en
Play Iheart ;en
Play twenties from Ken Floyd;en
 a record  2015 ;en
 some noise  on Netflix. ;en
 andrew lloyd webber's  tune  zvooq. ;en
Play POP GOES THE 80s.;en
 some tune  2011 on Youtube ;en
play top-twenty song from 2015;en
I want to hear the  The Boom  Bust   haruka shimotsuki off   ;en
 cheerful playlist ;en
 the  Gypsy Swing ;en
Play gothic music;en
Play the top five songs from Robert Lockwood Junior.;en
 any chanson ;en
I want to listen to  Daltrey  the sixties   ;en
 fifties  Sirusho Harutyunyan ;en
 some   by Perez Prado on Iheart ;en
Play Lil Hardin Armstrong from Itunes.;en
Play Andy Williams Sings Rodgers And Hammerstein by elica todorova;en
Open Zvooq and play the best songs from Device;en
