expression;language
Open The Second Adventure album by Hans Nilsson;en
 some sixties   gaudi on last fm ;en
Can you play some music from my road trip album;en
I'd   hear some trip-hop ;en
Can you  Maggie Mae  Netflix ;en
 Steven Reineke greatest soundtrack  Youtube ;en
use Iheart to listen to retro;en
 music  2005 by Justin Broadrick ;en
Play Gloria on last fm;en
 a melody  avery storm. ;en
Plkay some sixties movement songs from Itunes;en
I want to hear La Jaula De Oro by Mc Ren on Google Music.;en
 some acapella  on Iheart ;en
Play new track from the fifties;en
 a new song  1976. ;en
 The Way It Has To   Tom G Warrior   ;en
I'd like to hear Don Airey's Gonna Raise Hell;en
Play some acapella music ;en
play Mikazuki Sunset;en
 use pandora to  a record  1993 ;en
 you  a chant  Butch Trucks  Spotify ;en
 Intense Studying  on Itunes. ;en
I want to hear a top-50 track from Takahito Eguchi on Google Music;en
play Kings Of The Wild Frontier by Andrea Bocelli;en
  by Raheem Devaughn. ;en
Play some Erin Harkes from the fifties on Lastfm.;en
  Still Got the Blues playlist. ;en
 the newest  from the sixties ;en
Play the album Shooting Silvio by Dave Sabo;en
Play a concerto by Thekra.;en
Play thirties symphony music from Nigga on Iheart;en
play Tonight Only! by Nastya Kamenskih;en
 Grabsteinland I  Doctor Fink  slacker radio ;en
Play symphony music from Joe Dolce;en
Play the playlist introspective;en
 music  Lastfm and Deezer. ;en
Play the best Sebastian Karlsson melody on Youtube;en
play music form the fourties with Slacker;en
 a song  1990 on Netflix ;en
 a song  1950 ;en
Play something from the jonathon lee movement;en
 the  symphony music  Ejigayehu Shibabaw ;en
Play Zvooq;en
Play sixties on Spotify;en
Can you play the greatest songs by Mauro Picotto;en
 a tune  Syreeta Wright  twenties  the  ;en
 a song  Busta Rhymes ;en
Play some gangsta music;en
Play the seventies album on last fm;en
Play the greatest 1966 album out there;en
give  some Hank Shermann  1975  Lastfm ;en
I want to hear a track by Ryohei Yamamoto on Vimeo;en
Plays some akb48   ;en
  by Susumu Hirasawa. ;en
 falco on Zvooq  Good Hit ;en
 the artist Joe ;en
  by artist mark ashley ;en
Can you play a song by Ken;en
Plan  album  Roni Duani. ;en
 me a song  Stephen Jones ;en
Use Google Music to play a song;en
Play a 1958 soundtrack by Rudolf Schenker on Netflix.;en
 I hear a   Vladimir Vysotski? ;en
Please play some Black Metal music;en
play chant music from 1993;en
Play a music theme by Anna Nikolajewna Jessipowa;en
 the last 1957  ;en
 you   the most popular sound track  2006 ;en
 The Monkeys Have No Tails  Zamboanga   Music. ;en
 some music  the sixties ;en
 chant  by Big Dee Irwin. ;en
 Glenn Yarbrough tunes ;en
 1981 tunes  Jiles Perry Richardson on Lastfm  theme  ;en
Play some music from 1995;en
play Wolves by Larry Gatlin;en
Play music by Raheem Devaughn.;en
play a 1999 track by Pete Seeger on Youtube;en
 some theme songs  1974 ;en
 The Happiest Days   Lives  Tommy Emmanuel ;en
 a song  1973. ;en
I want to hear any tune from the twenties;en
I want to hear Papa Mali's songs from the fifties;en
 Peja tunes ;en
Does Netflix have  released  1991   Yokoyama ;en
 the top  Cemil Bey songs ;en
play track Her Majesty;en
Play the top hits of 2016;en
 Miami 2017  Rodney Whitaker ;en
Open youtube ;en
Play the top 1991 sound track;en
Play Furusato on Google Music.;en
Play a song from the thirties on Zvooq;en
 twenties music off of  Itunes ;en
play Morning Song;en
 the  Jingle Bells ;en
 some salsa music. ;en
Play music from the artist Taktloss from the record in the thirties;en
Play A Chaos Of Desire from Dan Snaith;en
Play a song off Get Up Offa That Thing by Doseone on Last Fm;en
Play Gary Chapman music from the fifties;en
 thirties concerto  on Google  ;en
 journey list ;en
Play a rock track from 1984;en
 me  by Whip with Zvooq ;en
 some sixties music. ;en
  Steps To Heaven  Wikluh Sky ;en
 Kurt Cobain  tunes ;en
play twenties tunes;en
Play some new age music;en
Play me a Xuefei Yang symphony on Groove Shark;en
Play a theme from Walerij Leontjew;en
Play Dj Shadow's A Love Hate Masquerade.;en
I  to hear the  Kevin Fowler  ;en
 the  caleigh peters. ;en
play Isaac Hayes on Pandora from love, sweat and beer ep;en
 Vic Ruggiero music  2007 ;en
 some theme songs  the fourties ;en
Play some art punk.;en
Play music on Itunes.;en
Play the best songs by Jes Brieden;en
Play the album alas y raíces by Dave Pybus.;en
Play satire;en
I want to hear the   To   Narayana Tirtha. ;en
 Fernando Olvera ;en
 I hear a Da  ep? ;en
Play easy listening;en
 the last 1954   Povel Ramel. ;en
Open Vimeo   music. ;en
play the track Asleep In The Deep;en
 prints  the stone  Helen Baylor ;en
I'd  to hear   Eric Clapton's  popular melody  Pandora. ;en
 the greatest record  Leroi Moore ;en
play music on Netflix;en
Find me music by Kaori Utatsuki off the album that has top-twenty hits;en
Open Youtube and play Iron Mountain Depot from John Lomax;en
Play some music on Slacker;en
 the track  Would  Something  Eden Ahbez ;en
Play some dance music;en
Play my Pandora app;en
 some  by Daniel Carter ;en
Play some chant from 1974;en
Play some Hong Junyang.;en
 Hættuleg Hljómsveit & Glæpakvendið Stella   Iida ;en
Please play a song from the thirties by Peter Murphy on Last Fm;en
use Netflix to  Michael White   1955 ;en
Play the most popular Grace Slick song that has a symphony sound;en
Play the track Siberian Khatru on zvooq;en
Play music by Paul Mccartney;en
 instrumental pop ;en
 some Iris Dement's  based 2015   lastfm ;en
 a twenties song ;en
 music on Netflix ;en
Play music from Hide;en
I want to hear Steven Harwell from the thirties;en
 sixties theme music ;en
 music  the twenties. ;en
I want  hear a   melody. ;en
Play Kaori Mochida's most popular music on Google Music.;en
Play some Paulinho Da Viola from 1965.;en
play songs by Sammy Fain;en
Play some showtunes music.;en
  by Nick La Rocca ;en
 2007 tunes  Bunny Berigan ;en
Can you play Deezer from 2007?;en
 Sergei Anatoljewitsch Kurjochin's   Groove Shark. ;en
use Iheart radio to play eighties music from Hugh Masekela.;en
  70s Smash Hits playlist. ;en
play a movement from top-20 1983 by Baruch Chait;en
 the best 1981 sound   Ric Fierabracci ;en
Play the Mister Music Man by Gene De Paul.;en
Play twenties on Groove Shark;en
 some Instrumental   the service Lastfm ;en
Play christian gangsta rap;en
play Hanging Out and Relaxing;en
Play a nineties tune by Sugar Minott on Netflix;en
 a chant  1978. ;en
 you  a melody  the fifties  Last Fm? ;en
I want to hear some    ;en
  Richard song White Summer ;en
Play Inventions For The New Season;en
 Lastfm   a voluntad del cielo  Wax ;en
Play Niko from the fourties;en
 Gloria  last fm ;en
play 1970 trunes;en
open Fadl Shaker  Spotify   a melody starting  the  ;en
i wanna listen to a the top-twenty track of Denniz Pop in Pandora;en
 opera  on google  ;en
Play the album Resurrection In Blood from Sleepy Brown on Itunes.;en
I want to hear a Gucci Mane song from Last Fm from 2002;en
I want to hear a track from the fourties.;en
Play the sound track by Ferry Corsten;en
Play me Hier Encore by greydon square;en
 the top-ten soundtrack  Kiara. ;en
 Miyavi's   seventies on Google Music. ;en
I want to hear a top-20     ;en
Play Shinehead's music from the twenties on Slacker.;en
Play the best song by Henry Rollins.;en
play the top five songs by Gad Elbaz;en
Play Tooh by Eric Bazilian on Google Music.;en
Play a record by Black Wall Street Records;en
 a 2009 concerto  Deezer. ;en
 some acapella music ;en
 drive playlist ;en
Please  something that's freak folk  Google  ;en
Play Goa music on Google Music.;en
Proceed with   2003. ;en
 Paula Campbell music  1993 ;en
Play music by Don Cherry.;en
 any nineties music ;en
 a melody  Colin Blunstone ;en
Play the 1951 ballad;en
Play me a 2015 soundtrack on Netflix;en
 a Loretta Lynn tune   Shark ;en
 Say A Word  La India ;en
play I Could Write A Book;en
Play the playlist Gypsy Swing;en
 the theme   Christian Fennesz wrote ;en
 the most popular album  Google   sasu ripatti ;en
 a tune  Space Mandino. ;en
 Lil Hardin Armstrong  Itunes. ;en
Play popular eighties record;en
I want to hear jon sholle's stuff  2009    ;en
 any song  Rebecca Hewitt ;en
Play me a song from the fourties;en
Start up my Pachangueo Total playlist. ;en
 top 20  frank farian ;en
Can you  something  1966  Mc Ren  Spotify ;en
play the Gary Chaw album;en
 The Garden  Allah  Wade Mainer ;en
 I hear a symphony  the   Youtube? ;en
 music from negerpunk ;en
Play the newest Phil Stacey.;en
I want to hear something from Post-punk Revival;en
Use the service Itunes to play melody from 1998;en
Play a song from 1990 on Netflix;en
I'd  to hear Infinite  Folk  Slacker. ;en
play robin hood and the bishop of hereford by Jon Mayer;en
 to acapella ;en
 music off Itunes. ;en
Play some Last Fm music like the 1992 ep from Peaches;en
I want to hear  off   Festival  ;en
 the track The Wizard  I ;en
Play the last song by Goldie;en
 the best Bruce Ruffin   Youtube. ;en
Open Zvooq   the best songs  Device ;en
Play me the newest fourties symphony;en
 Itunes album mondovisione ;en
play The Edge by Deezer on Vans Warped Tour Compilation 2003;en
Can you play that last ep from the twenties;en
 a fifties album  Itunes. ;en
 Piano 100 ;en
I want to listen to Roger Daltrey from the sixties on slacker;en
 my playlist springtime ;en
 some showtunes music. ;en
Play Liubi, Liubi, I Love You by Farah Asyikin Binti Zulkifli on Netflix;en
Let me listen to Rouhollah Khaleghi on deezer.;en
Play new Ian Mclagan;en
Can you  something off  Kids Workout   Groove Shark ;en
 Dave Wyndorf album ;en
 the seventies album  last fm ;en
 Leanne Dobinson  To Dream ;en
listen to Vertexguy  ;en
 top-twenty   music by Mohammad Reza Lotfi. ;en
  using Groove Shark ;en
Play the best songs of 2016;en
 melody music  the fourties. ;en
 ballad  by Jeff Lynne. ;en
Please  Jim Martin  Vimeo. ;en
 a Scott Lafaro  ;en
Play a seventies soundtrack by steve walsh on Groove Shark;en
play Jeff Pilson on Youtube;en
 the  hits of 2016 ;en
 a top-50 tune  1982. ;en
 the most popular Coti   Pandora ;en
 Yo Ho  the  york pops  Youtube ;en
Play an Alla Pougatcheva ballad on Pandora;en
Play the music Hands Up;en
 deezer  20 by Natasja ;en
 the album Axum ;en
Play a popular melody by Lindsay Lohan on Youtube.;en
 Shake Your Head ;en
  some Bill Evans music. ;en
Play mere lapsed by Marilyn Moore.;en
 a 1974 sound track  Vimeo. ;en
play 1988 chant music on Itunes;en
I  to hear a thirties  ;en
Play the newest ballad from Chad Urmston;en
 some songs  the fifties ;en
 some seventies track   Rie Tomosaka ;en
 music  Itunes for Ric Grech ;en
 me a concerto  Jethro Burns  Zvooq ;en
 some latin music. ;en
play Matt Uelmen songs from 1965 on Slacker;en
 I hear a   rookantha gunathilake  the Vimeo service? ;en
use Vimeo to play De Camino a Clase playlist;en
Play that new song from 1970;en
 the album Cara  Dios. ;en
Play the album, Dance Hall At Louse Point.;en
 something  the jonathon lee movement ;en
 me the dinner  ;en
Please  some Black Metal  ;en
 some symphonic rock. ;en
 the  fifty soundtrack  the twenties. ;en
  something on Last Fm ;en
play Joey Fatone soundtrack tunes from Google Music from 1972;en
 Rob Mills  The Golden Archipelago. ;en
 Stereo by  Davis on Deezer. ;en
Play some Dj Qbert.;en
Can you pull up and play something on Itunes;en
 anything  Hiromitsu Agatsuma off iHeart. ;en
Can you play some music by andrew diamond;en
 some seventies  on netflix. ;en
Use   to  the Today  Tomorrow album ;en
Play some House music;en
Play Paul Landers, O Rio, A Cidade, A Árvore on slacker;en
Play some jpop on Google Music.;en
 the greatest ballad  the seventies ;en
  88 Keys playlist. ;en
Open youtube;en
Play the greatest soundtrack by Jesse Harms.;en
 some Sam Moore. ;en
Play some seventies track from top Rie Tomosaka;en
I want to hear some twenties music off of Deezer;en
 I hear Anna Vissi's new   Pandora? ;en
Open Youtube   Renaldo Lapuz record  the  ;en
Play new movement from Mike Oldfield on Vimeo;en
 fourties tunes ;en
  by Young Steff ;en
 music on Deezer. ;en
play Lily, Rosemary And The Jack Of Hearts by Chris Goss;en
 the playlist introspective ;en
Play a song from 1950;en
Can you  me some eighties   Adele ;en
Play me some grunge music;en
Play a record from the year 1979;en
 some sad songs  the fifties ;en
Play Seasons In The Sun by Rosco Gordon on iheart;en
play a soundtrack by Sarah Geronimo on google music;en
 bebob on Iheart ;en
Play me some Badass Women on Groove Shark;en
Play my Hot 50 playlist.;en
  a  off the Curtis Lee  Rough Diamonds ;en
Play a 2013 song on Groove Shark;en
 1988 chant  on Itunes ;en
 Noctámbulo pl ;en
Play Oj, Jelena, Jelena, Jabuka Zelena by Ler Lalonde.;en
 Piano Ballads  Netflix ;en
Play the top five melody from 2000;en
play southern rock tunes;en
 robert fripp sound track  Pandora ;en
 my entertaining playlist ;en
 some soul music ;en
 some  on Itunes ;en
 a theme  1985  Patrick Cowley ;en
Listen to music from 1975;en
Play the best ballad by The Rascals.;en
Open Vimeo and paly every song released in 1986;en
 me a tune  john clayton ;en
 my De Camino  ;en
Play Talking To The Universe on Itunes;en
Play music from Lastfm;en
play the album by Paul Barker playing the greatest from 1978;en
I want to hear the Live At Slane Castle album by Haifa Wehbe;en
I would  to hear   1993 ;en
play some popular bryan gregory songs;en
play some Classical music on Spotify;en
 a popular ballad  Amanda ;en
  the greatest track of 1966 ;en
play some fourties Andrew Lloyd Webber on Groove Shark;en
 sound track music  the twenties ;en
Open    Reggaeton 2017 y Baila! ;en
Play me a song from the twenties by Randy Bachman;en
 a melody  Adassa  the twenties ;en
 Chad I Ginsburg ;en
 a track  1959. ;en
 the  Little Robin Redbreast ;en
I want to hear  off Fist  Fight  Rushton Moreve   ;en
 music by Charlie Adams  1954 ;en
 the  of Tupac Shakur ;en
I want to hear a    Luciano ;en
 the  20   the fifties by John Bundrick. ;en
 a 1958 soundtrack  Rudolf Schenker  Netflix. ;en
I'm in the mood to listen to meditative music.;en
 sugar baby  frank beard ;en
 Wolves  Larry Gatlin ;en
Please play some music from the seventies movement;en
 me some  youtube ;en
I want to play music off Deezer;en
Can you  Deezer  2007? ;en
I want to hear Jimmy James from the thirties, play a song on Groove Shark.;en
 The Lamentation  Cloris ;en
play them by Guy-manuel De Homem-christo;en
Play music by Deenanath Mangeshkar;en
Play a top-five song by Pete Candoli.;en
 the   Shakti – The Believer. ;en
play Escapada;en
 March  The Soviet Tankmen  Gloria Gaither ;en
 Isaac Hayes on Pandora  love, sweat  beer  ;en
Play some 2011 chant music, new first, by Shaggy.;en
Play music from 2012 by Yossif Kobzon on last fm.;en
  a popular song  Koichi Domoto ;en
Play The Soft Parade.;en
 some twenties theme   Google Music. ;en
   the album Evolution Of A Man  Joey Ramone ;en
play some nineties music;en
 me some music  1999 ;en
Play music on groove shark;en
 a 2001 tune ;en
 the new music  Wilko Johnson ;en
Can you use Pandora to play a soundtrack from 1999 by David Sitek?;en
Play The View From The Afternoon by Malese Jow on Last Fm;en
 some Alte Kameraden  ;en
play songs from Youtube;en
Use Vimeo to play a Mark King record from 1993;en
Play some Geir Jenssen.;en
 something from 1981 ;en
Play The Fool On The Hill by Khwaja Ghulam Farid;en
Play eighties music by Kaira Kwong on Google Music;en
Play anything  from Hiromitsu Agatsuma off iHeart.;en
Play me a 2003 song by Charles Neidich;en
Open Vimeo and play music.;en
Start   nostalgic playlist. ;en
Play music off Itunes.;en
 some Joeri Basjmet. ;en
 a 1998 sound   Sam The Kid  Last Fm ;en
Play some bass music.;en
 music from 1964 ;en
Play blues on Vimeo;en
 some seventies  on Netflix. ;en
play twenties music off of my Itunes;en
 a 1969   beth nielsen chapman,  first. ;en
Play some chanson style music.;en
play Mohammed Abdu from top 20;en
 a tune  2000  Bronislau Kaper ;en
 the most popular   Elena Paparizou  youtube ;en
 my Pandora app ;en
 my Femme Fatale  on Vimeo ;en
 Signe Anderson chant  that  newest ;en
Play the best chant of 1975;en
I want to hear a top five ballad from 2002;en
 some alternative  on Vimeo ;en
listen to ballad songs from 1999;en
 music  1976 on Deezer ;en
 a native us   Last Fm ;en
  GOES THE 80s. ;en
On Itunes play the latest Anna Yesipova ep;en
Give   album  1972 to listen to. ;en
Play them the greatest music by Chris Frantz.;en
 the  10 by Sankha Chatterjee. ;en
play theme by Yanni on Vimeo;en
Play eighties music;en
Play soundtrack by Armand Van Helden;en
Play me the greatest Doctor Fink song on zvooq;en
Play the album Killer Instinkt;en
  by Keren Woodward ;en
Let me hear the Rave Tapes album from Yuki Koyanagi.;en
 music  the  Get Your Mind Right ;en
 Divine  Vinnie Roslin ;en
 Clay Aiken's The Bonny Hind   Shark. ;en
Listen to Power Gaming playlist;en
play Neutrons  by Seun Kuti;en
play the last song from the thirties by Airto Moreira;en
Play all music Alan released in 1997;en
 the best songs  2016 ;en
Open pandora and play the top five melody by Hanna Sjedokowa;en
Play top Rosanne Cash;en
 Chance Of A Lifetime  Zvooq ;en
Play Dawn Richard song White Summer;en
Play me some chant from the last half of the sixties;en
I want to hear Ready by Frankenstein Drag Queens From Planet 13;en
Play Praise The Lord And Pass The Ammunition.;en
 Netflix ballad  Mike Shinoda that  popular ;en
turn on Last Fm;en
Play the top of emil de cou;en
Play Magic Sam from the thirties;en
  a 1974 tune on Slacker ;en
Open Spotify   a song  the twenties  Richard Harvey ;en
use Netflix to play Michael White tune from 1955;en
Play some dance music.;en
 some Rui  Silva. ;en
 1993 theme music ;en
Play Pride Of The Prairie from Johnny Burke;en
 some music  the thirties. ;en
Play best fourties from david izquierdo on album;en
Play some latin music.;en
 Foundling  Jean Grae on Vimeo. ;en
 Fill Yourself With   Ray Manzarek ;en
I  to  to some  music. ;en
 the top-ten chant Doda   the twenties. ;en
 the album Making   Night  Cevin Key ;en
play my De Camino playlist;en
Play Rain by Subliminal on Groove Shark;en
Play Pacific Ocean Blues by John Doe on Lastfm;en
Open Groove Shark and play sound track from Dj Cameo;en
  hear the  album  the artist, Skin. ;en
Play music by Young Steff;en
I want  hear some  Roches ;en
 Zvooq latest track  Peter Appleyard ;en
 the  1991 sound track ;en
Play Lukasz Gottwald album on Zvooq;en
Play some fourties music on Spotify.;en
Play some Retro music.;en
Play a ballad by Owen Pallett from the seventies on Slacker.;en
play Yusef Lateef songs from the fifties;en
play the greatest Vimeo tunes by angelo amorevoli on soundtrack;en
 a ballad form 2014  Double  Google  ;en
 something   Songs For You, Not Your Parents  ;en
 symphony   1991 by Irvin Mayfield ;en
Can you  some music  1999 ;en
Play me a Mario Vazquez movement;en
Use Netflix to   ;en
 the best chant  1975 ;en
I'd like to listen to Diana Vickers best tune from the twenties;en
Play Elitsa Todorova music;en
Play a top symphony sort form 1959 by Stuart Garrard.;en
Play some music on Vimeo;en
Play some Tony Grant.;en
 some Mike Burney  Google Music. ;en
 Yusef Lateef songs  the fifties ;en
 1977  track tunes ;en
 mere lapsed  Marilyn Moore. ;en
I want to hear Ding Dong Bell on groove shark;en
I'd like to hear music from 1951, preferably a soundtrack.;en
 a 2006 chant ;en
Open Netflix and play David Frizzell;en
Please use Itunes to play something from 1986;en
play Té Para Tres;en
Play some seventies songs from Luke Haines off of youtube;en
 Gary Chapman music  the fifties ;en
I want to hear Song For Adam;en
 1990 tunes  Groove Shark ;en
I want to hear   Frankenstein Drag Queens   13 ;en
play some Stephen Jones on Youtube;en
 me some folklore  ;en
Play top-twenty fourties movement music by Mohammad Reza Lotfi.;en
 1952 Yusef Lateef  Netflix ;en
 the greatest  by Phoebe Snow ;en
play ray davies on Iheart by only Hit It Again;en
 an album  1987. ;en
 any sixties song ;en
 songs  Cheryl Wheeler ;en
Play the greatest music by Phoebe Snow;en
Play some 50 Shades of Love;en
 my funtime  on lastfm . ;en
play Darude ;en
 That Would  Something  Eden Ahbez ;en
I want to hear something from the nineties by Alissa Musto on Groove Shark;en
play shara worden;en
 a track  Yui on Vimeo ;en
play a sound track by Vegard Sverre Tveitan;en
Please  This  The Day  Brian Robertson. ;en
play melody music from 1988;en
Play classic rock on Groove Shark;en
Play a song from 1973.;en
Play some James Cleveland.;en
 music  the year 1979 ;en
Play some chanson music;en
Open Deezer and play top 40 hits;en
Plkay some sixties  songs  Itunes ;en
 pandora tracks  Akhtar Sadmani ;en
play the last 1957 movement;en
Play some songs from the fifties;en
Please  a  by Rupam Islam ;en
play fourties tunes;en
Use the service  to  merengue  ;en
 an eighties song  Ler Lalonde ;en
 a  symphony  Perfecto De Castro  Lastfm ;en
I want to hear a   Ryohei Yamamoto   ;en
 dhafer youssef top-twenty  netflix ;en
 I Could Write A  ;en
Play me a Cinder Block movement;en
Play a fifties theme on lastfm ;en
Play Pledge by Markus Grosskopf;en
play a tune by Syreeta Wright from twenties from the top;en
 Wow  Jon Theodore ;en
Give me an album from 1972 to listen to.;en
 Ramakadha  Karl Davydov please ;en
play This Is Colour by Panda Bear;en
 The   Deezer  Vans Warped Tour Compilation 2003 ;en
 some Mark Tremonti  the thirties. ;en
Play some Iris Dement's theme based 2015 music on lastfm ;en
 the best album  the seventies ;en
Play sound track  music from the twenties;en
Play the most popular sound track from the 2006;en
 a music ballad  the sixties ;en
play fourties chant music on Last Fm;en
 Netflix tunes  2003 on  album ;en
play some Prabha Atre;en
 a top-10 ballad  1995 ;en
I want to hear   Madeleine Peyroux  1991  Youtube. ;en
  Martin Solveig on deezer ;en
  Robert Palmer sound track ;en
play Zvooq ;en
Play Step Up Your Game by Marc Cohn.;en
play Roy Orbison tunes now;en
 1966 theme  on Slacker. ;en
Play top 20 from frank farian;en
Play music by Keren Woodward;en
 a  tune  Sugar Minott on Netflix ;en
Play the track R U Professional by Roberto Carlos Braga;en
Please   a popular track  1984. ;en
 Asia Nitollano  itunes ;en
Play Shinji Miyazaki's music on netflix;en
Play a ballad by Heath;en
PLay some fourties music from Erin Harkes;en
 Joshua Homme Belle  Sebastian Write About  ;en
Play me Leonid Soybelman on Vimeo.;en
I want to hear Techno-industrial music.;en
Play some techno on Lastfm;en
Use Spotify to  me  ;en
Play music on the playlist Electronic Gaming;en
 songs by Wise ;en
 a  off Get Up Offa  Thing  Doseone  Last Fm ;en
 Safe Rock  Roll Sucks  Lastfm ;en
 a  50 tune  the twenties  Willi Williams ;en
Play me a song from 2008;en
play 1981 tunes by Jiles Perry Richardson on Lastfm for theme music;en
Please play a movement by Rupam Islam;en
 melody  sort the newest  Dj Format ;en
 new melody  Kenji Ito  Itunes. ;en
 some  music on vimeo ;en
Play playlist Chilled R&B;en
play the album Winner Takes All by Takuro with Last Fm;en
 top-50 Peter Frampton  ;en
 Dancing Through Life  Ronald Isley  spotify ;en
  by Deenanath Mangeshkar ;en
play Doctor Fink if i could choose;en
 the   Filipp Bedrossowitsch Kirkorow's theme ;en
  some Max Martin on Lastfm ;en
  Vlada Divljan  something he did that  good ;en
 Hanging Out  Relaxing ;en
 some songs  1958 ;en
Play me something Miles Davis did with a symphony;en
 Russell Morris's The Singer  The   Netflix. ;en
play chant music by David Cook;en
 music from 2011. ;en
 Matt Uelmen songs  1965  Slacker ;en
I want to hear the album Suites & Sweets;en
play Khujo eighties track song;en
 always  walter parazaider. ;en
Play a melody by Shada Hassoun;en
Play funtime activity;en
play Vanlose Stairway by Janove Ottesen;en
I want to hear a     Cottura. ;en
 some  music on Pandora ;en
Play instrumental pop;en
 the top-5 songs  Paddy Reilly  zvooq ;en
play fourties tunes by Bryan Webb on Groove Shark;en
I want to hear music off my Indie Festival playlist;en
play Zvooq;en
Please  a song  Everlast ;en
 Brian Clifton off  Shark. ;en
Let me listen to The Music Of Nature album by Paul Draper.;en
 Shinji Miyazaki's  on netflix ;en
 some Tony Grant. ;en
play a chant by Marina Verenikina;en
I want to hear the top Tim Madison;en
 music  2010 by Jason Donovan ;en
play falco on Zvooq for Good Hit;en
play some eighties by Amirbai Karnataki;en
 some  by Mutlu ;en
 me some grunge  ;en
"play Bill Evans album The Best Of The 12"" Mixes";en
 2006 chant music. ;en
Play my Top Gaming Tracks.;en
I want to hear  Mali's   the  ;en
 a  1952 symphony ;en
Play the album Vibrations by Marion Elise Raven;en
 the latest   Lobby Loyde on Netflix ;en
Play 2011 music ;en
 How Does  Work  Helen Carter. ;en
 a song  the thirties  Zvooq ;en
 some  theme music. ;en
  Cant Dels Ocells  vini lopez. ;en
play Clifford Brown All Stars by Michael Balzary;en
 music from 1958. ;en
Play a 1950 album on Iheart;en
Play Elysium from Ryan Cayabyab;en
 Lastfm pop tunes ;en
 pop  with Groove Shark ;en
I'd  to hear Ami Suzuki's   ;en
Play chant music by Big Dee Irwin.;en
list to the most popular Muireann Nic Amhlaoibh song;en
 some latin  Zvooq ;en
 Iheart tunes  Neil Finn ;en
 music  Gavin Koppell movement ;en
