expression;language
 a Martyn Bennett    Pandora ;en
Play me the greatest chant by Laurel Aitken on lastfm ;en
 Brotherhood  Ock Joo-hyun ;en
Play track Ai Se Eu Te Pego on google music from artist Maestro;en
I want to hear some     ;en
Play Oj, Jelena, Jelena, Jabuka Zelena by Ler Lalonde.;en
   2012  Yossif Kobzon  last fm. ;en
 twenties tunes ;en
 some jpop   Music. ;en
 some Eddie Vinson   ;en
Play music off the track Child Maurice;en
Play some showtunes music.;en
 the   Filipp Bedrossowitsch Kirkorow's  ;en
play some latin on Zvooq;en
 the    Nhat Son  Last Fm. ;en
play some Stephen Jones on Youtube;en
Play music from artist Ashley;en
Play the playlist Tropical Morning on Pandora;en
I want to hear a 1976 symphony by Jam Master Jay;en
 the seventies   last fm ;en
Play Kaori Mochida's most popular music on Google Music.;en
 Dansevise  Ebi  Groove Shark. ;en
Play Tad Kinchla soundtrack;en
 Fill Yourself    Ray Manzarek ;en
 Henrie Mutuku album   ;en
play 1981 music on Last Fm;en
 the  1981 sound   Ric Fierabracci ;en
 a 1958   Rudolf Schenker  Netflix. ;en
I want to hear Aki Nawaz, play the song fair annie.;en
Play music from the seventies for me. ;en
 some Classical   Spotify ;en
Play Chris Goss on Netflix;en
   album  1972 to listen to. ;en
Play iheart;en
Play music on Deezer.;en
Please  music  Itunes ;en
 some  Garside  Vimeo. ;en
 Martha  Dear  shannon. ;en
  The Realest Down  ;en
  Cabbage  Keiji Haino ;en
Play a song of I Myself And Me on Youtube;en
  on Netflix ;en
Play songs by Cheryl Wheeler;en
 the top-20   merz ;en
Play me a bluegrass song;en
  some seventies  with a  melody ;en
open Spotify and play a couple of celtic songs;en
 the   Série  Filmes O Hobbit   Alex Otaola ;en
 some  music. ;en
Play any nineties music;en
Play The New Retro playlist on Netflix.;en
play music from the twenties with Slacker;en
Play a popular melody by Lindsay Lohan on Youtube.;en
Open    Inyección Musical ;en
 a  off Ian Stuart Donaldson's  Nurture    ;en
Use Itunes to play artist Ringo Shiina track In Heaven;en
  Hype  on Youtube. ;en
 Google  tunes ;en
 some   the thirties. ;en
 a concerto  was    1958  mickey hart ;en
I need some Hardcore Hip Hop;en
Play some chant from 1974;en
Play One Good Reason by Tommy Flanagan on Itunes;en
Play the best Bruce Ruffin music on Youtube.;en
play Fereydoun Farrokhzad best track;en
open    Kenny Cox  popular concerto ;en
play a soundtrack by Sarah Geronimo on google music;en
Play me a Chris Needham song on Vimeo;en
  something  Davis did  a symphony ;en
 breed the killers   ;en
Play some eighties music.;en
Play bebob on Iheart;en
I want to hear the Jody Williams sound track;en
I want to hear the new Latin Pop Rising list;en
Play some Instrumental music on the service Lastfm;en
 you  a song  Ken ;en
Play anything from the top-50 Jeff Irwin record off of itunes;en
 a tune  1962 ;en
Please play a song by Ahmad Jamal;en
 the  Killer Instinkt ;en
   Amii Stewart with Itunes ;en
Can you  some   Youtube ;en
   Sings Rodgers  Hammerstein  elica todorova ;en
Play Elkie Brooks seventies sound track;en
Play me a Jill Scott sound track on deezer;en
   eighties song  Wes Dakus ;en
 some  Pearce. ;en
Play the latest ep from Lobby Loyde on Netflix;en
 a 1991   Anila Mirza ;en
 the  Tropical Morning  Pandora ;en
 something  the twenties ;en
Play music from 1958;en
play Dj Ozma top songs;en
 the  Lastfm to    the  ai kago ;en
Play Sergei Anatoljewitsch Kurjochin's music on Groove Shark.;en
Play me a song from Voices & Images;en
Play Deezer;en
play Latina;en
Use  to  dancing  ;en
Play Arif music from the fourties.;en
  by Duane Allman. ;en
Play the album Qr Iii by bobby bare;en
  off Itunes. ;en
Play mere lapsed by Marilyn Moore.;en
     the fourties, preferably a symphony? ;en
Play some Paul Stookey from the sixties;en
I want to hear music from the Lotus Flower album by Andy Mccoy;en
play something from the twenties on Lastfm;en
 1966 theme   Slacker. ;en
 Brian Clifton   Shark. ;en
 Murder The Mountains  Mana   ;en
Play me a symphony by Ricky Bell;en
Play some music on Slacker;en
play Neutrons  by Seun Kuti;en
 thirties concerto   Google  ;en
 Seaside  Don Cherry. ;en
  Jim Martin  Vimeo. ;en
  album mondovisione ;en
  a song  Kevin Cadogan ;en
 me some grunge  ;en
Play some music by Daniel Carter;en
 The Lamentation  Cloris ;en
Play the top melody from artist Maakii;en
 you  some Synthpop   Youtube ;en
play Barry Manilow from the twenties;en
 anything  Hiromitsu Agatsuma  iHeart. ;en
 me some Terror  ;en
play a ballad by Giorgio Moroder;en
   Pamela Jintana Racine ;en
play fourties tunes by Bryan Webb on Groove Shark;en
Play top-ten eighties song;en
play Peja tunes;en
Play my Masters of Metal playlist on Spotify;en
 some  tunes  Mike Mccready ;en
play The Edge by Deezer on Vans Warped Tour Compilation 2003;en
Play the most popular music from Nat Stuckey on Itunes.;en
Use Deezer service to play Opera ;en
  Aoyama's latest concerto ;en
Play movement by Duane Allman.;en
 1981 tunes  Jiles Perry Richardson  Lastfm    ;en
 Netflix tunes  2003   album ;en
play songs by Queen;en
have   songs  the fifties ;en
 Revival music. ;en
Play Metal Crash Course playlist.;en
 deezer  20  Natasja ;en
Open Vimeo   Lee Mellor   ;en
Play something by Daisy Voisin on google music;en
play 1990 tunes on Groove Shark;en
  Para Tres ;en
  a symphony  Ricky Bell ;en
 a twenties  ;en
Play music from the playlist Get Your Mind Right;en
Can you play something from the fourties, preferably a symphony?;en
play a popular sort of fifties tune music;en
   the  She   Through The Bathroom Window ;en
 some   on Pandora ;en
 music  Carina Round ;en
 Dj Ozma  songs ;en
play Angelo Amorevoli;en
 some   Mark Heard. ;en
 some  Jenssen. ;en
I want to hear the      ;en
play 1951 tunes;en
Play Dansevise by Ebi on Groove Shark.;en
 Ngola Ritmos top-ten  ;en
 the   Aphex Twin's  Album ;en
play Iheart;en
Play symphony music from Joe Dolce;en
I want to  to    ;en
play my tribute by Billy Cox;en
Play Halid 08 by video game pianist on Pandora;en
Play Robin Hood Rescuing Three Squires by Bhupinder Singh;en
Play a record from the year 1979;en
  Martin Solveig  deezer ;en
 music  Tommy Ridgley. ;en
 Dancing Through   Ronald Isley  spotify ;en
I want to hear    To    Tirtha. ;en
play track Her Majesty;en
Play me a song from Movies For The Blind on Pandora;en
Play Short Walk On A Long Pier on Slacker;en
 the  Shooting Silvio   Sabo ;en
  Pure Soul  netflix ;en
play 90s Love Songs on Youtube;en
   the balance  Nik Kershaw  Zvooq. ;en
Play some chanson music;en
play Deezer form 2010 tune by Dave Grohl;en
Can you play Deezer from 2007?;en
 some ivy anderson   1967 ;en
 a   sort by Akinyele. ;en
Can you play The Change Is Made on Netflix;en
 a symphonic   Pandora ;en
Play my playlist TGIF on itunes;en
 a 1983 concerto  Ayaka   ;en
Open    the best songs  Device ;en
 some   on Zvooq ;en
   the genre soundtrack ;en
 some 1999   Minami Takahashi ;en
Play the top chant music from 2014.;en
 you  that last   the twenties ;en
   Clark Kent  the year 1987 ;en
 the top-twenty   Braginsky. ;en
 Tooh  Eric Bazilian   Music. ;en
play a 1977 record by Bitty Mclean on Google Music;en
 Ik Hou  Jou   Temnikova ;en
 Oliver  pandora. ;en
Play something from the jonathon lee movement;en
Play That Stubborn Kinda Fellow by Michael Amott;en
Use Groove Shark to play music from the nineties;en
 a new   1976. ;en
 Dave Mason's   Last Fm. ;en
 some  music. ;en
 you  some Andrew Cash   Slacker ;en
 the  symphony   Ejigayehu Shibabaw ;en
I want to hear the Fear The Boom And Bust song from haruka shimotsuki off of Spotify;en
I want to hear Rock Bottom by Playa Fly on Slacker;en
 some Kyle Ward  the  ;en
I want to hear    zeebra  the    ;en
play a tune from 1973;en
play music by Billy Powell;en
Play music by Sha Money Xl sort by good.;en
  a song  Everlast ;en
   the punk genre  Last Fm. ;en
 i believe  Chico Buarque   iheart ;en
  by Bryan Maclean ;en
 fifties track  ;en
  by Otis Redding. ;en
 some twenties chant   Slacker ;en
 something off  New Boots  ;en
  a 1974 tune  Slacker ;en
play The Song Remains The Same with Pandora;en
play an Masaki Aiba tune;en
 paul ortiz   1990 ;en
play a 1983 concerto by Ayaka on Itunes;en
Play a Jack Lawrence concerto;en
Can you play the greatest sarah brightman song;en
Play Lukasz Gottwald album on Zvooq;en
Play the best song by Henry Rollins.;en
play a Karin Dreijer Andersson soundtrack on Groove Shark;en
 the    Claudja Barry  Last Fm ;en
play music from 1981;en
I want to hear  Mali's     ;en
Can you   some britpop  ;en
  Heavy Bluesy ;en
 Eddie Meduza  the  ;en
  Hardstyle, Baby  on Netflix ;en
play fifties track music;en
Play March Of The Soviet Tankmen from Gloria Gaither;en
Play Johnny Gimble;en
Play me a fifties song by Chingy;en
Play some psychadelic music.;en
 a   Margaret Kelly  Iheart ;en
 a 2007   Adam Jones ;en
  Femme Fatale  on Vimeo ;en
 chant  the   Last Fm ;en
 fourties tunes ;en
Play the greatest record by Leroi Moore;en
  Her Majesty ;en
Play best fourties from david izquierdo on album;en
  I Ginsburg ;en
  a  off the Curtis   Rough Diamonds ;en
Play Chad I Ginsburg;en
 something  the twenties  Lastfm ;en
 Spotify ;en
 some seventies  Colette ;en
  on groove shark ;en
I want to hear Richard Falomir's best song on Pandora;en
Play music on youtube;en
I want to listen to  Spain  50     ;en
 fifties music ;en
Play music from the twenties.;en
Play Tooh by Eric Bazilian on Google Music.;en
Play the playlist introspective;en
Play the Late Night Jazz soundtrack on Zvooq.;en
Play some fun-punk;en
Play Tujiko Noriko's Ten Years And Running.;en
 some   the thirties ;en
  by Janet Paschal ;en
Let's hear some    thirties. ;en
  100  Tracks  Spotify  Lastfm ;en
  Leonid Soybelman  Vimeo. ;en
I want to listen to my Spain Top 50 playlist on groove shark;en
  a seventies song ;en
 Grabsteinland I   Fink  slacker radio ;en
I want to hear popular music from Martin Lopez;en
Play some Last Fm music like the 1992 ep from Peaches;en
play the greatest Vimeo tunes by angelo amorevoli on soundtrack;en
Please play the newest music by Evil Jared Hasselhoff;en
 some  music. ;en
Play the top track by Claudja Barry on Last Fm;en
 Richard Thompson  the thirties   ;en
play some nineties music;en
 the  Grime Shutdown ;en
Open Vimeo and paly every song released in 1986;en
Let me hear an ep from the thirties era of music.;en
  the   Liked The Roses ;en
  a concerto  Jethro Burns  Zvooq ;en
 some  on Vimeo ;en
use netflix to play Bizzy Bone Kiss Me Goodnight, Sergeant Major;en
Play Alfredo Zitarrosa on spotify.;en
play the album a kiss before you go by Bt;en
Play theme music from the twenties by Tata Young;en
 some  Music. ;en
 the service  to  merengue  ;en
  by Don Cherry. ;en
 you   something  the eighties  Youtube ;en
  a Jill Scott sound   deezer ;en
Play the track That Would Be Something from Eden Ahbez;en
Play some steve boyett chant music;en
Play a record from 1950.;en
 the  Hands Up ;en
Play some movement music by Perez Prado on Iheart;en
play Yo Ho from the new york pops on Youtube;en
 a Morton Downey record   ;en
I want to hear  Harris's     ;en
play Bra Vibrationer by Dean;en
Play Ik Hou Van Jou by Elena Temnikova;en
 a   Ishmon Bracey  Iheart. ;en
Play me a 1957 ep;en
Play a ballad by Owen Pallett from the seventies on Slacker.;en
 Deezer ;en
 some dance  ;en
 Noctámbulo playlist ;en
play me a Mel Draisey tune from the fourties with vimeo ;en
 Party Ben  Slacker ;en
play Shake Your Head;en
I'd like to hear Infinite Indie Folk on Slacker. ;en
Play Alone, Again from Mike Viola;en
 To  Still ;en
I'd like to hear Don Airey's Gonna Raise Hell;en
   the  Late Night Jazz ;en
Play fifties from Sirusho Harutyunyan;en
 Portsmouth   Smith  Google Music. ;en
  Boy  Melody Gardot ;en
Play the greatest Nicholaus Arson concerto from around 2000;en
    a voluntad del cielo  Wax ;en
   Riches  Pan Mei Chen. ;en
Please play Casino Boogie;en
   Armand Van Helden ;en
I  to hear the   Fowler  ;en
Play fifties music on Slacker.;en
I want to hear     Lopez ;en
 you  a sonata ;en
I'd  to  the  ten Mickdeth  Google  ;en
 bebob  Iheart ;en
Play my Acoustic Covers playlist on Spotify.;en
Play the greatest record by Joe Purdy on Google Music;en
play the last Niney The Observer song;en
 some Krzysztof Penderecki   Fm ;en
Play sixties theme music;en
Play something by Brian Chase.;en
I want to hear Somi's     ;en
Play Goa music on Google Music.;en
  Garage  Revival playlist. ;en
 a 1974 sound   Vimeo. ;en
I want to hear a     1984   ;en
  The Way  Savior Leads   Spotify ;en
Play a song from the seventies by Pepe Aguilar;en
play Netflix ballad by Mike Shinoda that is popular;en
  Every Dream  A Heartache  vincent  abbott ;en
play steve harris False Gestures For A Devious Public album;en
 a  fifty ballad  Linda Strawberry  Google  ;en
Plpay my Disco Fever playlist.;en
 the  popular   Nat Stuckey  Itunes. ;en
play some 1991 Dave Barker;en
Play music from 2012 on google music;en
I want to hear music on Itunes;en
 some   Roberto Carlos ;en
 a Karin Dreijer Andersson    Shark ;en
 some   Frayser Boy. ;en
Play the newest stuff by blowfly;en
Play Taiwan Is Good by Kotoko.;en
   a chant  Butch Trucks  Spotify ;en
 Salmonella Dub Dvd  mario rubalcaba   ;en
 Maggot   Albano Carrisi ;en
 Morning Song ;en
 the  Wayning   Rabbit Brown ;en
Play the top hits of 2016;en
 I hear a    Hodges? ;en
 Turbulence  Streetdanz  Jeff Buckley ;en
play Safe Rock And Roll Sucks on Lastfm;en
Play some music by beverley martyn;en
 the  twenties melody. ;en
 the  1991 sound  ;en
 them  Guy-manuel  Homem-christo ;en
  a track  Steve Souza ;en
Play the music of Aphex Twin's good Album;en
 you  the  record  1966  Tony Lee ;en
 Solange 2016  ;en
Play my Hardstyle, Baby playlist on Netflix;en
Can you   some eighties   Adele ;en
Please play Jim Martin on Vimeo.;en
play primus ;en
 Rap Album   Gene Vincent. ;en
play Jawad Ahmad;en
  Different Slanguages  Fred Labour. ;en
I wanna hear     Eddie Vinson ;en
Play some The Lady Is A Tramp from Timour Moutsouraev;en
 shara worden ;en
 iheart   Té Para Tres ;en
Play me the best Charles Neidich song;en
Use Deezer to   ;en
 the   Sergei Chatschatrjan ;en
Play Rei Momo newest album;en
I'd  to  to Space  ;en
play a 1988 soundtrack;en
Play a top 5 song from Wally Bastian on Google Music;en
Play Murder The Mountains by Mana on Netflix;en
Can you play some music on Youtube;en
play Angela Winbush ep that is popular;en
Play some seventies music by Janne Puurtinen on Youtube.;en
 some  music. ;en
Play music from 1976 on Deezer;en
I'd  to hear the     Ford. ;en
play a track by Alpha Blondy with Deezer;en
  a Maia Hirasawa   1951 ;en
 Elastic   Junior Marvin ;en
 a sixties   Classified ;en
 you   the latest theme   Warren Vache ;en
I want to hear the      ;en
Play The View From The Afternoon by Malese Jow on Last Fm;en
  Your Eyes  gareth gates  Netflix ;en
Play easy listening;en
Play some Iris Dement's theme based 2015 music on lastfm ;en
Play That Would Be Something by Eden Ahbez;en
Play the sound track by Ferry Corsten;en
Play some Mark Tremonti from the thirties.;en
 some Industrial   Lastfm ;en
 Neutrons  Seun Kuti ;en
 Rei Momo  album ;en
play southern rock tunes;en
 the  Pressure Cracks  Netflix ;en
Please play Jag Vill Leva I Europa by porta;en
Play music from Hide;en
I   to hear a    Reynolds ;en
 music  negerpunk ;en
play the last Chris Douglas on Slacker;en
 newest soundtrack  2008 ;en
   the latest Anna Yesipova  ;en
Play Mea Culpa by Rahim Shah;en
Play some music on groove shark.;en
I would like to hear music from 1993;en
Play some movement from 1959 on deezer.;en
I want to hear    Playa Fly   ;en
 songs  Itunes ;en
    Reggaeton 2017 y Baila! ;en
 Wynton Kelly   Netflix sort  popular ;en
Play POP GOES THE 80s.;en
Can I hear a Da Brat ep?;en
 blues  Vimeo ;en
play Victoria Banks's album;en
Play some acapella music ;en
play caitlin cary from the fourties;en
Let me hear the Live From The Ghetto album by Beau Jocque.;en
Play music from the list Indie Electronics;en
 Contigo En  Distancia ;en
 music  1981 ;en
 some King Tubby  the  ;en
 a sound   1952. ;en
Play The Monkeys Have No Tails In Zamboanga on Google Music.;en
 music  the twenties. ;en
 a   The    & The Banshees  Faustino Oramas ;en
Play fifties music;en
Play the tune by Adam Yauch;en
I want to hear      deezer. ;en
 the most popular  Jones  ;en
Play a 1964 symphony on Netflix.;en
I want to hear some   Gilmour's    ;en
Play a theme from Walerij Leontjew;en
Play me a 1986 Jim Root;en
play Richard Thompson from the thirties song book;en
 top-twenty    by Mohammad Reza Lotfi. ;en
 some fifties   Chris Brown. ;en
 caitlin cary  the  ;en
use Netflix to play Michael White tune from 1955;en
use  to    Junior Brown ;en
Want to hear a    Mckay  the   ;en
 a    Anna Nikolajewna Jessipowa ;en
play Joshua Homme Belle And Sebastian Write About Love;en
 some  Rock. ;en
 Safe   Roll Sucks  Lastfm ;en
Please play a song from the thirties by Peter Murphy on Last Fm;en
 you  a sound   1963? ;en
 some Matthew Sweet    1996  Spotify ;en
Play my Trapeo playlist.;en
Play the most popular music by Ronald Isley on Google Music;en
play Fernando Olvera;en
Play The Eternal by Juju Mob on Vimeo.;en
 some   1993 on Itunes. ;en
 the  song  Jack Grisham ;en
 a  symphony  the fourties ;en
Play some James Cleveland.;en
  a Mel Draisey   the  with vimeo ;en
play some Annie Herring beat street on itunes;en
Play a sound track from 1952.;en
 Slacker tunes  Smog   in 2015 ;en
Let's  the  Handover  Deezer ;en
 fourties record ;en
Play Elysium from Ryan Cayabyab;en
Play tune from Sonny Stitt;en
Use the service Zvooq to play merengue music;en
I want to hear some Bill Black chant music;en
Play the top-twenty from Tony Calder off Slacker.;en
 a chant  1978. ;en
play songs by Gamble Rogers;en
I want ohear the 1996 soundtrack from deezer;en
Wish to hear   the   ;en
 the  popular   Elena Paparizou  youtube ;en
    songs  the Estado de ánimo playlist? ;en
 Fey's album Diamond Head   ;en
 the  fifty   Alan Jardine ;en
 Kk  Zvooq. ;en
 music  the seventies ;en
  Kaye music. ;en
I want to hear This Is The Night from Proof;en
 some P. J.  ;en
play By The Sleepy Lagoon by Greg Kurstin;en
Plpay   Fever playlist. ;en
I'd like to hear Nas's greatest ballad;en
Play some Retro music.;en
Please play me some Satire music;en
I want to listen to seventies music.;en
turn on Last Fm to listen to Chara ballad from 1988;en
 the    Bellamy contributed to ;en
 a sixties   George Sanger ;en
Play the Ricky Wilson album Spectral Dusk;en
 me songs  1955 ;en
I want to hear   5    ;en
 the   chant by Wise. ;en
Play 25 To Life by Paul Riley on Deezer.;en
 a seventies   ballad ;en
 me a song  the   ;en
Play the song Victim Of Changes from Hawkshaw Hawkins on Spotify;en
 a   Hagigat Rzayeva ;en
 the  Lastfm to   keren peles  the   symphony ;en
Play Saturday Nights & Sunday Mornings;en
play the top song from Damon Albarn using Slacker;en
 Fais Les Backs  Sarah Geronimo   ;en
Can you play a 1967 soundtrack on Slacker;en
Play the music genre Synthpop;en
Play the best 1981 sound track from Ric Fierabracci;en
 some chant   2008. ;en
 Iheart ;en
  on Spotify. ;en
 Latina ;en
 the last   1999 ;en
  Masters of Metal   Spotify ;en
play Zvooq latest track by Peter Appleyard;en
I wish to hear the playlist Estado de ánimo on Last Fm.;en
Play a Loretta Lynn tune on Groove Shark;en
Start playing my Disney playlist.;en
 some Rachel Stevens off   ;en
Play music on my Itunes;en
play Addicted To You by Hank Ballard;en
 Netflix have  released  1991   Yokoyama ;en
Play the song I Get Ideas as performed by Richard Kruspe;en
 some David Mallett   fm ;en
play Courting The Squall on Slacker;en
Wish to hear a concerto by Diplo from 1952;en
 industrial music. ;en
Play a song by Tim Finn on Last Fm;en
 thirties  Lastfm ;en
 I hear tod    1953? ;en
 Roy Orbison tunes  ;en
 a song  2013. ;en
play Netflix tunes from 2003 on an album;en
I want to hear the new movement from Richard Harvey;en
 some  Porcaro ;en
play the top twenty tracks of Ron Jarzombek;en
 the track Siberian Khatru   ;en
play Hardcore music;en
  This  World?  Leo Arnaud ;en
Play Funky Heavy Bluesy;en
Play new movement from Mike Oldfield on Vimeo;en
I want to hear   the top-fifty    ;en
Play a symphony from the thirties.;en
 you  a 1967   Slacker ;en
Play Furusato on Google Music.;en
Play ballad from Mandy Moore;en
I want to hear Papa Mali's songs from the fifties;en
 a song  the thirties   ;en
Play a song from 2013.;en
 Jawad Ahmad ;en
Play Hættuleg Hljómsveit & Glæpakvendið Stella by Kaori Iida;en
Play a track from 1985.;en
Play some folk-rock music;en
Please play some music from the seventies movement;en
I want    a    Moutsouraev. ;en
play a track by Mila Islam from Deezer;en
I want to hear a       sixties. ;en
 pandora ;en
 to Vertexguy  ;en
 Kool Keith  Thee Undatakerz   Mccrea. ;en
 the top-5 sort  ballad   2012. ;en
 Ramakadha  Karl Davydov  ;en
 some  Burney  Google Music. ;en
I want to hear    ;en
 anything  the twenties ;en
Play the heinz strobl ep from 2016 on Groove Shark;en
Let me hear the top album by the artist, Skin.;en
 the  popular   Chae Yeon off  Spotify ;en
  Piano Ballads playlist. ;en
play some good amber gristak on Lastfm;en
Play a ballad by Heath;en
play the newest by Exuma;en
 some Ray Williams   the   spotify ;en
 the   Grace Slick    a symphony sound ;en
 top-ten eighties  ;en
  melody  Kenji Ito  Itunes. ;en
 some seventies   Janne Puurtinen  Youtube. ;en
I want to hear the newest music from The Railway Children;en
Use service Vimeo to play music from the artist Mick track Now We Are 5;en
 a    Benjamin Darvill  Groove Shark ;en
Play some 2011 music by Dan Healy.;en
 a Jack Lawrence  ;en
 some Mf Doom  the   pandora. ;en
Play any song from 2006;en
 gothic music ;en
Please play a song for me from 1959;en
Play Russell Morris's The Singer And The Song on Netflix.;en
 the  1973   Peter Derose. ;en
 the greatest Nicholaus Arson    2000 ;en
Play movement music from Sheryfa Luna;en
Play Contigo En La Distancia;en
Use Netflix to play In The Arms Of A Woman playlist;en
   Itunes for Ric Grech ;en
 top-twenty song  2015 ;en
Play me songs from agreable;en
 Rocket Queen  Itunes ;en
play songs from the sixties;en
Play music on Groove Shark.;en
Play some music from the sixties;en
Lets hear some Dawood Sarkhosh from their The Power Of Your Love album from Groove Shark;en
 some grunge ;en
play chant music from 1993;en
Play The Wizard And I on Zvooq;en
 Songs  Heaven  ami koshimizu ;en
 some   Daniel Carter ;en
Open Spotify and play a song from the twenties by Richard Harvey;en
  Robert Palmer sound  ;en
Play me the most popular Peja song on Slacker;en
  on Itunes. ;en
Can you play me songs from the Estado de ánimo playlist?;en
 slow rock   Vimeo ;en
play Phil Spalding soundtrack from the seventies;en
Play that new song from 1970;en
 the last   the sixties ;en
I want    some  ;en
  88 Keys playlist. ;en
 a  symphony  Perfecto  Castro  Lastfm ;en
play music from the sixties;en
   jeremy   the  Dormi Amore,  Situazione Non È Buona    ;en
play 1988 chant music on Itunes;en
Play Goldie Hill's record on Google Music.;en
 Slow Rock  Lastfm. ;en
play David Banner on Netflix;en
  something  Last Fm ;en
Open Youtube and play Nanana from Massimo Altomare;en
Play the top-20 best Chicane songs on Deezer;en
Play me some Badass Women on Groove Shark;en
Use Groove Shark to play the Today And Tomorrow album;en
Can you play a song from the newest movement by prince on Lastfm;en
 the  Bruce Ruffin   Youtube. ;en
Play a ballad form 2014 by Double on Google Music;en
Play a chant by Mj Cole;en
 Phil Spalding   the seventies ;en
Play music from 2002;en
Play The Soft Parade.;en
Use  to    Maki Onaga  the  made  the  ;en
Play 2012 symphony music by Nardwuar The Human Serviette on Netflix.;en
play the top five songs by Isaac Hayes;en
play Spotify;en
Can you    2003  Netflix ;en
I want to hear something eclectic;en
  the  King Curtis   Google Music. ;en
 the  5   The Don. ;en
play a symphony that is good from 2000;en
play laura love songs from 1959;en
Play the 1951 ballad;en
   the year 1964 ;en
Want to play Christina Schollin Lastfm;en
 2011 music ;en
Play a sound track by Pee Wee Russell on Zvooq.;en
I want to hear the album Insult To Injury by Narayana Tirtha.;en
Play Tina Cousins from 1956;en
Play the red room sessions from chris cunningham;en
Can you play some music from 1999;en
Play Crossroad Blues.;en
Play a cohesive playlist for me;en
 some Origa  Google  ;en
 Sivamani ;en
Can you  some   1999 ;en
 the  chant music  2014. ;en
 the   stuff  Tina Dico ;en
play ambient music;en
turn on Last Fm;en
I want to hear some music from Spotify;en
 mere lapsed   Moore. ;en
Play some indie music on spotify.;en
Can you play something off Johan Larsson's Travelers And Thieves;en
Play the Mister Music Man by Gene De Paul.;en
I need to hear a thirties soundtrack;en
 some 1982   on Slacker ;en
Play the last theme by Behzad Mirkhani.;en
 genre opera ;en
I want to listen to Merrily We Roll Along by Marko Desantis.;en
Use  to  the    Lee Dorrian ;en
Play Tanti Auguri A Te from Bruce Gilbert;en
Play me Benjamin Kowalewicz's top hits;en
  on Last Fm ;en
Play 1966 theme music on Slacker.;en
 Someday Soon  fiona ;en
Please  Short  Sweet  Teyana Taylor   itunes. ;en
