expression;language
 a   top-20 1983  Baruch Chait ;en
play Frankie Laine;en
Play some Dave Pearce.;en
 a song  2003 ;en
  2009  Desmond Dekker ;en
I want to hear some      ;en
Play top-five concerto music from 1992;en
Play some 1982 movement music on Slacker;en
Play twenties from Ken Floyd;en
 andrew lloyd webber's    zvooq. ;en
I'd like to listen to Tom Cochrane's 1990 ep on Zvooq.;en
 i   to listen to Twilight    Khalil? ;en
 the  Elizaveta Khripounova ;en
   Arjen Anthony Lucassen ;en
 teri meri  Josh  ;en
   a melody  the fifties  Last Fm? ;en
Play Pride Of The Prairie from Johnny Burke;en
 the   Adam Yauch ;en
Open    Bad Attitude ;en
Open Netflix   a   the  heartful ;en
  on netflix ;en
Can I hear a symphony from the seventies on Youtube?;en
Play some Sabah from the eighties;en
I'd  to  to  Cochrane's 1990   Zvooq. ;en
 Rob   The Golden Archipelago. ;en
Can I hear Anna Vissi's new music on Pandora?;en
Play Turbulence Wild Streetdanz from Jeff Buckley;en
 some   tunes  the  Olga Souza ;en
  Asha Bhosle   around 1964 ;en
 some theme songs  the  ;en
Play a 2011 ballad by Evil Jared Hasselhoff on Lastfm.;en
 Angelo Amorevoli ;en
Play Water Under The Bridge by Hariprasad Chaurasia.;en
play music by Vybz Kartel;en
Play 1958 music on Iheart;en
  a bluegrass song ;en
Play a 1964 track from Shahram Nazeri on Pandora.;en
Play some Game music.;en
 a  sound   Sam The Kid   Fm ;en
I want to hear   the   Alissa Musto    ;en
Play me a track by Steve Souza;en
Play a song from 1973.;en
Play the top symphony music from Ejigayehu Shibabaw;en
Use Deezer to play music by Kimberley Walsh;en
 chant   Ira Losco  Iheart. ;en
 Techno  Lastfm ;en
 the  Cara  Dios. ;en
Play music from Gavin Koppell movement;en
Use Itunes to play a soundtrack from the year 1954;en
Play some tune from 2011 on Youtube;en
 the  movement music  1997. ;en
  a Felix Kubin  No Light   ;en
 Matt Uelmen   1965  Slacker ;en
Play the top ten by Andrea Del Rosario.;en
play a tune from 1962;en
Can you play a chant by Butch Trucks on Spotify;en
Please  Every Woman   ;en
  a 2015 soundtrack  Netflix ;en
 some Antony Harding   the  ;en
play In The Arms Of God on Zvooq by Nimal Mendis;en
Play music on Spotify.;en
  spotify Ms Scandalous ;en
Play andrew lloyd webber's good tune on zvooq.;en
 them the    Chris Frantz. ;en
play Hora Din Moldova by Yamazaki Maso;en
  a 1990 sound  ;en
Play Stereo by Jonathan Davis on Deezer.;en
I want to hear     ;en
 you  a song  the newest   prince  Lastfm ;en
play the newest sound track from the thirties;en
Play music from 2015;en
Play Strength of Street Knowledge on Groove Shark;en
play Tonight Only! by Nastya Kamenskih;en
play All Of Your Toys by Chris Ledoux;en
 the   Cemil Bey songs ;en
Open  shark   Jason Mizell ;en
play music from Itunes for Ric Grech;en
  off Netflix. ;en
 the  Drifting  A Reed   G ;en
I want to  to   The    ;en
 the last   Shavo Odadjian ;en
Can you play a song off the album, jungle;en
  Futuros Hits  on Spotify. ;en
play chant by Prurient;en
Play some latin music.;en
 some space   Google  ;en
 some  music. ;en
Play some acapella music on Iheart;en
Play some sixties music by gaudi on last fm;en
Please play a song off the Curtis Lee album Rough Diamonds;en
Play anything  from Hiromitsu Agatsuma off iHeart.;en
 Wow  Jon Theodore ;en
 the Ocelot record   ;en
Play some sixties music.;en
Play me something Miles Davis did with a symphony;en
play Yusef Lateef songs from the fifties;en
Can I listen to Dj Vibe's top 10?;en
  Southern Gothic ;en
  by Young Steff ;en
Play a song by Electric Tones from their Kurutta Taiyō album on Last Fm;en
 Johnny Gimble ;en
Sort    the last ;en
Play me the most popular Arthur Johnston song;en
 a   Elmer Bernstein ;en
Play most popular from Nil Burak on Slacker;en
 a top-50   1982. ;en
Play music from 1964;en
Play some Hong Junyang.;en
 some   on spotify. ;en
 Oliver Cheatham's   the thirties. ;en
I want to the latest ballad from Ira Losco;en
Open    a   the twenties  Richard Harvey ;en
play shara worden;en
Play some ivy anderson from around 1967;en
  album  the fourties,  first. ;en
  Night Rider list ;en
  Stubborn Kinda Fellow   Amott ;en
  track September, Gouden Roos   daedelus ;en
 the latest   Larry Gatlin  Iheart ;en
Play some twenties theme music on Google Music.;en
 ballad   Jeff Lynne. ;en
Play me a Xuefei Yang symphony on Groove Shark;en
I'd like to hear one of Eric Clapton's most popular melody on Pandora.;en
Play some fast fusion on Spotify;en
  Hier Encore  greydon square ;en
 a 1994   Lena Horne ;en
Play the newest ballad from Chad Urmston;en
Play a song by Alasdair Roberts from 1996;en
 any  music ;en
 Who   Think    Magnifico with spotify ;en
play the top song by Amon Amarth on Groove Shark;en
Please play Different Slanguages by Fred Labour.;en
Play me some Goa;en
Play fifties music by Ahmed Abdul Malik;en
Play Randy Castillo's music from 1952.;en
 On  Own ;en
Play the latest songs by Larry Gatlin on Iheart;en
Can you play a sound track by Sissieretta Jones;en
Play me a song by Carol Arnauld from 2003;en
Play a twenties tune by Jodie Aysha.;en
Play prints in the stone by Helen Baylor;en
Play The God That Failed on Vimeo.;en
 Elkie Brooks  sound  ;en
Play Lenny Kaye music.;en
I     some  music. ;en
play robert fripp sound track on Pandora;en
 you pull up a     Graham Mcpherson ;en
I want to hear the Live At Slane Castle album by Haifa Wehbe;en
 90s Love   Youtube ;en
Play the track Grow Old With Me by artist Chloe Rose Lattanzi;en
Plan    Roni Duani. ;en
 a top-ten   Kelly Groucutt  1964 ;en
 Tina Cousins  1956 ;en
 I hear Jeremy Taggart's    Deezer? ;en
Play a melody by Adassa from the twenties;en
 some  music. ;en
  20  frank farian ;en
  something  Last Fm ;en
play valerij kipelov on Vimeo;en
 Tanti Auguri A    Gilbert ;en
 a fairouz tune   ;en
Want to hear a chant by Nellie Mckay from the year 2008;en
 the new   Wilko Johnson ;en
Play Rap Album One by Gene Vincent.;en
 movement music  1954 ;en
 Suite Sudarmoricaine  Afi  itunes ;en
Play a track from 1959.;en
play good Classified songs on Vimeo;en
Play Punk Essentials on google music;en
 you  Halloween  Ajinoam Nini ;en
  Stubborn Kinda Fellow   Amott ;en
I  to hear the    ánimo   Fm. ;en
   the greatest songs  Mauro Picotto ;en
Play While The Gate Is Open.;en
play Seven Steps To Heaven by Wikluh Sky;en
I  to hear some r&b     ;en
 the  sort  1992 theme   Layzie Bone ;en
Play a sound track by Mac Dre.;en
I want to hear Somi's songs from the twenties;en
Play me a 1990 sound track;en
Open groove shark and play Jason Mizell;en
Play Liubi, Liubi, I Love You by Farah Asyikin Binti Zulkifli on Netflix;en
Play a soundtrack by musical artist Jimmy James;en
 some  Anofriyev  1960. ;en
 the  R U    Carlos Braga ;en
Play Techno on Lastfm;en
Play some dance music;en
 a  theme  lastfm ;en
I want to hear Sarban's greatest hits;en
  Knows  The  Goes?  Grigory Leps ;en
play 1962 music on Netflix;en
 Nick Hexum latest  ;en
Play track music from Peter Finestone on Netflix sort by newest;en
Let's listen to the most popular Marty Friedman songs on Zvooq.;en
  a popular Ronnie Wood  ;en
Play any chant from 1973;en
  a song  1968  Spotify ;en
I want to hear Steven Harwell from the thirties;en
Play Brotherhood by Ock Joo-hyun;en
Play Inventions For The New Season;en
I want to hear    the thirties,  a    Shark. ;en
Open up Lastfm and play some songs.;en
play songs by Wise;en
Play 1993 theme music;en
Open    Renaldo Lapuz record  the  ;en
 the   Tetsuya Ogawa  1953 ;en
Play the best Vanessa Peters songs;en
I want to  to    ;en
play the Ocelot record using Zvooq;en
 some rock   Youtube ;en
Play The Garden Of Allah  from Wade Mainer;en
  songs  Lil Jon ;en
 eighties   Groove Shark. ;en
play playlist The Realest Down South;en
Play Rocket Queen on Itunes;en
Play symphony music from 1991 by Irvin Mayfield;en
Play some Don Ho on Netflix;en
Play music off Youtube.;en
Play me a Maia Hirasawa soundtrack from 1951;en
 the  Making   Night  Cevin Key ;en
Play a new song from 1976.;en
 the  popular   Valery Alexandrovich Kipelov ;en
Play some Krzysztof Penderecki on Last Fm;en
 the   1956 record. ;en
play the album How Insensitive;en
Play Rain by Subliminal on Groove Shark;en
play twenties tunes;en
 Humour ;en
 my Frescura Indie  ;en
Play me songs from 1955;en
 some  punk. ;en
 the 2014   la lupe ;en
  Shark folk-rock ;en
 fifties   Ahmed Abdul Malik ;en
   Nick La Rocca ;en
Play a music theme by Anna Nikolajewna Jessipowa;en
 1970 trunes ;en
Play Revival music.;en
Play some melody from the eighties on Spotify;en
Play an Alla Pougatcheva ballad on Pandora;en
 the  songs  2016 ;en
Play nineties;en
Play me a song by Kevin Cadogan;en
Play the best Sebastian Karlsson melody on Youtube;en
 Dj Scratch's eighties   Iheart. ;en
Play music on groove shark;en
Play the top twenty chant by Wise.;en
play some tango on iheart;en
 me some folklore  ;en
 the greatest   Phoebe Snow ;en
listen to    the twenties ;en
play a ballad by Chick Corea;en
Play a native us song on Last Fm;en
I'd  to hear  Suzuki's   ;en
 Spotify ;en
 the album   Blood  Sleepy Brown  Itunes. ;en
Play twenties on Groove Shark;en
I want to hear music from 1975;en
  by Susumu Hirasawa. ;en
 Dick Marx ;en
Play a rock track from 1984;en
I want to hear a top-20 chant from the twenties;en
  on the  Electronic Gaming ;en
Play Elastic Love by Junior Marvin;en
Play music from the album Evolution Of A Man by Joey Ramone;en
 some amber kuo  the   Spotify. ;en
 1990 tunes   Shark ;en
 I hear a   ep? ;en
Play me a twenties tune on Deezer;en
Play some 1993 concerto off of Slacker;en
 the   Tupac Shakur ;en
Play Richard Fortus' Live Collection.;en
  Is: Animal Collective  ;en
I want to hear a 1957 theme song;en
 Angela Winbush  that  popular ;en
Play the song vodka by Kunal Ganjawala on Itunes;en
Play Socialism Is Good by terje bakken on Spotify.;en
 music  the sixties ;en
 songs  Wise ;en
listen to Pmd symphony;en
I want to hear the  The   Bust   haruka shimotsuki    ;en
 Apbl98  Alden Penner. ;en
 some sixties  netflix ;en
I want toi hear some Pop Punk Perfection  off of Deezer;en
 music  Lastfm  Deezer. ;en
 Regulate…g Funk Era   Iouri Bachmet   shark ;en
Play the next ep by Video Game Pianist on netflix;en
  the greatest Doctor Fink song   ;en
Play Spotify;en
   Louis Nelson Delisle. ;en
 music  2014 ;en
play some eighties by Amirbai Karnataki;en
 dhafer youssef top-twenty   ;en
  a  song  Joseph Genaro ;en
Play Tenerife Sea by Daniel Salomon on Lastfm;en
Play some music from 1993 on Itunes.;en
Play a melody from the nineties on Google Music;en
Play Still Life 1 ;en
 a seventies ballad  Annunzio Paolo Mantovani    ;en
 you  some    road trip album ;en
 jazz  by Zvooq ;en
I want to hear      Mc Ren   Music. ;en
I want to hear   The    ;en
 a   Syreeta Wright  twenties  the  ;en
Please play me something by New Wave Of American Heavy Metal;en
 a 1964   Netflix. ;en
 Always  Punk. ;en
  eighties track ;en
Play chant from Freddy Fender on iheart;en
 25 To   Paul Riley  Deezer. ;en
Open    Nanana  Massimo Altomare ;en
 sound track   the twenties ;en
I'm   the last   Fei Yu Ching  the  ;en
 a   Marina Verenikina ;en
Play a 1978 track on Slacker;en
 a 1950   Iheart ;en
Play me the dinner playlist;en
Play some Glenn Stetson music on Spotify;en
I want to hear    Peyroux    Youtube. ;en
Can you play something from 1966 by Mc Ren on Spotify;en
play Christina Milian latest music;en
 laura love   1959 ;en
 a   2000  Bronislau Kaper ;en
play chant music by David Cook;en
 No  Sorrow ;en
  Tu  Ebi Hamedi ;en
Play satire;en
  tunes  Bunny Berigan ;en
 twenties  Groove Shark ;en
Start playing something off Spotify;en
I'd  to hear   ;en
  by Odd Nosdam ;en
play Robert Stoddard from 1988;en
 The     Vans Warped Tour Compilation 2003 ;en
Play Party Through The Decades on Deezer;en
 Vivian Stanshall  1962 ;en
 anything  1970 ;en
Plkay some sixties  songs   ;en
Please  some   1996 ;en
Play music by Fidel Nadal sorted by newest.;en
Play the top five songs from Robert Lockwood Junior.;en
 a   Andrew Findon ;en
 Robert Stoddard  1988 ;en
Play music from Tommy Ridgley.;en
play melody and sort the newest in Dj Format;en
 Justin Broadrick's   Slacker. ;en
play a top-twenty tune by Noor Jehan;en
play some Bertine Zetlitz record;en
 some good   2012. ;en
Let me listen to The Music Of Nature album by Paul Draper.;en
Play some music on Lastfm.;en
Let me use netflix to listen to the last soundtrack from Out Of Eden.;en
 that new   1970 ;en
Play music by Otis Redding.;en
Play 2003 Ben Burnley on Spotify;en
Play the best music from Klaus Badelt.;en
Sort to the      1983 a   Mark Oliver Everett ;en
 Darude ;en
play Wait Until Tomorrow;en
 playlist funtime ;en
 a   symphony of 2010 ;en
Please play something on Last Fm;en
 some   2011 on lastfm ;en
 the last   Behzad Mirkhani. ;en
 start  some  theme music. ;en
 the  Shine A  ;en
Play me a song from 1976 by Bennie Moten;en
play the most popular Miles Jones track;en
 the   melody  Gus G ;en
Play a song from 1950;en
play a top Ryuichi Kawamura chant on Groove Shark;en
 a song  1990  Netflix ;en
 some  Stookey  the sixties ;en
Play a top track by Janamanchi Seshadri Sarma;en
 melody  sort the   Dj Format ;en
  Culpa  Rahim Shah ;en
  on youtube ;en
Play some Jungle music on iheart;en
  The  Lagoon   Kurstin ;en
Open Itunes   Heath   1981 ;en
 some fifties   Origa. ;en
Play the best songs of 2016;en
  Fink  i could choose ;en
play music by Bryan Maclean;en
 some  Eliza Carthy ;en
 a 2001  ;en
Use Groove Shark to play Krizz Kaliko;en
play Are & Be;en
play 1960 chant music by Hermann Baumann;en
Open Itunes and play Heath music from 1981;en
play the top twenty movement songs from Roberto Valverde;en
I want     music. ;en
  by Christian Bautista ;en
play a good John Maher record with Netflix;en
Open pandora and play the top five melody by Hanna Sjedokowa;en
 The Cherry-tree   Edwin Mccain ;en
Play Clásicos del Hip Hop Español;en
 the  funtime activity ;en
Play music on Spotify.;en
 the   Philip Oakey    Netflix ;en
 1958  on Iheart ;en
 Inside The   twinkie clark ;en
play songs by Sammy Fain;en
I want to hear a top-50    Eguchi    ;en
Play Elliot Easton's album Beautiful;en
 some Rui  Silva. ;en
Play an album from 1987.;en
play Pandora tunes from the fourties;en
I want to hear  Falomir's     ;en
 my entertaining  ;en
 some   the twenties. ;en
 Tad Kinchla  ;en
Play some chant music by Kevin Jonas on deezer.;en
Play the most popular song by espen lind;en
 music  the seventies ;en
Play some Maynard James Keenan songs from Scenes From The Big Chair;en
 some eighties  music ;en
  Women  Rock playlist. ;en
Please play Every Woman In Me;en
Open Groove Shark and play sound track from Dj Cameo;en
 some noise   Netflix. ;en
Start up my Independent Music Monday playlist.;en
play Hanging Out and Relaxing;en
Play Someday Soon by fiona;en
  the best Charles Neidich  ;en
  a song  Steve Hackett  Manuel ;en
Play me Hier Encore by greydon square;en
Play new Teo Macero;en
Play music from Clark Kent in the year 1987;en
play symphony music from the fourties with google music;en
play a top-fifty 1965 album by Ski;en
 a 2011    Jared Hasselhoff  Lastfm. ;en
Play me some music on Deezer;en
 a  melody  Lindsay Lohan  Youtube. ;en
  hear the    the artist, Skin. ;en
play some twenties music on Iheart;en
Play Deezer;en
 the  2016   Boaz Mauda. ;en
  to  to retro ;en
 the album   Barker  the greatest  1978 ;en
 a   Owen Pallett  the seventies  Slacker. ;en
play any sixties song;en
  music  Sheryfa Luna ;en
Play some chant music from 2008.;en
Open Deezer    40 hits ;en
 Pacific Ocean   John Doe  Lastfm ;en
 the  introspective ;en
I'd  to hear      Kerr. ;en
Play songs by Naomi Schemer;en
Use Groove Shark to    the  ;en
 you  a Sammy Fain  ;en
Please play This Is The Day by Brian Robertson.;en
 you   chant  the fourties? ;en
  Raices Y Antenas   &  Llp. ;en
Play the latest ep by Joel Hastings on Itunes.;en
 Sunshine Reggae  youtube ;en
 some  & Bass ;en
Play the song Waar Is De Zon on Slacker;en
 the  Joan Baez. ;en
Open Vimeo and play Lee Mellor good songs;en
 Piano Ballads  Netflix ;en
Turn   to Tiny Tim  ;en
Play a song from my workout playlist on Groove Shark;en
 a concerto   sort  Lloyd. ;en
Use Vimeo to play a Mark King record from 1993;en
Play me Sun Ra songs from the fifties;en
Play some music from the thirties.;en
  Real Talk ;en
  track  the fifties ;en
 The Cross  The Crucible  Angela Au  Sze    ;en
  a top-ten   Phil Ochs  Groove Shark ;en
 Courting The Squall   ;en
Play Humour;en
Play playlist riveting ;en
 the  I  Ideas  performed  Richard Kruspe ;en
I want to hear that track from 1991;en
 Eternally  Marko Desantis  zvooq. ;en
Play some Eddie Vinson on Deezer;en
Play the song Le Renouveau;en
 a   Busta Rhymes ;en
Open google    Women of Jazz  ;en
play a new song from the seventies;en
 the latest  Aoyama ;en
 While The   Open. ;en
I want to hear Dave Seaman's ep;en
 always  walter parazaider. ;en
Play Crazy=genius by The Alchemist;en
 the best   Arthur Johnston. ;en
I want to hear Major Harris's songs from the fifties;en
play soem nineties Charles Thompson;en
  Trapeo playlist. ;en
 album  Maureen Mcgovern ;en
play a 2006 chant;en
Play Adrian Borland's music on Zvooq.;en
 some  music. ;en
Play some sister rosetta tharpe songs from the eighties;en
 any track  Flame ;en
I'd  to hear Nas's   ;en
 pop  with  Shark ;en
  the greatest track  1966 ;en
Use Google  to  a  ;en
   the artist Irma Pane ;en
Play me a song from 2008;en
 Deezer   tunes  Jona Bechtolt  a ballad ;en
play deezer top 20 by Natasja;en
 music  the thirties. ;en
Open  Shark   native us ;en
Play Chantal Kreviazuk, Sister Ray;en
play Vimeo 2009 by Desmond Dekker;en
Open Youtube and play Iron Mountain Depot from John Lomax;en
 Signe Anderson chant    newest ;en
Plays some akb48 on Youtube;en
 tune  Sonny Stitt ;en
 fifties  songs  Fabio  Last Fm ;en
 a   Space Mandino. ;en
Play some music from 1989 by Sanjeev Abhyankar.;en
Play some fourties music on Spotify.;en
Play Is This My World? by Leo Arnaud;en
Play a soundtrack from 1954.;en
 a ballad  Heath ;en
play scott la rock from Stella on Slacker;en
Play me a twenties song;en
 the   twenties record  Leland Sklar ;en
  Barchetta  Blind Lemon Jefferson. ;en
I'd  to hear   Eric Clapton's   melody  Pandora. ;en
  a   Teitur Lassen  Groove Shark ;en
 Rain  Subliminal  Groove Shark ;en
 me   Whip with Zvooq ;en
I want to hear some songs from the twenties;en
Please play me Jerry Lee Lewis's If You Say So track.;en
 shining   Tsukiko Amano  pandora. ;en
Play me the most popular Lillian Hardin song on Itunes;en
Use service Vimeo to    the  Mick   We  5 ;en
  Stairway  Janove Ottesen ;en
Play the newest music by Gladys Knight;en
 the top-10   Caetano Veloso  Pandora ;en
Use Youtube to play music from Dorothy Ashby from the year 2002;en
Play a Paolo Gregoletto song;en
Play my Top Gaming Tracks.;en
I would like to hear a song by Tim Reynolds;en
  Sun Ra   the fifties ;en
I want to play music off Deezer;en
Play some eighties movement music;en
Play a popular song by Willie Dixon on Groove Shark;en
I want to listen to Lastfm, play A Drop Of The Hard Stuff by Joi Chua.;en
I want to hear   Bell    ;en
I want to hear something by Joe Dolce on Google Music;en
Play music on itunes from artist Jessica Delfino;en
    Kaori Utatsuki off the album  has top-twenty  ;en
Play 2006 chant music.;en
Play Tomorrow;en
 some  Qbert. ;en
play a Keith Richards album;en
 music  1964. ;en
  by Shinji Miyazaki ;en
Play music from 1964.;en
Play Henrie Mutuku album from 1957;en
Play music by Damien Rice;en
 songs  the sixties ;en
Play Noche de chicas playlist;en
play music on netflix;en
  Teo Macero ;en
 you   a track  the nineties? ;en
Play playlist funtime;en
 some sixties   gaudi  last fm ;en
play them by Guy-manuel De Homem-christo;en
I want to hear any tune from the twenties;en
play chant on groove shark from 1996;en
 1958  wayne petti ;en
Ply  1973 sound  ;en
Play some music on Pandora;en
 you  a song  the   George Martin ;en
Play a 2009 concerto on Deezer.;en
Play some Armik from the fourties;en
Use Deezer to play music;en
play my Madrugando playlist on Groove Shark;en
Play Yuauea by Rick Ross;en
 the  10  Sankha Chatterjee. ;en
Use the service Zvooq to play top-10 by artist Coolio;en
Play some theme based music from the thirties.;en
  a tune  Mick Brown ;en
   Got the Blues playlist. ;en
 a  ballad  Amanda ;en
 my melodious  ;en
 the  popular Coti   Pandora ;en
 Punk Essentials  Zvooq ;en
 a symphony that    2000 ;en
   Antonella Barba  the album Bath ;en
play Wolves by Larry Gatlin;en
 new   Liang Wern Fook ;en
 a 1977 record  Bitty Mclean    ;en
Play some seventies music on Netflix.;en
play Piano Ballads on Netflix;en
play the top nineties melody by Gus G;en
Play some music on Vimeo;en
I want to hear theme songs from zeebra from the sixties on Slacker;en
Play some music by Mutlu;en
Play some Glenn Miller.;en
Play me some Terror music;en
 Rob Dougan  youtube ;en
I'm looking for the last track by Fei Yu Ching from the fourties;en
I want  hear some   ;en
play Chance Of A Lifetime on Zvooq;en
 some Sabah  the  ;en
 some   on Zvooq ;en
 some   Miss Platnum ;en
 theme   the twenties  Tata Young ;en
  hear the   The Ghetto   Beau Jocque. ;en
Play some amber kuo from the eighties on Spotify.;en
  Christian Gangsta Rap ;en
Play Michael Angelo Batio;en
 some  music. ;en
I'd like to hear music from 1951, preferably a soundtrack.;en
Play Spotify;en
Play 2011 music ;en
   Under  Hurricane Chris ;en
   off the soundtrack  Beau Jocque ;en
play music form the fourties with Slacker;en
 me something  Funtwo ;en
Play Giovanni Battista Guadagnini's 1982 tracks.;en
Play some music from the twenties.;en
 the  Victim  Changes  Hawkshaw Hawkins  Spotify ;en
 the   songs  Isaac Hayes ;en
  something  the thirties  Candi Staton  Vimeo ;en
Play a seventies soundtrack by steve walsh on Groove Shark;en
  by Vybz Kartel ;en
Play music from 2000 on spotify;en
play a tune by Syreeta Wright from twenties from the top;en
play the greatest 1972 album by Wes Dakus;en
 hear some booty  ;en
play a movement from top-20 1983 by Baruch Chait;en
 Stevan Faddy   Music. ;en
Play a record from 2005 by Ruslana Lyschytschko.;en
I wish to enjoy some fifties music by Johnny Paycheck.;en
 fifties music ;en
 a new   the seventies ;en
 a   Mike Jones ;en
 robin   the bishop  hereford  Jon Mayer ;en
Play some Drum & Bass;en
Play the new music from Wilko Johnson;en
Play some Joeri Basjmet.;en
 some  music. ;en
   the year 1979 ;en
 Dave Joyal ;en
Use  to    Kimberley Walsh ;en
 A  Rainstorm playlist. ;en
Play me the greatest Doctor Fink song on zvooq;en
 sixties  Spotify ;en
Play Magic Sam from the thirties;en
Play Harel Skaat;en
 James Moody  ;en
 music  my relentless  ;en
can you play some weird music from the noise genre;en
Can I hear a movement by rookantha gunathilake on the Vimeo service?;en
 Lastfm  Steampunk ;en
 some fast fusion   ;en
I want to hear   Frankenstein  Queens    ;en
 a   Mila Islam  Deezer ;en
play a top-10 ballad from 1995;en
play some Spotify by Danni Bassan;en
Play the last soundtrack from the sixties;en
Play some John Oates on Youtube.;en
play Escapada;en
 the greatest  Win Stracke   Shark. ;en
I want to hear    &  ;en
Play the track Fight On, State by Yuvan Shankar Raja;en
  Bitch  Ii ;en
 music  1954 ;en
Play some twenties chant music on Slacker;en
Play Crucifixion on Deezer.;en
Play a 1983 ballad on Groove Shark.;en
 some new age  ;en
Play me a song by Linn Berggren from Spotify;en
Play Verjamem track by Hong Junyang.;en
play Techno music;en
I want to hear the     ;en
 the  hits  2016 ;en
 me a 1957  ;en
Play the top five melody from 2000;en
 Odessa  Maartin Allcock. ;en
 Tonight Only!   Kamenskih ;en
play Matt Walker tunes;en
 music  1958 ;en
listen to ballad songs from the twenties;en
Play the last Jonny Wickersham song;en
 a   Shada Hassoun ;en
Play the playlist spring;en
 Roland Alphonso tunes    popular ;en
  by Paul Mccartney ;en
Play some techno on Lastfm;en
 Alone, Again   Viola ;en
 a  tune  louis silvers. ;en
 the  Si   Hubiera Conocido  Haidar Salim ;en
play a chant by Marina Verenikina;en
Can you play me some Pop-folk music;en
 any song  2001 ;en
 Crossroad Blues. ;en
Play Nick Hexum latest album;en
 some Techno ;en
Play some Christian Rock;en
  a song  Ahmad Jamal ;en
   1968 on Vimeo. ;en
Play the track Pocahontas John Farnham;en
Want to   Schollin  ;en
 the  popular   marcel khalife  Netflix ;en
 Stereo   Davis on Deezer. ;en
Open Deezer and play Inyección Musical;en
Play any music on Spotify;en
play 1981 tunes by Jiles Perry Richardson on Lastfm for theme music;en
Play some songs from 1958;en
   2010 by Jason Donovan ;en
 the   On,   Yuvan Shankar Raja ;en
  Good Reason  Tommy Flanagan  Itunes ;en
 the newest chant  John Doyle   ;en
Play me a sound track by Bert Mccracken on zvooq;en
I want to hear the top Tim Madison;en
 sweet shanghai   Teddy Diaz. ;en
  by blowfly  the seventies ;en
 some chant  1974 ;en
Play music by Keren Woodward;en
   the album Evolution  A   Joey Ramone ;en
I'd  to hear   Iheart ;en
Play the last sound track by Soko from around 1975;en
Please play Got The Time;en
Play me a song from the fourties movement;en
Play classic rock on Groove Shark;en
Play Ciribiribin by Sandeep Khare;en
