expression;language
I want  hear a    ;en
 some  Andrew Lloyd Webber   Shark ;en
Play Pacific Ocean Blues by John Doe on Lastfm;en
Play some Psychedelic Rock.;en
 some  on spotify ;en
Play music from 1954;en
  A Mis Niños de  ;en
 something  the twenties ;en
 a   Jonny Buckland symphony   1989 ;en
Play Eddie Meduza from the thirties;en
Play thirties symphony music from Nigga on Iheart;en
Play Donna Summer;en
Play some music by Jody Williams from 2001;en
Play the thirties soundtrack by ghader abdollahzadeh on Youtube;en
Play some seventies track from top Rie Tomosaka;en
Play the track Siberian Khatru on zvooq;en
I want to hear something from the top-fifty by Jose Pasillas;en
   mina caputo on Lastfm ;en
Start   Disney playlist. ;en
 a chant  Sonsee ;en
 chant  Freddy Fender  iheart ;en
 a   Fats Waller ;en
Play a top symphony from the fourties;en
I want to hear some twenties music from Billy Sheehan;en
Play music by blowfly from the seventies;en
Please use pandora to play a record from 1993;en
Play any song from Rebecca Hewitt;en
Play Making Out by Alexander Rosenbaum off Google Music.;en
  a 1958 adam yauch concerto    ;en
listen to ballad songs from 1999;en
Play some Rui Da Silva.;en
 music  2011. ;en
Open     sound track  Dj Cameo ;en
Play a Herbie Fields record from the sixties;en
 me some   1999 ;en
 Punk Rock  ;en
Play Donald Rubinstein on Pandora;en
play The Necromancer;en
play the top-twenty tune by Masaharu Fukuyama on Slacker;en
play theme by Yanni on Vimeo;en
I want to hear Dido     ;en
Can you play Crossover?;en
Play music from jeremy taylor on the album Dormi Amore, La Situazione Non È Buona on Groove Shark;en
Play music year 2016 by artist Michiru Yamane;en
Play the best sort by Jan Robbe on pandora;en
 the  gangsta?  Siavash Ghomayshi ;en
play the Música Da Série De Filmes O Hobbit album by Alex Otaola;en
use  to    Moya Brennan ;en
 Moris Tepper ;en
I   hear some  Roches ;en
Can you play me a track from the nineties?;en
Play chant music by pappu venugopala rao on Slacker.;en
 I  to   the  Listening genre? ;en
 the top-5 songs  Paddy Reilly   ;en
Open google music and play Women of Jazz playlist;en
I want to hear the      Riabko ;en
 the   movement songs  Roberto Valverde ;en
play a top 50  tune from the twenties by Willi Williams;en
Please  good   Will Oldham. ;en
Please play Kabhi Jo Baadal Barse by Ruth Lorenzo;en
play anything from the twenties;en
I want to hear Sebastian's   the    ;en
 some Kansas  Mccoy ;en
   a popular track  1984. ;en
 some Last Fm   the 1992   Peaches ;en
 Hughie   Vidyadhar Vyas ;en
play pandora;en
Play Out From Under from Hurricane Chris;en
I need to hear some r&b music off of iheart;en
Play a top-50 tune from 1982.;en
I'd like to hear a track by Theo Keating.;en
   2010 tune  Dave Grohl ;en
  a Xuefei Yang symphony   Shark ;en
play Takes Place In Your Work Space by Eddie Kendricks;en
 the    Christian Fennesz wrote ;en
  off the  Child Maurice ;en
Play Night Electric Night on Iheart;en
I want to the     Losco ;en
I want to hear that tune from 2010;en
 the  The Wizard  I ;en
 a ballad  2014  Double  Google  ;en
 the last   the   Airto Moreira ;en
Use Last Fm to play artist Kawabata Makoto from their record;en
 something  1971  John Bonham ;en
Play music on the playlist Urban Hits;en
Start up my Pachangueo Total playlist. ;en
play Pop 2017 Picks;en
play a tune from 2000 by Bronislau Kaper;en
Play the good sort of 1992 theme music by Layzie Bone;en
 me some  youtube ;en
Play music from 2012 on Netflix.;en
Play Yung Joc on slacker;en
 chant  groove shark  1996 ;en
Can you play me some britpop music;en
play Lastfm tunes from 1997;en
Play a new symphony by Perfecto De Castro on Lastfm;en
Play the music Hands Up;en
   the  Get Your Mind Right ;en
play some music from the thirties;en
Play That Stubborn Kinda Fellow by Michael Amott;en
Please play playlist TODO REGGAETON;en
 melody   the thirties ;en
Play Who Knows Where The Time Goes? by Grigory Leps;en
 Oj, Jelena, Jelena,  Zelena   Lalonde. ;en
 some  Cleveland. ;en
Play Songs Of Heaven by ami koshimizu;en
 the greatest   Jesse Harms. ;en
play Lily, Rosemary And The Jack Of Hearts by Chris Goss;en
 drum & bass  ;en
 the   songs  Gad Elbaz ;en
 you  something off  Kids Workout    Shark ;en
   2005 by Justin Broadrick ;en
 a  song. ;en
 any  on Spotify ;en
play an album on Netflix by chris castle from 2011;en
 you  something  1966  Mc Ren  Spotify ;en
Play an album from the fourties;en
Do you have something like Impossible Is Nothing by Abderrahmane Abdelli?;en
Let's hear some tunes from the thirties.;en
 Steven Reineke greatest   Youtube ;en
I want to hear a Silvia Night ep from the sixties;en
 Elliot Easton's  Beautiful ;en
I want to hear a    Yamamoto   ;en
Play my 88 Keys playlist.;en
   Ryan Malcolm  Sympathy  The Devil  Pandora ;en
I want to hear     Festival  ;en
 something  1981 ;en
 Leanne Dobinson  To  ;en
Play something off Google Music;en
   itunes  artist Jessica Delfino ;en
 some gangsta  ;en
  a song  the sixties ;en
  a tune  john clayton ;en
 a song  1994. ;en
 some dance   Shark ;en
Play Julie Driscoll;en
 The Tyranny    Willy Mason. ;en
play the music track of 1998;en
Can you play the greatest songs by Mauro Picotto;en
Create a  station   Creeggan   collabs ;en
  holopainen's The  Project. ;en
Play a chant from 1978.;en
Play me some seventies music with a good melody;en
 Tujiko Noriko's Ten   Running. ;en
Turn on Spotify to Tiny Tim ep;en
play robin hood and the bishop of hereford by Jon Mayer;en
Listen to   1975 ;en
Use the service Itunes to play melody from 1998;en
Play some 1987 Edie Brickell.;en
 a  chant  Brian Epstein ;en
Play slow rock music on Vimeo;en
play a concerto that was most popular in 1958 by mickey hart;en
play music by Helen Ward;en
Play me a seventies ep;en
I want  hear some    ;en
 Piano 100 ;en
 some thirties   Netflix. ;en
  Kahn's Rushall Station. ;en
Play the greatest Ricky Bell music;en
I want to hear    ;en
 a   Chick Corea ;en
Play a Scott Lafaro soundtrack;en
Put on Vimeo and play Kacapi Suling;en
Play blues on Vimeo;en
 fifties  Sirusho Harutyunyan ;en
 a symphony  Bob Hardy  ;en
I wanna hear something on Spotify by Eddie Vinson;en
 easy listening ;en
use Spotify to play Nina Persson from 1962;en
Play music from 1999;en
 top-50 Peter Frampton  ;en
play Paula Campbell music from 1993;en
 melody   the fourties. ;en
 Anweshaa  the  first. ;en
Can you play Maggie Mae on Netflix;en
Could you play the album B Men Gahō by Nathaniel Shilkret;en
Please play me a popular track from 1984.;en
Play some music by Frayser Boy.;en
play 2007 tunes by Bunny Berigan;en
Play music by Country Dick Montana.;en
 Divine  Vinnie Roslin ;en
 Deezer ;en
  a  sound track ;en
Please use Itunes to play something from 1986;en
I want to hear    ;en
play some grunge;en
 ballad  Mandy Moore ;en
play fourties tunes;en
 the  popular   espen lind ;en
Play Praise The Lord And Pass The Ammunition.;en
 twenties chant  Lagaylia Frazier   ;en
 Skin & Bone  Jess Stacy   ;en
 a Ladyhawke  ;en
 Netflix ballad  Mike Shinoda   popular ;en
I want to hear something from the nineties by Alissa Musto on Groove Shark;en
 a   Juanes  Last Fm ;en
I want to listen to Speed Metal Symphony;en
play The New Timer by Augustus Pablo with Itunes;en
Play all music Alan released in 1997;en
Play music from 2010 by Jason Donovan;en
 some  music. ;en
Play Iheart;en
  a   Hank Thompson  Moa Anbessa ;en
Play some thirties music on Netflix.;en
open Fadl Shaker on Spotify and play a melody starting with the newest;en
 Adieu  Al Arsenault ;en
Play me a song by Teitur Lassen on Groove Shark;en
Play music on Iheart;en
play music by Christian Bautista;en
 some chanson  music. ;en
Play a track by Titiyo;en
Plya a   Kancherla Gopanna  1951   ;en
    the twenties on Itunes. ;en
Play music from Lastfm and Deezer.;en
Play me a song from the fourties;en
play Andy White;en
 some   Dj Spinna ;en
Use  to  Who Was    Last Night? ;en
I want  hear a     Cottura. ;en
 a  Ryuichi Kawamura chant   Shark ;en
 some   Karl Blau. ;en
play This Is Colour by Panda Bear;en
 some  Oates  Youtube. ;en
Play something by Louis Nelson Delisle.;en
 my Éxitos España  ;en
 I hear a    gunathilake  the  service? ;en
 the newest released   1951 ;en
 the   the  Get Lit ;en
Please play anything by george formby jr;en
 some songs  the   yoshiki fukuyama ;en
  funtime  on lastfm . ;en
play fifties movement songs by Fabio on Last Fm;en
Play record from the seventies;en
 Midnight Special ;en
Play Talking To The Universe on Itunes;en
Play the most popular 1956 record.;en
 my Trabajo Relax  ;en
Play music from 1989 by Maya.;en
play Itunes  songs by Gerard Way;en
Play a tune by Mc Hawking;en
Play the top-10 chant by Caetano Veloso on Pandora;en
Play some nineties Eliza Carthy;en
 Bitch  Ii  Julee Cruise  Iheart ;en
 some  on Itunes ;en
 a song  1973. ;en
Play me some music from 1999;en
Play A Sudden Rainstorm playlist.;en
play ray davies on Iheart by only Hit It Again;en
Play the Instrumental Study on Vimeo.;en
Play music off Itunes.;en
Play my funtime playlist on lastfm .;en
Play music from 2011.;en
I want to hear Ready by Frankenstein Drag Queens From Planet 13;en
 Chance Of A Lifetime   ;en
   something  New Wave  American Heavy Metal ;en
Can you play Under The Anheuser Bush by Pete Doherty;en
Play opera music on google music;en
play Tom Jones album from the twenties;en
Use Google Music to play some songs by Dr John;en
play playlist A Mis Niños de 30;en
Play music from Youtube.;en
Play my springtime playlist.;en
 some Armik  the  ;en
 the best   Henry Rollins. ;en
  a   1972  Sweet Emma Barrett ;en
Play a 2007 track from Adam Jones;en
  off Youtube. ;en
play Khujo eighties track song;en
Play Gary Chapman music from the fifties;en
Play the last 1954 ep by Povel Ramel.;en
 a    beth nielsen chapman,  first. ;en
 robert fripp sound   Pandora ;en
Play me the track Mama Liked The Roses;en
 some   Amirbai Karnataki ;en
 I hear Anna Vissi's    Pandora? ;en
Open Lastfm and play a voluntad del cielo from Wax;en
  on pandora ;en
Play Soldier Boy from Melody Gardot;en
 thirties symphony   Nigga  Iheart ;en
 a 2001 sound   Deezer. ;en
  on Spotify. ;en
Play some rock music on Youtube;en
Open    Iron Mountain Depot   Lomax ;en
Play the most popular Coti songs on Pandora;en
I     some  music. ;en
 theme  Yanni  Vimeo ;en
Can you play a Sammy Fain ep;en
I want to hear the   to  Macgregor     ;en
Can i use Lastfm to listen to Twilight Time by Dj Khalil?;en
 you  Maggie Mae  Netflix ;en
Play the album Have Another Ball;en
Proceed with   2003. ;en
  A Word  La India ;en
play some Kansas Joe Mccoy;en
I want to hear  Nawaz,     annie. ;en
  anything  george formby jr ;en
 some acapella  ;en
Please  some   on Spotify ;en
 a   deeyah khan. ;en
Play me a popular song by Koichi Domoto;en
Play Shinji Miyazaki's music on netflix;en
 the newest  Exuma ;en
Play a track by Yui on Vimeo;en
play Darude;en
I want to hear some acid punk music;en
I'd  to hear Infinite    Slacker. ;en
play Soheila Zaland;en
  Mellow Beats  please ;en
I  to hear some    ;en
play a music ballad from the sixties;en
 all  Alan released  1997 ;en
 the  Gypsy Swing ;en
 White Noise. ;en
   Paulinho Da Viola  1965 ;en
 something  Holly Cole  lastfm ;en
Play Larry Graham sound track;en
Play some Geir Jenssen.;en
Play music by Janet Paschal;en
 Strength  Street Knowledge   Shark ;en
I'd  to hear chant    ;en
 I  to merengue  music? ;en
play the album Winner Takes All by Takuro with Last Fm;en
Play the top 10 by Sankha Chatterjee.;en
 satire music ;en
 Clay Aiken's The Bonny    Shark. ;en
play Lastfm by Steampunk;en
Play 1958 music;en
play something from 1981;en
Play sixties music by giovanni battista guadagnini.;en
  stu davis  the   Chamber 3  Netflix ;en
Can I hear a song by David Hodges?;en
 eighties music ;en
 some   the thirties. ;en
Play Shinehead's music from the twenties on Slacker.;en
play a seventies ballad by Annunzio Paolo Mantovani on Groove Shark;en
 some   1985  Rolf Harris ;en
play Roland Alphonso tunes that are most popular;en
 a  theme  Greg Pattillo ;en
 some   on vimeo ;en
  Way Ticket  Ray Kennedy. ;en
Play breathtaking music;en
Can you play some music by andrew diamond;en
play music from 1950;en
Play me a song on Pandora;en
Play theme music from 2011.;en
Play Rob Mills album The Golden Archipelago.;en
 a native    Last Fm ;en
 the last Rocko  with  ;en
Play the greatest from Win Stracke on Groove Shark.;en
Play music by Antonella Barba from the album Bath;en
play a top twenty symphony of 2010;en
 some acapella   Iheart ;en
 paul riley  Youtube ;en
Play music from 1958.;en
play songs by Sarah Harding;en
Play me something on Last Fm;en
 some  Tremonti  the thirties. ;en
 scott la   Stella  Slacker ;en
Play a popular Gurdas Maan track;en
Play my Femme Fatale playlist on Vimeo;en
turn on Google Music to play 1991;en
Start up my nostalgic playlist. ;en
Play some Katiejane Garside on Vimeo.;en
 the  Winner Takes   Takuro  Last Fm ;en
Use the service  to  melody   ;en
  Palacios Quispe ;en
 Fereydoun Farrokhzad best  ;en
I want to  to  Daltrey  the    ;en
  Rosanne Cash ;en
I want to hear    Rebecca Cartwright    ;en
 concerto  the eighties ;en
 some   the sixties ;en
 Jeff Pilson  Youtube ;en
 eighties ;en
  a 2003   Charles Neidich ;en
Play the newest melody by Cisco Adler on pandora;en
 Lastfm  start  whatever ;en
Listen to music from 1975;en
play music from the year 1979;en
 a Samira Said   the  ;en
Play me track September, Gouden Roos by artist daedelus;en
Can you play some Andrew Cash music on Slacker;en
Play the top fifty record from Alan Jardine;en
  a  20 chant  Ruwanga Samath  Lastfm ;en
 a   avery storm. ;en
Create a theme station with Jim Creeggan records and collabs ;en
Use Pandora to play music from Maki Onaga from the album made in the nineties;en
I want to hear a    stat    ;en
Play my Sophisticated Dinner playlist on Slacker;en
 a concerto  the  ;en
 theme music  2011. ;en
 me a song  the  ;en
I want to hear     app ;en
in Google Music play the top singles released in 1972;en
 Takes   Your  Space  Eddie Kendricks ;en
Use Deezer to play the last song from Lee Dorrian;en
Play music by Sarah Connor;en
play the album Everybody Happy by Lee Aaron;en
Play my entertaining playlist;en
turn   Fm ;en
 some  Anderson. ;en
 the energic  ;en
 I hear a    Vysotski? ;en
Play a symphony from Bob Hardy please;en
Open youtube;en
play 1977 good track tunes;en
  Harris's song. ;en
 tribal ;en
 a   Maher record  Netflix ;en
  by Bonobo ;en
Play Justin Broadrick's music on Slacker.;en
Play 1952 Yusef Lateef on Netflix;en
Play the most popular chant song by Hossein Alizadeh from around 2009;en
Play some Paulinho Da Viola from 1965.;en
Play music on Itunes;en
Play The Cross And The Crucible by Angela Au Man Sze on Google Music;en
Play Adieu by Al Arsenault;en
Play a 1950 album on Iheart;en
 music  1960 ;en
play good music by General Woo on Deezer;en
I want to hear sia furler's      ;en
 chant   Big Dee Irwin. ;en
play the greatest Adrian Kowanek music;en
  to  free  Madeleine Peyroux ;en
Play some bass music.;en
I want to hear   Joe Dolce    ;en
Please open pandora   ;en
I wish to listen to some instrumental music.;en
 Are &  ;en
play music on Netflix;en
   2000 on spotify ;en
 something  the jonathon lee  ;en
Play some seventies music on netflix.;en
 instrumental pop ;en
Play Anweshaa by the new first.;en
Play thirties on Lastfm;en
Play Annet Artani soundtrack on Slacker;en
play Deezer tunes Are & Be;en
  use Pandora to  a   1999  David Sitek? ;en
Play my playlist springtime;en
Please play Bitch Please Ii;en
Open   paly every  released  1986 ;en
 Paula Campbell   1993 ;en
listen to acapella;en
 classic   Groove Shark ;en
 the   Suns  The Sunset  Airi Suzuki ;en
use Iheart radio to play eighties music from Hugh Masekela.;en
Can you play some music from my road trip album;en
play the It Could Only Happen With You album by Lawrence;en
Play music from the sixties;en
play a ballad from 2000;en
 Innovations  Kokia ;en
play a good 1952 symphony;en
play some Mike Porcaro;en
Play music from the artist Taktloss from the record in the thirties;en
open Spotify   a couple  celtic  ;en
 Chantal Kreviazuk, Sister  ;en
Play some Carmen Mcrae from Ed Robertson off of Itunes;en
   the top-5   Kenia Arias ;en
play Joey Fatone soundtrack tunes from Google Music from 1972;en
Play Alles Heeft Ritme by Liu Tianhua.;en
  some Black Metal  ;en
play Isaac Yamma Slut;en
play Latin Dinner;en
I want to hear a     ;en
Play the song Two Suns In The Sunset by Airi Suzuki;en
 you  a  5   Manos Hadjidakis ;en
Play some Avantgarde music on Netflix.;en
play Say A Word by La India;en
Play gothic music;en
Play some music from Miss Platnum;en
I want to hear a track by Ryohei Yamamoto on Vimeo;en
play something from 1971 by John Bonham;en
I want to listen to Roger Daltrey from the sixties on slacker;en
 the  chant  1975 ;en
   Country Dick Montana. ;en
 Kisaki  Pandora ;en
Play Sound Of Love from Papa Mali;en
 some   1962  Adeyto ;en
 Goldie Hill's record   Music. ;en
Play track Real Talk;en
Play my Mellow Beats playlist please;en
Play the newest released song from 1951;en
Play slow rock music;en
Play some music from 2011 on lastfm ;en
Play a popular ballad by Amanda;en
 Yuauea  Rick Ross ;en
Play Inside The Eye by twinkie clark;en
Play Midnight Special;en
  a song  Stephen Jones ;en
 some  using slacker ;en
 the  a kiss before    Bt ;en
 sugar   frank beard ;en
 you pull up   something  Itunes ;en
Play an Andy Silvester sound track from the thirties on Spotify;en
Please play an album from 1987;en
Play Divine from Vinnie Roslin;en
play James Moody ballad;en
Play a record from 2010.;en
 you  Deezer  2007? ;en
I want to hear a top five ballad from 2002;en
 1993 theme  ;en
 the top-twenty   Masaharu Fukuyama  Slacker ;en
Open Youtube and play Connie Francis Sings Spanish And Latin American Favorites from Yukiko Iwai;en
 a    Janamanchi Seshadri Sarma ;en
Open Lastfm and play Hot Lips Page from the sixties;en
play music by Amii Stewart with Itunes;en
play Going Down To The River on Pandora;en
Play good Pure Soul on netflix ;en
 March  The Soviet Tankmen   Gaither ;en
  the last 1980 record   Kahn ;en
Play a 1974 sound track on Vimeo.;en
I'd like to hear some trip-hop;en
Play always by walter parazaider.;en
Play The Lamentation Of Cloris;en
 some  & roll  Deezer. ;en
Play some space music on Google Music;en
Play a fifties album on Itunes.;en
 a ballad  2000 ;en
 the  Ricky Bell  ;en
Play the album Making Evening And Night by Cevin Key ;en
 you pull   Jueves de Antaño  ;en
I want to hear Gloryhole from Mani off of Lastfm;en
 a tune  1973 ;en
use Spotify to play greatest songs from Kailash Kher;en
 primus ;en
Open Groove Shark and play native us;en
 the  songs  Jes Brieden ;en
   the seventies for me. ;en
Play some Robbie Merrill.;en
   the track  Friend  Google   Steve Sholes ;en
play drive playlist;en
 Isaac Yamma  ;en
Play Dj Scratch's eighties music on Iheart.;en
Play me the last 1980 record by Brenda Kahn;en
Play some Google Music.;en
 ecstatic ;en
Play music from 1968 on Vimeo.;en
 songs  Youtube ;en
Play some music on Lastfm;en
 Jono El Grande  the  ;en
 Matt Walker  ;en
 the   sessions  chris cunningham ;en
Play some contemporary christian on Groove Shark.;en
Play some Tony Grant.;en
Play my Under The Surface playlist.;en
 music  2015 ;en
Play genre opera;en
 Russell Morris's The   The   Netflix. ;en
Play music by Young Steff;en
Please  a   Rupam Islam ;en
Open  ;en
 the  Qr Iii   bare ;en
 symphony   the  with google  ;en
I want to hear music by Madeleine Peyroux from 1991 on Youtube.;en
 some  on Vimeo. ;en
 Lastfm to  Attack  The  Smashers ;en
Play me some music by Prince Alla from the twenties;en
Play a movement from the nineties;en
 some 2011   Dan Healy. ;en
  a twenties song ;en
 a melody  the  on Google  ;en
 Annet Artani   Slacker ;en
 some contemporary christian   Shark. ;en
play some Classical music on Spotify;en
Play music from 2012 by Yossif Kobzon on last fm.;en
play Vivian Stanshall from 1962;en
Use netflix to play a record by Emil Gilels from year 2015;en
play Kurt Cobain ballad tunes;en
Play a Mike Osborne song;en
Play the top caleigh peters.;en
Play a fairouz tune on Deezer;en
Play something by Holly Cole on lastfm ;en
open Fadl Shaker  Spotify   a melody   the  ;en
Play my Hot 50 playlist.;en
use  to   Camino a Clase  ;en
 a Jim Mullen   the  ;en
Play got to be free by Madeleine Peyroux;en
Play rie fu music sorted by the best.;en
Play Ramakadha by Karl Davydov please;en
 1981   Last Fm ;en
Play top Martin Solveig on deezer;en
  a song  Movies  The Blind  Pandora ;en
 a sound   Mac Dre. ;en
Please play some music from 1996;en
I want to hear music from carman from the 1966 album;en
Play a top five Linda Strawberry ep;en
 the   Patrol  lauryn hill ;en
I want to hear La Jaula De Oro by Mc Ren on Google Music.;en
I want to  to the    to the     iheart ;en
Please play some Bill Evans music.;en
Give me an album from 1972 to listen to.;en
 Llegando a Casa  ;en
I want to listen to Swing music on Iheart;en
Play the album alas y raíces by Dave Pybus.;en
Use the service Lastfm to play artist keren peles from the most popular symphony;en
Play the most popular sound track from the 2006;en
 the top-twenty margaret becker   google  ;en
Play some Matthew Sweet music from around 1996 on Spotify;en
Play a sixties track by Noam Pikelny on iheart.;en
use Slacker to listen to seventies music;en
Play music from the seventies;en
 a    the aj carothers  Zvooq. ;en
 music  2016. ;en
play top-twenty song from 2015;en
 some  Da Viola  1965. ;en
 the    Amon Amarth  Groove Shark ;en
PLpay the     Asia Nitollano  spotify. ;en
I want to  to some  Atsumi  the    ;en
Play some Sam Moore.;en
Play me a tune by Mick Brown;en
Play me a 2015 soundtrack on Netflix;en
   Jerry  Lewis's If  Say So track. ;en
 the  record  Joe Purdy  Google  ;en
Open  Lastfm   some songs. ;en
Play a top-five song by Pete Candoli.;en
Play twenties symphony from Robert Walter;en
I want to hear a     ;en
 the  melody  Cisco Adler  pandora ;en
Play the album Axum;en
play falco on Zvooq for Good Hit;en
Play the top 20 ep from the fifties by John Bundrick.;en
Play Miami 2017 by Rodney Whitaker;en
  tribute  Billy Cox ;en
 Barry Manilow  the  ;en
Play pop;en
    Nadal sorted  newest. ;en
 the   melody  1997  Itunes ;en
 the 1951  ;en
Use Spotify to   ;en
 a Scott Lafaro  ;en
Play music on Last Fm;en
   Armand Van Helden ;en
Play the top Maynard James Keenan.;en
 the   Rap Over Hard   Food ;en
Play the newest 2016 ep from Boaz Mauda.;en
Play the greatest melody from Paul Wright on Pandora;en
Play me a song from 2016;en
 you  Crossover? ;en
play Groove Shark folk-rock;en
play a track from the thirties;en
I want to hear something from Post-punk Revival;en
Play me the newest fourties symphony;en
Play music by Daddy Yankee;en
 some  based   the thirties. ;en
 a   Nash The Slash ;en
play Long Way To Go by Keita Tachibana;en
Play some music from 1962 from Adeyto;en
I want to  to some       them ;en
Play some music from 1985 by Rolf Harris;en
 a twenties   Jodie Aysha. ;en
  Crash Course playlist. ;en
 some Avantgarde   Netflix. ;en
play music by Cass Elliot;en
Could   the  B Men Gahō   Shilkret ;en
 some steve boyett   ;en
 some Annie Herring beat    ;en
Play Junun by Noam Kaniel.;en
Play music from the punk genre on Last Fm.;en
 a record  the  ;en
Plya a tune by Kancherla Gopanna from 1951 on Zvooq;en
 the best   Klaus Badelt. ;en
Play Pledge by Markus Grosskopf;en
 Chris Goss  Netflix ;en
 Ciribiribin  Sandeep Khare ;en
Play me music from the twenties on Itunes.;en
Play the top-5 sort of ballad music from 2012.;en
 songs  Cheryl Wheeler ;en
  on Deezer. ;en
I want hear some Junior Murvin off of Youtube;en
 a top-five   Pete Candoli. ;en
   Your Toys  Chris Ledoux ;en
 something  grandmaster flash & the furious    ;en
 twenties symphony   Walter ;en
 the  Niney The Observer  ;en
Lets hear some Dawood Sarkhosh   The   Your      ;en
  some Hank Shermann  1975  Lastfm ;en
 the  caleigh peters. ;en
 the heinz strobl   2016   Shark ;en
Play my Piano Ballads playlist.;en
 Techno music ;en
Play Shinya Yamada music from 1962 on Groove Shark ;en
 the  titled Faget ;en
Play some music on Itunes;en
 some    Perez Prado on Iheart ;en
Listen to Power Gaming playlist;en
I'd like to hear songs from Iheart;en
 Used To  Her  Dara. ;en
 Geddy Lee  on Spotify sort   ;en
Play some music on Slacker;en
 some caribou  the  ;en
 Long  To   Keita Tachibana ;en
Play the newest twenties melody.;en
   Sha Money Xl   good. ;en
play some Nastya Kamenskih on Zvooq;en
Can you play Halloween by Ajinoam Nini;en
I want to hear De Eerste Keer from Paul Caiafa  off of Google Music;en
 the  Pocahontas  Farnham ;en
Play Post Garage Wave Revival playlist.;en
 some seventies   Netflix. ;en
 the  Hunter  off  Last Fm ;en
I want to hear Song For Adam;en
I want to hear      the twenties. ;en
Play the album Shooting Silvio by Dave Sabo;en
I   hear a   melody. ;en
Play Noctámbulo pl;en
play Slacker tunes;en
Play Wynton Kelly music on Netflix sort by popular;en
 a  sound   Joe Pass  Itunes. ;en
 Acid  music. ;en
 the newest   the sixties ;en
I want to hear a      Jay ;en
Play my 70s Smash Hits playlist.;en
Play the Mother Lode by Tamio Okuda;en
