expression;language
I want to hear Sebastian's songs from the thirties on Youtube;en
 the latest   Lobby Loyde  Netflix ;en
 Randy Castillo's   1952. ;en
 some sixties   Slacker. ;en
 any chanson ;en
Play me the new King Curtis music on Google Music.;en
Play the last song by Goldie;en
 some dream  ;en
Play a 2014 theme from Greg Pattillo;en
Play music from the top-5 from artist Kenia Arias;en
Find a top fifty zahir howaida concerto from the seventies;en
Play the latest music by Martin Luther Mccoy;en
  playlist, Hardstyle, Baby. ;en
 some melody  the   Spotify ;en
 some  on Lastfm. ;en
Play Supernaut by Armand Van Helden;en
I  to hear a   ;en
Can you play a song off an album by Shirley Horn;en
play Zvooq Night Rider list;en
 the latest melody  Cliff Edwards   ;en
 a  5 song  Wally Bastian  Google  ;en
 the  Feel  Dinner. ;en
  Hot 50 playlist. ;en
 some tango. ;en
I want  hear   Post-punk  ;en
Can you   some Pop-folk  ;en
 Kaori Mochida's  popular   Google Music. ;en
 the   songs  Robert Lockwood Junior. ;en
 the  Jonny Wickersham  ;en
Play music on Lastfm;en
 Peja tunes ;en
 Iheart ;en
 songs  Queen ;en
 Shinya Yamada   1962  Groove Shark ;en
Use Groove Shark to    the  ;en
Play Grabsteinland I by Doctor Fink on slacker radio;en
 Frankie Laine ;en
I'd like to hear the last song fro Willa Ford.;en
Can I listen to merengue style music?;en
Play 1958 by wayne petti;en
Play any chanson;en
  on Iheart ;en
 some   Victor Kunonga. ;en
Play the song gangsta? by Siavash Ghomayshi;en
 Socialism  Good  terje bakken  Spotify. ;en
  GOES THE 80s. ;en
Play the greatest ballad from the seventies;en
Play my Women of Rock playlist.;en
 the top-twenty   Calder  Slacker. ;en
 some  rock. ;en
Open pandora and play udhreko choli from Chowdiah;en
Play music in the genre soundtrack;en
  by Raheem Devaughn. ;en
play Slacker tunes by Smog from movement in 2015;en
 the   tracks  Ron Jarzombek ;en
play music by Rodney Whitaker;en
 some fun-punk ;en
I need to hear some music from Spotify;en
 Julie Driscoll ;en
Play Listen To The Mocking Bird by Billy Martin on Youtube;en
 Monie  tunes  Google   1984  her  list ;en
 some  on Netflix ;en
Will you play a ballad from Mahalaxmi Iyer;en
Play shadowplay by Dana on Deezer.;en
Open Netflix and play Kan Man Gifta Sig I Jeans?;en
Play Classical X;en
I  to  to  symphony    lu bing. ;en
  on Deezer  Imogen Heap ;en
Play Acid Punk music.;en
i wanna  to a the top-twenty   Denniz    ;en
 falco  Zvooq  Good Hit ;en
 chant   David Cook ;en
listen to    1999 ;en
Play Brian Clifton off Groove Shark.;en
Play some 1999 symphony from Minami Takahashi;en
Play some Ray Williams music from the nineties on spotify;en
play some movement by Dj Spinna;en
 Hardcore music ;en
I want to hear Techno-industrial music.;en
  Got The Time ;en
Play an Asha Bhosle song from around 1964;en
Play my Frescura Indie playlist ;en
  The   Pass The Ammunition. ;en
 some Glenn Stetson   Spotify ;en
Play me a Mario Vazquez movement;en
 the  spring ;en
 The  Timer  Augustus Pablo with  ;en
Play a melody by Colin Blunstone;en
Play the top-twenty from Alexander Braginsky.;en
 a Keith Richards  ;en
Open Pandora and play music from the fifties. ;en
 some  bryan gregory  ;en
 a   Alasdair Roberts  1996 ;en
I'd like to hear chant songs from nineties;en
   The Bridge  Hariprasad Chaurasia. ;en
 a twenties concerto  Roger Taylor   ;en
Play christian gangsta rap;en
Play music using Last Fm;en
Play a song off Get Up Offa That Thing by Doseone on Last Fm;en
I want to hear Jimmy James from the thirties, play a song on Groove Shark.;en
play pop music with Groove Shark;en
 the top-20  Macneil  ;en
Play me some Max Martin on Lastfm;en
I want to hear some music from Groove Shark;en
 music  1950 ;en
 Wanted  Erykah Badu ;en
 a cohesive   me ;en
  Masaki Aiba tune ;en
Play some Techno;en
Play a concerto from the nineties;en
Play me a 1974 tune on Slacker;en
 The   Juju Mob  Vimeo. ;en
Play Barbra Streisand music from 1997.;en
Please play some fourties music on Spotify;en
  a song  2016 ;en
 Hasan Saltik  2004 ;en
I'd  to  to Diana Vickers    the  ;en
I'd like to play the top ten Mickdeth on Google Music;en
play To Be Still;en
  Angelo Batio ;en
 you  a  off  album  Shirley Horn ;en
Play me a 2003 song by Charles Neidich;en
 Richard Fortus'  Collection. ;en
 The God  Failed  Vimeo. ;en
play some Deezer oldies music;en
 some House  ;en
Play me a song from 1968 on Spotify;en
play Mohammed Abdu from top 20;en
Play a song off the Nicht Sprechen album;en
play Who Do You Think You Are by Magnifico with spotify;en
I want to hear some theme music by Edsel Dope;en
play newest soundtrack from 2008;en
 some   1959 on deezer. ;en
Play Marche Lorraine by Rachael Lampa;en
Play Greg Raposo songs from the thirties;en
play a sound track by Vegard Sverre Tveitan;en
play the last track by Shavo Odadjian;en
play a 1999 track by Pete Seeger on Youtube;en
 the  Martin Solveig sound  ;en
I want to hear a top-50 track from Takahito Eguchi on Google Music;en
Play some 1962 theme music.;en
Use  to   Ringo Shiina   Heaven ;en
Play me a song by Michael Diamond;en
Play the music of Tupac Shakur;en
Use Netflix to   ;en
I want to  to a     Bazan ;en
 a track  1959. ;en
Play any track by Flame;en
 some Rockwell   1996 ;en
Play Sense Tu from Ebi Hamedi;en
 some  Grant. ;en
  by Billy Powell ;en
  on the  Urban Hits ;en
 some seventies   netflix. ;en
Play Dawn Richard song White Summer;en
 Dj Subroc  Itunes ;en
 music  Gavin Koppell  ;en
 the   Would  Something  Eden Ahbez ;en
I want to  to Swing    ;en
 Listen To The Mocking Bird  Billy    ;en
   The Surface playlist. ;en
  have something  Impossible  Nothing  Abderrahmane Abdelli? ;en
  Electric   Iheart ;en
 some Stephen Jones   ;en
 some   the fifties ;en
Play fourties record;en
 a 2004   eliel  Zvooq. ;en
Play movement music from 1954;en
play some papoose from 2003 on youtube;en
Play Suite Sudarmoricaine by Afi on itunes;en
  70s Smash  playlist. ;en
Play a song off Ian Stuart Donaldson's Nature Nurture album on Itunes;en
Play some Antony Harding songs from the eighties;en
Play the theme tune that Christian Fennesz wrote;en
Play a twenties track by the aj carothers on Zvooq.;en
play an eighties track ;en
 chant music  1993 ;en
I want to hear a track from the fourties.;en
Please play a song by Everlast;en
Play some art punk.;en
Can you play an ep by Tatjana Iwanowna Bulanowa;en
  Lodge  Alkabli   . ;en
Play Kisaki on Pandora;en
Play concerto from the eighties;en
Play the top fifty soundtrack from the twenties.;en
Play the most popular sort by ep by Brooke Fraser;en
Play the album Killer Instinkt;en
Play something by grandmaster flash & the furious five on youtube;en
I want to hear symphony songs from Rebecca Cartwright on Last Fm;en
 some   Last Fm ;en
 Greg Raposo   the thirties ;en
 Noche de chicas  ;en
 some   beverley martyn ;en
   some weird   the noise genre ;en
 me an   2005. ;en
Play Dj Subroc on Itunes;en
Please  some    on Netflix ;en
Play symphony by Josh Gracin on Slacker.;en
I want to hear some sixties  melody from Mark Mcentee off of Google Music;en
 Deezer tunes  &  ;en
Play the top song by Jack Grisham;en
Play the top-5 songs from Paddy Reilly on zvooq;en
Open    Last Fm. ;en
play The Trail Of The Lonesome Pine on Netflix;en
 The New Retro   Netflix. ;en
Play some thrash metal.;en
 Women  Jazz ;en
play a tune by Margaret Kelly on Iheart;en
 the theme   1963  Yuki Koyanagi ;en
 the  Chaw album ;en
Find me music by Kaori Utatsuki off the album that has top-twenty hits;en
Play the top 1991 sound track;en
Play my Fusion Fest playlist on Youtube;en
I  to hear the  Aspro Mavro   Szymczyk   ;en
Play Dave Joyal;en
   False Gestures  A Devious Public  ;en
Play a concerto by Thekra.;en
 a movement  1974. ;en
 some  Africana. ;en
Play a top fifty track from the twenties;en
Open    Connie  Sings Spanish    Favorites  Yukiko Iwai ;en
 a theme  1985   Cowley ;en
 some 1993  off  Slacker ;en
 the top-20  Chicane   Deezer ;en
play a new soundtrack by Benjamin Darvill on Groove Shark;en
 Realization  Randy Jackson ;en
Play some 50 Shades of Love;en
 Lukasz Gottwald album   ;en
Sort to the last song on playlist from 1983 a chant by Mark Oliver Everett;en
 Latin Dinner ;en
 something off  Radio ;en
Play a 2001 sound track on Deezer.;en
Play Dj Cameo on itunes.;en
 a  fromthe   Nobuo Uematsu. ;en
Play the top-five ballad sort from 2004;en
Play a 1958 soundtrack by Rudolf Schenker on Netflix.;en
Play me a song from Luxury Liner;en
 Donald Rubinstein  Pandora ;en
Play some 1954 songs on my Itunes.;en
 an album  1987. ;en
Open The Second Adventure album by Hans Nilsson;en
Play album from Maureen Mcgovern;en
Please   a   theme song ;en
open Deezer and search for Scott Miller and play some of his new songs;en
Play some good music from 2012.;en
 a   symphony  Bumble Bee Slim ;en
Play sweet shanghai devil by Teddy Diaz.;en
I  some Hardcore   ;en
 the  Could Only Happen With    Lawrence ;en
Play top Rosanne Cash;en
 music  2007. ;en
 a   the seventies  Pepe Aguilar ;en
Play a melody from Elmer Bernstein;en
Let me hear the Rave Tapes album from Yuki Koyanagi.;en
Play the most popular soundtrack by Elena Paparizou on youtube;en
Play me some music youtube;en
Play some seventies songs from Luke Haines off of youtube;en
Play Moris Tepper;en
play My Back Pages by Paul Young on vimeo ;en
 Verjamem   Hong Junyang. ;en
 a record  2015 ;en
Play a tune from Space Mandino.;en
 some Sonu Niigaam  the  ;en
Play Leanne Dobinson Right To Dream;en
Play the playlist Grime Shutdown;en
  on Itunes ;en
  Top Gaming Tracks. ;en
Play music from Paul Landers;en
Please play music off the soundtrack by Beau Jocque;en
Play the most popular Grace Slick song that has a symphony sound;en
 The   Allah  Wade Mainer ;en
play a record from 1982;en
play Innovations by Kokia;en
play I Could Write A Book;en
  the newest   Evil Jared Hasselhoff ;en
use Lastfm to play Attack Of The Planet Smashers;en
 some tune  2011  Youtube ;en
  a song  Michael Diamond ;en
 some 1959   Iheart ;en
Play some symphonic rock.;en
Play top-twenty fourties movement music by Mohammad Reza Lotfi.;en
play latest George Ducas music;en
 Hanging Out  Relaxing ;en
play the album Wayning Moments by Rabbit Brown;en
Play Llegando a Casa playlist;en
 Seasons  The   Rosco Gordon  iheart ;en
Play some fourties music on Zvooq;en
  Kabhi Jo Baadal Barse  Ruth  ;en
I'd   hear   1951,  a soundtrack. ;en
 some  music. ;en
   the  Taktloss  the record  the  ;en
Can you play me something from the eighties on Youtube;en
Play 2004 Guy Sebastian on Itunes;en
I want to hear a      ;en
Play a top five Jonny Buckland symphony from around 1989;en
Play me some folklore music;en
 some  rock. ;en
 Punk Essentials  google  ;en
Play a record from 2015;en
play the track The Wizard And I;en
  a song  2008 ;en
open Deezer    Scott Miller   some  his   ;en
Play Regulate…g Funk Era by artist Iouri Bachmet on groove shark;en
play a Samira Said ballad from the nineties;en
Play music which has humour on Youtube.;en
play 1970 trunes;en
 Barbra Streisand   1997. ;en
 1951 tunes ;en
 some  selling rave  ;en
Please play the most popular ep from 1998 by Mc Frontalot ;en
  Gil Parris's A Cup  Coffee, A    ;en
Play eighties music by Kaira Kwong on Google Music;en
Play Elitsa Todorova music;en
Play some theme songs from the fourties;en
 twenties  off of  Itunes ;en
Play music on the playlist Electronic Gaming;en
Play some music from 1958 on Deezer.;en
 some Sia Furler   Fm ;en
Open Deezer and play top 40 hits;en
 Clásicos del   Español ;en
Play music from 1960;en
 Halid 08   game pianist  Pandora ;en
 sixties theme  ;en
Play any song from the eighties;en
Play Salmonella Dub Dvd by mario rubalcaba on Vimeo ;en
play a sixties song by George Sanger;en
 the  1972   Wes Dakus ;en
Play some good movement music by Brian Littrell from around 2001;en
 the thirties   ghader abdollahzadeh  Youtube ;en
 Eve ;en
turn  Google  to  1991 ;en
 the  jazz record  1951 ;en
 some Jungle   iheart ;en
 some Alte Kameraden  ;en
play anything from 1970;en
Play sound track  music from the twenties;en
 music  artist Ashley ;en
   the greatest sarah brightman  ;en
 a soundtrack  1954. ;en
Play me a song by Stephen Jones;en
Play music on Deezer by Imogen Heap;en
   1969 on lastfm . ;en
 a   sam sparro ;en
 These  Walls  Yummy Bingham. ;en
 A   Desire  Dan Snaith ;en
Play Intense Studying playlist on Itunes.;en
play Monie Love tunes on Google Music from 1984 from her song list;en
Play me a seventies song;en
  to  a   the year 1954 ;en
play the last chant from the fourties;en
 Party Anthems ;en
 Elysium  Ryan Cayabyab ;en
I want to hear some Boris Grebenchtchikov on Zvooq;en
 some sixties  ;en
 the last Chris Douglas   ;en
play Heavy Machinery by Phil Spector on Zvooq;en
 the  Study  Vimeo. ;en
play Calico Skies by John Feinstein with Netflix;en
I want to hear some of David Gilmour's music from 1973;en
Play a chant from the fifties;en
play Abhijeet Bhattacharya from 1986;en
 Noctámbulo pl ;en
   1976 on Deezer ;en
Play Cherry Pink by Trapp Mendoza on Iheart;en
Play concerto from 1951;en
 David Banner  Netflix ;en
Will you   Nuestros 80  ;en
play an eighties song by Ler Lalonde;en
Does Netflix have music released in 1991 by You Yokoyama;en
Play Party Anthems;en
  by Charlie Adams  1954 ;en
Play Shaina Magdayao's music on Iheart;en
Play some chanson style music.;en
   2012 on google  ;en
Open my music playlist on Youtube;en
 iheart ;en
Play music by Paul Mccartney;en
    Kan  Gifta Sig I Jeans? ;en
Play the playlist Gypsy Swing;en
 the  Asleep  The Deep ;en
  the greatest   Laurel Aitken  lastfm ;en
 the    – The Believer. ;en
play Robin Trower Unravel;en
 Cherry Pink  Trapp Mendoza   ;en
play some dream music;en
 anything  the top-50 Jeff Irwin record    ;en
play journey list;en
play the newest Martin Solveig sound track;en
 the  Maynard  Keenan. ;en
 Bra Vibrationer  Dean ;en
  by Rodney Whitaker ;en
I want to hear a full album on youtube by Jem Godfrey;en
Play White Noise.;en
 Gary Chapman   the fifties ;en
play Realization by Randy Jackson;en
 the top  melody  2000 ;en
Play a song from 2003;en
 Miyavi's   seventies  Google Music. ;en
Play some gothic rock.;en
 the   sort    Brooke Fraser ;en
Please   TODO REGGAETON ;en
 the    Damon Albarn using Slacker ;en
play Piano 100;en
  New  Mix  Google Music. ;en
Please  some   the seventies  ;en
Play Dave Wyndorf album;en
 symphony  Josh Gracin  Slacker. ;en
Play the top 5 by Akira The Don.;en
 songs  Sarah Harding ;en
I want toi hear some   Perfection    ;en
play some fourties Andrew Lloyd Webber on Groove Shark;en
 a song  1950 ;en
 a  symphony sort  1959   Garrard. ;en
 eighties track ;en
Play music by mina caputo on Lastfm;en
  Baxter tracks ;en
I want to hear Box Of Rain by Skeets Mcdonald;en
  kentaro  the year 1994 ;en
Play some nineties music on Pandora;en
"play Bill Evans album The Best Of The 12"" Mixes";en
 Glenn Yarbrough  ;en
  Heeft Ritme  Liu Tianhua. ;en
Play shining down by Tsukiko Amano on pandora.;en
Play something from my Songs For You, Not Your Parents playlist;en
 a   2005  Ruslana Lyschytschko. ;en
 Vic Ruggiero   2007 ;en
Play me a Patrick Cowley ballad;en
Play some 2011 chant music, new first, by Shaggy.;en
 Goa   Google Music. ;en
 Moustapha Amar Make   ;en
Play some jpop on Google Music.;en
 How   Work  Helen Carter. ;en
Can I hear tod ashley music from 1953?;en
  Chilled R&B ;en
 Robin  Rescuing  Squires  Bhupinder Singh ;en
 a top-fifty 1965   Ski ;en
Would you please play me a symphony from 1995;en
  Farm  Deana Carter. ;en
play the album by Paul Barker playing the greatest from 1978;en
 Bald  Kaskade. ;en
I need to hear the new Kevin Fowler album;en
  Down To The   Pandora ;en
 fifties  on Slacker. ;en
Play me an ep from 2005.;en
Play the concert from Philip Oakey 1973 concert on Netflix;en
Play a Jim Mullen ep from the sixties;en
Play some music from the thirties.;en
 Trace Adkins'   the thirties. ;en
play newest Robert Palmer sound track;en
Play One Way Ticket by Ray Kennedy.;en
 Pledge  Markus Grosskopf ;en
I want to hear Nokko's songs from the twenties;en
Play on spotify Ms Scandalous;en
Play a song from 1994.;en
 a record  1982 ;en
Play the top movement music from 1997.;en
I want to hear     the   ;en
Play Expresión from Mickey Finn;en
I want to hear a Sandra ep;en
 breathtaking music ;en
Play some music from Roberto Carlos;en
I want to hear secrets on parade from Tommy Walter;en
  on Netflix. ;en
Play the most popular track from Valery Alexandrovich Kipelov;en
Open Last Fm and play the top song from Daniel Lee Chee Hun;en
play Ngola Ritmos top-ten songs;en
play some Industrial music on Lastfm;en
Play The Cherry-tree Carol by Edwin Mccain;en
   Pachangueo Total playlist. ;en
Play the most popular twenties record from Leland Sklar;en
  year 2016   Michiru Yamane ;en
listen to tei movement from most popular eighties music;en
play Wanted by Erykah Badu;en
 pop ;en
Play me a popular Ronnie Wood soundtrack;en
 Donna Summer ;en
I want to hear      Gene Autry ;en
 Groove Shark ;en
Play me a tune by john clayton;en
 the  ballad  Chad Urmston ;en
 new   Mike Oldfield  Vimeo ;en
Play an ep by Uncle Jimmy Thompson;en
Play El Cant Dels Ocells by vini lopez.;en
Play cheerful playlist;en
I want to hear music from the sixties.;en
  off Youtube. ;en
Lets hear some 2009 music;en
 wendy james  the  ;en
Play eighties music;en
Play sixties on Spotify;en
Use Spotify to play me music;en
 Isaac Hayes  Pandora  love, sweat  beer  ;en
Play fifties music on Deezer;en
 me a song  Avispa   1965 ;en
Find Mahalakshmi Iyer music on Netflix;en
play my De Camino playlist;en
Play me a nineties sound track;en
Play some dance music.;en
listen to tei   most popular   ;en
Play me an eighties song by Wes Dakus;en
 concerto  1951 ;en
Play a nineties tune by Sugar Minott on Netflix;en
 Adrian Borland's   Zvooq. ;en
 some   1989  Sanjeev Abhyankar. ;en
Play a song by Nash The Slash;en
Play some Ven A Mi;en
 the  Grow Old     Chloe Rose Lattanzi ;en
Play the playlist funtime activity ;en
play some sixties music;en
Play Bald by Kaskade.;en
Play some Laurie Anderson.;en
play twenties music off of my Itunes;en
Play music from Art Porter Junior movie sound track using Vimeo;en
Use Google Music to play a song;en
 Gloria  last fm ;en
Play Kim Wilde by Mike Scott on Slacker;en
  gangsta rap ;en
 a track  Titiyo ;en
Play celtic music;en
 Yo Ho  the   pops  Youtube ;en
 Netflix to  Michael White   1955 ;en
Play a song from 1990 on Netflix;en
 you  fifties theme   Mohsen Chavoshi ;en
Play Stevan Faddy on Google Music.;en
 opera   google  ;en
play music from the twenties;en
I want to hear Vegetables by pharrell williams;en
I want to hear the     ;en
 Yung Joc  slacker ;en
play Clifford Brown All Stars by Michael Balzary;en
Play music from the seventies;en
  Steps To   Wikluh Sky ;en
Open Lastfm and start playing whatever;en
Can you pull up and play something on Itunes;en
Play a song off The Best Of Siouxsie & The Banshees by Faustino Oramas;en
I want  hear a    fourties. ;en
Play a twenties soundtrack on Youtube;en
 the album Sauna   ;en
 to hear a   Diplo  1952 ;en
 some  Edie Brickell. ;en
 a Herbie  record  the  ;en
Play Within You Without You by Distance on zvooq.;en
 a  1952 symphony ;en
Play me a concerto by Jethro Burns from Zvooq;en
Play the best music by Arthur Johnston.;en
Can you play an ep from the year 1958?;en
 the   Robin Redbreast ;en
Play the most popular song from Chae Yeon off of Spotify;en
play Sunshine Reggae on youtube;en
 Larry Graham sound  ;en
Wish to hear music from the year 1996;en
 the greatest  you can   Ari Herstand   ;en
Play Apbl98 by Alden Penner.;en
  Pandora app ;en
I'd  to  to iheart radio's    please. ;en
 anything   Chieko Ochi ;en
Play a track by Ishmon Bracey on Iheart.;en
Play chant music by Ira Losco on Iheart.;en
  eighties song  Ler Lalonde ;en
   1989 by Maya. ;en
Play something off my New Boots playlist;en
Play a song from the thirties on Zvooq;en
play some sad songs from the fifties;en
Play music on Netflix by Don Kikas;en
 the  Phil Stacey. ;en
Use Pandora to play Korean OSTs;en
I'm in the mood to listen to meditative music.;en
 some good    Brian Littrell  around 2001 ;en
play Isham Jones;en
 some  Merrill. ;en
Play music from the artist Joe Sample;en
I want to listen to Born On The Bayou on Iheart;en
 a popular   Willie Dixon   Shark ;en
 Dj Cameo  itunes. ;en
Play the playlist, A Mis Niños de 30.;en
Play the album Resurrection In Blood from Sleepy Brown on Itunes.;en
Can you play a top 5 song by Manos Hadjidakis;en
Play paul ortiz music from 1990;en
  Benjamin Kowalewicz's  hits ;en
Play music from the playlist Late Night Jazz;en
play chant from the nineties with Last Fm;en
Play Zvooq;en
I want to hear jon sholle's       ;en
 symphony   Joe Dolce ;en
Let's listen to the    Friedman   Zvooq. ;en
play Zvooq;en
 some  Antero Manninen  zvooq. ;en
 top-five concerto   1992 ;en
I need some ambient music. ;en
Play the latest ballad by September;en
Play Seaside by Don Cherry.;en
I   to hear   1993 ;en
Plkay some sixties movement songs from Itunes;en
Play Pease Porridge Hot by Johnny Vicious on Zvooq;en
Play a twenties concerto from Roger Taylor on deezer;en
 Niko  the fourties ;en
Play a tune or two from Kansas City, Missouri;en
play a ballad by Bob Johnston;en
   a ballad  Mahalaxmi Iyer ;en
play some Folk tunes;en
 some Christian  ;en
I  to enjoy some     Paycheck. ;en
Play Odessa by Maartin Allcock.;en
play the 2014 album from la lupe;en
Play a popular chant by Brian Epstein;en
Play the theme music from 1963 by Yuki Koyanagi;en
Play Pura Vida.;en
Play me a nineties ep;en
I want to listen to the album going back to the blue ridge mountains on iheart;en
Plan an album by Roni Duani.;en
Play Vic Ruggiero music from 2007;en
  Fm to   Kawabata Makoto  their record ;en
 top-50  theme  Alain Caron ;en
I want to hear some      ;en
Play funtime activity;en
 some  Miller. ;en
Can you play some Synthpop music on Youtube;en
 Shake  Head ;en
  Against The World  Glukoza ;en
PLay some fourties music from Erin Harkes;en
 a sixties   Noam Pikelny  iheart. ;en
Play me a fifties song;en
 the last 1957  ;en
Play This Is: Animal Collective please;en
play paul riley on Youtube;en
Open Zvooq and play the best songs from Device;en
 the   Alexander,   Boy  Ehsaan Noorani ;en
Play industrial music.;en
Play the most popular ep by marcel khalife on Netflix;en
 the   Karlsson melody  Youtube ;en
play a chant by Sonsee;en
 Liubi, Liubi, I    Farah Asyikin Binti Zulkifli   ;en
 the latest    Luther Mccoy ;en
 to Pmd  ;en
Play eighties music on Groove Shark.;en
Play me a nineties song by Joseph Genaro;en
 a ballad  1997. ;en
 Expresión  Mickey Finn ;en
Play hanging in the balance by Nik Kershaw on Zvooq.;en
  by Ian Haugland ;en
  by Keren Woodward ;en
I want to hear  Eerste Keer   Caiafa     ;en
 popular  record ;en
Play the music of Filipp Bedrossowitsch Kirkorow's theme;en
 The Necromancer ;en
Play a new song form the eighties;en
 the last   Goldie ;en
  Back Pages  Paul Young  vimeo ;en
 Crucifixion  Deezer. ;en
   & Sunday Mornings ;en
 Wolves  Larry Gatlin ;en
play Tom Baxter tracks;en
 music  Lastfm. ;en
Play music from 2005 by Justin Broadrick;en
Play music by Ian Haugland;en
 Foundling  Jean Grae  Vimeo. ;en
Play music from Lastfm.;en
Play a new tune by louis silvers.;en
play eighties track;en
Open    on Youtube ;en
  Classified songs  Vimeo ;en
Play tuomas holopainen's The 21 Project.;en
 the  fifty   the twenties. ;en
  Sam  the thirties ;en
play some Alte Kameraden music;en
 some Don Ho   ;en
Play me the greatest track of 1966;en
 The Way  Has To   Tom G Warrior   ;en
 a Paolo Gregoletto  ;en
  You Without You  Distance  zvooq. ;en
play zvooq Southern Gothic;en
Play Clay Aiken's The Bonny Hind on Groove Shark.;en
 Miami   Rodney Whitaker ;en
  a Mario Vazquez  ;en
 Kings  The  Frontier  Andrea Bocelli ;en
 2gether  Jade Puget ;en
Play the newest melody from Corey Clark on Lastfm;en
play the top-twenty margaret becker songs with google music;en
I want to hear    the  ;en
 a record  2010. ;en
I    Techno-industrial music. ;en
Play the song Little Robin Redbreast;en
 the  Le Renouveau ;en
Play the greatest music you can find by Ari Herstand on Zvooq;en
 Mahalakshmi Iyer   Netflix ;en
Play the symphony by Tetsuya Ogawa from 1953;en
 the  Long Live  ;en
Play the greatest 1966 album out there;en
Please  a song    1959 ;en
    Elmore James with google  ;en
play a 1994 tune by Lena Horne;en
Play some chanson music.;en
 some seventies   Luke Haines off   ;en
I want to hear the    The   ;en
Play me a song from the twenties by Randy Bachman;en
play satire music;en
Put  Vimeo   Kacapi Suling ;en
Play a melody by Shada Hassoun;en
Play some rock & roll by Deezer.;en
Play artist Vlada Divljan from something he did that is good;en
Play music by Susumu Hirasawa.;en
Can you play the latest faust soundtrack from 1967?;en
play dj kentaro from the year 1994;en
 Hora Din   Yamazaki Maso ;en
Play me Leonid Soybelman on Vimeo.;en
I'd  to hear  Airey's  Raise  ;en
Play a top song by Carson Parks on Groove Shark;en
I want to hear music off my Indie Festival playlist;en
Play some Rachel Stevens off of Itunes;en
Play a top-ten chant by Kelly Groucutt from 1964;en
 the Late Night    Zvooq. ;en
  on Groove Shark. ;en
 a song  zvooq ;en
